(22851, 3, '', 0, 'AQRZF', '9ddc6d5856956916bc0330c425e5ba2a', '2014-03-13', 'laurena0jlawn@yahoo.com', 0, '', '', '', '', '', '', '', 2, 0, 'New Member', 0, 1394748552, 0, 1394748552, 1394748552, 0, 0, 0, 0, 4, '5', 0, 0, 0, 0, 0, 3194967, '07-13-1984', '1984-07-13', -1, -1, '91.108.180.140', 0, 1, 0, 0, -1, 0, 0, '0|t{WSIz-F~KeUq,CmOD7I@P-Yk42T', 0, 0, 0, '', 0, 0, 0, 0, 0, 0, 0, 0, 0, 0, 0, 0, '', '', 0, '', 'vb', '', 0, 1, 0, 0, NULL),
(22793, 3, '', 0, 'CMerion', '412be49713fc749be07a7049398fee6b', '2014-03-12', 'cohntar@hotmail.com', 0, '', '', '', '', '', '', '', 2, 0, 'New Member', 0, 1394635936, 0, 1394635936, 1394635936, 0, 0, 0, 0, 4, '5', 0, 0, 0, 0, 0, 3194967, '11-05-1976', '1976-11-05', -1, -1, '198.143.143.229', 0, 1, 0, 0, -1, 0, 0, '"p0x@R?,r*9p#M|VM:2F''R/KAK!VX;', 0, 0, 0, '', 0, 0, 0, 0, 0, 0, 0, 0, 0, 0, 0, 0, '', '', 0, '', 'vb', '', 0, 1, 0, 0, NULL),
(23116, 3, '', 0, 'MColon', '4bbcb9a181352a360544513ff8a735b8', '2014-03-23', 'grouchymasquera4jg17@outlook.com', 0, '', '', '', '', '', '', '', 2, 0, 'New Member', 0, 1395542016, 0, 1395542016, 1395542016, 0, 0, 0, 0, 4, '5', 0, 0, 0, 0, 0, 3194967, '03-11-1979', '1979-03-11', -1, -1, '5.157.45.135', 0, 1, 0, 0, -1, 0, 0, 'RnVKFg7<KF8V}*5l*2?F$%xEk''=MF6', 0, 0, 0, '', 0, 0, 0, 0, 0, 0, 0, 0, 0, 0, 0, 0, '', '', 0, '', 'vb', '', 0, 1, 0, 0, NULL),
(22953, 2, '', 0, 'hammadkhan', '8fa8baf353fbada0384f60617f073ffa', '2014-03-16', 'hammadkhan154@gmail.com', 0, '', '', '', '', '', '', '', 2, 0, 'New Member', 0, 1394956446, 0, 1394958113, 1394958113, 0, 0, 0, 0, 4, '5', 0, 0, 0, 0, 0, 3194967, '02-06-1985', '1985-02-06', -1, -1, '39.32.232.11', 0, 1, 0, 0, -1, 0, 0, '8)`nc~b$KTm\\yZRy"XyFoi-rVUqiZX', 0, 0, 0, '', 0, 0, 0, 0, 0, 0, 0, 0, 0, 0, 0, 0, '', '', 0, '', 'vb', '', 0, 1, 0, 0, NULL),
(22779, 2, '', 0, 'Obaid.ali', '38f1233c76bd16510d8658b35d2ebb89', '2014-03-12', 'ch.usman.84@gmail.com', 0, '', '', '', '', '', '', '', 2, 0, 'New Member', 0, 1394605061, 0, 1394605061, 1394605278, 0, 0, 0, 0, 4, '4', 0, 0, 0, 0, 0, 3194903, '03-12-1984', '1984-03-12', -1, -1, '58.65.173.140', 0, 1, 0, 0, -1, 0, 0, ':!6s#2[9_ATR|,S0p\\[^tjf^pG!_uV', 0, 0, 0, '', 0, 0, 0, 0, 0, 0, 0, 0, 0, 0, 0, 0, '', '', 0, '', 'vb', '', 0, 1, 0, 0, NULL),
(23135, 3, '', 0, 'BlondellQ', '9cafb4dcda71bbfae43f61e1185ea274', '2014-03-24', 'blondell-basaldua78@crashdivas.net', 0, '', '', '', '', '', '', '', 2, 0, 'New Member', 0, 1395699000, 0, 1395699000, 1396134504, 0, 0, 0, 0, 4, '5', 0, 0, 0, 0, 0, 3194967, '02-19-1976', '1976-02-19', -1, -1, '192.3.182.12', 0, 1, 0, 0, -1, 0, 0, '6rm-*JmCUPRmLt#rDqKGF-:LL-}iPh', 0, 0, 0, '', 0, 0, 0, 0, 0, 0, 0, 0, 0, 0, 0, 0, '', '', 0, '', 'vb', '', 0, 1, 0, 0, NULL);
INSERT INTO `user` (`userid`, `usergroupid`, `membergroupids`, `displaygroupid`, `username`, `password`, `passworddate`, `email`, `styleid`, `parentemail`, `homepage`, `icq`, `aim`, `yahoo`, `msn`, `skype`, `showvbcode`, `showbirthday`, `usertitle`, `customtitle`, `joindate`, `daysprune`, `lastvisit`, `lastactivity`, `lastpost`, `lastpostid`, `posts`, `reputation`, `reputationlevelid`, `timezoneoffset`, `pmpopup`, `avatarid`, `avatarrevision`, `profilepicrevision`, `sigpicrevision`, `options`, `birthday`, `birthday_search`, `maxposts`, `startofweek`, `ipaddress`, `referrerid`, `languageid`, `emailstamp`, `threadedmode`, `autosubscribe`, `pmtotal`, `pmunread`, `salt`, `ipoints`, `infractions`, `warnings`, `infractiongroupids`, `infractiongroupid`, `adminoptions`, `profilevisits`, `friendcount`, `friendreqcount`, `vmunreadcount`, `vmmoderatedcount`, `socgroupinvitecount`, `socgroupreqcount`, `pcunreadcount`, `pcmoderatedcount`, `gmmoderatedcount`, `assetposthash`, `fbuserid`, `fbjoindate`, `fbname`, `logintype`, `fbaccesstoken`, `bloggroupreqcount`, `showblogcss`, `importuserid`, `newrepcount`, `panjo_selling`) VALUES
(22783, 2, '', 0, 'Pr0fessor007', '1a38ba507afa401d5cc6335462dad8aa', '2014-03-12', 'Haneefsaeed@hotmail.com', 0, '', '', '', '', '', '', '', 2, 0, 'New Member', 0, 1394612049, 0, 1401575621, 1403990061, 1397649875, 434481, 1, 0, 4, '5', 0, 0, 0, 0, 0, 3194967, '01-26-1981', '1981-01-26', -1, -1, '175.110.26.132', 0, 1, 0, 0, -1, 0, 0, 'MdRY6]''HOQ\\sudKIj7LM)SDbYv`/m~', 0, 0, 0, '', 0, 0, 1, 0, 0, 0, 0, 0, 0, 0, 0, 0, '', '', 0, '', 'vb', '', 0, 1, 0, 0, NULL),
(22905, 2, '', 0, 'atar9c', '00b7e0bbbc2f92ccd18bd71aa6898654', '2014-09-19', 'arshad_mukhtar2001@yahoo.com', 0, '', '', '', '', '', '', '', 2, 0, 'New Member', 0, 1394870460, 0, 1405463865, 1411130965, 0, 0, 0, 0, 4, '5', 0, 0, 0, 0, 0, 3194967, '11-09-1969', '1969-11-09', -1, -1, '39.47.45.188', 0, 1, 0, 0, -1, 0, 0, ':nBoj|b\\_z@)[61+-Tg?mB%{y51Ru|', 0, 0, 0, '', 0, 0, 0, 0, 0, 0, 0, 0, 0, 0, 0, 0, '8cb85e1195ae3fd852f15aef15c20558', '', 0, '', 'vb', '', 0, 1, 0, 0, NULL),
(22801, 2, '', 0, 'imran1122', '76f4fc353603d43136afea10aa03bea5', '2014-03-12', 'imrangillani@live.com', 0, '', '', '', '', '', '', '', 2, 0, 'New Member', 0, 1394647634, 0, 1394795573, 1394981671, 1394981608, 430531, 3, 0, 4, '5', 0, 0, 0, 0, 0, 3194967, '10-28-1987', '1987-10-28', -1, -1, '39.53.72.28', 0, 1, 0, 0, -1, 0, 0, ':TXu^R^V"D+m.U7:g_.:8HSk[kr''&S', 0, 0, 0, '', 0, 0, 0, 0, 0, 0, 0, 0, 0, 0, 0, 0, '', '', 0, '', 'vb', '', 0, 1, 0, 0, NULL),
(22898, 2, '', 0, 'shahnawaz.khan', '9057139d63bd58005a057e14cf0e39e2', '2014-03-15', 'khan.shanu@gmail.com', 0, '', '', '', '', '', '', '', 2, 0, 'New Member', 0, 1394853487, 0, 1394853487, 1394856112, 0, 0, 0, 0, 4, '5', 0, 0, 0, 0, 0, 3194967, '11-13-1981', '1981-11-13', -1, -1, '139.190.68.177', 0, 1, 0, 0, -1, 0, 0, '!w/eH3`=/^1;Sk-rZ)lj^o6dSG[b%`', 0, 0, 0, '', 0, 0, 1, 0, 0, 0, 0, 0, 0, 0, 0, 0, '', '', 0, '', 'vb', '', 0, 1, 0, 0, NULL),
(22866, 3, '', 0, 'bbobbylittey7954', '244623bbaa087c47a5f13c3c8c239015', '2014-03-14', 'bbobbylittey@ymail.com', 0, '', '', '', '', '', '', '', 2, 0, 'New Member', 0, 1394795318, 0, 1394795318, 1394795318, 0, 0, 0, 0, 4, '-3.5', 0, 0, 0, 0, 0, 3194903, '05-13-1977', '1977-05-13', -1, -1, '46.191.148.19', 0, 1, 0, 0, -1, 0, 0, 'oiU}2M%.hYy0|6Q4xJK+k#}E*2~j=s', 0, 0, 0, '', 0, 0, 0, 0, 0, 0, 0, 0, 0, 0, 0, 0, '', '', 0, '', 'vb', '', 0, 1, 0, 0, NULL),
(22845, 2, '', 0, 'mughal1977', '5c4fff039e0a55a6566f3e282c7c2d51', '2015-10-21', 'mughalskt1977@yahoo.com', 0, '', '', '', '', '', '', '', 2, 0, 'Rookie', 0, 1394737819, 0, 1413040205, 1413313447, 1408204689, 455000, 39, 0, 4, '5', 0, 0, 0, 0, 0, 3194967, '03-06-1977', '1977-03-06', -1, -1, '39.45.227.159', 0, 1, 0, 0, -1, 0, 0, '.*ij[6j+1xA$!*pi65spMJxH(h\\z>;', 0, 0, 0, '', 0, 0, 7, 4, 0, 0, 0, 0, 0, 0, 0, 0, '79153384a459a2a81e7a6733fa251948', '', 0, '', 'vb', '', 0, 1, 0, 0, NULL),
(23064, 2, '', 0, 'Snake_Charmer', '28a9865ef30986934bcdf34091b6791a', '2014-03-19', 'usmanchattha@icloud.com', 0, '', '', '', '', '', '', '', 2, 0, 'New Member', 0, 1395209780, 0, 1395209780, 1395210382, 0, 0, 0, 0, 4, '5', 0, 0, 0, 0, 0, 3194967, '03-13-1982', '1982-03-13', -1, -1, '203.124.41.126', 0, 1, 0, 0, -1, 0, 0, 'AT>R[/{k:P=Wiq6[3&&M"swH/6Ey19', 0, 0, 0, '', 0, 0, 2, 0, 0, 0, 0, 0, 0, 0, 0, 0, '', '', 0, '', 'vb', '', 0, 1, 0, 0, NULL),
(23029, 2, '', 0, 'satti00', '2312839d32e6fe9aba3231aeb25b59df', '2014-03-17', 'najamsatti@gmail.com', 0, '', '', '', '', '', '', '', 2, 0, 'New Member', 0, 1395095454, 0, 1395095454, 1395095572, 0, 0, 0, 0, 4, '5', 0, 0, 0, 0, 0, 3194967, '04-26-1988', '1988-04-26', -1, -1, '139.190.203.88', 0, 1, 0, 0, -1, 0, 0, 'zc9xAW`3(HJFYDcyLre"a,Q$^x_"D^', 0, 0, 0, '', 0, 0, 0, 0, 0, 0, 0, 0, 0, 0, 0, 0, '', '', 0, '', 'vb', '', 0, 1, 0, 0, NULL),
(22937, 3, '', 0, 'MMadden', 'a3a0cdc7b0d5afa5593fcbe5bd3e1451', '2014-03-15', 'jeziorskip@hotmail.com', 0, '', '', '', '', '', '', '', 2, 0, 'New Member', 0, 1394911325, 0, 1394911325, 1394935805, 0, 0, 0, 0, 4, '5', 0, 0, 0, 0, 0, 3194967, '11-22-1980', '1980-11-22', -1, -1, '69.12.80.135', 0, 1, 0, 0, -1, 0, 0, '@dVi]!#TNw^m>qm#LSLgeoDUm/GrA&', 0, 0, 0, '', 0, 0, 0, 0, 0, 0, 0, 0, 0, 0, 0, 0, '', '', 0, '', 'vb', '', 0, 1, 0, 0, NULL),
(22821, 3, '', 0, 'HMcCabe', 'cd74872a48b979f8a1f3b5a28c1e6601', '2014-03-13', 'wonderfulranch87ro11@outlook.com', 0, '', '', '', '', '', '', '', 2, 0, 'New Member', 0, 1394687523, 0, 1394687523, 1394687594, 0, 0, 0, 0, 4, '5', 0, 0, 0, 0, 0, 3194967, '10-10-1976', '1976-10-10', -1, -1, '192.3.183.192', 0, 1, 0, 0, -1, 0, 0, 'NQ\\Q!F2lyr@/j&''Z(%694;gNfI/^J5', 0, 0, 0, '', 0, 0, 0, 0, 0, 0, 0, 0, 0, 0, 0, 0, '', '', 0, '', 'vb', '', 0, 1, 0, 0, NULL),
(23125, 2, '', 0, 'imran shahid', 'adada3d3d30aef0ec1adbb6c46df018a', '2014-03-24', 'imran_shahid67@yahoo.com', 0, '', '', '', '', '', '', '', 2, 0, 'New Member', 0, 1395644601, 0, 1395644601, 1395645372, 0, 0, 0, 0, 4, '5', 0, 0, 0, 0, 0, 3194967, '11-16-1981', '1981-11-16', -1, -1, '182.189.172.123', 0, 1, 0, 0, -1, 0, 0, 'Cxp)ScKA9SmDo;Q7B^]h%-Q;]<jB_G', 0, 0, 0, '', 0, 0, 0, 0, 0, 0, 0, 0, 0, 0, 0, 0, '', '', 0, '', 'vb', '', 0, 1, 0, 0, NULL),
(23036, 2, '', 0, 'syedwajahathussain', '7dfb9ab011182a51258967ce1badc6d8', '2014-03-18', 'syedwajahathussain1977@yahoo.com', 0, '', '', '', '', '', '', '', 2, 0, 'New Member', 0, 1395132569, 0, 1395132569, 1395133164, 0, 0, 0, 0, 4, '5', 0, 0, 0, 0, 0, 3194967, '01-26-1977', '1977-01-26', -1, -1, '182.181.180.141', 790, 1, 0, 0, -1, 0, 0, 'RQ+|3I,"#xQplmjq!=N1?T;2vukOG7', 0, 0, 0, '', 0, 0, 0, 0, 0, 0, 0, 0, 0, 0, 0, 0, '', '', 0, '', 'vb', '', 0, 1, 0, 0, NULL),
(22826, 3, '', 0, 'umerrauf15', '4bddb0bc000c19b09f577e0490c5ed28', '2014-03-13', 'umerrauf15@gmail.com', 0, '', '', '', '', '', '', '', 2, 0, 'New Member', 0, 1394697435, 0, 1394697435, 1394697435, 0, 0, 0, 0, 4, '10', 0, 0, 0, 0, 0, 3194967, '03-14-1992', '1992-03-14', -1, -1, '203.45.87.130', 0, 1, 0, 0, -1, 0, 0, 'F=(eL?6v{v!&+9M"Us$7+\\t*1eR"px', 0, 0, 0, '', 0, 0, 0, 0, 0, 0, 0, 0, 0, 0, 0, 0, '', '', 0, '', 'vb', '', 0, 1, 0, 0, NULL),
(23123, 2, '', 0, 'omerpk', 'c2a33b3658906fcc6f347515c8fb7052', '2014-03-23', 'ozia20@yahoo.com', 0, '', '', '', '', '', '', '', 2, 0, 'New Member', 0, 1395603708, 0, 1397406049, 1398955566, 0, 0, 0, 0, 4, '5', 0, 0, 0, 0, 0, 3194967, '10-29-1992', '1992-10-29', -1, -1, '182.185.247.85', 0, 1, 0, 0, -1, 0, 0, 'o\\GWb>qwvM00!mH<ExK_Iz'')2l|7Wc', 0, 0, 0, '', 0, 0, 0, 0, 0, 0, 0, 0, 0, 0, 0, 0, '', '', 0, '', 'vb', '', 0, 1, 0, 0, NULL),
(22871, 3, '', 0, 'MReynoso', 'dd2718c9839985572bdabee1ece948a6', '2014-03-14', 'michel-reynoso21@tipbongmoingay.info', 0, '', '', '', '', '', '', '', 2, 0, 'New Member', 0, 1394806253, 0, 1394806253, 1394806253, 0, 0, 0, 0, 4, '5', 0, 0, 0, 0, 0, 3194967, '11-20-1974', '1974-11-20', -1, -1, '107.158.23.135', 0, 1, 0, 0, -1, 0, 0, '&M)+SLp~+##ufB?JN+3/p#)kTB"d58', 0, 0, 0, '', 0, 0, 0, 0, 0, 0, 0, 0, 0, 0, 0, 0, '', '', 0, '', 'vb', '', 0, 1, 0, 0, NULL),
(22883, 2, '', 0, 'Mian Daniyal', '21759402e05df50c0b3773454c96b661', '2014-03-14', 'danialloverboy@ymail.com', 0, '', '', '', '', '', '', '', 2, 0, 'New Member', 0, 1394826397, 0, 1394826397, 1394826397, 0, 0, 0, 0, 4, '5', 0, 0, 0, 0, 0, 3194967, '03-01-1990', '1990-03-01', -1, -1, '39.35.114.26', 0, 1, 0, 0, -1, 0, 0, 'C4RZ%|;np@}XKG+qp=h!eZCaV>|5Q!', 0, 0, 0, '', 0, 0, 0, 0, 0, 0, 0, 0, 0, 0, 0, 0, '', '', 0, '', 'vb', '', 0, 1, 0, 0, NULL),
(22830, 3, '', 0, 'GNorrie', '4527f6ac9ecc6cec18ddda7a9e65fb57', '2014-03-13', 'liannek4cappucci@yahoo.com', 0, '', '', '', '', '', '', '', 2, 0, 'New Member', 0, 1394703074, 0, 1394703074, 1394712420, 0, 0, 0, 0, 4, '5', 0, 0, 0, 0, 0, 3194967, '09-23-1971', '1971-09-23', -1, -1, '198.55.113.76', 0, 1, 0, 0, -1, 0, 0, '`k5m5@gnkk8j]yzR.A~eS)mWbgHqtk', 0, 0, 0, '', 0, 0, 0, 0, 0, 0, 0, 0, 0, 0, 0, 0, '', '', 0, '', 'vb', '', 0, 1, 0, 0, NULL),
(23095, 3, '', 0, 'PSkeen', 'f1fad4e704f75fcfce514a28ca870980', '2014-03-21', 'concepcionqhdinardi@yahoo.com', 0, '', '', '', '', '', '', '', 2, 0, 'New Member', 0, 1395376980, 0, 1395376980, 1402653496, 0, 0, 0, 0, 4, '5', 0, 0, 0, 0, 0, 3194967, '03-04-1980', '1980-03-04', -1, -1, '23.94.19.102', 0, 1, 0, 0, -1, 0, 0, 'DU`6by2UG?peTA.Oh~2mS=+QH''{F_^', 0, 0, 0, '', 0, 0, 0, 0, 0, 0, 0, 0, 0, 0, 0, 0, '', '', 0, '', 'vb', '', 0, 1, 0, 0, NULL),
(23090, 3, '', 0, 'JCoble', '476afb9e2d4d4d791090024802c86ff7', '2014-03-20', 'janeen-coble@elitetest360review.net', 0, '', '', '', '', '', '', '', 2, 0, 'New Member', 0, 1395320369, 0, 1395320369, 1395961272, 0, 0, 0, 0, 4, '5', 0, 0, 0, 0, 0, 3194967, '07-21-1985', '1985-07-21', -1, -1, '198.20.81.45', 0, 1, 0, 0, -1, 0, 0, 'N&i*$Yq*n:*VQv<E-o6M#LaMM)R2Ke', 0, 0, 0, '', 0, 0, 0, 0, 0, 0, 0, 0, 0, 0, 0, 0, '', '', 0, '', 'vb', '', 0, 1, 0, 0, NULL),
(22832, 2, '', 0, 'Osama Hafeez', 'f29d9a9c3571b9d4c28079c9106790fc', '2015-01-30', 'osamahafeez@hotmail.com', 0, '', '', '', '', '', '', '', 2, 0, 'New Member', 0, 1394710938, 0, 1424494620, 1424494620, 1424493642, 474066, 6, 0, 4, '5', 0, 0, 0, 0, 0, 3194967, '02-14-1989', '1989-02-14', -1, -1, '125.209.85.58', 0, 1, 0, 0, -1, 0, 0, '-h^U-I~QC&fmF@:\\!F|1RtF%v9U"{o', 0, 0, 0, '', 0, 0, 5, 0, 0, 0, 0, 0, 0, 0, 0, 0, '', '', 0, '', 'vb', '', 0, 1, 0, 0, NULL),
(22833, 2, '', 0, 'Antimon', '56b6083795177f45b544c640b0b6e314', '2014-03-13', 'aminigo@gmail.com', 0, '', '', '', '', '', '', '', 2, 0, 'New Member', 0, 1394712429, 0, 1394712429, 1394712706, 0, 0, 0, 0, 4, '1', 0, 0, 0, 0, 0, 3194967, '03-28-1973', '1973-03-28', -1, -1, '93.142.136.171', 0, 1, 0, 0, -1, 0, 0, 'y\\cwJLjd&WGVt/NQ4#VY{_w&}`"i<k', 0, 0, 0, '', 0, 0, 0, 0, 0, 0, 0, 0, 0, 0, 0, 0, '', '', 0, '', 'vb', '', 0, 1, 0, 0, NULL),
(22870, 3, '', 0, 'ELakeland', '393f693cb19beaa6ba40d79d9f65136d', '2014-03-14', 'alisekmcrall@yahoo.com', 0, '', '', '', '', '', '', '', 2, 0, 'New Member', 0, 1394802410, 0, 1394802410, 1394809436, 0, 0, 0, 0, 4, '5', 0, 0, 0, 0, 0, 3194967, '12-05-1978', '1978-12-05', -1, -1, '5.255.75.188', 0, 1, 0, 0, -1, 0, 0, 'Q,TPB[CVE50GiNg02xsNG#!4HfWsKJ', 0, 0, 0, '', 0, 0, 0, 0, 0, 0, 0, 0, 0, 0, 0, 0, '', '', 0, '', 'vb', '', 0, 1, 0, 0, NULL),
(22938, 3, '', 0, 'KNUNE', '96b2c9ea9c4624a5de304b7482135da4', '2014-03-15', 'obsoleteupshot45gm57@outlook.com', 0, '', '', '', '', '', '', '', 2, 0, 'New Member', 0, 1394918914, 0, 1394918914, 1395369108, 0, 0, 0, 0, 4, '5', 0, 0, 0, 0, 0, 3194967, '05-09-1972', '1972-05-09', -1, -1, '192.3.182.86', 0, 1, 0, 0, -1, 0, 0, 'N3u#Sp."24M@|n@^5/6%mivRK*cGeX', 0, 0, 0, '', 0, 0, 0, 0, 0, 0, 0, 0, 0, 0, 0, 0, '', '', 0, '', 'vb', '', 0, 1, 0, 0, NULL),
(23708, 2, '', 0, 'jazz2554', '21f90372e8c4874a541e2b62e2e8d665', '2014-04-22', 'ejran2554@hotmail.com', 0, '', '', '', '', '', '', '', 2, 0, 'New Member', 0, 1398170789, 0, 1403197393, 1403197393, 1403008493, 445724, 2, 0, 4, '5', 0, 35, 0, 0, 0, 3194967, '10-19-1990', '1990-10-19', -1, -1, '39.51.77.202', 0, 1, 0, 0, -1, 0, 0, '.OqB<[Zl*+xd/`l=w\\\\W?^T+H''SzAA', 0, 0, 0, '', 0, 0, 0, 0, 0, 0, 0, 0, 0, 0, 0, 0, '', '', 0, '', 'vb', '', 0, 1, 0, 0, NULL),
(23479, 2, '', 0, 'saljouk', '2ac32a7ea1a7c43f428d46979db21ba8', '2014-04-13', 'ahmedsaljouk@gmail.com', 0, '', '', '', '', '', '', '', 2, 0, 'New Member', 0, 1397427477, 0, 1397427477, 1397430243, 0, 0, 0, 0, 4, '5', 0, 0, 0, 0, 0, 3194967, '03-14-1990', '1990-03-14', -1, -1, '175.110.187.36', 0, 1, 0, 0, -1, 0, 0, '%#>"S"4m:<&1==g/wsb6UrPw`g/]{7', 0, 0, 0, '', 0, 0, 0, 0, 0, 0, 0, 0, 0, 0, 0, 0, '', '', 0, '', 'vb', '', 0, 1, 0, 0, NULL),
(23066, 2, '', 0, 'xs2bilal', 'a427976779628b5bc06fa35cad71f6f3', '2014-03-19', 'xs2bilal@gmail.com', 0, '', '', '', '', '', '', '', 2, 0, 'New Member', 0, 1395214168, 0, 1395214168, 1395479017, 0, 0, 0, 0, 4, '5', 0, 0, 0, 0, 0, 3194967, '11-25-1983', '1983-11-25', -1, -1, '182.185.129.54', 0, 1, 0, 0, -1, 0, 0, ';Qu)HyQLzfjL9ag]l^5}[:2M7mLJnG', 0, 0, 0, '', 0, 0, 0, 0, 0, 0, 0, 0, 0, 0, 0, 0, '', '', 0, '', 'vb', '', 0, 1, 0, 0, NULL),
(22862, 2, '', 0, 'Ice Man', '0e043794cf1a42eff7f9333858c36666', '2014-03-14', 'ahmedfarooq59@gmail.com', 0, '', '', '', '', '', '', '', 2, 0, 'New Member', 0, 1394790286, 0, 1395335553, 1398020598, 1394976107, 430512, 4, 0, 4, '5', 0, 0, 0, 0, 0, 3194967, '01-23-1996', '1996-01-23', -1, -1, '39.32.248.255', 0, 1, 0, 0, -1, 0, 0, 't0Qfg-''Kq`q\\GVp:dyc{+>|GR+lFV*', 0, 0, 0, '', 0, 0, 0, 0, 0, 0, 0, 0, 0, 0, 0, 0, '', '', 0, '', 'vb', '', 0, 1, 0, 0, NULL),
(22841, 2, '', 0, 'Mudasar', '7bc98979d8a0736e8276b78b1ac17e3e', '2014-03-13', 'mudasariqbal922@gmail.com', 0, '', '', '', '', '', '', '', 2, 0, 'New Member', 0, 1394733206, 0, 1394733206, 1394733518, 0, 0, 0, 0, 4, '5', 0, 0, 0, 0, 0, 3194967, '12-04-1990', '1990-12-04', -1, -1, '39.52.160.225', 0, 1, 0, 0, -1, 0, 0, '?RX-glnq,=H,E_mEE]qh$vU.o5##$I', 0, 0, 0, '', 0, 0, 0, 0, 0, 0, 0, 0, 0, 0, 0, 0, '', '', 0, '', 'vb', '', 0, 1, 0, 0, NULL),
(22842, 16, '', 0, 'badar8', 'aa0268d414c9409ea52fa795f4610f16', '2014-03-13', 'badar7@live.com', 0, '', '', '', '', '', '', '', 2, 0, 'Banned', 0, 1394733619, 0, 1395358145, 1395358145, 1395322929, 0, 6, 0, 4, '5', 0, 0, 0, 0, 0, 3194967, '12-28-1990', '1990-12-28', -1, -1, '39.55.80.48', 0, 1, 0, 0, -1, 0, 0, 'd]OV[1FJj`#,b9b9Z|4!A?pW$Vq:<|', 0, 0, 0, '', 0, 0, 7, 0, 0, 0, 0, 0, 0, 0, 0, 0, '', '', 0, '', 'vb', '', 0, 1, 0, 0, NULL),
(22843, 2, '', 0, 'Selfrespect', '46f054a4c43b048c45111acb4e716f24', '2014-03-13', 'sherazhabib@hotmail.com', 0, '', '', '', '', '', '', '', 2, 0, 'New Member', 0, 1394735357, 0, 1394735357, 1394735734, 0, 0, 0, 0, 4, '5', 0, 0, 0, 0, 0, 3194967, '01-01-1980', '1980-01-01', -1, -1, '182.189.3.182', 0, 1, 0, 0, -1, 0, 0, 'CrV},yj5rGW''k0}XFJgPNhR9/]IOe7', 0, 0, 0, '', 0, 0, 0, 0, 0, 0, 0, 0, 0, 0, 0, 0, '', '', 0, '', 'vb', '', 0, 1, 0, 0, NULL),
(23127, 3, '', 0, 'LBarksdal', '294825c1baf276b97995066ecfee2415', '2014-03-24', 'emiliavvmartorelli@yahoo.com', 0, '', '', '', '', '', '', '', 2, 0, 'New Member', 0, 1395649161, 0, 1395649161, 1395649161, 0, 0, 0, 0, 4, '5', 0, 0, 0, 0, 0, 3194967, '01-13-1981', '1981-01-13', -1, -1, '198.55.113.96', 0, 1, 0, 0, -1, 0, 0, ';s"8j4iMw/Qd.9&ySh5Lp(x>gYXA|=', 0, 0, 0, '', 0, 0, 0, 0, 0, 0, 0, 0, 0, 0, 0, 0, '', '', 0, '', 'vb', '', 0, 1, 0, 0, NULL),
(23244, 2, '', 0, 'extracrunchy', 'e9a9314c816eba48da1ed478701ceec0', '2014-04-01', 'wpervaiz@gmail.com', 0, '', '', '', '', '', '', '', 2, 0, 'New Member', 0, 1396383733, 0, 1431264943, 1431600911, 1424519587, 474087, 11, 0, 4, '5', 0, 0, 0, 0, 0, 3194967, '06-05-1985', '1985-06-05', -1, -1, '61.5.141.13', 0, 1, 0, 0, -1, 0, 0, '|5dIFS~1^!7o>VUD%}rgmYMzu^5~N_', 0, 0, 0, '', 0, 0, 5, 0, 0, 0, 0, 0, 0, 0, 0, 0, '', '', 0, '', 'vb', '', 0, 1, 0, 0, NULL),
(22918, 2, '', 0, 'harrykhan', '86ce6de3fc4c90940820ecbf3156ebb5', '2014-03-15', 'ripespeed@hotmail.com', 0, '', '', '', '', '', '', '', 2, 0, 'New Member', 0, 1394890233, 0, 1394890233, 1394891076, 0, 0, 0, 0, 4, '5', 0, 0, 0, 0, 0, 3194967, '05-22-1977', '1977-05-22', -1, -1, '119.159.191.163', 0, 1, 0, 0, -1, 0, 0, '.DQ7TC7q[ON*[f5xjyZoq#g]6M"]r8', 0, 0, 0, '', 0, 0, 0, 0, 0, 0, 0, 0, 0, 0, 0, 0, '', '', 0, '', 'vb', '', 0, 1, 0, 0, NULL),
(22919, 3, '', 0, 'mohsinniaz834', 'dc27c8ae59fd0418b1547c317039ef16', '2014-03-15', 'mohsiniaz834@yahoo.com', 0, '', '', '', '', '', '', '', 2, 0, 'New Member', 0, 1394890406, 0, 1400680817, 1401364835, 0, 0, 0, 0, 4, '5', 0, 0, 0, 0, 0, 3194967, '04-02-1994', '1994-04-02', -1, -1, '39.32.109.181', 0, 1, 0, 0, -1, 0, 0, '1u(SJV-+D7Hvlt)T5]H]-PLw94:J=''', 0, 0, 0, '', 0, 0, 0, 0, 0, 0, 0, 0, 0, 0, 0, 0, '', '', 0, '', 'vb', '', 0, 1, 0, 0, NULL),
(22921, 3, '', 0, 'CRigg', '86eecccac1fd07158a5cf2da5686cc27', '2014-03-15', 'ildadnatkekex13@hotmail.com', 0, '', '', '', '', '', '', '', 2, 0, 'New Member', 0, 1394892199, 0, 1394892199, 1395328738, 0, 0, 0, 0, 4, '5', 0, 0, 0, 0, 0, 3194967, '05-19-1980', '1980-05-19', -1, -1, '23.229.75.153', 0, 1, 0, 0, -1, 0, 0, 'gWG&x5@nb;<Fr_[]xm=_mW1;;*@+pF', 0, 0, 0, '', 0, 0, 0, 0, 0, 0, 0, 0, 0, 0, 0, 0, '', '', 0, '', 'vb', '', 0, 1, 0, 0, NULL),
(23107, 3, '', 0, 'ABachus', '6b16af0fdc70a7d1527d832f5c84d000', '2014-03-22', 'nanceeeyhaga@yahoo.com', 0, '', '', '', '', '', '', '', 2, 0, 'New Member', 0, 1395466894, 0, 1395466894, 1395466894, 0, 0, 0, 0, 4, '5', 0, 0, 0, 0, 0, 3194967, '10-16-1981', '1981-10-16', -1, -1, '198.55.113.51', 0, 1, 0, 0, -1, 0, 0, ']3:tWNv68fgQ|YD~yRqlQ.j9Rrgh0J', 0, 0, 0, '', 0, 0, 0, 0, 0, 0, 0, 0, 0, 0, 0, 0, '', '', 0, '', 'vb', '', 0, 1, 0, 0, NULL),
(22947, 3, '', 0, 'DCramsie', 'b15fe1f1ed10695e7355e5788f08dddd', '2014-03-16', 'avilafrazer541@hotmail.com', 0, '', '', '', '', '', '', '', 2, 0, 'New Member', 0, 1394946492, 0, 1394946492, 1394946492, 0, 0, 0, 0, 4, '5', 0, 0, 0, 0, 0, 3194967, '07-15-1979', '1979-07-15', -1, -1, '192.227.243.179', 0, 1, 0, 0, -1, 0, 0, 'J96V#Kq8_d{}0kU^3@-9[/>h4lf:/#', 0, 0, 0, '', 0, 0, 0, 0, 0, 0, 0, 0, 0, 0, 0, 0, '', '', 0, '', 'vb', '', 0, 1, 0, 0, NULL),
(23476, 2, '', 0, 'saqibss', 'f6e46f430e334e7892c1e65d2423e738', '2014-04-13', 'saqibss@yahoo.com', 0, '', '', '', '', '', '', '', 2, 0, 'New Member', 0, 1397409390, 0, 1397409793, 1397409793, 0, 0, 0, 0, 4, '5', 0, 0, 0, 0, 0, 3194967, '04-19-1973', '1973-04-19', -1, -1, '39.32.22.91', 0, 1, 0, 0, -1, 0, 0, '7>QR!ai@-L\\7SM[<>5}{<''^,[DtFY*', 0, 0, 0, '', 0, 0, 0, 0, 0, 0, 0, 0, 0, 0, 0, 0, '', '', 0, '', 'vb', '', 0, 1, 0, 0, NULL),
(22940, 2, '', 0, 'Littleredhen', 'be8978e43699b7417e4a5ffd97597af8', '2014-03-15', 'billygood@hughes.net', 0, '', '', '', '', '', '', '', 2, 0, 'New Member', 0, 1394921835, 0, 1394922249, 1394975762, 0, 0, 0, 0, 4, '-4.5', 0, 0, 0, 0, 0, 3194967, '04-07-1941', '1941-04-07', -1, -1, '69.35.216.126', 0, 1, 0, 0, -1, 0, 0, 'Q.fkRtOSX:Z{~*%{,>pvtAV"r"eGg7', 0, 0, 0, '', 0, 0, 0, 0, 0, 0, 0, 0, 0, 0, 0, 0, '', '', 0, '', 'vb', '', 0, 1, 0, 0, NULL),
(22941, 3, '', 0, 'TMacKillo', '35e832e4ea7669550f9e6d5db9b8f15f', '2014-03-16', 'purplecamper40ndh38@outlook.com', 0, '', '', '', '', '', '', '', 2, 0, 'New Member', 0, 1394931987, 0, 1394931987, 1395404467, 0, 0, 0, 0, 4, '5', 0, 0, 0, 0, 0, 3194967, '04-06-1975', '1975-04-06', -1, -1, '184.82.177.139', 0, 1, 0, 0, -1, 0, 0, 'P:}fO''F=SS2G_,y8.qcF@]^[$Q*/U/', 0, 0, 0, '', 0, 0, 0, 0, 0, 0, 0, 0, 0, 0, 0, 0, '', '', 0, '', 'vb', '', 0, 1, 0, 0, NULL),
(23132, 3, '', 0, 'Fsmagum', '0181ccb897f16890af0b4a48281f4675', '2016-08-24', 'Fsaeed1975@gmail.com', 0, '', '', '', '', '', '', '', 2, 0, 'New Member', 0, 1395681259, 0, 1473378532, 1477281559, 0, 0, 0, 0, 4, '5', 0, 0, 0, 0, 0, 3194967, '06-01-1975', '1975-06-01', -1, -1, '39.32.240.88', 0, 1, 0, 0, -1, 0, 0, '9]d<<8BA0"m<R0d]X-ip.v;Jv:`fhV', 0, 0, 0, '', 0, 0, 3, 0, 0, 0, 0, 0, 0, 0, 0, 0, '', '', 0, '', 'vb', '', 0, 1, 0, 0, NULL),
(22928, 2, '', 0, 'SBrothers', '49687561f4e9953aa3ef62172f35c607', '2014-03-15', 'alidxzc@outlook.com', 0, '', '', '', '', '', '', '', 2, 0, 'New Member', 0, 1394900878, 0, 1394900878, 1394901344, 0, 0, 0, 0, 4, '5', 0, 0, 0, 0, 0, 3194967, '03-21-1974', '1974-03-21', -1, -1, '5.39.54.23', 0, 1, 0, 0, -1, 0, 0, 'S[4<%H*5]KNV2(&Ax''y<ZUC3lQ*$Q#', 0, 0, 0, '', 0, 0, 0, 0, 0, 0, 0, 0, 0, 0, 0, 0, '', '', 0, '', 'vb', '', 0, 1, 0, 0, NULL),
(23053, 2, '', 0, 'HeartTTAK', '8d53b2678cf84f05554766e57f1c4c57', '2014-03-18', 'eagleman786@yahoo.com', 0, '', '', '', '', '', '', '', 2, 0, 'Member', 0, 1395158125, 0, 1418036643, 1420901957, 1406285152, 451853, 66, 0, 4, '5', 0, 0, 0, 0, 0, 3194967, '04-01-1986', '1986-04-01', -1, -1, '182.189.169.238', 0, 1, 0, 0, -1, 0, 0, '}@kLpqKE;AVm~)zR"0CI-lz!2;&!9(', 0, 0, 0, '', 0, 0, 5, 1, 0, 0, 0, 0, 0, 0, 0, 0, '', '', 0, '', 'vb', '', 0, 1, 0, 0, NULL),
(23105, 3, '', 0, 'bbobbymaareyay3021', '7c7c274e8073a9bb178e1c5e756b43ed', '2014-03-22', 'bbobbymaareyay@ymail.com', 0, '', '', '', '', '', '', '', 2, 0, 'New Member', 0, 1395460507, 0, 1395460507, 1395460507, 0, 0, 0, 0, 4, '-10', 0, 0, 0, 0, 0, 3194903, '05-01-1977', '1977-05-01', -1, -1, '197.163.12.73', 0, 1, 0, 0, -1, 0, 0, '7?JVu~1.-u[O9JtX73&)&zcs.%%<bZ', 0, 0, 0, '', 0, 0, 0, 0, 0, 0, 0, 0, 0, 0, 0, 0, '', '', 0, '', 'vb', '', 0, 1, 0, 0, NULL),
(22957, 3, '', 0, 'SWindeyer', '5c3251bc3a9761dbfe8865b917cb83cb', '2014-03-16', 'heat.h.vd.orsey7321@gmail.com', 0, '', '', '', '', '', '', '', 2, 0, 'New Member', 0, 1394960742, 0, 1394960742, 1394960742, 0, 0, 0, 0, 4, '5', 0, 0, 0, 0, 0, 3194967, '10-15-1985', '1985-10-15', -1, -1, '173.232.105.210', 0, 1, 0, 0, -1, 0, 0, '>{M;A,C<>uSfeN9u$!f{-v[[#1QA?w', 0, 0, 0, '', 0, 0, 0, 0, 0, 0, 0, 0, 0, 0, 0, 0, '', '', 0, '', 'vb', '', 0, 1, 0, 0, NULL),
(23128, 2, '', 0, 'adilqaisrani', 'fa811cb594292425dd0d36183540fc99', '2014-03-24', 'rzmgadil@yahoo.com', 0, '', '', '', '', '', '', '', 2, 0, 'New Member', 0, 1395654773, 0, 1395654773, 1395656455, 0, 0, 0, 0, 4, '5', 0, 0, 0, 0, 0, 3194967, '07-19-1980', '1980-07-19', -1, -1, '39.32.55.140', 0, 1, 0, 0, -1, 0, 0, 'k(9Ai/ai\\X~<opHELT5.l;>0nYh&VF', 0, 0, 0, '', 0, 0, 0, 0, 0, 0, 0, 0, 0, 0, 0, 0, '', '', 0, '', 'vb', '', 0, 1, 0, 0, NULL),
(23122, 3, '', 0, 'bajehnzyadexta6538', '920f763989825a2f231050e58022ece5', '2014-03-23', 'bajehnzyadexta@ymail.com', 0, '', '', '', '', '', '', '', 2, 0, 'New Member', 0, 1395601079, 0, 1395601079, 1395601079, 0, 0, 0, 0, 4, '-7', 0, 0, 0, 0, 0, 3194903, '06-09-1979', '1979-06-09', -1, -1, '146.185.177.103', 0, 1, 0, 0, -1, 0, 0, ')9U=Bc_+^}tw)yKGGM_op)70o2fcCF', 0, 0, 0, '', 0, 0, 0, 0, 0, 0, 0, 0, 0, 0, 0, 0, '', '', 0, '', 'vb', '', 0, 1, 0, 0, NULL),
(23096, 2, '', 0, 'IHowse', 'd2c2e006e4761c78799d98e5a0c50263', '2014-03-21', 'pool@pbnsniper.com', 0, '', '', '', '', '', '', '', 2, 0, 'New Member', 0, 1395379967, 0, 1395379967, 1395384630, 0, 0, 0, 0, 4, '5', 0, 0, 0, 0, 0, 3194967, '06-22-1972', '1972-06-22', -1, -1, '184.154.170.220', 0, 1, 0, 0, -1, 0, 0, 'p8"=TQ#ot3UO_S+:`0gmc*EF[F4yCF', 0, 0, 0, '', 0, 0, 0, 0, 0, 0, 0, 0, 0, 0, 0, 0, '', '', 0, '', 'vb', '', 0, 1, 0, 0, NULL),
(23097, 3, '', 0, 'babadatts5602', '64ed52a655c341a442225abfead4b010', '2014-03-21', 'babadatts@ymail.com', 0, '', '', '', '', '', '', '', 2, 0, 'New Member', 0, 1395381614, 0, 1395381614, 1395381614, 0, 0, 0, 0, 4, '1', 0, 0, 0, 0, 0, 3194903, '03-09-1977', '1977-03-09', -1, -1, '190.207.232.49', 0, 1, 0, 0, -1, 0, 0, 'u4U<:1S3XN''?$g~,+@M8+V_=Q%~p;V', 0, 0, 0, '', 0, 0, 0, 0, 0, 0, 0, 0, 0, 0, 0, 0, '', '', 0, '', 'vb', '', 0, 1, 0, 0, NULL),
(23212, 3, '', 0, 'JanelleSt', 'b5c3edd14136c158552913ff3deef5b2', '2014-03-29', 'janelle-stamper@crashdivas.net', 0, '', '', '', '', '', '', '', 2, 0, 'New Member', 0, 1396057497, 0, 1396057497, 1396493053, 0, 0, 0, 0, 4, '5', 0, 0, 0, 0, 0, 3194967, '02-08-1980', '1980-02-08', -1, -1, '23.94.19.51', 0, 1, 0, 0, -1, 0, 0, '-hsMP+YDuI0f3CRf"+Kt*\\Nz.k<}nt', 0, 0, 0, '', 0, 0, 0, 0, 0, 0, 0, 0, 0, 0, 0, 0, '', '', 0, '', 'vb', '', 0, 1, 0, 0, NULL),
(23113, 2, '', 0, 'Hunter Boy', '9a7d489c3e40625b4d9805ce92420f05', '2014-03-22', 'HunterBoy.wk@gmail.com', 0, '', '', '', '', '', '', '', 2, 0, 'New Member', 0, 1395512951, 0, 1395592450, 1395592450, 0, 0, 0, 0, 4, '5', 0, 0, 0, 0, 0, 3194967, '05-16-1987', '1987-05-16', -1, -1, '39.52.80.74', 0, 1, 0, 0, -1, 0, 0, 'li[&?&M,(w`6C!30dH<cXfw/=0]nT:', 0, 0, 0, '', 0, 0, 0, 0, 0, 0, 0, 0, 0, 0, 0, 0, '4aad1c1c2ac3a0adc0868b5575b467e9', '', 0, '', 'vb', '', 0, 1, 0, 0, NULL),
(23570, 3, '', 0, 'SFatnowna', '6bab31689902588279747441753f0dcd', '2014-04-17', 'nbgodardjuh@outlook.com', 0, '', '', '', '', '', '', '', 2, 0, 'New Member', 0, 1397689567, 0, 1397689567, 1397689567, 0, 0, 0, 0, 4, '5', 0, 0, 0, 0, 0, 3194967, '07-14-1976', '1976-07-14', -1, -1, '199.180.134.197', 0, 1, 0, 0, -1, 0, 0, 'GeDMHGcBjvK4EHZd@w\\=_qiYJ)a9*`', 0, 0, 0, '', 0, 0, 0, 0, 0, 0, 0, 0, 0, 0, 0, 0, '', '', 0, '', 'vb', '', 0, 1, 0, 0, NULL),
(23093, 3, '', 0, 'AConnely', '8882ac56977734421db2b246fa53d65a', '2014-03-20', 'typicaltwaddle2y4l43@outlook.com', 0, '', '', '', '', '', '', '', 2, 0, 'New Member', 0, 1395351063, 0, 1395351063, 1395351063, 0, 0, 0, 0, 4, '5', 0, 0, 0, 0, 0, 3194967, '08-22-1976', '1976-08-22', -1, -1, '198.143.144.26', 0, 1, 0, 0, -1, 0, 0, 'c>Y}%Dmo@)#M6naJ5h;c=im[~.&]:5', 0, 0, 0, '', 0, 0, 0, 0, 0, 0, 0, 0, 0, 0, 0, 0, '', '', 0, '', 'vb', '', 0, 1, 0, 0, NULL),
(23094, 3, '', 0, 'LTovell', 'f669142236def91c610d441ef3ff3781', '2014-03-21', 'magicalfaithles9qd49@outlook.com', 0, '', '', '', '', '', '', '', 2, 0, 'New Member', 0, 1395362021, 0, 1395362021, 1395362021, 0, 0, 0, 0, 4, '5', 0, 0, 0, 0, 0, 3194967, '04-18-1983', '1983-04-18', -1, -1, '162.248.102.174', 0, 1, 0, 0, -1, 0, 0, '@/TIVH}Hs:d=M0=r~*:0g/`]r::&d4', 0, 0, 0, '', 0, 0, 0, 0, 0, 0, 0, 0, 0, 0, 0, 0, '', '', 0, '', 'vb', '', 0, 1, 0, 0, NULL),
(23051, 3, '', 0, 'khalil ahmed', '0a72c1871027b41664d6df9584c807f1', '2014-03-18', 'khalil.saarim@gmail.com', 0, '', '', '', '', '', '', '', 2, 0, 'New Member', 0, 1395155209, 0, 1395155209, 1395155422, 0, 0, 0, 0, 4, '5', 0, 0, 0, 0, 0, 3194967, '03-16-1977', '1977-03-16', -1, -1, '115.167.46.35', 0, 1, 0, 0, -1, 0, 0, '$f1gYvI#8(\\0MOfI}I*!`$)w*FLR0Y', 0, 0, 0, '', 0, 0, 0, 0, 0, 0, 0, 0, 0, 0, 0, 0, '', '', 0, '', 'vb', '', 0, 1, 0, 0, NULL),
(23026, 3, '', 0, 'LGarland', '785d7631202a543a71a95f60c06b1c0a', '2014-03-17', 'louisa_garland@trimatolreview.com', 0, '', '', '', '', '', '', '', 2, 0, 'New Member', 0, 1395093173, 0, 1395093173, 1395093173, 0, 0, 0, 0, 4, '5', 0, 0, 0, 0, 0, 3194967, '11-02-1980', '1980-11-02', -1, -1, '198.55.112.175', 0, 1, 0, 0, -1, 0, 0, 'd1xRI:D"Wh%h&]twh</.4Q\\vUg%Lva', 0, 0, 0, '', 0, 0, 0, 0, 0, 0, 0, 0, 0, 0, 0, 0, '', '', 0, '', 'vb', '', 0, 1, 0, 0, NULL),
(23175, 3, '', 0, 'C71B', 'e2fe56a1a697acf5cdc3204e54f8159d', '2014-03-26', 'cathern.tice@flawlessraspberryketonediet.net', 0, '', '', '', '', '', '', '', 2, 0, 'New Member', 0, 1395832817, 0, 1395832817, 1396924797, 0, 0, 0, 0, 4, '5', 0, 0, 0, 0, 0, 3194967, '02-28-1984', '1984-02-28', -1, -1, '192.3.148.178', 0, 1, 0, 0, -1, 0, 0, 'AdBi+,4AnP7vo2LGm."{eq1^A''9}-+', 0, 0, 0, '', 0, 0, 0, 0, 0, 0, 0, 0, 0, 0, 0, 0, '', '', 0, '', 'vb', '', 0, 1, 0, 0, NULL),
(22983, 2, '', 0, 'CHunter', '0290999e236546e0ecf060898871bcb2', '2014-03-16', 'rogerzcw@hotmail.com', 0, '', '', '', '', '', '', '', 2, 0, 'New Member', 0, 1394992620, 0, 1394992620, 1394992828, 0, 0, 0, 0, 4, '5', 0, 0, 0, 0, 0, 3194967, '06-27-1985', '1985-06-27', -1, -1, '68.65.240.146', 0, 1, 0, 0, -1, 0, 0, 'n@9e-bfL:/`((si[RIydLo}~/Rs9pF', 0, 0, 0, '', 0, 0, 0, 0, 0, 0, 0, 0, 0, 0, 0, 0, '', '', 0, '', 'vb', '', 0, 1, 0, 0, NULL),
(23173, 3, '', 0, 'EBitner', '55b962f85609f0aa467fa2b3a577bb88', '2014-03-26', 'esteban-bitner@seodesignexpert.tk', 0, '', '', '', '', '', '', '', 2, 0, 'New Member', 0, 1395831382, 0, 1395831382, 1395831382, 0, 0, 0, 0, 4, '5', 0, 0, 0, 0, 0, 3194967, '06-22-1984', '1984-06-22', -1, -1, '198.143.136.19', 0, 1, 0, 0, -1, 0, 0, '0?rd$`~E/XX9&5j%[i60b}(L^=3n-R', 0, 0, 0, '', 0, 0, 0, 0, 0, 0, 0, 0, 0, 0, 0, 0, '', '', 0, '', 'vb', '', 0, 1, 0, 0, NULL),
(23101, 3, '', 0, 'pittyjray9508', '0159b49c49a98ab55b31dd444d6069d0', '2014-03-21', 'pittyjray@ymail.com', 0, '', '', '', '', '', '', '', 2, 0, 'New Member', 0, 1395424255, 0, 1395424255, 1395424255, 0, 0, 0, 0, 4, '-7', 0, 0, 0, 0, 0, 3194903, '03-21-1984', '1984-03-21', -1, -1, '192.3.108.180', 0, 1, 0, 0, -1, 0, 0, 'SzEXU)a]^@#xZLu(R\\!|vAg1e&Q~0T', 0, 0, 0, '', 0, 0, 0, 0, 0, 0, 0, 0, 0, 0, 0, 0, '', '', 0, '', 'vb', '', 0, 1, 0, 0, NULL),
(23067, 3, '', 0, 'NHanger', '68abf914e226b6a6f68522f5d8f2cbcc', '2014-03-19', 'kathiovstarace@yahoo.com', 0, '', '', '', '', '', '', '', 2, 0, 'New Member', 0, 1395214197, 0, 1395214197, 1395214197, 0, 0, 0, 0, 4, '5', 0, 0, 0, 0, 0, 3194967, '05-11-1983', '1983-05-11', -1, -1, '5.255.75.233', 0, 1, 0, 0, -1, 0, 0, 'iv=-5ag?_;W3N(/nBz"=W&orrp:ak%', 0, 0, 0, '', 0, 0, 0, 0, 0, 0, 0, 0, 0, 0, 0, 0, '', '', 0, '', 'vb', '', 0, 1, 0, 0, NULL),
(23050, 2, '', 0, 'hanzalazahid', '272bd05f1816f408a6e30e9bf49d03b0', '2014-03-18', 'usmanpcc@yahoo.com', 0, '', '', '', '', '', '', '', 2, 0, 'New Member', 0, 1395154844, 0, 1395155471, 1395155471, 0, 0, 0, 0, 4, '5', 0, 0, 0, 0, 0, 3194967, '02-03-1994', '1994-02-03', -1, -1, '182.185.206.104', 0, 1, 0, 0, -1, 0, 0, '+|oC*:#Xu,Vm},wk=aRO:\\Y|$tM-lm', 0, 0, 0, '', 0, 0, 0, 0, 0, 0, 0, 0, 0, 0, 0, 0, '', '', 0, '', 'vb', '', 0, 1, 0, 0, NULL),
(23043, 3, '', 0, 'SCurtiss', 'a83e1ea05954ebed249ae7cb102f708b', '2014-03-18', 'samlawrenceoe@marchmail.com', 0, '', '', '', '', '', '', '', 2, 0, 'New Member', 0, 1395139664, 0, 1395139664, 1395629147, 0, 0, 0, 0, 4, '5', 0, 0, 0, 0, 0, 3194967, '07-15-1972', '1972-07-15', -1, -1, '194.126.251.165', 0, 1, 0, 0, -1, 0, 0, 'H=\\{,osJQ)wn63LZVT-gFfaP|,kr8b', 0, 0, 0, '', 0, 0, 0, 0, 0, 0, 0, 0, 0, 0, 0, 0, '', '', 0, '', 'vb', '', 0, 1, 0, 0, NULL),
(23063, 3, '', 0, 'banelasjnra5635', '7633db9288708f902c9da9047f227f86', '2014-03-19', 'banelasjnra@ymail.com', 0, '', '', '', '', '', '', '', 2, 0, 'New Member', 0, 1395208768, 0, 1397590013, 1397967686, 0, 0, 0, 0, 4, '2', 0, 0, 0, 0, 0, 3195031, '09-09-1986', '1986-09-09', -1, -1, '180.183.239.18', 0, 1, 0, 0, -1, 0, 0, 'w=l}AuFjpM")o5byIz"=e).bOYGb"v', 0, 0, 0, '', 0, 0, 0, 0, 0, 0, 0, 0, 0, 0, 0, 0, '', '', 0, '', 'vb', '', 0, 1, 0, 0, NULL),
(23046, 2, '', 0, 'k_nisar', 'd3e5f6b9e2f5e06f8ad41acda0e9dc56', '2014-03-18', 'k_nisar@yahoo.com', 0, '', '', '', '', '', '', '', 2, 0, 'New Member', 0, 1395149051, 0, 1419441602, 1419503191, 1399647527, 438624, 18, 0, 4, '5', 0, 36, 0, 0, 0, 3194967, '02-16-1988', '1988-02-16', -1, -1, '113.203.144.252', 0, 1, 0, 0, -1, 0, 0, 'I!)yE6&h^w~.DAs|l@RY''K*}Q[R*oH', 0, 0, 0, '', 0, 0, 2, 0, 0, 0, 0, 0, 0, 0, 0, 0, '2d7b237c765dacd70b93d4b111213834', '', 0, '', 'vb', '', 0, 1, 0, 0, NULL),
(23060, 3, '', 0, 'SWUIO', 'e865f1eb7fea6d236d3848f66f402695', '2014-03-19', 'cher7kniro@yahoo.com', 0, '', '', '', '', '', '', '', 2, 0, 'New Member', 0, 1395198231, 0, 1395198231, 1395198231, 0, 0, 0, 0, 4, '5', 0, 0, 0, 0, 0, 3194967, '10-08-1972', '1972-10-08', -1, -1, '198.50.161.227', 0, 1, 0, 0, -1, 0, 0, '6#bp50s.2EJX}RiUinO=K//NvVv7il', 0, 0, 0, '', 0, 0, 0, 0, 0, 0, 0, 0, 0, 0, 0, 0, '', '', 0, '', 'vb', '', 0, 1, 0, 0, NULL),
(23061, 2, '', 0, 'ninjaOptimus', 'fde08ac99c32c987e9ab74c844ff4776', '2014-03-19', 'abbasjin@gmail.com', 0, '', '', '', '', '', '', '', 2, 0, 'New Member', 0, 1395200469, 0, 1395200572, 1395567072, 1395567071, 0, 1, 0, 4, '5', 0, 0, 0, 0, 0, 3194967, '08-22-1987', '1987-08-22', -1, -1, '39.32.62.174', 0, 1, 0, 0, -1, 0, 0, 'Nixv_SHE-qz[Z''(Q(VB.%Un-w`9hq:', 0, 0, 0, '', 0, 0, 0, 0, 0, 0, 0, 0, 0, 0, 0, 0, '', '', 0, '', 'vb', '', 0, 1, 0, 0, NULL),
(23049, 3, '', 0, 'SLorenzo', 'ab7a5575448ef0d7669be25a90a10d38', '2014-03-18', 'silke_lorenzo@leanmuscles.net', 0, '', '', '', '', '', '', '', 2, 0, 'New Member', 0, 1395153503, 0, 1395153503, 1395766500, 0, 0, 0, 0, 4, '5', 0, 0, 0, 0, 0, 3194967, '05-16-1981', '1981-05-16', -1, -1, '184.154.154.13', 0, 1, 0, 0, -1, 0, 0, 'd0''Cp%Wc[un"s3l$xdSp`i\\JGqjf?;', 0, 0, 0, '', 0, 0, 0, 0, 0, 0, 0, 0, 0, 0, 0, 0, '', '', 0, '', 'vb', '', 0, 1, 0, 0, NULL),
(23000, 3, '', 0, 'RPNRP', '21519bfb63e4a0764487ca117e6ba302', '2014-03-17', 'learnedjurist652206@outlook.com', 0, '', '', '', '', '', '', '', 2, 0, 'New Member', 0, 1395036304, 0, 1395036304, 1395036304, 0, 0, 0, 0, 4, '5', 0, 0, 0, 0, 0, 3194967, '12-28-1981', '1981-12-28', -1, -1, '5.157.41.92', 0, 1, 0, 0, -1, 0, 0, 'uf{!^8;7r{wIzv~y.JhIndkhnuQ7Jp', 0, 0, 0, '', 0, 0, 0, 0, 0, 0, 0, 0, 0, 0, 0, 0, '', '', 0, '', 'vb', '', 0, 1, 0, 0, NULL),
(23054, 3, '', 0, 'DWIV', 'e7f544d2a01334852285611b6a01fea1', '2014-03-18', 'reflectiveorati8dr65@outlook.com', 0, '', '', '', '', '', '', '', 2, 0, 'New Member', 0, 1395174221, 0, 1395174221, 1397173785, 0, 0, 0, 0, 4, '5', 0, 0, 0, 0, 0, 3194967, '08-09-1976', '1976-08-09', -1, -1, '192.3.142.75', 0, 1, 0, 0, -1, 0, 0, '$F55!wR_%kG;XaNa1a^z-=2f{z&u@J', 0, 0, 0, '', 0, 0, 0, 0, 0, 0, 0, 0, 0, 0, 0, 0, '', '', 0, '', 'vb', '', 0, 1, 0, 0, NULL),
(23079, 2, '', 0, 'mughale', '4332c3091190dd757d0f6144f84eec8e', '2014-10-12', 'mughale_007@yahoo.com', 0, '', '', '', '', '', '', '', 2, 0, 'New Member', 0, 1395261897, 0, 1419426411, 1419437837, 1395816844, 431966, 4, 0, 4, '5', 0, 0, 0, 0, 0, 3194967, '08-15-1982', '1982-08-15', -1, -1, '65.49.14.55', 0, 1, 0, 0, -1, 0, 0, 'r$7^E:T)p-(0xBI$X}BNNUOG84~$6;', 0, 0, 0, '', 0, 0, 0, 0, 0, 0, 0, 0, 0, 0, 0, 0, '', '', 0, '', 'vb', '', 0, 1, 0, 0, NULL),
(23084, 2, '', 0, 'Anib Ahmad', 'a2caa041354f70b3ea1c4990ed130a27', '2014-03-20', 'souvenirgraphics@gmail.com', 0, '', '', '', '', '', '', '', 2, 0, 'New Member', 0, 1395298420, 0, 1395298420, 1395298823, 0, 0, 0, 0, 4, '5', 0, 0, 0, 0, 0, 3194967, '12-07-1994', '1994-12-07', -1, -1, '182.178.52.169', 0, 1, 0, 0, -1, 0, 0, 'LeUo69p!;JYa,ku|=flGl2zEi",!Ah', 0, 0, 0, '', 0, 0, 0, 0, 0, 0, 0, 0, 0, 0, 0, 0, '', '', 0, '', 'vb', '', 0, 1, 0, 0, NULL),
(23005, 3, '', 0, 'shan123', '0a0370f9f26c9ce13b915876a2f41292', '2014-03-17', 'hasan4u.39@gmail.com', 0, '', '', '', '', '', '', '', 2, 0, 'New Member', 0, 1395044721, 0, 1395044721, 1395044747, 0, 0, 0, 0, 4, '5', 0, 0, 0, 0, 0, 3194967, '01-28-1986', '1986-01-28', -1, -1, '124.29.213.109', 0, 1, 0, 0, -1, 0, 0, 'Pv:<*lU_b%1SEyGtJ3{k&6YfY]o+JX', 0, 0, 0, '', 0, 0, 0, 0, 0, 0, 0, 0, 0, 0, 0, 0, '', '', 0, '', 'vb', '', 0, 1, 0, 0, NULL),
(23111, 2, '', 0, 'khaleeqab', '8195e8ec5297f37213bc04a94779de78', '2014-03-22', 'khaleeqab@gmail.com', 0, '', '', '', '', '', '', '', 2, 0, 'New Member', 0, 1395481156, 0, 1395481330, 1395481330, 0, 0, 0, 0, 4, '5', 0, 0, 0, 0, 0, 3194967, '10-25-1969', '1969-10-25', -1, -1, '203.135.33.135', 0, 1, 0, 0, -1, 0, 0, '"^#''*x;/Y^07m_lFF~t@*Gd%H#\\IbO', 0, 0, 0, '', 0, 0, 0, 0, 0, 0, 0, 0, 0, 0, 0, 0, '', '', 0, '', 'vb', '', 0, 1, 0, 0, NULL),
(23087, 3, '', 0, 'IXQC', '5a286d85affb371867b9f38b0175ae94', '2014-03-20', 'eugeniaq1yaun@yahoo.com', 0, '', '', '', '', '', '', '', 2, 0, 'New Member', 0, 1395308120, 0, 1395308120, 1395385282, 0, 0, 0, 0, 4, '5', 0, 0, 0, 0, 0, 3194967, '09-22-1980', '1980-09-22', -1, -1, '198.55.113.124', 0, 1, 0, 0, -1, 0, 0, 'wIdV_r^VD86j0No*x5u74%MB>>>lor', 0, 0, 0, '', 0, 0, 0, 0, 0, 0, 0, 0, 0, 0, 0, 0, '', '', 0, '', 'vb', '', 0, 1, 0, 0, NULL),
(23103, 3, '', 0, 'TUNOI', 'b1b12a7b60a39e698e9e850ae68b6629', '2014-03-21', 'taylah_dahl@tlevelboost.net', 0, '', '', '', '', '', '', '', 2, 0, 'New Member', 0, 1395432521, 0, 1395432521, 1396234216, 0, 0, 0, 0, 4, '5', 0, 0, 0, 0, 0, 3194967, '03-27-1976', '1976-03-27', -1, -1, '184.154.174.12', 0, 1, 0, 0, -1, 0, 0, '5{v^b~d"$(aH!l(_&t(R_6l:>ABL|.', 0, 0, 0, '', 0, 0, 0, 0, 0, 0, 0, 0, 0, 0, 0, 0, '', '', 0, '', 'vb', '', 0, 1, 0, 0, NULL),
(23007, 3, '', 0, 'JK15', 'ae614c07a47bec0d6e6cf0843b9dd16d', '2014-03-17', 'abrasivetail4yg95o@outlook.com', 0, '', '', '', '', '', '', '', 2, 0, 'New Member', 0, 1395045546, 0, 1395045546, 1395045546, 0, 0, 0, 0, 4, '5', 0, 0, 0, 0, 0, 3194967, '12-08-1975', '1975-12-08', -1, -1, '192.3.183.114', 0, 1, 0, 0, -1, 0, 0, 'Y#qcKB!1lnBqX&[z`Q,J[:0sGhg{ZZ', 0, 0, 0, '', 0, 0, 0, 0, 0, 0, 0, 0, 0, 0, 0, 0, '', '', 0, '', 'vb', '', 0, 1, 0, 0, NULL),
(23008, 2, '', 0, 'hans', '77ea60075830558a6b5348d7a5eee35c', '2014-03-17', 'hans.enslin@telalresort.ae', 0, '', '', '', '', '', '', '', 2, 0, 'New Member', 0, 1395047135, 0, 1395047135, 1395047135, 0, 0, 0, 0, 4, '5', 0, 0, 0, 0, 0, 3194967, '01-23-1971', '1971-01-23', -1, -1, '2.50.129.145', 0, 1, 0, 0, -1, 0, 0, '\\XwDb^,k,>;USR?:}HkPM:09)Ct3d>', 0, 0, 0, '', 0, 0, 0, 0, 0, 0, 0, 0, 0, 0, 0, 0, '', '', 0, '', 'vb', '', 0, 1, 0, 0, NULL),
(23009, 3, '', 0, 'DGale', '480dcfabff30db5e1e6c30719ac37ddd', '2014-03-17', 'talishavnlupold@yahoo.com', 0, '', '', '', '', '', '', '', 2, 0, 'New Member', 0, 1395049949, 0, 1395049949, 1406125351, 0, 0, 0, 0, 4, '5', 0, 0, 0, 0, 0, 3194967, '11-08-1984', '1984-11-08', -1, -1, '192.227.253.191', 0, 1, 0, 0, -1, 0, 0, 'w6]sj:rCUx*.084~ew2pFj\\z1w&~bR', 0, 0, 0, '', 0, 0, 0, 0, 0, 0, 0, 0, 0, 0, 0, 0, '', '', 0, '', 'vb', '', 0, 1, 0, 0, NULL),
(23010, 2, '', 0, 'umarhayat1014', '7be528fe9a88de8b33f5828090560735', '2014-03-17', 'umarhayat1014@gmail.com', 0, '', '', '', '', '', '', '', 2, 0, 'New Member', 0, 1395052591, 0, 1395052591, 1395052591, 0, 0, 0, 0, 4, '5', 0, 0, 0, 0, 0, 3194967, '07-06-1993', '1993-07-06', -1, -1, '111.68.99.250', 0, 1, 0, 0, -1, 0, 0, 'c;<cXv2|)@Jg&)YbL6%x9~!T**cQb`', 0, 0, 0, '', 0, 0, 0, 0, 0, 0, 0, 0, 0, 0, 0, 0, '', '', 0, '', 'vb', '', 0, 1, 0, 0, NULL),
(23163, 3, '', 0, 'STUAQ', 'fc6d31951056cf12b52124db4411b424', '2014-03-25', 'tangysummary604120@outlook.com', 0, '', '', '', '', '', '', '', 2, 0, 'New Member', 0, 1395784652, 0, 1395784652, 1395784652, 0, 0, 0, 0, 4, '5', 0, 0, 0, 0, 0, 3194967, '04-20-1974', '1974-04-20', -1, -1, '173.236.55.172', 0, 1, 0, 0, -1, 0, 0, 'N]_gH7.s0])H&Y)%jTEV_{nw#tPp4-', 0, 0, 0, '', 0, 0, 0, 0, 0, 0, 0, 0, 0, 0, 0, 0, '', '', 0, '', 'vb', '', 0, 1, 0, 0, NULL),
(23098, 2, '', 0, 'sadiqahmad', '5c3dff6561087fc4abaa72f2ff6186fb', '2014-03-21', 'diamondstar786@hotmail.com', 0, '', '', '', '', '', '', '', 2, 0, 'New Member', 0, 1395386290, 0, 1395386794, 1395386794, 0, 0, 0, 0, 4, '5', 0, 0, 0, 0, 0, 3194967, '05-27-1986', '1986-05-27', -1, -1, '182.181.234.114', 0, 1, 0, 0, -1, 0, 0, 'VvALn;hCC/2?`QUZ9HIv_uhhDO@aR!', 0, 0, 0, '', 0, 0, 0, 0, 0, 0, 0, 0, 0, 0, 0, 0, '', '', 0, '', 'vb', '', 0, 1, 0, 0, NULL),
(23071, 3, '', 0, 'K1919', '24afe225486ef71e384239506a90c0fd', '2014-03-19', 'tiannancbrungard@yahoo.com', 0, '', '', '', '', '', '', '', 2, 0, 'New Member', 0, 1395226808, 0, 1395226808, 1395226808, 0, 0, 0, 0, 4, '5', 0, 0, 0, 0, 0, 3194967, '02-15-1984', '1984-02-15', -1, -1, '5.255.72.212', 0, 1, 0, 0, -1, 0, 0, '_o1|+hRIb''9Po6ckxC-Q#uuFe''p;xa', 0, 0, 0, '', 0, 0, 0, 0, 0, 0, 0, 0, 0, 0, 0, 0, '', '', 0, '', 'vb', '', 0, 1, 0, 0, NULL),
(23072, 2, '', 0, '9mmfan', '9dd65f9f2af9fe8a2ecd2c2aeabb7803', '2014-03-19', 'taufeeqkhalid@yahoo.com', 0, '', '', '', '', '', '', '', 2, 0, 'New Member', 0, 1395229682, 0, 1395229807, 1395315748, 0, 0, 0, 0, 4, '5', 0, 0, 0, 0, 0, 3194967, '03-05-1987', '1987-03-05', -1, -1, '182.185.28.178', 0, 1, 0, 0, -1, 0, 0, '1i%eV_H4&}z0EG1kFq^<"g?!~!u''fR', 0, 0, 0, '', 0, 0, 0, 0, 0, 0, 0, 0, 0, 0, 0, 0, '', '', 0, '', 'vb', '', 0, 1, 0, 0, NULL),
(23082, 2, '', 0, 'Rcpak', 'a128a853212ee517fcad9802df093bd6', '2014-03-20', 'Salman.Dard@gmail.com', 7, '', '', '', '', '', '', '', 2, 0, 'Rookie', 0, 1395290170, 0, 1430742567, 1462358901, 1462358900, 493726, 30, 0, 4, '5', 0, 0, 0, 0, 0, 3163223, '10-01-1973', '1973-10-01', -1, 1, '101.50.80.110', 0, 0, 0, 0, -1, 0, 0, 'd]vC''A>]1Cor7yo*Jq}X(~VH*|:f4R', 0, 0, 0, '', 0, 0, 17, 1, 0, 0, 0, 0, 0, 0, 0, 0, '2d2d15c0e063094cbce32f4c1db3ebbf', '', 0, '', 'vb', '', 0, 1, 0, 0, NULL),
(23074, 16, '', 0, 'abbaskhan', 'f583e1b762e99c50db525683f0f00ca1', '2014-03-19', 'abbaskhan5610@gmail.com', 0, '', '', '', '', '', '', '', 2, 0, 'Banned', 0, 1395242252, 0, 1405435130, 1405435130, 1405380237, 450332, 42, 0, 4, '5', 0, 0, 0, 0, 0, 3194967, '09-10-1975', '1975-09-10', -1, -1, '39.44.198.50', 0, 1, 1405242313, 0, -1, 0, 0, '4uPIa''N6c@#HQT*C.K?xlKJ&k.C<e/', 0, 0, 0, '', 0, 0, 5, 0, 1, 0, 0, 0, 0, 0, 0, 0, '', '', 0, '', 'vb', '', 0, 1, 0, 0, NULL),
(23081, 3, '', 0, 'WFXW', 'ee3c829728c6d0cbda1f3d5faa67cd94', '2014-03-20', 'gratisunderdog28237@outlook.com', 0, '', '', '', '', '', '', '', 2, 0, 'New Member', 0, 1395281865, 0, 1395281865, 1395281865, 0, 0, 0, 0, 4, '5', 0, 0, 0, 0, 0, 3194967, '12-15-1979', '1979-12-15', -1, -1, '162.218.234.224', 0, 1, 0, 0, -1, 0, 0, 'M.w!Sbc->/!b7VKNJ{^)^MkCt+G{IV', 0, 0, 0, '', 0, 0, 0, 0, 0, 0, 0, 0, 0, 0, 0, 0, '', '', 0, '', 'vb', '', 0, 1, 0, 0, NULL),
(23076, 3, '', 0, 'regorasyandexty2772', 'fbae29abc3316325c2e59573f1b22657', '2014-03-19', 'regorasyandexty@ymail.com', 0, '', '', '', '', '', '', '', 2, 0, 'New Member', 0, 1395245810, 0, 1395245810, 1395245810, 0, 0, 0, 0, 4, '5', 0, 0, 0, 0, 0, 3195031, '04-02-1987', '1987-04-02', -1, -1, '193.106.31.114', 0, 1, 0, 0, -1, 0, 0, 'WvD{;!#vpgQB9gj&g)IIhr4Ku%*H?&', 0, 0, 0, '', 0, 0, 0, 0, 0, 0, 0, 0, 0, 0, 0, 0, '', '', 0, '', 'vb', '', 0, 1, 0, 0, NULL),
(23019, 3, '', 0, 'Basit subhani', 'd55a1918d7dca7cd3cc705d4273c80d1', '2014-03-17', 'Freetoride35@yahoo.com', 0, '', '', '', '', '', '', '', 2, 0, 'New Member', 0, 1395064628, 0, 1395064628, 1395064774, 0, 0, 0, 0, 4, '5', 0, 0, 0, 0, 0, 3194967, '03-18-1991', '1991-03-18', -1, -1, '139.190.3.149', 0, 1, 0, 0, -1, 0, 0, 'gsG\\o<eu#C.!nq.Mvk]Iv''b_$m`LK}', 0, 0, 0, '', 0, 0, 0, 0, 0, 0, 0, 0, 0, 0, 0, 0, '', '', 0, '', 'vb', '', 0, 1, 0, 0, NULL),
(23020, 3, '', 0, 'Asif Chaudhry', 'e23d4dfc8ff18219c1b44b5060738d23', '2014-03-17', 'asif.taj@hotmail.com', 0, '', '', '', '', '', '', '', 2, 0, 'New Member', 0, 1395067926, 0, 1395067926, 1395068207, 0, 0, 0, 0, 4, '5', 0, 0, 0, 0, 0, 3194967, '02-18-1978', '1978-02-18', -1, -1, '85.194.83.210', 0, 1, 0, 0, -1, 0, 0, 'kD)qztjKhD6FqI=I)8z}X5sA>l"|W=', 0, 0, 0, '', 0, 0, 0, 0, 0, 0, 0, 0, 0, 0, 0, 0, '', '', 0, '', 'vb', '', 0, 1, 0, 0, NULL),
(23092, 3, '', 0, 'CStreet', '39cf0f0ed39330987bcb14219fa3639a', '2014-03-20', '1med.ieregsa@gmail.com', 0, '', '', '', '', '', '', '', 2, 0, 'New Member', 0, 1395335070, 0, 1395335070, 1395767430, 0, 0, 0, 0, 4, '5', 0, 0, 0, 0, 0, 3194967, '11-10-1971', '1971-11-10', -1, -1, '177.43.210.170', 0, 1, 0, 0, -1, 0, 0, '0hEH0QgdNI@0TcC<D(7c%GhPGlYxFZ', 0, 0, 0, '', 0, 0, 0, 0, 0, 0, 0, 0, 0, 0, 0, 0, '', '', 0, '', 'vb', '', 0, 1, 0, 0, NULL),
(23022, 2, '', 0, 'grandpower', '6be70acc8262d93a298e97eeaeb0ee5b', '2014-03-17', 'waqasandbrothers@gmail.com', 0, '', '', '', '', '', '', '', 2, 0, 'New Member', 0, 1395072497, 0, 1395073446, 1395073946, 0, 0, 0, 0, 4, '5', 0, 0, 0, 0, 0, 3194967, '07-22-1984', '1984-07-22', -1, -1, '23.27.220.177', 0, 1, 0, 0, -1, 0, 0, 'B!^eb7n|iuoF$0<1*hZ`[l&f-efO3?', 0, 0, 0, '', 0, 0, 0, 0, 0, 0, 0, 0, 0, 0, 0, 0, '', '', 0, '', 'vb', '', 0, 1, 0, 0, NULL),
(23023, 2, '', 0, 'mk122', '067f19b1532f419a44481ce17bc5bc90', '2014-03-17', 'mk122@hotmail.com', 0, '', '', '', '', '', '', '', 2, 0, 'New Member', 0, 1395073996, 0, 1395073996, 1395075479, 0, 0, 0, 0, 4, '5', 0, 0, 0, 0, 0, 3194967, '01-15-1986', '1986-01-15', -1, -1, '39.32.234.226', 0, 1, 0, 0, -1, 0, 0, 'xi2CR@B\\A1V`>x:Z#t_`@X$giCO(`/', 0, 0, 0, '', 0, 0, 0, 0, 0, 0, 0, 0, 0, 0, 0, 0, '', '', 0, '', 'vb', '', 0, 1, 0, 0, NULL),
(23078, 3, '', 0, 'GBurkett', 'ae3bc95313b6fb06e0bcf225dcbedd9f', '2014-03-19', 'hildenrgronlund@yahoo.com', 0, '', '', '', '', '', '', '', 2, 0, 'New Member', 0, 1395253686, 0, 1395253686, 1395259654, 0, 0, 0, 0, 4, '5', 0, 0, 0, 0, 0, 3194967, '11-26-1985', '1985-11-26', -1, -1, '198.55.112.177', 0, 1, 0, 0, -1, 0, 0, ']_Qhqn1)BZcyK''Uyo&|@EL#!CwsOSR', 0, 0, 0, '', 0, 0, 0, 0, 0, 0, 0, 0, 0, 0, 0, 0, '', '', 0, '', 'vb', '', 0, 1, 0, 0, NULL),
(23108, 2, '', 0, 'Pakiboy', '34fd33935b13679b36e8c8d194604cdc', '2014-03-22', 'alpinefreezer@outlook.com', 0, '', '', '', '', '', '', '', 2, 0, 'New Member', 0, 1395469313, 0, 1430656708, 1430656708, 0, 0, 0, 0, 4, '5', 0, 0, 0, 0, 0, 3194967, '06-12-1990', '1990-06-12', -1, -1, '182.186.179.183', 0, 1, 0, 0, -1, 0, 0, '|59IaRmRR{MSD!3KjvhiU(\\l~9Y/`Z', 0, 0, 0, '', 0, 0, 2, 0, 0, 0, 0, 0, 0, 0, 0, 0, '', '', 0, '', 'vb', '', 0, 1, 0, 0, NULL),
(23181, 3, '', 0, 'S2692', '402a7f481ea7c5e34b8bd3630b7754ad', '2014-03-26', 'stewart-parra@outlook.com', 0, '', '', '', '', '', '', '', 2, 0, 'New Member', 0, 1395877013, 0, 1395877013, 1396311760, 0, 0, 0, 0, 4, '5', 0, 0, 0, 0, 0, 3194967, '12-26-1974', '1974-12-26', -1, -1, '186.95.169.135', 0, 1, 0, 0, -1, 0, 0, '[yHZ"6_>)ag_d4rzIA9fT3s+JBgrZ2', 0, 0, 0, '', 0, 0, 0, 0, 0, 0, 0, 0, 0, 0, 0, 0, '', '', 0, '', 'vb', '', 0, 1, 0, 0, NULL),
(23140, 3, '', 0, 'HFlinders', '199102c3fa664307f94c0fa2cacaa639', '2014-03-25', 'jaggeddancer513vh61@outlook.com', 0, '', '', '', '', '', '', '', 2, 0, 'New Member', 0, 1395711489, 0, 1395711489, 1396259284, 0, 0, 0, 0, 4, '5', 0, 0, 0, 0, 0, 3194967, '07-17-1970', '1970-07-17', -1, -1, '188.165.25.181', 0, 1, 0, 0, -1, 0, 0, '}Jg:Bd\\<x|2Et$"2hB;=W[nOy$WwJ/', 0, 0, 0, '', 0, 0, 0, 0, 0, 0, 0, 0, 0, 0, 0, 0, '', '', 0, '', 'vb', '', 0, 1, 0, 0, NULL),
(23190, 2, '', 0, 'zoraiz', '9bcc4b584edec272f495a6dc98f51bca', '2014-03-27', 'xoraix@hotmail.com', 0, '', '', '', '', '', '', '', 2, 0, 'New Member', 0, 1395917878, 0, 1395918646, 1395923051, 0, 0, 0, 0, 4, '5', 0, 0, 0, 0, 0, 3194967, '10-11-1987', '1987-10-11', -1, -1, '119.157.151.65', 0, 1, 0, 0, -1, 0, 0, '^6;o!vLta1l}k=r:@@JcB>QFQ:|#+J', 0, 0, 0, '', 0, 0, 0, 0, 0, 0, 0, 0, 0, 0, 0, 0, '', '', 0, '', 'vb', '', 0, 1, 0, 0, NULL),
(23142, 2, '', 0, 'Mughees', 'b0c9ec7e43aa4807aac5ad30a3eeca2f', '2014-04-11', 'mugheesahmed@gmail.com', 0, '', '', '', '', '', '', '', 2, 0, 'Rookie', 0, 1395724994, 0, 1478581734, 1478931890, 1478581733, 498923, 25, 0, 4, '5', 0, 45, 0, 0, 0, 3194967, '08-11-0000', '0000-08-11', -1, -1, '221.120.204.162', 0, 1, 0, 0, -1, 0, 0, 'jl/ZEbD,zB;yoF;U|</e''[N|UiUeV^', 0, 0, 0, '', 0, 0, 3, 0, 0, 0, 0, 0, 0, 0, 0, 0, '2c0f4fcbe5554dddce58394ea1460ec0', '', 0, '', 'vb', '', 0, 1, 0, 0, NULL),
(23238, 3, '', 0, 'bangelasussd9384', '5b756593be550edeaab5c38ad9f0ac1d', '2014-03-31', 'bangelasussd@ymail.com', 0, '', '', '', '', '', '', '', 2, 0, 'New Member', 0, 1396301275, 0, 1396301275, 1396301275, 0, 0, 0, 0, 4, '1', 0, 0, 0, 0, 0, 3195031, '02-26-1980', '1980-02-26', -1, -1, '204.124.83.134', 0, 1, 0, 0, -1, 0, 0, 'Fm@L/ly0~e``8T3go}nJo?/q''5MS_o', 0, 0, 0, '', 0, 0, 0, 0, 0, 0, 0, 0, 0, 0, 0, 0, '', '', 0, '', 'vb', '', 0, 1, 0, 0, NULL),
(23208, 3, '', 0, 'GMcLeay', 'ad17b7d1d06283467b5bf105b4a77d06', '2014-03-28', 'deettakql007@hotmail.com', 0, '', '', '', '', '', '', '', 2, 0, 'New Member', 0, 1396037035, 0, 1396037035, 1396037035, 0, 0, 0, 0, 4, '5', 0, 0, 0, 0, 0, 3194967, '07-12-1982', '1982-07-12', -1, -1, '93.118.67.41', 0, 1, 0, 0, -1, 0, 0, '6QL,&i6,f$|7<(5LU1dOd-{aqo+ag7', 0, 0, 0, '', 0, 0, 0, 0, 0, 0, 0, 0, 0, 0, 0, 0, '', '', 0, '', 'vb', '', 0, 1, 0, 0, NULL),
(23145, 3, '', 0, 'faheemg2', 'e0821c6e4d20d23a1a3045de9ac83537', '2014-03-25', 'fahimg2@gmail.com', 0, '', '', '', '', '', '', '', 2, 0, 'New Member', 0, 1395737147, 0, 1395886393, 1396081065, 0, 0, 0, 0, 4, '5', 0, 0, 0, 0, 0, 3194967, '01-11-1996', '1996-01-11', -1, -1, '119.160.118.155', 2259, 1, 0, 0, -1, 0, 0, 'E:/*?(~w.PA~r''7T%MnGDXHKYC1QvR', 0, 0, 0, '', 0, 0, 0, 0, 0, 0, 0, 0, 0, 0, 0, 0, '', '', 0, '', 'vb', '', 0, 1, 0, 0, NULL),
(23174, 2, '', 0, 'chaudhary_490', '505a64587207a4a5fd04904cb4580a42', '2014-03-26', 'naeemkhalid999@hotmail.com', 0, '', '', '', '', '', '', '', 2, 0, 'New Member', 0, 1395831805, 0, 1395831805, 1395832027, 0, 0, 0, 0, 4, '5', 0, 0, 0, 0, 0, 3194967, '12-25-1988', '1988-12-25', -1, -1, '182.178.209.97', 18803, 1, 0, 0, -1, 0, 0, '{j`DDjg$5v4C,y\\&~7F95ax:H0I[<c', 0, 0, 0, '', 0, 0, 0, 0, 0, 0, 0, 0, 0, 0, 0, 0, '', '', 0, '', 'vb', '', 0, 1, 0, 0, NULL),
(23147, 3, '', 0, 'FBertram', '3a309c386d2a0b14318569007ffbfe20', '2014-03-25', 'assorteddiva242ux83@outlook.com', 0, '', '', '', '', '', '', '', 2, 0, 'New Member', 0, 1395741325, 0, 1395741325, 1395741325, 0, 0, 0, 0, 4, '5', 0, 0, 0, 0, 0, 3194967, '06-15-1971', '1971-06-15', -1, -1, '69.12.77.169', 0, 1, 0, 0, -1, 0, 0, '?^B.(pEJ@DE.qQ<HXU,\\v*8`D*b0uD', 0, 0, 0, '', 0, 0, 0, 0, 0, 0, 0, 0, 0, 0, 0, 0, '', '', 0, '', 'vb', '', 0, 1, 0, 0, NULL),
(23148, 3, '', 0, 'bannatpttay5599', 'cab62c530b484d5719880a2e0e8b92f7', '2014-03-25', 'bannatpttay@ymail.com', 0, '', '', '', '', '', '', '', 2, 0, 'New Member', 0, 1395749015, 0, 1395749015, 1395749015, 0, 0, 0, 0, 4, '8', 0, 0, 0, 0, 0, 3195031, '10-14-1975', '1975-10-14', -1, -1, '91.213.72.253', 0, 1, 0, 0, -1, 0, 0, '?3NtrS_pnuF:(I3mal!s@P-''fl&]D*', 0, 0, 0, '', 0, 0, 0, 0, 0, 0, 0, 0, 0, 0, 0, 0, '', '', 0, '', 'vb', '', 0, 1, 0, 0, NULL),
(23149, 3, '', 0, 'IsmailKhann', 'e26e4e6a1d9280ec57ad782bf5550dea', '2016-08-05', 'ismail.khann@gmail.com', 0, '', '', '', '', '', '', '', 2, 0, 'New Member', 0, 1395754709, 0, 1399910192, 1470398016, 0, 0, 0, 0, 4, '5', 0, 0, 0, 0, 0, 3194967, '01-23-1985', '1985-01-23', -1, -1, '115.186.137.69', 0, 1, 0, 0, -1, 0, 0, '}ysPQ-~mI8d$rGPy82B*''N$3R&XPzh', 0, 0, 0, '', 0, 0, 0, 0, 0, 0, 0, 0, 0, 0, 0, 0, '', '', 0, '', 'vb', '', 0, 1, 0, 0, NULL),
(23151, 3, '', 0, 'SFNTJ', '7e3f7fce2d7ee3b0575b12581452828d', '2014-03-25', 'availablelunati92@outlook.com', 0, '', '', '', '', '', '', '', 2, 0, 'New Member', 0, 1395760929, 0, 1395760929, 1395768295, 0, 0, 0, 0, 4, '5', 0, 0, 0, 0, 0, 3194967, '07-25-1976', '1976-07-25', -1, -1, '189.59.219.202', 0, 1, 0, 0, -1, 0, 0, '3HLnI>}l1''3O1JXP9bR;gkRir\\4QqL', 0, 0, 0, '', 0, 0, 0, 0, 0, 0, 0, 0, 0, 0, 0, 0, '', '', 0, '', 'vb', '', 0, 1, 0, 0, NULL),
(23170, 3, '', 0, 'Muddassar', '96e8cc744c9e434bcfda20aa64830ae7', '2014-03-26', 'muddassarjameel@gmail.com', 0, '', '', '', '', '', '', '', 2, 0, 'New Member', 0, 1395818584, 0, 1395819448, 1395819448, 0, 0, 0, 0, 4, '5', 0, 0, 0, 0, 0, 3194967, '09-02-1981', '1981-09-02', -1, -1, '202.69.13.179', 0, 1, 0, 0, -1, 0, 0, 'bqp+_#e6\\[(_Z+g0Bkg"VzXVE|B''@.', 0, 0, 0, '', 0, 0, 0, 0, 0, 0, 0, 0, 0, 0, 0, 0, '', '', 0, '', 'vb', '', 0, 1, 0, 0, NULL);
INSERT INTO `user` (`userid`, `usergroupid`, `membergroupids`, `displaygroupid`, `username`, `password`, `passworddate`, `email`, `styleid`, `parentemail`, `homepage`, `icq`, `aim`, `yahoo`, `msn`, `skype`, `showvbcode`, `showbirthday`, `usertitle`, `customtitle`, `joindate`, `daysprune`, `lastvisit`, `lastactivity`, `lastpost`, `lastpostid`, `posts`, `reputation`, `reputationlevelid`, `timezoneoffset`, `pmpopup`, `avatarid`, `avatarrevision`, `profilepicrevision`, `sigpicrevision`, `options`, `birthday`, `birthday_search`, `maxposts`, `startofweek`, `ipaddress`, `referrerid`, `languageid`, `emailstamp`, `threadedmode`, `autosubscribe`, `pmtotal`, `pmunread`, `salt`, `ipoints`, `infractions`, `warnings`, `infractiongroupids`, `infractiongroupid`, `adminoptions`, `profilevisits`, `friendcount`, `friendreqcount`, `vmunreadcount`, `vmmoderatedcount`, `socgroupinvitecount`, `socgroupreqcount`, `pcunreadcount`, `pcmoderatedcount`, `gmmoderatedcount`, `assetposthash`, `fbuserid`, `fbjoindate`, `fbname`, `logintype`, `fbaccesstoken`, `bloggroupreqcount`, `showblogcss`, `importuserid`, `newrepcount`, `panjo_selling`) VALUES
(23154, 3, '', 0, 'ZAIN26', '550fbe2625b1b666d308eed3c7314c9b', '2014-03-25', 'zainsh21@yahoo.com', 0, '', '', '', '', '', '', '', 2, 0, 'New Member', 0, 1395768294, 0, 1395768294, 1395768558, 0, 0, 0, 0, 4, '5', 0, 0, 0, 0, 0, 3194967, '05-07-1995', '1995-05-07', -1, -1, '116.71.174.99', 848, 1, 0, 0, -1, 0, 0, 'H$|Oop~&X9|(X>FpM\\fxlt4i`&XTR4', 0, 0, 0, '', 0, 0, 0, 0, 0, 0, 0, 0, 0, 0, 0, 0, '', '', 0, '', 'vb', '', 0, 1, 0, 0, NULL),
(23234, 2, '', 0, 'TheSaint', '6fd03e739269589054afcb36b2ce55b4', '2014-03-31', 'asimjibran@yahoo.com', 0, '', '', '', '', '', '', '', 2, 0, 'New Member', 0, 1396267700, 0, 1396267700, 1396267700, 0, 0, 0, 0, 4, '5', 0, 0, 0, 0, 0, 3194967, '04-22-1983', '1983-04-22', -1, -1, '119.154.115.122', 8123, 1, 0, 0, -1, 0, 0, 'bTh\\n\\4P"DS<)#2CdN<''?GJMgl,C.e', 0, 0, 0, '', 0, 0, 0, 0, 0, 0, 0, 0, 0, 0, 0, 0, '', '', 0, '', 'vb', '', 0, 1, 0, 0, NULL),
(23157, 2, '', 0, 'BajwaApex', '84e60943a8f7a9b08cfc372324efb9db', '2014-03-25', 'zaki_lasallian@yahoo.com', 0, '', '', '', '', '', '', '', 2, 0, 'New Member', 0, 1395774533, 0, 1396571816, 1396810405, 1395956553, 432134, 2, 0, 4, '5', 0, 0, 0, 0, 0, 3194967, '01-20-1994', '1994-01-20', -1, -1, '39.36.116.55', 0, 1, 0, 0, -1, 0, 0, 'AtvEJl|Z@t`NA^@VWBkPcRBEYPUxPk', 0, 0, 0, '', 0, 0, 1, 1, 0, 0, 0, 0, 0, 0, 0, 0, '7f4fdd910cdc5170916b39077c012b7b', '', 0, '', 'vb', '', 0, 1, 0, 0, NULL),
(23177, 3, '', 0, 'markhor', 'd307cec764357e9339743e74d9037b2c', '2014-03-26', 'saqibjanjua1985@gmail.com', 0, '', '', '', '', '', '', '', 2, 0, 'New Member', 0, 1395859347, 0, 1395859693, 1415630027, 0, 0, 0, 0, 4, '5', 0, 0, 0, 0, 0, 3194967, '02-03-1985', '1985-02-03', -1, -1, '39.45.198.187', 0, 1, 0, 0, -1, 0, 0, 'PE6CG+rB`aO#CFOfXYgxq?#d}00tqf', 0, 0, 0, '', 0, 0, 0, 0, 0, 0, 0, 0, 0, 0, 0, 0, '', '', 0, '', 'vb', '', 0, 1, 0, 0, NULL),
(23194, 2, '', 0, 'Prince khan7009', 'bfdb469029dd787519f373fc46449cc1', '2014-09-26', 'amirshehzadkhan@ymail.com', 0, '', '', '', '', '', '', '', 2, 0, 'New Member', 0, 1395930756, 0, 1395932236, 1395939374, 0, 0, 0, 0, 4, '5', 0, 0, 0, 0, 0, 3195031, '03-10-1989', '1989-03-10', -1, -1, '182.185.45.216', 5648, 1, 0, 0, -1, 0, 0, 'it{UD[=m!^Bv7''FU?CjZu}FPP]93/n', 0, 0, 0, '', 0, 0, 2, 0, 0, 0, 0, 0, 0, 0, 0, 0, '', '', 0, '', 'vb', '', 0, 1, 0, 0, NULL),
(23160, 3, '', 0, 'saleem008', 'c221435394f346d86a4a9724d6f53081', '2014-03-25', 's8888808@gmail.com', 0, '', '', '', '', '', '', '', 2, 0, 'New Member', 0, 1395779000, 0, 1395779242, 1395779242, 0, 0, 0, 0, 4, '5', 0, 0, 0, 0, 0, 3194967, '01-07-1983', '1983-01-07', -1, -1, '42.83.86.17', 0, 1, 0, 0, -1, 0, 0, 'YQwAZgIY37D5ghS''"R/9WRY;tA#?Nm', 0, 0, 0, '', 0, 0, 0, 0, 0, 0, 0, 0, 0, 0, 0, 0, '', '', 0, '', 'vb', '', 0, 1, 0, 0, NULL),
(23207, 3, '', 0, 'raja ahmad faraz turk', 'e2d3fd8f6539e2119cd162cee5b5b3e2', '2014-03-28', 'rajaahmadfarazazad@hotmail.com', 0, '', '', '', '', '', '', '', 2, 0, 'New Member', 0, 1396029142, 0, 1396030648, 1396030648, 0, 0, 0, 0, 4, '5', 0, 0, 0, 0, 0, 3194967, '01-04-1981', '1981-01-04', -1, -1, '119.154.196.224', 6386, 1, 0, 0, -1, 0, 0, 'ogg#RPw]2Ho3X$(Y[a:%Q~?r''Yze{W', 0, 0, 0, '', 0, 0, 1, 0, 0, 0, 0, 0, 0, 0, 0, 0, '', '', 0, '', 'vb', '', 0, 1, 0, 0, NULL),
(23179, 3, '', 0, 'VBeamon', '05d8a3ac6e37246eac2c27e00feb8f8a', '2014-03-26', 'vicky-beamon@active-updates.tk', 0, '', '', '', '', '', '', '', 2, 0, 'New Member', 0, 1395872760, 0, 1395872760, 1395872760, 0, 0, 0, 0, 4, '5', 0, 0, 0, 0, 0, 3194967, '04-01-1984', '1984-04-01', -1, -1, '198.143.136.24', 0, 1, 0, 0, -1, 0, 0, 'Sskay6<vm*-qYE"1"<|##h-H4[#LUe', 0, 0, 0, '', 0, 0, 0, 0, 0, 0, 0, 0, 0, 0, 0, 0, '', '', 0, '', 'vb', '', 0, 1, 0, 0, NULL),
(23197, 2, '', 0, 'Bunnyguns', '112a235eff5c77316c28ccae7b13c366', '2014-03-27', 'husnain232010@hotmail.com', 0, '', '', '', '', '', '', '', 2, 0, 'New Member', 0, 1395937446, 0, 1395937446, 1395937494, 0, 0, 0, 0, 4, '5', 0, 0, 0, 0, 0, 3194967, '11-26-1991', '1991-11-26', -1, -1, '88.8.81.121', 14250, 1, 0, 0, -1, 0, 0, ')|8xQ0d`ZR:_3WK\\N98Z@E6##4jpdN', 0, 0, 0, '', 0, 0, 0, 0, 0, 0, 0, 0, 0, 0, 0, 0, '', '', 0, '', 'vb', '', 0, 1, 0, 0, NULL),
(23193, 2, '', 0, 'alishah89', '8f70d49e25eda231ee275ff379a7c2ca', '2014-03-27', 'alishah89@hotmail.com', 0, '', '', '', '', '', '', '', 2, 0, 'New Member', 0, 1395925596, 0, 1395925596, 1395926593, 0, 0, 0, 0, 4, '5', 0, 0, 0, 0, 0, 3194967, '03-18-1976', '1976-03-18', -1, -1, '110.38.11.41', 0, 1, 0, 0, -1, 0, 0, '<)ZT3J2FX:MrcQtJIj,+J1s~oduv~{', 0, 0, 0, '', 0, 0, 0, 0, 0, 0, 0, 0, 0, 0, 0, 0, '', '', 0, '', 'vb', '', 0, 1, 0, 0, NULL),
(23187, 3, '', 0, 'CRobin', 'a8bffacead3378c0a8b4de14a73a48d4', '2014-03-27', 'charley-robin@rsawebsites.tk', 0, '', '', '', '', '', '', '', 2, 0, 'New Member', 0, 1395902576, 0, 1395902576, 1395902576, 0, 0, 0, 0, 4, '5', 0, 0, 0, 0, 0, 3194967, '08-08-1983', '1983-08-08', -1, -1, '188.240.143.170', 0, 1, 0, 0, -1, 0, 0, 'r9X%AFFn4>$aZxo2"Hl2Kew,yFb(Y=', 0, 0, 0, '', 0, 0, 0, 0, 0, 0, 0, 0, 0, 0, 0, 0, '', '', 0, '', 'vb', '', 0, 1, 0, 0, NULL),
(23188, 3, '', 0, 'CSaragosa', '3bebcde3af78f84d0a01b965fa4cc867', '2014-03-27', 'youthfuldepictiob66@outlook.com', 0, '', '', '', '', '', '', '', 2, 0, 'New Member', 0, 1395904137, 0, 1395904137, 1395904137, 0, 0, 0, 0, 4, '5', 0, 0, 0, 0, 0, 3194967, '08-10-1970', '1970-08-10', -1, -1, '107.161.182.235', 0, 1, 0, 0, -1, 0, 0, 'Bk$P_5|!riu4$N(Xy!o@B[k\\>o1K>+', 0, 0, 0, '', 0, 0, 0, 0, 0, 0, 0, 0, 0, 0, 0, 0, '', '', 0, '', 'vb', '', 0, 1, 0, 0, NULL),
(23189, 3, '', 0, 'm imran', '3898cfc577271f7a47af6b005f50d57f', '2014-03-27', 'samivj8@gmail.com', 0, '', '', '', '', '', '', '', 2, 0, 'New Member', 0, 1395909142, 0, 1396979880, 1396979880, 0, 0, 0, 0, 4, '5', 0, 0, 0, 0, 0, 3194967, '03-02-1986', '1986-03-02', -1, -1, '27.255.57.213', 7419, 1, 0, 0, -1, 0, 0, '0h./7=9+HCE5B''}Y3yR{''T6Zd+(3Yp', 0, 0, 0, '', 0, 0, 1, 0, 0, 0, 0, 0, 0, 0, 0, 0, '', '', 0, '', 'vb', '', 0, 1, 0, 0, NULL),
(23246, 2, '', 0, 'guns4defence', '6a8d283d471f28284f02063ed4a54c52', '2014-04-02', 'gunsfordefence2012@gmail.com', 0, '', '', '', '', '', '', '', 2, 0, 'New Member', 0, 1396434721, 0, 1396434721, 1396435686, 0, 0, 0, 0, 4, '5', 0, 0, 0, 0, 0, 3194967, '02-01-1988', '1988-02-01', -1, -1, '202.5.151.184', 19403, 1, 0, 0, -1, 0, 0, '@>,+x1\\xk;#qWhEj?4Hv:LK_s2-)-j', 0, 0, 0, '', 0, 0, 0, 0, 0, 0, 0, 0, 0, 0, 0, 0, '', '', 0, '', 'vb', '', 0, 1, 0, 0, NULL),
(23239, 2, '', 0, 'Ovais_1994@hotmail.com', 'dfc1f5295feddeb7061933876a0b30cf', '2014-04-01', 'Ovais_1994@hotmail.com', 0, '', '', '', '', '', '', '', 2, 0, 'New Member', 0, 1396307374, 0, 1396427748, 1396428388, 1396385153, 432587, 2, 0, 4, '-12', 0, 0, 0, 0, 0, 3194967, '02-19-1994', '1994-02-19', -1, -1, '139.190.129.49', 0, 1, 0, 0, -1, 0, 0, '4pc=U?z4''_e(Qaf{#p|l)1U95K"NrX', 0, 0, 0, '', 0, 0, 2, 0, 0, 0, 0, 0, 0, 0, 0, 0, '', '', 0, '', 'vb', '', 0, 1, 0, 0, NULL),
(23202, 3, '', 0, 'SFortenbe', 'fff90414ec99162677f85ec0ef462440', '2014-03-28', 'kimberliezzx297@hotmail.com', 0, '', '', '', '', '', '', '', 2, 0, 'New Member', 0, 1395979983, 0, 1395979983, 1395979983, 0, 0, 0, 0, 4, '5', 0, 0, 0, 0, 0, 3194967, '10-11-1982', '1982-10-11', -1, -1, '68.171.100.140', 0, 1, 0, 0, -1, 0, 0, '6atB$jM;_}_kDl_wTK/BFt_=+kz%>4', 0, 0, 0, '', 0, 0, 0, 0, 0, 0, 0, 0, 0, 0, 0, 0, '', '', 0, '', 'vb', '', 0, 1, 0, 0, NULL),
(23939, 3, '', 0, 'LLindley', '9ea329050b93e6bc7cc3e80f1f3ed1c3', '2014-04-30', 'fadedvacancy376jl79@outlook.com', 0, '', '', '', '', '', '', '', 2, 0, 'New Member', 0, 1398880731, 0, 1398880731, 1398880731, 0, 0, 0, 0, 4, '5', 0, 0, 0, 0, 0, 3194967, '03-01-1979', '1979-03-01', -1, -1, '192.3.111.221', 0, 1, 0, 0, -1, 0, 0, 'P2P?A*w7>XhJV;JG:v"*s<(UtZBt3y', 0, 0, 0, '', 0, 0, 0, 0, 0, 0, 0, 0, 0, 0, 0, 0, '', '', 0, '', 'vb', '', 0, 1, 0, 0, NULL),
(23204, 2, '', 0, 'riz_104', '582d3c9f6786b9b0bdb9cb20f838ef4c', '2014-03-28', 'riz_104@hotmail.com', 0, '', '', '', '', '', '', '', 2, 0, 'New Member', 0, 1395994698, 0, 1395997853, 1395997853, 0, 0, 0, 0, 4, '5', 0, 0, 0, 0, 0, 3194967, '05-24-1979', '1979-05-24', -1, -1, '182.188.200.212', 0, 1, 0, 0, -1, 0, 0, 'j!"0Vw)~]gzU_G>]j;bng<ntm%Yu.e', 0, 0, 0, '', 0, 0, 1, 0, 0, 0, 0, 0, 0, 0, 0, 0, '', '', 0, '', 'vb', '', 0, 1, 0, 0, NULL),
(23205, 2, '', 0, 'CLAY N FIELD', '9967da8c8be847fe587fdd99270431c3', '2016-08-09', 'chshafiq81@gmail.com', 0, '', '', '', '', '', '', '', 2, 0, 'New Member', 0, 1396003187, 0, 1437323809, 1470739163, 1436339725, 0, 4, 0, 4, '5', 0, 0, 0, 0, 0, 3194967, '04-25-1970', '1970-04-25', -1, -1, '182.178.250.137', 0, 1, 0, 0, -1, 0, 0, 'ZO\\.UKeA@3D7$aX`W\\=~$pop.0KwW(', 0, 0, 0, '', 0, 0, 1, 0, 0, 0, 0, 0, 0, 0, 0, 0, '14c866c5c08f677505395f77e03dbfa1', '', 0, '', 'vb', '', 0, 1, 0, 0, NULL),
(23206, 2, '', 0, 'Faizan311', 'e449b32bdf10a7206f2c72e89eac50b4', '2014-10-02', 'fmalik462@gmail.com', 0, '', '', '', '', '', '', '', 2, 0, 'New Member', 0, 1396020785, 0, 1413820641, 1413975422, 0, 0, 0, 0, 4, '5', 0, 0, 0, 0, 0, 3194967, '09-01-1980', '1980-09-01', -1, -1, '23.27.248.5', 0, 1, 0, 0, -1, 0, 0, '6XdA>iZ@_1Ix|1@m{%b@^l&qEe!Ybl', 0, 0, 0, '', 0, 0, 2, 0, 0, 0, 0, 0, 0, 0, 0, 0, '', '', 0, '', 'vb', '', 0, 1, 0, 0, NULL),
(23242, 2, '', 0, 'Hamza Ahmed', '1968c868137e963e95bbb9e30dd881df', '2014-04-01', 'danisharms@gmail.com', 0, '', '', '', '', '', '', '', 2, 0, 'New Member', 0, 1396346347, 0, 1396346795, 1396351180, 0, 0, 0, 0, 4, '5', 0, 0, 0, 0, 0, 3194967, '07-07-1984', '1984-07-07', -1, -1, '37.221.172.11', 2303, 1, 0, 0, -1, 0, 0, 'mCqS\\xrRuDj]?6N^w>HaXY52<Z_4Qw', 0, 0, 0, '', 0, 0, 0, 0, 0, 0, 0, 0, 0, 0, 0, 0, '', '', 0, '', 'vb', '', 0, 1, 0, 0, NULL),
(23214, 3, '', 0, 'MCreech', '3b8683af279afa6919da5a305ce416b4', '2014-03-29', 'healthyjar13h2285@outlook.com', 0, '', '', '', '', '', '', '', 2, 0, 'New Member', 0, 1396059581, 0, 1396059581, 1396059581, 0, 0, 0, 0, 4, '5', 0, 0, 0, 0, 0, 3194967, '08-19-1977', '1977-08-19', -1, -1, '173.232.105.50', 0, 1, 0, 0, -1, 0, 0, 'p;TRHvZPm:S/*vnM3FXnrLdCL/K9fK', 0, 0, 0, '', 0, 0, 0, 0, 0, 0, 0, 0, 0, 0, 0, 0, '', '', 0, '', 'vb', '', 0, 1, 0, 0, NULL),
(23215, 3, '', 0, 'Muhammad Haroon Khan', '5a2f1d3927bfc3abfdbc7c27d58bdb4e', '2014-03-29', 'haroonkhan2003.hk@gmail.com', 0, '', '', '', '', '', '', '', 2, 0, 'New Member', 0, 1396093516, 0, 1396093516, 1396093516, 0, 0, 0, 0, 4, '5', 0, 0, 0, 0, 0, 3194967, '02-05-1982', '1982-02-05', -1, -1, '182.186.44.100', 0, 1, 0, 0, -1, 0, 0, 'x~.%n<W0zRQTaPO6d!-ze[+AN:%K>@', 0, 0, 0, '', 0, 0, 0, 0, 0, 0, 0, 0, 0, 0, 0, 0, '', '', 0, '', 'vb', '', 0, 1, 0, 0, NULL),
(23216, 3, '', 0, 'ajnessjunior6424', '9cd90df44036325c991c321aac6cf357', '2014-03-29', 'ajnessjunior@ymail.com', 0, '', '', '', '', '', '', '', 2, 0, 'New Member', 0, 1396095988, 0, 1396095988, 1396095988, 0, 0, 0, 0, 4, '-7', 0, 0, 0, 0, 0, 3195031, '07-21-1976', '1976-07-21', -1, -1, '62.122.73.29', 0, 1, 0, 0, -1, 0, 0, 'VbXj{]a@4K-g"J{qG=LS{XCgLbYJ;:', 0, 0, 0, '', 0, 0, 0, 0, 0, 0, 0, 0, 0, 0, 0, 0, '', '', 0, '', 'vb', '', 0, 1, 0, 0, NULL),
(23217, 3, '', 0, 'AWishart', '25484a5d10f79b1b4249396d5dd60d65', '2014-03-29', 'obtainableswindmk476@outlook.com', 0, '', '', '', '', '', '', '', 2, 0, 'New Member', 0, 1396100596, 0, 1396100596, 1396554423, 0, 0, 0, 0, 4, '5', 0, 0, 0, 0, 0, 3194967, '06-21-1979', '1979-06-21', -1, -1, '91.214.223.72', 0, 1, 0, 0, -1, 0, 0, 'w}mU~n-s#T)@*FdXhRjDjDb/=roDBB', 0, 0, 0, '', 0, 0, 0, 0, 0, 0, 0, 0, 0, 0, 0, 0, '', '', 0, '', 'vb', '', 0, 1, 0, 0, NULL),
(23218, 2, '', 0, 'xedrex777', 'af3f28e7ffb7374f75d2b3e229fb6b4e', '2014-03-29', 'zarrarbangash@gmail.com', 0, '', '', '', '', '', '', '', 2, 0, 'New Member', 0, 1396109014, 0, 1406562466, 1416700248, 1406555699, 452246, 8, 0, 4, '5', 0, 0, 0, 0, 0, 3194967, '10-20-1990', '1990-10-20', -1, -1, '182.185.255.87', 0, 1, 0, 0, -1, 0, 0, 'YdgtD&`axv+6UHcPy5KopQFNik"RL-', 0, 0, 0, '', 0, 0, 5, 0, 1, 0, 0, 0, 0, 0, 0, 0, '1223a28dabc62a4e82b178942ecafd2d', '', 0, '', 'vb', '', 0, 1, 0, 0, NULL),
(23237, 3, '', 0, 'syed47', 'd01355f38852690cfb01103756bbcd77', '2014-03-31', 'syed_moazzam_hussain@yahoo.com', 0, '', '', '', '', '', '', '', 2, 0, 'New Member', 0, 1396299111, 0, 1396299339, 1396299339, 0, 0, 0, 0, 4, '5', 0, 0, 0, 0, 0, 3194967, '11-26-1979', '1979-11-26', -1, -1, '182.186.125.100', 5795, 1, 0, 0, -1, 0, 0, 's$RtP<Fi_qPqQ($<VWYQ5#0xNmj-Fl', 0, 0, 0, '', 0, 0, 0, 0, 0, 0, 0, 0, 0, 0, 0, 0, '', '', 0, '', 'vb', '', 0, 1, 0, 0, NULL),
(23220, 2, '', 0, 'mansoor janjua', 'db00df45b708c37565dd61c43f84841e', '2014-03-29', 'mansoor25c@hotmail.com', 0, '', '', '', '', '', '', '', 2, 0, 'New Member', 0, 1396109222, 0, 1396109222, 1396110314, 0, 0, 0, 0, 4, '5', 0, 0, 0, 0, 0, 3194967, '03-05-1970', '1970-03-05', -1, -1, '182.185.37.22', 0, 1, 0, 0, -1, 0, 0, '1tzZ|={v64tX:yLSW]fB|`haN]ycL`', 0, 0, 0, '', 0, 0, 0, 0, 0, 0, 0, 0, 0, 0, 0, 0, '', '', 0, '', 'vb', '', 0, 1, 0, 0, NULL),
(23225, 2, '', 0, 'azeem786', '697ed274f549ba0b4bbe28db5ca39d3a', '2014-03-30', 'youngman544@hotmail.co.uk', 0, '', '', '', '', '', '', '', 2, 0, 'New Member', 0, 1396207167, 0, 1419066412, 1420140325, 1415473282, 465348, 22, 0, 4, '5', 0, 0, 0, 0, 0, 3194967, '10-14-1975', '1975-10-14', -1, -1, '119.160.117.33', 0, 1, 0, 0, -1, 0, 0, ',[k20JFI49n{/+~ZV^$G&Vd)N]]Hyf', 0, 0, 0, '', 0, 0, 1, 1, 0, 0, 0, 0, 0, 0, 0, 0, '', '', 0, '', 'vb', '', 0, 1, 0, 0, NULL),
(23226, 2, '', 0, 'federalagent', 'c46629d9f64521f3631f4e8158837ce7', '2014-03-30', 'jaudatshaad@yahoo.com', 0, '', '', '', '', '', '', '', 2, 0, 'New Member', 0, 1396210387, 0, 1396211836, 1398026064, 0, 0, 0, 0, 4, '5', 0, 0, 0, 0, 0, 3194967, '04-15-1992', '1992-04-15', -1, -1, '182.185.191.204', 0, 1, 0, 0, -1, 0, 0, 'gi~GKst7Ys%|$;H(.E$j%m^3MB$Hd%', 0, 0, 0, '', 0, 0, 0, 0, 0, 0, 0, 0, 0, 0, 0, 0, '', '', 0, '', 'vb', '', 0, 1, 0, 0, NULL),
(23227, 3, '', 0, 'Hani', 'ca7c6b29c213cd6f64a48dd69498014e', '2014-03-31', 'Hmani65@yahoo.com', 0, '', '', '', '', '', '', '', 2, 0, 'New Member', 0, 1396223706, 0, 1396224007, 1396224007, 0, 0, 0, 0, 4, '5', 0, 0, 0, 0, 0, 3194967, '08-14-1995', '1995-08-14', -1, -1, '141.0.8.135', 0, 1, 0, 0, -1, 0, 0, '|.tto)dr+.aI"z[HM%k4`Q6ck1TR~i', 0, 0, 0, '', 0, 0, 0, 0, 0, 0, 0, 0, 0, 0, 0, 0, '', '', 0, '', 'vb', '', 0, 1, 0, 0, NULL),
(23235, 3, '', 0, 'SDB', 'f0c62e2d16ee4601abe139f82a5371af', '2014-03-31', 'sdbhutto1@yahoo.com', 0, '', '', '', '', '', '', '', 2, 0, 'New Member', 0, 1396269692, 0, 1396270080, 1396270080, 0, 0, 0, 0, 4, '5', 0, 0, 0, 0, 0, 3194967, '03-11-1976', '1976-03-11', -1, -1, '39.50.151.5', 0, 1, 0, 0, -1, 0, 0, '(q8K}^<e(!B%o,Sa2aJg:M|s)iixS<', 0, 0, 0, '', 0, 0, 0, 0, 0, 0, 0, 0, 0, 0, 0, 0, '', '', 0, '', 'vb', '', 0, 1, 0, 0, NULL),
(23229, 2, '', 0, 'saqibjanjua', '431375f7dba4a2dba25c5bb7db10a19a', '2014-03-31', 'saqibjanjua@live.co.uk', 0, '', '', '', '', '', '', '', 2, 0, 'New Member', 0, 1396243932, 0, 1396678301, 1402343121, 0, 0, 0, 0, 4, '5', 0, 0, 0, 0, 0, 3194967, '02-03-1985', '1985-02-03', -1, -1, '182.188.166.76', 0, 1, 0, 0, -1, 0, 0, 'Z0d_0BD[~''wBj\\)!8qwGdjZSPyvNX{', 0, 0, 0, '', 0, 0, 0, 0, 0, 0, 0, 0, 0, 0, 0, 0, '', '', 0, '', 'vb', '', 0, 1, 0, 0, NULL),
(23230, 2, '', 0, 'saddamhussainh43', 'a45c47421474e75134027ea951805ab9', '2014-03-31', 'saddamhussainh43@gmail.com', 0, '', '', '', '', '', '', '', 2, 0, 'New Member', 0, 1396250485, 0, 1396250485, 1396252643, 0, 0, 0, 0, 4, '5', 0, 0, 0, 0, 0, 3194967, '01-25-1996', '1996-01-25', -1, -1, '182.181.165.14', 0, 1, 0, 0, -1, 0, 0, 'lzn)un{KN''uOw%Q"GFV?*mU*oTD$Ou', 0, 0, 0, '', 0, 0, 0, 0, 0, 0, 0, 0, 0, 0, 0, 0, '', '', 0, '', 'vb', '', 0, 1, 0, 0, NULL),
(23231, 3, '', 0, 'hassanasif47', '5c9a282887d8609dc25f5f6cd30212bd', '2014-03-31', 'hassanasif46@gmail.com', 0, '', '', '', '', '', '', '', 2, 0, 'New Member', 0, 1396253101, 0, 1396258499, 1396258499, 0, 0, 0, 0, 4, '5', 0, 0, 0, 0, 0, 3194967, '07-27-1995', '1995-07-27', -1, -1, '119.63.143.113', 0, 1, 0, 0, -1, 0, 0, '0`ZZyP'']T#@._Sb3|9eYdAl&Dx>hlx', 0, 0, 0, '', 0, 0, 0, 0, 0, 0, 0, 0, 0, 0, 0, 0, '', '', 0, '', 'vb', '', 0, 1, 0, 0, NULL),
(23248, 2, '', 0, 'Imrank', '6c0a31ad7c9cdf39b860ba25a6c27a27', '2014-04-02', 'khetran82@gmail.com', 0, '', '', '', '', '', '', '', 2, 0, 'New Member', 0, 1396459351, 0, 1396459351, 1396460449, 0, 0, 0, 0, 4, '5', 0, 0, 0, 0, 0, 3194967, '03-08-1982', '1982-03-08', -1, -1, '39.47.100.121', 0, 1, 0, 0, -1, 0, 0, 'kBUIP+[DLUbII-:($QNGoPg%H0v"HO', 0, 0, 0, '', 0, 0, 0, 0, 0, 0, 0, 0, 0, 0, 0, 0, '', '', 0, '', 'vb', '', 0, 1, 0, 0, NULL),
(23343, 3, '', 0, 'VFrier', '4fdf88e53d97887d07571917ae3feb02', '2014-04-07', 'alivenucleus6005@outlook.com', 0, '', '', '', '', '', '', '', 2, 0, 'New Member', 0, 1396865314, 0, 1396865314, 1396865314, 0, 0, 0, 0, 4, '5', 0, 0, 0, 0, 0, 3194967, '04-08-1982', '1982-04-08', -1, -1, '198.50.161.251', 0, 1, 0, 0, -1, 0, 0, 'p3M~[z5dL#2O#!4:({Sdfa@".QHx$$', 0, 0, 0, '', 0, 0, 0, 0, 0, 0, 0, 0, 0, 0, 0, 0, '', '', 0, '', 'vb', '', 0, 1, 0, 0, NULL),
(23253, 2, '', 0, 'Ahsan Tariq', '4e553f03c5987c87f971a0e4c535865d', '2014-04-02', 'ahsantariq2013@gmail.com', 0, '', '', '', '', '', '', '', 2, 0, 'New Member', 0, 1396470523, 0, 1396470523, 1396470668, 0, 0, 0, 0, 4, '5', 0, 0, 0, 0, 0, 3194967, '07-10-1992', '1992-07-10', -1, -1, '180.92.144.132', 0, 1, 0, 0, -1, 0, 0, '6?~7anQXT592)6SPDB4Tw(grW}u>Mu', 0, 0, 0, '', 0, 0, 0, 0, 0, 0, 0, 0, 0, 0, 0, 0, '', '', 0, '', 'vb', '', 0, 1, 0, 0, NULL),
(23251, 3, '', 0, 'JL36', '24f4a523737c3dfe0f375731084bc62f', '2014-04-02', 'jacindafvw939@hotmail.com', 0, '', '', '', '', '', '', '', 2, 0, 'New Member', 0, 1396462020, 0, 1396462020, 1396462020, 0, 0, 0, 0, 4, '5', 0, 0, 0, 0, 0, 3194967, '12-04-1976', '1976-12-04', -1, -1, '93.118.70.203', 0, 1, 0, 0, -1, 0, 0, '@UCSgu$i;DQ57m)x@&dQR7Ue,@"fSS', 0, 0, 0, '', 0, 0, 0, 0, 0, 0, 0, 0, 0, 0, 0, 0, '', '', 0, '', 'vb', '', 0, 1, 0, 0, NULL),
(23254, 3, '', 0, 'MU37', '30ffbda12b6f996ed621f5886922eb6c', '2014-04-02', 'internalpasseng6518@outlook.com', 0, '', '', '', '', '', '', '', 2, 0, 'New Member', 0, 1396471628, 0, 1396471628, 1396471628, 0, 0, 0, 0, 4, '5', 0, 0, 0, 0, 0, 3194967, '07-12-1985', '1985-07-12', -1, -1, '107.155.77.37', 0, 1, 0, 0, -1, 0, 0, '7:"b02rnITR<$''.7i(OQ:4~WCu5QI1', 0, 0, 0, '', 0, 0, 0, 0, 0, 0, 0, 0, 0, 0, 0, 0, '', '', 0, '', 'vb', '', 0, 1, 0, 0, NULL),
(23331, 2, '', 0, 'Adil Elahi', 'e2fefb1ac6610a80ab933789b61d95d5', '2014-04-06', 'adilelahi94@yahoo.co.uk', 0, '', '', '', '', '', '', '', 2, 0, 'New Member', 0, 1396812245, 0, 1396812245, 1396812341, 0, 0, 0, 0, 4, '5', 0, 0, 0, 0, 0, 3194967, '06-12-1994', '1994-06-12', -1, -1, '101.50.97.20', 0, 1, 0, 0, -1, 0, 0, 'qeQx>|GLrRuz3:8/<EYy(:l[%jv/%w', 0, 0, 0, '', 0, 0, 0, 0, 0, 0, 0, 0, 0, 0, 0, 0, '', '', 0, '', 'vb', '', 0, 1, 0, 0, NULL),
(23258, 3, '', 0, 'RToussain', 'f9f2a4da89ad4f99a04b72dba8be5ded', '2014-04-03', 'he.athvdorsey7321@gmail.com', 0, '', '', '', '', '', '', '', 2, 0, 'New Member', 0, 1396481784, 0, 1396481784, 1396914910, 0, 0, 0, 0, 4, '5', 0, 0, 0, 0, 0, 3194967, '05-04-1970', '1970-05-04', -1, -1, '162.244.11.203', 0, 1, 0, 0, -1, 0, 0, 'eg|4iREB{lmiVbjNprA}v-YIRY1\\[:', 0, 0, 0, '', 0, 0, 0, 0, 0, 0, 0, 0, 0, 0, 0, 0, '', '', 0, '', 'vb', '', 0, 1, 0, 0, NULL),
(23298, 3, '', 0, 'EKnudson', '75fd34cfc4ce345ebe60d9052eef0b25', '2014-04-04', 'laveraeme134@hotmail.com', 0, '', '', '', '', '', '', '', 2, 0, 'New Member', 0, 1396635962, 0, 1396635962, 1397069729, 0, 0, 0, 0, 4, '5', 0, 0, 0, 0, 0, 3194967, '09-05-1975', '1975-09-05', -1, -1, '142.91.106.196', 0, 1, 0, 0, -1, 0, 0, '8!gfG$4%(yGSGt;Tv&1r-5]+)Q!DN3', 0, 0, 0, '', 0, 0, 0, 0, 0, 0, 0, 0, 0, 0, 0, 0, '', '', 0, '', 'vb', '', 0, 1, 0, 0, NULL),
(23260, 3, '', 0, 'IQJUU', 'c2f2232cb9934cbf10bfe37fd6e6247f', '2014-04-03', 'luckydog488h243@outlook.com', 0, '', '', '', '', '', '', '', 2, 0, 'New Member', 0, 1396486040, 0, 1396486040, 1396486040, 0, 0, 0, 0, 4, '5', 0, 0, 0, 0, 0, 3194967, '01-01-1977', '1977-01-01', -1, -1, '5.153.235.100', 0, 1, 0, 0, -1, 0, 0, '~JAT}Rwed:A^<T(Bb1!nhs`{dSG?Aj', 0, 0, 0, '', 0, 0, 0, 0, 0, 0, 0, 0, 0, 0, 0, 0, '', '', 0, '', 'vb', '', 0, 1, 0, 0, NULL),
(23438, 3, '', 0, 'CCaffyn', 'f395227ff683c0d8e2d285835c885f8b', '2014-04-11', 'perpetualcatcalczz35@outlook.com', 0, '', '', '', '', '', '', '', 2, 0, 'New Member', 0, 1397244679, 0, 1397244679, 1397244679, 0, 0, 0, 0, 4, '5', 0, 0, 0, 0, 0, 3194967, '06-28-1980', '1980-06-28', -1, -1, '95.174.103.176', 0, 1, 0, 0, -1, 0, 0, '~.5}J~NVV9RvYY%{+]iG3M!lE"Ub9''', 0, 0, 0, '', 0, 0, 0, 0, 0, 0, 0, 0, 0, 0, 0, 0, '', '', 0, '', 'vb', '', 0, 1, 0, 0, NULL),
(23411, 3, '', 0, 'bangelasfancesay9839', '085ab1d1dfa09ddbbabbc232e412ba0a', '2014-04-10', 'bangelasfancesay@ymail.com', 0, '', '', '', '', '', '', '', 2, 0, 'New Member', 0, 1397128039, 0, 1397128039, 1397128039, 0, 0, 0, 0, 4, '6.5', 0, 0, 0, 0, 0, 3194903, '03-06-1988', '1988-03-06', -1, -1, '121.96.176.212', 0, 1, 0, 0, -1, 0, 0, 'tWP@p6wanFMu]f+9E$}w!FRa2r1U7Q', 0, 0, 0, '', 0, 0, 0, 0, 0, 0, 0, 0, 0, 0, 0, 0, '', '', 0, '', 'vb', '', 0, 1, 0, 0, NULL),
(23462, 3, '', 0, 'EManns', '319fe614d1a84ad3455b0082f05cc83b', '2014-04-13', 'madisonc0bilkiss@yahoo.com', 0, '', '', '', '', '', '', '', 2, 0, 'New Member', 0, 1397369131, 0, 1397369131, 1397369131, 0, 0, 0, 0, 4, '5', 0, 0, 0, 0, 0, 3194967, '11-12-1981', '1981-11-12', -1, -1, '173.232.104.251', 0, 1, 0, 0, -1, 0, 0, '$"CVI?PC&2Q/b3i?J6`OD+L{-7ENAG', 0, 0, 0, '', 0, 0, 0, 0, 0, 0, 0, 0, 0, 0, 0, 0, '', '', 0, '', 'vb', '', 0, 1, 0, 0, NULL),
(23415, 3, '', 0, 'saifurrehman', 'e783f5e915d453e7dbf0000cc0c2b9de', '2014-08-10', 'saifrehman161@yahoo.com', 0, '', '', '', '', '', '', '', 2, 0, 'New Member', 0, 1397145546, 0, 1397145771, 1397147298, 0, 0, 0, 0, 4, '5', 0, 0, 0, 0, 0, 3194967, '02-16-1995', '1995-02-16', -1, -1, '111.119.183.29', 0, 1, 0, 0, -1, 0, 0, '!=-%qh^fx%9q}d\\`kKR~rpm!@rSXmi', 0, 0, 0, '', 0, 0, 0, 0, 0, 0, 0, 0, 0, 0, 0, 0, '', '', 0, '', 'vb', '', 0, 1, 0, 0, NULL),
(23280, 3, '', 0, 'THipple', '0d2061dea1130c8069a6eb68b4706949', '2014-04-03', 'taylor-hipple@4starmaids.com', 0, '', '', '', '', '', '', '', 2, 0, 'New Member', 0, 1396563861, 0, 1396563861, 1397153945, 0, 0, 0, 0, 4, '5', 0, 0, 0, 0, 0, 3194967, '06-25-1979', '1979-06-25', -1, -1, '23.81.216.230', 0, 1, 0, 0, -1, 0, 0, 'oj#Be>"Lc*b^Z]]PK{i-@:alKNOQ})', 0, 0, 0, '', 0, 0, 0, 0, 0, 0, 0, 0, 0, 0, 0, 0, '', '', 0, '', 'vb', '', 0, 1, 0, 0, NULL),
(23263, 3, '', 0, 'S38Q', '27e3098f0c5768dd9fabe2aadc433fbc', '2014-04-03', 'mightyevasion778da70@outlook.com', 0, '', '', '', '', '', '', '', 2, 0, 'New Member', 0, 1396496369, 0, 1396496369, 1396496369, 0, 0, 0, 0, 4, '5', 0, 0, 0, 0, 0, 3194967, '01-13-1985', '1985-01-13', -1, -1, '91.108.182.34', 0, 1, 0, 0, -1, 0, 0, '9d;ljY_"Z5R:f4`\\.|Z}UC192)SRy1', 0, 0, 0, '', 0, 0, 0, 0, 0, 0, 0, 0, 0, 0, 0, 0, '', '', 0, '', 'vb', '', 0, 1, 0, 0, NULL),
(23281, 3, '', 0, 'GWhitehur', '44a0b4565acff826003533d7e5fdc79a', '2014-04-03', 'functionalboughl071g@outlook.com', 0, '', '', '', '', '', '', '', 2, 0, 'New Member', 0, 1396565173, 0, 1396565173, 1396565173, 0, 0, 0, 0, 4, '5', 0, 0, 0, 0, 0, 3194967, '10-22-1980', '1980-10-22', -1, -1, '216.107.159.65', 0, 1, 0, 0, -1, 0, 0, '.;hluGJFqF1}eJ`Rt/#G-+Oy}Z+X%<', 0, 0, 0, '', 0, 0, 0, 0, 0, 0, 0, 0, 0, 0, 0, 0, '', '', 0, '', 'vb', '', 0, 1, 0, 0, NULL),
(23266, 3, '', 0, 'O8636', 'bfb2cf018465c0d5ec4193c8bc9665e8', '2014-04-03', 'wistfuldye504454@outlook.com', 0, '', '', '', '', '', '', '', 2, 0, 'New Member', 0, 1396517789, 0, 1396517789, 1397008098, 0, 0, 0, 0, 4, '5', 0, 0, 0, 0, 0, 3194967, '07-11-1972', '1972-07-11', -1, -1, '192.227.240.43', 0, 1, 0, 0, -1, 0, 0, '$XGlT)1dfCx#tl>P\\KbR$>w1lffW''x', 0, 0, 0, '', 0, 0, 0, 0, 0, 0, 0, 0, 0, 0, 0, 0, '', '', 0, '', 'vb', '', 0, 1, 0, 0, NULL),
(23283, 3, '', 0, 'J3038', 'f932f056bd6c2c7854069b231ed0b1bd', '2014-04-04', 'earlyperdition3uo800@outlook.com', 0, '', '', '', '', '', '', '', 2, 0, 'New Member', 0, 1396572569, 0, 1396572569, 1397005427, 0, 0, 0, 0, 4, '5', 0, 0, 0, 0, 0, 3194967, '09-21-1982', '1982-09-21', -1, -1, '23.94.148.67', 0, 1, 0, 0, -1, 0, 0, 'r!UqjKZ*{['';pC|`G,qRoZkdl&vf!r', 0, 0, 0, '', 0, 0, 0, 0, 0, 0, 0, 0, 0, 0, 0, 0, '', '', 0, '', 'vb', '', 0, 1, 0, 0, NULL),
(23269, 3, '', 0, 'SSag', '5e78721a0a9f23955ba00001a5d04a4a', '2014-04-03', 'giftshopbrilliant@outlook.com', 0, '', '', '', '', '', '', '', 2, 0, 'New Member', 0, 1396524220, 0, 1396524220, 1396524220, 0, 0, 0, 0, 4, '5', 0, 0, 0, 0, 0, 3194967, '07-10-1979', '1979-07-10', -1, -1, '192.227.253.203', 0, 1, 0, 0, -1, 0, 0, 'DbUxz|!_D)%vb5;f$jo-zeA3hWZjpz', 0, 0, 0, '', 0, 0, 0, 0, 0, 0, 0, 0, 0, 0, 0, 0, '', '', 0, '', 'vb', '', 0, 1, 0, 0, NULL),
(23270, 2, '', 0, 'Abubaker', '95a62e993fa873f9ee7dc76545213ca2', '2014-04-03', 'abubaker1@yahoo.com', 0, '', '', '', '', '', '', '', 2, 0, 'New Member', 0, 1396524732, 0, 1396524732, 1396525791, 0, 0, 0, 0, 4, '5', 0, 0, 0, 0, 0, 3194967, '02-15-1993', '1993-02-15', -1, -1, '188.227.166.186', 0, 1, 0, 0, -1, 0, 0, 'FPfx|V8hjOEiDxuDQ8f[WJHrjP1.Mp', 0, 0, 0, '', 0, 0, 0, 0, 0, 0, 0, 0, 0, 0, 0, 0, '', '', 0, '', 'vb', '', 0, 1, 0, 0, NULL),
(23271, 3, '', 0, 'shabd73', '4731944d499905002a40c157a18d08cd', '2014-04-03', 'sheikh.abdullah@hotmail.com', 0, '', '', '', '', '', '', '', 2, 0, 'New Member', 0, 1396531040, 0, 1396531040, 1396531270, 0, 0, 0, 0, 4, '5', 0, 0, 0, 0, 0, 3194967, '12-16-1973', '1973-12-16', -1, -1, '39.32.50.105', 0, 1, 0, 0, -1, 0, 0, 'c@,FHEc[/<Mi}ht''aw5wjk*r*H0&=K', 0, 0, 0, '', 0, 0, 0, 0, 0, 0, 0, 0, 0, 0, 0, 0, '', '', 0, '', 'vb', '', 0, 1, 0, 0, NULL),
(23300, 2, '', 0, 'atif.hassan', '1296f2558fb47ff918822bd5260255d7', '2014-04-04', 'smatifhasan@gmail.com', 0, '', '', '', '', '', '', '', 2, 0, 'New Member', 0, 1396647169, 0, 1396647234, 1396647234, 0, 0, 0, 0, 4, '5', 0, 0, 0, 0, 0, 3194967, '10-29-1980', '1980-10-29', -1, -1, '125.209.100.246', 0, 1, 0, 0, -1, 0, 0, '|%uKO2XzIxM#!5_|pU{!8<\\e=wfT-(', 0, 0, 0, '', 0, 0, 0, 0, 0, 0, 0, 0, 0, 0, 0, 0, '', '', 0, '', 'vb', '', 0, 1, 0, 0, NULL),
(23338, 3, '', 0, 'KYob', '0092ea5b4276d7c69af4a60b8a89bb1c', '2014-04-07', 'quackwriter8444@outlook.com', 0, '', '', '', '', '', '', '', 2, 0, 'New Member', 0, 1396850880, 0, 1396850880, 1396850880, 0, 0, 0, 0, 4, '5', 0, 0, 0, 0, 0, 3194967, '04-11-1977', '1977-04-11', -1, -1, '50.2.225.12', 0, 1, 0, 0, -1, 0, 0, '71b`VDRiL%>d}c\\urcc1s?yx7%frGi', 0, 0, 0, '', 0, 0, 0, 0, 0, 0, 0, 0, 0, 0, 0, 0, '', '', 0, '', 'vb', '', 0, 1, 0, 0, NULL),
(23580, 3, '', 0, 'NickZeped', '8655b9144d4f5dffce925dcbd3d70544', '2014-04-17', 'redusxaxgvxwe@outlook.com', 0, '', '', '', '', '', '', '', 2, 0, 'New Member', 0, 1397716577, 0, 1397716577, 1398676097, 0, 0, 0, 0, 4, '5', 0, 0, 0, 0, 0, 3194967, '10-13-1980', '1980-10-13', -1, -1, '89.47.23.8', 0, 1, 0, 0, -1, 0, 0, 'dU|*iZ`"`qU9%1_7w}Ag%y3P''La~}"', 0, 0, 0, '', 0, 0, 0, 0, 0, 0, 0, 0, 0, 0, 0, 0, '', '', 0, '', 'vb', '', 0, 1, 0, 0, NULL),
(23288, 3, '', 0, 'LB46', 'e4d2aac3320bde5a3aaa5beaa9147929', '2014-04-04', 'jealousnook58noh7@outlook.com', 0, '', '', '', '', '', '', '', 2, 0, 'New Member', 0, 1396585468, 0, 1396585468, 1396585468, 0, 0, 0, 0, 4, '5', 0, 0, 0, 0, 0, 3194967, '12-19-1975', '1975-12-19', -1, -1, '173.212.192.72', 0, 1, 0, 0, -1, 0, 0, '5WqmN.{@CENflj5anKm#TgRfD4"0j-', 0, 0, 0, '', 0, 0, 0, 0, 0, 0, 0, 0, 0, 0, 0, 0, '', '', 0, '', 'vb', '', 0, 1, 0, 0, NULL),
(23276, 3, '', 0, 'DLenehan', '9c874ea4501a6ca7db71102ddea17aea', '2014-04-03', 'overconfidentfa5w692@outlook.com', 0, '', '', '', '', '', '', '', 2, 0, 'New Member', 0, 1396547259, 0, 1396547259, 1397046280, 0, 0, 0, 0, 4, '5', 0, 0, 0, 0, 0, 3194967, '07-08-1977', '1977-07-08', -1, -1, '107.161.82.205', 0, 1, 0, 0, -1, 0, 0, 'pewme+P/\\%@.R$N{LRJp/LL6u=s"an', 0, 0, 0, '', 0, 0, 0, 0, 0, 0, 0, 0, 0, 0, 0, 0, '', '', 0, '', 'vb', '', 0, 1, 0, 0, NULL),
(23321, 3, '', 0, 'SU65', '70428b59e317e520a9b71efbb23b46bd', '2014-04-06', 'tinyalcove1xb482@outlook.com', 0, '', '', '', '', '', '', '', 2, 0, 'New Member', 0, 1396739562, 0, 1396739562, 1396739562, 0, 0, 0, 0, 4, '5', 0, 0, 0, 0, 0, 3194967, '06-12-1970', '1970-06-12', -1, -1, '5.157.45.137', 0, 1, 0, 0, -1, 0, 0, ')|*x<CZ_7ahoZs<,+p"4sWeqU#OYTo', 0, 0, 0, '', 0, 0, 0, 0, 0, 0, 0, 0, 0, 0, 0, 0, '', '', 0, '', 'vb', '', 0, 1, 0, 0, NULL),
(23278, 3, '', 0, 'tt diamond', '3ddebe7bc310f6d0546bd1f7e38e2ee4', '2014-04-03', 'sajji42@yahoo.com', 0, '', '', '', '', '', '', '', 2, 0, 'New Member', 0, 1396552277, 0, 1396552277, 1396553094, 0, 0, 0, 0, 4, '12', 0, 0, 0, 0, 0, 3195031, '02-22-1995', '1995-02-22', -1, -1, '141.0.10.220', 2536, 1, 0, 0, -1, 0, 0, 'eM_H/8T]=#M[}OQtYz5Hl@R[''WU`>M', 0, 0, 0, '', 0, 0, 0, 0, 0, 0, 0, 0, 0, 0, 0, 0, '', '', 0, '', 'vb', '', 0, 1, 0, 0, NULL),
(23339, 3, '', 0, 'GYPI', 'ff0b55f2123010daafa797879bd46590', '2014-04-07', 'wackyhuman5082@outlook.com', 0, '', '', '', '', '', '', '', 2, 0, 'New Member', 0, 1396859077, 0, 1396859077, 1397267376, 0, 0, 0, 0, 4, '5', 0, 0, 0, 0, 0, 3194967, '06-23-1978', '1978-06-23', -1, -1, '37.59.62.70', 0, 1, 0, 0, -1, 0, 0, ')slaAUj-gKR%ZV%|zW&HocXXP&@j><', 0, 0, 0, '', 0, 0, 0, 0, 0, 0, 0, 0, 0, 0, 0, 0, '', '', 0, '', 'vb', '', 0, 1, 0, 0, NULL),
(23395, 2, '', 0, 'aafzall', '153d6feb3e3db80c317ac6bcf351fae4', '2014-04-09', 'aafzall@msn.com', 0, '', '', '', '', '', '', '', 2, 0, 'New Member', 0, 1397058977, 0, 1397060357, 1397060357, 0, 0, 0, 0, 4, '5', 0, 0, 0, 0, 0, 3194967, '07-07-1979', '1979-07-07', -1, -1, '182.185.111.54', 0, 1, 0, 0, -1, 0, 0, '?p[l%.,Z|GF+g^p+\\i5>HHkeT>1Yaj', 0, 0, 0, '', 0, 0, 0, 0, 0, 0, 0, 0, 0, 0, 0, 0, '', '', 0, '', 'vb', '', 0, 1, 0, 0, NULL),
(23293, 2, '', 0, 'malik77', '38e32e0f11df3333c84ad69fd0ea166f', '2014-04-04', 'awanjee77@yahoo.com', 0, '', '', '', '', '', '', '', 2, 0, 'New Member', 0, 1396618172, 0, 1396618800, 1396618800, 0, 0, 0, 0, 4, '5', 0, 0, 0, 0, 0, 3194967, '12-20-1975', '1975-12-20', -1, -1, '223.29.229.122', 0, 1, 0, 0, -1, 0, 0, 'w/znIWp+`Y3qtCU=T%[k0R/t[z5=u{', 0, 0, 0, '', 0, 0, 0, 0, 0, 0, 0, 0, 0, 0, 0, 0, '', '', 0, '', 'vb', '', 0, 1, 0, 0, NULL),
(23295, 3, '', 0, 'BHarbison', 'adc11dfee426624e94d10711372e7ff3', '2014-04-04', 'benito-harbison@cadomoingay.info', 0, '', '', '', '', '', '', '', 2, 0, 'New Member', 0, 1396628304, 0, 1396628304, 1396628304, 0, 0, 0, 0, 4, '5', 0, 0, 0, 0, 0, 3194967, '10-31-1972', '1972-10-31', -1, -1, '107.158.228.51', 0, 1, 0, 0, -1, 0, 0, '&-&&+8p&.3xylXq{@5LQRHs>7q#guC', 0, 0, 0, '', 0, 0, 0, 0, 0, 0, 0, 0, 0, 0, 0, 0, '', '', 0, '', 'vb', '', 0, 1, 0, 0, NULL),
(23304, 3, '', 0, 'ECarvosso', '1ec5a00aa0d520082366f7e6a760434e', '2014-04-05', 'enriqueta01mcglinn@outlook.com', 0, '', '', '', '', '', '', '', 2, 0, 'New Member', 0, 1396653490, 0, 1396653490, 1397102574, 0, 0, 0, 0, 4, '5', 0, 0, 0, 0, 0, 3194967, '03-09-1973', '1973-03-09', -1, -1, '192.161.55.174', 0, 1, 0, 0, -1, 0, 0, 'C\\3&gwus`\\%|SJK8"l8GGJJROcI?lP', 0, 0, 0, '', 0, 0, 0, 0, 0, 0, 0, 0, 0, 0, 0, 0, '', '', 0, '', 'vb', '', 0, 1, 0, 0, NULL),
(23305, 2, '', 0, 'Faizan Noor', '60f07e4d49bcc90bf854e7a13daee75e', '2014-04-05', 'noorfaizan2011@gmail.com', 0, '', '', '', '', '', '', '', 2, 0, 'New Member', 0, 1396654963, 0, 1396655137, 1396679180, 0, 0, 0, 0, 4, '5', 0, 0, 0, 0, 0, 3194967, '08-22-1988', '1988-08-22', -1, -1, '46.16.38.247', 0, 1, 0, 0, -1, 0, 0, '#W[B#(UTDqXs:/L;''ky9y|u2L:8!Xx', 0, 0, 0, '', 0, 0, 0, 0, 0, 0, 0, 0, 0, 0, 0, 0, '', '', 0, '', 'vb', '', 0, 1, 0, 0, NULL),
(23306, 2, '', 0, 'usmaan_Malik', '69ce891a9b76c455daf89328c5e03b03', '2014-04-05', 'usman_akbr@hotmail.com', 0, '', '', '', '', '', '', '', 2, 0, 'New Member', 0, 1396673162, 0, 1396673162, 1396674926, 0, 0, 0, 0, 4, '5', 0, 0, 0, 0, 0, 3194967, '10-23-1983', '1983-10-23', -1, -1, '182.178.72.211', 0, 1, 0, 0, -1, 0, 0, '-U3f66m]e8C;S^M<dpy05>CTmL6N)s', 0, 0, 0, '', 0, 0, 0, 0, 0, 0, 0, 0, 0, 0, 0, 0, '', '', 0, '', 'vb', '', 0, 1, 0, 0, NULL),
(23307, 2, '', 0, 'Afridi Arms pakistan', '21e6f7c174dd701d877335f396379845', '2014-11-28', 'afridiarms@gmail.com', 0, '', '', '', '', '', '', '', 2, 0, 'New Member', 0, 1396677799, 0, 1397320805, 1417150644, 0, 0, 0, 0, 4, '5', 0, 0, 0, 0, 0, 3194967, '02-01-1980', '1980-02-01', -1, -1, '69.31.103.150', 16111, 1, 0, 0, -1, 0, 0, 'ZigCyg,X)&W3~q"w~DlXOO7CZAcY8:', 0, 0, 0, '', 0, 0, 0, 0, 0, 0, 0, 0, 0, 0, 0, 0, '', '', 0, '', 'vb', '', 0, 1, 0, 0, NULL),
(23335, 2, '', 0, 'sajidjalal', '2d19ffb2779cbb087dd4beeab379b9b8', '2014-04-07', 'sajidjalal07@gmail.com', 0, '', '', '', '', '', '', '', 2, 0, 'New Member', 0, 1396826800, 0, 1396826800, 1396828268, 0, 0, 0, 0, 4, '5', 0, 0, 0, 0, 0, 3194967, '04-01-1989', '1989-04-01', -1, -1, '101.50.122.113', 790, 1, 0, 0, -1, 0, 0, ';2u=<%1LMe?Y:%#Cc$>}-9W/xp''Su#', 0, 0, 0, '', 0, 0, 0, 0, 0, 0, 0, 0, 0, 0, 0, 0, '', '', 0, '', 'vb', '', 0, 1, 0, 0, NULL),
(23473, 3, '', 0, 'ACarbajal', '21b0c8dff6b6ca7a8c51a3c98faa4eec', '2014-04-13', 'pamilaazb703@hotmail.com', 0, '', '', '', '', '', '', '', 2, 0, 'New Member', 0, 1397403895, 0, 1397403895, 1397403895, 0, 0, 0, 0, 4, '5', 0, 0, 0, 0, 0, 3194967, '11-10-1979', '1979-11-10', -1, -1, '165.231.12.170', 0, 1, 0, 0, -1, 0, 0, '0,~#U_&w}1?7@1zsXThm&j*tI3,PkI', 0, 0, 0, '', 0, 0, 0, 0, 0, 0, 0, 0, 0, 0, 0, 0, '', '', 0, '', 'vb', '', 0, 1, 0, 0, NULL),
(23310, 2, '', 0, 'AghaTH', 'f9022d5789223efcfad927af90f9046e', '2014-06-12', 'hussainat110@gmail.com', 0, '', '', '', '', '', '', '', 2, 0, 'New Member', 0, 1396685132, 0, 1405583757, 1405587741, 1397027629, 433417, 1, 0, 4, '5', 0, 25, 0, 0, 0, 3194967, '07-24-1973', '1973-07-24', -1, -1, '169.252.4.21', 0, 1, 0, 0, -1, 0, 0, 'V*9vI`i[$DDUA(=!z(Xpj#/gAf48.#', 0, 0, 0, '', 0, 0, 1, 0, 0, 0, 0, 0, 0, 0, 0, 0, '33abcbd22002312bee3b48083f836ec2', '', 0, '', 'vb', '', 0, 1, 0, 0, NULL),
(23311, 2, '', 0, 'Shiji', 'b9e38ef09f96411585eca0d8f8bea435', '2014-04-05', 'pakistanpatriots@gmail.com', 0, '', '', '', '', '', '', '', 2, 0, 'New Member', 0, 1396689265, 0, 1417945223, 1418234553, 1417633922, 468270, 3, 0, 4, '5', 0, 0, 0, 0, 0, 3194967, '07-21-1992', '1992-07-21', -1, -1, '39.41.103.116', 0, 1, 0, 0, -1, 0, 0, 'w"qigI|}RODh?`F;@[+i}X{}aTaZ''R', 0, 0, 0, '', 0, 0, 0, 0, 0, 0, 0, 0, 0, 0, 0, 0, '', '', 0, '', 'vb', '', 0, 1, 0, 0, NULL),
(23332, 3, '', 0, 'obbytts4001', '756d2dacbc77088f2ffa6594a71baff0', '2014-04-06', 'obbytts@ymail.com', 0, '', '', '', '', '', '', '', 2, 0, 'New Member', 0, 1396813015, 0, 1396813015, 1396813015, 0, 0, 0, 0, 4, '-4.5', 0, 0, 0, 0, 0, 3195031, '04-20-1986', '1986-04-20', -1, -1, '200.151.207.246', 0, 1, 0, 0, -1, 0, 0, 'Ai?={YU,uydp#~]^%IU3MN2D-b4*2K', 0, 0, 0, '', 0, 0, 0, 0, 0, 0, 0, 0, 0, 0, 0, 0, '', '', 0, '', 'vb', '', 0, 1, 0, 0, NULL),
(23323, 2, '', 0, 'Malik_Tiger', '9a25cde62fe3487c65a9413a6c1bf774', '2014-04-06', 'malikimran1981@gmail.com', 0, '', '', '', '', '', '', '', 2, 0, 'New Member', 0, 1396766571, 0, 1396766679, 1396766679, 0, 0, 0, 0, 4, '4', 0, 0, 0, 0, 0, 3195095, '04-23-1981', '1981-04-23', -1, -1, '115.186.125.34', 0, 1, 0, 0, -1, 0, 0, 'OSG1T.v}a#LR.-s\\}"s\\mD^^[EA3Vo', 0, 0, 0, '', 0, 0, 0, 0, 0, 0, 0, 0, 0, 0, 0, 0, '', '', 0, '', 'vb', '', 0, 1, 0, 0, NULL),
(23324, 3, '', 0, 'CBrewingt', 'bc86db784f18910ffa2b47240bd361eb', '2014-04-06', 'justinepeters90269@outlook.com', 0, '', '', '', '', '', '', '', 2, 0, 'New Member', 0, 1396766836, 0, 1396766836, 1396766836, 0, 0, 0, 0, 4, '5', 0, 0, 0, 0, 0, 3194967, '08-11-1985', '1985-08-11', -1, -1, '5.255.91.92', 0, 1, 0, 0, -1, 0, 0, '/f+[Ui]F_Nj\\I<b.8kq;28z+h(pA;2', 0, 0, 0, '', 0, 0, 0, 0, 0, 0, 0, 0, 0, 0, 0, 0, '', '', 0, '', 'vb', '', 0, 1, 0, 0, NULL),
(23315, 3, '', 0, 'JLovekin', '692d993a79b3a897551036ea09f6bf6f', '2014-04-05', 'roseannajom097@hotmail.com', 0, '', '', '', '', '', '', '', 2, 0, 'New Member', 0, 1396705295, 0, 1396705295, 1397139950, 0, 0, 0, 0, 4, '5', 0, 0, 0, 0, 0, 3194967, '07-24-1970', '1970-07-24', -1, -1, '23.238.235.163', 0, 1, 0, 0, -1, 0, 0, '7.o*qkCzt/7xg~vo-8F#X*KNe}rh4{', 0, 0, 0, '', 0, 0, 0, 0, 0, 0, 0, 0, 0, 0, 0, 0, '', '', 0, '', 'vb', '', 0, 1, 0, 0, NULL),
(23329, 2, '', 0, 'pirzarar', 'e5f6267cb8981ae92e9a5bfbbe3c89b5', '2014-04-06', 'pirzarar@live.com', 0, '', '', '', '', '', '', '', 2, 0, 'New Member', 0, 1396794102, 0, 1396794188, 1396847761, 0, 0, 0, 0, 4, '5', 0, 0, 0, 0, 0, 3194967, '09-22-1989', '1989-09-22', -1, -1, '202.69.12.27', 0, 1, 0, 0, -1, 0, 0, '$h:qVJEy_e:bQiW`(u,|wBL";,-=.m', 0, 0, 0, '', 0, 0, 0, 0, 0, 0, 0, 0, 0, 0, 0, 0, '', '', 0, '', 'vb', '', 0, 1, 0, 0, NULL),
(23346, 3, '', 0, 'AEoo', '164d57e5b4e8b908e53e7c92288d604e', '2014-04-07', 'woozyleash202529@outlook.com', 0, '', '', '', '', '', '', '', 2, 0, 'New Member', 0, 1396869208, 0, 1396869208, 1397301437, 0, 0, 0, 0, 4, '5', 0, 0, 0, 0, 0, 3194967, '02-06-1971', '1971-02-06', -1, -1, '5.153.237.134', 0, 1, 0, 0, -1, 0, 0, 'AWX$`9b)eM''WW?">zQ^0rlo6$F#G/F', 0, 0, 0, '', 0, 0, 0, 0, 0, 0, 0, 0, 0, 0, 0, 0, '', '', 0, '', 'vb', '', 0, 1, 0, 0, NULL),
(23622, 3, '', 0, 'MDolan', '9c75a644d757b7fc34fae29528f7defd', '2014-04-18', 'maximo-dolan@rankapps.tk', 0, '', '', '', '', '', '', '', 2, 0, 'New Member', 0, 1397860647, 0, 1397860647, 1397867600, 0, 0, 0, 0, 4, '5', 0, 0, 0, 0, 0, 3194967, '10-14-1981', '1981-10-14', -1, -1, '198.143.136.18', 0, 1, 0, 0, -1, 0, 0, 'T">=:xj"M[cWze/h0dPwD6nm$9}35u', 0, 0, 0, '', 0, 0, 0, 0, 0, 0, 0, 0, 0, 0, 0, 0, '', '', 0, '', 'vb', '', 0, 1, 0, 0, NULL),
(23414, 2, '', 0, 'shama mustafa hayder', '070d09920e8ce84edc6fdf06b0902cda', '2015-04-15', 'shamamustafahayder@gmail.com', 0, '', '', '', '', '', '', '', 2, 0, 'New Member', 0, 1397130419, 0, 1397130555, 1429056628, 0, 0, 0, 0, 4, '5', 0, 0, 0, 0, 0, 3194967, '07-28-1993', '1993-07-28', -1, -1, '111.68.102.26', 0, 1, 0, 0, -1, 0, 0, '[LTVqxnMW!MsXFatyQXru>?OV}C#Q)', 0, 0, 0, '', 0, 0, 2, 0, 0, 0, 0, 0, 0, 0, 0, 0, '', '', 0, '', 'vb', '', 0, 1, 0, 0, NULL),
(23330, 3, '', 0, 'RosalineL', '99ff06c899839cfe0c9efae386006fce', '2014-04-06', 'cwaarbdl@hotmail.com', 0, '', '', '', '', '', '', '', 2, 0, 'New Member', 0, 1396796672, 0, 1396796672, 1396796672, 0, 0, 0, 0, 4, '5', 0, 0, 0, 0, 0, 3194967, '05-22-1984', '1984-05-22', -1, -1, '192.3.108.211', 0, 1, 0, 0, -1, 0, 0, '@fAo8]]mpKPRhB''q>\\asXE:00V1wn\\', 0, 0, 0, '', 0, 0, 0, 0, 0, 0, 0, 0, 0, 0, 0, 0, '', '', 0, '', 'vb', '', 0, 1, 0, 0, NULL),
(23407, 2, '', 0, 'Mubasharchudary', 'a7e9e6f0501e1ca0b5d77b26c8f0b1d9', '2014-04-10', 'mubasharchudary@yahoo.com', 0, '', '', '', '', '', '', '', 2, 0, 'New Member', 0, 1397115547, 0, 1397115547, 1397115694, 0, 0, 0, 0, 4, '5', 0, 0, 0, 0, 0, 3194967, '08-08-1986', '1986-08-08', -1, -1, '39.42.150.92', 0, 1, 0, 0, -1, 0, 0, 'ul(78yGuc0fbK<mu,wf-Me/:{Z1{Q$', 0, 0, 0, '', 0, 0, 0, 0, 0, 0, 0, 0, 0, 0, 0, 0, '', '', 0, '', 'vb', '', 0, 1, 0, 0, NULL),
(23431, 2, '', 0, 'Ali Nisar', '2801d2c165f9c88259e96537d1c2b8fc', '2014-04-11', 'mustangandyou@gmail.com', 0, '', '', '', '', '', '', '', 2, 0, 'New Member', 0, 1397202515, 0, 1454050792, 1458495066, 1458494989, 492267, 9, 0, 4, '5', 0, 0, 0, 0, 0, 3194967, '03-07-1956', '1956-03-07', -1, -1, '61.5.159.153', 790, 1, 0, 0, -1, 0, 0, '~!Q<f5~.0*wHUfqx''2g5J[O=43QP+W', 0, 0, 0, '', 0, 0, 1, 1, 0, 0, 0, 0, 0, 0, 0, 0, '', '', 0, '', 'vb', '', 0, 1, 0, 0, NULL),
(23408, 2, '', 0, 'Hadii', '4b7f5c578cf220b8687f66d00022201e', '2014-04-10', 'hadijhandir@gmail.com', 7, '', '', '', '', '', '', '', 2, 0, 'Member', 0, 1397115622, 0, 1427099804, 1427368007, 1427088746, 476095, 169, 0, 4, '5', 0, 0, 0, 0, 0, 11584599, '03-26-1990', '1990-03-26', -1, 1, '182.185.151.22', 0, 0, 0, 0, -1, 0, 0, 'j1`WQJ}r)d<}TZCbgrquWB2qCQfns,', 0, 0, 0, '', 0, 0, 23, 3, 1, 0, 0, 0, 0, 0, 0, 0, '89f8f9217126d3588512c1271f3e0ca0', '', 0, '', 'vb', '', 0, 1, 0, 0, NULL),
(23349, 3, '', 0, 'CNaranjo', '8fccabb321b6cbb135452dbdb5ae00ea', '2014-04-07', 'summerwoodard79829@outlook.com', 0, '', '', '', '', '', '', '', 2, 0, 'New Member', 0, 1396874527, 0, 1396874527, 1396874527, 0, 0, 0, 0, 4, '5', 0, 0, 0, 0, 0, 3194967, '04-22-1978', '1978-04-22', -1, -1, '5.255.91.92', 0, 1, 0, 0, -1, 0, 0, '+]}%[+!!o$`SpZTx:np3&{wlpum^ja', 0, 0, 0, '', 0, 0, 0, 0, 0, 0, 0, 0, 0, 0, 0, 0, '', '', 0, '', 'vb', '', 0, 1, 0, 0, NULL),
(23350, 2, '', 0, 'mehr', 'f2039587e799692597c4136c5c29f686', '2014-04-07', 'adan1_1@yahoo.com', 0, '', '', '', '', '', '', '', 2, 0, 'New Member', 0, 1396874910, 0, 1396874910, 1396874993, 0, 0, 0, 0, 4, '5', 0, 0, 0, 0, 0, 3194967, '04-08-1982', '1982-04-08', -1, -1, '182.188.153.19', 0, 1, 0, 0, -1, 0, 0, 'AK4]c@5].wDiQ2v{A){3/P0s3O?\\DT', 0, 0, 0, '', 0, 0, 0, 0, 0, 0, 0, 0, 0, 0, 0, 0, '', '', 0, '', 'vb', '', 0, 1, 0, 0, NULL),
(23351, 2, '', 0, 'Duck Lover', '199119bc5fac3ced2e86c1b29e34d6b1', '2014-04-24', 'Rehmanarif7@gmail.com', 0, '', '', '', '', '', '', '', 2, 0, 'New Member', 0, 1396893405, 0, 1398373065, 1398373065, 0, 0, 0, 0, 4, '5', 0, 0, 0, 0, 0, 3194967, '09-10-1992', '1992-09-10', -1, -1, '182.186.74.124', 0, 1, 0, 0, -1, 0, 0, '}\\!L]x[p~{8~m=[otT-pPd[BLu4BP"', 0, 0, 0, '', 0, 0, 2, 0, 0, 0, 0, 0, 0, 0, 0, 0, '', '', 0, '', 'vb', '', 0, 1, 0, 0, NULL),
(23440, 2, '', 0, 'Magnum44', '669567e090433c7aa43898cd95d53a8e', '2014-04-12', 'letmetakeoff@gmail.com', 0, '', '', '', '', '', '', '', 2, 0, 'New Member', 0, 1397269082, 0, 1398412801, 1398422762, 1398412787, 435951, 1, 0, 4, '5', 0, 0, 0, 0, 0, 3194967, '08-17-1973', '1973-08-17', -1, -1, '39.55.202.232', 1, 1, 0, 0, -1, 0, 0, '$rgKvK?9Ar]KLBthZ~kA*k-(m/^MRy', 0, 0, 0, '', 0, 0, 0, 0, 0, 0, 0, 0, 0, 0, 0, 0, '', '', 0, '', 'vb', '', 0, 1, 0, 0, NULL),
(23468, 3, '', 0, 'OZKY', '5cbac7162594964869e496e5d6ea9179', '2014-04-13', 'pricklyhairstyl2to79@outlook.com', 0, '', '', '', '', '', '', '', 2, 0, 'New Member', 0, 1397385306, 0, 1397385306, 1397385306, 0, 0, 0, 0, 4, '5', 0, 0, 0, 0, 0, 3194967, '09-17-1975', '1975-09-17', -1, -1, '173.213.96.63', 0, 1, 0, 0, -1, 0, 0, '2G7_)PcGHU<,b%=b1jmeXPgu@SN3G]', 0, 0, 0, '', 0, 0, 0, 0, 0, 0, 0, 0, 0, 0, 0, 0, '', '', 0, '', 'vb', '', 0, 1, 0, 0, NULL),
(23427, 3, '', 0, 'FJKV', 'b6257c0e1139e03b4cec356092e666be', '2014-04-11', 'kkeithnr@yahoo.com', 0, '', '', '', '', '', '', '', 2, 0, 'New Member', 0, 1397195474, 0, 1397195474, 1397195474, 0, 0, 0, 0, 4, '5', 0, 0, 0, 0, 0, 3194967, '03-18-1971', '1971-03-18', -1, -1, '170.130.24.162', 0, 1, 0, 0, -1, 0, 0, '[''<2e4?D$)cA`&n^)0ZF)H*wrUHQeu', 0, 0, 0, '', 0, 0, 0, 0, 0, 0, 0, 0, 0, 0, 0, 0, '', '', 0, '', 'vb', '', 0, 1, 0, 0, NULL),
(23355, 3, '', 0, 'Buddy', '4b06571a215235b1b5c8c3ba6d09d38a', '2014-04-07', 'pakistaniboy_1@yahoo.com', 0, '', '', '', '', '', '', '', 2, 0, 'New Member', 0, 1396899647, 0, 1396899647, 1396901151, 0, 0, 0, 0, 4, '5', 0, 0, 0, 0, 0, 3194967, '03-30-1990', '1990-03-30', -1, -1, '58.65.190.2', 0, 1, 0, 0, -1, 0, 0, '6Q`K_(]Bsl(4B)r/IrZO}(+T6^.,sk', 0, 0, 0, '', 0, 0, 0, 0, 0, 0, 0, 0, 0, 0, 0, 0, '', '', 0, '', 'vb', '', 0, 1, 0, 0, NULL),
(23409, 3, '', 0, 'Rauf Alam', 'f7e5d00080c77676471b076fa60937be', '2014-04-10', 'raufalam19@gmail.com', 0, '', '', '', '', '', '', '', 2, 0, 'New Member', 0, 1397116445, 0, 1397116445, 1397116731, 0, 0, 0, 0, 4, '5', 0, 0, 0, 0, 0, 3194967, '06-25-1989', '1989-06-25', -1, -1, '113.203.171.241', 0, 1, 0, 0, -1, 0, 0, '[B*h3"o]Mm+EFZ?~Y]\\8D^iqXJ9Y0Z', 0, 0, 0, '', 0, 0, 0, 0, 0, 0, 0, 0, 0, 0, 0, 0, '', '', 0, '', 'vb', '', 0, 1, 0, 0, NULL),
(23358, 3, '', 0, 'KD83', 'bc3dc3759dab4b15deb7861db14f06ea', '2014-04-08', 'nobukopiccillo5955@live.com', 0, '', '', '', '', '', '', '', 2, 0, 'New Member', 0, 1396922468, 0, 1396922468, 1396922468, 0, 0, 0, 0, 4, '5', 0, 0, 0, 0, 0, 3194967, '11-05-1970', '1970-11-05', -1, -1, '50.2.225.107', 0, 1, 0, 0, -1, 0, 0, '4.%m%/``_h=[\\Cd)AYUM8uZtQUK;`3', 0, 0, 0, '', 0, 0, 0, 0, 0, 0, 0, 0, 0, 0, 0, 0, '', '', 0, '', 'vb', '', 0, 1, 0, 0, NULL),
(23360, 2, '', 0, 'arslaan safder', '693d4118fd49059ad8ebda75340b3f9b', '2014-04-08', 'arsi_armypsmc@hotmail.com', 0, '', '', '', '', '', '', '', 2, 0, 'New Member', 0, 1396934052, 0, 1396934052, 1396935356, 0, 0, 0, 0, 4, '5', 0, 0, 0, 0, 0, 3194967, '06-25-1991', '1991-06-25', -1, -1, '119.159.29.174', 0, 1, 0, 0, -1, 0, 0, '=G>=I*"_ua}j-$1"&#\\&Y_8@H]KSaN', 0, 0, 0, '', 0, 0, 0, 0, 0, 0, 0, 0, 0, 0, 0, 0, '', '', 0, '', 'vb', '', 0, 1, 0, 0, NULL),
(23433, 2, '', 0, 'engr.rashid1977', 'ef0bcd72c6679f0407741296244514dc', '2014-04-11', 'engr.rashid.marwat@gmail.com', 0, '', '', '', '', '', '', '', 2, 0, 'New Member', 0, 1397214286, 0, 1397216397, 1397216397, 0, 0, 0, 0, 4, '5', 0, 0, 0, 0, 0, 3194967, '08-20-1977', '1977-08-20', -1, -1, '182.181.222.22', 0, 1, 0, 0, -1, 0, 0, 'lN~q*Iw|$3[y=s44NSbT+i8Q"<,JGN', 0, 0, 0, '', 0, 0, 0, 0, 0, 0, 0, 0, 0, 0, 0, 0, '', '', 0, '', 'vb', '', 0, 1, 0, 0, NULL),
(23363, 2, '', 0, 'pagal', '19611ca838a13d426a59d643e4a0a17b', '2014-04-08', 'ipakipower@gmail.com', 0, '', '', '', '', '', '', '', 2, 0, 'New Member', 0, 1396942939, 0, 1396942939, 1396943170, 0, 0, 0, 0, 4, '5', 0, 0, 0, 0, 0, 3194967, '10-29-1990', '1990-10-29', -1, -1, '182.184.30.133', 0, 1, 0, 0, -1, 0, 0, 'leIAxXN%eSh|U''2Eb4''b</>~@VgI;P', 0, 0, 0, '', 0, 0, 0, 0, 0, 0, 0, 0, 0, 0, 0, 0, '', '', 0, '', 'vb', '', 0, 1, 0, 0, NULL),
(23416, 3, '', 0, 'syed hasee', 'bd9eb5b79241dc9561b4ad0ecb2eacd2', '2014-04-10', 'haseebmarwat08@gmail.com', 0, '', '', '', '', '', '', '', 2, 0, 'New Member', 0, 1397148930, 0, 1397148930, 1397149315, 0, 0, 0, 0, 4, '5', 0, 0, 0, 0, 0, 3194967, '07-22-1991', '1991-07-22', -1, -1, '119.154.148.112', 0, 1, 0, 0, -1, 0, 0, 'E$uHnTN/^9w!w|sW$hA]]oXk>vikhC', 0, 0, 0, '', 0, 0, 0, 0, 0, 0, 0, 0, 0, 0, 0, 0, '', '', 0, '', 'vb', '', 0, 1, 0, 0, NULL),
(23366, 2, '', 0, 'Fahad150', '20cadbc76ae633a0f87d6506be039366', '2016-05-21', 'fahdalpha@gmail.com', 9, '', '', '', '', '', '', '', 2, 0, 'New Member', 0, 1396966300, 0, 1464125669, 1467529305, 1463877085, 494202, 9, 0, 4, '5', 0, 0, 0, 0, 0, 11551831, '01-18-1991', '1991-01-18', 40, 2, '182.180.93.44', 0, 0, 0, 0, -1, 0, 0, 'c(#Ng<p:W0y;%!#$l4<8;vSw&1@fzf', 0, 0, 0, '', 0, 0, 2, 0, 0, 0, 0, 0, 0, 0, 0, 0, '', '', 0, '', 'vb', '', 0, 1, 0, 0, NULL),
(23368, 3, '', 0, 'M5218', '200b762c67ca03201b9f6eae748471b8', '2014-04-08', 'angelicpojcv@hotmail.com', 0, '', '', '', '', '', '', '', 2, 0, 'New Member', 0, 1396977686, 0, 1396977686, 1396977686, 0, 0, 0, 0, 4, '5', 0, 0, 0, 0, 0, 3194967, '07-30-1979', '1979-07-30', -1, -1, '2.51.13.148', 0, 1, 0, 0, -1, 0, 0, '%ib/m<'':~%q-M3%e0%!igO$HivL}&]', 0, 0, 0, '', 0, 0, 0, 0, 0, 0, 0, 0, 0, 0, 0, 0, '', '', 0, '', 'vb', '', 0, 1, 0, 0, NULL),
(23369, 2, '', 0, 'Akhunzada', 'b6afefe16b540555e2538956047ea406', '2014-04-08', 'abbi_dj@hotmail.com', 0, '', '', '', '', '', '', '', 2, 0, 'Rookie', 0, 1396978368, 0, 1437415947, 1475271653, 1435619409, 483034, 38, 0, 4, '5', 0, 0, 0, 0, 0, 3194967, '09-30-1986', '1986-09-30', -1, -1, '39.32.130.114', 0, 1, 0, 0, -1, 0, 0, '!}/)TN(p&.Hp-=0undAvEW4xCwo"H(', 0, 0, 0, '', 0, 0, 9, 2, 0, 0, 0, 0, 0, 0, 0, 0, '601f3019cc5fc01c0642f933f10ad514', '', 0, '', 'vb', '', 0, 1, 0, 0, NULL),
(23370, 2, '', 0, 'usama13', 'c6c555f67af85b78bea286100b8246af', '2014-04-08', 'usamamela@gmail.com', 0, '', '', '', '', '', '', '', 2, 0, 'New Member', 0, 1396980756, 0, 1397161084, 1398191021, 1397161083, 433665, 3, 0, 4, '5', 0, 0, 0, 0, 0, 3194967, '11-16-1991', '1991-11-16', -1, -1, '132.216.227.88', 790, 1, 0, 0, -1, 0, 0, '3WYTGnRg1@*^ps4wjN=<7p}O(3@Y:T', 0, 0, 0, '', 0, 0, 0, 0, 0, 0, 0, 0, 0, 0, 0, 0, '', '', 0, '', 'vb', '', 0, 1, 0, 0, NULL),
(23371, 3, '', 0, 'MJkf', '08be86a034c15321b09f811cba041099', '2014-04-08', 'kuf@willievacca.com', 0, '', '', '', '', '', '', '', 2, 0, 'New Member', 0, 1396983878, 0, 1396983878, 1396984665, 0, 0, 0, 0, 4, '5', 0, 0, 0, 0, 0, 3194967, '04-06-1979', '1979-04-06', -1, -1, '107.155.81.78', 0, 1, 0, 0, -1, 0, 0, 'E|zXR{c\\&cpXfAz${o2qy~-Wssz<M[', 0, 0, 0, '', 0, 0, 0, 0, 0, 0, 0, 0, 0, 0, 0, 0, '', '', 0, '', 'vb', '', 0, 1, 0, 0, NULL),
(23463, 2, '', 0, 'hussainwala', '30a006ff16df7c38ead84af0cb6926e2', '2014-05-20', 'yahhussain@gmail.com', 0, '', '', '', '', '', '', '', 2, 0, 'Rookie', 0, 1397375516, 0, 1401186724, 1401377389, 1400674270, 441099, 26, 0, 4, '5', 0, 0, 0, 0, 0, 3194967, '03-29-1985', '1985-03-29', -1, -1, '39.42.180.230', 16541, 1, 0, 0, -1, 0, 0, '&4ud@:x^:P_~%Eg#+Gi);^!E*m>NvN', 0, 0, 0, '', 0, 0, 1, 1, 0, 0, 0, 0, 0, 0, 0, 0, '494f747ec21025cc9aa5a15080182561', '', 0, '', 'vb', '', 0, 1, 0, 0, NULL),
(23430, 3, '', 0, 'LEGM', '647779ee1edd030802583668b4e941ee', '2014-04-11', 'spotlessstem030@hotmail.com', 0, '', '', '', '', '', '', '', 2, 0, 'New Member', 0, 1397202353, 0, 1397202353, 1397202353, 0, 0, 0, 0, 4, '5', 0, 0, 0, 0, 0, 3194967, '07-22-1970', '1970-07-22', -1, -1, '50.2.225.109', 0, 1, 0, 0, -1, 0, 0, 'l0e-KO|wo*f<$H.(RA`GuF4{pvys?a', 0, 0, 0, '', 0, 0, 0, 0, 0, 0, 0, 0, 0, 0, 0, 0, '', '', 0, '', 'vb', '', 0, 1, 0, 0, NULL),
(23541, 3, '', 0, 'JTomholt', '331b8e760e9bb3914f983203fc5560c4', '2014-04-15', 'ophelia38laurange@outlook.com', 0, '', '', '', '', '', '', '', 2, 0, 'New Member', 0, 1397595621, 0, 1397595621, 1398028187, 0, 0, 0, 0, 4, '5', 0, 0, 0, 0, 0, 3194967, '03-25-1973', '1973-03-25', -1, -1, '192.210.144.36', 0, 1, 0, 0, -1, 0, 0, 'zRGlL{/''ZlvD{<r)>eVxEZ[FB31Wkx', 0, 0, 0, '', 0, 0, 0, 0, 0, 0, 0, 0, 0, 0, 0, 0, '', '', 0, '', 'vb', '', 0, 1, 0, 0, NULL);
INSERT INTO `user` (`userid`, `usergroupid`, `membergroupids`, `displaygroupid`, `username`, `password`, `passworddate`, `email`, `styleid`, `parentemail`, `homepage`, `icq`, `aim`, `yahoo`, `msn`, `skype`, `showvbcode`, `showbirthday`, `usertitle`, `customtitle`, `joindate`, `daysprune`, `lastvisit`, `lastactivity`, `lastpost`, `lastpostid`, `posts`, `reputation`, `reputationlevelid`, `timezoneoffset`, `pmpopup`, `avatarid`, `avatarrevision`, `profilepicrevision`, `sigpicrevision`, `options`, `birthday`, `birthday_search`, `maxposts`, `startofweek`, `ipaddress`, `referrerid`, `languageid`, `emailstamp`, `threadedmode`, `autosubscribe`, `pmtotal`, `pmunread`, `salt`, `ipoints`, `infractions`, `warnings`, `infractiongroupids`, `infractiongroupid`, `adminoptions`, `profilevisits`, `friendcount`, `friendreqcount`, `vmunreadcount`, `vmmoderatedcount`, `socgroupinvitecount`, `socgroupreqcount`, `pcunreadcount`, `pcmoderatedcount`, `gmmoderatedcount`, `assetposthash`, `fbuserid`, `fbjoindate`, `fbname`, `logintype`, `fbaccesstoken`, `bloggroupreqcount`, `showblogcss`, `importuserid`, `newrepcount`, `panjo_selling`) VALUES
(23376, 3, '', 0, 'SEspino', '2b0c8ce09d94cc97d70608f26db27ddd', '2014-04-09', 'nappyknoll66nr845@outlook.com', 0, '', '', '', '', '', '', '', 2, 0, 'New Member', 0, 1396998617, 0, 1396998617, 1396998617, 0, 0, 0, 0, 4, '5', 0, 0, 0, 0, 0, 3194967, '03-28-1977', '1977-03-28', -1, -1, '23.94.20.40', 0, 1, 0, 0, -1, 0, 0, ']!>/(9-=+@=b9WADzU3G=c[9uESa1x', 0, 0, 0, '', 0, 0, 0, 0, 0, 0, 0, 0, 0, 0, 0, 0, '', '', 0, '', 'vb', '', 0, 1, 0, 0, NULL),
(23378, 3, '', 0, 'C0508', 'ac9c079ab832907c33c184d41156ed8a', '2014-04-09', 'jyvuqimejyly@hotmail.com', 0, '', '', '', '', '', '', '', 2, 0, 'New Member', 0, 1396999853, 0, 1396999853, 1397039248, 0, 0, 0, 0, 4, '5', 0, 0, 0, 0, 0, 3194967, '09-01-1976', '1976-09-01', -1, -1, '198.55.99.156', 0, 1, 0, 0, -1, 0, 0, 'omt#v%i3Zm3m-)F}_/iceOR;6Cy;B%', 0, 0, 0, '', 0, 0, 0, 0, 0, 0, 0, 0, 0, 0, 0, 0, '', '', 0, '', 'vb', '', 0, 1, 0, 0, NULL),
(23405, 2, '', 0, 'shani jutt', '7f2fa9362fa37486d70f2c3012f17b6c', '2014-04-10', 'shanijutt167@gmail.com', 0, '', '', '', '', '', '', '', 2, 0, 'New Member', 0, 1397115296, 0, 1397115296, 1397116684, 0, 0, 0, 0, 4, '5', 0, 0, 0, 0, 0, 3194967, '12-31-1996', '1996-12-31', -1, -1, '42.83.85.12', 0, 1, 0, 0, -1, 0, 0, 'fo?7/evHR_yR}Y1eI*p*`;SQU{Fu/E', 0, 0, 0, '', 0, 0, 0, 0, 0, 0, 0, 0, 0, 0, 0, 0, '', '', 0, '', 'vb', '', 0, 1, 0, 0, NULL),
(23381, 3, '', 0, 'BHaggerty', 'ba124124f301aae88e3b7e4742703c13', '2014-04-09', 'evasivewhiz19nl81@outlook.com', 0, '', '', '', '', '', '', '', 2, 0, 'New Member', 0, 1397006096, 0, 1397006096, 1397006096, 0, 0, 0, 0, 4, '5', 0, 0, 0, 0, 0, 3194967, '02-21-1971', '1971-02-21', -1, -1, '173.232.105.51', 0, 1, 0, 0, -1, 0, 0, 'ZK<4z)!-lU!4;{b3~c1a(>0''b$B62+', 0, 0, 0, '', 0, 0, 0, 0, 0, 0, 0, 0, 0, 0, 0, 0, '', '', 0, '', 'vb', '', 0, 1, 0, 0, NULL),
(23382, 3, '', 0, 'JTeece', 'ca2636bc2d5938a5fc19b541f4a6f2f3', '2014-04-09', 'marycopeland90275@outlook.com', 0, '', '', '', '', '', '', '', 2, 0, 'New Member', 0, 1397007563, 0, 1397007563, 1397007563, 0, 0, 0, 0, 4, '5', 0, 0, 0, 0, 0, 3194967, '04-28-1979', '1979-04-28', -1, -1, '37.203.208.185', 0, 1, 0, 0, -1, 0, 0, 'K3U%Z1F[-c/P#+C*jEl;qvytD2"#*@', 0, 0, 0, '', 0, 0, 0, 0, 0, 0, 0, 0, 0, 0, 0, 0, '', '', 0, '', 'vb', '', 0, 1, 0, 0, NULL),
(23550, 2, '', 0, 'Dr.Homayoun sheikh', 'f54cd830513d5c3f9164950019ec4eb8', '2014-04-16', 'drhsheikhmd@gmail.com', 0, '', '', '', '', '', '', '', 2, 0, 'Member', 0, 1397631141, 0, 1400328154, 1401647039, 1400115793, 439718, 57, 0, 4, '5', 0, 0, 0, 0, 0, 3194967, '07-24-1969', '1969-07-24', -1, -1, '113.203.130.247', 0, 1, 0, 0, -1, 0, 0, 'kpV`APErJ~JG`ogU/s,_WvK@c\\~|M$', 0, 0, 0, '', 0, 0, 18, 1, 1, 0, 0, 0, 0, 0, 0, 0, '320528cbb044d294b40c3ee024781ff7', '', 0, '', 'vb', '', 0, 1, 0, 0, NULL),
(23421, 2, '', 0, 'Gunnie', 'f098ee384449b1a9c269775e551dcc7c', '2014-04-11', 'usmanden@hotmail.com', 0, '', '', '', '', '', '', '', 2, 0, 'New Member', 0, 1397174198, 0, 1470223546, 1470679195, 1470223175, 495705, 4, 0, 4, '5', 0, 0, 0, 0, 0, 3194967, '12-09-1984', '1984-12-09', -1, -1, '39.32.205.192', 0, 1, 0, 0, -1, 0, 0, 'OsP[iNghb=4GUShP\\g4\\Dl8t&\\/[$6', 0, 0, 0, '', 0, 0, 0, 0, 0, 0, 0, 0, 0, 0, 0, 0, '', '', 0, '', 'vb', '', 0, 1, 0, 0, NULL),
(23384, 3, '', 0, 'abobbyshuleay8678', '10a87af2385a766ec5a15f2d7b2d0095', '2014-04-09', 'abobbyshuleay@ymail.com', 0, '', '', '', '', '', '', '', 2, 0, 'New Member', 0, 1397011346, 0, 1397011346, 1397011346, 0, 0, 0, 0, 4, '-4', 0, 0, 0, 0, 0, 3194903, '07-09-1986', '1986-07-09', -1, -1, '41.134.63.50', 0, 1, 0, 0, -1, 0, 0, 'NRRa,eG}K7XT4?\\FN7J"(e>Y''>e|^7', 0, 0, 0, '', 0, 0, 0, 0, 0, 0, 0, 0, 0, 0, 0, 0, '', '', 0, '', 'vb', '', 0, 1, 0, 0, NULL),
(23704, 2, '', 0, 'slayer', '7ac8f88b156c3bb1cb63920dd63a7198', '2014-04-22', 'alisaeed40@gmail.com', 0, '', '', '', '', '', '', '', 2, 0, 'New Member', 0, 1398162298, 0, 1398251874, 1398255799, 1398250300, 435583, 2, 0, 4, '5', 0, 0, 0, 0, 0, 3194967, '08-30-1981', '1981-08-30', -1, -1, '125.209.127.187', 0, 1, 0, 0, -1, 0, 0, '*WRO<$Sb?Rx#<p>Y$8D~$S;#qj#.|A', 0, 0, 0, '', 0, 0, 0, 0, 0, 0, 0, 0, 0, 0, 0, 0, '', '', 0, '', 'vb', '', 0, 1, 0, 0, NULL),
(23584, 3, '', 0, 'pilate', '7ffa6f44bef55dc2536fc6a329b65b5c', '2014-04-17', 'raheel.rabbani123@hotmail.com', 0, '', '', '', '', '', '', '', 2, 0, 'New Member', 0, 1397732967, 0, 1397733358, 1397733358, 0, 0, 0, 0, 4, '5', 0, 0, 0, 0, 0, 3194967, '05-21-1989', '1989-05-21', -1, -1, '113.203.137.96', 0, 1, 0, 0, -1, 0, 0, 'Wq3{?TgjW0Wrt.8w"HU''J`)|h`;JpK', 0, 0, 0, '', 0, 0, 0, 0, 0, 0, 0, 0, 0, 0, 0, 0, '', '', 0, '', 'vb', '', 0, 1, 0, 0, NULL),
(23386, 3, '', 0, 'zia khan', '959399a1c4283e69def782c893d6e646', '2014-04-09', 'sspusmanizia@yahoo.com', 0, '', '', '', '', '', '', '', 2, 0, 'New Member', 0, 1397020532, 0, 1397637019, 1397637019, 0, 0, 0, 0, 4, '5', 0, 0, 0, 0, 0, 3194967, '06-10-1994', '1994-06-10', -1, -1, '69.22.184.107', 363, 1, 0, 0, -1, 0, 0, ';D%@e[iSw(?+(RHrNZtns7(J[J/k*]', 0, 0, 0, '', 0, 0, 0, 0, 0, 0, 0, 0, 0, 0, 0, 0, '', '', 0, '', 'vb', '', 0, 1, 0, 0, NULL),
(23387, 2, '', 0, 'Kashif Uddin Syed', '5264906c34500495ea81668ac9940a4d', '2014-04-09', 'kashifuddinsyed@gmail.com', 0, '', '', '', '', '', '', '', 2, 0, 'New Member', 0, 1397023204, 0, 1397023204, 1397023358, 0, 0, 0, 0, 4, '5', 0, 0, 0, 0, 0, 3194967, '01-02-1972', '1972-01-02', -1, -1, '202.147.162.36', 0, 1, 0, 0, -1, 0, 0, '-TZYe4_s9+:!/P$3F{O_p>LUZn&m9F', 0, 0, 0, '', 0, 0, 0, 0, 0, 0, 0, 0, 0, 0, 0, 0, '', '', 0, '', 'vb', '', 0, 1, 0, 0, NULL),
(23470, 2, '', 0, 'raja.ahmad', 'ac8fbd9cc531a4657b34d57315f356fb', '2014-04-13', 'raja.ahmad903@gmail.com', 0, '', '', '', '', '', '', '', 2, 0, 'New Member', 0, 1397398047, 0, 1397398047, 1397398277, 0, 0, 0, 0, 4, '5', 0, 0, 0, 0, 0, 3194967, '06-04-1987', '1987-06-04', -1, -1, '39.32.165.160', 0, 1, 0, 0, -1, 0, 0, '(:A!id{dXI>{B.=NzlL)YomeM2%{!^', 0, 0, 0, '', 0, 0, 1, 0, 0, 0, 0, 0, 0, 0, 0, 0, '', '', 0, '', 'vb', '', 0, 1, 0, 0, NULL),
(23553, 3, '', 0, 'MAYM', '1d945015c525cb49248acdfbc0503c8e', '2014-04-16', 'shiramrmolly@yahoo.com', 0, '', '', '', '', '', '', '', 2, 0, 'New Member', 0, 1397640212, 0, 1397640212, 1397640212, 0, 0, 0, 0, 4, '5', 0, 0, 0, 0, 0, 3194967, '07-30-1983', '1983-07-30', -1, -1, '184.154.9.35', 0, 1, 0, 0, -1, 0, 0, 'iGXvGhfGF5U&IYD3HR"Td!XoB/I7Ef', 0, 0, 0, '', 0, 0, 0, 0, 0, 0, 0, 0, 0, 0, 0, 0, '', '', 0, '', 'vb', '', 0, 1, 0, 0, NULL),
(23390, 3, '', 0, 'mayabhai', '358646c339dab2a1f555d81f605363a1', '2014-04-09', 'danger_baloch302@yahoo.com', 0, '', '', '', '', '', '', '', 2, 0, 'New Member', 0, 1397030382, 0, 1397030542, 1397034231, 1397032279, 0, 1, 0, 4, '5', 0, 0, 0, 0, 0, 3195095, '06-10-1986', '1986-06-10', -1, -1, '94.59.67.122', 0, 1, 1397032279, 0, -1, 0, 0, '[C*W:.sHQOOM)2~wa3defchj{yy,Y''', 0, 0, 0, '', 0, 0, 0, 0, 0, 0, 0, 0, 0, 0, 0, 0, '', '', 0, '', 'vb', '', 0, 1, 0, 0, NULL),
(23549, 3, '', 0, 'JHatton', '3294d6d5ad548054d813438de1d5e470', '2014-04-16', 'allinejekeene@yahoo.com', 0, '', '', '', '', '', '', '', 2, 0, 'New Member', 0, 1397621955, 0, 1397621955, 1397621955, 0, 0, 0, 0, 4, '5', 0, 0, 0, 0, 0, 3194967, '08-16-1981', '1981-08-16', -1, -1, '198.143.144.242', 0, 1, 0, 0, -1, 0, 0, 'xi5>.IT:{:''tq<.,hBU<?[szy$WX+\\', 0, 0, 0, '', 0, 0, 0, 0, 0, 0, 0, 0, 0, 0, 0, 0, '', '', 0, '', 'vb', '', 0, 1, 0, 0, NULL),
(23480, 3, '', 0, 'LAkins', 'fd23d4691149ec710ac5318c5bbaec73', '2014-04-14', 'derangedaxle4824@outlook.com', 0, '', '', '', '', '', '', '', 2, 0, 'New Member', 0, 1397431348, 0, 1397431348, 1397864853, 0, 0, 0, 0, 4, '5', 0, 0, 0, 0, 0, 3194967, '05-13-1980', '1980-05-13', -1, -1, '5.39.54.16', 0, 1, 0, 0, -1, 0, 0, ']5E4#Yf3>)\\LP:/Fn[5?iT1|_b0!>^', 0, 0, 0, '', 0, 0, 0, 0, 0, 0, 0, 0, 0, 0, 0, 0, '', '', 0, '', 'vb', '', 0, 1, 0, 0, NULL),
(23460, 3, '', 0, 'MaMughal', '23d01bd79a7d9df45a63e76546f561e3', '2014-04-13', 'ashar.mughal@outlook.com', 0, '', '', '', '', '', '', '', 2, 0, 'New Member', 0, 1397363168, 0, 1397363168, 1397363238, 0, 0, 0, 0, 4, '5', 0, 0, 0, 0, 0, 3194967, '10-29-1994', '1994-10-29', -1, -1, '182.187.57.220', 0, 1, 0, 0, -1, 0, 0, 'bBP"H.zt7fa2vB;E.-F#3abo(17]$7', 0, 0, 0, '', 0, 0, 0, 0, 0, 0, 0, 0, 0, 0, 0, 0, '', '', 0, '', 'vb', '', 0, 1, 0, 0, NULL),
(23461, 3, '', 0, 'M69P', 'ad565731d9df9e53ae690701e22f8835', '2014-04-13', 'ap.t.ak.444@gmail.com', 0, '', '', '', '', '', '', '', 2, 0, 'New Member', 0, 1397365981, 0, 1397365981, 1397981276, 0, 0, 0, 0, 4, '5', 0, 0, 0, 0, 0, 3194967, '07-22-1971', '1971-07-22', -1, -1, '192.3.183.6', 0, 1, 0, 0, -1, 0, 0, 'K9D^+pbxY2-m]U5:QH;k~R$#AX&uZj', 0, 0, 0, '', 0, 0, 0, 0, 0, 0, 0, 0, 0, 0, 0, 0, '', '', 0, '', 'vb', '', 0, 1, 0, 0, NULL),
(23398, 2, '', 0, 'Abdullahtahir', 'd136e8ea28843ee3405f7a94e4109ace', '2014-04-09', 'blueribon_13@yahoo.com', 0, '', '', '', '', '', '', '', 2, 0, 'New Member', 0, 1397067309, 0, 1397067309, 1397067445, 0, 0, 0, 0, 4, '5', 0, 0, 0, 0, 0, 3194967, '01-03-1987', '1987-01-03', -1, -1, '39.41.132.138', 0, 1, 0, 0, -1, 0, 0, 'wV''(X3fPJ}bC]U$X[,lzM%RUU]baK3', 0, 0, 0, '', 0, 0, 0, 0, 0, 0, 0, 0, 0, 0, 0, 0, '', '', 0, '', 'vb', '', 0, 1, 0, 0, NULL),
(23399, 2, '', 0, 'usman ali', '270f7f0bb60940783d45eef06fd954d0', '2014-04-09', 'rabiarabia230@yahoo.com', 0, '', '', '', '', '', '', '', 2, 0, 'New Member', 0, 1397073827, 0, 1397073827, 1397074992, 0, 0, 0, 0, 4, '5', 0, 0, 0, 0, 0, 3195095, '07-31-1989', '1989-07-31', -1, -1, '86.97.67.201', 0, 1, 0, 0, -1, 0, 0, 'z?u!l1>I=d6*LCAIVsc[4PO''k>DvjS', 0, 0, 0, '', 0, 0, 0, 0, 0, 0, 0, 0, 0, 0, 0, 0, '', '', 0, '', 'vb', '', 0, 1, 0, 0, NULL),
(23401, 3, '', 0, 'apatickmshtolzeay5727', '3d59f4f3af11909e2c4e6bb391b52604', '2014-04-09', 'apatickmshtolzeay@ymail.com', 0, '', '', '', '', '', '', '', 2, 0, 'New Member', 0, 1397078929, 0, 1397078929, 1397078929, 0, 0, 0, 0, 4, '7', 0, 0, 0, 0, 0, 3194903, '02-26-1984', '1984-02-26', -1, -1, '190.242.67.67', 0, 1, 0, 0, -1, 0, 0, 'V97eaL_7O>PS&W.-3FEdx''R8|kWb^a', 0, 0, 0, '', 0, 0, 0, 0, 0, 0, 0, 0, 0, 0, 0, 0, '', '', 0, '', 'vb', '', 0, 1, 0, 0, NULL),
(23441, 3, '', 0, 'MichealKt', '816cc0b6be1415f65205f41f8791c072', '2014-04-12', 'g.oo.g.le@gmail.com', 0, '', '', '', '', '', '', '', 2, 0, 'New Member', 0, 1397275899, 0, 1397275899, 1397275899, 0, 0, 0, 0, 4, '6.5', 0, 0, 0, 0, 0, 3194903, '09-01-1976', '1976-09-01', -1, -1, '103.6.189.187', 0, 1, 0, 0, -1, 0, 0, '%}zZ+t4rnoW]B1v21L@Nuq*Q=hQdBX', 0, 0, 0, '', 0, 0, 0, 0, 0, 0, 0, 0, 0, 0, 0, 0, '', '', 0, '', 'vb', '', 0, 1, 0, 0, NULL),
(23442, 3, '', 0, 'bapatrikmtivanov3312', '97d06c3c963944c5de77cbe118ba5e49', '2014-04-12', 'bapatrikmtivanov@ymail.com', 0, '', '', '', '', '', '', '', 2, 0, 'New Member', 0, 1397276209, 0, 1397276209, 1397276350, 0, 0, 0, 0, 4, '10', 0, 0, 0, 0, 0, 3195031, '10-05-1978', '1978-10-05', -1, -1, '110.232.70.99', 0, 1, 0, 0, -1, 0, 0, 't=I6b*^F9w%>Xd7o%n\\"|t{{ZUMsrV', 0, 0, 0, '', 0, 0, 0, 0, 0, 0, 0, 0, 0, 0, 0, 0, '', '', 0, '', 'vb', '', 0, 1, 0, 0, NULL),
(23559, 2, '', 0, 'khanhassan', '002b4a8a5d64e8550d4fed8f081fcf3a', '2015-08-31', 'hassankhan.fsd@gmail.com', 0, '', '', '', '', '', '', '', 2, 0, 'New Member', 0, 1397648242, 0, 1397649291, 1441042821, 1441042136, 485625, 1, 0, 4, '5', 0, 0, 0, 0, 0, 3194967, '11-16-1980', '1980-11-16', -1, -1, '182.186.207.104', 2900, 1, 0, 0, -1, 0, 0, 'EKNe''"(QfcFgl+''i],dzfi1O|5?&Y]', 0, 0, 0, '', 0, 0, 0, 0, 0, 0, 0, 0, 0, 0, 0, 0, '', '', 0, '', 'vb', '', 0, 1, 0, 0, NULL),
(23723, 3, '', 0, 'GHager', 'cf71ddad549357958943ea9f5ad008f6', '2014-04-23', 'cravenschedule4zc66d@outlook.com', 0, '', '', '', '', '', '', '', 2, 0, 'New Member', 0, 1398238453, 0, 1398238453, 1398245994, 0, 0, 0, 0, 4, '5', 0, 0, 0, 0, 0, 3194967, '05-26-1983', '1983-05-26', -1, -1, '172.241.136.147', 0, 1, 0, 0, -1, 0, 0, 'obhk|M.F6:zS:fN3[LUQ`otC-vspH"', 0, 0, 0, '', 0, 0, 0, 0, 0, 0, 0, 0, 0, 0, 0, 0, '', '', 0, '', 'vb', '', 0, 1, 0, 0, NULL),
(24590, 3, '', 0, 'CHoppe', 'f844b67d1b86849af8d1995af1af4226', '2014-05-20', 'burtonuahehuq48@hotmail.com', 0, '', '', '', '', '', '', '', 2, 0, 'New Member', 0, 1400622974, 0, 1400622974, 1401147911, 0, 0, 0, 0, 4, '5', 0, 0, 0, 0, 0, 3194967, '09-28-1978', '1978-09-28', -1, -1, '198.167.136.100', 0, 1, 0, 0, -1, 0, 0, '#AgH"\\[/wv1eBE]H^H.l]~.tfL\\<q4', 0, 0, 0, '', 0, 0, 0, 0, 0, 0, 0, 0, 0, 0, 0, 0, '', '', 0, '', 'vb', '', 0, 1, 0, 0, NULL),
(23457, 3, '', 0, 'aolgauopay352', '327782a2fd0f1f96db54ff2a6ef95857', '2014-04-13', 'aolgauopay@ymail.com', 0, '', '', '', '', '', '', '', 2, 0, 'New Member', 0, 1397347524, 0, 1397347524, 1397347524, 0, 0, 0, 0, 4, '5.75', 0, 0, 0, 0, 0, 3195031, '03-17-1983', '1983-03-17', -1, -1, '134.249.48.133', 0, 1, 0, 0, -1, 0, 0, '8}<fxa#"-;RfP+,3S,k?L;IKu^a3Xh', 0, 0, 0, '', 0, 0, 0, 0, 0, 0, 0, 0, 0, 0, 0, 0, '', '', 0, '', 'vb', '', 0, 1, 0, 0, NULL),
(23448, 2, '', 0, 'Jamal mustafa', '03c5f0d3b193fe3f47b31f399e69ff53', '2014-04-12', 'Mustafajamal@gmail.com', 0, '', '', '', '', '', '', '', 2, 0, 'New Member', 0, 1397295831, 0, 1474781550, 1477463342, 1454919247, 490588, 12, 0, 4, '5', 0, 25, 0, 0, 0, 3194967, '01-29-1983', '1983-01-29', -1, -1, '66.249.81.16', 0, 1, 0, 0, -1, 0, 0, 'J&`YI=Cotc|G1M9ncBPKQ.o1z5"~}P', 0, 0, 0, '', 0, 0, 4, 0, 0, 0, 0, 0, 0, 0, 0, 0, '', '', 0, '', 'vb', '', 0, 1, 0, 0, NULL),
(23450, 3, '', 0, 'KBrookins', '1647a31bdd3d149799bfc5714a3baaff', '2014-04-12', 'chantellewln812@hotmail.com', 0, '', '', '', '', '', '', '', 2, 0, 'New Member', 0, 1397311425, 0, 1397311425, 1397745655, 0, 0, 0, 0, 4, '5', 0, 0, 0, 0, 0, 3194967, '08-17-1971', '1971-08-17', -1, -1, '142.91.106.106', 0, 1, 0, 0, -1, 0, 0, 'dd''fly!/aO(*]2MQ[Ci.]~&Ac:''~~i', 0, 0, 0, '', 0, 0, 0, 0, 0, 0, 0, 0, 0, 0, 0, 0, '', '', 0, '', 'vb', '', 0, 1, 0, 0, NULL),
(23482, 3, '', 0, 'RPBE', '5f900127b44c28456e06734e296db9e8', '2014-04-14', 'herminalmj615@hotmail.com', 0, '', '', '', '', '', '', '', 2, 0, 'New Member', 0, 1397439677, 0, 1397439677, 1397439677, 0, 0, 0, 0, 4, '5', 0, 0, 0, 0, 0, 3194967, '04-01-1979', '1979-04-01', -1, -1, '165.231.22.123', 0, 1, 0, 0, -1, 0, 0, '*KN&+rT;"eE,''9go10-n6;)Io);(Z>', 0, 0, 0, '', 0, 0, 0, 0, 0, 0, 0, 0, 0, 0, 0, 0, '', '', 0, '', 'vb', '', 0, 1, 0, 0, NULL),
(23564, 3, '', 0, 'shahza', '3556ad0396af809a05ea32db24b37a62', '2014-04-16', 'shahzad@pkguns.com', 0, '', '', '', '', '', '', '', 2, 0, 'New Member', 0, 1397664117, 0, 1397664669, 1397664669, 0, 0, 0, 0, 4, '5', 0, 0, 0, 0, 0, 3195031, '01-27-1993', '1993-01-27', -1, -1, '39.42.206.4', 0, 1, 0, 0, -1, 0, 0, 'Q&s|!XxJzbb{6&ZKM6H3)N??PiJ1!b', 0, 0, 0, '', 0, 0, 0, 0, 0, 0, 0, 0, 0, 0, 0, 0, '', '', 0, '', 'vb', '', 0, 1, 0, 0, NULL),
(23546, 3, '', 0, 'dbfbfybrlefr', '7bcfd56bef47692e856514924a1d9226', '2014-04-16', 'lucywilliams_lw@outlook.com', 0, '', '', '', '', '', '', '', 2, 0, 'New Member', 0, 1397612721, 0, 1397612721, 1397620494, 0, 0, 0, 0, 4, '-11', 0, 0, 0, 0, 0, 3195031, '05-07-1985', '1985-05-07', -1, -1, '198.2.222.166', 0, 1, 0, 0, -1, 0, 0, 'x|[w-zbI+X;u}:"pSD,n(&K;?[?}CF', 0, 0, 0, '', 0, 0, 0, 0, 0, 0, 0, 0, 0, 0, 0, 0, '', '', 0, '', 'vb', '', 0, 1, 0, 0, NULL),
(23484, 3, '', 0, 'ABWM', '6d41c9a8a3193abfb7d296af66b3c5ff', '2014-04-14', 'par.kerdurante58@gmail.com', 0, '', '', '', '', '', '', '', 2, 0, 'New Member', 0, 1397443134, 0, 1397443134, 1397879926, 0, 0, 0, 0, 4, '5', 0, 0, 0, 0, 0, 3194967, '04-08-1979', '1979-04-08', -1, -1, '196.196.16.250', 0, 1, 0, 0, -1, 0, 0, 'JVFd~1VUK=<)orY$M9P)3ZA|B|"w.v', 0, 0, 0, '', 0, 0, 0, 0, 0, 0, 0, 0, 0, 0, 0, 0, '', '', 0, '', 'vb', '', 0, 1, 0, 0, NULL),
(23485, 3, '', 0, 'AG23', '7f9e5aa13532eadc24de85cc007d1a1c', '2014-04-14', 'jordanrngmx2iik@hotmail.com', 0, '', '', '', '', '', '', '', 2, 0, 'New Member', 0, 1397443288, 0, 1397443288, 1400532292, 0, 0, 0, 0, 4, '5', 0, 0, 0, 0, 0, 3194967, '01-30-1984', '1984-01-30', -1, -1, '199.180.130.54', 0, 1, 0, 0, -1, 0, 0, 'Oq,Z(^=H-I)r9P^(e{nYM''a''p6NRf;', 0, 0, 0, '', 0, 0, 0, 0, 0, 0, 0, 0, 0, 0, 0, 0, '', '', 0, '', 'vb', '', 0, 1, 0, 0, NULL),
(23486, 3, '', 0, 'MOnslow', '5cbacdee9e590eb03332d9d9d17d7877', '2014-04-14', 'juleskellerh.ouse90@gmail.com', 0, '', '', '', '', '', '', '', 2, 0, 'New Member', 0, 1397444459, 0, 1397444459, 1397879938, 0, 0, 0, 0, 4, '5', 0, 0, 0, 0, 0, 3194967, '12-02-1977', '1977-12-02', -1, -1, '23.94.20.29', 0, 1, 0, 0, -1, 0, 0, 'd*0VX"{}>(t-L&Xw~`LAOu#H,@`/uW', 0, 0, 0, '', 0, 0, 0, 0, 0, 0, 0, 0, 0, 0, 0, 0, '', '', 0, '', 'vb', '', 0, 1, 0, 0, NULL),
(23557, 3, '', 0, 'G2513', 'dfcd22d91ea9ac55c3c7b9f1c490dd5a', '2014-04-16', 'sobhyluy@null.net', 0, '', '', '', '', '', '', '', 2, 0, 'New Member', 0, 1397642618, 0, 1397642618, 1397642618, 0, 0, 0, 0, 4, '5', 0, 0, 0, 0, 0, 3194967, '03-16-1976', '1976-03-16', -1, -1, '195.74.88.46', 0, 1, 0, 0, -1, 0, 0, '-+|fybp0OIvCGr$n;nK7o6u"\\5Fn./', 0, 0, 0, '', 0, 0, 0, 0, 0, 0, 0, 0, 0, 0, 0, 0, '', '', 0, '', 'vb', '', 0, 1, 0, 0, NULL),
(23551, 3, '', 0, 'MPizzey', '870a59682908d9779ddb4bcde984ab1c', '2014-04-16', 'agonizingxanadu8445@outlook.com', 0, '', '', '', '', '', '', '', 2, 0, 'New Member', 0, 1397633441, 0, 1397633441, 1397633441, 0, 0, 0, 0, 4, '5', 0, 0, 0, 0, 0, 3194967, '05-10-1975', '1975-05-10', -1, -1, '50.2.225.167', 0, 1, 0, 0, -1, 0, 0, 'I+^t@Xw(drr74tjbto+kOcZys"Ug}@', 0, 0, 0, '', 0, 0, 0, 0, 0, 0, 0, 0, 0, 0, 0, 0, '', '', 0, '', 'vb', '', 0, 1, 0, 0, NULL),
(23489, 2, '', 0, 'Raja Noraiz', 'd9d1471491f67628f4f9c5c4c6739406', '2014-04-14', 'raja.noraiz123@gmail.com', 0, '', '', '', '', '', '', '', 2, 0, 'New Member', 0, 1397459682, 0, 1397460836, 1397460836, 0, 0, 0, 0, 4, '5', 0, 0, 0, 0, 0, 3194967, '10-17-1991', '1991-10-17', -1, -1, '182.186.207.60', 14229, 1, 0, 0, -1, 0, 0, '%ThAsxc<`vz-PeI2FLbGjnDhLHmu]w', 0, 0, 0, '', 0, 0, 0, 0, 0, 0, 0, 0, 0, 0, 0, 0, '', '', 0, '', 'vb', '', 0, 1, 0, 0, NULL),
(23581, 3, '', 0, 'ROFTC', '5753337bdaeed7cf3c65461c7b29fcc0', '2014-04-17', 'youthfulfuton99hlr72@outlook.com', 0, '', '', '', '', '', '', '', 2, 0, 'New Member', 0, 1397718661, 0, 1397718661, 1397718661, 0, 0, 0, 0, 4, '5', 0, 0, 0, 0, 0, 3194967, '09-06-1977', '1977-09-06', -1, -1, '198.143.145.229', 0, 1, 0, 0, -1, 0, 0, '+JDeNFXh%Sh7PG$gbfxNW?-$s<H7mL', 0, 0, 0, '', 0, 0, 0, 0, 0, 0, 0, 0, 0, 0, 0, 0, '', '', 0, '', 'vb', '', 0, 1, 0, 0, NULL),
(23647, 3, '', 0, 'MSNA', '6b4c054680a1c5b9876c24ed309314a7', '2014-04-19', 'earthyarson22ene34@outlook.com', 0, '', '', '', '', '', '', '', 2, 0, 'New Member', 0, 1397945414, 0, 1397945414, 1397945414, 0, 0, 0, 0, 4, '5', 0, 0, 0, 0, 0, 3194967, '07-24-1975', '1975-07-24', -1, -1, '107.155.116.96', 0, 1, 0, 0, -1, 0, 0, 'A`osHy$XI+=E@Yz6~~1|`8N}SAO:FF', 0, 0, 0, '', 0, 0, 0, 0, 0, 0, 0, 0, 0, 0, 0, 0, '', '', 0, '', 'vb', '', 0, 1, 0, 0, NULL),
(23492, 2, '', 0, 'shakur', '6952a2be00dbb1d73dc34e603822e3a6', '2014-04-14', 'shakur009@outlook.com', 0, '', '', '', '', '', '', '', 2, 2, 'New Member', 0, 1397463061, 0, 1399296013, 1399296013, 1399295970, 437837, 1, 0, 4, '5', 0, 37, 0, 0, 0, 3194967, '12-03-1990', '1990-12-03', -1, -1, '202.5.156.252', 0, 1, 0, 0, -1, 0, 0, ':~}I>EGYmx;mVNGrOjV7P''8#Blk1cM', 0, 0, 0, '', 0, 0, 0, 0, 0, 0, 0, 0, 0, 0, 0, 0, '', '', 0, '', 'vb', '', 0, 1, 0, 0, NULL),
(23531, 3, '', 0, 'SCordner', '0e71a43f6a379cd8946ed16c4b5a7245', '2014-04-15', 'amandahurst24260@outlook.com', 0, '', '', '', '', '', '', '', 2, 0, 'New Member', 0, 1397572372, 0, 1397572372, 1397572372, 0, 0, 0, 0, 4, '5', 0, 0, 0, 0, 0, 3194967, '11-22-1971', '1971-11-22', -1, -1, '95.154.217.193', 0, 1, 0, 0, -1, 0, 0, '}3_"-eEL="\\nKsc*zf.+$WKIikurOA', 0, 0, 0, '', 0, 0, 0, 0, 0, 0, 0, 0, 0, 0, 0, 0, '', '', 0, '', 'vb', '', 0, 1, 0, 0, NULL),
(23495, 2, '', 0, 'Muhammad Suleman Kahout', '7494c97d7d3142c210af92650916ad2f', '2014-04-14', 's_tariq111222@yahoo.com', 0, '', '', '', '', '', '', '', 2, 0, 'New Member', 0, 1397470901, 0, 1397470901, 1397472050, 0, 0, 0, 0, 4, '5', 0, 0, 0, 0, 0, 3194967, '06-19-1995', '1995-06-19', -1, -1, '39.32.46.127', 0, 1, 0, 0, -1, 0, 0, 'O.HIs@"n41_,CjsZQ=8{Ax4n],2k}&', 0, 0, 0, '', 0, 0, 0, 0, 0, 0, 0, 0, 0, 0, 0, 0, '', '', 0, '', 'vb', '', 0, 1, 0, 0, NULL),
(23658, 2, '', 0, 'sajid Gujjar', '77f0ae77eeb8eddd709b2d1041249b43', '2014-04-20', 'sajidh976@gmail.com', 0, '', '', '', '', '', '', '', 2, 0, 'New Member', 0, 1398019091, 0, 1409735796, 1409735796, 0, 0, 0, 0, 4, '5', 0, 0, 0, 0, 0, 3194967, '08-10-1975', '1975-08-10', -1, -1, '182.185.180.224', 0, 1, 0, 0, -1, 0, 0, 'GJ''t[''1#T;}\\U]5;wqMCXJ86MA=Q"1', 0, 0, 0, '', 0, 0, 0, 0, 0, 0, 0, 0, 0, 0, 0, 0, '', '', 0, '', 'vb', '', 0, 1, 0, 0, NULL),
(23643, 3, '', 0, 'NITD', '759cda12e9e366b197ab505f15a1159d', '2014-04-19', 'jwemalinafqj@live.com', 0, '', '', '', '', '', '', '', 2, 0, 'New Member', 0, 1397927571, 0, 1397927571, 1397931862, 0, 0, 0, 0, 4, '5', 0, 0, 0, 0, 0, 3194967, '05-16-1981', '1981-05-16', -1, -1, '199.119.226.249', 0, 1, 0, 0, -1, 0, 0, 'Erk=~5zGYXilz?[49_XQ64$)Y<U9Iz', 0, 0, 0, '', 0, 0, 0, 0, 0, 0, 0, 0, 0, 0, 0, 0, '', '', 0, '', 'vb', '', 0, 1, 0, 0, NULL),
(23558, 3, '', 0, 'SDowdell', '922292cacfa88281e5d9ab72ab3447c6', '2014-04-16', 'holisticchum95fl62@outlook.com', 0, '', '', '', '', '', '', '', 2, 0, 'New Member', 0, 1397643999, 0, 1397643999, 1397643999, 0, 0, 0, 0, 4, '5', 0, 0, 0, 0, 0, 3194967, '05-22-1980', '1980-05-22', -1, -1, '23.231.7.96', 0, 1, 0, 0, -1, 0, 0, '0=gTcQxr)0~+b{r`"2A,^"WP;hP*P''', 0, 0, 0, '', 0, 0, 0, 0, 0, 0, 0, 0, 0, 0, 0, 0, '', '', 0, '', 'vb', '', 0, 1, 0, 0, NULL),
(23686, 2, '', 0, 'Engr Azhar soomro', '934c27380ff7d7b295fdede63c1b6763', '2014-04-21', 'engr.azhar786@gmail.com', 0, '', '', '', '', '', '', '', 2, 0, 'New Member', 0, 1398105146, 0, 1398106412, 1398106948, 0, 0, 0, 0, 4, '5', 0, 0, 0, 0, 0, 3194967, '07-14-1988', '1988-07-14', -1, -1, '111.119.171.199', 0, 1, 0, 0, -1, 0, 0, '{ys.pEil$$"T`@;\\<@1)((%&#5u/R:', 0, 0, 0, '', 0, 0, 0, 0, 0, 0, 0, 0, 0, 0, 0, 0, '', '', 0, '', 'vb', '', 0, 1, 0, 0, NULL),
(23566, 3, '', 0, 'P2319', '15da794ee4a523bd9ed357d39bb95672', '2014-04-16', 'annette82steagall@live.com', 0, '', '', '', '', '', '', '', 2, 0, 'New Member', 0, 1397670784, 0, 1397670784, 1398104502, 0, 0, 0, 0, 4, '5', 0, 0, 0, 0, 0, 3194967, '11-26-1974', '1974-11-26', -1, -1, '69.12.73.206', 0, 1, 0, 0, -1, 0, 0, '8iwr9b9goIH&MY`@>4cnJ+^6*o+fw{', 0, 0, 0, '', 0, 0, 0, 0, 0, 0, 0, 0, 0, 0, 0, 0, '', '', 0, '', 'vb', '', 0, 1, 0, 0, NULL),
(23779, 3, '', 0, 'N2734', '80ce1bcdf393af53455893136b3def70', '2014-04-25', 'joan5jmatzke@yahoo.com', 0, '', '', '', '', '', '', '', 2, 0, 'New Member', 0, 1398392445, 0, 1398392445, 1398392445, 0, 0, 0, 0, 4, '5', 0, 0, 0, 0, 0, 3194967, '06-15-1977', '1977-06-15', -1, -1, '108.178.5.109', 0, 1, 0, 0, -1, 0, 0, '"FW+GeQN`*|)T3JkhC*}X.]d$-VOw!', 0, 0, 0, '', 0, 0, 0, 0, 0, 0, 0, 0, 0, 0, 0, 0, '', '', 0, '', 'vb', '', 0, 1, 0, 0, NULL),
(23619, 3, '', 0, 'JGAUT', 'fac313f186cdf322d43cfff27745faa3', '2014-04-18', 'yuk35seuss@hotmail.com', 0, '', '', '', '', '', '', '', 2, 0, 'New Member', 0, 1397856438, 0, 1397856438, 1397863646, 0, 0, 0, 0, 4, '5', 0, 0, 0, 0, 0, 3194967, '07-26-1980', '1980-07-26', -1, -1, '192.210.144.65', 0, 1, 0, 0, -1, 0, 0, '>TP[a%3PDb\\V%O385Q|8$d:Cv3E]*P', 0, 0, 0, '', 0, 0, 0, 0, 0, 0, 0, 0, 0, 0, 0, 0, '', '', 0, '', 'vb', '', 0, 1, 0, 0, NULL),
(23620, 3, '', 0, 'KHolt', '21f9a28875d027a8bc1f34525345dcd2', '2014-04-18', 'camilleums493@hotmail.com', 0, '', '', '', '', '', '', '', 2, 0, 'New Member', 0, 1397857063, 0, 1397857063, 1397859422, 0, 0, 0, 0, 4, '5', 0, 0, 0, 0, 0, 3194967, '02-18-1981', '1981-02-18', -1, -1, '83.30.194.120', 0, 1, 0, 0, -1, 0, 0, 'zd_,=^?-@P`MVfbD"u"q#.w?I''v:<p', 0, 0, 0, '', 0, 0, 0, 0, 0, 0, 0, 0, 0, 0, 0, 0, '', '', 0, '', 'vb', '', 0, 1, 0, 0, NULL),
(23595, 3, '', 0, 'Ar_15', 'b8fddd89bd681fc01c537c2aff2ef557', '2014-04-17', 'mohammadkhosa@hotmail.com', 0, '', '', '', '', '', '', '', 2, 0, 'New Member', 0, 1397767539, 0, 1397767539, 1397767539, 0, 0, 0, 0, 4, '5', 0, 0, 0, 0, 0, 3194967, '10-02-1995', '1995-10-02', -1, -1, '188.165.0.38', 0, 1, 0, 0, -1, 0, 0, 'C!law/mE2x6R]MD''5^EjI-U&eft*)i', 0, 0, 0, '', 0, 0, 0, 0, 0, 0, 0, 0, 0, 0, 0, 0, '', '', 0, '', 'vb', '', 0, 1, 0, 0, NULL),
(23572, 3, '', 0, 'RBlaylock', 'f948d09c492b2cd76249732e32a9e14e', '2014-04-17', 'utopianjar464i113@outlook.com', 0, '', '', '', '', '', '', '', 2, 0, 'New Member', 0, 1397696590, 0, 1397696590, 1398192320, 0, 0, 0, 0, 4, '5', 0, 0, 0, 0, 0, 3194967, '07-25-1972', '1972-07-25', -1, -1, '192.184.82.191', 0, 1, 0, 0, -1, 0, 0, '+~],w2.8"eO>VsGPl-v]xOrGyN@)]-', 0, 0, 0, '', 0, 0, 0, 0, 0, 0, 0, 0, 0, 0, 0, 0, '', '', 0, '', 'vb', '', 0, 1, 0, 0, NULL),
(23651, 2, '', 0, 'The Wasp', '86f84ffc0eb921b747b1d3e14741ec02', '2014-04-20', 'bilal_nabi@yahoo.com', 0, '', '', '', '', '', '', '', 2, 0, 'New Member', 0, 1397989369, 0, 1397989369, 1397990068, 0, 0, 0, 0, 4, '5', 0, 0, 0, 0, 0, 3194967, '02-20-1973', '1973-02-20', -1, -1, '39.47.56.57', 790, 1, 0, 0, -1, 0, 0, 'RgSxP=KaS7)OUBMmB5X5mR,1T>wfJQ', 0, 0, 0, '', 0, 0, 0, 0, 0, 0, 0, 0, 0, 0, 0, 0, '', '', 0, '', 'vb', '', 0, 1, 0, 0, NULL),
(23535, 2, '', 0, 'ovaus27', 'a4e7823b74e3df402ffd72bb6a98b4d5', '2014-04-15', 'ovais4@gmail.com', 0, '', '', '', '', '', '', '', 2, 0, 'New Member', 0, 1397581257, 0, 1397889885, 1398012444, 1397668678, 434547, 1, 0, 4, '5', 0, 0, 0, 0, 0, 3194967, '10-27-1980', '1980-10-27', -1, -1, '223.29.227.163', 0, 1, 0, 0, -1, 0, 0, 'feLY|FXX!853O]?^g]^\\%p|b<!4yi&', 0, 0, 0, '', 0, 0, 0, 1, 0, 0, 0, 0, 0, 0, 0, 0, '', '', 0, '', 'vb', '', 0, 1, 0, 0, NULL),
(23507, 2, '', 0, 'Maryam Latif', '596875034616ebfc3be21c131777769e', '2014-04-14', 'maryam.latif@hotmail.com', 0, '', '', '', '', '', '', '', 2, 0, 'New Member', 0, 1397503733, 0, 1397503733, 1397503988, 0, 0, 0, 0, 4, '5', 0, 0, 0, 0, 0, 3194967, '05-09-1993', '1993-05-09', -1, -1, '39.32.76.37', 0, 1, 0, 0, -1, 0, 0, 'tyt)>o\\5tRelTc)]pwT>aVuhBvp_%H', 0, 0, 0, '', 0, 0, 0, 0, 0, 0, 0, 0, 0, 0, 0, 0, '', '', 0, '', 'vb', '', 0, 1, 0, 0, NULL),
(23509, 2, '', 0, 'ahmarraza', 'd80aa462db7864d42dfde5d077394dda', '2014-04-14', 'ahmarraza23@gmail.com', 0, '', '', '', '', '', '', '', 2, 0, 'New Member', 0, 1397509160, 0, 1398266145, 1399318752, 1397663336, 434533, 3, 0, 4, '5', 0, 0, 0, 0, 0, 3194967, '01-01-1970', '1970-01-01', -1, -1, '182.181.167.141', 0, 1, 0, 0, -1, 0, 0, '))\\E1YXBVuCyIS-QGOY`wZ@}71"zI~', 0, 0, 0, '', 0, 0, 1, 0, 0, 0, 0, 0, 0, 0, 0, 0, '', '', 0, '', 'vb', '', 0, 1, 0, 0, NULL),
(23672, 2, '', 0, 'ossama', '2f8d3298d9e8978ae894f2ed8baa652e', '2014-04-21', 'ossama_ktk@yahoo.com', 0, '', '', '', '', '', '', '', 2, 0, 'New Member', 0, 1398067344, 0, 1398067344, 1398067544, 0, 0, 0, 0, 4, '5', 0, 0, 0, 0, 0, 3194967, '03-28-1991', '1991-03-28', -1, -1, '182.186.121.115', 0, 1, 0, 0, -1, 0, 0, 'YV_C.Y*r]=`{wx5EUIjf./&IH{Ud%O', 0, 0, 0, '', 0, 0, 1, 0, 0, 0, 0, 0, 0, 0, 0, 0, '', '', 0, '', 'vb', '', 0, 1, 0, 0, NULL),
(23511, 3, '', 0, 'A2824', 'c6292121e3bfcb541a8ee7303c5da4de', '2014-04-15', 'awfag@hotmail.com', 0, '', '', '', '', '', '', '', 2, 0, 'New Member', 0, 1397517465, 0, 1397517465, 1398264134, 0, 0, 0, 0, 4, '5', 0, 0, 0, 0, 0, 3194967, '05-29-1974', '1974-05-29', -1, -1, '162.248.102.223', 0, 1, 0, 0, -1, 0, 0, '?Dh=o=Uj<<+,z9>Qr=&a4:=8lPt,*}', 0, 0, 0, '', 0, 0, 0, 0, 0, 0, 0, 0, 0, 0, 0, 0, '', '', 0, '', 'vb', '', 0, 1, 0, 0, NULL),
(23597, 3, '', 0, 'GDacey', 'f9336e2a24fb1f937e919b8370d10091', '2014-04-17', 'pleasantquota86ugh57@outlook.com', 0, '', '', '', '', '', '', '', 2, 0, 'New Member', 0, 1397774756, 0, 1397774756, 1397776968, 0, 0, 0, 0, 4, '5', 0, 0, 0, 0, 0, 3194967, '09-08-1974', '1974-09-08', -1, -1, '173.0.61.141', 0, 1, 0, 0, -1, 0, 0, 'OuJc<^Ur5''^_/lO&=\\sb(2wTXiE{7A', 0, 0, 0, '', 0, 0, 0, 0, 0, 0, 0, 0, 0, 0, 0, 0, '', '', 0, '', 'vb', '', 0, 1, 0, 0, NULL),
(23656, 2, '', 0, 'Ztirmizi', '16678044ce7dc7c748a947bab529eaa5', '2014-04-20', 'Zafar.tirmizi@hbl.com', 0, '', '', '', '', '', '', '', 2, 0, 'New Member', 0, 1398015103, 0, 1401646687, 1426516670, 1426515789, 475626, 10, 0, 4, '5', 0, 0, 0, 0, 0, 3194967, '06-18-1974', '1974-06-18', -1, -1, '115.186.110.98', 0, 1, 0, 0, -1, 0, 0, 'vEnV%oNSY0_f,YBF<s8WHZm;@F6cB-', 0, 0, 0, '', 0, 0, 1, 0, 0, 0, 0, 0, 0, 0, 0, 0, '0d56380ec29e6d23d7203bb51dde674c', '', 0, '', 'vb', '', 0, 1, 0, 0, NULL),
(23513, 3, '', 0, 'HL03', '432dde74f762ee70672dcbc122158d7e', '2014-04-15', 'somerrocker4655@outlook.com', 0, '', '', '', '', '', '', '', 2, 0, 'New Member', 0, 1397534438, 0, 1397534438, 1397534438, 0, 0, 0, 0, 4, '5', 0, 0, 0, 0, 0, 3194967, '12-13-1985', '1985-12-13', -1, -1, '178.19.99.39', 0, 1, 0, 0, -1, 0, 0, 'J=#g'')(P~-<V)=Yw{)lqy.cB7xehs_', 0, 0, 0, '', 0, 0, 0, 0, 0, 0, 0, 0, 0, 0, 0, 0, '', '', 0, '', 'vb', '', 0, 1, 0, 0, NULL),
(23901, 2, '', 0, 'Mohsin Khetran', '1ff0630cbcafa4f81a4bbc9b6d399b9d', '2014-04-29', 'msn.khitran@gmail.com', 0, '', '', '', '', '', '', '', 2, 0, 'New Member', 0, 1398801357, 0, 1398945384, 1398946075, 0, 0, 0, 0, 4, '5', 0, 0, 0, 0, 0, 3194967, '09-08-1989', '1989-09-08', -1, -1, '111.68.97.180', 0, 1, 0, 0, -1, 0, 0, 'HbZ<h&m\\KMK&0"_VpN%@m<j=O9''e,&', 0, 0, 0, '', 0, 0, 0, 0, 0, 0, 0, 0, 0, 0, 0, 0, '', '', 0, '', 'vb', '', 0, 1, 0, 0, NULL),
(23594, 2, '', 0, 'JunooniRocker', 'bbe0365489ff8f36320612abeb2b7a24', '2014-04-17', 'BADMAN_32@hotmail.com', 0, '', '', '', '', '', '', '', 2, 0, 'New Member', 0, 1397762356, 0, 1397910884, 1397992747, 1397992502, 435083, 5, 0, 4, '5', 0, 0, 0, 0, 0, 3194967, '10-25-1989', '1989-10-25', -1, -1, '23.27.220.86', 0, 1, 0, 0, -1, 0, 0, 'dfBEPwdfEznX[#<a<M5/eK-\\czUhov', 0, 0, 0, '', 0, 0, 1, 0, 0, 0, 0, 0, 0, 0, 0, 0, '', '', 0, '', 'vb', '', 0, 1, 0, 0, NULL),
(23515, 3, '', 0, 'EEubanks', '41efb955f361f1ae9148f5394d814086', '2014-04-15', 'georgie68seabrook@live.com', 0, '', '', '', '', '', '', '', 2, 0, 'New Member', 0, 1397541576, 0, 1397541576, 1397977374, 0, 0, 0, 0, 4, '5', 0, 0, 0, 0, 0, 3194967, '06-27-1984', '1984-06-27', -1, -1, '192.161.55.174', 0, 1, 0, 0, -1, 0, 0, '!/m2(Mhr&7v:rh''Y<(Y7O!$SWhX`_g', 0, 0, 0, '', 0, 0, 0, 0, 0, 0, 0, 0, 0, 0, 0, 0, '', '', 0, '', 'vb', '', 0, 1, 0, 0, NULL),
(23516, 3, '', 0, 'WV71', '1e2d14b1cf8764fc14322208a5f3059d', '2014-04-15', 'elane31urby@live.com', 0, '', '', '', '', '', '', '', 2, 0, 'New Member', 0, 1397544717, 0, 1397544717, 1397978199, 0, 0, 0, 0, 4, '5', 0, 0, 0, 0, 0, 3194967, '03-16-1976', '1976-03-16', -1, -1, '192.3.150.30', 0, 1, 0, 0, -1, 0, 0, 'Si=I48Ik\\W0J{F:*;%>2K$6hg,*8^S', 0, 0, 0, '', 0, 0, 0, 0, 0, 0, 0, 0, 0, 0, 0, 0, '', '', 0, '', 'vb', '', 0, 1, 0, 0, NULL),
(23517, 2, '', 0, 'J.A.Malik', '1fb4ac67d1ea3436d9113dd239978d19', '2014-04-15', 'jawad2k6@hotmail.com', 0, '', '', '', '', '', '', '', 2, 0, 'New Member', 0, 1397544830, 0, 1449570179, 1449574146, 0, 0, 0, 0, 4, '5', 0, 0, 0, 0, 0, 3194967, '12-14-1982', '1982-12-14', -1, -1, '182.181.158.160', 0, 1, 0, 0, -1, 0, 0, 'C|{;vjRk.]eZwerp[wqs2vB`1)}U-*', 0, 0, 0, '', 0, 0, 0, 0, 0, 0, 0, 0, 0, 0, 0, 0, '', '', 0, '', 'vb', '', 0, 1, 0, 0, NULL),
(23518, 2, '', 0, 'sma.itslia@yahoo.com', '89b9d54fd77ae599ef414f5a7b0e625b', '2014-04-15', 'sma.italia@yahoo.com', 0, '', '', '', '', '', '', '', 2, 0, 'New Member', 0, 1397547212, 0, 1397547945, 1397547945, 0, 0, 0, 0, 4, '5', 0, 0, 0, 0, 0, 3194967, '06-27-1964', '1964-06-27', -1, -1, '93.55.17.24', 0, 1, 0, 0, -1, 0, 0, 'x5SX>vP^k$Zownn;Vegx$ix[Sg^/nc', 0, 0, 0, '', 0, 0, 1, 0, 0, 0, 0, 0, 0, 0, 0, 0, '', '', 0, '', 'vb', '', 0, 1, 0, 0, NULL),
(23519, 3, '', 0, 'FDesjardi', '23e0ba0f38d4c0150747e49a33617baa', '2014-04-15', 'reginaldberg24607@outlook.com', 0, '', '', '', '', '', '', '', 2, 0, 'New Member', 0, 1397550940, 0, 1397550940, 1397550940, 0, 0, 0, 0, 4, '5', 0, 0, 0, 0, 0, 3194967, '02-13-1977', '1977-02-13', -1, -1, '5.135.113.224', 0, 1, 0, 0, -1, 0, 0, 'yz`s|%X69,Pt:5''h9jujlp.(gIK*@A', 0, 0, 0, '', 0, 0, 0, 0, 0, 0, 0, 0, 0, 0, 0, 0, '', '', 0, '', 'vb', '', 0, 1, 0, 0, NULL),
(23652, 3, '', 0, 'H07W', 'a0a94d49ef3df6552dc5f71210f5fea7', '2014-04-20', 'coskatsq@hotmail.com', 0, '', '', '', '', '', '', '', 2, 0, 'New Member', 0, 1397990879, 0, 1397990879, 1398012859, 0, 0, 0, 0, 4, '5', 0, 0, 0, 0, 0, 3194967, '06-14-1979', '1979-06-14', -1, -1, '173.0.56.151', 0, 1, 0, 0, -1, 0, 0, '}eh:I^,{,o0A$vNl;Es)+U1NM^[p"6', 0, 0, 0, '', 0, 0, 0, 0, 0, 0, 0, 0, 0, 0, 0, 0, '', '', 0, '', 'vb', '', 0, 1, 0, 0, NULL),
(23650, 3, '', 0, 'KLomas', 'e011b7743d30c6dbd71245a4cf86de10', '2014-04-20', 'languidransom497050@outlook.com', 0, '', '', '', '', '', '', '', 2, 0, 'New Member', 0, 1397958589, 0, 1397958589, 1397965903, 0, 0, 0, 0, 4, '5', 0, 0, 0, 0, 0, 3194967, '07-02-1970', '1970-07-02', -1, -1, '62.122.78.97', 0, 1, 0, 0, -1, 0, 0, 'P?x\\v+m(Xpr[JUTo7k`^`DE$GY7mw,', 0, 0, 0, '', 0, 0, 0, 0, 0, 0, 0, 0, 0, 0, 0, 0, '', '', 0, '', 'vb', '', 0, 1, 0, 0, NULL),
(23554, 3, '', 0, 'M02V', '0a04ab234cfd0d7764afa4c4915a08d4', '2014-04-16', 'vigorousinvesti857@outlook.com', 0, '', '', '', '', '', '', '', 2, 0, 'New Member', 0, 1397640357, 0, 1397640357, 1397641062, 0, 0, 0, 0, 4, '5', 0, 0, 0, 0, 0, 3194967, '06-15-1975', '1975-06-15', -1, -1, '107.161.83.78', 0, 1, 0, 0, -1, 0, 0, '|=Ak=7W/s!X<*5KW\\e9[)jd=qHNV"k', 0, 0, 0, '', 0, 0, 0, 0, 0, 0, 0, 0, 0, 0, 0, 0, '', '', 0, '', 'vb', '', 0, 1, 0, 0, NULL),
(23591, 2, '', 0, 'imran hafeez khan', '4db724ffff90ef2f8264da840a831f41', '2014-04-17', 'imranraikwal@gmail.com', 0, '', '', '', '', '', '', '', 2, 0, 'New Member', 0, 1397749108, 0, 1397749108, 1397749463, 0, 0, 0, 0, 4, '5', 0, 0, 0, 0, 0, 3194967, '04-01-1968', '1968-04-01', -1, -1, '69.22.184.173', 0, 1, 0, 0, -1, 0, 0, 'R>HXS>;HumRw\\eEny%[dC|{j''ybHhg', 0, 0, 0, '', 0, 0, 0, 0, 0, 0, 0, 0, 0, 0, 0, 0, '', '', 0, '', 'vb', '', 0, 1, 0, 0, NULL),
(23981, 3, '', 0, 'PhyllisWi', 'ea3ef1f136ea7dac5df5ef3987967b30', '2014-05-02', 'willahasrddzz@outlook.com', 0, '', '', '', '', '', '', '', 2, 0, 'New Member', 0, 1399012986, 0, 1399012986, 1399245481, 0, 0, 0, 0, 4, '5', 0, 0, 0, 0, 0, 3194967, '10-26-1974', '1974-10-26', -1, -1, '89.47.23.152', 0, 1, 0, 0, -1, 0, 0, '_"(-`KZyB:{_}vz''k`z;i:t}/Y(kNS', 0, 0, 0, '', 0, 0, 0, 0, 0, 0, 0, 0, 0, 0, 0, 0, '', '', 0, '', 'vb', '', 0, 1, 0, 0, NULL),
(23565, 2, '', 0, 'SEZERARMS', '6aa522ced38c2e534926d507fdd76427', '2014-04-16', 'sezerav@gmail.com', 0, '', 'http://www.sezerarms.tr.gg', '', '', '', '', '', 2, 1, 'New Member', 0, 1397666326, 0, 1397728962, 1397728962, 1397728776, 434656, 1, 0, 4, '5', 0, 0, 0, 0, 0, 3194967, '01-13-1985', '1985-01-13', -1, -1, '85.102.67.178', 0, 1, 0, 0, -1, 0, 0, '%}bacA^<tV}H1r9^Dye/`M!z3.C[zh', 0, 0, 0, '', 0, 0, 0, 0, 0, 0, 0, 0, 0, 0, 0, 0, '', '', 0, '', 'vb', '', 0, 1, 0, 0, NULL),
(23536, 2, '', 0, 'MAJID KHAN', '162c06dd5a1624640ad060854ab02f08', '2014-04-16', 'fmkhan99@hotmail.com', 0, '', '', '', '', '', '', '', 2, 0, 'New Member', 0, 1397586562, 0, 1415132575, 1419795075, 0, 0, 0, 0, 4, '5', 0, 0, 0, 0, 0, 3194967, '12-23-1956', '1956-12-23', -1, -1, '182.181.151.192', 0, 1, 0, 0, -1, 0, 0, '@dwNs}f?E`\\euN4J|[Vc^<t\\232}9X', 0, 0, 0, '', 0, 0, 0, 0, 0, 0, 0, 0, 0, 0, 0, 0, 'b488eabe546062b29c35c424b6cf4be6', '', 0, '', 'vb', '', 0, 1, 0, 0, NULL),
(23527, 2, '', 0, 'usmanali', '7e9a67a70d5c96c57a9642a3f3c5d786', '2014-04-15', 'usman.alishah70@gmail.com', 0, '', '', '', '', '', '', '', 2, 0, 'New Member', 0, 1397561848, 0, 1397561848, 1397561878, 0, 0, 0, 0, 4, '5', 0, 0, 0, 0, 0, 3194967, '08-16-1990', '1990-08-16', -1, -1, '121.52.147.77', 0, 1, 0, 0, -1, 0, 0, 'Z{>`1gVU&GD*b@pEI*<_5`Z9o@WBBn', 0, 0, 0, '', 0, 0, 0, 0, 0, 0, 0, 0, 0, 0, 0, 0, '', '', 0, '', 'vb', '', 0, 1, 0, 0, NULL),
(23612, 3, '', 0, 'FVrooman', 'b6e1520e778c5db7ccab23f4969fabe4', '2014-04-18', 'aundrea68mt@hotmail.com', 0, '', '', '', '', '', '', '', 2, 0, 'New Member', 0, 1397837722, 0, 1397837722, 1397844902, 0, 0, 0, 0, 4, '5', 0, 0, 0, 0, 0, 3194967, '10-21-1978', '1978-10-21', -1, -1, '96.8.117.144', 0, 1, 0, 0, -1, 0, 0, 'AgB16k0{LhjOM}{rwin;w"O{:=eV\\n', 0, 0, 0, '', 0, 0, 0, 0, 0, 0, 0, 0, 0, 0, 0, 0, '', '', 0, '', 'vb', '', 0, 1, 0, 0, NULL),
(23613, 3, '', 0, 'LMedrano', '4b90eecc2dbb28cc1b1d1727b6d2092c', '2014-04-18', 'gkajoneyb@outlook.com', 0, '', '', '', '', '', '', '', 2, 0, 'New Member', 0, 1397840327, 0, 1397840327, 1397849023, 0, 0, 0, 0, 4, '5', 0, 0, 0, 0, 0, 3194967, '11-11-1972', '1972-11-11', -1, -1, '199.15.248.83', 0, 1, 0, 0, -1, 0, 0, '`Q4R;Rlx=jXP?{r?-''Jah&ZPfi$y9Z', 0, 0, 0, '', 0, 0, 0, 0, 0, 0, 0, 0, 0, 0, 0, 0, '', '', 0, '', 'vb', '', 0, 1, 0, 0, NULL),
(23785, 2, '', 0, 'Syed Mustafa', '0413660e4943e876231931f8d33a9918', '2014-04-25', 'smhaider96@hotmail.com', 0, '', '', '', '', '', '', '', 2, 0, 'New Member', 0, 1398400934, 0, 1398967766, 1398967940, 1398942135, 0, 7, 0, 4, '5', 0, 0, 0, 0, 0, 3194967, '12-22-1990', '1990-12-22', -1, -1, '182.189.119.253', 0, 1, 0, 0, -1, 0, 0, 'R}ObV@ar`C@yG.=/%7Z(MVGp<eG@/_', 0, 0, 0, '', 0, 0, 9, 0, 0, 0, 0, 0, 0, 0, 0, 0, '', '', 0, '', 'vb', '', 0, 1, 0, 0, NULL),
(23698, 2, '', 0, 'tahashaukat', '4d9a7cb1bd12ca279fd590e0ef88721d', '2014-04-22', 'tahashaukat1@gmail.com', 0, '', '', '', '', '', '', '', 2, 0, 'New Member', 0, 1398151392, 0, 1398151392, 1398151569, 0, 0, 0, 0, 4, '5', 0, 0, 0, 0, 0, 3194967, '06-05-1993', '1993-06-05', -1, -1, '182.178.3.200', 790, 1, 0, 0, -1, 0, 0, ']k,9p5IP?xeP7-|LSEE+>~^:eL[o2]', 0, 0, 0, '', 0, 0, 0, 0, 0, 0, 0, 0, 0, 0, 0, 0, '', '', 0, '', 'vb', '', 0, 1, 0, 0, NULL),
(23646, 2, '', 0, 'Col', 'a231d670626d02dfc073fd11babda633', '2014-04-19', 'Ssas.publishers@hotmail.com', 0, '', '', '', '', '', '', '', 2, 0, 'Member', 0, 1397938855, 0, 1469571070, 1473692444, 1469570886, 495571, 106, 0, 4, '5', 0, 0, 0, 0, 0, 3194967, '02-16-1985', '1985-02-16', -1, -1, '115.167.120.126', 0, 1, 0, 0, -1, 0, 0, '&_ay>m;;GJe,3>5(D|1"1(<a2sO|"{', 0, 0, 0, '', 0, 0, 21, 2, 0, 0, 0, 0, 0, 0, 0, 0, '', '', 0, '', 'vb', '', 0, 1, 0, 0, NULL),
(23616, 2, '', 0, 'khanmagsiz', '422d9a295f8c4077c407c74fa2e617dc', '2014-04-18', 'khanmagsiz@gmail.com', 0, '', '', '', '', '', '', '', 2, 0, 'New Member', 0, 1397844348, 0, 1425155491, 1432217045, 0, 0, 0, 0, 4, '5', 0, 0, 0, 0, 0, 3194967, '10-30-1972', '1972-10-30', -1, -1, '182.186.55.172', 0, 1, 0, 0, -1, 0, 0, 'V{mOgWcmvdO{f2q&C5Wk&(''8l[@S>E', 0, 0, 0, '', 0, 0, 3, 0, 0, 0, 0, 0, 0, 0, 0, 0, '', '', 0, '', 'vb', '', 0, 1, 0, 0, NULL),
(23617, 2, '', 0, 'tayyab arif', '66fd4296e1986452cce13e91821f1874', '2014-04-18', 'tayyabarif21889@gmail.com', 0, '', '', '', '', '', '', '', 2, 0, 'New Member', 0, 1397849226, 0, 1397849538, 1397849538, 0, 0, 0, 0, 4, '5', 0, 0, 0, 0, 0, 3194967, '08-21-1989', '1989-08-21', -1, -1, '39.50.242.171', 0, 1, 0, 0, -1, 0, 0, 'wC_pLo(^pp,C\\c"0amV:t'';Q|I<J''W', 0, 0, 0, '', 0, 0, 0, 0, 0, 0, 0, 0, 0, 0, 0, 0, '', '', 0, '', 'vb', '', 0, 1, 0, 0, NULL),
(23607, 3, '', 0, 'CBeavers', 'fc84bcfefcdb281aacd0e0693b59da08', '2014-04-18', 'telma53kassis@hotmail.com', 0, '', '', '', '', '', '', '', 2, 0, 'New Member', 0, 1397799158, 0, 1397799158, 1397806327, 0, 0, 0, 0, 4, '5', 0, 0, 0, 0, 0, 3194967, '10-29-1980', '1980-10-29', -1, -1, '23.94.243.137', 0, 1, 0, 0, -1, 0, 0, '"vK}rwa2T7Y,bHL]UPeHwu7|R5|m>w', 0, 0, 0, '', 0, 0, 0, 0, 0, 0, 0, 0, 0, 0, 0, 0, '', '', 0, '', 'vb', '', 0, 1, 0, 0, NULL),
(23608, 3, '', 0, 'YCLJ', '2ec387160ff4d7d3b6679ba8769750d2', '2014-04-18', 'malbonrals@hotmail.com', 0, '', '', '', '', '', '', '', 2, 0, 'New Member', 0, 1397804973, 0, 1397804973, 1397828615, 0, 0, 0, 0, 4, '5', 0, 0, 0, 0, 0, 3194967, '07-18-1984', '1984-07-18', -1, -1, '165.231.14.74', 0, 1, 0, 0, -1, 0, 0, ')3f@/M";@-n]E[FAS,f_d)=Q,fl(`P', 0, 0, 0, '', 0, 0, 0, 0, 0, 0, 0, 0, 0, 0, 0, 0, '', '', 0, '', 'vb', '', 0, 1, 0, 0, NULL),
(23654, 2, '', 0, 'fintruder', 'a57ceb31f7177fe28b3298a635b9878b', '2014-04-20', 'farhan_shahid143@hotmail.com', 7, '', '', '', '', '', '', 'fintruder', 2, 1, 'Rookie', 0, 1398009298, 0, 1456855258, 1457895962, 1432478033, 480555, 48, 0, 4, '5', 0, 0, 0, 0, 0, 11584599, '09-01-1984', '1984-09-01', 20, 1, '39.41.255.86', 0, 0, 0, 0, 0, 0, 0, 'Ui{pwC4}M-~e$w@''P{c^xZ:2YKo`Ca', 0, 0, 0, '', 0, 0, 13, 6, 0, 0, 0, 0, 0, 0, 0, 0, '', '', 0, '', 'vb', '', 0, 1, 0, 0, NULL),
(23649, 3, '', 0, 'JTraeger', '7ea8ed1aaf4027c0316161f8c47c7af0', '2014-04-20', 'truculentbabe224tc20@outlook.com', 0, '', '', '', '', '', '', '', 2, 0, 'New Member', 0, 1397953450, 0, 1397953450, 1397961211, 0, 0, 0, 0, 4, '5', 0, 0, 0, 0, 0, 3194967, '04-27-1983', '1983-04-27', -1, -1, '91.108.180.89', 0, 1, 0, 0, -1, 0, 0, 'Ag3kUE.''NE/=k!r6(\\;=X7cz`|f4/#', 0, 0, 0, '', 0, 0, 0, 0, 0, 0, 0, 0, 0, 0, 0, 0, '', '', 0, '', 'vb', '', 0, 1, 0, 0, NULL),
(23712, 3, '', 0, 'Terryld', '410d9153389351818783f8fdfc14947b', '2014-04-22', 'tnt33709@outlook.com', 0, '', '', '', '', '', '', '', 2, 0, 'New Member', 0, 1398191830, 0, 1398192290, 1409455525, 0, 0, 0, 0, 4, '-8', 0, 0, 0, 0, 0, 3195095, '02-11-1955', '1955-02-11', -1, -1, '68.200.20.200', 790, 1, 0, 0, -1, 0, 0, '6_9!bSv|:L&kF&.-+68PGlgi%$@,(%', 0, 0, 0, '', 0, 0, 0, 0, 0, 0, 0, 0, 0, 0, 0, 0, '', '', 0, '', 'vb', '', 0, 1, 0, 0, NULL),
(23707, 3, '', 0, 'KLQM', '645144a01c42d28b174e674d61a4bb95', '2014-04-22', 'joaniek9onyeanus@yahoo.com', 0, '', '', '', '', '', '', '', 2, 0, 'New Member', 0, 1398167618, 0, 1398167618, 1398167618, 0, 0, 0, 0, 4, '5', 0, 0, 0, 0, 0, 3194967, '09-02-1984', '1984-09-02', -1, -1, '192.95.52.203', 0, 1, 0, 0, -1, 0, 0, '<,1v(CJVR''t!eg1TLX;7TbZV6oKx(L', 0, 0, 0, '', 0, 0, 0, 0, 0, 0, 0, 0, 0, 0, 0, 0, '', '', 0, '', 'vb', '', 0, 1, 0, 0, NULL),
(23737, 2, '', 0, 'dare devil', '0a56ca2af3557198f1892597b673124d', '2014-04-23', 'yasiraziz_50@yahoo.com', 0, '', '', '', '', '', '', '', 2, 0, 'New Member', 0, 1398279846, 0, 1398279886, 1398279886, 0, 0, 0, 0, 4, '5', 0, 0, 0, 0, 0, 3194967, '05-29-1987', '1987-05-29', -1, -1, '182.188.175.200', 0, 1, 0, 0, -1, 0, 0, 'J&k83;T:]/XS?WIvH~klY`who{RNLu', 0, 0, 0, '', 0, 0, 0, 0, 0, 0, 0, 0, 0, 0, 0, 0, '', '', 0, '', 'vb', '', 0, 1, 0, 0, NULL),
(23661, 2, '', 0, 'ayeshnaveed', '3d1e10ef2aed8fed6c6f6545e9b895a0', '2014-04-20', 'ayeshnaveed@hotmail.com', 0, '', '', '', '', '', '', '', 2, 0, 'New Member', 0, 1398027264, 0, 1398027706, 1398111567, 0, 0, 0, 0, 4, '5', 0, 0, 0, 0, 0, 3194967, '11-21-1987', '1987-11-21', -1, -1, '39.59.66.91', 0, 1, 0, 0, -1, 0, 0, '(bm~=79lyfp0v,D#5VukPCR%<a0!/.', 0, 0, 0, '', 0, 0, 0, 0, 0, 0, 0, 0, 0, 0, 0, 0, '', '', 0, '', 'vb', '', 0, 1, 0, 0, NULL),
(23641, 3, '', 0, 'AVIJ', 'ad60a9ea1799ac018e212197d8006885', '2014-04-19', 'jon_checchi@camnangdoisong.com', 0, '', '', '', '', '', '', '', 2, 0, 'New Member', 0, 1397924046, 0, 1397924046, 1397933442, 0, 0, 0, 0, 4, '5', 0, 0, 0, 0, 0, 3194967, '04-15-1975', '1975-04-15', -1, -1, '173.213.96.212', 0, 1, 0, 0, -1, 0, 0, 'PCcdwUu4.nZ8#1$tXS3Td|"\\HD<_dN', 0, 0, 0, '', 0, 0, 0, 0, 0, 0, 0, 0, 0, 0, 0, 0, '', '', 0, '', 'vb', '', 0, 1, 0, 0, NULL),
(23630, 3, '', 0, 'K7441', '0b0dbe4d85588ed1d6446928810fcdaf', '2014-04-19', 'wealthyaggresso01@outlook.com', 0, '', '', '', '', '', '', '', 2, 0, 'New Member', 0, 1397891988, 0, 1397891988, 1397899147, 0, 0, 0, 0, 4, '5', 0, 0, 0, 0, 0, 3194967, '12-02-1977', '1977-12-02', -1, -1, '5.255.91.114', 0, 1, 0, 0, -1, 0, 0, 'yz*&0QPE&t%*VC]n)I|''ha`,,kMKC.', 0, 0, 0, '', 0, 0, 0, 0, 0, 0, 0, 0, 0, 0, 0, 0, '', '', 0, '', 'vb', '', 0, 1, 0, 0, NULL),
(23655, 3, '', 0, 'HUSE', '7527841a45a314a8c907fe9a66b1ea6d', '2014-04-20', 'geparedosoza@hotmail.com', 0, '', '', '', '', '', '', '', 2, 0, 'New Member', 0, 1398012492, 0, 1398012492, 1398040021, 0, 0, 0, 0, 4, '5', 0, 0, 0, 0, 0, 3194967, '11-03-1983', '1983-11-03', -1, -1, '192.208.185.233', 0, 1, 0, 0, -1, 0, 0, '@*^'')IDy''QGsw"E}#GF=m?,8AAmR{Q', 0, 0, 0, '', 0, 0, 0, 0, 0, 0, 0, 0, 0, 0, 0, 0, '', '', 0, '', 'vb', '', 0, 1, 0, 0, NULL),
(23632, 2, '', 0, 'Zia Awan', 'e06b316c27842dc0331610b858dd9568', '2014-04-19', 'awanzia@hotmail.com', 0, '', '', '', '', '', '', '', 2, 0, 'New Member', 0, 1397894009, 0, 1397894009, 1397894296, 0, 0, 0, 0, 4, '5', 0, 0, 0, 0, 0, 3194967, '12-22-1972', '1972-12-22', -1, -1, '176.225.173.46', 0, 1, 0, 0, -1, 0, 0, 'LL?Xu8g^Sdq+542<rNE;!?6O(r]*R>', 0, 0, 0, '', 0, 0, 0, 0, 0, 0, 0, 0, 0, 0, 0, 0, '', '', 0, '', 'vb', '', 0, 1, 0, 0, NULL),
(23633, 3, '', 0, 'SPgo', '475ba4ea2ef333b956a4915aad37bca2', '2014-04-19', 'neritefohyba@hotmail.com', 0, '', '', '', '', '', '', '', 2, 0, 'New Member', 0, 1397894202, 0, 1397894202, 1398334470, 0, 0, 0, 0, 4, '5', 0, 0, 0, 0, 0, 3194967, '10-04-1971', '1971-10-04', -1, -1, '23.94.20.113', 0, 1, 0, 0, -1, 0, 0, 'b<n4RNHK])VuuES(<l,''bBUu+%nKGu', 0, 0, 0, '', 0, 0, 0, 0, 0, 0, 0, 0, 0, 0, 0, 0, '', '', 0, '', 'vb', '', 0, 1, 0, 0, NULL),
(23736, 2, '', 0, 'irfan.pk', 'ee1ada5ad01b56eccce7b811a0050913', '2014-04-23', 'md4irfan@gmail.com', 0, '', '', '', '', '', '', '', 2, 0, 'New Member', 0, 1398279199, 0, 1398520788, 1398520788, 0, 0, 0, 0, 4, '5', 0, 0, 0, 0, 0, 3194967, '10-01-1974', '1974-10-01', -1, -1, '182.185.122.237', 0, 1, 0, 0, -1, 0, 0, 'Y;=&4wU$rBo,pIDz31{rkeW_4o{f&h', 0, 0, 0, '', 0, 0, 0, 0, 0, 0, 0, 0, 0, 0, 0, 0, '', '', 0, '', 'vb', '', 0, 1, 0, 0, NULL),
(23653, 2, '', 0, 'ShadowWalker', '653047c96917012e3705091496073592', '2014-05-08', 'saadijhandir@gmail.com', 0, '', '', '', '', '', '', '', 2, 0, 'New Member', 0, 1398008967, 0, 1399582790, 1399582830, 0, 0, 0, 0, 4, '5', 0, 0, 0, 0, 0, 3194967, '07-05-1990', '1990-07-05', -1, -1, '182.178.207.165', 23408, 1, 0, 0, -1, 0, 0, '9Ue"g%kFKT#\\2}S`)isc&18FCIbKf"', 0, 0, 0, '', 0, 0, 0, 0, 0, 0, 0, 0, 0, 0, 0, 0, '', '', 0, '', 'vb', '', 0, 1, 0, 0, NULL),
(23636, 3, '', 0, 'CKish', '8f165e480830ceed7fe2a4178075045a', '2014-04-19', 'wantingastronomtg13f@outlook.com', 0, '', '', '', '', '', '', '', 2, 0, 'New Member', 0, 1397910644, 0, 1397910644, 1397910644, 0, 0, 0, 0, 4, '5', 0, 0, 0, 0, 0, 3194967, '12-03-1979', '1979-12-03', -1, -1, '208.89.209.82', 0, 1, 0, 0, -1, 0, 0, 'X/SA+>)Lh(9h|J5QF||{JBkXkyg<a`', 0, 0, 0, '', 0, 0, 0, 0, 0, 0, 0, 0, 0, 0, 0, 0, '', '', 0, '', 'vb', '', 0, 1, 0, 0, NULL),
(23637, 3, '', 0, 'VChick', 'c94a0cf7b9f383776d9d10cd064b18e3', '2014-04-19', 'axewf@hotmail.com', 0, '', '', '', '', '', '', '', 2, 0, 'New Member', 0, 1397912589, 0, 1397912589, 1397912589, 0, 0, 0, 0, 4, '5', 0, 0, 0, 0, 0, 3194967, '02-09-1979', '1979-02-09', -1, -1, '198.143.143.140', 0, 1, 0, 0, -1, 0, 0, ']e_>>qY9<}[AVMv[!^e,R;=-ePGdLl', 0, 0, 0, '', 0, 0, 0, 0, 0, 0, 0, 0, 0, 0, 0, 0, '', '', 0, '', 'vb', '', 0, 1, 0, 0, NULL),
(23638, 2, '', 0, 'A R Sadiq', '305f77402011b4993e61ca2005fb6981', '2014-04-19', 'stes.rehman@gmail.com', 0, '', '', '', '', '', '', '', 2, 0, 'New Member', 0, 1397915911, 0, 1397915911, 1397916634, 0, 0, 0, 0, 4, '5', 0, 0, 0, 0, 0, 3194967, '10-16-1984', '1984-10-16', -1, -1, '80.240.76.194', 0, 1, 0, 0, -1, 0, 0, '_5-+ycB|M(,F4{gC7uviwPE,CbBqj<', 0, 0, 0, '', 0, 0, 0, 0, 0, 0, 0, 0, 0, 0, 0, 0, '', '', 0, '', 'vb', '', 0, 1, 0, 0, NULL),
(23934, 3, '', 0, 'DHecht', 'eb6b2f9b726b7f41e631d9c876c7869d', '2014-04-30', 'gezekopipase@hotmail.com', 0, '', '', '', '', '', '', '', 2, 0, 'New Member', 0, 1398870781, 0, 1398870781, 1398870781, 0, 0, 0, 0, 4, '5', 0, 0, 0, 0, 0, 3194967, '04-30-1984', '1984-04-30', -1, -1, '23.94.20.29', 0, 1, 0, 0, -1, 0, 0, 'yeKK)6``O<~x6dLPmU}pKuUo\\YBOt;', 0, 0, 0, '', 0, 0, 0, 0, 0, 0, 0, 0, 0, 0, 0, 0, '', '', 0, '', 'vb', '', 0, 1, 0, 0, NULL),
(23788, 2, '', 0, 'Muhammad Talha Patel', '440425be8b1437a493692f83f9484810', '2014-04-25', 'talhapatel1@yahoo.com', 0, '', '', '', '', '', '', '', 2, 0, 'New Member', 0, 1398409782, 0, 1398412452, 1398412555, 0, 0, 0, 0, 4, '5', 0, 0, 0, 0, 0, 3194967, '12-20-1991', '1991-12-20', -1, -1, '59.103.199.59', 0, 1, 0, 0, -1, 0, 0, 'N:Db{:~[''bsFRk/32.u%j9K!Ap=LHU', 0, 0, 0, '', 0, 0, 0, 0, 0, 0, 0, 0, 0, 0, 0, 0, '', '', 0, '', 'vb', '', 0, 1, 0, 0, NULL),
(23720, 3, '', 0, 'BBreland', '95428023bd0defdf7a9cbfef5e0299e4', '2014-04-23', 'nullomen7809@outlook.com', 0, '', '', '', '', '', '', '', 2, 0, 'New Member', 0, 1398230547, 0, 1398230547, 1398237797, 0, 0, 0, 0, 4, '5', 0, 0, 0, 0, 0, 3194967, '08-29-1984', '1984-08-29', -1, -1, '107.161.87.138', 0, 1, 0, 0, -1, 0, 0, 'W#d;gFL.|*<vz9;4`9K[{STvwU-t`Q', 0, 0, 0, '', 0, 0, 0, 0, 0, 0, 0, 0, 0, 0, 0, 0, '', '', 0, '', 'vb', '', 0, 1, 0, 0, NULL),
(23985, 3, '', 0, 'IKIE', '743e73cd68699d21348dede97b6717df', '2014-05-02', 'ambiguousenginehu273@outlook.com', 0, '', '', '', '', '', '', '', 2, 0, 'New Member', 0, 1399020505, 0, 1399020505, 1399023189, 0, 0, 0, 0, 4, '5', 0, 0, 0, 0, 0, 3194967, '09-15-1980', '1980-09-15', -1, -1, '199.119.226.145', 0, 1, 0, 0, -1, 0, 0, 'P<X&#+_mJO~hKn!ft!~o^Za$}!sOvN', 0, 0, 0, '', 0, 0, 0, 0, 0, 0, 0, 0, 0, 0, 0, 0, '', '', 0, '', 'vb', '', 0, 1, 0, 0, NULL),
(23690, 3, '', 0, 'BPittard', '409e3d48dd21b45669f3a2b9f8a6b658', '2014-04-22', 'cuvujm@hotmail.com', 0, '', '', '', '', '', '', '', 2, 0, 'New Member', 0, 1398130771, 0, 1398130771, 1398130771, 0, 0, 0, 0, 4, '5', 0, 0, 0, 0, 0, 3194967, '08-22-1971', '1971-08-22', -1, -1, '107.6.144.228', 0, 1, 0, 0, -1, 0, 0, '0+(}mCY#K@h3,''N,aZtuRM6Lz[_-tk', 0, 0, 0, '', 0, 0, 0, 0, 0, 0, 0, 0, 0, 0, 0, 0, '', '', 0, '', 'vb', '', 0, 1, 0, 0, NULL);
INSERT INTO `user` (`userid`, `usergroupid`, `membergroupids`, `displaygroupid`, `username`, `password`, `passworddate`, `email`, `styleid`, `parentemail`, `homepage`, `icq`, `aim`, `yahoo`, `msn`, `skype`, `showvbcode`, `showbirthday`, `usertitle`, `customtitle`, `joindate`, `daysprune`, `lastvisit`, `lastactivity`, `lastpost`, `lastpostid`, `posts`, `reputation`, `reputationlevelid`, `timezoneoffset`, `pmpopup`, `avatarid`, `avatarrevision`, `profilepicrevision`, `sigpicrevision`, `options`, `birthday`, `birthday_search`, `maxposts`, `startofweek`, `ipaddress`, `referrerid`, `languageid`, `emailstamp`, `threadedmode`, `autosubscribe`, `pmtotal`, `pmunread`, `salt`, `ipoints`, `infractions`, `warnings`, `infractiongroupids`, `infractiongroupid`, `adminoptions`, `profilevisits`, `friendcount`, `friendreqcount`, `vmunreadcount`, `vmmoderatedcount`, `socgroupinvitecount`, `socgroupreqcount`, `pcunreadcount`, `pcmoderatedcount`, `gmmoderatedcount`, `assetposthash`, `fbuserid`, `fbjoindate`, `fbname`, `logintype`, `fbaccesstoken`, `bloggroupreqcount`, `showblogcss`, `importuserid`, `newrepcount`, `panjo_selling`) VALUES
(23972, 3, '', 0, 'SKKIM', '1050562b042a5317a3d06e262ed166e9', '2014-05-01', 'solomon.nordstrom@apprankerwebsite.tk', 0, '', '', '', '', '', '', '', 2, 0, 'New Member', 0, 1398970920, 0, 1398970920, 1398978198, 0, 0, 0, 0, 4, '5', 0, 0, 0, 0, 0, 3194967, '06-10-1981', '1981-06-10', -1, -1, '198.143.136.21', 0, 1, 0, 0, -1, 0, 0, 'AYLxD^2Q/^nh8**C_8-6N*B6''y[AQ,', 0, 0, 0, '', 0, 0, 0, 0, 0, 0, 0, 0, 0, 0, 0, 0, '', '', 0, '', 'vb', '', 0, 1, 0, 0, NULL),
(23693, 3, '', 0, 'muhammad siraj', '1c8173444ed8e30a72fed3d666a5f61f', '2014-04-22', 'sirajkhan9737@gmail.com', 0, '', '', '', '', '', '', '', 2, 0, 'New Member', 0, 1398139652, 0, 1398139652, 1398139980, 0, 0, 0, 0, 4, '5', 0, 0, 0, 0, 0, 3194967, '03-05-1985', '1985-03-05', -1, -1, '39.32.249.2', 0, 1, 0, 0, -1, 0, 0, 'A(#&5[8FnGEoI+&-MPVRS+DY\\n:u+P', 0, 0, 0, '', 0, 0, 0, 0, 0, 0, 0, 0, 0, 0, 0, 0, '', '', 0, '', 'vb', '', 0, 1, 0, 0, NULL),
(23738, 3, '', 0, 'MWaldrup', '07e26cc263f78df34db535d026e7c313', '2014-04-23', 'ponolaqimini@hotmail.com', 0, '', '', '', '', '', '', '', 2, 0, 'New Member', 0, 1398282185, 0, 1398282185, 1398282185, 0, 0, 0, 0, 4, '5', 0, 0, 0, 0, 0, 3194967, '05-03-1976', '1976-05-03', -1, -1, '50.2.225.181', 0, 1, 0, 0, -1, 0, 0, '%RDNf!''!*(Bw,w*[Gdd-''G9gN-Yr[\\', 0, 0, 0, '', 0, 0, 0, 0, 0, 0, 0, 0, 0, 0, 0, 0, '', '', 0, '', 'vb', '', 0, 1, 0, 0, NULL),
(23721, 3, '', 0, 'HHeng', '1e9a8aee2cb1ed26d6dc7eb3c3f820ab', '2014-04-23', 'guardedquota245497@outlook.com', 0, '', '', '', '', '', '', '', 2, 0, 'New Member', 0, 1398234254, 0, 1398234254, 1398236660, 0, 0, 0, 0, 4, '5', 0, 0, 0, 0, 0, 3194967, '06-06-1980', '1980-06-06', -1, -1, '192.208.185.70', 0, 1, 0, 0, -1, 0, 0, 'FN^9hbQJQ\\d8VbrTPLqrVBz"&V2Co*', 0, 0, 0, '', 0, 0, 0, 0, 0, 0, 0, 0, 0, 0, 0, 0, '', '', 0, '', 'vb', '', 0, 1, 0, 0, NULL),
(23675, 3, '', 0, 'Ali Abbass', 'bf3b7535288ddd8f0281c4d4d74f43b5', '2014-04-21', 'khan.kabirali@yahoo.com', 0, '', '', '', '', '', '', '', 2, 0, 'New Member', 0, 1398076488, 0, 1398076488, 1398076488, 0, 0, 0, 0, 4, '5', 0, 0, 0, 0, 0, 3194967, '03-03-1992', '1992-03-03', -1, -1, '203.124.29.21', 0, 1, 0, 0, -1, 0, 0, '6a~SK4zaj-f]_"xrafJT)-D?dnjQ}p', 0, 0, 0, '', 0, 0, 0, 0, 0, 0, 0, 0, 0, 0, 0, 0, '', '', 0, '', 'vb', '', 0, 1, 0, 0, NULL),
(23988, 3, '', 0, 'THAZ', '5614e1351dff762a566b06587946ada8', '2014-05-02', 'numerouscage2096@outlook.com', 0, '', '', '', '', '', '', '', 2, 0, 'New Member', 0, 1399025324, 0, 1399025324, 1399025324, 0, 0, 0, 0, 4, '5', 0, 0, 0, 0, 0, 3194967, '02-12-1980', '1980-02-12', -1, -1, '64.19.28.6', 0, 1, 0, 0, -1, 0, 0, 'kEsxrT+UW5b6%fCrMw(hH,{sl|/.<b', 0, 0, 0, '', 0, 0, 0, 0, 0, 0, 0, 0, 0, 0, 0, 0, '', '', 0, '', 'vb', '', 0, 1, 0, 0, NULL),
(24025, 2, '', 0, 'iftekharrasool1', '7f360599cc0f671e379ad70eb2e772a5', '2014-05-03', 'iftekharrasool1@yahoo.com', 0, '', '', '', '', '', '', '', 2, 0, 'New Member', 0, 1399149879, 0, 1399149879, 1399151920, 0, 0, 0, 0, 4, '5', 0, 0, 0, 0, 0, 3194967, '04-17-1988', '1988-04-17', -1, -1, '182.186.2.220', 0, 1, 0, 0, -1, 0, 0, '|r0KC0VMYp)0ayZUKaDZxPk0-5_[HN', 0, 0, 0, '', 0, 0, 0, 0, 0, 0, 0, 0, 0, 0, 0, 0, '', '', 0, '', 'vb', '', 0, 1, 0, 0, NULL),
(23976, 3, '', 0, 'ELJJP', '6ba8e87a13e968778a78cb19e5b4e001', '2014-05-01', 'leanbyword51dd92q@outlook.com', 0, '', '', '', '', '', '', '', 2, 0, 'New Member', 0, 1398978985, 0, 1398978985, 1398981070, 0, 0, 0, 0, 4, '5', 0, 0, 0, 0, 0, 3194967, '03-14-1982', '1982-03-14', -1, -1, '83.27.120.32', 0, 1, 0, 0, -1, 0, 0, '=~C.gVGOL!9]8]<KykYTXIWkw0jaBj', 0, 0, 0, '', 0, 0, 0, 0, 0, 0, 0, 0, 0, 0, 0, 0, '', '', 0, '', 'vb', '', 0, 1, 0, 0, NULL),
(23882, 3, '', 0, 'AHaas', 'f4933e8d199ffc837fbfe49068ffd10b', '2014-04-29', 'roastedvirus3wxc20@outlook.com', 0, '', '', '', '', '', '', '', 2, 0, 'New Member', 0, 1398750443, 0, 1398750443, 1398752641, 0, 0, 0, 0, 4, '5', 0, 0, 0, 0, 0, 3194967, '12-18-1983', '1983-12-18', -1, -1, '198.167.138.120', 0, 1, 0, 0, -1, 0, 0, 'W|8.R<e#P;"$e;eo62bJoSyY-@7Bus', 0, 0, 0, '', 0, 0, 0, 0, 0, 0, 0, 0, 0, 0, 0, 0, '', '', 0, '', 'vb', '', 0, 1, 0, 0, NULL),
(23680, 3, '', 0, 'NPWP', '6525f4cfe35e373a9d3e06d0822d7da5', '2014-04-21', 'zealouswriter49dgf58@outlook.com', 0, '', '', '', '', '', '', '', 2, 0, 'New Member', 0, 1398086093, 0, 1398086093, 1398086093, 0, 0, 0, 0, 4, '5', 0, 0, 0, 0, 0, 3194967, '04-24-1974', '1974-04-24', -1, -1, '23.94.243.251', 0, 1, 0, 0, -1, 0, 0, 'ZY]Q|Ier+UN%V9K>"0ArtE:kT<3<~V', 0, 0, 0, '', 0, 0, 0, 0, 0, 0, 0, 0, 0, 0, 0, 0, '', '', 0, '', 'vb', '', 0, 1, 0, 0, NULL),
(23681, 3, '', 0, 'arobertosgooglety3672', '312c7f152fd9577754109c7b8d832afe', '2014-04-21', 'arobertosgooglety@ymail.com', 0, '', '', '', '', '', '', '', 2, 0, 'New Member', 0, 1398086602, 0, 1398086602, 1398086602, 0, 0, 0, 0, 4, '-6', 0, 0, 0, 0, 0, 3194903, '02-13-1982', '1982-02-13', -1, -1, '91.213.72.36', 0, 1, 0, 0, -1, 0, 0, '-dLE7?qkaK6xRSH]uitre[1/A3~YQ3', 0, 0, 0, '', 0, 0, 0, 0, 0, 0, 0, 0, 0, 0, 0, 0, '', '', 0, '', 'vb', '', 0, 1, 0, 0, NULL),
(23682, 3, '', 0, 'SWrd', '572ef14b2549b47a7346489d22eebe07', '2014-04-21', 'desireediaz65674@outlook.com', 0, '', '', '', '', '', '', '', 2, 0, 'New Member', 0, 1398086723, 0, 1398086723, 1398096754, 0, 0, 0, 0, 4, '5', 0, 0, 0, 0, 0, 3194967, '09-27-1972', '1972-09-27', -1, -1, '37.203.212.2', 0, 1, 0, 0, -1, 0, 0, 'EFr:ReT4Ce/gOA:1"G/o35Qe;HT/0@', 0, 0, 0, '', 0, 0, 0, 0, 0, 0, 0, 0, 0, 0, 0, 0, '', '', 0, '', 'vb', '', 0, 1, 0, 0, NULL),
(23685, 2, '', 0, 'Dr Abu-Ibrar', '7fbb6ee09c9bc9a9e0a42642d16b38d0', '2014-04-21', 'kkzaigham@yahoo.com', 0, '', '', '', '', '', '', '', 2, 0, 'New Member', 0, 1398095177, 0, 1398446095, 1398602324, 0, 0, 0, 0, 4, '5', 0, 0, 0, 0, 0, 3194967, '02-05-1980', '1980-02-05', -1, -1, '141.0.9.236', 0, 1, 0, 0, -1, 0, 0, 'b1-Skm"(IL+0Ea;a_}W*nh<O-3JH_0', 0, 0, 0, '', 0, 0, 0, 0, 0, 0, 0, 0, 0, 0, 0, 0, '', '', 0, '', 'vb', '', 0, 1, 0, 0, NULL),
(23709, 3, '', 0, 'DTabarez', '004e183acc00e0dc3713f582a316d614', '2014-04-22', 'jerri80matzke@yahoo.com', 0, '', '', '', '', '', '', '', 2, 0, 'New Member', 0, 1398171461, 0, 1398171461, 1398171461, 0, 0, 0, 0, 4, '5', 0, 0, 0, 0, 0, 3194967, '03-11-1984', '1984-03-11', -1, -1, '192.95.52.203', 0, 1, 0, 0, -1, 0, 0, 'D4PZ,^b+slUwzgfe@|9fBmK?p(J,{m', 0, 0, 0, '', 0, 0, 0, 0, 0, 0, 0, 0, 0, 0, 0, 0, '', '', 0, '', 'vb', '', 0, 1, 0, 0, NULL),
(23747, 3, '', 0, 'AYee', 'd1a6060e756c2579fed877e6c63478d1', '2014-04-24', 'fuqree@hotmail.com', 0, '', '', '', '', '', '', '', 2, 0, 'New Member', 0, 1398306824, 0, 1398306824, 1398306824, 0, 0, 0, 0, 4, '5', 0, 0, 0, 0, 0, 3194967, '10-01-1983', '1983-10-01', -1, -1, '198.55.113.51', 0, 1, 0, 0, -1, 0, 0, 'k9?7d+tNo,Roa=xVxSLX4rj#<gZCd\\', 0, 0, 0, '', 0, 0, 0, 0, 0, 0, 0, 0, 0, 0, 0, 0, '', '', 0, '', 'vb', '', 0, 1, 0, 0, NULL),
(23860, 3, '', 0, 'ESDMK', '49c0a4d0de65985299dfc1a83019a334', '2014-04-28', 'addie@buytwitterfollowersreviews.org', 0, '', '', '', '', '', '', '', 2, 0, 'New Member', 0, 1398703964, 0, 1398703964, 1398706293, 0, 0, 0, 0, 4, '5', 0, 0, 0, 0, 0, 3194967, '05-13-1973', '1973-05-13', -1, -1, '151.237.186.126', 0, 1, 0, 0, -1, 0, 0, 'Md#`.sTSiu*ivl>GcFAB?qyL[BRh)R', 0, 0, 0, '', 0, 0, 0, 0, 0, 0, 0, 0, 0, 0, 0, 0, '', '', 0, '', 'vb', '', 0, 1, 0, 0, NULL),
(25536, 3, '', 0, 'CAvy', '0bb31439656c7751b1a3b6b38edd3ce2', '2014-06-17', 'citurraldeg@yahoo.com', 0, '', '', '', '', '', '', '', 2, 0, 'New Member', 0, 1403003342, 0, 1403003342, 1403003342, 0, 0, 0, 0, 4, '5', 0, 0, 0, 0, 0, 3194967, '10-30-1979', '1979-10-30', -1, -1, '176.31.60.99', 0, 1, 0, 0, -1, 0, 0, '32y#Kvj~6ELTPv!HR&ViGn~bW4%)&K', 0, 0, 0, '', 0, 0, 0, 0, 0, 0, 0, 0, 0, 0, 0, 0, '', '', 0, '', 'vb', '', 0, 1, 0, 0, NULL),
(23977, 3, '', 0, 'ALittle', 'ead7a50080a7e0c027938a803798cc24', '2014-05-02', 'steadyrose716@hotmail.com', 0, '', '', '', '', '', '', '', 2, 0, 'New Member', 0, 1398985522, 0, 1398985522, 1398985522, 0, 0, 0, 0, 4, '5', 0, 0, 0, 0, 0, 3194967, '06-24-1984', '1984-06-24', -1, -1, '198.55.112.209', 0, 1, 0, 0, -1, 0, 0, ':Zu_>S>k#&vxQ{mfKP<nhElB!vP@GZ', 0, 0, 0, '', 0, 0, 0, 0, 0, 0, 0, 0, 0, 0, 0, 0, '', '', 0, '', 'vb', '', 0, 1, 0, 0, NULL),
(23726, 2, '', 0, 'Muhammad Idrees', 'c1742b09e634c2aa495912535a732453', '2015-01-18', 'jawadidrees89@yahoo.com', 0, '', '', '', '', '', '', '', 2, 0, 'Member', 0, 1398248424, 0, 1453818332, 1454606158, 1453573021, 489958, 70, 0, 4, '5', 0, 0, 0, 0, 0, 3194967, '10-02-1964', '1964-10-02', -1, -1, '39.55.53.81', 0, 1, 0, 0, -1, 0, 0, 'b>iln{|A$TvVFVD4;E{zfZ0G''s-q$>', 0, 0, 0, '', 0, 0, 13, 1, 0, 0, 0, 0, 0, 0, 0, 0, '56a24a93468773650e2e448bdc38e47d', '', 0, '', 'vb', '', 0, 1, 0, 0, NULL),
(23928, 3, '', 0, 'TIMZ', 'bfe161eaf769f999fe5b3e392b250c58', '2014-04-30', 'nanafnm051@hotmail.com', 0, '', '', '', '', '', '', '', 2, 0, 'New Member', 0, 1398860337, 0, 1398860337, 1398862804, 0, 0, 0, 0, 4, '5', 0, 0, 0, 0, 0, 3194967, '01-23-1983', '1983-01-23', -1, -1, '192.126.157.75', 0, 1, 0, 0, -1, 0, 0, 'f,.~Z@G@''x"ez3h&RnGoGOaDBeQ>Pe', 0, 0, 0, '', 0, 0, 0, 0, 0, 0, 0, 0, 0, 0, 0, 0, '', '', 0, '', 'vb', '', 0, 1, 0, 0, NULL),
(23775, 3, '', 0, 'LMarian', '324b3608781947d9e8b0cd8460eec18a', '2014-04-24', 'lynettewdsundell@yahoo.com', 0, '', '', '', '', '', '', '', 2, 0, 'New Member', 0, 1398375686, 0, 1398375686, 1398375686, 0, 0, 0, 0, 4, '5', 0, 0, 0, 0, 0, 3194967, '06-11-1978', '1978-06-11', -1, -1, '108.178.5.109', 0, 1, 0, 0, -1, 0, 0, '`764.YkO`JOx)sH_$58)pllvIT\\N,R', 0, 0, 0, '', 0, 0, 0, 0, 0, 0, 0, 0, 0, 0, 0, 0, '', '', 0, '', 'vb', '', 0, 1, 0, 0, NULL),
(23959, 2, '', 0, 'irshadghani150', 'f764ea978adff72da1ff5a0062db6730', '2014-05-01', 'irshadghani150@yahoo.com', 0, '', '', '', '', '', '', '', 2, 0, 'New Member', 0, 1398936622, 0, 1398936622, 1398937198, 0, 0, 0, 0, 4, '5', 0, 0, 0, 0, 0, 3194967, '03-10-1992', '1992-03-10', -1, -1, '182.181.197.181', 0, 1, 0, 0, -1, 0, 0, 'IvZD/y4L0`x8h!&{L<{q5#xl>PFY`*', 0, 0, 0, '', 0, 0, 0, 0, 0, 0, 0, 0, 0, 0, 0, 0, '', '', 0, '', 'vb', '', 0, 1, 0, 0, NULL),
(23742, 3, '', 0, 'M84V', 'c70018914636ba4a97eae7f3daeda1f1', '2014-04-23', 'yieldingchamberbt941@outlook.com', 0, '', '', '', '', '', '', '', 2, 0, 'New Member', 0, 1398284980, 0, 1398284980, 1398293115, 0, 0, 0, 0, 4, '5', 0, 0, 0, 0, 0, 3194967, '05-31-1976', '1976-05-31', -1, -1, '23.231.7.98', 0, 1, 0, 0, -1, 0, 0, '=ywMxx,&S]kj-42|hN/RakZ-l+i;^~', 0, 0, 0, '', 0, 0, 0, 0, 0, 0, 0, 0, 0, 0, 0, 0, '', '', 0, '', 'vb', '', 0, 1, 0, 0, NULL),
(23732, 3, '', 0, 'AFVS', '3371c33e9186b8f8330d167648c8d7f0', '2014-04-23', 'tsaospt@hotmail.com', 0, '', '', '', '', '', '', '', 2, 0, 'New Member', 0, 1398266997, 0, 1398266997, 1398266997, 0, 0, 0, 0, 4, '5', 0, 0, 0, 0, 0, 3194967, '12-11-1972', '1972-12-11', -1, -1, '107.158.23.39', 0, 1, 0, 0, -1, 0, 0, '\\.B}JTzu>u5ba9p6`Y|v]]6Y|9DrJ,', 0, 0, 0, '', 0, 0, 0, 0, 0, 0, 0, 0, 0, 0, 0, 0, '', '', 0, '', 'vb', '', 0, 1, 0, 0, NULL),
(23913, 3, '', 0, 'MProvan', 'c2f72c7500e857d353615cbf49bb4392', '2014-04-30', 'womanlyrapture2vq460@outlook.com', 0, '', '', '', '', '', '', '', 2, 0, 'New Member', 0, 1398831431, 0, 1398831431, 1398831431, 0, 0, 0, 0, 4, '5', 0, 0, 0, 0, 0, 3194967, '09-05-1976', '1976-09-05', -1, -1, '198.50.171.113', 0, 1, 0, 0, -1, 0, 0, 'Y16Y3+VLk5E1j''oB+ztl#c:TIk:Zab', 0, 0, 0, '', 0, 0, 0, 0, 0, 0, 0, 0, 0, 0, 0, 0, '', '', 0, '', 'vb', '', 0, 1, 0, 0, NULL),
(23983, 3, '', 0, 'HJVB', '2cf8cb69e92156fcf0c9d9b2b640b16e', '2014-05-02', 'aguonhkarqnsy@outlook.com', 0, '', '', '', '', '', '', '', 2, 0, 'New Member', 0, 1399019117, 0, 1399019117, 1399021109, 0, 0, 0, 0, 4, '5', 0, 0, 0, 0, 0, 3194967, '11-18-1984', '1984-11-18', -1, -1, '108.177.146.17', 0, 1, 0, 0, -1, 0, 0, '"~frv()bSG5Z%c,J,OPheC*!EiizOA', 0, 0, 0, '', 0, 0, 0, 0, 0, 0, 0, 0, 0, 0, 0, 0, '', '', 0, '', 'vb', '', 0, 1, 0, 0, NULL),
(23910, 3, '', 0, 'QGRC', '0b607ce8e6f48746356569975eab3840', '2014-04-30', 'bonniec9tenen@yahoo.com', 0, '', '', '', '', '', '', '', 2, 0, 'New Member', 0, 1398826579, 0, 1398826579, 1398826579, 0, 0, 0, 0, 4, '5', 0, 0, 0, 0, 0, 3194967, '12-17-1979', '1979-12-17', -1, -1, '69.12.88.135', 0, 1, 0, 0, -1, 0, 0, '"w5Nvu.P5p(96(^U`Y$k%d3P%.u{fK', 0, 0, 0, '', 0, 0, 0, 0, 0, 0, 0, 0, 0, 0, 0, 0, '', '', 0, '', 'vb', '', 0, 1, 0, 0, NULL),
(23892, 3, '', 0, 'VQBP', 'cc9cf3470f6c8948201dceb58696fb76', '2014-04-29', 'mirandawcelvey@yahoo.com', 0, '', '', '', '', '', '', '', 2, 0, 'New Member', 0, 1398779411, 0, 1398779411, 1398782949, 0, 0, 0, 0, 4, '5', 0, 0, 0, 0, 0, 3194967, '05-16-1980', '1980-05-16', -1, -1, '192.3.55.200', 0, 1, 0, 0, -1, 0, 0, '=t-#G-QBKdv1]`><@UlU76Ij2{1p=j', 0, 0, 0, '', 0, 0, 0, 0, 0, 0, 0, 0, 0, 0, 0, 0, '', '', 0, '', 'vb', '', 0, 1, 0, 0, NULL),
(23751, 3, '', 0, 'J57J', '0f91fc9cda4160c40e52484209166ba1', '2014-04-24', 'changeablekeeps4822@outlook.com', 0, '', '', '', '', '', '', '', 2, 0, 'New Member', 0, 1398317660, 0, 1398317660, 1398320002, 0, 0, 0, 0, 4, '5', 0, 0, 0, 0, 0, 3194967, '09-17-1980', '1980-09-17', -1, -1, '107.161.190.163', 0, 1, 0, 0, -1, 0, 0, 'VCqU7+ht!Ve/ope@)<(R5#nwy,zu;E', 0, 0, 0, '', 0, 0, 0, 0, 0, 0, 0, 0, 0, 0, 0, 0, '', '', 0, '', 'vb', '', 0, 1, 0, 0, NULL),
(23752, 2, '', 0, 'nadir khan buzdar', 'd73f53177358c591be10460480b8134d', '2014-04-24', 'buzdar6516@yahoo.com', 0, '', '', '', '', '', '', '', 2, 0, 'New Member', 0, 1398319526, 0, 1398665471, 1399398576, 0, 0, 0, 0, 4, '5', 0, 0, 0, 0, 0, 3194967, '04-01-1978', '1978-04-01', -1, -1, '182.186.20.101', 0, 1, 0, 0, -1, 0, 0, '@fvAanG*v_jcYSoZHI4G(8X-]0x?\\O', 0, 0, 0, '', 0, 0, 0, 0, 0, 0, 0, 0, 0, 0, 0, 0, '', '', 0, '', 'vb', '', 0, 1, 0, 0, NULL),
(24486, 3, '', 0, 'CRubio', 'ee2c77de5037dda7372651cf3be40f68', '2014-05-17', 'callum_rubio@capnhaptintuc.com', 0, '', '', '', '', '', '', '', 2, 0, 'New Member', 0, 1400314075, 0, 1400314075, 1400316427, 0, 0, 0, 0, 4, '5', 0, 0, 0, 0, 0, 3194967, '06-25-1982', '1982-06-25', -1, -1, '69.12.77.126', 0, 1, 0, 0, -1, 0, 0, '>z{[XcK,([QV2>eT_Ug4p19MPqTeiq', 0, 0, 0, '', 0, 0, 0, 0, 0, 0, 0, 0, 0, 0, 0, 0, '', '', 0, '', 'vb', '', 0, 1, 0, 0, NULL),
(23783, 2, '', 0, 'bugtii.12bore', 'ddcd717c8ec2c54178ba602fe331f803', '2014-04-25', 'ali.balouch@hotmail.com', 0, '', '', '', '', '', '', '', 2, 0, 'New Member', 0, 1398398876, 0, 1403643019, 1403814859, 1403620207, 0, 0, 0, 4, '5', 0, 0, 0, 0, 0, 3194967, '03-16-1989', '1989-03-16', -1, -1, '119.154.119.91', 0, 1, 0, 0, -1, 0, 0, '~*qh\\1)DaNlCd<}&MJehom>v]XO,~!', 0, 0, 0, '', 0, 0, 1, 0, 0, 0, 0, 0, 0, 0, 0, 0, '', '', 0, '', 'vb', '', 0, 1, 0, 0, NULL),
(23754, 2, '', 0, 'DMTKH', '7df178a639f74a1fc458c040fa96f268', '2014-04-24', 'ashaopkatra@yahoo.com', 0, '', '', '', '', '', '', '', 2, 0, 'New Member', 0, 1398328499, 0, 1398328499, 1398328982, 0, 0, 0, 0, 4, '5', 0, 0, 0, 0, 0, 3194967, '03-20-1975', '1975-03-20', -1, -1, '5.157.36.15', 0, 1, 0, 0, -1, 0, 0, 'wIB~rm''g=vH8P,ig380\\jAed"!g\\JY', 0, 0, 0, '', 0, 0, 0, 0, 0, 0, 0, 0, 0, 0, 0, 0, '', '', 0, '', 'vb', '', 0, 1, 0, 0, NULL),
(23755, 3, '', 0, 'AZRXG', 'a72b8ed07c577e0720ff10e4dcb188db', '2014-04-24', 'ricolemanwyz@live.com', 0, '', '', '', '', '', '', '', 2, 0, 'New Member', 0, 1398332705, 0, 1398332705, 1398332705, 0, 0, 0, 0, 4, '5', 0, 0, 0, 0, 0, 3194967, '02-17-1975', '1975-02-17', -1, -1, '198.50.136.237', 0, 1, 0, 0, -1, 0, 0, 'sB|T/R|#KwB4]4iI:N3W0mq5,RvJ]{', 0, 0, 0, '', 0, 0, 0, 0, 0, 0, 0, 0, 0, 0, 0, 0, '', '', 0, '', 'vb', '', 0, 1, 0, 0, NULL),
(23771, 2, '', 0, 'dr asghar', 'de8c4857222e2768ad15a056b724fb72', '2014-04-24', 'as.gh.ar@hotmail.com', 0, '', '', '', '', '', '', '', 2, 0, 'New Member', 0, 1398369332, 0, 1398369434, 1398611482, 0, 0, 0, 0, 4, '5', 0, 0, 0, 0, 0, 3194967, '06-04-1953', '1953-06-04', -1, -1, '182.185.82.226', 0, 1, 0, 0, -1, 0, 0, '!&a%kKCuD_H@oF''viTcM.[VKsmbBMa', 0, 0, 0, '', 0, 0, 0, 0, 0, 0, 0, 0, 0, 0, 0, 0, '', '', 0, '', 'vb', '', 0, 1, 0, 0, NULL),
(23757, 3, '', 0, 'Shahzad Amro', '5435f3ceeffe691c97740a4e0341d213', '2014-04-24', 'kazimamrohvi@hotmail.com', 0, '', '', '', '', '', '', '', 2, 0, 'New Member', 0, 1398337061, 0, 1398337161, 1398337161, 0, 0, 0, 0, 4, '5', 0, 0, 0, 0, 0, 3194967, '10-01-1982', '1982-10-01', -1, -1, '125.209.120.75', 0, 1, 0, 0, -1, 0, 0, 'sS!Zu~7H&B!!j|naw\\''G-S.m%!k0gM', 0, 0, 0, '', 0, 0, 0, 0, 0, 0, 0, 0, 0, 0, 0, 0, '', '', 0, '', 'vb', '', 0, 1, 0, 0, NULL),
(23906, 3, '', 0, 'RDemaria', 'a2993e808ffce2689b5236a691792951', '2014-04-30', 'robin_demaria@camnangdoisong.com', 0, '', '', '', '', '', '', '', 2, 0, 'New Member', 0, 1398818264, 0, 1398818264, 1398827917, 0, 0, 0, 0, 4, '5', 0, 0, 0, 0, 0, 3194967, '07-03-1974', '1974-07-03', -1, -1, '173.213.96.21', 0, 1, 0, 0, -1, 0, 0, '{>UIT6S_t5U|!UUcjT\\n:4?^vh>Uif', 0, 0, 0, '', 0, 0, 0, 0, 0, 0, 0, 0, 0, 0, 0, 0, '', '', 0, '', 'vb', '', 0, 1, 0, 0, NULL),
(23759, 2, '', 0, 'Shadab Ahmad', 'e4eaf51e49bcd33e73a8a92dd6a6b6d7', '2014-04-24', 'shadab_ahmad94@yahoo.com', 0, '', '', '', '', '', '', '', 2, 0, 'New Member', 0, 1398345857, 0, 1398346674, 1398531475, 1398531465, 436260, 3, 0, 4, '5', 0, 0, 0, 0, 0, 3194967, '05-13-1994', '1994-05-13', -1, -1, '182.181.240.15', 0, 1, 0, 0, -1, 0, 0, '<}y$c<eicyuYS\\@%D8-\\A5\\c@!%}U|', 0, 0, 0, '', 0, 0, 0, 1, 0, 0, 0, 0, 0, 0, 0, 0, '', '', 0, '', 'vb', '', 0, 1, 0, 0, NULL),
(23862, 2, '', 0, 'shani017', '1b587052cbede9f6331747ef10735a2a', '2014-04-28', 'shanib82@gmail.com', 0, '', '', '', '', '', '', '', 2, 0, 'New Member', 0, 1398710304, 0, 1400759567, 1400759567, 0, 0, 0, 0, 4, '5', 0, 0, 0, 0, 0, 3194967, '12-17-1989', '1989-12-17', -1, -1, '39.53.62.249', 0, 1, 0, 0, -1, 0, 0, 'Jsl\\$3:s""LjE:*2aZ2n0_}a8EQ:Nt', 0, 0, 0, '', 0, 0, 0, 0, 0, 0, 0, 0, 0, 0, 0, 0, '', '', 0, '', 'vb', '', 0, 1, 0, 0, NULL),
(24154, 3, '', 0, 'SDesjardi', 'c4f3dbb696653e6952b279e76991a654', '2014-05-07', 'woebegoneteam24xtgpz@nokiamail.com', 0, '', '', '', '', '', '', '', 2, 0, 'New Member', 0, 1399429482, 0, 1399429482, 1399429482, 0, 0, 0, 0, 4, '5', 0, 0, 0, 0, 0, 3194967, '06-27-1982', '1982-06-27', -1, -1, '192.161.166.85', 0, 1, 0, 0, -1, 0, 0, '!N{y)WR5k;9u"%l%''FKgdplAm)J2.R', 0, 0, 0, '', 0, 0, 0, 0, 0, 0, 0, 0, 0, 0, 0, 0, '', '', 0, '', 'vb', '', 0, 1, 0, 0, NULL),
(24136, 3, '', 0, 'anatttsy2661', '8515332f0a14c0def4b23682a24b4ee4', '2014-05-06', 'anatttsy@ymail.com', 0, '', '', '', '', '', '', '', 2, 0, 'New Member', 0, 1399396947, 0, 1399396947, 1399396947, 0, 0, 0, 0, 4, '-10', 0, 0, 0, 0, 0, 3195031, '07-20-1981', '1981-07-20', -1, -1, '83.25.76.98', 0, 1, 0, 0, -1, 0, 0, 'R617ld66w/0L.iO4g#,3CZUiS$q4w3', 0, 0, 0, '', 0, 0, 0, 0, 0, 0, 0, 0, 0, 0, 0, 0, '', '', 0, '', 'vb', '', 0, 1, 0, 0, NULL),
(23763, 2, '', 0, 'mrrick', '4ebcab231d3322e3a4f7160be99d0062', '2014-04-24', 'tabingcolt@gmail.com', 7, '', '', '', '', '', '', '', 2, 0, 'Member', 0, 1398354975, 0, 1473094400, 1475027725, 1472918584, 496511, 64, 0, 4, '4', 0, 0, 0, 0, 0, 11584599, '09-21-1945', '1945-09-21', -1, 1, '68.231.97.226', 0, 0, 0, 0, -1, 0, 0, '6e\\9fE=5+o+s&Q5bNdI{-u6!1R9}R4', 0, 0, 0, '', 0, 0, 19, 0, 0, 0, 0, 0, 0, 0, 0, 0, 'd540d1f104288adf15fa2dee2155fc04', '', 0, '', 'vb', '', 0, 1, 0, 0, NULL),
(23764, 3, '', 0, 'ER93', '5bff74abb364ec60eb9ee28a0578c32f', '2014-04-24', 'shirlyqjmabus@yahoo.com', 0, '', '', '', '', '', '', '', 2, 0, 'New Member', 0, 1398357071, 0, 1398357071, 1398361152, 0, 0, 0, 0, 4, '5', 0, 0, 0, 0, 0, 3194967, '10-09-1970', '1970-10-09', -1, -1, '108.178.5.109', 0, 1, 0, 0, -1, 0, 0, 'j@U^Wcw\\}`5WjPg]t=mymF^`bNVV2X', 0, 0, 0, '', 0, 0, 0, 0, 0, 0, 0, 0, 0, 0, 0, 0, '', '', 0, '', 'vb', '', 0, 1, 0, 0, NULL),
(23765, 3, '', 0, 'emmy', '242d513d3ff961582590b272ae9896b9', '2014-04-24', 'emran4238@gmail.com', 0, '', '', '', '', '', '', '', 2, 0, 'New Member', 0, 1398358492, 0, 1398359943, 1398359943, 0, 0, 0, 0, 4, '5', 0, 0, 0, 0, 0, 3194967, '03-26-1982', '1982-03-26', -1, -1, '182.178.147.127', 5445, 1, 0, 0, -1, 0, 0, 'keCH<cCYZ"JqN..\\!nablgzw~m%C+-', 0, 0, 0, '', 0, 0, 0, 0, 0, 0, 0, 0, 0, 0, 0, 0, '', '', 0, '', 'vb', '', 0, 1, 0, 0, NULL),
(23766, 3, '', 0, 'Fahad Suhaib', '30dc960cef613acb5f21d5c10067731e', '2014-04-24', 'fahadsohaib8@gmail.com', 0, '', '', '', '', '', '', '', 2, 0, 'New Member', 0, 1398360921, 0, 1398360921, 1398360941, 0, 0, 0, 0, 4, '5', 0, 0, 0, 0, 0, 3194967, '08-24-1995', '1995-08-24', -1, -1, '182.178.228.77', 0, 1, 0, 0, -1, 0, 0, 'A30JH<d@ob2iv3`+;k@*fsT7t[uWoU', 0, 0, 0, '', 0, 0, 0, 0, 0, 0, 0, 0, 0, 0, 0, 0, '', '', 0, '', 'vb', '', 0, 1, 0, 0, NULL),
(23986, 3, '', 0, 'RDcg', 'de42845e3da4a2952292e9904b090261', '2014-05-02', 'coherentaccuserlu97w@outlook.com', 0, '', '', '', '', '', '', '', 2, 0, 'New Member', 0, 1399021555, 0, 1399021555, 1399023962, 0, 0, 0, 0, 4, '5', 0, 0, 0, 0, 0, 3194967, '07-12-1971', '1971-07-12', -1, -1, '83.10.43.38', 0, 1, 0, 0, -1, 0, 0, 'pl{Is+EDGNq.VYBN6=ZW@L5\\kCl2gn', 0, 0, 0, '', 0, 0, 0, 0, 0, 0, 0, 0, 0, 0, 0, 0, '', '', 0, '', 'vb', '', 0, 1, 0, 0, NULL),
(23880, 2, '', 0, 'Amer420', '364a25da0f42f13287bf5938d870ff72', '2014-04-29', 'Ameralwi@gmail.com', 0, '', '', '', '', '', '', '', 2, 0, 'New Member', 0, 1398748134, 0, 1398748134, 1398748185, 0, 0, 0, 0, 4, '5', 0, 0, 0, 0, 0, 3194967, '01-18-1980', '1980-01-18', -1, -1, '182.188.244.189', 0, 1, 0, 0, -1, 0, 0, '`A@i(||5?48oz<[\\LLY7d5tA+y8g>a', 0, 0, 0, '', 0, 0, 0, 0, 0, 0, 0, 0, 0, 0, 0, 0, '', '', 0, '', 'vb', '', 0, 1, 0, 0, NULL),
(23769, 3, '', 0, 'C78W', 'fa210b868131b0c4b2e35abdc21e033e', '2014-04-24', 'blairm1rias@yahoo.com', 0, '', '', '', '', '', '', '', 2, 0, 'New Member', 0, 1398365715, 0, 1398365715, 1398365715, 0, 0, 0, 0, 4, '5', 0, 0, 0, 0, 0, 3194967, '10-08-1970', '1970-10-08', -1, -1, '108.178.5.109', 0, 1, 0, 0, -1, 0, 0, '>S&h6gZA&h;MIb<(`HYLer0\\^^9^0m', 0, 0, 0, '', 0, 0, 0, 0, 0, 0, 0, 0, 0, 0, 0, 0, '', '', 0, '', 'vb', '', 0, 1, 0, 0, NULL),
(24017, 3, '', 0, 'BBDJ', '7dbf6eb8f8cafdf192805ef25bba7808', '2014-05-03', 'dotyrhc@hotmail.com', 0, '', '', '', '', '', '', '', 2, 0, 'New Member', 0, 1399124752, 0, 1399124752, 1399124752, 0, 0, 0, 0, 4, '5', 0, 0, 0, 0, 0, 3194967, '10-24-1978', '1978-10-24', -1, -1, '23.94.23.90', 0, 1, 0, 0, -1, 0, 0, '|TEn1cpsY0Y48J`C;,pMh/@Np{6{l$', 0, 0, 0, '', 0, 0, 0, 0, 0, 0, 0, 0, 0, 0, 0, 0, '', '', 0, '', 'vb', '', 0, 1, 0, 0, NULL),
(23917, 2, '', 0, 'maxim', '8ac59069171a87a18c2bb77203d184da', '2014-04-30', 'gmaxim@gmail.com', 0, '', '', '', '', '', '', '', 2, 0, 'New Member', 0, 1398843673, 0, 1398845239, 1400781115, 0, 0, 0, 0, 4, '-5', 0, 0, 0, 0, 0, 3195095, '12-11-1977', '1977-12-11', -1, -1, '99.237.124.180', 0, 1, 0, 0, -1, 0, 0, '"hl!^Grk0cTH7@j~tn%uhuZnvEgg`R', 0, 0, 0, '', 0, 0, 0, 0, 0, 0, 0, 0, 0, 0, 0, 0, '', '', 0, '', 'vb', '', 0, 1, 0, 0, NULL),
(23789, 2, '', 0, 'raja1', '61d4ef7835a5a73e2b686713517b1301', '2014-04-25', 'raja1905@yahoo.com', 0, '', '', '', '', '', '', '', 2, 0, 'New Member', 0, 1398410476, 0, 1415954006, 1436808528, 0, 0, 0, 0, 4, '5', 0, 0, 0, 0, 0, 3194967, '10-19-1970', '1970-10-19', -1, -1, '39.47.106.162', 0, 1, 0, 0, -1, 0, 0, '2K)5)08T''fD).Fzs=06PLci$``/MI0', 0, 0, 0, '', 0, 0, 0, 0, 0, 0, 0, 0, 0, 0, 0, 0, '', '', 0, '', 'vb', '', 0, 1, 0, 0, NULL),
(23790, 2, '', 0, 'asadnow2k', 'fbc7f98244ff197f77b3316e10a23b6e', '2014-04-25', 'asadnow2k@gmail.com', 0, '', '', '', '', '', '', '', 2, 0, 'New Member', 0, 1398411324, 0, 1403021432, 1403025742, 1403021109, 0, 2, 0, 4, '5', 0, 0, 0, 0, 0, 3194967, '05-01-1987', '1987-05-01', -1, -1, '39.51.114.74', 0, 1, 0, 0, -1, 0, 0, 'J^JD_9l{7^a(|MGQX/-SVfi|cL04tx', 0, 0, 0, '', 0, 0, 2, 0, 0, 0, 0, 0, 0, 0, 0, 0, '', '', 0, '', 'vb', '', 0, 1, 0, 0, NULL),
(23851, 3, '', 0, 'GSjd', '90754663c00835ae2c815be20ad2baa2', '2014-04-27', 'gisele.matney@gwyneth.progrespoland.com', 0, '', '', '', '', '', '', '', 2, 0, 'New Member', 0, 1398623609, 0, 1398623609, 1398626337, 0, 0, 0, 0, 4, '5', 0, 0, 0, 0, 0, 3194967, '02-24-1977', '1977-02-24', -1, -1, '193.189.117.25', 0, 1, 0, 0, -1, 0, 0, ')`JuwB^PrWq3w)bQdg*|0qB-X5d2[B', 0, 0, 0, '', 0, 0, 0, 0, 0, 0, 0, 0, 0, 0, 0, 0, '', '', 0, '', 'vb', '', 0, 1, 0, 0, NULL),
(23792, 3, '', 0, 'GHSB', '36221006eb3710570a3b6b2593713c4d', '2014-04-25', 'brett_feldman100@houston.malme.waw.pl', 0, '', '', '', '', '', '', '', 2, 0, 'New Member', 0, 1398416357, 0, 1398416357, 1398418730, 0, 0, 0, 0, 4, '5', 0, 0, 0, 0, 0, 3194967, '05-04-1980', '1980-05-04', -1, -1, '46.22.173.72', 0, 1, 0, 0, -1, 0, 0, '1.H3fITX%7PuAJ"y7g7xxw>3blnJ@S', 0, 0, 0, '', 0, 0, 0, 0, 0, 0, 0, 0, 0, 0, 0, 0, '', '', 0, '', 'vb', '', 0, 1, 0, 0, NULL),
(23793, 3, '', 0, 'SGuf', '970b6c0a9c1551526acfe89f2cc29aa6', '2014-04-25', 'musescy@hotmail.com', 0, '', '', '', '', '', '', '', 2, 0, 'New Member', 0, 1398418854, 0, 1398418854, 1398508903, 0, 0, 0, 0, 4, '5', 0, 0, 0, 0, 0, 3194967, '11-05-1970', '1970-11-05', -1, -1, '178.32.56.248', 0, 1, 0, 0, -1, 0, 0, 'SjeO$7`p51lhSTcB%evS0lmSFzC:%E', 0, 0, 0, '', 0, 0, 0, 0, 0, 0, 0, 0, 0, 0, 0, 0, '', '', 0, '', 'vb', '', 0, 1, 0, 0, NULL),
(27039, 2, '', 0, 'Ahsan 1', '8ed15c2221e116e6ded19fcfade974d4', '2014-08-19', 'ahsanmumtaz73@hotmail.com', 0, '', '', '', '', '', '', '', 2, 0, 'New Member', 0, 1408439834, 0, 1408439834, 1408440011, 0, 0, 0, 0, 4, '5', 0, 0, 0, 0, 0, 3194967, '12-01-1995', '1995-12-01', -1, -1, '119.154.195.177', 0, 1, 0, 0, -1, 0, 0, '1d#|};!WgU.pC<r}!H8JVJqmvJP(fQ', 0, 0, 0, '', 0, 0, 0, 0, 0, 0, 0, 0, 0, 0, 0, 0, '', '', 0, '', 'vb', '', 0, 1, 0, 0, NULL),
(23865, 3, '', 0, 'EThornbur', '9b3ccdc41b60436255cbc4fcaaa0de04', '2014-04-28', 'karonycj232@hotmail.com', 0, '', '', '', '', '', '', '', 2, 0, 'New Member', 0, 1398711875, 0, 1398711875, 1398711875, 0, 0, 0, 0, 4, '5', 0, 0, 0, 0, 0, 3194967, '12-06-1970', '1970-12-06', -1, -1, '192.227.240.11', 0, 1, 0, 0, -1, 0, 0, 'V_HP!:Ek$9(gB|]U&#b(dE%#5h0v{y', 0, 0, 0, '', 0, 0, 0, 0, 0, 0, 0, 0, 0, 0, 0, 0, '', '', 0, '', 'vb', '', 0, 1, 0, 0, NULL),
(23796, 2, '', 0, 'faisalshery', '7a25ce0ac9c85fed0d45153552daf9a4', '2014-04-25', 'faisalshery@hotmail.com', 0, '', '', '', '', '', '', '', 2, 0, 'New Member', 0, 1398431172, 0, 1398431348, 1398849847, 0, 0, 0, 0, 4, '5', 0, 0, 0, 0, 0, 3194967, '01-01-1975', '1975-01-01', -1, -1, '182.189.152.229', 5098, 1, 0, 0, -1, 0, 0, 'yn]FV&e2!3FGrQ*K#;k-W^+G+OeA#C', 0, 0, 0, '', 0, 0, 0, 0, 0, 0, 0, 0, 0, 0, 0, 0, '', '', 0, '', 'vb', '', 0, 1, 0, 0, NULL),
(23940, 3, '', 0, 'juanid bajwa', '103d2eca14ccb9e1d9e1ce06cc417dfc', '2014-04-30', 'junaidbajwa76@yahoo.com', 0, '', '', '', '', '', '', '', 2, 0, 'New Member', 0, 1398881251, 0, 1398881993, 1398881993, 0, 0, 0, 0, 4, '5', 0, 0, 0, 0, 0, 3194967, '09-13-1994', '1994-09-13', -1, -1, '119.158.3.96', 0, 1, 0, 0, -1, 0, 0, '~ReZDfFM''s)ap(z}3>`zT`Oi@$iA\\l', 0, 0, 0, '', 0, 0, 1, 0, 0, 0, 0, 0, 0, 0, 0, 0, '', '', 0, '', 'vb', '', 0, 1, 0, 0, NULL),
(23975, 3, '', 0, 'MarilouMa', 'aa70da4b65751bb8bf8f640157fe827d', '2014-05-01', 'mandyvwnkrprn@outlook.com', 0, '', '', '', '', '', '', '', 2, 0, 'New Member', 0, 1398975840, 0, 1398975840, 1399795932, 0, 0, 0, 0, 4, '5', 0, 0, 0, 0, 0, 3194967, '02-27-1977', '1977-02-27', -1, -1, '93.118.68.35', 0, 1, 0, 0, -1, 0, 0, 'ld%Yyy&1T6)2''$B7A\\R%11fgd4lHBP', 0, 0, 0, '', 0, 0, 0, 0, 0, 0, 0, 0, 0, 0, 0, 0, '', '', 0, '', 'vb', '', 0, 1, 0, 0, NULL),
(23961, 2, '', 0, 'asad110', 'b6a4a240d2189afc17f96c7c242c94c8', '2014-05-01', 'channaasad@hotmail.com', 0, '', '', '', '', '', '', '', 2, 0, 'New Member', 0, 1398942137, 0, 1398942137, 1398942442, 0, 0, 0, 0, 4, '5', 0, 0, 0, 0, 0, 3194967, '02-04-1978', '1978-02-04', -1, -1, '182.182.29.150', 0, 1, 0, 0, -1, 0, 0, 'd!DevLYk}\\{BZNhZzCS.Mhl>@<fdR.', 0, 0, 0, '', 0, 0, 0, 0, 0, 0, 0, 0, 0, 0, 0, 0, '', '', 0, '', 'vb', '', 0, 1, 0, 0, NULL),
(24056, 3, '', 0, 'SKillian', 'fc3dda96504a283a4ecb5cd207bb89c0', '2014-05-04', 'judebowers74@yahoo.com', 0, '', '', '', '', '', '', '', 2, 0, 'New Member', 0, 1399232174, 0, 1399232174, 1399242561, 0, 0, 0, 0, 4, '5', 0, 0, 0, 0, 0, 3194967, '05-13-1971', '1971-05-13', -1, -1, '165.231.22.236', 0, 1, 0, 0, -1, 0, 0, '+|ux!b4b=~~(VS9iBESS`+vd)wHzM}', 0, 0, 0, '', 0, 0, 0, 0, 0, 0, 0, 0, 0, 0, 0, 0, '', '', 0, '', 'vb', '', 0, 1, 0, 0, NULL),
(23801, 3, '', 0, 'LNivison', 'eae3ff9f59ff34cc080c1ecca9045a8e', '2014-04-25', 'ewinglmb8ysrr@hotmail.com', 0, '', '', '', '', '', '', '', 2, 0, 'New Member', 0, 1398440968, 0, 1398440968, 1398484252, 0, 0, 0, 0, 4, '5', 0, 0, 0, 0, 0, 3194967, '10-09-1982', '1982-10-09', -1, -1, '42.117.131.187', 0, 1, 0, 0, -1, 0, 0, '+",Sy9l''7C2e(PsV1O~%y^fIiVTWj4', 0, 0, 0, '', 0, 0, 0, 0, 0, 0, 0, 0, 0, 0, 0, 0, '', '', 0, '', 'vb', '', 0, 1, 0, 0, NULL),
(23802, 3, '', 0, 'patrickmuasda2748', '4e42e7ab4a019995704d483e3b57f63d', '2014-04-25', 'patrickmuasda@ymail.com', 0, '', '', '', '', '', '', '', 2, 0, 'New Member', 0, 1398446466, 0, 1398446466, 1398446466, 0, 0, 0, 0, 4, '1', 0, 0, 0, 0, 0, 3195031, '07-03-1985', '1985-07-03', -1, -1, '85.104.58.135', 0, 1, 0, 0, -1, 0, 0, 'pi=dz)asCQ5p>]F!vyP!|2?3Mp0k''v', 0, 0, 0, '', 0, 0, 0, 0, 0, 0, 0, 0, 0, 0, 0, 0, '', '', 0, '', 'vb', '', 0, 1, 0, 0, NULL),
(24006, 3, '', 0, 'JEbsworth', '1fa044561ee1db6b8a08b46f8ad615ff', '2014-05-03', 'jayme.ebsworth@elbert.progrespoland.com', 0, '', '', '', '', '', '', '', 2, 0, 'New Member', 0, 1399074010, 0, 1399074010, 1399076388, 0, 0, 0, 0, 4, '5', 0, 0, 0, 0, 0, 3194967, '07-06-1978', '1978-07-06', -1, -1, '193.189.116.233', 0, 1, 0, 0, -1, 0, 0, 'HenhC$\\S-<j~*cXZ/u$Z!NbH1Gf0>"', 0, 0, 0, '', 0, 0, 0, 0, 0, 0, 0, 0, 0, 0, 0, 0, '', '', 0, '', 'vb', '', 0, 1, 0, 0, NULL),
(23991, 2, '', 0, 'Hungry Lion', '14f6ebb656aa8dcfa5bff804fa0ff09e', '2014-05-02', 'umernoon23@gmail.com', 0, '', '', '', '', '', '', '', 2, 0, 'Member', 0, 1399030667, 0, 1400178862, 1400245042, 1400245016, 440100, 65, 0, 4, '5', 0, 0, 0, 0, 0, 3194967, '06-05-1993', '1993-06-05', -1, -1, '203.124.28.1', 688, 1, 0, 0, -1, 0, 0, 'n,`:(>;9''<r{~"_?u"QbMN$KZ.ReB/', 0, 0, 0, '', 0, 0, 15, 0, 1, 0, 0, 0, 0, 0, 0, 0, '', '', 0, '', 'vb', '', 0, 1, 0, 0, NULL),
(23804, 3, '', 0, 'VScribner', '578e39117f558f9842a4b2066a48713e', '2014-04-25', 'bonnie0jennis@yahoo.com', 0, '', '', '', '', '', '', '', 2, 0, 'New Member', 0, 1398449047, 0, 1398449047, 1398449047, 0, 0, 0, 0, 4, '5', 0, 0, 0, 0, 0, 3194967, '01-07-1979', '1979-01-07', -1, -1, '5.255.75.23', 0, 1, 0, 0, -1, 0, 0, 'X8BZL&w<K*:G2{RZ#{NiYid[${*l|^', 0, 0, 0, '', 0, 0, 0, 0, 0, 0, 0, 0, 0, 0, 0, 0, '', '', 0, '', 'vb', '', 0, 1, 0, 0, NULL),
(23937, 3, '', 0, 'talons', '33246aafc3152b403a39b8160bce1616', '2014-04-30', 'alyasifnaqvi@yahoo.com', 0, '', '', '', '', '', '', '', 2, 0, 'New Member', 0, 1398876106, 0, 1398876106, 1398879387, 0, 0, 0, 0, 4, '5', 0, 0, 0, 0, 0, 3194967, '09-29-1973', '1973-09-29', -1, -1, '39.52.145.158', 0, 1, 0, 0, -1, 0, 0, 'K1[TX/M:e_p|*FIO+^y]Sy:S}Wj2Y]', 0, 0, 0, '', 0, 0, 0, 0, 0, 0, 0, 0, 0, 0, 0, 0, '', '', 0, '', 'vb', '', 0, 1, 0, 0, NULL),
(23808, 3, '', 0, 'ZGZC', '70e3b272df2d2e79df5405ee1a325808', '2014-04-25', 'martinahuwillers@yahoo.com', 0, '', '', '', '', '', '', '', 2, 0, 'New Member', 0, 1398460348, 0, 1398460348, 1398460348, 0, 0, 0, 0, 4, '5', 0, 0, 0, 0, 0, 3194967, '02-13-1976', '1976-02-13', -1, -1, '69.12.88.135', 0, 1, 0, 0, -1, 0, 0, 's2YPM<G.Nc&!\\KZ7QNwkNp<;e*_jmN', 0, 0, 0, '', 0, 0, 0, 0, 0, 0, 0, 0, 0, 0, 0, 0, '', '', 0, '', 'vb', '', 0, 1, 0, 0, NULL),
(23971, 3, '', 0, 'QQTJ', '40ec7af820baf9f6190290ca9eb1a162', '2014-05-01', 'elvaqtg@hotmail.com', 0, '', '', '', '', '', '', '', 2, 0, 'New Member', 0, 1398967388, 0, 1398967388, 1398970306, 0, 0, 0, 0, 4, '5', 0, 0, 0, 0, 0, 3194967, '08-27-1981', '1981-08-27', -1, -1, '50.115.169.92', 0, 1, 0, 0, -1, 0, 0, 'eI]rk5CQza\\":1~L7(2e9cA2\\`hAv)', 0, 0, 0, '', 0, 0, 0, 0, 0, 0, 0, 0, 0, 0, 0, 0, '', '', 0, '', 'vb', '', 0, 1, 0, 0, NULL),
(23969, 3, '', 0, 'TForte', '2d8acff12aca4113b3061c3c2531d166', '2014-05-01', 'tanyawaa@hotmail.com', 0, '', '', '', '', '', '', '', 2, 0, 'New Member', 0, 1398965577, 0, 1398965577, 1398983273, 0, 0, 0, 0, 4, '5', 0, 0, 0, 0, 0, 3194967, '08-24-1983', '1983-08-24', -1, -1, '107.158.23.4', 0, 1, 0, 0, -1, 0, 0, '~5v(qJK[<5PlI\\"B8B;^pqeOr-@+3c', 0, 0, 0, '', 0, 0, 0, 0, 0, 0, 0, 0, 0, 0, 0, 0, '', '', 0, '', 'vb', '', 0, 1, 0, 0, NULL),
(23942, 3, '', 0, 'D7884', '253b99d65ed68516732e235bc88a6c61', '2014-04-30', 'parksujnj@outlook.com', 0, '', '', '', '', '', '', '', 2, 0, 'New Member', 0, 1398894127, 0, 1398894127, 1398911482, 0, 0, 0, 0, 4, '5', 0, 0, 0, 0, 0, 3194967, '05-26-1979', '1979-05-26', -1, -1, '190.179.76.68', 0, 1, 0, 0, -1, 0, 0, 'yF4|%''B4OZmjfmC[qexRL7f;.~j0@S', 0, 0, 0, '', 0, 0, 0, 0, 0, 0, 0, 0, 0, 0, 0, 0, '', '', 0, '', 'vb', '', 0, 1, 0, 0, NULL),
(23811, 3, '', 0, 'GRatten', '1a672d8a32993a9fb069a9807292cae8', '2014-04-25', 'glossysilhouett17@outlook.com', 0, '', '', '', '', '', '', '', 2, 0, 'New Member', 0, 1398465779, 0, 1398465779, 1398467738, 0, 0, 0, 0, 4, '5', 0, 0, 0, 0, 0, 3194967, '02-20-1982', '1982-02-20', -1, -1, '37.203.210.149', 0, 1, 0, 0, -1, 0, 0, 'c2TdWUq:o.P:i~xD6]|D4)0V,.b''=+', 0, 0, 0, '', 0, 0, 0, 0, 0, 0, 0, 0, 0, 0, 0, 0, '', '', 0, '', 'vb', '', 0, 1, 0, 0, NULL),
(23973, 3, '', 0, 'JSaddler', '4092ec670bcbf19d76ede7a5c6f8e12f', '2014-05-01', 'madgeujm@hotmail.com', 0, '', '', '', '', '', '', '', 2, 0, 'New Member', 0, 1398971196, 0, 1398971196, 1398971196, 0, 0, 0, 0, 4, '5', 0, 0, 0, 0, 0, 3194967, '07-02-1970', '1970-07-02', -1, -1, '23.88.104.176', 0, 1, 0, 0, -1, 0, 0, 'y7QYmBn&nFQN0nrgl*&d"R4/s?,<ih', 0, 0, 0, '', 0, 0, 0, 0, 0, 0, 0, 0, 0, 0, 0, 0, '', '', 0, '', 'vb', '', 0, 1, 0, 0, NULL),
(23921, 2, '', 0, 'hawks eye', '5e6eb42b6cdfa6aaedd318a8d147bb0a', '2014-04-30', 'hawkseye33@hotmail.com', 0, '', '', '', '', '', '', '', 2, 0, 'New Member', 0, 1398850637, 0, 1398851365, 1399477131, 0, 0, 0, 0, 4, '5', 0, 0, 0, 0, 0, 3195031, '04-17-1992', '1992-04-17', -1, -1, '39.44.90.99', 4286, 1, 0, 0, -1, 0, 0, '''4Inr|{03GpiPOffe(nQHT:bf,ehR0', 0, 0, 0, '', 0, 0, 0, 0, 0, 0, 0, 0, 0, 0, 0, 0, '25ac154eb1186348e09d3607103f85c5', '', 0, '', 'vb', '', 0, 1, 0, 0, NULL),
(23948, 2, '', 0, 'Crater Soon', '5172d039cf09074a8a04e51821006900', '2014-05-01', 'zesdar95@gmail.com', 0, '', '', '', '', '', '', '', 2, 0, 'New Member', 0, 1398910428, 0, 1398910428, 1398911068, 0, 0, 0, 0, 4, '5', 0, 0, 0, 0, 0, 3194967, '10-02-1985', '1985-10-02', -1, -1, '39.55.43.126', 0, 1, 0, 0, -1, 0, 0, 'eRIE,dP,dVKs)R}tY5s>W_p5#c2](8', 0, 0, 0, '', 0, 0, 0, 0, 0, 0, 0, 0, 0, 0, 0, 0, '', '', 0, '', 'vb', '', 0, 1, 0, 0, NULL),
(23927, 3, '', 0, 'RPaxton', 'e6b00fa5f83df4f5e03182a8091659a7', '2014-04-30', 'ancientalibi34gm27x@outlook.com', 0, '', '', '', '', '', '', '', 2, 0, 'New Member', 0, 1398858090, 0, 1398858090, 1398860311, 0, 0, 0, 0, 4, '5', 0, 0, 0, 0, 0, 3194967, '01-04-1975', '1975-01-04', -1, -1, '192.3.176.197', 0, 1, 0, 0, -1, 0, 0, '{-jQp@h^BC7Z2Idr%yMGB|f>7A2x6p', 0, 0, 0, '', 0, 0, 0, 0, 0, 0, 0, 0, 0, 0, 0, 0, '', '', 0, '', 'vb', '', 0, 1, 0, 0, NULL),
(23899, 3, '', 0, 'YPWL', '883983084f2fdd237957c923a02e39e3', '2014-04-29', 'larhonda_hoddle@gwyneth.progrespoland.com', 0, '', '', '', '', '', '', '', 2, 0, 'New Member', 0, 1398792337, 0, 1398792337, 1398795012, 0, 0, 0, 0, 4, '5', 0, 0, 0, 0, 0, 3194967, '05-03-1979', '1979-05-03', -1, -1, '46.22.173.78', 0, 1, 0, 0, -1, 0, 0, 'ZEirdp8|hZVALUJ[-zn?3<_=E;`\\I/', 0, 0, 0, '', 0, 0, 0, 0, 0, 0, 0, 0, 0, 0, 0, 0, '', '', 0, '', 'vb', '', 0, 1, 0, 0, NULL),
(23869, 2, '', 0, 'waisoo', '9b94fbaff9c3a81efb83263e52e39cef', '2014-04-28', 'awaiszafar@hotmail.com', 0, '', '', '', '', '', '', '', 2, 0, 'New Member', 0, 1398722433, 0, 1398723818, 1399818050, 0, 0, 0, 0, 4, '5', 0, 0, 0, 0, 0, 3194967, '12-15-1980', '1980-12-15', -1, -1, '46.7.235.101', 0, 1, 0, 0, -1, 0, 0, '/_1:D_#Xqz)jk|D]$Q3E;y:wB@s^ND', 0, 0, 0, '', 0, 0, 0, 0, 0, 0, 0, 0, 0, 0, 0, 0, '', '', 0, '', 'vb', '', 0, 1, 0, 0, NULL),
(23852, 2, '', 0, 'digitekk', '44a4df27a2d2c8b7e201b98670b745c7', '2014-04-27', 'digitekk@yahoo.com', 0, '', '', '', '', '', '', '', 2, 0, 'New Member', 0, 1398627204, 0, 1398627204, 1398628566, 0, 0, 0, 0, 4, '5', 0, 0, 0, 0, 0, 3194967, '09-22-1977', '1977-09-22', -1, -1, '182.188.207.30', 0, 1, 0, 0, -1, 0, 0, '<]xm<.fltuo<f''M!Pj7x?F\\R.zh(y3', 0, 0, 0, '', 0, 0, 0, 0, 0, 0, 0, 0, 0, 0, 0, 0, '', '', 0, '', 'vb', '', 0, 1, 0, 0, NULL),
(23820, 3, '', 0, 'E51X', '0df1b2679471f24df20159d34cfaf8df', '2014-04-26', 'james@buytwitterfollowersreviews.org', 0, '', '', '', '', '', '', '', 2, 0, 'New Member', 0, 1398474233, 0, 1398474233, 1398476452, 0, 0, 0, 0, 4, '5', 0, 0, 0, 0, 0, 3194967, '02-06-1973', '1973-02-06', -1, -1, '188.165.174.222', 0, 1, 0, 0, -1, 0, 0, '6yQYucWaw2PdZK.1>l[W.vP_&0FBdO', 0, 0, 0, '', 0, 0, 0, 0, 0, 0, 0, 0, 0, 0, 0, 0, '', '', 0, '', 'vb', '', 0, 1, 0, 0, NULL),
(23895, 2, '', 0, 'Toothbuster', '35ea8687f83ea0f51be29ad286e6c37a', '2014-04-29', 'Bjqureshi@gmail.com', 0, '', '', '', '', '', '', '', 2, 0, 'New Member', 0, 1398787143, 0, 1398788249, 1461007509, 0, 0, 0, 0, 4, '5', 0, 0, 0, 0, 0, 3194967, '08-31-1977', '1977-08-31', -1, -1, '101.50.94.36', 0, 1, 0, 0, -1, 0, 0, 'GyxXtk67pVt6}4x6vV3wY^7koGD<]>', 0, 0, 0, '', 0, 0, 0, 0, 0, 0, 0, 0, 0, 0, 0, 0, '', '', 0, '', 'vb', '', 0, 1, 0, 0, NULL),
(23968, 2, '', 0, 'Hunter786', '60a9ddc67ca60f7583ff94972ae292f5', '2014-05-01', 'Trustedhands@live.com', 0, '', '', '', '', '', '', '', 2, 0, 'New Member', 0, 1398964425, 0, 1398968927, 1411385280, 0, 0, 0, 0, 4, '5', 0, 0, 0, 0, 0, 3194967, '10-24-1974', '1974-10-24', -1, -1, '39.32.100.106', 0, 1, 0, 0, -1, 0, 0, '/ZXy}[k5o?VkxDC-hK189yi5;xq!Yj', 0, 0, 0, '', 0, 0, 0, 0, 0, 0, 0, 0, 0, 0, 0, 0, '', '', 0, '', 'vb', '', 0, 1, 0, 0, NULL),
(23825, 3, '', 0, 'BHouser', '905295510d6da8bb864ef2f9c2f5aad7', '2014-04-26', 'helpfulglut448r361@outlook.com', 0, '', '', '', '', '', '', '', 2, 0, 'New Member', 0, 1398479211, 0, 1398479211, 1398553242, 0, 0, 0, 0, 4, '5', 0, 0, 0, 0, 0, 3194967, '02-22-1985', '1985-02-22', -1, -1, '198.50.242.21', 0, 1, 0, 0, -1, 0, 0, '\\/08E3J_N2,&fA.8Q$e1HsXR?}`y{=', 0, 0, 0, '', 0, 0, 0, 0, 0, 0, 0, 0, 0, 0, 0, 0, '', '', 0, '', 'vb', '', 0, 1, 0, 0, NULL),
(23970, 3, '', 0, 'VMacDevit', '22c8b683f96594917aa56f3341d22c39', '2014-05-01', 'bwaeotj@hotmail.com', 0, '', '', '', '', '', '', '', 2, 0, 'New Member', 0, 1398966071, 0, 1398966071, 1399006046, 0, 0, 0, 0, 4, '5', 0, 0, 0, 0, 0, 3194967, '04-24-1981', '1981-04-24', -1, -1, '23.88.104.154', 0, 1, 0, 0, -1, 0, 0, ':i^dFzxuhCSidk,!K|r1Me>lpQP0cI', 0, 0, 0, '', 0, 0, 0, 0, 0, 0, 0, 0, 0, 0, 0, 0, '', '', 0, '', 'vb', '', 0, 1, 0, 0, NULL),
(23872, 3, '', 0, 'LBaines', '4935cdb052f4f6ca7c73bf5bce2fc166', '2014-04-29', 'lonna-baines@rsawebsites.tk', 0, '', '', '', '', '', '', '', 2, 0, 'New Member', 0, 1398727721, 0, 1398727721, 1398730447, 0, 0, 0, 0, 4, '5', 0, 0, 0, 0, 0, 3194967, '08-31-1980', '1980-08-31', -1, -1, '198.143.136.25', 0, 1, 0, 0, -1, 0, 0, 'k0_(]''U3pn+1"xJl`/;V''.)#Y>s,es', 0, 0, 0, '', 0, 0, 0, 0, 0, 0, 0, 0, 0, 0, 0, 0, '', '', 0, '', 'vb', '', 0, 1, 0, 0, NULL),
(23873, 3, '', 0, 'JGeorgina', '6ad12c8d3785fe3d980fdc0efb8e8900', '2014-04-29', 'johnie.georgina@carbulosss.com', 0, '', '', '', '', '', '', '', 2, 0, 'New Member', 0, 1398731255, 0, 1398731255, 1398748933, 0, 0, 0, 0, 4, '5', 0, 0, 0, 0, 0, 3194967, '06-07-1971', '1971-06-07', -1, -1, '192.157.239.77', 0, 1, 0, 0, -1, 0, 0, ';b\\a_1MZ)&z-L|62DW;S{k+S6wTcbE', 0, 0, 0, '', 0, 0, 0, 0, 0, 0, 0, 0, 0, 0, 0, 0, '', '', 0, '', 'vb', '', 0, 1, 0, 0, NULL),
(23984, 3, '', 0, 'NSmythe', 'aaafda9b66d67bab9c44569f4101be99', '2014-05-02', 'kayceyle661@hotmail.com', 0, '', '', '', '', '', '', '', 2, 0, 'New Member', 0, 1399020471, 0, 1399020471, 1399027783, 0, 0, 0, 0, 4, '5', 0, 0, 0, 0, 0, 3194967, '03-04-1981', '1981-03-04', -1, -1, '84.246.73.17', 0, 1, 0, 0, -1, 0, 0, '_xa.2"ZJlg%s+k1=o_VbGb7}J&Frj`', 0, 0, 0, '', 0, 0, 0, 0, 0, 0, 0, 0, 0, 0, 0, 0, '', '', 0, '', 'vb', '', 0, 1, 0, 0, NULL),
(23979, 3, '', 0, 'GMaselli', 'bfcf194f3934e41381b6934902cf6672', '2014-05-02', 'winonaukw629@hotmail.com', 0, '', '', '', '', '', '', '', 2, 0, 'New Member', 0, 1399002460, 0, 1399002460, 1399441661, 0, 0, 0, 0, 4, '5', 0, 0, 0, 0, 0, 3194967, '08-21-1977', '1977-08-21', -1, -1, '23.81.201.224', 0, 1, 0, 0, -1, 0, 0, '~k=@fJz;5aKM~mj}Qw}!!YMz}"BNfo', 0, 0, 0, '', 0, 0, 0, 0, 0, 0, 0, 0, 0, 0, 0, 0, '', '', 0, '', 'vb', '', 0, 1, 0, 0, NULL),
(23889, 3, '', 0, 'topakairgun', 'f193ff3505985505e826ed44b84f382e', '2014-04-29', 'qurbanalikhan2003@yahoo.com', 0, '', '', '', '', '', '', '', 2, 0, 'New Member', 0, 1398765469, 0, 1398767404, 1398767404, 0, 0, 0, 0, 4, '5', 0, 0, 0, 0, 0, 3194967, '03-14-1983', '1983-03-14', -1, -1, '175.110.145.14', 0, 1, 0, 0, -1, 0, 0, '`.UWLLOxi`wKq~(XwKLd|Qg<0TB%q:', 0, 0, 0, '', 0, 0, 0, 0, 0, 0, 0, 0, 0, 0, 0, 0, '', '', 0, '', 'vb', '', 0, 1, 0, 0, NULL),
(23831, 2, '', 0, 'akbarullah', '7eccb1d871c8cdfa704d994696b6feec', '2014-04-26', 'asimkhan6@gmail.com', 9, '', '', '', '', '', '', '', 2, 0, 'New Member', 0, 1398487023, 100, 1399194699, 1424408889, 1424408695, 474013, 5, 0, 4, '-6', 0, 0, 0, 0, 0, 3163223, '02-19-1980', '1980-02-19', 30, 1, '24.211.12.240', 0, 0, 0, 0, -1, 0, 0, 'tH8Sui`&*fY^-oh)h\\!ws=\\FFAYM&W', 0, 0, 0, '', 0, 0, 0, 0, 0, 0, 0, 0, 0, 0, 0, 0, '', '', 0, '', 'vb', '', 0, 1, 0, 0, NULL),
(23833, 3, '', 0, 'EJDK', '08d9fca8f82db5c89710ab6e2e74e8fe', '2014-04-26', 'torieokmulaney@yahoo.com', 0, '', '', '', '', '', '', '', 2, 0, 'New Member', 0, 1398491722, 0, 1398491722, 1398491722, 0, 0, 0, 0, 4, '5', 0, 0, 0, 0, 0, 3194967, '04-08-1981', '1981-04-08', -1, -1, '46.105.247.243', 0, 1, 0, 0, -1, 0, 0, 'Tm;>5`>AOR%QK/a)PewU>&/jG06.qR', 0, 0, 0, '', 0, 0, 0, 0, 0, 0, 0, 0, 0, 0, 0, 0, '', '', 0, '', 'vb', '', 0, 1, 0, 0, NULL),
(23834, 3, '', 0, 'RonaldMet', '8ac49c668a32711d7c31569b7935dadf', '2014-04-26', 'xfxflhxlffhx@hotmail.com', 0, '', '', '', '', '', '', '', 2, 0, 'New Member', 0, 1398493944, 0, 1398493944, 1398493944, 0, 0, 0, 0, 4, '-3', 0, 0, 0, 0, 0, 3194903, '04-03-1985', '1985-04-03', -1, -1, '46.211.108.131', 0, 1, 0, 0, -1, 0, 0, '.y%SR_05LB;WEC>dhlXz,nEZ"qF2[7', 0, 0, 0, '', 0, 0, 0, 0, 0, 0, 0, 0, 0, 0, 0, 0, '', '', 0, '', 'vb', '', 0, 1, 0, 0, NULL),
(23987, 3, '', 0, 'DClore', '8a647250a10333a18380be296855d913', '2014-05-02', 'lumvuccvdpj@outlook.com', 0, '', '', '', '', '', '', '', 2, 0, 'New Member', 0, 1399022251, 0, 1399022251, 1399024187, 0, 0, 0, 0, 4, '5', 0, 0, 0, 0, 0, 3194967, '06-02-1970', '1970-06-02', -1, -1, '108.177.146.204', 0, 1, 0, 0, -1, 0, 0, 'euO}aHFUynv{]lm^>9[Mow-N_2a$+.', 0, 0, 0, '', 0, 0, 0, 0, 0, 0, 0, 0, 0, 0, 0, 0, '', '', 0, '', 'vb', '', 0, 1, 0, 0, NULL),
(23836, 2, '', 0, 'Mehran Lodhi', '2153cff9da4153fe557840ad1eb7ba8f', '2014-04-26', 'itsmehran@hotmail.com', 0, '', '', '', '', '', '', '', 2, 0, 'New Member', 0, 1398502480, 0, 1398503052, 1398503052, 0, 0, 0, 0, 4, '5', 0, 0, 0, 0, 0, 3194967, '04-14-1987', '1987-04-14', -1, -1, '182.185.229.122', 0, 1, 0, 0, -1, 0, 0, '?1bJ%%=u<uHJ*2SN(9`9,^+B#|en4x', 0, 0, 0, '', 0, 0, 0, 0, 0, 0, 0, 0, 0, 0, 0, 0, '', '', 0, '', 'vb', '', 0, 1, 0, 0, NULL),
(23837, 3, '', 0, 'CWallwork', '60487278d7ef7d5925ec5f4f170d809c', '2014-04-26', 'caitlinnwgawlas@yahoo.com', 0, '', '', '', '', '', '', '', 2, 0, 'New Member', 0, 1398502974, 0, 1398502974, 1398502974, 0, 0, 0, 0, 4, '5', 0, 0, 0, 0, 0, 3194967, '09-25-1974', '1974-09-25', -1, -1, '108.178.5.109', 0, 1, 0, 0, -1, 0, 0, 'bxDKOo%DGik7]B*:l\\&SyNqd<Bag,R', 0, 0, 0, '', 0, 0, 0, 0, 0, 0, 0, 0, 0, 0, 0, 0, '', '', 0, '', 'vb', '', 0, 1, 0, 0, NULL),
(23915, 3, '', 0, 'JJacquez', 'ae60619bae8cb38f1237d69f9d8dd8b6', '2014-04-30', 'puffytongue62we44u@outlook.com', 0, '', '', '', '', '', '', '', 2, 0, 'New Member', 0, 1398837061, 0, 1398837061, 1398844302, 0, 0, 0, 0, 4, '5', 0, 0, 0, 0, 0, 3194967, '09-06-1981', '1981-09-06', -1, -1, '172.241.136.141', 0, 1, 0, 0, -1, 0, 0, '2]F9K71''Xa7ngjkxgch9{!lS;yDrPE', 0, 0, 0, '', 0, 0, 0, 0, 0, 0, 0, 0, 0, 0, 0, 0, '', '', 0, '', 'vb', '', 0, 1, 0, 0, NULL),
(23840, 3, '', 0, 'Junaid khattak', '9e5b93f04668b0d7ab8a7f1fe970f6f5', '2014-04-26', 'akhtarjunaid30@yahoo.com', 0, '', '', '', '', '', '', '', 2, 0, 'New Member', 0, 1398524738, 0, 1398524738, 1398525699, 0, 0, 0, 0, 4, '5', 0, 0, 0, 0, 0, 3194967, '08-05-1964', '1964-08-05', -1, -1, '182.181.130.31', 0, 1, 0, 0, -1, 0, 0, 'e"c}+nhr(n"mt@B0JfRqDx`An[JLmF', 0, 0, 0, '', 0, 0, 0, 0, 0, 0, 0, 0, 0, 0, 0, 0, '', '', 0, '', 'vb', '', 0, 1, 0, 0, NULL),
(23842, 2, '', 0, 'meerullah', 'cc29b7ba8b0de80e0e608597e860a08f', '2014-04-26', 'meerullah@yahoo.com', 0, '', '', '', '', '', '', '', 2, 0, 'New Member', 0, 1398538980, 0, 1398712338, 1400961227, 0, 0, 0, 0, 4, '5', 0, 0, 0, 0, 0, 3194967, '03-03-1995', '1995-03-03', -1, -1, '182.183.166.178', 1817, 1, 0, 0, -1, 0, 0, 'nF(AR|q=g-u(wFT8c\\khff*L.73G5x', 0, 0, 0, '', 0, 0, 0, 0, 0, 0, 0, 0, 0, 0, 0, 0, '', '', 0, '', 'vb', '', 0, 1, 0, 0, NULL),
(23843, 2, '', 0, 'abdrock', 'c29857f0fb3b8dfd3966bd92c332ef98', '2014-04-26', 'abdrock23@gmail.com', 0, '', '', '', '', '', '', '', 2, 0, 'New Member', 0, 1398541940, 0, 1398541940, 1398542306, 0, 0, 0, 0, 4, '5', 0, 0, 0, 0, 0, 3194967, '10-24-1997', '1997-10-24', -1, -1, '39.47.164.229', 4022, 1, 0, 0, -1, 0, 0, ');"-QeZk@5\\oLi,_1l4).=}+kqcm+J', 0, 0, 0, '', 0, 0, 0, 0, 0, 0, 0, 0, 0, 0, 0, 0, '', '', 0, '', 'vb', '', 0, 1, 0, 0, NULL),
(23844, 3, '', 0, 'Apple', 'd40d5d25dad6b9639a03dfeb6d6a3da1', '2014-04-27', 'motwani.sumeet@yahoo.com', 0, '', '', '', '', '', '', '', 2, 0, 'New Member', 0, 1398568121, 0, 1398568121, 1398568121, 0, 0, 0, 0, 4, '-5', 0, 0, 0, 0, 0, 3194967, '09-23-1991', '1991-09-23', -1, -1, '115.42.66.109', 0, 1, 0, 0, -1, 0, 0, '~VQ1v#l~"''5Cr.SAU14_,6hpX<h#GF', 0, 0, 0, '', 0, 0, 0, 0, 0, 0, 0, 0, 0, 0, 0, 0, '', '', 0, '', 'vb', '', 0, 1, 0, 0, NULL),
(23845, 3, '', 0, 'CHarriman', 'd4857208adadd7956fcdb41b890180bd', '2014-04-27', 'unsightlytower3he22l@outlook.com', 0, '', '', '', '', '', '', '', 2, 0, 'New Member', 0, 1398587516, 0, 1398587516, 1398590027, 0, 0, 0, 0, 4, '5', 0, 0, 0, 0, 0, 3194967, '10-05-1979', '1979-10-05', -1, -1, '41.34.173.207', 0, 1, 0, 0, -1, 0, 0, '/DE1B*TA&/`>rjn>V`2a>MZo0n[Bmz', 0, 0, 0, '', 0, 0, 0, 0, 0, 0, 0, 0, 0, 0, 0, 0, '', '', 0, '', 'vb', '', 0, 1, 0, 0, NULL),
(23846, 2, '', 0, 'awaisansari', '11e29f8e389bb52c593cb959846a46fd', '2014-04-27', 'goodluckawais@yahoo.com', 0, '', '', '', '', '', '', '', 2, 0, 'New Member', 0, 1398588258, 0, 1398676516, 1398676516, 0, 0, 0, 0, 4, '5', 0, 0, 0, 0, 0, 3194967, '09-12-1994', '1994-09-12', -1, -1, '182.184.31.123', 7774, 1, 0, 0, -1, 0, 0, '[#=!,pvEdQ!>A+VI_Mx?]5HU7W:iwH', 0, 0, 0, '', 0, 0, 1, 0, 0, 0, 0, 0, 0, 0, 0, 0, '', '', 0, '', 'vb', '', 0, 1, 0, 0, NULL),
(23992, 3, '', 0, 'LDxr', 'e43a8c75eb2cac8f6ced7af0e50d8c2a', '2014-05-02', 'glamorousvagran5031@outlook.com', 0, '', '', '', '', '', '', '', 2, 0, 'New Member', 0, 1399039819, 0, 1399039819, 1399039819, 0, 0, 0, 0, 4, '5', 0, 0, 0, 0, 0, 3194967, '02-03-1978', '1978-02-03', -1, -1, '204.44.92.145', 0, 1, 0, 0, -1, 0, 0, 'L@m5)L]#K@_%(nhXilQCAt{OHlZTmh', 0, 0, 0, '', 0, 0, 0, 0, 0, 0, 0, 0, 0, 0, 0, 0, '', '', 0, '', 'vb', '', 0, 1, 0, 0, NULL),
(24014, 3, '', 0, 'ISdo', '9acac41d1be7d75ef40f041b9144a675', '2014-05-03', 'faultyshoe38cc238@outlook.com', 0, '', '', '', '', '', '', '', 2, 0, 'New Member', 0, 1399117865, 0, 1399117865, 1399119971, 0, 0, 0, 0, 4, '5', 0, 0, 0, 0, 0, 3194967, '03-06-1985', '1985-03-06', -1, -1, '41.129.34.88', 0, 1, 0, 0, -1, 0, 0, 'qPdP''*3@8Z1n>>StCE_foMgd#N*Cv#', 0, 0, 0, '', 0, 0, 0, 0, 0, 0, 0, 0, 0, 0, 0, 0, '', '', 0, '', 'vb', '', 0, 1, 0, 0, NULL),
(23995, 3, '', 0, 'GMbs', '590601de6978c1a82e358f2829318acc', '2014-05-02', 'corazon76boning@hotmail.com', 0, '', '', '', '', '', '', '', 2, 0, 'New Member', 0, 1399042826, 0, 1399042826, 1399050264, 0, 0, 0, 0, 4, '5', 0, 0, 0, 0, 0, 3194967, '02-14-1980', '1980-02-14', -1, -1, '172.245.35.197', 0, 1, 0, 0, -1, 0, 0, '=(JIl(JMvq-!h}<oqT\\Z\\~;p%`OkAN', 0, 0, 0, '', 0, 0, 0, 0, 0, 0, 0, 0, 0, 0, 0, 0, '', '', 0, '', 'vb', '', 0, 1, 0, 0, NULL),
(24059, 2, '', 0, 'gunny', '3f8e436e88212f41f9022db92295d6b0', '2014-05-04', 'ahmadfca@gmail.com', 0, '', '', '', '', '', '', '', 2, 0, 'New Member', 0, 1399238743, 0, 1414524763, 1419679107, 1400850995, 441478, 5, 0, 4, '5', 0, 0, 0, 0, 0, 3194967, '07-31-1983', '1983-07-31', -1, -1, '39.50.210.88', 0, 1, 0, 0, -1, 0, 0, 'o]i*~DG.yk>wTub*.@n*5T^GYQ\\JFt', 0, 0, 0, '', 0, 0, 0, 0, 1, 0, 0, 0, 0, 0, 0, 0, '', '', 0, '', 'vb', '', 0, 1, 0, 0, NULL),
(24007, 3, '', 0, 'DX15', 'b76a48e7f1299ba7be93e58a50e80de3', '2014-05-03', 'helpfulallure67rq@outlook.com', 0, '', '', '', '', '', '', '', 2, 0, 'New Member', 0, 1399083395, 0, 1399083395, 1399083395, 0, 0, 0, 0, 4, '5', 0, 0, 0, 0, 0, 3194967, '10-05-1971', '1971-10-05', -1, -1, '37.72.190.139', 0, 1, 0, 0, -1, 0, 0, 'c\\^0Z)Y""-SLl9iq1-$g1K@ObJ7B%x', 0, 0, 0, '', 0, 0, 0, 0, 0, 0, 0, 0, 0, 0, 0, 0, '', '', 0, '', 'vb', '', 0, 1, 0, 0, NULL),
(23998, 3, '', 0, 'Wajid93', 'f134e4fda145b92f0a608f4f2fd6cfa6', '2014-05-02', 'wajid93@hotmail.com', 0, '', '', '', '', '', '', '', 2, 0, 'New Member', 0, 1399046068, 0, 1399046199, 1399046199, 0, 0, 0, 0, 4, '5', 0, 0, 0, 0, 0, 3194967, '04-27-1976', '1976-04-27', -1, -1, '39.48.93.80', 0, 1, 0, 0, -1, 0, 0, 'uE5F};u}.#sT6fY|L_5Jy?}5&8y"h;', 0, 0, 0, '', 0, 0, 0, 0, 0, 0, 0, 0, 0, 0, 0, 0, '', '', 0, '', 'vb', '', 0, 1, 0, 0, NULL);
INSERT INTO `user` (`userid`, `usergroupid`, `membergroupids`, `displaygroupid`, `username`, `password`, `passworddate`, `email`, `styleid`, `parentemail`, `homepage`, `icq`, `aim`, `yahoo`, `msn`, `skype`, `showvbcode`, `showbirthday`, `usertitle`, `customtitle`, `joindate`, `daysprune`, `lastvisit`, `lastactivity`, `lastpost`, `lastpostid`, `posts`, `reputation`, `reputationlevelid`, `timezoneoffset`, `pmpopup`, `avatarid`, `avatarrevision`, `profilepicrevision`, `sigpicrevision`, `options`, `birthday`, `birthday_search`, `maxposts`, `startofweek`, `ipaddress`, `referrerid`, `languageid`, `emailstamp`, `threadedmode`, `autosubscribe`, `pmtotal`, `pmunread`, `salt`, `ipoints`, `infractions`, `warnings`, `infractiongroupids`, `infractiongroupid`, `adminoptions`, `profilevisits`, `friendcount`, `friendreqcount`, `vmunreadcount`, `vmmoderatedcount`, `socgroupinvitecount`, `socgroupreqcount`, `pcunreadcount`, `pcmoderatedcount`, `gmmoderatedcount`, `assetposthash`, `fbuserid`, `fbjoindate`, `fbname`, `logintype`, `fbaccesstoken`, `bloggroupreqcount`, `showblogcss`, `importuserid`, `newrepcount`, `panjo_selling`) VALUES
(24008, 3, '', 0, 'CMoreton', '3bad1d9360791774f7b1f8269a712650', '2014-05-03', 'minglfminock@yahoo.com', 0, '', '', '', '', '', '', '', 2, 0, 'New Member', 0, 1399090977, 0, 1399090977, 1399157742, 0, 0, 0, 0, 4, '5', 0, 0, 0, 0, 0, 3194967, '07-05-1977', '1977-07-05', -1, -1, '178.32.234.139', 0, 1, 0, 0, -1, 0, 0, '=wM~x*)<yX*I;$V~i!Zy2?_)7wr!56', 0, 0, 0, '', 0, 0, 0, 0, 0, 0, 0, 0, 0, 0, 0, 0, '', '', 0, '', 'vb', '', 0, 1, 0, 0, NULL),
(24218, 3, '', 0, 'MDickinso', 'ce9f0da2e1ac9883cf0afea0beb2c00d', '2014-05-08', 'dasiyzexrx@yahoo.com', 0, '', '', '', '', '', '', '', 2, 0, 'New Member', 0, 1399580476, 0, 1399580476, 1399599125, 0, 0, 0, 0, 4, '5', 0, 0, 0, 0, 0, 3194967, '10-18-1976', '1976-10-18', -1, -1, '5.135.99.207', 0, 1, 0, 0, -1, 0, 0, 'Hz}]a;L[8K;]V7,K?GmJ@h*xZP@fk-', 0, 0, 0, '', 0, 0, 0, 0, 0, 0, 0, 0, 0, 0, 0, 0, '', '', 0, '', 'vb', '', 0, 1, 0, 0, NULL),
(24160, 3, '', 0, 'SVangundy', '0119225734630bd9b511650600f0e541', '2014-05-07', 'clarege@outlook.com', 0, '', '', '', '', '', '', '', 2, 0, 'New Member', 0, 1399450111, 0, 1399450111, 1399470442, 0, 0, 0, 0, 4, '5', 0, 0, 0, 0, 0, 3194967, '04-16-1978', '1978-04-16', -1, -1, '192.210.211.21', 0, 1, 0, 0, -1, 0, 0, '{5SGF23x.+"''(^@{Br4YzXZrD|_yvb', 0, 0, 0, '', 0, 0, 0, 0, 0, 0, 0, 0, 0, 0, 0, 0, '', '', 0, '', 'vb', '', 0, 1, 0, 0, NULL),
(24246, 3, '', 0, 'BPettway', '81f861a9d92a0fb83881351ff144fac6', '2014-05-09', 'esbervrtdk@yahoo.com', 0, '', '', '', '', '', '', '', 2, 0, 'New Member', 0, 1399640630, 0, 1399640630, 1399640630, 0, 0, 0, 0, 4, '5', 0, 0, 0, 0, 0, 3194967, '05-22-1985', '1985-05-22', -1, -1, '5.153.237.105', 0, 1, 0, 0, -1, 0, 0, 'j>BEN?n;E?}CS{9z=NX@%>o~/knD*p', 0, 0, 0, '', 0, 0, 0, 0, 0, 0, 0, 0, 0, 0, 0, 0, '', '', 0, '', 'vb', '', 0, 1, 0, 0, NULL),
(24011, 3, '', 0, 'RMcLendon', '818c46c93974b2bed554ed0efb6a0429', '2014-05-03', 'ramiro_mclendon@scifiuk.com', 0, '', '', '', '', '', '', '', 2, 0, 'New Member', 0, 1399100220, 0, 1399100220, 1399990751, 0, 0, 0, 0, 4, '5', 0, 0, 0, 0, 0, 3194967, '08-26-1984', '1984-08-26', -1, -1, '172.245.136.242', 0, 1, 0, 0, -1, 0, 0, 'm&lZ^[-S;1Nk#Qh-i$OmKn?$HX"iwG', 0, 0, 0, '', 0, 0, 0, 0, 0, 0, 0, 0, 0, 0, 0, 0, '', '', 0, '', 'vb', '', 0, 1, 0, 0, NULL),
(24004, 2, '', 0, 'abdulmalik', '0d9edee2321396e5bc366d84802b0e04', '2014-05-02', 'abdulmalik_chaudhry@hotmail.com', 0, '', '', '', '', '', '', '', 2, 0, 'New Member', 0, 1399068666, 0, 1399068666, 1399068666, 0, 0, 0, 0, 4, '5', 0, 0, 0, 0, 0, 3194967, '06-20-1989', '1989-06-20', -1, -1, '139.190.64.103', 0, 1, 0, 0, -1, 0, 0, '^H:{\\mg2[Gkffn&?Ef@abZA*e0^]{}', 0, 0, 0, '', 0, 0, 0, 0, 0, 0, 0, 0, 0, 0, 0, 0, '', '', 0, '', 'vb', '', 0, 1, 0, 0, NULL),
(24055, 3, '', 0, 'S9468', '43757395f7a3d7065b01b594a99fcb39', '2014-05-04', 'patricia96felmlee@hotmail.com', 0, '', '', '', '', '', '', '', 2, 0, 'New Member', 0, 1399231743, 0, 1399231743, 1399268785, 0, 0, 0, 0, 4, '5', 0, 0, 0, 0, 0, 3194967, '06-03-1976', '1976-06-03', -1, -1, '23.89.192.157', 0, 1, 0, 0, -1, 0, 0, 'zzJ)wdAob8ErL%{&;uzZ+qVd5#3*_G', 0, 0, 0, '', 0, 0, 1, 0, 0, 0, 0, 0, 0, 0, 0, 0, '', '', 0, '', 'vb', '', 0, 1, 0, 0, NULL),
(24060, 3, '', 0, 'W42T', 'd1bded28bc696b115c92a2d797b54d15', '2014-05-04', 'hallwmevm@yahoo.com', 0, '', '', '', '', '', '', '', 2, 0, 'New Member', 0, 1399240119, 0, 1399240119, 1399240119, 0, 0, 0, 0, 4, '5', 0, 0, 0, 0, 0, 3194967, '04-15-1975', '1975-04-15', -1, -1, '23.94.36.178', 0, 1, 0, 0, -1, 0, 0, '"!n&QzceW=cqND%{A<J=XDyd6{-(}]', 0, 0, 0, '', 0, 0, 0, 0, 0, 0, 0, 0, 0, 0, 0, 0, '', '', 0, '', 'vb', '', 0, 1, 0, 0, NULL),
(24019, 2, '', 0, 'kitto', '046aadd155eea9407da2a6788a1706ec', '2014-05-03', 'fahad6107@gmail.com', 0, '', '', '', '', '', '', '', 2, 0, 'New Member', 0, 1399127302, 0, 1399127350, 1399265591, 0, 0, 0, 0, 4, '5', 0, 0, 0, 0, 0, 3194967, '01-08-1989', '1989-01-08', -1, -1, '39.42.141.10', 0, 1, 0, 0, -1, 0, 0, '>#eV6}z(=;f7OA,xiN)B^''B7673/Zc', 0, 0, 0, '', 0, 0, 1, 0, 0, 0, 0, 0, 0, 0, 0, 0, '', '', 0, '', 'vb', '', 0, 1, 0, 0, NULL),
(24020, 3, '', 0, 'SRexford', '3f23c4c2facfe0c31640e0ddbe05f8f2', '2014-05-03', 'alvineba@outlook.com', 0, '', '', '', '', '', '', '', 2, 0, 'New Member', 0, 1399129961, 0, 1399129961, 1399142351, 0, 0, 0, 0, 4, '5', 0, 0, 0, 0, 0, 3194967, '10-14-1972', '1972-10-14', -1, -1, '198.23.248.39', 0, 1, 0, 0, -1, 0, 0, 'ANF})Cyua*L9eIe5K,:6NSx6|Z$<:(', 0, 0, 0, '', 0, 0, 1, 0, 0, 0, 0, 0, 0, 0, 0, 0, '', '', 0, '', 'vb', '', 0, 1, 0, 0, NULL),
(24021, 3, '', 0, 'BBugnion', '697c1bfcc53fdc9a22f80e2abe1250af', '2014-05-03', 'bryan.bugnion59@freeincomeapps.org', 0, '', '', '', '', '', '', '', 2, 0, 'New Member', 0, 1399133186, 0, 1399133186, 1399149419, 0, 0, 0, 0, 4, '5', 0, 0, 0, 0, 0, 3194967, '11-21-1982', '1982-11-21', -1, -1, '199.180.135.126', 0, 1, 0, 0, -1, 0, 0, 'K}#<\\w(YH(+gN>S!aaDFaT]~Ur?3kv', 0, 0, 0, '', 0, 0, 0, 0, 0, 0, 0, 0, 0, 0, 0, 0, '', '', 0, '', 'vb', '', 0, 1, 0, 0, NULL),
(24022, 3, '', 0, 'DStein', 'b811a37395c32c75e20a66add3feae72', '2014-05-03', 'denisbge@hotmail.com', 0, '', '', '', '', '', '', '', 2, 0, 'New Member', 0, 1399135467, 0, 1399135467, 1399137790, 0, 0, 0, 0, 4, '5', 0, 0, 0, 0, 0, 3194967, '04-28-1978', '1978-04-28', -1, -1, '165.231.12.212', 0, 1, 0, 0, -1, 0, 0, '&''ZUVTl.3c#bQe}DyFePp3(Y<Pu[?M', 0, 0, 0, '', 0, 0, 0, 0, 0, 0, 0, 0, 0, 0, 0, 0, '', '', 0, '', 'vb', '', 0, 1, 0, 0, NULL),
(24024, 2, '', 0, 'Obaid Sumbal', '6bb97da707ca047bb14c8515fdf1ab0b', '2014-05-03', 'obaidsumbal@gmail.com', 0, '', '', '', '', '', '', '', 2, 0, 'New Member', 0, 1399143887, 0, 1399143887, 1399145089, 0, 0, 0, 0, 4, '5', 0, 0, 0, 0, 0, 3194967, '06-02-1965', '1965-06-02', -1, -1, '39.55.20.31', 0, 1, 0, 0, -1, 0, 0, 's6H]+`"!=0Hp2VOJOM^],3wgv3<(ey', 0, 0, 0, '', 0, 0, 0, 0, 0, 0, 0, 0, 0, 0, 0, 0, '', '', 0, '', 'vb', '', 0, 1, 0, 0, NULL),
(24026, 3, '', 0, 'LHagenaue', 'e03a6ed2721714b985341f2ef9e67c84', '2014-05-03', 'aniafikier88@outlook.com', 0, '', '', '', '', '', '', '', 2, 0, 'New Member', 0, 1399150453, 0, 1399150453, 1399155540, 0, 0, 0, 0, 4, '5', 0, 0, 0, 0, 0, 3194967, '02-11-1975', '1975-02-11', -1, -1, '69.12.84.36', 0, 1, 0, 0, -1, 0, 0, 'wL$rnarVyb(vk*;U#5:jN^S],u"f=h', 0, 0, 0, '', 0, 0, 0, 0, 0, 0, 0, 0, 0, 0, 0, 0, '', '', 0, '', 'vb', '', 0, 1, 0, 0, NULL),
(24028, 3, '', 0, 'MBerryman', 'c1d9158a70356d6535e94a157e2bd822', '2014-05-03', 'magentacelebrit6499@outlook.com', 0, '', '', '', '', '', '', '', 2, 0, 'New Member', 0, 1399157475, 0, 1399157475, 1399312082, 0, 0, 0, 0, 4, '5', 0, 0, 0, 0, 0, 3194967, '08-21-1970', '1970-08-21', -1, -1, '192.3.180.167', 0, 1, 0, 0, -1, 0, 0, 'eZR>sG\\zL.=]fHL_"3UO:usZ.g|xs+', 0, 0, 0, '', 0, 0, 0, 0, 0, 0, 0, 0, 0, 0, 0, 0, '', '', 0, '', 'vb', '', 0, 1, 0, 0, NULL),
(24029, 3, '', 0, 'PPeebles', '5d2498fa4b3ef76e2e64ddbd7bb8cc8a', '2014-05-04', 'tartpodium959963@outlook.com', 0, '', '', '', '', '', '', '', 2, 0, 'New Member', 0, 1399158068, 0, 1399158068, 1399160770, 0, 0, 0, 0, 4, '5', 0, 0, 0, 0, 0, 3194967, '11-14-1982', '1982-11-14', -1, -1, '198.50.242.6', 0, 1, 0, 0, -1, 0, 0, 'Y''gp%,)?Fkinccb7o>GUDlW^Q?syJJ', 0, 0, 0, '', 0, 0, 0, 0, 0, 0, 0, 0, 0, 0, 0, 0, '', '', 0, '', 'vb', '', 0, 1, 0, 0, NULL),
(24100, 3, '', 0, 'NMacgroar', '78b6077885a1189b728ef2aeb81b8007', '2014-05-06', 'fellaknnq@yahoo.com', 0, '', '', '', '', '', '', '', 2, 0, 'New Member', 0, 1399350518, 0, 1399350518, 1399350518, 0, 0, 0, 0, 4, '5', 0, 0, 0, 0, 0, 3194967, '08-08-1978', '1978-08-08', -1, -1, '198.55.112.177', 0, 1, 0, 0, -1, 0, 0, 'h}L#2;P`!^(ywLz]\\YP`5r=*iP>wBo', 0, 0, 0, '', 0, 0, 0, 0, 0, 0, 0, 0, 0, 0, 0, 0, '', '', 0, '', 'vb', '', 0, 1, 0, 0, NULL),
(24031, 3, '', 0, 'SBPT', 'b49d2fbbcbcc61c0136d417ee1c7fc2c', '2014-05-04', 'shawn-kuster@apprankerwebsite.tk', 0, '', '', '', '', '', '', '', 2, 0, 'New Member', 0, 1399158886, 0, 1399158886, 1399162020, 0, 0, 0, 0, 4, '5', 0, 0, 0, 0, 0, 3194967, '07-06-1970', '1970-07-06', -1, -1, '198.143.136.48', 0, 1, 0, 0, -1, 0, 0, 'i*XHHmlB#`8$~;y]I9\\9cK?4QRiDT-', 0, 0, 0, '', 0, 0, 0, 0, 0, 0, 0, 0, 0, 0, 0, 0, '', '', 0, '', 'vb', '', 0, 1, 0, 0, NULL),
(24057, 3, '', 0, 'JAddis', '5ceb5526d895312ff93fb8cbf3173c46', '2014-05-04', 'jami-addis@diendanthongtin.com', 0, '', '', '', '', '', '', '', 2, 0, 'New Member', 0, 1399237313, 0, 1399237313, 1399237313, 0, 0, 0, 0, 4, '5', 0, 0, 0, 0, 0, 3194967, '09-29-1984', '1984-09-29', -1, -1, '69.12.77.126', 0, 1, 0, 0, -1, 0, 0, '2vVQ^JWc%kj$Vi>rr*#/f_CmM)P''(E', 0, 0, 0, '', 0, 0, 0, 0, 0, 0, 0, 0, 0, 0, 0, 0, '', '', 0, '', 'vb', '', 0, 1, 0, 0, NULL),
(24033, 3, '', 0, 'ERoemer', 'e0f2d21fd6ed3e51ec4a6642bddef08d', '2014-05-04', 'aguojnacau@yahoo.com', 0, '', '', '', '', '', '', '', 2, 0, 'New Member', 0, 1399161696, 0, 1399161696, 1399161696, 0, 0, 0, 0, 4, '5', 0, 0, 0, 0, 0, 3194967, '02-15-1983', '1983-02-15', -1, -1, '173.232.104.77', 0, 1, 0, 0, -1, 0, 0, 'M=f][@b''MR(eaI~N}0}=k^#{2(1=]@', 0, 0, 0, '', 0, 0, 0, 0, 0, 0, 0, 0, 0, 0, 0, 0, '', '', 0, '', 'vb', '', 0, 1, 0, 0, NULL),
(24062, 3, '', 0, 'RCope', 'e3f3a05a225d0873dbc1f6bfa3be854b', '2014-05-05', 'oneroussuit940@hotmail.com', 0, '', '', '', '', '', '', '', 2, 0, 'New Member', 0, 1399256287, 0, 1399256287, 1399260040, 0, 0, 0, 0, 4, '5', 0, 0, 0, 0, 0, 3194967, '09-29-1970', '1970-09-29', -1, -1, '204.44.83.36', 0, 1, 0, 0, -1, 0, 0, '&)minf~x78f@~lJHgWH5j*2Thq%JH{', 0, 0, 0, '', 0, 0, 0, 0, 0, 0, 0, 0, 0, 0, 0, 0, '', '', 0, '', 'vb', '', 0, 1, 0, 0, NULL),
(24035, 3, '', 0, 'GForlonge', 'e7407c27d1d0ad43468493a16d285c95', '2014-05-04', 'graciela.forlonge25@garciniawowreview.com', 0, '', '', '', '', '', '', '', 2, 0, 'New Member', 0, 1399176136, 0, 1399176136, 1399316539, 0, 0, 0, 0, 4, '5', 0, 0, 0, 0, 0, 3194967, '02-08-1971', '1971-02-08', -1, -1, '192.3.60.234', 0, 1, 0, 0, -1, 0, 0, 'mon{G)WNw+;t8C[Yls^sJoh1*b0ON=', 0, 0, 0, '', 0, 0, 0, 0, 0, 0, 0, 0, 0, 0, 0, 0, '', '', 0, '', 'vb', '', 0, 1, 0, 0, NULL),
(24036, 3, '', 0, 'ROMay', '3d9f69cb8d0aaa21ddffef80403c34f7', '2014-05-04', 'smalllaborer189@hotmail.com', 0, '', '', '', '', '', '', '', 2, 0, 'New Member', 0, 1399182983, 0, 1399182983, 1399182983, 0, 0, 0, 0, 4, '5', 0, 0, 0, 0, 0, 3194967, '10-06-1974', '1974-10-06', -1, -1, '93.118.73.91', 0, 1, 0, 0, -1, 0, 0, '~//h!}9X1$unF3`Zh0xAY''E,HFNV7Z', 0, 0, 0, '', 0, 0, 0, 0, 0, 0, 0, 0, 0, 0, 0, 0, '', '', 0, '', 'vb', '', 0, 1, 0, 0, NULL),
(24037, 3, '', 0, 'MCooksey', '783fb7d09bed723d268d682907af7a32', '2014-05-04', 'aevryfzuhr@yahoo.com', 0, '', '', '', '', '', '', '', 2, 0, 'New Member', 0, 1399188028, 0, 1399188028, 1399188028, 0, 0, 0, 0, 4, '5', 0, 0, 0, 0, 0, 3194967, '03-26-1978', '1978-03-26', -1, -1, '23.94.19.151', 0, 1, 0, 0, -1, 0, 0, '|Y>s5Ubu`:5@w~5v''1[Y8)7)g[a3N<', 0, 0, 0, '', 0, 0, 0, 0, 0, 0, 0, 0, 0, 0, 0, 0, '', '', 0, '', 'vb', '', 0, 1, 0, 0, NULL),
(24038, 3, '', 0, 'N59E', '61929794092fd708c0e9ac86d9a6a2b6', '2014-05-04', 'cindaykr@hotmail.com', 0, '', '', '', '', '', '', '', 2, 0, 'New Member', 0, 1399193939, 0, 1399193939, 1399627606, 0, 0, 0, 0, 4, '5', 0, 0, 0, 0, 0, 3194967, '12-21-1975', '1975-12-21', -1, -1, '151.237.181.107', 0, 1, 0, 0, -1, 0, 0, 'C,yOoZO$.k(,Ocl_Kdx.Eeb]7a(X4w', 0, 0, 0, '', 0, 0, 0, 0, 0, 0, 0, 0, 0, 0, 0, 0, '', '', 0, '', 'vb', '', 0, 1, 0, 0, NULL),
(24039, 3, '', 0, 'MSaldana', '673bed4552e7add950c0108acd356c57', '2014-05-04', 'ebonitpkku@yahoo.com', 0, '', '', '', '', '', '', '', 2, 0, 'New Member', 0, 1399195108, 0, 1399195108, 1399212209, 0, 0, 0, 0, 4, '5', 0, 0, 0, 0, 0, 3194967, '01-13-1974', '1974-01-13', -1, -1, '31.220.44.248', 0, 1, 0, 0, -1, 0, 0, 'o9YF#[DI<LTBVKve[V[Y=~P6aaD}v6', 0, 0, 0, '', 0, 0, 0, 0, 0, 0, 0, 0, 0, 0, 0, 0, '', '', 0, '', 'vb', '', 0, 1, 0, 0, NULL),
(24040, 3, '', 0, 'RMcAlexan', '0709d86c41d3a5030cbdd3d47c32b813', '2014-05-04', 'adamantdress2462396@outlook.com', 0, '', '', '', '', '', '', '', 2, 0, 'New Member', 0, 1399197686, 0, 1399197686, 1399206124, 0, 0, 0, 0, 4, '5', 0, 0, 0, 0, 0, 3194967, '12-10-1981', '1981-12-10', -1, -1, '78.129.131.93', 0, 1, 0, 0, -1, 0, 0, 'y)NL^''$;hkvsg+mGG}8x]xOim|s3YL', 0, 0, 0, '', 0, 0, 0, 0, 0, 0, 0, 0, 0, 0, 0, 0, '', '', 0, '', 'vb', '', 0, 1, 0, 0, NULL),
(24041, 3, '', 0, 'SKeartlan', '3a7608c9a6d66f71cd864065386733ac', '2014-05-04', 'pearlene37wilbon@hotmail.com', 0, '', '', '', '', '', '', '', 2, 0, 'New Member', 0, 1399201658, 0, 1399201658, 1399208862, 0, 0, 0, 0, 4, '5', 0, 0, 0, 0, 0, 3194967, '12-10-1981', '1981-12-10', -1, -1, '23.89.192.157', 0, 1, 0, 0, -1, 0, 0, 'sLYRP)yAM6x}@yuI3f0D''`DD&U;uqe', 0, 0, 0, '', 0, 0, 0, 0, 0, 0, 0, 0, 0, 0, 0, 0, '', '', 0, '', 'vb', '', 0, 1, 0, 0, NULL),
(24042, 3, '', 0, 'RFriday', 'd6e821fbc8ac9228e77c0278dd998fb9', '2014-05-04', 'jollylawsuit9514@outlook.com', 0, '', '', '', '', '', '', '', 2, 0, 'New Member', 0, 1399203017, 0, 1399203017, 1399210324, 0, 0, 0, 0, 4, '5', 0, 0, 0, 0, 0, 3194967, '12-29-1979', '1979-12-29', -1, -1, '165.231.27.114', 0, 1, 0, 0, -1, 0, 0, 'b-w"xhs5+pwbc!F/P>z!i[lZ-YxtAP', 0, 0, 0, '', 0, 0, 0, 0, 0, 0, 0, 0, 0, 0, 0, 0, '', '', 0, '', 'vb', '', 0, 1, 0, 0, NULL),
(24470, 3, '', 0, 'AVXQJ', 'e041418069d2790fd70e607805d3f6a1', '2014-05-16', 'sonsanhjamqxag@yahoo.com', 0, '', '', '', '', '', '', '', 2, 0, 'New Member', 0, 1400249924, 0, 1400249924, 1400253102, 0, 0, 0, 0, 4, '5', 0, 0, 0, 0, 0, 3194967, '03-31-1978', '1978-03-31', -1, -1, '5.135.9.47', 0, 1, 0, 0, -1, 0, 0, '%)4!_;p"SbeErr-cNaNxvi*&|K\\lz,', 0, 0, 0, '', 0, 0, 0, 0, 0, 0, 0, 0, 0, 0, 0, 0, '', '', 0, '', 'vb', '', 0, 1, 0, 0, NULL),
(24304, 3, '', 0, 'BTrudeau', 'bdfe46fe53cc14db677a224be5981d3b', '2014-05-11', 'setozoj@outlook.com', 0, '', '', '', '', '', '', '', 2, 0, 'New Member', 0, 1399807082, 0, 1399807082, 1399824956, 0, 0, 0, 0, 4, '5', 0, 0, 0, 0, 0, 3194967, '02-13-1978', '1978-02-13', -1, -1, '192.184.91.206', 0, 1, 0, 0, -1, 0, 0, '1X,L!z+;5O9fETw$Y|m;N5H}i+gIG5', 0, 0, 0, '', 0, 0, 0, 0, 0, 0, 0, 0, 0, 0, 0, 0, '', '', 0, '', 'vb', '', 0, 1, 0, 0, NULL),
(24045, 3, '', 0, 'L3863', '468c17f91ab7ee6b8d37352502d461f0', '2014-05-04', 'aubreysloane@outlook.com', 0, '', '', '', '', '', '', '', 2, 0, 'New Member', 0, 1399209188, 0, 1399209188, 1399213786, 0, 0, 0, 0, 4, '5', 0, 0, 0, 0, 0, 3194967, '12-30-1980', '1980-12-30', -1, -1, '69.12.66.150', 0, 1, 0, 0, -1, 0, 0, '=Y|CT\\BfnM*htAuX6=h''Ud)jKZ\\+om', 0, 0, 0, '', 0, 0, 0, 0, 0, 0, 0, 0, 0, 0, 0, 0, '', '', 0, '', 'vb', '', 0, 1, 0, 0, NULL),
(24173, 3, '', 0, 'MThigpen', 'a0e60faf7e6b95f12caf25d849dbb77b', '2014-05-07', 'nelsonlouis97@yahoo.com', 0, '', '', '', '', '', '', '', 2, 0, 'New Member', 0, 1399475904, 0, 1399475904, 1399842137, 0, 0, 0, 0, 4, '5', 0, 0, 0, 0, 0, 3194967, '02-16-1983', '1983-02-16', -1, -1, '23.226.224.137', 0, 1, 0, 0, -1, 0, 0, '/!2g!7iLj;s1Gj=vJ*[T`>.l&|qLk+', 0, 0, 0, '', 0, 0, 0, 0, 0, 0, 0, 0, 0, 0, 0, 0, '', '', 0, '', 'vb', '', 0, 1, 0, 0, NULL),
(24048, 3, '', 0, 'CBrisbane', '1c94ce4550bd0d26b17b4d43c6af5c56', '2014-05-04', 'laurihavv@hotmail.com', 0, '', '', '', '', '', '', '', 2, 0, 'New Member', 0, 1399216718, 0, 1399216718, 1399219283, 0, 0, 0, 0, 4, '5', 0, 0, 0, 0, 0, 3194967, '10-07-1985', '1985-10-07', -1, -1, '192.161.160.153', 0, 1, 0, 0, -1, 0, 0, 'H%Zg;~m!9mQI~dEdFPj;+6umJoO+hg', 0, 0, 0, '', 0, 0, 0, 0, 0, 0, 0, 0, 0, 0, 0, 0, '', '', 0, '', 'vb', '', 0, 1, 0, 0, NULL),
(24145, 3, '', 0, 'C35K', '6daf12cb2d4c0997d3f8751c5fd779ff', '2014-05-07', 'mohamed-leech907435@outlook.com', 0, '', '', '', '', '', '', '', 2, 0, 'New Member', 0, 1399417503, 0, 1399417503, 1399417503, 0, 0, 0, 0, 4, '5', 0, 0, 0, 0, 0, 3194967, '01-09-1981', '1981-01-09', -1, -1, '204.44.82.124', 0, 1, 0, 0, -1, 0, 0, '>{guyA$T%Q9-an,s}sYQPGr|`_#i_E', 0, 0, 0, '', 0, 0, 0, 0, 0, 0, 0, 0, 0, 0, 0, 0, '', '', 0, '', 'vb', '', 0, 1, 0, 0, NULL),
(24050, 3, '', 0, 'KFinlay', '5c8a06c50c12d07c4dccb209f78c87c8', '2014-05-04', 'mindlessfuzz9528w90@outlook.com', 0, '', '', '', '', '', '', '', 2, 0, 'New Member', 0, 1399218052, 0, 1399218052, 1399220622, 0, 0, 0, 0, 4, '5', 0, 0, 0, 0, 0, 3194967, '01-28-1983', '1983-01-28', -1, -1, '93.118.79.90', 0, 1, 0, 0, -1, 0, 0, '/[.1P<N9ap[-%v%&W`Y4"y/pqa1|\\v', 0, 0, 0, '', 0, 0, 0, 0, 0, 0, 0, 0, 0, 0, 0, 0, '', '', 0, '', 'vb', '', 0, 1, 0, 0, NULL),
(24051, 2, '', 0, 'Soul Hacker', 'c6a6821141172882841a5f63eeed053f', '2014-05-04', 'bikerboy_Bilal@hotmail.com', 0, '', '', '', '', '', '', '', 2, 0, 'Rookie', 0, 1399226046, 0, 1420569700, 1420569700, 1401377499, 442734, 48, 0, 4, '5', 0, 0, 0, 0, 0, 3194967, '03-01-1990', '1990-03-01', -1, -1, '119.154.45.235', 0, 1, 0, 0, -1, 0, 0, 'N1s0n@m}=V)wPp&d6ASe:0q*]Gw''6I', 0, 0, 0, '', 0, 0, 5, 0, 0, 0, 0, 0, 0, 0, 0, 0, '', '', 0, '', 'vb', '', 0, 1, 0, 0, NULL),
(24052, 3, '', 0, 'LKiser', '9cb1ef97eb8f1b79c645dd102448d888', '2014-05-04', 'christa28dittberner@outlook.com', 0, '', '', '', '', '', '', '', 2, 0, 'New Member', 0, 1399226971, 0, 1399226971, 1399234270, 0, 0, 0, 0, 4, '5', 0, 0, 0, 0, 0, 3194967, '02-25-1970', '1970-02-25', -1, -1, '23.89.192.157', 0, 1, 0, 0, -1, 0, 0, 'kX{Z>B*R^,a*RF{F>-TF''8Ccr$EYEv', 0, 0, 0, '', 0, 0, 0, 0, 0, 0, 0, 0, 0, 0, 0, 0, '', '', 0, '', 'vb', '', 0, 1, 0, 0, NULL),
(24129, 3, '', 0, 'NEbert', 'e163428c1a50d60f092b2966543c7dd0', '2014-05-06', 'hryniewskie.m.il@gmail.com', 0, '', '', '', '', '', '', '', 2, 0, 'New Member', 0, 1399388551, 0, 1399388551, 1399720870, 0, 0, 0, 0, 4, '5', 0, 0, 0, 0, 0, 3194967, '01-08-1982', '1982-01-08', -1, -1, '23.108.74.177', 0, 1, 0, 0, -1, 0, 0, '"]a8kk(9''fH(EdSrw26rg<Gz_s%d_t', 0, 0, 0, '', 0, 0, 0, 0, 0, 0, 0, 0, 0, 0, 0, 0, '', '', 0, '', 'vb', '', 0, 1, 0, 0, NULL),
(24405, 2, '', 0, 'Wild Troop', 'eb02614ff67cb4fa9d74dd2996ce80b1', '2014-05-14', 'ammar.qurashi@gmail.com', 0, '', '', '', '', '', '', '', 2, 0, 'New Member', 0, 1400077991, 0, 1400150319, 1400165914, 0, 0, 0, 0, 4, '5', 0, 0, 0, 0, 0, 3194967, '03-02-1988', '1988-03-02', -1, -1, '182.185.253.22', 0, 1, 0, 0, -1, 0, 0, 'VW(\\Mu2sPofB}g]NTjY\\=$#=J4dM3{', 0, 0, 0, '', 0, 0, 0, 0, 0, 0, 0, 0, 0, 0, 0, 0, '', '', 0, '', 'vb', '', 0, 1, 0, 0, NULL),
(24066, 3, '', 0, 'NStickler', 'ea2e847756a4af4608df56fe9e3e084d', '2014-05-05', 'norine_stickler@active-updates.tk', 0, '', '', '', '', '', '', '', 2, 0, 'New Member', 0, 1399260602, 0, 1399260602, 1399263569, 0, 0, 0, 0, 4, '5', 0, 0, 0, 0, 0, 3194967, '10-30-1971', '1971-10-30', -1, -1, '198.143.136.21', 0, 1, 0, 0, -1, 0, 0, 'gJ[z{r''QCZ&^8cX%LG2r\\w>HH>}@4J', 0, 0, 0, '', 0, 0, 0, 0, 0, 0, 0, 0, 0, 0, 0, 0, '', '', 0, '', 'vb', '', 0, 1, 0, 0, NULL),
(24067, 3, '', 0, 'barobertostianov4742', '595bacd9b8960d13094ca6a90c1d709c', '2014-05-05', 'barobertostianov@ymail.com', 0, '', '', '', '', '', '', '', 2, 0, 'New Member', 0, 1399263944, 0, 1399263944, 1399263944, 0, 0, 0, 0, 4, '4', 0, 0, 0, 0, 0, 3194903, '09-10-1977', '1977-09-10', -1, -1, '101.255.40.129', 0, 1, 0, 0, -1, 0, 0, 'VBWh=!I9(I0=qev#^<E(X/kA/eY(@$', 0, 0, 0, '', 0, 0, 0, 0, 0, 0, 0, 0, 0, 0, 0, 0, '', '', 0, '', 'vb', '', 0, 1, 0, 0, NULL),
(24171, 3, '', 0, 'CWYA', '082d3daa6247ce35c2d5be2e93e7f73c', '2014-05-07', 'edtihxq@hotmail.com', 0, '', '', '', '', '', '', '', 2, 0, 'New Member', 0, 1399472334, 0, 1399472334, 1399472334, 0, 0, 0, 0, 4, '5', 0, 0, 0, 0, 0, 3194967, '03-22-1975', '1975-03-22', -1, -1, '165.231.12.212', 0, 1, 0, 0, -1, 0, 0, '6Y]1LS}7H!WCdLv\\>=CR2F{V9!}DMt', 0, 0, 0, '', 0, 0, 0, 0, 0, 0, 0, 0, 0, 0, 0, 0, '', '', 0, '', 'vb', '', 0, 1, 0, 0, NULL),
(24147, 3, '', 0, 'LHazeltin', '70516d17071b706f2981c3c9a92bb949', '2014-05-07', 'lauryn-lambert138463@outlook.com', 0, '', '', '', '', '', '', '', 2, 0, 'New Member', 0, 1399420257, 0, 1399420257, 1399528497, 0, 0, 0, 0, 4, '5', 0, 0, 0, 0, 0, 3194967, '12-13-1970', '1970-12-13', -1, -1, '204.44.82.126', 0, 1, 0, 0, -1, 0, 0, 'NF~$NrguzpTze|@|h{r>!D|TfA)0u[', 0, 0, 0, '', 0, 0, 0, 0, 0, 0, 0, 0, 0, 0, 0, 0, '', '', 0, '', 'vb', '', 0, 1, 0, 0, NULL),
(24098, 3, '', 0, 'MKauffman', '6c75d942d54c7afe51fabcc51fc1d0ab', '2014-05-06', 'anxiousachiever581@hotmail.com', 0, '', '', '', '', '', '', '', 2, 0, 'New Member', 0, 1399337416, 0, 1399337416, 1399341031, 0, 0, 0, 0, 4, '5', 0, 0, 0, 0, 0, 3194967, '11-29-1977', '1977-11-29', -1, -1, '204.44.83.27', 0, 1, 0, 0, -1, 0, 0, 'Hy)<>rkrS$RA"-dN.t;5aqY%\\QTV*u', 0, 0, 0, '', 0, 0, 0, 0, 0, 0, 0, 0, 0, 0, 0, 0, '', '', 0, '', 'vb', '', 0, 1, 0, 0, NULL),
(24099, 3, '', 0, 'RW39', '14cd34ef0f76867a2352eb155abc0fc8', '2014-05-06', 'rob.hendrick@progrespolska.net', 0, '', '', '', '', '', '', '', 2, 0, 'New Member', 0, 1399340685, 0, 1399340685, 1399343079, 0, 0, 0, 0, 4, '5', 0, 0, 0, 0, 0, 3194967, '03-10-1974', '1974-03-10', -1, -1, '83.8.88.176', 0, 1, 0, 0, -1, 0, 0, '~+g|]\\Q6+(2Hd9oq([*c`hd,g!XGKo', 0, 0, 0, '', 0, 0, 0, 0, 0, 0, 0, 0, 0, 0, 0, 0, '', '', 0, '', 'vb', '', 0, 1, 0, 0, NULL),
(24095, 3, '', 0, 'P8373', '63505781fb6a1712ce97e40232b35530', '2014-05-06', 'sinceregroup32fse43@outlook.com', 0, '', '', '', '', '', '', '', 2, 0, 'New Member', 0, 1399330855, 0, 1399330855, 1399332719, 0, 0, 0, 0, 4, '5', 0, 0, 0, 0, 0, 3194967, '01-17-1981', '1981-01-17', -1, -1, '198.55.109.27', 0, 1, 0, 0, -1, 0, 0, 'KAE}go\\J|6`.mnXct(7,:9Oi!**}zg', 0, 0, 0, '', 0, 0, 0, 0, 0, 0, 0, 0, 0, 0, 0, 0, '', '', 0, '', 'vb', '', 0, 1, 0, 0, NULL),
(24096, 3, '', 0, 'MBuley', '73149d65b84426650426929652047e32', '2014-05-06', 'dustylegacy92s855o@outlook.com', 0, '', '', '', '', '', '', '', 2, 0, 'New Member', 0, 1399332279, 0, 1399332279, 1399332279, 0, 0, 0, 0, 4, '5', 0, 0, 0, 0, 0, 3194967, '06-28-1979', '1979-06-28', -1, -1, '23.94.243.130', 0, 1, 0, 0, -1, 0, 0, 'w''Jjc}|X1T[J?gZwGp&;xa''2k;;4H?', 0, 0, 0, '', 0, 0, 0, 0, 0, 0, 0, 0, 0, 0, 0, 0, '', '', 0, '', 'vb', '', 0, 1, 0, 0, NULL),
(24230, 3, '', 0, 'DAbernath', '38dd10a8323d2f71c291f1d34a11b6c0', '2014-05-09', 'gymexabaloh@yahoo.com', 0, '', '', '', '', '', '', '', 2, 0, 'New Member', 0, 1399618067, 0, 1399618067, 1399693484, 0, 0, 0, 0, 4, '5', 0, 0, 0, 0, 0, 3194967, '01-20-1983', '1983-01-20', -1, -1, '165.231.12.208', 0, 1, 0, 0, -1, 0, 0, '~=x6RA~X$*tFDvXa&*,XhjP(<3ic;(', 0, 0, 0, '', 0, 0, 0, 0, 0, 0, 0, 0, 0, 0, 0, 0, '', '', 0, '', 'vb', '', 0, 1, 0, 0, NULL),
(24105, 3, '', 0, 'KYGF', '72b8780c2eb3b5177b20ff897562a7a8', '2014-05-06', 'hypnoticmilk693@hotmail.com', 0, '', '', '', '', '', '', '', 2, 0, 'New Member', 0, 1399359674, 0, 1399359674, 1399363395, 0, 0, 0, 0, 4, '5', 0, 0, 0, 0, 0, 3194967, '12-25-1974', '1974-12-25', -1, -1, '23.94.60.16', 0, 1, 0, 0, -1, 0, 0, '<<0Qd!~WTuYeZXO=,0eWSGL3HP,MKt', 0, 0, 0, '', 0, 0, 0, 0, 0, 0, 0, 0, 0, 0, 0, 0, '', '', 0, '', 'vb', '', 0, 1, 0, 0, NULL),
(24078, 3, '', 0, 'MArmstead', '814aafd015051ae63888fc18530e9eb1', '2014-05-05', 'kelsi21paganini@hotmail.com', 0, '', '', '', '', '', '', '', 2, 0, 'New Member', 0, 1399283031, 0, 1399283031, 1399290223, 0, 0, 0, 0, 4, '5', 0, 0, 0, 0, 0, 3194967, '05-15-1983', '1983-05-15', -1, -1, '23.89.192.157', 0, 1, 0, 0, -1, 0, 0, 'uo&XoO#MVa(pQe$_U`C]+5:}O;YbsZ', 0, 0, 0, '', 0, 0, 0, 0, 0, 0, 0, 0, 0, 0, 0, 0, '', '', 0, '', 'vb', '', 0, 1, 0, 0, NULL),
(24309, 3, '', 0, 'ZGNC', '1691f331c6dcd03c66b129535d9809f5', '2014-05-11', 'luisocxku@outlook.com', 0, '', '', '', '', '', '', '', 2, 0, 'New Member', 0, 1399822093, 0, 1399822093, 1399822093, 0, 0, 0, 0, 4, '5', 0, 0, 0, 0, 0, 3194967, '08-03-1977', '1977-08-03', -1, -1, '23.94.19.244', 0, 1, 0, 0, -1, 0, 0, 'd)WM?8(?5`NfseiQN4g!YMxtT#''1>#', 0, 0, 0, '', 0, 0, 0, 0, 0, 0, 0, 0, 0, 0, 0, 0, '', '', 0, '', 'vb', '', 0, 1, 0, 0, NULL),
(24079, 3, '', 0, 'CIZGW', '174911f3149012b0ced8d2af03bac5e5', '2014-05-05', 'christiane.pedersen16@gojislims.com', 0, '', '', '', '', '', '', '', 2, 0, 'New Member', 0, 1399292534, 0, 1399292534, 1399292534, 0, 0, 0, 0, 4, '5', 0, 0, 0, 0, 0, 3194967, '07-07-1978', '1978-07-07', -1, -1, '198.167.136.126', 0, 1, 0, 0, -1, 0, 0, 'YD%9<`N0%M&mO*P]!q}^~|kv\\qAPoK', 0, 0, 0, '', 0, 0, 0, 0, 0, 0, 0, 0, 0, 0, 0, 0, '', '', 0, '', 'vb', '', 0, 1, 0, 0, NULL),
(24080, 2, '', 0, 'xsman-11', '2facb925b48c4884eface9e71956674d', '2014-05-05', 'usmanb2@hotmail.com', 0, '', '', '', '', '', '', '', 2, 0, 'New Member', 0, 1399295169, 0, 1399295169, 1399295273, 0, 0, 0, 0, 4, '5', 0, 0, 0, 0, 0, 3194967, '09-11-1983', '1983-09-11', -1, -1, '182.185.253.27', 8037, 1, 0, 0, -1, 0, 0, '3=3p@_mZ2J:1DA9s3MlI>E@V}"\\j,B', 0, 0, 0, '', 0, 0, 0, 0, 0, 0, 0, 0, 0, 0, 0, 0, '', '', 0, '', 'vb', '', 0, 1, 0, 0, NULL),
(24229, 3, '', 0, 'BMacaluso', '9bb2e525b79a994ff4b819d1437cd3aa', '2014-05-09', 'alikenotary25ud8@outlook.com', 0, '', '', '', '', '', '', '', 2, 0, 'New Member', 0, 1399615927, 0, 1399615927, 1399618396, 0, 0, 0, 0, 4, '5', 0, 0, 0, 0, 0, 3194967, '11-20-1985', '1985-11-20', -1, -1, '50.149.119.23', 0, 1, 0, 0, -1, 0, 0, 'fP?>(L9ZfGbo{Z&`d/#HK''85by=z8|', 0, 0, 0, '', 0, 0, 0, 0, 0, 0, 0, 0, 0, 0, 0, 0, '', '', 0, '', 'vb', '', 0, 1, 0, 0, NULL),
(24082, 3, '', 0, 'MXNW', '26f2764744cff53dcdcd5ea525531db1', '2014-05-05', 'strangetundra95c094q@outlook.com', 0, '', '', '', '', '', '', '', 2, 0, 'New Member', 0, 1399297251, 0, 1399297251, 1399300842, 0, 0, 0, 0, 4, '5', 0, 0, 0, 0, 0, 3194967, '06-13-1977', '1977-06-13', -1, -1, '23.94.243.136', 0, 1, 0, 0, -1, 0, 0, 'R=:\\Y7]uxtmP0/V?vHl$!;qcx5i}T{', 0, 0, 0, '', 0, 0, 0, 0, 0, 0, 0, 0, 0, 0, 0, 0, '', '', 0, '', 'vb', '', 0, 1, 0, 0, NULL),
(24083, 3, '', 0, 'LBoynton', 'dc47bee334daa4779d8702f98d28ae27', '2014-05-05', 'fertilewarlock5dri56@outlook.com', 0, '', '', '', '', '', '', '', 2, 0, 'New Member', 0, 1399298176, 0, 1399298176, 1399300978, 0, 0, 0, 0, 4, '5', 0, 0, 0, 0, 0, 3194967, '08-13-1971', '1971-08-13', -1, -1, '69.12.68.85', 0, 1, 0, 0, -1, 0, 0, '/''SZN9~&+1I#5_v\\?K6gvkcrl]._t=', 0, 0, 0, '', 0, 0, 0, 0, 0, 0, 0, 0, 0, 0, 0, 0, '', '', 0, '', 'vb', '', 0, 1, 0, 0, NULL),
(24161, 3, '', 0, 'milesqnra4885', 'f8a4531b4ac6744bd9f314bb9c5e9912', '2014-05-07', 'milesqnra@ymail.com', 0, '', '', '', '', '', '', '', 2, 0, 'New Member', 0, 1399452465, 0, 1399452465, 1399452465, 0, 0, 0, 0, 4, '12', 0, 0, 0, 0, 0, 3195031, '01-25-1988', '1988-01-25', -1, -1, '46.71.96.187', 0, 1, 0, 0, -1, 0, 0, '&1yKp=4C@Ds$xxzI$;LmJF0J^J:y{T', 0, 0, 0, '', 0, 0, 0, 0, 0, 0, 0, 0, 0, 0, 0, 0, '', '', 0, '', 'vb', '', 0, 1, 0, 0, NULL),
(24088, 2, '', 0, 'muhammad khalid', '547d83a6b6340bb56c324e3b52713c99', '2015-08-01', 'zindigi123@yahoo.com', 0, '', '', '', '', 'ZINDIGI123', '', 'ZINDIGI123', 2, 0, 'New Member', 0, 1399309300, 0, 1440061081, 1440061081, 1409684385, 457484, 7, 0, 4, '5', 0, 0, 0, 0, 0, 3194967, '07-14-1972', '1972-07-14', -1, -1, '182.187.31.245', 149, 1, 1399744283, 0, -1, 0, 0, 'Rc*m,{IGH2++pfp{zlJcCMj}g!oanG', 0, 0, 0, '', 0, 0, 7, 0, 0, 0, 0, 0, 0, 0, 0, 0, '', '', 0, '', 'vb', '', 0, 1, 0, 0, NULL),
(24170, 3, '', 0, 'GLockwood', '8b4186ed92d1948b54fb830cb275b5bc', '2014-05-07', 'leanncowart09@yahoo.com', 0, '', '', '', '', '', '', '', 2, 0, 'New Member', 0, 1399466864, 0, 1399466864, 1399466864, 0, 0, 0, 0, 4, '5', 0, 0, 0, 0, 0, 3194967, '08-15-1975', '1975-08-15', -1, -1, '81.4.125.175', 0, 1, 0, 0, -1, 0, 0, 'HH$uL.(?bLS+ufm{}>"\\"X]K8P\\UR9', 0, 0, 0, '', 0, 0, 0, 0, 0, 0, 0, 0, 0, 0, 0, 0, '', '', 0, '', 'vb', '', 0, 1, 0, 0, NULL),
(24234, 3, '', 0, 'Armghan Atlas', 'adc3a8aefe547839896adbbab95769ec', '2014-05-09', 'khanjee_express005@yahoo.com', 0, '', '', '', '', '', '', '', 2, 0, 'New Member', 0, 1399621144, 0, 1399626675, 1399744120, 0, 0, 0, 0, 4, '5', 0, 0, 0, 0, 0, 3194967, '02-02-1980', '1980-02-02', -1, -1, '182.183.239.115', 0, 1, 0, 0, -1, 0, 0, 'JydEguJ''U0?r>k?fhW9667mTA`&eG>', 0, 0, 0, '', 0, 0, 0, 0, 0, 0, 0, 0, 0, 0, 0, 0, '', '', 0, '', 'vb', '', 0, 1, 0, 0, NULL),
(24108, 3, '', 0, 'Z5917', '7c5e95b592ff91873cd4532e7a3203ce', '2014-05-06', 'lackingguideboo1vq88@outlook.com', 0, '', '', '', '', '', '', '', 2, 0, 'New Member', 0, 1399362319, 0, 1399362319, 1399362319, 0, 0, 0, 0, 4, '5', 0, 0, 0, 0, 0, 3194967, '12-12-1979', '1979-12-12', -1, -1, '23.94.243.130', 0, 1, 0, 0, -1, 0, 0, 'X9zdDES:~#bm>+i<a5K+VzIMq/XQ!V', 0, 0, 0, '', 0, 0, 0, 0, 0, 0, 0, 0, 0, 0, 0, 0, '', '', 0, '', 'vb', '', 0, 1, 0, 0, NULL),
(24268, 3, '', 0, 'EHerbert', 'a9ae49000be7f3264cbb01f6be7a66e0', '2014-05-10', 'thinkablefinanc6zy@nokiamail.com', 0, '', '', '', '', '', '', '', 2, 0, 'New Member', 0, 1399710482, 0, 1399710482, 1399710482, 0, 0, 0, 0, 4, '5', 0, 0, 0, 0, 0, 3194967, '01-29-1984', '1984-01-29', -1, -1, '23.239.199.144', 0, 1, 0, 0, -1, 0, 0, '/L0c<''w:~_!,oR]<{)>37^fb/[8w=C', 0, 0, 0, '', 0, 0, 0, 0, 0, 0, 0, 0, 0, 0, 0, 0, '', '', 0, '', 'vb', '', 0, 1, 0, 0, NULL),
(24142, 3, '', 0, 'HHyder', '4ec40033f3085732b43a0c7ed077b2c5', '2014-05-06', 'leonard-vela866095@outlook.com', 0, '', '', '', '', '', '', '', 2, 0, 'New Member', 0, 1399415362, 0, 1399415362, 1399415362, 0, 0, 0, 0, 4, '5', 0, 0, 0, 0, 0, 3194967, '07-31-1982', '1982-07-31', -1, -1, '204.44.85.91', 0, 1, 0, 0, -1, 0, 0, 'd[~l#*d(IWtinic^pP''i1uH:Qbsk/=', 0, 0, 0, '', 0, 0, 0, 0, 0, 0, 0, 0, 0, 0, 0, 0, '', '', 0, '', 'vb', '', 0, 1, 0, 0, NULL),
(24151, 2, '', 0, 'bro', '9b32828c6e1093168fb8001faa9e0976', '2014-05-07', 'Shahramtalpur@yahoo.com', 0, '', '', '', '', '', '', '', 2, 0, 'New Member', 0, 1399427189, 0, 1400447600, 1401497490, 1399476021, 438305, 1, 0, 4, '5', 0, 0, 0, 0, 0, 3194967, '12-10-1985', '1985-12-10', -1, -1, '59.103.201.39', 0, 1, 0, 0, -1, 0, 0, 'W6MEi}8zFAyZ[X-4g%+fjv##XFa?F%', 0, 0, 0, '', 0, 0, 0, 0, 0, 0, 0, 0, 0, 0, 0, 0, '', '', 0, '', 'vb', '', 0, 1, 0, 0, NULL),
(24111, 2, '', 0, 'shani baba', '6dd6b32053b0296206cadde9ef410a14', '2014-05-06', 'foneofyou@hotmail.com', 0, '', '', '', '', '', '', '', 2, 0, 'New Member', 0, 1399368839, 0, 1399536030, 1399969783, 0, 0, 0, 0, 4, '5', 0, 0, 0, 0, 0, 3194967, '02-11-1987', '1987-02-11', -1, -1, '119.73.55.129', 96, 1, 0, 0, -1, 0, 0, 'q6!YY/vz>DG5d~v)''==k=y1meW\\\\MP', 0, 0, 0, '', 0, 0, 1, 0, 0, 0, 0, 0, 0, 0, 0, 0, '', '', 0, '', 'vb', '', 0, 1, 0, 0, NULL),
(24231, 3, '', 0, 'WGranata', '2c479bedaf76e1ab6ca5c2cffb16c284', '2014-05-09', 'inesgjbotz@yahoo.com', 0, '', '', '', '', '', '', '', 2, 0, 'New Member', 0, 1399618626, 0, 1399618626, 1399625139, 0, 0, 0, 0, 4, '5', 0, 0, 0, 0, 0, 3194967, '07-07-1972', '1972-07-07', -1, -1, '69.12.91.156', 0, 1, 0, 0, -1, 0, 0, 'SaG.,''7Z.Rpq7o\\2yx_!8JK|fb6|7Z', 0, 0, 0, '', 0, 0, 0, 0, 0, 0, 0, 0, 0, 0, 0, 0, '', '', 0, '', 'vb', '', 0, 1, 0, 0, NULL),
(24132, 3, '', 0, 'AColebatc', '4928b13c711c79f69b5a127ca8a45acd', '2014-05-06', 'lowsadness657jn20@outlook.com', 0, '', '', '', '', '', '', '', 2, 0, 'New Member', 0, 1399391734, 0, 1399391734, 1399391734, 0, 0, 0, 0, 4, '5', 0, 0, 0, 0, 0, 3194967, '06-04-1979', '1979-06-04', -1, -1, '2.147.159.44', 0, 1, 0, 0, -1, 0, 0, 'Fob5@_JDy<6d5c4o=\\Ut/z0B#StO%(', 0, 0, 0, '', 0, 0, 0, 0, 0, 0, 0, 0, 0, 0, 0, 0, '', '', 0, '', 'vb', '', 0, 1, 0, 0, NULL),
(29224, 3, '', 0, 'EH46', '23c38083ffdf595c691d6bd0e41be64b', '2014-11-01', 'armandosemenzagmy@yahoo.com', 0, '', '', '', '', '', '', '', 2, 0, 'New Member', 0, 1414817076, 0, 1414817076, 1414823768, 0, 0, 0, 0, 4, '5', 0, 0, 0, 0, 0, 3194967, '12-20-1971', '1971-12-20', -1, -1, '107.168.11.98', 0, 1, 0, 0, -1, 0, 0, 'wGi&{}SOPC5_pNYneD"~=t#6r"LX&^', 0, 0, 0, '', 0, 0, 0, 0, 0, 0, 0, 0, 0, 0, 0, 0, '', '', 0, '', 'vb', '', 0, 1, 0, 0, NULL),
(24377, 2, '', 0, 'abuumer', 'd81990c3f18b9b59223591116717be4c', '2014-05-13', 'madihanouman@hotmail.com', 0, '', '', '', '', '', '', '', 2, 0, 'New Member', 0, 1399993431, 0, 1402771002, 1403158253, 1401681109, 443114, 2, 0, 4, '5', 0, 0, 0, 0, 0, 3194967, '01-26-1980', '1980-01-26', -1, -1, '139.190.42.189', 0, 1, 0, 0, -1, 0, 0, '!A(FC?{1baak!K\\lhstQdYK.~)r@;=', 0, 0, 0, '', 0, 0, 0, 0, 0, 0, 0, 0, 0, 0, 0, 0, '', '', 0, '', 'vb', '', 0, 1, 0, 0, NULL),
(24152, 2, '', 0, 'UETT', 'c00773c5fc43f991c040a7b0a793e587', '2014-05-07', 'djshismandg@yahoo.com', 0, '', '', '', '', '', '', '', 2, 0, 'New Member', 0, 1399428204, 0, 1399428204, 1399428204, 0, 0, 0, 0, 4, '5', 0, 0, 0, 0, 0, 3194967, '03-18-1971', '1971-03-18', -1, -1, '170.130.110.101', 0, 1, 0, 0, -1, 0, 0, 'i_!nY6&\\WZ7|q)QNuyCJ8<CIbAzq"s', 0, 0, 0, '', 0, 0, 0, 0, 0, 0, 0, 0, 0, 0, 0, 0, '', '', 0, '', 'vb', '', 0, 1, 0, 0, NULL),
(24127, 3, '', 0, 'EHardie', 'f41857b222f96e152346872a7fd623bd', '2014-05-06', 'kristianmckinnon60@yahoo.com', 0, '', '', '', '', '', '', '', 2, 0, 'New Member', 0, 1399387004, 0, 1399387004, 1399619785, 0, 0, 0, 0, 4, '5', 0, 0, 0, 0, 0, 3194967, '08-27-1976', '1976-08-27', -1, -1, '5.157.45.236', 0, 1, 0, 0, -1, 0, 0, '#mgyPw~CPfC$`$<ucx{GJsKs{(@zp8', 0, 0, 0, '', 0, 0, 0, 0, 0, 0, 0, 0, 0, 0, 0, 0, '', '', 0, '', 'vb', '', 0, 1, 0, 0, NULL),
(24272, 2, '', 0, 'Anees', '29fd35450221bade8619af32e43fd765', '2014-05-10', 'sowith1@gmail.com', 0, '', '', '', '', '', '', '', 2, 0, 'New Member', 0, 1399725923, 0, 1403538904, 1406260654, 1400489305, 440574, 3, 0, 4, '5', 0, 0, 0, 0, 0, 3194967, '11-01-1991', '1991-11-01', -1, -1, '74.115.1.129', 0, 1, 0, 0, -1, 0, 0, 'MldJG5`A#.CZ5xKgOQ-0mhpX-IK3<f', 0, 0, 0, '', 0, 0, 1, 0, 0, 0, 0, 0, 0, 0, 0, 0, '', '', 0, '', 'vb', '', 0, 1, 0, 0, NULL),
(24169, 3, '', 0, 'HPgh', 'a6f4391eeced9ce535b9b338b1ef0769', '2014-05-07', 'scientificnation365@hotmail.com', 0, '', '', '', '', '', '', '', 2, 0, 'New Member', 0, 1399462566, 0, 1399462566, 1399466370, 0, 0, 0, 0, 4, '5', 0, 0, 0, 0, 0, 3194967, '09-30-1979', '1979-09-30', -1, -1, '204.44.83.28', 0, 1, 0, 0, -1, 0, 0, ':2ZmcOOKV=of0c,$>JoB9g4c?]>vQ_', 0, 0, 0, '', 0, 0, 0, 0, 0, 0, 0, 0, 0, 0, 0, 0, '', '', 0, '', 'vb', '', 0, 1, 0, 0, NULL),
(24166, 2, '', 0, 'Yassar', 'd7657df667449ea126dee1a6a8464286', '2014-05-07', 'khamar007@yahoo.com', 0, '', '', '', '', '', '', '', 2, 0, 'New Member', 0, 1399458576, 0, 1399459263, 1399459263, 0, 0, 0, 0, 4, '5', 0, 0, 0, 0, 0, 3194967, '12-25-1982', '1982-12-25', -1, -1, '182.188.220.173', 0, 1, 0, 0, -1, 0, 0, 'OC2YP~Ri}Ivxn*y:fw`U3F,ShSBqXT', 0, 0, 0, '', 0, 0, 0, 0, 0, 0, 0, 0, 0, 0, 0, 0, '', '', 0, '', 'vb', '', 0, 1, 0, 0, NULL),
(24139, 3, '', 0, 'ali@123', 'be4d75857d9b563cef6b37adfbb62961', '2014-05-06', 'ahmadali134857@yahoo.com', 0, '', '', '', '', '', '', '', 2, 0, 'New Member', 0, 1399409706, 0, 1399409844, 1399411040, 0, 0, 0, 0, 4, '5', 0, 0, 0, 0, 0, 3194967, '02-22-1991', '1991-02-22', -1, -1, '119.154.88.208', 0, 1, 0, 0, -1, 0, 0, '1%Z5fFw$i''vguR6&eU[r7fm3Yx6=c1', 0, 0, 0, '', 0, 0, 0, 0, 0, 0, 0, 0, 0, 0, 0, 0, '', '', 0, '', 'vb', '', 0, 1, 0, 0, NULL),
(24125, 3, '', 0, 'DHerrera', '7107f374543298846ce358b6831a3c7b', '2014-05-06', 'ossifiedcomediab6hi@aol.com', 0, '', '', '', '', '', '', '', 2, 0, 'New Member', 0, 1399384928, 0, 1399384928, 1399387466, 0, 0, 0, 0, 4, '5', 0, 0, 0, 0, 0, 3194967, '06-03-1982', '1982-06-03', -1, -1, '23.94.60.109', 0, 1, 0, 0, -1, 0, 0, ';W.~,")f8MmqImJDFYRZeOza}RKakk', 0, 0, 0, '', 0, 0, 0, 0, 0, 0, 0, 0, 0, 0, 0, 0, '', '', 0, '', 'vb', '', 0, 1, 0, 0, NULL),
(24126, 3, '', 0, 'GF49', 'cd7875f78386b91c31a915ebbf6a68b6', '2014-05-06', 'tinapyjcqbwh@outlook.com', 0, '', '', '', '', '', '', '', 2, 0, 'New Member', 0, 1399386836, 0, 1399386836, 1401087893, 0, 0, 0, 0, 4, '5', 0, 0, 0, 0, 0, 3194967, '05-15-1980', '1980-05-15', -1, -1, '93.118.68.17', 0, 1, 0, 0, -1, 0, 0, '3w[|ZnnARYq,Xqrf-/wOD$|vg$cGL>', 0, 0, 0, '', 0, 0, 0, 0, 0, 0, 0, 0, 0, 0, 0, 0, '', '', 0, '', 'vb', '', 0, 1, 0, 0, NULL),
(24124, 3, '', 0, 'MJ94', '3aa7d369e475a22f54c1fd671b3f6745', '2014-05-06', 'exultantboss8nnp@nokiamail.com', 0, '', '', '', '', '', '', '', 2, 0, 'New Member', 0, 1399381225, 0, 1399381225, 1399381225, 0, 0, 0, 0, 4, '5', 0, 0, 0, 0, 0, 3194967, '11-13-1984', '1984-11-13', -1, -1, '68.171.98.146', 0, 1, 0, 0, -1, 0, 0, 'C_(dPq^*L9>6r{9MvOM8jL[g@4`q\\$', 0, 0, 0, '', 0, 0, 0, 0, 0, 0, 0, 0, 0, 0, 0, 0, '', '', 0, '', 'vb', '', 0, 1, 0, 0, NULL),
(24148, 3, '', 0, 'LRyland', 'abd953c711bd187794d2eb606db0639c', '2014-05-07', 'heldecv@outlook.com', 0, '', '', '', '', '', '', '', 2, 0, 'New Member', 0, 1399420625, 0, 1399420625, 1399424382, 0, 0, 0, 0, 4, '5', 0, 0, 0, 0, 0, 3194967, '01-27-1978', '1978-01-27', -1, -1, '107.158.22.107', 0, 1, 0, 0, -1, 0, 0, '`V_>G7{+{*/T$(''g)HpE/.J&U3x(~d', 0, 0, 0, '', 0, 0, 0, 0, 0, 0, 0, 0, 0, 0, 0, 0, '', '', 0, '', 'vb', '', 0, 1, 0, 0, NULL),
(24162, 2, '', 0, 'SNK', 'e7c5619bdabaa3b392ad070e0120ac04', '2014-05-07', 'sohailnawaz.marwat@gmail.com', 0, '', '', '', '', '', '', '', 2, 0, 'New Member', 0, 1399453280, 0, 1400132621, 1400133407, 0, 0, 0, 0, 4, '5', 0, 0, 0, 0, 0, 3194967, '10-01-1988', '1988-10-01', -1, -1, '182.185.14.162', 0, 1, 0, 0, -1, 0, 0, 'f#Zcx5<DGl#F/_xX21UG7:jiWnXtL)', 0, 0, 0, '', 0, 0, 0, 0, 0, 0, 0, 0, 0, 0, 0, 0, '', '', 0, '', 'vb', '', 0, 1, 0, 0, NULL),
(24163, 2, '', 0, 'Dr. Khan', 'def2e3193af2684e6a7fa1098d031247', '2016-02-13', 'dr.shaukat.khan@gmail.com', 0, '', '', '', '', '', '', '', 2, 0, 'New Member', 0, 1399454303, 0, 1404194620, 1455358183, 1400059987, 439616, 2, 0, 4, '5', 0, 0, 0, 0, 0, 3194967, '05-16-1971', '1971-05-16', -1, -1, '111.68.101.136', 0, 1, 0, 0, -1, 0, 0, '[a%>sE;lu4_.hHd/}VGL;a}/u+_&U7', 0, 0, 0, '', 0, 0, 0, 0, 0, 0, 0, 0, 0, 0, 0, 0, '', '', 0, '', 'vb', '', 0, 1, 0, 0, NULL),
(24164, 2, '', 0, 'nafis rehman', 'f8cb8b74ccd566e7b4ed9466cad7e3a8', '2014-05-07', 'nafisurrehman@hotmail.com', 0, '', '', '', '', '', '', '', 2, 0, 'New Member', 0, 1399454665, 0, 1399622073, 1399622158, 0, 0, 0, 0, 4, '5', 0, 0, 0, 0, 0, 3194967, '03-24-1961', '1961-03-24', -1, -1, '182.178.7.55', 0, 1, 0, 0, -1, 0, 0, 'jb`x(~t@Cu.^?JZh^ImBGBO&4<v{W-', 0, 0, 0, '', 0, 0, 0, 0, 0, 0, 0, 0, 0, 0, 0, 0, '', '', 0, '', 'vb', '', 0, 1, 0, 0, NULL),
(24165, 2, '', 0, 'ali khan gandapur', 'b96538abb6807d72734ade723c88103a', '2014-11-30', 'muhammadali303031@yahoo.com', 0, '', '', '', '', '', '', '', 2, 0, 'New Member', 0, 1399456430, 0, 1399456867, 1417336989, 1417336401, 467890, 2, 0, 4, '5', 0, 0, 0, 0, 0, 3194967, '01-02-1990', '1990-01-02', -1, -1, '182.185.30.59', 96, 1, 0, 0, -1, 0, 0, '!JV''QRp]n%J{8VMC^xqHh?CjLzx\\4d', 0, 0, 0, '', 0, 0, 0, 1, 0, 0, 0, 0, 0, 0, 0, 0, '', '', 0, '', 'vb', '', 0, 1, 0, 0, NULL),
(24177, 3, '', 0, 'MTeichelm', '3eb007fd7c532a27840bc828cecb586b', '2014-05-07', 'veronika-deanda798010@outlook.com', 0, '', '', '', '', '', '', '', 2, 0, 'New Member', 0, 1399488625, 0, 1399488625, 1399488625, 0, 0, 0, 0, 4, '5', 0, 0, 0, 0, 0, 3194967, '09-12-1980', '1980-09-12', -1, -1, '204.44.82.122', 0, 1, 0, 0, -1, 0, 0, '2_HPSFFCYdGAGJ[>J3XoTP#%%Ix8k>', 0, 0, 0, '', 0, 0, 0, 0, 0, 0, 0, 0, 0, 0, 0, 0, '', '', 0, '', 'vb', '', 0, 1, 0, 0, NULL),
(24249, 2, '', 0, 'virk98', '411ea8a473f6ac3d77a2dafe8dd78744', '2014-05-09', 'h_masood63@hotmail.com', 0, '', '', '', '', '', '', '', 2, 0, 'New Member', 0, 1399646098, 0, 1399646098, 1399647240, 0, 0, 0, 0, 4, '5', 0, 0, 0, 0, 0, 3194967, '12-25-1990', '1990-12-25', -1, -1, '182.185.134.130', 0, 1, 0, 0, -1, 0, 0, 'vldt$FIkMtnh`,WuOY,T7''n3b?''h-t', 0, 0, 0, '', 0, 0, 0, 0, 0, 0, 0, 0, 0, 0, 0, 0, '', '', 0, '', 'vb', '', 0, 1, 0, 0, NULL),
(24179, 2, '', 0, 'Tabrez', '60e2e7e28e86b6b4638badd9b75f04bc', '2014-05-07', 'm.tjk@live.com', 0, '', '', '', '', '', '', '', 2, 0, 'New Member', 0, 1399490556, 0, 1399531249, 1399535053, 0, 0, 0, 0, 4, '5', 0, 0, 0, 0, 0, 3194967, '12-16-1985', '1985-12-16', -1, -1, '39.41.68.147', 0, 1, 0, 0, -1, 0, 0, 'RK*J_8k^+lo''w\\x<BGlCU!=D,_r^(6', 0, 0, 0, '', 0, 0, 0, 0, 0, 0, 0, 0, 0, 0, 0, 0, '', '', 0, '', 'vb', '', 0, 1, 0, 0, NULL),
(24180, 3, '', 0, 'RLumpkin', '89e7c17f3e48ba7ad1ea3a5fbf80da41', '2014-05-07', 'lorrineely42@yahoo.com', 0, '', '', '', '', '', '', '', 2, 0, 'New Member', 0, 1399490861, 0, 1399490861, 1399871483, 0, 0, 0, 0, 4, '5', 0, 0, 0, 0, 0, 3194967, '08-29-1977', '1977-08-29', -1, -1, '192.227.243.151', 0, 1, 0, 0, -1, 0, 0, 'y&}2d*OYP%w5?Ag-QA9u4{GoZk%aAW', 0, 0, 0, '', 0, 0, 0, 0, 0, 0, 0, 0, 0, 0, 0, 0, '', '', 0, '', 'vb', '', 0, 1, 0, 0, NULL),
(24182, 3, '', 0, 'C88X', '4c82f7edd733feed679b0508a7f282e2', '2014-05-07', 'xadazibynuza@yahoo.com', 0, '', '', '', '', '', '', '', 2, 0, 'New Member', 0, 1399491617, 0, 1399491617, 1399491617, 0, 0, 0, 0, 4, '5', 0, 0, 0, 0, 0, 3194967, '11-02-1984', '1984-11-02', -1, -1, '107.155.80.22', 0, 1, 0, 0, -1, 0, 0, '>s`l9P+q-R<sgQQKG-b&HE]*.IwC}e', 0, 0, 0, '', 0, 0, 0, 0, 0, 0, 0, 0, 0, 0, 0, 0, '', '', 0, '', 'vb', '', 0, 1, 0, 0, NULL),
(24233, 3, '', 0, 'EChappel', 'ad0f2ab0688b990c87e1a5f757a01cd6', '2014-05-09', 'tubymukicej@yahoo.com', 0, '', '', '', '', '', '', '', 2, 0, 'New Member', 0, 1399620170, 0, 1399620170, 1399620170, 0, 0, 0, 0, 4, '5', 0, 0, 0, 0, 0, 3194967, '02-14-1972', '1972-02-14', -1, -1, '107.161.85.77', 0, 1, 0, 0, -1, 0, 0, 'Gss.q@#?M+`"WOux(''"JF(`@Ie"Z3g', 0, 0, 0, '', 0, 0, 0, 0, 0, 0, 0, 0, 0, 0, 0, 0, '', '', 0, '', 'vb', '', 0, 1, 0, 0, NULL),
(24222, 3, '', 0, 'R31Q', '0d1b9b0f3a815aec7186853a78d586d0', '2014-05-09', 'ayalarvb@hotmail.com', 0, '', '', '', '', '', '', '', 2, 0, 'New Member', 0, 1399602917, 0, 1399602917, 1399602917, 0, 0, 0, 0, 4, '5', 0, 0, 0, 0, 0, 3194967, '08-05-1976', '1976-08-05', -1, -1, '192.208.185.194', 0, 1, 0, 0, -1, 0, 0, 'BXwklbB[(k2B.NI`))UtP>{jACkg+f', 0, 0, 0, '', 0, 0, 0, 0, 0, 0, 0, 0, 0, 0, 0, 0, '', '', 0, '', 'vb', '', 0, 1, 0, 0, NULL),
(24185, 3, '', 0, 'HWeddle', '5c1f2097cc7ec34926847a28da77fcdd', '2014-05-07', 'cohennnu@hotmail.com', 0, '', '', '', '', '', '', '', 2, 0, 'New Member', 0, 1399494476, 0, 1399494476, 1399494476, 0, 0, 0, 0, 4, '5', 0, 0, 0, 0, 0, 3194967, '02-13-1982', '1982-02-13', -1, -1, '151.237.181.110', 0, 1, 0, 0, -1, 0, 0, '6IASwWRh$3bY=kp^:S*uk_shWHKWp+', 0, 0, 0, '', 0, 0, 0, 0, 0, 0, 0, 0, 0, 0, 0, 0, '', '', 0, '', 'vb', '', 0, 1, 0, 0, NULL),
(24186, 3, '', 0, 'SAugustin', '0e8eaeb0c8eb2ca53c7eeda34caa3dd2', '2014-05-07', 'mingniukyswgbk@yahoo.com', 0, '', '', '', '', '', '', '', 2, 0, 'New Member', 0, 1399496735, 0, 1399496735, 1399505656, 0, 0, 0, 0, 4, '5', 0, 0, 0, 0, 0, 3194967, '11-18-1978', '1978-11-18', -1, -1, '46.105.131.119', 0, 1, 0, 0, -1, 0, 0, '[2&6?cMr61MP(e|^3K~X%^yA)qOT~p', 0, 0, 0, '', 0, 0, 0, 0, 0, 0, 0, 0, 0, 0, 0, 0, '', '', 0, '', 'vb', '', 0, 1, 0, 0, NULL),
(24187, 3, '', 0, 'P74R', 'e35d270eb0ae9865dc5015ac0e0e5db9', '2014-05-08', 'jamieayfg@outlook.com', 0, '', '', '', '', '', '', '', 2, 0, 'New Member', 0, 1399510786, 0, 1399510786, 1399526881, 0, 0, 0, 0, 4, '5', 0, 0, 0, 0, 0, 3194967, '11-20-1983', '1983-11-20', -1, -1, '199.30.54.137', 0, 1, 0, 0, -1, 0, 0, 'qoF~{";;XsaSQu!wv[KVfssFYUXL{U', 0, 0, 0, '', 0, 0, 0, 0, 0, 0, 0, 0, 0, 0, 0, 0, '', '', 0, '', 'vb', '', 0, 1, 0, 0, NULL),
(24385, 3, '', 0, 'TMerrill', '6e562123abf89d7b8c386b14325a5a8a', '2014-05-13', 'trudy_merrill@kienthuccuatoi.com', 0, '', '', '', '', '', '', '', 2, 0, 'New Member', 0, 1400013356, 0, 1400013356, 1400020182, 0, 0, 0, 0, 4, '5', 0, 0, 0, 0, 0, 3194967, '03-20-1972', '1972-03-20', -1, -1, '23.231.103.141', 0, 1, 0, 0, -1, 0, 0, '2''Ikw4ymZBgpFkriTw/CqW0_.T<rPc', 0, 0, 0, '', 0, 0, 0, 0, 0, 0, 0, 0, 0, 0, 0, 0, '', '', 0, '', 'vb', '', 0, 1, 0, 0, NULL),
(24215, 3, '', 0, 'L2078', '4cbf8252a37f03b7b912a04e518a88be', '2014-05-08', 'oswnepr@outlook.com', 0, '', '', '', '', '', '', '', 2, 0, 'New Member', 0, 1399578036, 0, 1399578036, 1399581767, 0, 0, 0, 0, 4, '5', 0, 0, 0, 0, 0, 3194967, '06-27-1981', '1981-06-27', -1, -1, '204.44.112.42', 0, 1, 0, 0, -1, 0, 0, 'jSMV]YHS=UoS[$G\\ZYVR[^=1];$9C9', 0, 0, 0, '', 0, 0, 0, 0, 0, 0, 0, 0, 0, 0, 0, 0, '', '', 0, '', 'vb', '', 0, 1, 0, 0, NULL),
(24216, 3, '', 0, 'OYEL', 'a7be584964f402fb03fd51ceefb4adb6', '2014-05-08', 'danicawza532@hotmail.com', 0, '', '', '', '', '', '', '', 2, 0, 'New Member', 0, 1399578083, 0, 1399578083, 1399581875, 0, 0, 0, 0, 4, '5', 0, 0, 0, 0, 0, 3194967, '01-09-1984', '1984-01-09', -1, -1, '46.249.51.135', 0, 1, 0, 0, -1, 0, 0, 'H2($}?1JH]^5/u3KL}>34|el2Y8qk&', 0, 0, 0, '', 0, 0, 0, 0, 0, 0, 0, 0, 0, 0, 0, 0, '', '', 0, '', 'vb', '', 0, 1, 0, 0, NULL),
(24217, 3, '', 0, 'J82R', '4b973ce76f757bae006330b08d11fc70', '2014-05-08', 'deonkyayr@yahoo.com', 0, '', '', '', '', '', '', '', 2, 0, 'New Member', 0, 1399580175, 0, 1399580175, 1399588920, 0, 0, 0, 0, 4, '5', 0, 0, 0, 0, 0, 3194967, '09-11-1979', '1979-09-11', -1, -1, '5.135.99.207', 0, 1, 0, 0, -1, 0, 0, 'Vo|fY[^X$s6oLZF/OSk"1<tHpGy2PT', 0, 0, 0, '', 0, 0, 0, 0, 0, 0, 0, 0, 0, 0, 0, 0, '', '', 0, '', 'vb', '', 0, 1, 0, 0, NULL),
(24192, 3, '', 0, 'JCrosby', '0bbf54526a9b9bb91b4bb2e10390c08c', '2014-05-08', 'frdeakwgp@yahoo.com', 0, '', '', '', '', '', '', '', 2, 0, 'New Member', 0, 1399523013, 0, 1399523013, 1399535616, 0, 0, 0, 0, 4, '5', 0, 0, 0, 0, 0, 3194967, '12-27-1979', '1979-12-27', -1, -1, '178.32.161.209', 0, 1, 0, 0, -1, 0, 0, 'iMdKaCPz%BzFP,/@56{(#/yz!t<#V/', 0, 0, 0, '', 0, 0, 0, 0, 0, 0, 0, 0, 0, 0, 0, 0, '', '', 0, '', 'vb', '', 0, 1, 0, 0, NULL),
(24193, 3, '', 0, 'FMackinno', '85e423839a5049293710a677b27a93be', '2014-05-08', 'pryorupwxn@yahoo.com', 0, '', '', '', '', '', '', '', 2, 0, 'New Member', 0, 1399524175, 0, 1399524175, 1399547195, 0, 0, 0, 0, 4, '5', 0, 0, 0, 0, 0, 3194967, '06-08-1972', '1972-06-08', -1, -1, '178.32.226.84', 0, 1, 0, 0, -1, 0, 0, 'j(j9y,#l2jyGkd7"ltBgM+r]NPts%2', 0, 0, 0, '', 0, 0, 0, 0, 0, 0, 0, 0, 0, 0, 0, 0, '', '', 0, '', 'vb', '', 0, 1, 0, 0, NULL),
(24194, 3, '', 0, 'MBrentnal', '4f1abc94197996f2b86c6593b726499a', '2014-05-08', 'grumpyutopia2gqsv@nokiamail.com', 0, '', '', '', '', '', '', '', 2, 0, 'New Member', 0, 1399524442, 0, 1399524442, 1399524442, 0, 0, 0, 0, 4, '5', 0, 0, 0, 0, 0, 3194967, '07-12-1984', '1984-07-12', -1, -1, '196.196.32.196', 0, 1, 0, 0, -1, 0, 0, 'cwg|z*R*{7LU?KWc=+\\8n)L]0i[R<_', 0, 0, 0, '', 0, 0, 0, 0, 0, 0, 0, 0, 0, 0, 0, 0, '', '', 0, '', 'vb', '', 0, 1, 0, 0, NULL),
(24232, 3, '', 0, 'OMoritz', 'fde0c9a77e032893a120cfef559a841d', '2014-05-09', 'waggishalcove9278d87@outlook.com', 0, '', '', '', '', '', '', '', 2, 0, 'New Member', 0, 1399619944, 0, 1399619944, 1399627211, 0, 0, 0, 0, 4, '5', 0, 0, 0, 0, 0, 3194967, '02-10-1985', '1985-02-10', -1, -1, '173.208.27.145', 0, 1, 0, 0, -1, 0, 0, '#Q|()bO}?b-?8T{&F1A=-r1C''cM7S*', 0, 0, 0, '', 0, 0, 0, 0, 0, 0, 0, 0, 0, 0, 0, 0, '', '', 0, '', 'vb', '', 0, 1, 0, 0, NULL),
(24196, 3, '', 0, 'VMartinel', 'cba93477d1f8735c5f2ac925bac00601', '2014-05-08', 'reneexkcab@yahoo.com', 0, '', '', '', '', '', '', '', 2, 0, 'New Member', 0, 1399539199, 0, 1399539199, 1399559008, 0, 0, 0, 0, 4, '5', 0, 0, 0, 0, 0, 3194967, '04-09-1981', '1981-04-09', -1, -1, '178.32.190.135', 0, 1, 0, 0, -1, 0, 0, '?>e6BQ/I(B7gxg=rQzkstyp9>2WLzg', 0, 0, 0, '', 0, 0, 0, 0, 0, 0, 0, 0, 0, 0, 0, 0, '', '', 0, '', 'vb', '', 0, 1, 0, 0, NULL),
(24197, 16, '', 0, 'Disturbed_owl', 'ce9547278025dc54a2fa1aa97b143d9b', '2014-05-08', 'disturbed_owl91@yahoo.com', 0, '', '', '', '', '', '', '', 2, 0, 'Banned', 0, 1399540449, 0, 1439651310, 1439651310, 1439628272, 485014, 77, 0, 4, '5', 0, 0, 0, 0, 0, 3194967, '09-17-1991', '1991-09-17', -1, -1, '39.47.119.123', 0, 1, 0, 0, -1, 0, 0, 'B42Q|<w@Q@xta>7@9#<;[rJ:zCC]p!', 0, 0, 0, '', 0, 0, 23, 2, 0, 0, 0, 0, 0, 0, 0, 0, '7ce6752140a75709036810a294234061', '', 0, '', 'vb', '', 0, 1, 0, 0, NULL),
(24504, 3, '', 0, 'khurramz', '482a7e0cff990494ebe06730c83487a0', '2014-05-17', 'pir_psp@yahoo.com', 0, '', '', '', '', '', '', '', 2, 0, 'New Member', 0, 1400362674, 0, 1400362674, 1400363109, 0, 0, 0, 0, 4, '5', 0, 0, 0, 0, 0, 3194967, '12-12-1975', '1975-12-12', -1, -1, '115.186.115.210', 0, 1, 0, 0, -1, 0, 0, 'yeDcCqm"Ej''z/8Pycu3]+7|Bs"x}Lw', 0, 0, 0, '', 0, 0, 0, 0, 0, 0, 0, 0, 0, 0, 0, 0, '', '', 0, '', 'vb', '', 0, 1, 0, 0, NULL),
(24200, 3, '', 0, 'PDonohue', '83ba3818e1d6d582946e4127a9ac0817', '2014-05-08', 'leo-quade888440@outlook.com', 0, '', '', '', '', '', '', '', 2, 0, 'New Member', 0, 1399543278, 0, 1399543278, 1399543278, 0, 0, 0, 0, 4, '5', 0, 0, 0, 0, 0, 3194967, '01-01-1971', '1971-01-01', -1, -1, '23.94.23.83', 0, 1, 0, 0, -1, 0, 0, 'e/zRjFA#3j_Z)#P<l<!^mVQ[GE6DN<', 0, 0, 0, '', 0, 0, 0, 0, 0, 0, 0, 0, 0, 0, 0, 0, '', '', 0, '', 'vb', '', 0, 1, 0, 0, NULL),
(24201, 2, '', 0, 'Kashifandcompany', '86a578d4ded6d6d13a81b276761f3637', '2014-05-08', 'kashifandcompany@gmail.com', 0, '', '', '', '', '', '', '', 2, 0, 'New Member', 0, 1399543613, 0, 1400334557, 1400488007, 1400334319, 0, 1, 0, 4, '5', 0, 0, 0, 0, 0, 3194967, '12-19-1975', '1975-12-19', -1, -1, '182.185.0.165', 0, 1, 0, 0, -1, 0, 0, '_c''y=>CbDC_CSpM4U[EwVPyE`t/$`F', 0, 0, 0, '', 0, 0, 1, 0, 0, 0, 0, 0, 0, 0, 0, 0, '', '', 0, '', 'vb', '', 0, 1, 0, 0, NULL),
(24202, 3, '', 0, 'HWhitten', '30be71ea7d1a90a4e8b73d92848c5e04', '2014-05-08', 'fabehitxrr@yahoo.com', 0, '', '', '', '', '', '', '', 2, 0, 'New Member', 0, 1399544636, 0, 1399544636, 1399577650, 0, 0, 0, 0, 4, '5', 0, 0, 0, 0, 0, 3194967, '04-02-1970', '1970-04-02', -1, -1, '176.31.213.102', 0, 1, 0, 0, -1, 0, 0, '{@r]_`Xh#l;eofH+Q?}+e%e(q+YA@V', 0, 0, 0, '', 0, 0, 0, 0, 0, 0, 0, 0, 0, 0, 0, 0, '', '', 0, '', 'vb', '', 0, 1, 0, 0, NULL),
(24203, 2, '', 0, 'junaidking', 'e5d13815d8b77c256590b865b161bddc', '2014-05-08', 'junaidking651@yahoo.com', 0, '', '', '', '', '', '', '', 2, 0, 'New Member', 0, 1399546165, 0, 1400082182, 1400082536, 1399915714, 0, 1, 0, 4, '5', 0, 0, 0, 0, 0, 3194967, '12-01-1978', '1978-12-01', -1, -1, '39.42.76.222', 0, 1, 0, 0, -1, 0, 0, '}[}DdqM1e?>9q5.v_H7QwZd|bJ*o)"', 0, 0, 0, '', 0, 0, 0, 0, 0, 0, 0, 0, 0, 0, 0, 0, '', '', 0, '', 'vb', '', 0, 1, 0, 0, NULL);
INSERT INTO `user` (`userid`, `usergroupid`, `membergroupids`, `displaygroupid`, `username`, `password`, `passworddate`, `email`, `styleid`, `parentemail`, `homepage`, `icq`, `aim`, `yahoo`, `msn`, `skype`, `showvbcode`, `showbirthday`, `usertitle`, `customtitle`, `joindate`, `daysprune`, `lastvisit`, `lastactivity`, `lastpost`, `lastpostid`, `posts`, `reputation`, `reputationlevelid`, `timezoneoffset`, `pmpopup`, `avatarid`, `avatarrevision`, `profilepicrevision`, `sigpicrevision`, `options`, `birthday`, `birthday_search`, `maxposts`, `startofweek`, `ipaddress`, `referrerid`, `languageid`, `emailstamp`, `threadedmode`, `autosubscribe`, `pmtotal`, `pmunread`, `salt`, `ipoints`, `infractions`, `warnings`, `infractiongroupids`, `infractiongroupid`, `adminoptions`, `profilevisits`, `friendcount`, `friendreqcount`, `vmunreadcount`, `vmmoderatedcount`, `socgroupinvitecount`, `socgroupreqcount`, `pcunreadcount`, `pcmoderatedcount`, `gmmoderatedcount`, `assetposthash`, `fbuserid`, `fbjoindate`, `fbname`, `logintype`, `fbaccesstoken`, `bloggroupreqcount`, `showblogcss`, `importuserid`, `newrepcount`, `panjo_selling`) VALUES
(24242, 16, '', 0, 'BlazingBlade', '73bf5545686ee426c31e2324e18bebe2', '2014-05-09', 'maliksdamascus@gmail.com', 0, '', '', '', '', '', '', '', 2, 0, 'Banned', 0, 1399636619, 0, 1403374655, 1403374655, 1403019447, 445752, 0, 0, 4, '5', 0, 0, 0, 0, 0, 3194967, '01-01-1990', '1990-01-01', -1, -1, '39.45.28.56', 0, 1, 0, 0, -1, 0, 0, 'u+"9F5?(#"<8h~nu$;>Tdenxjl~e@9', 0, 0, 0, '', 0, 0, 10, 5, 0, 0, 0, 0, 0, 0, 0, 0, '', '', 0, '', 'vb', '', 0, 1, 0, 0, NULL),
(24226, 3, '', 0, 'AFlack', 'a0389a0cc6566d8171a47226ced9d365', '2014-05-09', 'kaylaucba@outlook.com', 0, '', '', '', '', '', '', '', 2, 0, 'New Member', 0, 1399612767, 0, 1399612767, 1399627695, 0, 0, 0, 0, 4, '5', 0, 0, 0, 0, 0, 3194967, '08-31-1982', '1982-08-31', -1, -1, '23.94.47.81', 0, 1, 0, 0, -1, 0, 0, '.)ahbC"Qgf4Kwe''9gi3:q?2I11U,)h', 0, 0, 0, '', 0, 0, 0, 0, 0, 0, 0, 0, 0, 0, 0, 0, '', '', 0, '', 'vb', '', 0, 1, 0, 0, NULL),
(24206, 3, '', 0, 'PParra', 'af9ef28a846cc16cd860b51abccaaca2', '2014-05-08', 'parthenia-parra@elbert.progrespoland.com', 0, '', '', '', '', '', '', '', 2, 0, 'New Member', 0, 1399557943, 0, 1399557943, 1399568320, 0, 0, 0, 0, 4, '5', 0, 0, 0, 0, 0, 3194967, '04-26-1978', '1978-04-26', -1, -1, '46.22.173.76', 0, 1, 0, 0, -1, 0, 0, 'gU*8gWcKt.Nq/kn:3SW,7aaInzQD7z', 0, 0, 0, '', 0, 0, 0, 0, 0, 0, 0, 0, 0, 0, 0, 0, '', '', 0, '', 'vb', '', 0, 1, 0, 0, NULL),
(24207, 3, '', 0, 'abraashulzey8552', '82098179c26a3f0d0fbc5431b0ed2010', '2014-05-08', 'abraashulzey@ymail.com', 0, '', '', '', '', '', '', '', 2, 0, 'New Member', 0, 1399559748, 0, 1399559748, 1399559748, 0, 0, 0, 0, 4, '5.5', 0, 0, 0, 0, 0, 3194903, '09-02-1977', '1977-09-02', -1, -1, '62.209.151.38', 0, 1, 0, 0, -1, 0, 0, 'qK@&;lD_(`a;H6\\.(pesR3WZ=8eh7J', 0, 0, 0, '', 0, 0, 0, 0, 0, 0, 0, 0, 0, 0, 0, 0, '', '', 0, '', 'vb', '', 0, 1, 0, 0, NULL),
(24497, 2, '', 0, 'A409', '024a09b12cd22ed9243d4e26b0c493ec', '2014-05-17', 'asim_1999@hotmail.com', 0, '', '', '', '', '', '', '', 2, 0, 'New Member', 0, 1400339347, 0, 1400516270, 1400516270, 0, 0, 0, 0, 4, '5', 0, 0, 0, 0, 0, 3194967, '01-01-1988', '1988-01-01', -1, -1, '205.206.189.212', 0, 1, 0, 0, -1, 0, 0, 'm>{i*iU\\%\\,F>Akl9EKp>YF?+4R(1+', 0, 0, 0, '', 0, 0, 0, 0, 0, 0, 0, 0, 0, 0, 0, 0, '', '', 0, '', 'vb', '', 0, 1, 0, 0, NULL),
(24209, 3, '', 0, 'M55K', 'd2393d4d93377b75795345b05355ecf6', '2014-05-08', 'hryniewski.e.m.il@gmail.com', 0, '', '', '', '', '', '', '', 2, 0, 'New Member', 0, 1399561432, 0, 1399561432, 1400026310, 0, 0, 0, 0, 4, '5', 0, 0, 0, 0, 0, 3194967, '11-22-1970', '1970-11-22', -1, -1, '23.108.74.182', 0, 1, 0, 0, -1, 0, 0, 'ao#-js(cn71]|43Ei")gb''~fDN<JU0', 0, 0, 0, '', 0, 0, 0, 0, 0, 0, 0, 0, 0, 0, 0, 0, '', '', 0, '', 'vb', '', 0, 1, 0, 0, NULL),
(24211, 3, '', 0, 'NChambles', '78cbb0cd52d1c25dff41a4239167bd43', '2014-05-08', 'hryniews.kie.m.il@gmail.com', 0, '', '', '', '', '', '', '', 2, 0, 'New Member', 0, 1399563770, 0, 1399563770, 1399670797, 0, 0, 0, 0, 4, '5', 0, 0, 0, 0, 0, 3194967, '05-31-1975', '1975-05-31', -1, -1, '23.108.74.59', 0, 1, 0, 0, -1, 0, 0, '%XVi7BE*Re5}3^VD[M)pmxc+]w)h8M', 0, 0, 0, '', 0, 0, 0, 0, 0, 0, 0, 0, 0, 0, 0, 0, '', '', 0, '', 'vb', '', 0, 1, 0, 0, NULL),
(24212, 3, '', 0, 'ASackett', '76a61e89f1e917510f2729d97c4770dc', '2014-05-08', 'daleasuaz@yahoo.com', 0, '', '', '', '', '', '', '', 2, 0, 'New Member', 0, 1399565460, 0, 1399565460, 1399569923, 0, 0, 0, 0, 4, '5', 0, 0, 0, 0, 0, 3194967, '07-03-1985', '1985-07-03', -1, -1, '178.32.186.129', 0, 1, 0, 0, -1, 0, 0, 'E>:MAgXxsp7#k"CJW|;ztl\\7I''BAqd', 0, 0, 0, '', 0, 0, 0, 0, 0, 0, 0, 0, 0, 0, 0, 0, '', '', 0, '', 'vb', '', 0, 1, 0, 0, NULL),
(24213, 3, '', 0, 'ALander', '061c0bc18037414b5f5351078745b7e8', '2014-05-08', 'jewokabycus@hotmail.com', 0, '', '', '', '', '', '', '', 2, 0, 'New Member', 0, 1399568702, 0, 1399568702, 1399568702, 0, 0, 0, 0, 4, '5', 0, 0, 0, 0, 0, 3194967, '11-17-1975', '1975-11-17', -1, -1, '151.237.181.115', 0, 1, 0, 0, -1, 0, 0, '%KhM<f1[0kOnea;lW0&8mVr`3WLzV[', 0, 0, 0, '', 0, 0, 0, 0, 0, 0, 0, 0, 0, 0, 0, 0, '', '', 0, '', 'vb', '', 0, 1, 0, 0, NULL),
(24236, 3, '', 0, 'DSierra', '96b7d49538bf3dc90f264fa0d2f28ab3', '2014-05-09', 'badfly18@outlook.com', 0, '', '', '', '', '', '', '', 2, 0, 'New Member', 0, 1399625184, 0, 1399625184, 1399625184, 0, 0, 0, 0, 4, '5', 0, 0, 0, 0, 0, 3194967, '05-20-1978', '1978-05-20', -1, -1, '198.167.136.221', 0, 1, 0, 0, -1, 0, 0, '6F^-PPWJ~{&OVR4"g&Ms6A=bZj-9jX', 0, 0, 0, '', 0, 0, 0, 0, 0, 0, 0, 0, 0, 0, 0, 0, '', '', 0, '', 'vb', '', 0, 1, 0, 0, NULL),
(24244, 3, '', 0, 'ABattarbe', '39778dae7df1d44a59d805e949c6efc0', '2014-05-09', 'antoinetteczgerdsen@yahoo.com', 0, '', '', '', '', '', '', '', 2, 0, 'New Member', 0, 1399637219, 0, 1399637219, 1399642823, 0, 0, 0, 0, 4, '5', 0, 0, 0, 0, 0, 3194967, '09-08-1972', '1972-09-08', -1, -1, '69.12.91.37', 0, 1, 0, 0, -1, 0, 0, '=227f2c^\\j7qtfCx@?%UV}C=nSL)uq', 0, 0, 0, '', 0, 0, 0, 0, 0, 0, 0, 0, 0, 0, 0, 0, '', '', 0, '', 'vb', '', 0, 1, 0, 0, NULL),
(24238, 2, '', 0, 'zahidrehman', '8582f417ade3e763f7a844bbcb6804ab', '2014-05-09', 'zahidbahi007@gmail.com', 0, '', '', '', '', '', '', '', 2, 0, 'New Member', 0, 1399625665, 0, 1399625665, 1399626026, 0, 0, 0, 0, 4, '5', 0, 0, 0, 0, 0, 3194967, '07-22-1990', '1990-07-22', -1, -1, '39.53.145.224', 0, 1, 0, 0, -1, 0, 0, 'agm((O,PG7`xC$/zb]*+S6$o]b~@8h', 0, 0, 0, '', 0, 0, 0, 0, 0, 0, 0, 0, 0, 0, 0, 0, '', '', 0, '', 'vb', '', 0, 1, 0, 0, NULL),
(24243, 3, '', 0, 'LDearborn', 'be163af686d090d19b8783b43717463d', '2014-05-09', 'latanya-dearborn42@c02.info', 0, '', '', '', '', '', '', '', 2, 0, 'New Member', 0, 1399637037, 0, 1399637037, 1399646605, 0, 0, 0, 0, 4, '5', 0, 0, 0, 0, 0, 3194967, '07-17-1972', '1972-07-17', -1, -1, '192.171.236.82', 0, 1, 0, 0, -1, 0, 0, 'DNL1Cv%fM`Y4lu9b#rMi%kKGkF}QHE', 0, 0, 0, '', 0, 0, 0, 0, 0, 0, 0, 0, 0, 0, 0, 0, '', '', 0, '', 'vb', '', 0, 1, 0, 0, NULL),
(24240, 3, '', 0, 'parickmyandext1695', '912d7f428d9c91cb1b6bc1fac71939c6', '2014-05-09', 'parickmyandext@ymail.com', 0, '', '', '', '', '', '', '', 2, 0, 'New Member', 0, 1399627783, 0, 1399627783, 1399627783, 0, 0, 0, 0, 4, '6', 0, 0, 0, 0, 0, 3195031, '02-12-1977', '1977-02-12', -1, -1, '72.37.249.124', 0, 1, 0, 0, -1, 0, 0, '7Z,JdoKzRAj2([sbu+]*&a/\\YZxwE_', 0, 0, 0, '', 0, 0, 0, 0, 0, 0, 0, 0, 0, 0, 0, 0, '', '', 0, '', 'vb', '', 0, 1, 0, 0, NULL),
(24254, 3, '', 0, 'wisalafridi', 'caea29f0482e021e17c3f70f7178a076', '2014-05-09', 'tina_zaman11@yahoo.com', 0, '', '', '', '', '', '', '', 2, 0, 'New Member', 0, 1399659247, 0, 1399659247, 1399660271, 0, 0, 0, 0, 4, '5', 0, 0, 0, 0, 0, 3194967, '09-01-1986', '1986-09-01', -1, -1, '119.154.154.53', 0, 1, 0, 0, -1, 0, 0, 'Lyug"zR`zF}Zx|cC3r#\\wG>`.Y|~cq', 0, 0, 0, '', 0, 0, 0, 0, 0, 0, 0, 0, 0, 0, 0, 0, '', '', 0, '', 'vb', '', 0, 1, 0, 0, NULL),
(24255, 3, '', 0, 'LLovejoy', 'adce20ef753775f3ddcfef5d3392441c', '2014-05-09', 'glamorousaddition41@outlook.com', 0, '', '', '', '', '', '', '', 2, 0, 'New Member', 0, 1399660056, 0, 1399660056, 1399660056, 0, 0, 0, 0, 4, '5', 0, 0, 0, 0, 0, 3194967, '08-11-1978', '1978-08-11', -1, -1, '69.12.64.14', 0, 1, 0, 0, -1, 0, 0, '#4,pI4Y#C=.D9~!*yF}E~Jm\\UkXAIn', 0, 0, 0, '', 0, 0, 0, 0, 0, 0, 0, 0, 0, 0, 0, 0, '', '', 0, '', 'vb', '', 0, 1, 0, 0, NULL),
(24256, 3, '', 0, 'GMerideth', '84f6f771a86089e2c834ed9c239bda1b', '2014-05-09', 'wilmactbr@outlook.com', 0, '', '', '', '', '', '', '', 2, 0, 'New Member', 0, 1399669709, 0, 1399669709, 1399685605, 0, 0, 0, 0, 4, '5', 0, 0, 0, 0, 0, 3194967, '08-09-1971', '1971-08-09', -1, -1, '96.127.190.61', 0, 1, 0, 0, -1, 0, 0, 'jDAa!h''Lh=49EqAD\\K+`|!F!.WH@.1', 0, 0, 0, '', 0, 0, 0, 0, 0, 0, 0, 0, 0, 0, 0, 0, '', '', 0, '', 'vb', '', 0, 1, 0, 0, NULL),
(24258, 3, '', 0, 'D74S', '045baba90d6dd3b0fe73447f602ae51d', '2014-05-09', 'tadesubupoc@yahoo.com', 0, '', '', '', '', '', '', '', 2, 0, 'New Member', 0, 1399672604, 0, 1399672604, 1399688708, 0, 0, 0, 0, 4, '5', 0, 0, 0, 0, 0, 3194967, '04-09-1983', '1983-04-09', -1, -1, '165.231.12.212', 0, 1, 0, 0, -1, 0, 0, 'EP;A"o?<;Yl\\b[I0O8?1vSm>U=+|H@', 0, 0, 0, '', 0, 0, 0, 0, 0, 0, 0, 0, 0, 0, 0, 0, '', '', 0, '', 'vb', '', 0, 1, 0, 0, NULL),
(24400, 3, '', 0, 'SMickens', 'a44f9a8d308b5e6f6b2eada71a0c7245', '2014-05-14', 'cuppernellk@hotmail.com', 0, '', '', '', '', '', '', '', 2, 0, 'New Member', 0, 1400067339, 0, 1400067339, 1400131748, 0, 0, 0, 0, 4, '5', 0, 0, 0, 0, 0, 3194967, '03-16-1983', '1983-03-16', -1, -1, '41.190.232.250', 0, 1, 0, 0, -1, 0, 0, 'zM(N!FhN^pa![3C3dHilT`da"@k,?F', 0, 0, 0, '', 0, 0, 0, 0, 0, 0, 0, 0, 0, 0, 0, 0, '', '', 0, '', 'vb', '', 0, 1, 0, 0, NULL),
(24259, 3, '', 0, 'RZ33', '29ef53a1915312fe14997bf3bdc615c0', '2014-05-10', 'knottyfable3696@outlook.com', 0, '', '', '', '', '', '', '', 2, 0, 'New Member', 0, 1399689310, 0, 1399689310, 1399696486, 0, 0, 0, 0, 4, '5', 0, 0, 0, 0, 0, 3194967, '09-03-1981', '1981-09-03', -1, -1, '107.155.81.27', 0, 1, 0, 0, -1, 0, 0, 'pp:W@HrrnS{fFDZvFM:;B.X@IGO[h0', 0, 0, 0, '', 0, 0, 0, 0, 0, 0, 0, 0, 0, 0, 0, 0, '', '', 0, '', 'vb', '', 0, 1, 0, 0, NULL),
(24477, 3, '', 0, 'CHeidelbe', '97c444b50884c36c0d6fcd4f88b2da31', '2014-05-16', 'keishatheusebio@yahoo.com', 0, '', '', '', '', '', '', '', 2, 0, 'New Member', 0, 1400269165, 0, 1400269165, 1400303238, 0, 0, 0, 0, 4, '5', 0, 0, 0, 0, 0, 3194967, '03-24-1983', '1983-03-24', -1, -1, '69.12.67.7', 0, 1, 0, 0, -1, 0, 0, 'Ak*f>k4"#z2alI<-lkq^)HRv9U+YD7', 0, 0, 0, '', 0, 0, 0, 0, 0, 0, 0, 0, 0, 0, 0, 0, '', '', 0, '', 'vb', '', 0, 1, 0, 0, NULL),
(24262, 3, '', 0, 'DHerrmann', '99dda0d612f9d908d8e83a5f2ee47f7a', '2014-05-10', 'mqxeycvryk@yahoo.com', 0, '', '', '', '', '', '', '', 2, 0, 'New Member', 0, 1399694294, 0, 1399694294, 1399707323, 0, 0, 0, 0, 4, '5', 0, 0, 0, 0, 0, 3194967, '08-23-1970', '1970-08-23', -1, -1, '95.154.216.252', 0, 1, 0, 0, -1, 0, 0, 'XX)@PP6*!;i78H3hP+;''o{xJ&eLNke', 0, 0, 0, '', 0, 0, 0, 0, 0, 0, 0, 0, 0, 0, 0, 0, '', '', 0, '', 'vb', '', 0, 1, 0, 0, NULL),
(24389, 3, '', 0, 'Shantae06', 'd5db9ddc2036c8aa749dc81e4dd8c2db', '2014-05-13', 'emmabzvfqyac@outlook.com', 0, '', '', '', '', '', '', '', 2, 0, 'New Member', 0, 1400020670, 0, 1400020670, 1400117543, 0, 0, 0, 0, 4, '5', 0, 0, 0, 0, 0, 3194967, '11-22-1976', '1976-11-22', -1, -1, '188.208.2.6', 0, 1, 0, 0, -1, 0, 0, '&Wpt<;(@P]dy$D{CD{G}-6mJz[!P5U', 0, 0, 0, '', 0, 0, 0, 0, 0, 0, 0, 0, 0, 0, 0, 0, '', '', 0, '', 'vb', '', 0, 1, 0, 0, NULL),
(24264, 3, '', 0, 'SF10', '4819ee46c6364dde15e3d780f5febcd7', '2014-05-10', 'lesaitey@hotmail.com', 0, '', '', '', '', '', '', '', 2, 0, 'New Member', 0, 1399697346, 0, 1399697346, 1399697346, 0, 0, 0, 0, 4, '5', 0, 0, 0, 0, 0, 3194967, '09-01-1970', '1970-09-01', -1, -1, '23.81.201.230', 0, 1, 0, 0, -1, 0, 0, 'P<P3W$IVa]^0zk^E1!owEFbAM!|8*J', 0, 0, 0, '', 0, 0, 0, 0, 0, 0, 0, 0, 0, 0, 0, 0, '', '', 0, '', 'vb', '', 0, 1, 0, 0, NULL),
(24489, 3, '', 0, 'Bilalhz75', 'f75d8daf2daa44f7b0179113cea0ef92', '2014-05-17', 'Bilalhz75@hotmail.com', 0, '', '', '', '', '', '', '', 2, 0, 'New Member', 0, 1400322150, 0, 1400322150, 1400322507, 0, 0, 0, 0, 4, '5', 0, 0, 0, 0, 0, 3194967, '03-02-1977', '1977-03-02', -1, -1, '87.109.80.180', 0, 1, 0, 0, -1, 0, 0, 'd\\\\H<]:Z&Y"Vra3,JY\\vY(c$[FqI}t', 0, 0, 0, '', 0, 0, 0, 0, 0, 0, 0, 0, 0, 0, 0, 0, '', '', 0, '', 'vb', '', 0, 1, 0, 0, NULL),
(24266, 2, '', 0, 'wahabali', '1318dd7058b71813c96265da1b5670e8', '2014-05-10', 'abdulwahab.84@gmail.com', 0, '', '', '', '', '', '', '', 2, 0, 'New Member', 0, 1399701568, 0, 1399780663, 1400070345, 0, 0, 0, 0, 4, '5', 0, 0, 0, 0, 0, 3194967, '04-15-1984', '1984-04-15', -1, -1, '202.69.12.238', 0, 1, 0, 0, -1, 0, 0, '=5,mUc#<I+Dm2n>;66Vde''\\]1X++6,', 0, 0, 0, '', 0, 0, 0, 0, 0, 0, 0, 0, 0, 0, 0, 0, '', '', 0, '', 'vb', '', 0, 1, 0, 0, NULL),
(24498, 2, '', 0, 'mahota', '018fa100783ae8259233b1c65ba62eb4', '2014-05-17', 'mahota@gmail.com', 0, '', '', '', '', '', '', '', 2, 0, 'New Member', 0, 1400340394, 0, 1400340394, 1400342008, 0, 0, 0, 0, 4, '5', 0, 0, 0, 0, 0, 3194967, '02-29-1976', '1976-02-29', -1, -1, '110.38.62.14', 0, 1, 0, 0, -1, 0, 0, 'E]tM}JP&^wBZ7`#s&gS^n$tjNF@U\\k', 0, 0, 0, '', 0, 0, 1, 0, 0, 0, 0, 0, 0, 0, 0, 0, '', '', 0, '', 'vb', '', 0, 1, 0, 0, NULL),
(24312, 2, '', 0, 'shah jii', '1b131e492219d7a689ebb0ea995c121e', '2014-05-11', 'texin.za@gmail.com', 0, '', '', '', '', '', '', '', 2, 3, 'New Member', 0, 1399824215, 0, 1426087690, 1429886334, 1418733720, 469332, 13, 0, 4, '5', 0, 0, 0, 0, 0, 3194903, '07-30-1986', '1986-07-30', -1, -1, '180.178.191.53', 0, 1, 0, 0, -1, 0, 0, 'hwQYW\\"s;jRy/J83onU\\t:[+n5z-.*', 0, 0, 0, '', 0, 0, 1, 0, 0, 0, 0, 0, 0, 0, 0, 0, '', '', 0, '', 'vb', '', 0, 1, 0, 0, NULL),
(24276, 2, '', 0, 'mani82', '5777bbabe34f160728b42f883b0fd05e', '2014-05-10', 'usmanmirza8t2@gmail.com', 0, '', '', '', '', '', '', '', 2, 0, 'New Member', 0, 1399734468, 0, 1400400892, 1400404685, 0, 0, 0, 0, 4, '5', 0, 0, 0, 0, 0, 3194967, '06-09-1982', '1982-06-09', -1, -1, '119.154.176.178', 0, 1, 0, 0, -1, 0, 0, 'a*MOJiagkDhHbQz%,WK!}ck!%)[2,|', 0, 0, 0, '', 0, 0, 0, 0, 0, 0, 0, 0, 0, 0, 0, 0, '', '', 0, '', 'vb', '', 0, 1, 0, 0, NULL),
(24277, 3, '', 0, 'OMoulden', '60a1dfb13738e8a11f0a9c587d465eeb', '2014-05-10', 'fuqevevoxuko@yahoo.com', 0, '', '', '', '', '', '', '', 2, 0, 'New Member', 0, 1399734508, 0, 1399734508, 1399743829, 0, 0, 0, 0, 4, '5', 0, 0, 0, 0, 0, 3194967, '05-31-1983', '1983-05-31', -1, -1, '107.161.85.77', 0, 1, 0, 0, -1, 0, 0, '\\W8,NPfZ<zX5I"![P<"|?;9%h]@?b''', 0, 0, 0, '', 0, 0, 0, 0, 0, 0, 0, 0, 0, 0, 0, 0, '', '', 0, '', 'vb', '', 0, 1, 0, 0, NULL),
(24278, 3, '', 0, 'krinkov', 'e6ef5ab32a721923db6716febcc0ae33', '2014-05-10', 'rttt2893@yahoo.com', 0, '', '', '', '', '', '', '', 2, 0, 'New Member', 0, 1399736281, 0, 1399736281, 1399736294, 0, 0, 0, 0, 4, '5', 0, 0, 0, 0, 0, 3194967, '08-02-1992', '1992-08-02', -1, -1, '63.141.204.76', 0, 1, 0, 0, -1, 0, 0, ';Z&o:#*d~F9Wtw.CEj?0xQxAg&jI7f', 0, 0, 0, '', 0, 0, 0, 0, 0, 0, 0, 0, 0, 0, 0, 0, '', '', 0, '', 'vb', '', 0, 1, 0, 0, NULL),
(24301, 2, '', 0, 'asiflashare', '3d42cd6a387f7072f3f3be4472cbeb61', '2014-05-11', 'asiflashare@gmail.com', 0, '', '', '', '', '', '', '', 2, 0, 'New Member', 0, 1399803164, 0, 1399803164, 1399803501, 0, 0, 0, 0, 4, '5', 0, 0, 0, 0, 0, 3194967, '04-04-1984', '1984-04-04', -1, -1, '182.186.34.186', 16374, 1, 0, 0, -1, 0, 0, 'S(,)8%Op7}!GrB.Qu}#sEr!]x''g]VL', 0, 0, 0, '', 0, 0, 0, 0, 0, 0, 0, 0, 0, 0, 0, 0, '', '', 0, '', 'vb', '', 0, 1, 0, 0, NULL),
(24298, 3, '', 0, 'sajadkhans', 'f4fa6a7e3394d699a786ab3f08a4da81', '2014-05-11', 'sajad_yaqoob_khan@yahoo.com', 0, '', '', '', '', '', '', '', 2, 0, 'New Member', 0, 1399799042, 0, 1399799042, 1399799042, 0, 0, 0, 0, 4, '5', 0, 0, 0, 0, 0, 3195031, '05-04-1987', '1987-05-04', -1, -1, '182.181.174.79', 0, 1, 0, 0, -1, 0, 0, '~cO&<Ia7H[)qz]sFCBUPzBWYOEo>BH', 0, 0, 0, '', 0, 0, 0, 0, 0, 0, 0, 0, 0, 0, 0, 0, '', '', 0, '', 'vb', '', 0, 1, 0, 0, NULL),
(24284, 3, '', 0, 'VGalvin', '170c121f6be3935b6bac94975b89d6dc', '2014-05-10', 'michael.dufre@agilaspire.com', 0, '', '', '', '', '', '', '', 2, 0, 'New Member', 0, 1399747874, 0, 1399747874, 1399747874, 0, 0, 0, 0, 4, '5', 0, 0, 0, 0, 0, 3194967, '12-24-1975', '1975-12-24', -1, -1, '23.94.63.53', 0, 1, 0, 0, -1, 0, 0, '~W1OS/`<3)Ds=%}$$9h+?*N`Q4Aq0&', 0, 0, 0, '', 0, 0, 0, 0, 0, 0, 0, 0, 0, 0, 0, 0, '', '', 0, '', 'vb', '', 0, 1, 0, 0, NULL),
(24285, 2, '', 0, 'Machine Gun Preacher', '1c517b66b182b816706fd7662c8e23d4', '2014-05-10', 'alimurtazadk@gmail.com', 0, '', '', '', '', '', '', '', 2, 0, 'New Member', 0, 1399748159, 0, 1399749418, 1399749418, 0, 0, 0, 0, 4, '5', 0, 0, 0, 0, 0, 3194967, '01-05-1987', '1987-01-05', -1, -1, '65.49.14.159', 0, 1, 0, 0, -1, 0, 0, '7''PL:VH=WDVR3KOyt^=;^[|]rWZ[-R', 0, 0, 0, '', 0, 0, 0, 0, 0, 0, 0, 0, 0, 0, 0, 0, '', '', 0, '', 'vb', '', 0, 1, 0, 0, NULL),
(24286, 3, '', 0, 'SVentimig', 'd783dddbf103e9852d61ca7f3820601a', '2014-05-10', 'auspiciouspiffl2894@outlook.com', 0, '', '', '', '', '', '', '', 2, 0, 'New Member', 0, 1399750984, 0, 1399750984, 1399758484, 0, 0, 0, 0, 4, '5', 0, 0, 0, 0, 0, 3194967, '01-23-1975', '1975-01-23', -1, -1, '109.169.5.239', 0, 1, 0, 0, -1, 0, 0, '"nxk2=:jqW@O9?5{j*8r~0@O;S$2>8', 0, 0, 0, '', 0, 0, 0, 0, 0, 0, 0, 0, 0, 0, 0, 0, '', '', 0, '', 'vb', '', 0, 1, 0, 0, NULL),
(24311, 3, '', 0, 'RMerritt', '17eebbe23d884ccb9d9d9e7e3b59e93f', '2014-05-11', 'remona_merritt83@progrespolska.net', 0, '', '', '', '', '', '', '', 2, 0, 'New Member', 0, 1399823516, 0, 1399823516, 1399827515, 0, 0, 0, 0, 4, '5', 0, 0, 0, 0, 0, 3194967, '12-09-1982', '1982-12-09', -1, -1, '83.11.255.250', 0, 1, 0, 0, -1, 0, 0, 'K^|^=qbl3E]>YRl*ijO=QrDHpk=~2R', 0, 0, 0, '', 0, 0, 0, 0, 0, 0, 0, 0, 0, 0, 0, 0, '', '', 0, '', 'vb', '', 0, 1, 0, 0, NULL),
(24288, 3, '', 0, 'BRodway', '005bfe8f2c275545f04f1bd7a6075dc7', '2014-05-10', 'barrett-rodway@kienthuccuatoi.com', 0, '', '', '', '', '', '', '', 2, 0, 'New Member', 0, 1399762075, 0, 1399762075, 1399769920, 0, 0, 0, 0, 4, '5', 0, 0, 0, 0, 0, 3194967, '10-16-1976', '1976-10-16', -1, -1, '50.2.223.96', 0, 1, 0, 0, -1, 0, 0, 'D2c"oAn|hsi`?Wk!kyia3q8gAl~*sK', 0, 0, 0, '', 0, 0, 0, 0, 0, 0, 0, 0, 0, 0, 0, 0, '', '', 0, '', 'vb', '', 0, 1, 0, 0, NULL),
(24289, 3, '', 0, 'PLWK', 'd21d6d093833e143247b2e06e1101234', '2014-05-10', 'phil-spargo20@kienthuccuatoi.com', 0, '', '', '', '', '', '', '', 2, 0, 'New Member', 0, 1399762575, 0, 1399762575, 1399769960, 0, 0, 0, 0, 4, '5', 0, 0, 0, 0, 0, 3194967, '01-21-1981', '1981-01-21', -1, -1, '23.231.103.172', 0, 1, 0, 0, -1, 0, 0, 'v6=b\\i]^s_L(&/T@M6&}8D9JfI$HYH', 0, 0, 0, '', 0, 0, 0, 0, 0, 0, 0, 0, 0, 0, 0, 0, '', '', 0, '', 'vb', '', 0, 1, 0, 0, NULL),
(24308, 3, '', 0, 'CLangford', '6414454b0e08b6b4977e7e5124df64b2', '2014-05-11', 'hryniew.s.kiem.il@gmail.com', 0, '', '', '', '', '', '', '', 2, 0, 'New Member', 0, 1399816756, 0, 1399816756, 1400017898, 0, 0, 0, 0, 4, '5', 0, 0, 0, 0, 0, 3194967, '06-10-1979', '1979-06-10', -1, -1, '23.108.196.40', 0, 1, 0, 0, -1, 0, 0, 'e</Y[>=n,quG)008W:Zy.G!ymP0by6', 0, 0, 0, '', 0, 0, 0, 0, 0, 0, 0, 0, 0, 0, 0, 0, '', '', 0, '', 'vb', '', 0, 1, 0, 0, NULL),
(24307, 3, '', 0, 'Y7186', '0d3240bf9045db9ecc93b9e1d6526258', '2014-05-11', 'cherlyjmqwi@outlook.com', 0, '', '', '', '', '', '', '', 2, 0, 'New Member', 0, 1399816436, 0, 1399816436, 1399816436, 0, 0, 0, 0, 4, '5', 0, 0, 0, 0, 0, 3194967, '08-15-1980', '1980-08-15', -1, -1, '23.94.19.248', 0, 1, 0, 0, -1, 0, 0, 'QyY:~[j^|''z.cA~n$QYzJ,3PxcZthh', 0, 0, 0, '', 0, 0, 0, 0, 0, 0, 0, 0, 0, 0, 0, 0, '', '', 0, '', 'vb', '', 0, 1, 0, 0, NULL),
(24293, 2, '', 0, 'ehsanawan242', '6957a5f20a5bc1f319edc3c123b10bbf', '2014-05-11', 'ehsanawan242@gmail.com', 0, '', '', '', '', '', '', '', 2, 0, 'New Member', 0, 1399781229, 0, 1399781839, 1399794275, 0, 0, 0, 0, 4, '5', 0, 0, 0, 0, 0, 3194967, '11-25-1985', '1985-11-25', -1, -1, '182.186.44.243', 0, 1, 0, 0, -1, 0, 0, '*1cx,Fo}gTSj&qtaiwB]%26<fRQ<2f', 0, 0, 0, '', 0, 0, 0, 0, 0, 0, 0, 0, 0, 0, 0, 0, '', '', 0, '', 'vb', '', 0, 1, 0, 0, NULL),
(24395, 3, '', 0, 'GHosking', '6d1cabddbf4b41129c9c3e74666d579b', '2014-05-14', 'georgianna-hosking75@kienthuccuatoi.com', 0, '', '', '', '', '', '', '', 2, 0, 'New Member', 0, 1400044597, 0, 1400044597, 1400051594, 0, 0, 0, 0, 4, '5', 0, 0, 0, 0, 0, 3194967, '07-07-1984', '1984-07-07', -1, -1, '107.155.80.225', 0, 1, 0, 0, -1, 0, 0, 'q!ViaaJOnsM}57~-^QTgf&>@V,anCx', 0, 0, 0, '', 0, 0, 0, 0, 0, 0, 0, 0, 0, 0, 0, 0, '', '', 0, '', 'vb', '', 0, 1, 0, 0, NULL),
(24295, 3, '', 0, 'KTamayo', '0f78116b77475ebe76c12b14a20ae4cb', '2014-05-11', 'sue90@wiserocket.com', 0, '', '', '', '', '', '', '', 2, 0, 'New Member', 0, 1399788374, 0, 1399788374, 1399860726, 0, 0, 0, 0, 4, '5', 0, 0, 0, 0, 0, 3194967, '09-14-1982', '1982-09-14', -1, -1, '172.245.57.49', 0, 1, 0, 0, -1, 0, 0, '''Az''DT@*8p$k:o*46T+,Z]~FpV+Cx,', 0, 0, 0, '', 0, 0, 0, 0, 0, 0, 0, 0, 0, 0, 0, 0, '', '', 0, '', 'vb', '', 0, 1, 0, 0, NULL),
(24396, 3, '', 0, 'LBanvard', '44638bfa900afd88d57d559bc498d930', '2014-05-14', 'cottycotswold@outlook.com', 0, '', '', '', '', '', '', '', 2, 0, 'New Member', 0, 1400045730, 0, 1400045730, 1400050016, 0, 0, 0, 0, 4, '5', 0, 0, 0, 0, 0, 3194967, '06-21-1981', '1981-06-21', -1, -1, '69.12.77.167', 0, 1, 0, 0, -1, 0, 0, 'PkeI,nN+xc;>C~uWl??_zkg.a"=S5k', 0, 0, 0, '', 0, 0, 0, 0, 0, 0, 0, 0, 0, 0, 0, 0, '', '', 0, '', 'vb', '', 0, 1, 0, 0, NULL),
(24358, 3, '', 0, 'HReinoso', '1ad4a02c094b0925223e841b7d58f718', '2014-05-13', 'tyxugedutyw@yahoo.com', 0, '', '', '', '', '', '', '', 2, 0, 'New Member', 0, 1399935907, 0, 1399935907, 1399937807, 0, 0, 0, 0, 4, '5', 0, 0, 0, 0, 0, 3194967, '12-14-1977', '1977-12-14', -1, -1, '170.130.179.155', 0, 1, 0, 0, -1, 0, 0, '%^~stiP+l`K6%t\\QpJoS!Gu5QD/@Is', 0, 0, 0, '', 0, 0, 0, 0, 0, 0, 0, 0, 0, 0, 0, 0, '', '', 0, '', 'vb', '', 0, 1, 0, 0, NULL),
(24359, 3, '', 0, 'Syed Fahim abbas hamdani', 'fecbb97422cfef7cd030d95d0bfe0e0f', '2014-05-13', 'Fahim.hamdani@yahoo.com', 0, '', '', '', '', '', '', '', 2, 0, 'New Member', 0, 1399944445, 0, 1399944445, 1399945067, 0, 0, 0, 0, 4, '5', 0, 0, 0, 0, 0, 3194967, '05-25-1980', '1980-05-25', -1, -1, '110.39.207.143', 0, 1, 0, 0, -1, 0, 0, '?oAUsJ`K<~}h"|D6hVt7q''x4&JOktH', 0, 0, 0, '', 0, 0, 0, 0, 0, 0, 0, 0, 0, 0, 0, 0, '', '', 0, '', 'vb', '', 0, 1, 0, 0, NULL),
(24316, 3, '', 0, 'LMcCorkle', 'b2ee1861feaeab34b075e6f41254d106', '2014-05-11', 'beautifulsadnesem614@outlook.com', 0, '', '', '', '', '', '', '', 2, 0, 'New Member', 0, 1399830484, 0, 1399830484, 1399837698, 0, 0, 0, 0, 4, '5', 0, 0, 0, 0, 0, 3194967, '02-01-1979', '1979-02-01', -1, -1, '5.157.55.69', 0, 1, 0, 0, -1, 0, 0, '>$2^1Ls-n,_|EU(|[=Ne[?J+>0.`8J', 0, 0, 0, '', 0, 0, 0, 0, 0, 0, 0, 0, 0, 0, 0, 0, '', '', 0, '', 'vb', '', 0, 1, 0, 0, NULL),
(24318, 2, '', 0, 'Epic', 'd63b9ad4a735bf2e54eb62ce2c49b980', '2014-05-11', 'fahadkhan252@yahoo.com', 0, '', '', '', '', '', '', '', 2, 0, 'Member', 0, 1399832002, 0, 1406909825, 1406923462, 1406846992, 452657, 78, 0, 4, '5', 0, 0, 0, 0, 0, 3194967, '12-16-1990', '1990-12-16', -1, -1, '39.41.126.239', 0, 1, 0, 0, -1, 0, 0, '?5dhoI''60mI''^Aza=E%_zOZs_S%pC0', 0, 0, 0, '', 0, 0, 13, 2, 0, 0, 0, 0, 0, 0, 0, 0, '', '', 0, '', 'vb', '', 0, 1, 0, 0, NULL),
(24374, 2, '', 0, 'Ammar Yasir', 'e35f0d41075490a3a7bad41b5731bc0e', '2014-05-13', 'princegoogle@yahoo.com', 0, '', '', '', '', '', '', '', 2, 0, 'New Member', 0, 1399982815, 0, 1399982815, 1399983654, 0, 0, 0, 0, 4, '5', 0, 0, 0, 0, 0, 3194967, '01-08-1984', '1984-01-08', -1, -1, '39.47.109.1', 0, 1, 0, 0, -1, 0, 0, '=.`pLdQ-v;>:o>!ja?vV{y3+\\7<C7i', 0, 0, 0, '', 0, 0, 0, 0, 0, 0, 0, 0, 0, 0, 0, 0, '', '', 0, '', 'vb', '', 0, 1, 0, 0, NULL),
(24320, 3, '', 0, 'CHinchcli', '44887e731796806d9d3660bf662a0806', '2014-05-11', 'sloanefish@outlook.com', 0, '', '', '', '', '', '', '', 2, 0, 'New Member', 0, 1399837734, 0, 1399837734, 1399846257, 0, 0, 0, 0, 4, '5', 0, 0, 0, 0, 0, 3194967, '09-30-1975', '1975-09-30', -1, -1, '69.12.77.156', 0, 1, 0, 0, -1, 0, 0, '$zT]_5\\Oj`23Q&`p+}9Pya?@A_3h8W', 0, 0, 0, '', 0, 0, 0, 0, 0, 0, 0, 0, 0, 0, 0, 0, '', '', 0, '', 'vb', '', 0, 1, 0, 0, NULL),
(24397, 3, '', 0, 'LGarden', 'eb85a6dfcc0cf2c83fabb75931b3743c', '2014-05-14', 'welchssvky3co@hotmail.com', 0, '', '', '', '', '', '', '', 2, 0, 'New Member', 0, 1400050207, 0, 1400050207, 1400494921, 0, 0, 0, 0, 4, '5', 0, 0, 0, 0, 0, 3194967, '11-25-1983', '1983-11-25', -1, -1, '162.248.102.239', 0, 1, 0, 0, -1, 0, 0, 'h~Hg/)j(I8qB/SWN!<ex)''Igen]<?K', 0, 0, 0, '', 0, 0, 0, 0, 0, 0, 0, 0, 0, 0, 0, 0, '', '', 0, '', 'vb', '', 0, 1, 0, 0, NULL),
(24323, 3, '', 0, 'TOdonnell', '30c7534f953fe92fdcf6ba55503e5822', '2014-05-12', 'hpronkmrk@yahoo.com', 0, '', '', '', '', '', '', '', 2, 0, 'New Member', 0, 1399853698, 0, 1399853698, 1399889631, 0, 0, 0, 0, 4, '5', 0, 0, 0, 0, 0, 3194967, '01-27-1978', '1978-01-27', -1, -1, '198.175.125.23', 0, 1, 0, 0, -1, 0, 0, ']s''m%cfCLX/xqX)UyX_B|@*uLJx3,l', 0, 0, 0, '', 0, 0, 0, 0, 0, 0, 0, 0, 0, 0, 0, 0, '', '', 0, '', 'vb', '', 0, 1, 0, 0, NULL),
(24382, 3, '', 0, 'MGarris', 'f3131f0d7fcd4e4976e89e03cb01c029', '2014-05-13', 'walters4nksbqi@hotmail.com', 0, '', '', '', '', '', '', '', 2, 0, 'New Member', 0, 1400005122, 0, 1400005122, 1401090846, 0, 0, 0, 0, 4, '5', 0, 0, 0, 0, 0, 3194967, '03-31-1978', '1978-03-31', -1, -1, '199.180.135.235', 0, 1, 0, 0, -1, 0, 0, '8}6sxgJEPE>+a:)`[N8q@}L60}}(L(', 0, 0, 0, '', 0, 0, 0, 0, 0, 0, 0, 0, 0, 0, 0, 0, '', '', 0, '', 'vb', '', 0, 1, 0, 0, NULL),
(24383, 2, '', 0, 'Zhgoreja', 'dc552002d1439f50d4c822643b9d6744', '2014-05-13', 'zhgoreja@gmail.com', 0, '', '', '', '', '', '', '', 2, 0, 'New Member', 0, 1400012903, 0, 1400012903, 1400013850, 0, 0, 0, 0, 4, '5', 0, 0, 0, 0, 0, 3194967, '06-01-1977', '1977-06-01', -1, -1, '39.55.4.155', 0, 1, 0, 0, -1, 0, 0, 'KL9v]1(9BQ}1g?T$''"Qe*Pbnc&[L}m', 0, 0, 0, '', 0, 0, 0, 0, 0, 0, 0, 0, 0, 0, 0, 0, '', '', 0, '', 'vb', '', 0, 1, 0, 0, NULL),
(24328, 3, '', 0, 'ELooney', '798d7f7756001e335a760e246e7e0005', '2014-05-12', 'lyonvzend@yahoo.com', 0, '', '', '', '', '', '', '', 2, 0, 'New Member', 0, 1399869517, 0, 1399869517, 1399905744, 0, 0, 0, 0, 4, '5', 0, 0, 0, 0, 0, 3194967, '01-31-1981', '1981-01-31', -1, -1, '198.46.153.233', 0, 1, 0, 0, -1, 0, 0, '2Cb+G^\\ZUP5b5iy^IR(cz&FjY,6~FN', 0, 0, 0, '', 0, 0, 0, 0, 0, 0, 0, 0, 0, 0, 0, 0, '', '', 0, '', 'vb', '', 0, 1, 0, 0, NULL),
(24329, 3, '', 0, 'TTLL', '897807803085d031674a9a6193c7fdaa', '2014-05-12', 'hryniewsk.ie.mil@gmail.com', 0, '', '', '', '', '', '', '', 2, 0, 'New Member', 0, 1399871395, 0, 1399871395, 1400436461, 0, 0, 0, 0, 4, '5', 0, 0, 0, 0, 0, 3194967, '12-08-1977', '1977-12-08', -1, -1, '23.108.196.49', 0, 1, 0, 0, -1, 0, 0, 'k:_V!P[O-^F]wzX2:R{IcH~a(YS?lK', 0, 0, 0, '', 0, 0, 0, 0, 0, 0, 0, 0, 0, 0, 0, 0, '', '', 0, '', 'vb', '', 0, 1, 0, 0, NULL),
(24480, 3, '', 0, 'imran ashrafi1', 'be33ad5b39a1972fa1eb392e0c23030e', '2014-05-16', 'ashrafi.ashrafi@live.com', 0, '', '', '', '', '', '', '', 2, 0, 'New Member', 0, 1400272151, 0, 1400945318, 1400945560, 1400745419, 0, 5, 0, 4, '5', 0, 0, 0, 0, 0, 3195095, '03-02-1986', '1986-03-02', -1, -1, '27.255.57.213', 430, 1, 1400745419, 0, -1, 0, 0, 'M-bwj"02]Fn-,qi&M5t3&HIfd3ZIAM', 0, 0, 0, '', 0, 0, 1, 0, 0, 0, 0, 0, 0, 0, 0, 0, '', '', 0, '', 'vb', '', 0, 1, 0, 0, NULL),
(24331, 2, '', 0, 'kami645', '9a0547474be07960e309698dceb38ad0', '2014-05-12', 'kami645@gmail.com', 0, '', '', '', '', '', '', '', 2, 0, 'New Member', 0, 1399874690, 0, 1401539108, 1401814125, 0, 0, 0, 0, 4, '5', 0, 0, 0, 0, 0, 3194967, '10-11-1978', '1978-10-11', -1, -1, '39.32.128.7', 0, 1, 0, 0, -1, 0, 0, '.RJ/QO>ZA@M-fW:$z$uH&^T*uA#=Q:', 0, 0, 0, '', 0, 0, 0, 0, 0, 0, 0, 0, 0, 0, 0, 0, '', '', 0, '', 'vb', '', 0, 1, 0, 0, NULL),
(24332, 3, '', 0, 'MLennon', '2e2cd5e8552b39e9c3be490442b00753', '2014-05-12', 'ywrkfodym@yahoo.com', 0, '', '', '', '', '', '', '', 2, 0, 'New Member', 0, 1399875410, 0, 1399875410, 1399909057, 0, 0, 0, 0, 4, '5', 0, 0, 0, 0, 0, 3194967, '12-18-1976', '1976-12-18', -1, -1, '188.165.83.232', 0, 1, 0, 0, -1, 0, 0, ',4i:}Sir/(2s_Ls8*!g|A+%6V$A)>z', 0, 0, 0, '', 0, 0, 0, 0, 0, 0, 0, 0, 0, 0, 0, 0, '', '', 0, '', 'vb', '', 0, 1, 0, 0, NULL),
(24376, 3, '', 0, 'DHurst', 'b30d1da15f588eb9555c86dd8ba27f32', '2014-05-13', 'deena-hurst35@kienthuccuatoi.com', 0, '', '', '', '', '', '', '', 2, 0, 'New Member', 0, 1399991152, 0, 1399991152, 1399997985, 0, 0, 0, 0, 4, '5', 0, 0, 0, 0, 0, 3194967, '09-23-1972', '1972-09-23', -1, -1, '69.12.77.178', 0, 1, 0, 0, -1, 0, 0, 'v:A/DRI(V;y1''o\\*dJB^9_QH[T]E4i', 0, 0, 0, '', 0, 0, 0, 0, 0, 0, 0, 0, 0, 0, 0, 0, '', '', 0, '', 'vb', '', 0, 1, 0, 0, NULL),
(24455, 3, '', 0, 'AT00', '45181295ff24626e87db22accf1b7efb', '2014-05-16', 'albert-grove87@crashdivas.net', 0, '', '', '', '', '', '', '', 2, 0, 'New Member', 0, 1400212357, 0, 1400212357, 1400219602, 0, 0, 0, 0, 4, '5', 0, 0, 0, 0, 0, 3194967, '10-26-1982', '1982-10-26', -1, -1, '204.44.82.40', 0, 1, 0, 0, -1, 0, 0, 'T.|z|0H!)\\rL_I4o8a/eLg8S}0PQtr', 0, 0, 0, '', 0, 0, 0, 0, 0, 0, 0, 0, 0, 0, 0, 0, '', '', 0, '', 'vb', '', 0, 1, 0, 0, NULL),
(24357, 3, '', 0, 'VLemon', '7a2d0ddd780683e5ab05bd0af2de71d6', '2014-05-12', 'burkeka@outlook.com', 0, '', '', '', '', '', '', '', 2, 0, 'New Member', 0, 1399935402, 0, 1399935402, 1400369048, 0, 0, 0, 0, 4, '5', 0, 0, 0, 0, 0, 3194967, '07-20-1975', '1975-07-20', -1, -1, '108.166.183.226', 0, 1, 0, 0, -1, 0, 0, ':0qBufF#`~.h^CI`]hU.^>!;Hi*Lq4', 0, 0, 0, '', 0, 0, 0, 0, 0, 0, 0, 0, 0, 0, 0, 0, '', '', 0, '', 'vb', '', 0, 1, 0, 0, NULL),
(24337, 2, '', 0, 'Shahji637', '4e59e867f51b81a3178cce2f530fc921', '2014-05-12', 'sta_pa_tama@yahoo.com', 0, '', '', '', '', '', '', '', 2, 0, 'New Member', 0, 1399881368, 0, 1399881368, 1399882202, 0, 0, 0, 0, 4, '5', 0, 0, 0, 0, 0, 3194967, '07-15-1986', '1986-07-15', -1, -1, '182.185.69.8', 0, 1, 0, 0, -1, 0, 0, '`be(y1HQvJ./,p"Msg(E>%|gdpU[,9', 0, 0, 0, '', 0, 0, 0, 0, 0, 0, 0, 0, 0, 0, 0, 0, '', '', 0, '', 'vb', '', 0, 1, 0, 0, NULL),
(24340, 2, '', 0, 'Qutbie', '0e79a688e67778ecc6559a98b4044ab8', '2014-05-12', 'qutbie@gmail.com', 0, '', '', '', '', '', '', '', 2, 0, 'New Member', 0, 1399888349, 0, 1400181801, 1401285978, 0, 0, 0, 0, 4, '5', 0, 0, 0, 0, 0, 3194967, '11-10-1990', '1990-11-10', -1, -1, '39.45.67.234', 0, 1, 0, 0, -1, 0, 0, 'du!+~|#kto0~&_u|s?km)/SZ<fRdE4', 0, 0, 0, '', 0, 0, 0, 0, 0, 0, 0, 0, 0, 0, 0, 0, '', '', 0, '', 'vb', '', 0, 1, 0, 0, NULL),
(24476, 2, '', 0, 'Hulkpayne', 'ca3319f289212c0abb53534db379999b', '2014-05-16', 'asif.47@gmail.com', 0, '', '', '', '', '', '', '', 2, 0, 'New Member', 0, 1400269114, 0, 1400269114, 1400269507, 0, 0, 0, 0, 4, '5', 0, 0, 0, 0, 0, 3194967, '01-18-1988', '1988-01-18', -1, -1, '175.107.51.171', 0, 1, 0, 0, -1, 0, 0, '>CgxA?6{i(<$n5sbE%J?NyCzJ3uVj%', 0, 0, 0, '', 0, 0, 0, 0, 0, 0, 0, 0, 0, 0, 0, 0, '', '', 0, '', 'vb', '', 0, 1, 0, 0, NULL),
(24394, 3, '', 0, 'NMusser', 'e2d0c14fa18323633403eaf3d93f9c4c', '2014-05-14', 'nancy.musser@kienthuccuatoi.com', 0, '', '', '', '', '', '', '', 2, 0, 'New Member', 0, 1400044470, 0, 1400044470, 1400051393, 0, 0, 0, 0, 4, '5', 0, 0, 0, 0, 0, 3194967, '11-27-1978', '1978-11-27', -1, -1, '107.155.80.225', 0, 1, 0, 0, -1, 0, 0, 'b1->%I8!#4/"ais9Gt#Pa]zK>{;,S>', 0, 0, 0, '', 0, 0, 0, 0, 0, 0, 0, 0, 0, 0, 0, 0, '', '', 0, '', 'vb', '', 0, 1, 0, 0, NULL),
(24379, 3, '', 0, 'WJJB', 'a03a206db4040aad119bfcba0b22a5ff', '2014-05-13', 'sample89@daynew.org', 0, '', '', '', '', '', '', '', 2, 0, 'New Member', 0, 1399995926, 0, 1399995926, 1399996292, 0, 0, 0, 0, 4, '5', 0, 0, 0, 0, 0, 3194967, '07-15-1971', '1971-07-15', -1, -1, '46.252.36.140', 0, 1, 0, 0, -1, 0, 0, '+qX](21w=g;s)Y/KA`|*k$yo"M24JJ', 0, 0, 0, '', 0, 0, 0, 0, 0, 0, 0, 0, 0, 0, 0, 0, '', '', 0, '', 'vb', '', 0, 1, 0, 0, NULL),
(24507, 3, '', 0, 'CBarela', '92a2d44ade125d44101411b81791e6d2', '2014-05-18', 'quickestphysiciafxd@nokiamail.com', 0, '', '', '', '', '', '', '', 2, 0, 'New Member', 0, 1400377825, 0, 1400377825, 1400377825, 0, 0, 0, 0, 4, '5', 0, 0, 0, 0, 0, 3194967, '01-06-1973', '1973-01-06', -1, -1, '192.161.181.23', 0, 1, 0, 0, -1, 0, 0, '?L~[''>D0t''9|rj1o+z''''RsG$z1e`YZ', 0, 0, 0, '', 0, 0, 0, 0, 0, 0, 0, 0, 0, 0, 0, 0, '', '', 0, '', 'vb', '', 0, 1, 0, 0, NULL),
(26227, 2, '', 0, 'hasnatshah', 'b44933ca3aff65dfb211521620ca7b4b', '2014-07-15', 'hasnat.bokhari@yahoo.com', 0, '', '', '', '', '', '', '', 2, 0, 'New Member', 0, 1405419742, 0, 1405419742, 1405420030, 0, 0, 0, 0, 4, '5', 0, 0, 0, 0, 0, 3194967, '12-29-1981', '1981-12-29', -1, -1, '202.142.173.22', 0, 1, 0, 0, -1, 0, 0, '\\`gowrpqnRCL`n<;NY*2Z1_H7B.bP}', 0, 0, 0, '', 0, 0, 0, 0, 0, 0, 0, 0, 0, 0, 0, 0, '', '', 0, '', 'vb', '', 0, 1, 0, 0, NULL),
(24563, 2, '', 0, 'Al Capone', 'd49875de15a4bb8dbdd144b15c077642', '2014-05-19', 'mirwisekhan@gmail.com', 0, '', '', '', '', '', '', '', 2, 0, 'New Member', 0, 1400517466, 0, 1400517466, 1400613397, 0, 0, 0, 0, 4, '5', 0, 0, 0, 0, 0, 3194967, '10-09-1984', '1984-10-09', -1, -1, '119.154.189.74', 0, 1, 0, 0, -1, 0, 0, 'Y{m3Q\\kTQZQixOk&''#^/M10S^]CYQa', 0, 0, 0, '', 0, 0, 0, 0, 0, 0, 0, 0, 0, 0, 0, 0, '', '', 0, '', 'vb', '', 0, 1, 0, 0, NULL),
(24473, 3, '', 0, 'JGRKX', 'd2af496230a02f0d0d077d733d0fffeb', '2014-05-16', 'floraerrda@yahoo.com', 0, '', '', '', '', '', '', '', 2, 0, 'New Member', 0, 1400265502, 0, 1400265502, 1400265502, 0, 0, 0, 0, 4, '5', 0, 0, 0, 0, 0, 3194967, '10-25-1970', '1970-10-25', -1, -1, '149.255.111.73', 0, 1, 0, 0, -1, 0, 0, ']S+slxL!]/o]eTr@y=+dcN4P467dM6', 0, 0, 0, '', 0, 0, 0, 0, 0, 0, 0, 0, 0, 0, 0, 0, '', '', 0, '', 'vb', '', 0, 1, 0, 0, NULL),
(24365, 3, '', 0, 'E6201', '5b1494c009e1a9ca892951f395c43a31', '2014-05-13', 'calaalzgb@yahoo.com', 0, '', '', '', '', '', '', '', 2, 0, 'New Member', 0, 1399958858, 0, 1399958858, 1399958858, 0, 0, 0, 0, 4, '5', 0, 0, 0, 0, 0, 3194967, '08-08-1981', '1981-08-08', -1, -1, '188.165.121.241', 0, 1, 0, 0, -1, 0, 0, '3_1QsT{s(G?=|RRkQZw4uRt[.^{)xu', 0, 0, 0, '', 0, 0, 0, 0, 0, 0, 0, 0, 0, 0, 0, 0, '', '', 0, '', 'vb', '', 0, 1, 0, 0, NULL),
(24345, 3, '', 0, 'messi', '4592daf57862cdda4bd297f003a846d1', '2014-05-12', 'byrononfire@gmail.com', 0, '', '', '', '', '', '', '', 2, 0, 'New Member', 0, 1399913389, 0, 1399913389, 1399913873, 0, 0, 0, 0, 4, '5', 0, 0, 0, 0, 0, 3194967, '01-04-1990', '1990-01-04', -1, -1, '39.54.103.247', 0, 1, 0, 0, -1, 0, 0, 'Xt^`W_M2}@7$ji96/o(|}fm}`tMFhS', 0, 0, 0, '', 0, 0, 0, 0, 0, 0, 0, 0, 0, 0, 0, 0, '', '', 0, '', 'vb', '', 0, 1, 0, 0, NULL),
(24346, 3, '', 0, 'LThaxton', '8d9e69a59c901c5c9470ab274f523b6e', '2014-05-12', 'jamiegxhyz@yahoo.com', 0, '', '', '', '', '', '', '', 2, 0, 'New Member', 0, 1399914356, 0, 1399914356, 1399914356, 0, 0, 0, 0, 4, '5', 0, 0, 0, 0, 0, 3194967, '07-25-1973', '1973-07-25', -1, -1, '91.121.238.76', 0, 1, 0, 0, -1, 0, 0, '_GDQ`5EpAZO5!Y(uXzOPk6p(wdZHc[', 0, 0, 0, '', 0, 0, 0, 0, 0, 0, 0, 0, 0, 0, 0, 0, '', '', 0, '', 'vb', '', 0, 1, 0, 0, NULL),
(24402, 2, '', 0, 'kashir', '6b51673fc4f610a5cfd9be27445e6585', '2014-05-14', 'usmanarif32@gmail.com', 0, '', '', '', '', '', '', '', 2, 0, 'New Member', 0, 1400073217, 0, 1400074228, 1400074228, 0, 0, 0, 0, 4, '5', 0, 0, 0, 0, 0, 3194967, '04-07-1989', '1989-04-07', -1, -1, '119.158.27.33', 0, 1, 0, 0, -1, 0, 0, '''l+(8QSlY^2p=jC1jBI?KXCu7ddtrG', 0, 0, 0, '', 0, 0, 0, 0, 0, 0, 0, 0, 0, 0, 0, 0, '', '', 0, '', 'vb', '', 0, 1, 0, 0, NULL),
(24354, 3, '', 0, 'TChurch', '0939f0d756e5f6a3b4b53909c8be1590', '2014-05-12', 'jumbledsilhouet04@outlook.com', 0, '', '', '', '', '', '', '', 2, 0, 'New Member', 0, 1399929471, 0, 1399929471, 1399936630, 0, 0, 0, 0, 4, '5', 0, 0, 0, 0, 0, 3194967, '06-23-1975', '1975-06-23', -1, -1, '165.231.27.252', 0, 1, 0, 0, -1, 0, 0, '8`8Y{CE;nr]@{>uw>atZ{OE%J:#*G:', 0, 0, 0, '', 0, 0, 0, 0, 0, 0, 0, 0, 0, 0, 0, 0, '', '', 0, '', 'vb', '', 0, 1, 0, 0, NULL),
(24401, 3, '', 0, 'GJRA', '1f879c4fe50b4391859d318122338ce1', '2014-05-14', 'aliza-holroyd39@diendanthongtin.com', 0, '', '', '', '', '', '', '', 2, 0, 'New Member', 0, 1400072502, 0, 1400072502, 1400079344, 0, 0, 0, 0, 4, '5', 0, 0, 0, 0, 0, 3194967, '04-02-1970', '1970-04-02', -1, -1, '69.12.77.33', 0, 1, 0, 0, -1, 0, 0, '$MB)RJI9h~o=lOu1rmYEA)t1k`s@ke', 0, 0, 0, '', 0, 0, 0, 0, 0, 0, 0, 0, 0, 0, 0, 0, '', '', 0, '', 'vb', '', 0, 1, 0, 0, NULL),
(24351, 3, '', 0, 'KCasimaty', 'd894c3bafcc9ec840157fd7a7ea6a58e', '2014-05-12', 'mexbavxcul@yahoo.com', 0, '', '', '', '', '', '', '', 2, 0, 'New Member', 0, 1399920858, 0, 1399920858, 1399943475, 0, 0, 0, 0, 4, '5', 0, 0, 0, 0, 0, 3194967, '08-21-1980', '1980-08-21', -1, -1, '178.33.154.132', 0, 1, 0, 0, -1, 0, 0, '1B!X"F?G=f`B^!1x4K@CpZrgS8;^bI', 0, 0, 0, '', 0, 0, 0, 0, 0, 0, 0, 0, 0, 0, 0, 0, '', '', 0, '', 'vb', '', 0, 1, 0, 0, NULL),
(24352, 3, '', 0, 'JOVZ', '032975134f1b43229dbaffc464615e17', '2014-05-12', 'opitzbekwg@yahoo.com', 0, '', '', '', '', '', '', '', 2, 0, 'New Member', 0, 1399921027, 0, 1399921027, 1399927709, 0, 0, 0, 0, 4, '5', 0, 0, 0, 0, 0, 3194967, '05-27-1981', '1981-05-27', -1, -1, '5.39.32.109', 0, 1, 0, 0, -1, 0, 0, 'ki4)QtJ1u[**''JLv%?_XWz8:E\\-1"X', 0, 0, 0, '', 0, 0, 0, 0, 0, 0, 0, 0, 0, 0, 0, 0, '', '', 0, '', 'vb', '', 0, 1, 0, 0, NULL),
(24353, 3, '', 0, 'FAdv', 'ec39c15ef901854acac7d4a4ed2361ff', '2014-05-12', 'jalygevyvuhy@yahoo.com', 0, '', '', '', '', '', '', '', 2, 0, 'New Member', 0, 1399921719, 0, 1399921719, 1399982431, 0, 0, 0, 0, 4, '5', 0, 0, 0, 0, 0, 3194967, '09-30-1977', '1977-09-30', -1, -1, '107.161.85.134', 0, 1, 0, 0, -1, 0, 0, '{M|`4bD@)-QLP+!TzW2Wi/_pF7\\\\cn', 0, 0, 0, '', 0, 0, 0, 0, 0, 0, 0, 0, 0, 0, 0, 0, '', '', 0, '', 'vb', '', 0, 1, 0, 0, NULL),
(24449, 3, '', 0, 'VBivins', '20e5dfae4203a3a5195cf4ff8505e80d', '2014-05-15', 'bcairbmdnl@yahoo.com', 0, '', '', '', '', '', '', '', 2, 0, 'New Member', 0, 1400179516, 0, 1400179516, 1400358697, 0, 0, 0, 0, 4, '5', 0, 0, 0, 0, 0, 3194967, '11-14-1981', '1981-11-14', -1, -1, '198.143.143.78', 0, 1, 0, 0, -1, 0, 0, 'pP''&YG7^S!P{5yVQDNel)cDBXEHw!*', 0, 0, 0, '', 0, 0, 0, 0, 0, 0, 0, 0, 0, 0, 0, 0, '', '', 0, '', 'vb', '', 0, 1, 0, 0, NULL),
(24406, 3, '', 0, 'E0459', 'e1704182f9c2bc5030b6c7fe876d4f46', '2014-05-14', 'andremullin.s9.5.7@gmail.com', 0, '', '', '', '', '', '', '', 2, 0, 'New Member', 0, 1400081782, 0, 1400081782, 1400083874, 0, 0, 0, 0, 4, '5', 0, 0, 0, 0, 0, 3194967, '09-29-1970', '1970-09-29', -1, -1, '192.3.61.126', 0, 1, 0, 0, -1, 0, 0, 'z0#ak;pk8aSX2ZC?[w[8@w}\\0*_^dZ', 0, 0, 0, '', 0, 0, 0, 0, 0, 0, 0, 0, 0, 0, 0, 0, '', '', 0, '', 'vb', '', 0, 1, 0, 0, NULL),
(24407, 3, '', 0, 'HGainey', 'e0a337dfb75664c2db83a3c490a90cc0', '2014-05-14', 'vqykissat@yahoo.com', 0, '', '', '', '', '', '', '', 2, 0, 'New Member', 0, 1400087062, 0, 1400087062, 1400094343, 0, 0, 0, 0, 4, '5', 0, 0, 0, 0, 0, 3194967, '09-27-1984', '1984-09-27', -1, -1, '170.130.110.104', 0, 1, 0, 0, -1, 0, 0, 'CFH/Bjj"T-7''K4-rCzMSdWK<>}R#wH', 0, 0, 0, '', 0, 0, 0, 0, 0, 0, 0, 0, 0, 0, 0, 0, '', '', 0, '', 'vb', '', 0, 1, 0, 0, NULL),
(24408, 3, '', 0, 'sono_mirza66', '534a7e79b48d69b009c9d58339723da5', '2014-05-14', 'sono_mirza66@hotmail.co.uk', 0, '', '', '', '', '', '', '', 2, 0, 'New Member', 0, 1400087686, 0, 1400087686, 1400088169, 0, 0, 0, 0, 4, '5', 0, 0, 0, 0, 0, 3194967, '04-11-1998', '1998-04-11', -1, -1, '39.53.169.19', 0, 1, 0, 0, -1, 0, 0, '=iZoLrc1Q^TUg91Pc0Qt};5uF!Ua,"', 0, 0, 0, '', 0, 0, 0, 0, 0, 0, 0, 0, 0, 0, 0, 0, '', '', 0, '', 'vb', '', 0, 1, 0, 0, NULL),
(24491, 3, '', 0, 'ZWatters', '32f8198e99a85dfdd522cb16deea06af', '2014-05-17', 'zoe-watters@diendanthongtin.com', 0, '', '', '', '', '', '', '', 2, 0, 'New Member', 0, 1400324145, 0, 1400324145, 1400330975, 0, 0, 0, 0, 4, '5', 0, 0, 0, 0, 0, 3194967, '12-11-1973', '1973-12-11', -1, -1, '192.3.142.91', 0, 1, 0, 0, -1, 0, 0, '%<)~mQ^sC[Q/<H$#d}k+%Rat{3LVhz', 0, 0, 0, '', 0, 0, 0, 0, 0, 0, 0, 0, 0, 0, 0, 0, '', '', 0, '', 'vb', '', 0, 1, 0, 0, NULL),
(24410, 3, '', 0, 'raufashraf', '616162dde4b4f7150ad0ba4311189afa', '2014-05-14', 'raufashraf@ymail.com', 0, '', '', '', '', '', '', '', 2, 0, 'New Member', 0, 1400092922, 0, 1400092922, 1400094631, 0, 0, 0, 0, 4, '5', 0, 0, 0, 0, 0, 3194967, '05-30-1982', '1982-05-30', -1, -1, '119.160.118.34', 316, 1, 0, 0, -1, 0, 0, 'fvf]XZ.m;i2$ao6r>_2j31jhlmHe;\\', 0, 0, 0, '', 0, 0, 0, 0, 0, 0, 0, 0, 0, 0, 0, 0, '', '', 0, '', 'vb', '', 0, 1, 0, 0, NULL),
(24494, 3, '', 0, 'Muhammad Adeeel', '8c0460f5a180189ed63be90a85b0fe67', '2014-05-17', 'adeel_bounce@hotmail.com', 0, '', '', '', '', '', '', '', 2, 0, 'New Member', 0, 1400335912, 0, 1400336557, 1400336557, 0, 0, 0, 0, 4, '5', 0, 0, 0, 0, 0, 3194967, '02-21-1981', '1981-02-21', -1, -1, '39.54.117.238', 0, 1, 0, 0, -1, 0, 0, '}ovgy=nMkWs.=,BGB`[Y!(Q={<"*AS', 0, 0, 0, '', 0, 0, 0, 0, 0, 0, 0, 0, 0, 0, 0, 0, '', '', 0, '', 'vb', '', 0, 1, 0, 0, NULL),
(24482, 3, '', 0, 'Syed Fazil rashdi', '2f566d81f97c84c9dafb5542d5e51e8e', '2014-05-17', 'fazil_rashdi@hotmail.com', 0, '', '', '', '', '', '', '', 2, 0, 'New Member', 0, 1400282646, 0, 1400285479, 1400455615, 0, 0, 0, 0, 4, '5', 0, 0, 0, 0, 0, 3194967, '10-04-1988', '1988-10-04', -1, -1, '42.83.85.47', 0, 1, 0, 0, -1, 0, 0, '5\\sL~]aX!LX_HqGe9i[])G~r0?;#@W', 0, 0, 0, '', 0, 0, 0, 0, 0, 0, 0, 0, 0, 0, 0, 0, '', '', 0, '', 'vb', '', 0, 1, 0, 0, NULL),
(24469, 2, '', 0, 'alibutt75', 'ca9a56dcefcd0e922730c9c807032e19', '2014-05-16', 'buttali516@gmail.com', 12, '', '', '', '', '', '', '', 2, 0, 'New Member', 0, 1400244579, 0, 1420814295, 1421417226, 1418444544, 0, 22, 0, 4, '5', 0, 0, 0, 0, 0, 11551831, '03-18-1987', '1987-03-18', -1, 1, '182.185.210.10', 0, 0, 0, 0, -1, 0, 0, 'odbr^ibbj5E5J61wiMFOq)$0_!DM5X', 0, 0, 0, '', 0, 0, 9, 4, 0, 0, 0, 0, 0, 0, 0, 0, '', '', 0, '', 'vb', '', 0, 1, 0, 0, NULL),
(24413, 3, '', 0, 'B3700', 'cbfee006f3bc594422f9ed8ddfd0c6aa', '2014-05-14', 'taketyzebuku@yahoo.com', 0, '', '', '', '', '', '', '', 2, 0, 'New Member', 0, 1400100569, 0, 1400100569, 1400181086, 0, 0, 0, 0, 4, '5', 0, 0, 0, 0, 0, 3194967, '03-13-1973', '1973-03-13', -1, -1, '204.44.83.186', 0, 1, 0, 0, -1, 0, 0, 'zg2P>~''gJ1O;QleIa[e~:4*JQvD!.&', 0, 0, 0, '', 0, 0, 0, 0, 0, 0, 0, 0, 0, 0, 0, 0, '', '', 0, '', 'vb', '', 0, 1, 0, 0, NULL),
(24501, 3, '', 0, 'EHailes', '037154aaaffeb7183fc51e0f4426ad85', '2014-05-17', 'edgardo-hailes@diendanthongtin.com', 0, '', '', '', '', '', '', '', 2, 0, 'New Member', 0, 1400351601, 0, 1400351601, 1400358407, 0, 0, 0, 0, 4, '5', 0, 0, 0, 0, 0, 3194967, '10-20-1984', '1984-10-20', -1, -1, '107.155.80.39', 0, 1, 0, 0, -1, 0, 0, 'usr+5bn1pKN$P!U3~7oD%Vv>:5Oe1P', 0, 0, 0, '', 0, 0, 0, 0, 0, 0, 0, 0, 0, 0, 0, 0, '', '', 0, '', 'vb', '', 0, 1, 0, 0, NULL),
(24492, 3, '', 0, 'MCawthorn', '1e6f706d42f4797c26024a27191db2ea', '2014-05-17', 'xytymezygir@yahoo.com', 0, '', '', '', '', '', '', '', 2, 0, 'New Member', 0, 1400328855, 0, 1400328855, 1400379705, 0, 0, 0, 0, 4, '5', 0, 0, 0, 0, 0, 3194967, '12-03-1971', '1971-12-03', -1, -1, '69.12.70.246', 0, 1, 0, 0, -1, 0, 0, '|BMnKY-6dX-_<Hh|8`mSKEh26\\V0<Q', 0, 0, 0, '', 0, 0, 0, 0, 0, 0, 0, 0, 0, 0, 0, 0, '', '', 0, '', 'vb', '', 0, 1, 0, 0, NULL),
(24415, 3, '', 0, 'EQHA', '364d33a77a56783414035b6fc8b601de', '2014-05-14', 'aleida_jernigan27@kienthuccuatoi.com', 0, '', '', '', '', '', '', '', 2, 0, 'New Member', 0, 1400105139, 0, 1400105139, 1400112467, 0, 0, 0, 0, 4, '5', 0, 0, 0, 0, 0, 3194967, '05-22-1983', '1983-05-22', -1, -1, '172.245.240.50', 0, 1, 0, 0, -1, 0, 0, '_#n[FCT3Dh"~`4E/l.*YWR<`%Z+Ee0', 0, 0, 0, '', 0, 0, 0, 0, 0, 0, 0, 0, 0, 0, 0, 0, '', '', 0, '', 'vb', '', 0, 1, 0, 0, NULL),
(24479, 3, '', 0, 'EHEWT', 'c8a43f402136d09a3947263456bf0a6a', '2014-05-16', 'eunice-fisher@garnous.com', 0, '', '', '', '', '', '', '', 2, 0, 'New Member', 0, 1400272039, 0, 1400272039, 1400272039, 0, 0, 0, 0, 4, '5', 0, 0, 0, 0, 0, 3194967, '08-12-1983', '1983-08-12', -1, -1, '89.46.101.129', 0, 1, 0, 0, -1, 0, 0, 'h;bd1XU)3n4{)g{:$)?]X>F:d^yhW-', 0, 0, 0, '', 0, 0, 0, 0, 0, 0, 0, 0, 0, 0, 0, 0, '', '', 0, '', 'vb', '', 0, 1, 0, 0, NULL),
(24635, 3, '', 0, 'LM90', 'b3e0da54b37544041366f28f6ef4838c', '2014-05-22', 'woodwardeqvsmmbg@outlook.com', 0, '', '', '', '', '', '', '', 2, 0, 'New Member', 0, 1400724878, 0, 1400724878, 1401209434, 0, 0, 0, 0, 4, '5', 0, 0, 0, 0, 0, 3194967, '03-19-1980', '1980-03-19', -1, -1, '107.161.182.90', 0, 1, 0, 0, -1, 0, 0, 'U4(6:hl?rAW{T1,gmo6,4[_g48U&q"', 0, 0, 0, '', 0, 0, 0, 0, 0, 0, 0, 0, 0, 0, 0, 0, '', '', 0, '', 'vb', '', 0, 1, 0, 0, NULL),
(24441, 3, '', 0, 'CMBA', '6ed5673397008af67a982865908d930d', '2014-05-15', 'patmeqaup@yahoo.com', 0, '', '', '', '', '', '', '', 2, 0, 'New Member', 0, 1400164829, 0, 1400164829, 1400164829, 0, 0, 0, 0, 4, '5', 0, 0, 0, 0, 0, 3194967, '07-13-1979', '1979-07-13', -1, -1, '188.165.83.232', 0, 1, 0, 0, -1, 0, 0, '.(^=*L{lY42)aX{%(xv6M<xqEIh_nW', 0, 0, 0, '', 0, 0, 0, 0, 0, 0, 0, 0, 0, 0, 0, 0, '', '', 0, '', 'vb', '', 0, 1, 0, 0, NULL),
(24419, 3, '', 0, 'CReasoner', '90a823658ed4bae34b8c78aba3713040', '2014-05-15', 'maudzdg@outlook.com', 0, '', '', '', '', '', '', '', 2, 0, 'New Member', 0, 1400109057, 0, 1400109057, 1400109057, 0, 0, 0, 0, 4, '5', 0, 0, 0, 0, 0, 3194967, '01-21-1981', '1981-01-21', -1, -1, '201.243.187.128', 0, 1, 0, 0, -1, 0, 0, '#\\TrK%oYC-rfw`6qnE+I#]5~~JV>QC', 0, 0, 0, '', 0, 0, 0, 0, 0, 0, 0, 0, 0, 0, 0, 0, '', '', 0, '', 'vb', '', 0, 1, 0, 0, NULL),
(24448, 3, '', 0, 'LBurgmann', '161c66acc852695d144f954c41726b5a', '2014-05-15', 'frgeytdvc@yahoo.com', 0, '', '', '', '', '', '', '', 2, 0, 'New Member', 0, 1400176877, 0, 1400176877, 1400204087, 0, 0, 0, 0, 4, '5', 0, 0, 0, 0, 0, 3194967, '01-02-1982', '1982-01-02', -1, -1, '178.32.56.248', 0, 1, 0, 0, -1, 0, 0, '7(a''"G5J?e"s-poTdxp+7yEm[b9:V''', 0, 0, 0, '', 0, 0, 0, 0, 0, 0, 0, 0, 0, 0, 0, 0, '', '', 0, '', 'vb', '', 0, 1, 0, 0, NULL),
(24450, 3, '', 0, 'ahsiaasy', '817055b34768d9d46bc2b4ff8b13b65c', '2014-05-15', 'amanshinwari16@yahoo.com', 0, '', '', '', '', '', '', '', 2, 0, 'New Member', 0, 1400186094, 0, 1400186362, 1400186362, 0, 0, 0, 0, 4, '5', 0, 0, 0, 0, 0, 3194967, '06-15-1990', '1990-06-15', -1, -1, '182.185.23.97', 0, 1, 0, 0, -1, 0, 0, 'X8KQ#k|YVd,?,04$O>jS<96T-+]''DD', 0, 0, 0, '', 0, 0, 0, 0, 0, 0, 0, 0, 0, 0, 0, 0, '', '', 0, '', 'vb', '', 0, 1, 0, 0, NULL),
(24528, 3, '', 0, 'MKinard', 'a0697ba86a5dde3ff25937adcdeba712', '2014-05-18', 'ranarpdmrj@outlook.com', 0, '', '', '', '', '', '', '', 2, 0, 'New Member', 0, 1400420343, 0, 1400420343, 1400431225, 0, 0, 0, 0, 4, '5', 0, 0, 0, 0, 0, 3194967, '01-28-1979', '1979-01-28', -1, -1, '192.230.61.109', 0, 1, 0, 0, -1, 0, 0, 'Ru0&3<y]8%''y6VLOJ3[@r.|SGncl;z', 0, 0, 0, '', 0, 0, 0, 0, 0, 0, 0, 0, 0, 0, 0, 0, '', '', 0, '', 'vb', '', 0, 1, 0, 0, NULL),
(24423, 3, '', 0, 'D79J', '90b3346b31a580f958f95f0034dc2991', '2014-05-15', 'cashbrenn@hotmail.com', 0, '', '', '', '', '', '', '', 2, 0, 'New Member', 0, 1400116687, 0, 1400116687, 1400119832, 0, 0, 0, 0, 4, '5', 0, 0, 0, 0, 0, 3194967, '07-12-1975', '1975-07-12', -1, -1, '186.93.173.5', 0, 1, 0, 0, -1, 0, 0, 'z,:uX[GPkP],`icpiK3tA~X?!:+6zM', 0, 0, 0, '', 0, 0, 0, 0, 0, 0, 0, 0, 0, 0, 0, 0, '', '', 0, '', 'vb', '', 0, 1, 0, 0, NULL),
(24425, 3, '', 0, 'TWeinman', '5af1374e6534910e9d23336020e90cd8', '2014-05-15', 'tomas.weinman92@diendanthongtin.com', 0, '', '', '', '', '', '', '', 2, 0, 'New Member', 0, 1400117690, 0, 1400117690, 1400124560, 0, 0, 0, 0, 4, '5', 0, 0, 0, 0, 0, 3194967, '09-30-1984', '1984-09-30', -1, -1, '23.231.103.170', 0, 1, 0, 0, -1, 0, 0, 'j|Ib[.[n<d-HBdl{Ek9gCIUm0K_1;+', 0, 0, 0, '', 0, 0, 1, 0, 0, 0, 0, 0, 0, 0, 0, 0, '', '', 0, '', 'vb', '', 0, 1, 0, 0, NULL),
(24466, 2, '', 0, 'Colt kingcobra', '002590376dbdc4a4610e6549fc4d07b4', '2014-05-16', 's.sahibzada7380@yahoo.com', 0, '', '', '', '', '', '', '', 2, 0, 'New Member', 0, 1400238092, 0, 1400238092, 1400238092, 0, 0, 0, 0, 4, '5', 0, 0, 0, 0, 0, 3194967, '01-01-1994', '1994-01-01', -1, -1, '39.33.153.97', 0, 1, 0, 0, -1, 0, 0, '%E7zFNpZ84-yDR,[/B$ZOmwn3[mAPl', 0, 0, 0, '', 0, 0, 0, 0, 0, 0, 0, 0, 0, 0, 0, 0, '', '', 0, '', 'vb', '', 0, 1, 0, 0, NULL),
(24474, 3, '', 0, 'JA31', '11e1713e99cc05ac5c885e6c2d98d941', '2014-05-16', 'janette-neuman@capnhaptintuc.com', 0, '', '', '', '', '', '', '', 2, 0, 'New Member', 0, 1400268628, 0, 1400268628, 1400271231, 0, 0, 0, 0, 4, '5', 0, 0, 0, 0, 0, 3194967, '08-22-1980', '1980-08-22', -1, -1, '69.12.77.179', 0, 1, 0, 0, -1, 0, 0, 'mmsP)Ec2T5\\xE{aLGq,Kq5;5y[28|y', 0, 0, 0, '', 0, 0, 0, 0, 0, 0, 0, 0, 0, 0, 0, 0, '', '', 0, '', 'vb', '', 0, 1, 0, 0, NULL),
(24429, 3, '', 0, 'BHorrell', 'ef4aa5a8bf7b2f1fbd4e1cab273dc786', '2014-05-15', 'juanaxsjx@hotmail.com', 0, '', '', '', '', '', '', '', 2, 0, 'New Member', 0, 1400131499, 0, 1400131499, 1400139159, 0, 0, 0, 0, 4, '5', 0, 0, 0, 0, 0, 3194967, '07-25-1972', '1972-07-25', -1, -1, '173.0.49.248', 0, 1, 0, 0, -1, 0, 0, 'Kq8CZ=sj$Zy}u/Oj}ZQle|\\1''MI,N$', 0, 0, 0, '', 0, 0, 0, 0, 0, 0, 0, 0, 0, 0, 0, 0, '', '', 0, '', 'vb', '', 0, 1, 0, 0, NULL),
(24430, 3, '', 0, 'JGracia', '87ea9f1a4311d46badc3ca38c0d6c7e8', '2014-05-15', 'jerold_gracia49@kienthuccuatoi.com', 0, '', '', '', '', '', '', '', 2, 0, 'New Member', 0, 1400132827, 0, 1400132827, 1400139691, 0, 0, 0, 0, 4, '5', 0, 0, 0, 0, 0, 3194967, '01-16-1970', '1970-01-16', -1, -1, '173.0.60.23', 0, 1, 0, 0, -1, 0, 0, '27fp6ubSWyK/7wV%zgDe}91c\\JdT+-', 0, 0, 0, '', 0, 0, 0, 0, 0, 0, 0, 0, 0, 0, 0, 0, '', '', 0, '', 'vb', '', 0, 1, 0, 0, NULL),
(24471, 3, '', 0, 'dewdrop', '99d5f59490740c55308b6f72a0c63c79', '2014-05-16', 'dewdrop@outlook.com', 0, '', '', '', '', '', '', '', 2, 0, 'New Member', 0, 1400256900, 0, 1400258551, 1400258551, 0, 0, 0, 0, 4, '5', 0, 0, 0, 0, 0, 3194967, '03-13-1980', '1980-03-13', -1, -1, '39.51.83.139', 0, 1, 0, 0, -1, 0, 0, 'q<Ma",8C4IVPyTyz36<T.%bVy2a(w$', 0, 0, 0, '', 0, 0, 0, 0, 0, 0, 0, 0, 0, 0, 0, 0, '', '', 0, '', 'vb', '', 0, 1, 0, 0, NULL),
(24461, 3, '', 0, 'ASeaver', '50827f5e2c9976f120a9ca565467cd14', '2014-05-16', 'andremullins957@gmail.com', 0, '', '', '', '', '', '', '', 2, 0, 'New Member', 0, 1400227284, 0, 1400227284, 1400229557, 0, 0, 0, 0, 4, '5', 0, 0, 0, 0, 0, 3194967, '12-06-1979', '1979-12-06', -1, -1, '192.99.141.127', 0, 1, 0, 0, -1, 0, 0, '#RiW<;ttps4)UHK+,%UTVq:rr;Z)CR', 0, 0, 0, '', 0, 0, 0, 0, 0, 0, 0, 0, 0, 0, 0, 0, '', '', 0, '', 'vb', '', 0, 1, 0, 0, NULL);
INSERT INTO `user` (`userid`, `usergroupid`, `membergroupids`, `displaygroupid`, `username`, `password`, `passworddate`, `email`, `styleid`, `parentemail`, `homepage`, `icq`, `aim`, `yahoo`, `msn`, `skype`, `showvbcode`, `showbirthday`, `usertitle`, `customtitle`, `joindate`, `daysprune`, `lastvisit`, `lastactivity`, `lastpost`, `lastpostid`, `posts`, `reputation`, `reputationlevelid`, `timezoneoffset`, `pmpopup`, `avatarid`, `avatarrevision`, `profilepicrevision`, `sigpicrevision`, `options`, `birthday`, `birthday_search`, `maxposts`, `startofweek`, `ipaddress`, `referrerid`, `languageid`, `emailstamp`, `threadedmode`, `autosubscribe`, `pmtotal`, `pmunread`, `salt`, `ipoints`, `infractions`, `warnings`, `infractiongroupids`, `infractiongroupid`, `adminoptions`, `profilevisits`, `friendcount`, `friendreqcount`, `vmunreadcount`, `vmmoderatedcount`, `socgroupinvitecount`, `socgroupreqcount`, `pcunreadcount`, `pcmoderatedcount`, `gmmoderatedcount`, `assetposthash`, `fbuserid`, `fbjoindate`, `fbname`, `logintype`, `fbaccesstoken`, `bloggroupreqcount`, `showblogcss`, `importuserid`, `newrepcount`, `panjo_selling`) VALUES
(30270, 3, '', 0, 'JRosenber', '4590ea43ae40e122b952c024898a7ce5', '2014-11-30', 'evitaguijeje@outlook.com', 0, '', '', '', '', '', '', '', 2, 0, 'New Member', 0, 1417367162, 0, 1417367162, 1417367162, 0, 0, 0, 0, 4, '5', 0, 0, 0, 0, 0, 3194967, '09-11-1976', '1976-09-11', -1, -1, '107.183.229.81', 0, 1, 0, 0, -1, 0, 0, '~dl@vu"roDOZ9]aY{+p_+Dg`UNx0Oa', 0, 0, 0, '', 0, 0, 0, 0, 0, 0, 0, 0, 0, 0, 0, 0, '', '', 0, '', 'vb', '', 0, 1, 0, 0, NULL),
(24629, 3, '', 0, 'JFortier', '90eae2d8dc94e3ed9b046bde5d2d7c50', '2014-05-22', 'hallowedsinger1vz65@outlook.com', 0, '', '', '', '', '', '', '', 2, 0, 'New Member', 0, 1400722738, 0, 1400722738, 1400724956, 0, 0, 0, 0, 4, '5', 0, 0, 0, 0, 0, 3194967, '01-19-1984', '1984-01-19', -1, -1, '69.12.78.126', 0, 1, 0, 0, -1, 0, 0, 'tgcVd&C}{y6$af^9@5m2`Lw|NoY7.P', 0, 0, 0, '', 0, 0, 0, 0, 0, 0, 0, 0, 0, 0, 0, 0, '', '', 0, '', 'vb', '', 0, 1, 0, 0, NULL),
(24434, 3, '', 0, 'KSaavedra', 'a069c9c2097c3897b45df3d136b53e06', '2014-05-15', 'ubiquitousincuboc238@outlook.com', 0, '', '', '', '', '', '', '', 2, 0, 'New Member', 0, 1400148207, 0, 1400148207, 1400150938, 0, 0, 0, 0, 4, '5', 0, 0, 0, 0, 0, 3194967, '09-24-1980', '1980-09-24', -1, -1, '117.242.161.76', 0, 1, 0, 0, -1, 0, 0, '6rd|0D1QN}5HH9;)5a),`TOb,W.T!-', 0, 0, 0, '', 0, 0, 0, 0, 0, 0, 0, 0, 0, 0, 0, 0, '', '', 0, '', 'vb', '', 0, 1, 0, 0, NULL),
(24435, 3, '', 0, 'CBarringe', 'b9c78b5eb9b4a0d311e1157a37a966f0', '2014-05-15', 'uvrecuperx@yahoo.com', 0, '', '', '', '', '', '', '', 2, 0, 'New Member', 0, 1400148460, 0, 1400148460, 1400151099, 0, 0, 0, 0, 4, '5', 0, 0, 0, 0, 0, 3194967, '07-29-1973', '1973-07-29', -1, -1, '96.127.147.220', 0, 1, 0, 0, -1, 0, 0, 'FIt3>f+b1J9mU9F~(s]Q4(_&VHEdGP', 0, 0, 0, '', 0, 0, 0, 0, 0, 0, 0, 0, 0, 0, 0, 0, '', '', 0, '', 'vb', '', 0, 1, 0, 0, NULL),
(24436, 3, '', 0, 'khan G', 'df26fff59cac35c05ccfcfd8c5c96a6e', '2014-05-15', 'javedakhter429@yahoo.com', 0, '', '', '', '', '', '', '', 2, 0, 'New Member', 0, 1400149867, 0, 1400149867, 1400149867, 0, 0, 0, 0, 4, '5', 0, 0, 0, 0, 0, 3194967, '03-14-1980', '1980-03-14', -1, -1, '182.185.55.26', 0, 1, 0, 0, -1, 0, 0, 'sJkr0b]"whJ&X~tq$D-S`9&'';vl`Gj', 0, 0, 0, '', 0, 0, 0, 0, 0, 0, 0, 0, 0, 0, 0, 0, '', '', 0, '', 'vb', '', 0, 1, 0, 0, NULL),
(24442, 3, '', 0, 'NZJT', 'b079ba14ff272d13bb740fe87a786dc0', '2014-05-15', 'weemecbmes@yahoo.com', 0, '', '', '', '', '', '', '', 2, 0, 'New Member', 0, 1400165164, 0, 1400165164, 1400165164, 0, 0, 0, 0, 4, '5', 0, 0, 0, 0, 0, 3194967, '12-08-1974', '1974-12-08', -1, -1, '178.32.254.17', 0, 1, 0, 0, -1, 0, 0, 'Vvrm%78Yz~}(ubbf[Zkh9Dd$?-8x{.', 0, 0, 0, '', 0, 0, 0, 0, 0, 0, 0, 0, 0, 0, 0, 0, '', '', 0, '', 'vb', '', 0, 1, 0, 0, NULL),
(24496, 3, '', 0, 'BLofland', 'b00104e86b1f597285e61829fb1e7fea', '2014-05-17', 'barttre@outlook.com', 0, '', '', '', '', '', '', '', 2, 0, 'New Member', 0, 1400336953, 0, 1400336953, 1400353654, 0, 0, 0, 0, 4, '5', 0, 0, 0, 0, 0, 3194967, '06-15-1981', '1981-06-15', -1, -1, '69.12.74.213', 0, 1, 0, 0, -1, 0, 0, 'b|<.AP3\\B._,_M@q>au.o,C`+1r[Bv', 0, 0, 0, '', 0, 0, 0, 0, 0, 0, 0, 0, 0, 0, 0, 0, '', '', 0, '', 'vb', '', 0, 1, 0, 0, NULL),
(24453, 3, '', 0, 'E6111', '6a0acefa49e28746cf6d55d62364dc2d', '2014-05-16', 'bkratffdp@yahoo.com', 0, '', '', '', '', '', '', '', 2, 0, 'New Member', 0, 1400209868, 0, 1400209868, 1400317906, 0, 0, 0, 0, 4, '5', 0, 0, 0, 0, 0, 3194967, '10-15-1982', '1982-10-15', -1, -1, '5.39.39.131', 0, 1, 0, 0, -1, 0, 0, '2,KB@uV>d/`_>Q-$y~[Nt@[1D:RYH1', 0, 0, 0, '', 0, 0, 0, 0, 0, 0, 0, 0, 0, 0, 0, 0, '', '', 0, '', 'vb', '', 0, 1, 0, 0, NULL),
(24484, 3, '', 0, 'C90K', '5cff6beef679bdc0ecc286562a41768d', '2014-05-17', 'kileyfxdegenaro@yahoo.com', 0, '', '', '', '', '', '', '', 2, 0, 'New Member', 0, 1400295490, 0, 1400295490, 1400295490, 0, 0, 0, 0, 4, '5', 0, 0, 0, 0, 0, 3194967, '01-11-1979', '1979-01-11', -1, -1, '107.181.70.190', 0, 1, 0, 0, -1, 0, 0, 'xUr7>{!54/g5OGgIHzH=:6$!YhS?@-', 0, 0, 0, '', 0, 0, 0, 0, 0, 0, 0, 0, 0, 0, 0, 0, '', '', 0, '', 'vb', '', 0, 1, 0, 0, NULL),
(24558, 3, '', 0, 'MSumsuma', '2c13b73efbe40480df1e0ad44813e374', '2014-05-19', 'angelicam9madore@yahoo.com', 0, '', '', '', '', '', '', '', 2, 0, 'New Member', 0, 1400498178, 0, 1400498178, 1400498178, 0, 0, 0, 0, 4, '5', 0, 0, 0, 0, 0, 3194967, '10-25-1985', '1985-10-25', -1, -1, '172.245.214.165', 0, 1, 0, 0, -1, 0, 0, '?J;?@45~6h&y^:{MhB\\Bh(D3-d<zb}', 0, 0, 0, '', 0, 0, 0, 0, 0, 0, 0, 0, 0, 0, 0, 0, '', '', 0, '', 'vb', '', 0, 1, 0, 0, NULL),
(24553, 3, '', 0, 'AJack', '911e2e93f78438ba0d34719df3f10b29', '2014-05-19', 'preciousexcerpt08@outlook.com', 0, '', '', '', '', '', '', '', 2, 0, 'New Member', 0, 1400493612, 0, 1400493612, 1400500764, 0, 0, 0, 0, 4, '5', 0, 0, 0, 0, 0, 3194967, '03-25-1979', '1979-03-25', -1, -1, '69.12.72.245', 0, 1, 0, 0, -1, 0, 0, 'oz=H:H$bu?D}<0bnln"3OyfXrsZ]k+', 0, 0, 0, '', 0, 0, 0, 0, 0, 0, 0, 0, 0, 0, 0, 0, '', '', 0, '', 'vb', '', 0, 1, 0, 0, NULL),
(24544, 3, '', 0, 'YCBM', 'a07bb37c83cb3dcdbad0b8147984b3d9', '2014-05-19', 'nbordonjkw@yahoo.com', 0, '', '', '', '', '', '', '', 2, 0, 'New Member', 0, 1400477672, 0, 1400477672, 1400479854, 0, 0, 0, 0, 4, '5', 0, 0, 0, 0, 0, 3194967, '06-04-1977', '1977-06-04', -1, -1, '69.12.65.61', 0, 1, 0, 0, -1, 0, 0, 'C%")o8BwJDW9OL\\fI#8cy+{4BCx<Ct', 0, 0, 0, '', 0, 0, 0, 0, 0, 0, 0, 0, 0, 0, 0, 0, '', '', 0, '', 'vb', '', 0, 1, 0, 0, NULL),
(24503, 3, '', 0, 'CVQJC', '78a1b080ec6c0cdbba58eaee174a27e6', '2014-05-17', 'colleen-cadwallader23@diendanthongtin.com', 0, '', '', '', '', '', '', '', 2, 0, 'New Member', 0, 1400355054, 0, 1400355054, 1400361901, 0, 0, 0, 0, 4, '5', 0, 0, 0, 0, 0, 3194967, '06-11-1977', '1977-06-11', -1, -1, '50.2.195.131', 0, 1, 0, 0, -1, 0, 0, '0zk#{Wn(m`,.4)mO(pq?SKf-`?jj4B', 0, 0, 0, '', 0, 0, 0, 0, 0, 0, 0, 0, 0, 0, 0, 0, '', '', 0, '', 'vb', '', 0, 1, 0, 0, NULL),
(24506, 3, '', 0, 'CDarnell', '26af5fecf30753b9ef01f63db2606778', '2014-05-18', 'vodkaandlime@outlook.com', 0, '', '', '', '', '', '', '', 2, 0, 'New Member', 0, 1400375957, 0, 1400375957, 1400379387, 0, 0, 0, 0, 4, '5', 0, 0, 0, 0, 0, 3194967, '02-03-1978', '1978-02-03', -1, -1, '5.255.91.75', 0, 1, 0, 0, -1, 0, 0, '#].XMVio'')Wp-xGb&Cz;2kyNrh{~T:', 0, 0, 0, '', 0, 0, 0, 0, 0, 0, 0, 0, 0, 0, 0, 0, '', '', 0, '', 'vb', '', 0, 1, 0, 0, NULL),
(24508, 3, '', 0, 'VWelsby', 'f4bd1d0e1930e29c45e955bdddef733c', '2014-05-18', 'von.welsby82@4starmaids.com', 0, '', '', '', '', '', '', '', 2, 0, 'New Member', 0, 1400380377, 0, 1400380377, 1400380377, 0, 0, 0, 0, 4, '5', 0, 0, 0, 0, 0, 3194967, '02-16-1978', '1978-02-16', -1, -1, '23.110.169.189', 0, 1, 0, 0, -1, 0, 0, '|_JVXRPo"\\<d2Ij(pMRwNAqY:G^>~L', 0, 0, 0, '', 0, 0, 0, 0, 0, 0, 0, 0, 0, 0, 0, 0, '', '', 0, '', 'vb', '', 0, 1, 0, 0, NULL),
(24549, 3, '', 0, 'OCNJ', 'eb16937c08bf0d366bf6c08bdd6d5dc6', '2014-05-19', 'barbarousdiseasgo389@outlook.com', 0, '', '', '', '', '', '', '', 2, 0, 'New Member', 0, 1400487974, 0, 1400487974, 1400495255, 0, 0, 0, 0, 4, '5', 0, 0, 0, 0, 0, 3194967, '02-13-1979', '1979-02-13', -1, -1, '85.99.94.82', 0, 1, 0, 0, -1, 0, 0, 'u-)Z)ppi<%=?xG%[!z){(W4UAilZX3', 0, 0, 0, '', 0, 0, 0, 0, 0, 0, 0, 0, 0, 0, 0, 0, '', '', 0, '', 'vb', '', 0, 1, 0, 0, NULL),
(24511, 3, '', 0, 'RAstudill', '9d63362b356163bcc74253e54af2f526', '2014-05-18', 'matesz2.4.n.arch@gmail.com', 0, '', '', '', '', '', '', '', 2, 0, 'New Member', 0, 1400384909, 0, 1400384909, 1400387042, 0, 0, 0, 0, 4, '5', 0, 0, 0, 0, 0, 3194967, '01-12-1985', '1985-01-12', -1, -1, '173.234.181.23', 0, 1, 0, 0, -1, 0, 0, 'j)7V&b_n63H<@UvM*N61]_Ri!6CtSY', 0, 0, 0, '', 0, 0, 0, 0, 0, 0, 0, 0, 0, 0, 0, 0, '', '', 0, '', 'vb', '', 0, 1, 0, 0, NULL),
(24591, 3, '', 0, 'EMcewen', 'e0831118b31c480356fe93c40844f896', '2014-05-20', 'owenblpthj@hotmail.com', 0, '', '', '', '', '', '', '', 2, 0, 'New Member', 0, 1400624578, 0, 1400624578, 1401093883, 0, 0, 0, 0, 4, '5', 0, 0, 0, 0, 0, 3194967, '08-30-1983', '1983-08-30', -1, -1, '50.115.170.90', 0, 1, 0, 0, -1, 0, 0, '<-v6+AJ(kv=uHj/>LMI063LU4.Fl#r', 0, 0, 0, '', 0, 0, 0, 0, 0, 0, 0, 0, 0, 0, 0, 0, '', '', 0, '', 'vb', '', 0, 1, 0, 0, NULL),
(24513, 2, '', 0, 'RogueElement', '8c3d695fbfd616f83b018600e692806d', '2014-05-18', 'lukkisoul@yahoo.com', 0, '', '', '', '', '', '', '', 2, 0, 'New Member', 0, 1400385868, 0, 1400386461, 1400386461, 0, 0, 0, 0, 4, '5', 0, 0, 0, 0, 0, 3194903, '12-31-1976', '1976-12-31', -1, -1, '39.41.167.179', 3656, 1, 0, 0, -1, 0, 0, '0d`DTPb~3sN/N^(OTccb))Jk/Rh^du', 0, 0, 0, '', 0, 0, 0, 0, 0, 0, 0, 0, 0, 0, 0, 0, '', '', 0, '', 'vb', '', 0, 1, 0, 0, NULL),
(24514, 3, '', 0, 'RBaggett', '8eca634e11cc75cccb42f974fe8c8155', '2014-05-18', 'bestyqxrde34n@live.com', 0, '', '', '', '', '', '', '', 2, 0, 'New Member', 0, 1400387428, 0, 1400387428, 1401004127, 0, 0, 0, 0, 4, '5', 0, 0, 0, 0, 0, 3194967, '07-08-1976', '1976-07-08', -1, -1, '50.2.223.24', 0, 1, 0, 0, -1, 0, 0, 'tzPB21#{mZUt5\\yl<7*5EQ$hkhr-K[', 0, 0, 0, '', 0, 0, 0, 0, 0, 0, 0, 0, 0, 0, 0, 0, '', '', 0, '', 'vb', '', 0, 1, 0, 0, NULL),
(24515, 3, '', 0, 'XNWL', '97b19da7ac917b3ed6293eb72982e40a', '2014-05-18', 'languidbevy219hl23@outlook.com', 0, '', '', '', '', '', '', '', 2, 0, 'New Member', 0, 1400388719, 0, 1400388719, 1400428437, 0, 0, 0, 0, 4, '5', 0, 0, 0, 0, 0, 3194967, '08-12-1985', '1985-08-12', -1, -1, '81.4.104.209', 0, 1, 0, 0, -1, 0, 0, '\\Ele6(:W_kk%e~fimc<~X\\"*$]$T!P', 0, 0, 0, '', 0, 0, 0, 0, 0, 0, 0, 0, 0, 0, 0, 0, '', '', 0, '', 'vb', '', 0, 1, 0, 0, NULL),
(24829, 3, '', 0, 'R9937', 'bd9d337d4cd0addc10a55b54c4a52caa', '2014-05-26', 'ross_buzacott@camnangdoisong.com', 0, '', '', '', '', '', '', '', 2, 0, 'New Member', 0, 1401137945, 0, 1401137945, 1401146687, 0, 0, 0, 0, 4, '5', 0, 0, 0, 0, 0, 3194967, '05-07-1978', '1978-05-07', -1, -1, '173.0.55.154', 0, 1, 0, 0, -1, 0, 0, '-t-"T(}*5mT$X_<b(J?&8%$}!B^_2j', 0, 0, 0, '', 0, 0, 0, 0, 0, 0, 0, 0, 0, 0, 0, 0, '', '', 0, '', 'vb', '', 0, 1, 0, 0, NULL),
(24516, 3, '', 0, 'ESimcox', '3f762e38646ef7627365385ad20c90a4', '2014-05-18', 'estelle-simcox@4starmaids.com', 0, '', '', '', '', '', '', '', 2, 0, 'New Member', 0, 1400398711, 0, 1400398711, 1400406027, 0, 0, 0, 0, 4, '5', 0, 0, 0, 0, 0, 3194967, '04-20-1980', '1980-04-20', -1, -1, '136.0.120.75', 0, 1, 0, 0, -1, 0, 0, 'fV7tgT{2yg&AFiuJ)II2{1ue4F=L9W', 0, 0, 0, '', 0, 0, 0, 0, 0, 0, 0, 0, 0, 0, 0, 0, '', '', 0, '', 'vb', '', 0, 1, 0, 0, NULL),
(24525, 3, '', 0, 'M15Z', '00e6aaeafa3255533a551d1fa7584bed', '2014-05-18', 'kyunzggagn@yahoo.com', 0, '', '', '', '', '', '', '', 2, 0, 'New Member', 0, 1400418415, 0, 1400418415, 1400420709, 0, 0, 0, 0, 4, '5', 0, 0, 0, 0, 0, 3194967, '11-10-1974', '1974-11-10', -1, -1, '80.83.121.152', 0, 1, 0, 0, -1, 0, 0, 'FaeV''3,]!S3I$p^+H;a7eg-ao,.qr}', 0, 0, 0, '', 0, 0, 0, 0, 0, 0, 0, 0, 0, 0, 0, 0, '', '', 0, '', 'vb', '', 0, 1, 0, 0, NULL),
(24526, 3, '', 0, 'BWRB', '272e8119d24a3be07f7edd74b0f3a562', '2014-05-18', 'robbinswann48@yahoo.com', 0, '', '', '', '', '', '', '', 2, 0, 'New Member', 0, 1400418532, 0, 1400418532, 1400418532, 0, 0, 0, 0, 4, '5', 0, 0, 0, 0, 0, 3194967, '10-19-1983', '1983-10-19', -1, -1, '5.153.234.26', 0, 1, 0, 0, -1, 0, 0, '4L}z9S>Y''|ea$~Y?N8P8a`T)(''](x}', 0, 0, 0, '', 0, 0, 0, 0, 0, 0, 0, 0, 0, 0, 0, 0, '', '', 0, '', 'vb', '', 0, 1, 0, 0, NULL),
(24527, 3, '', 0, 'WEEK', '7e6b5113bc9eb876798cc299add54eac', '2014-05-18', 'leesabin31@yahoo.com', 0, '', '', '', '', '', '', '', 2, 0, 'New Member', 0, 1400420055, 0, 1400420055, 1400641979, 0, 0, 0, 0, 4, '5', 0, 0, 0, 0, 0, 3194967, '11-01-1981', '1981-11-01', -1, -1, '165.231.22.236', 0, 1, 0, 0, -1, 0, 0, 'I).L^-63@q!ha''hk"o?}OQ]d#~kNo#', 0, 0, 0, '', 0, 0, 0, 0, 0, 0, 0, 0, 0, 0, 0, 0, '', '', 0, '', 'vb', '', 0, 1, 0, 0, NULL),
(24545, 3, '', 0, 'JBuckingh', 'd266e1c755bf16485bc83b91277c904f', '2014-05-19', 'sableauger46rs134@outlook.com', 0, '', '', '', '', '', '', '', 2, 0, 'New Member', 0, 1400478704, 0, 1400478704, 1400480564, 0, 0, 0, 0, 4, '5', 0, 0, 0, 0, 0, 3194967, '05-15-1981', '1981-05-15', -1, -1, '199.119.226.83', 0, 1, 0, 0, -1, 0, 0, '7/k|h3q1KagT3=8T9/}I@1i_]Z=8I]', 0, 0, 0, '', 0, 0, 0, 0, 0, 0, 0, 0, 0, 0, 0, 0, '', '', 0, '', 'vb', '', 0, 1, 0, 0, NULL),
(24524, 2, '', 0, 'mr_shakeel', '24337d8e377df506678baba83d45899a', '2014-05-18', 'mr_shakeelahmad@yahoo.com', 0, '', '', '', '', '', '', '', 2, 0, 'New Member', 0, 1400417527, 0, 1413443278, 1416898907, 0, 0, 0, 0, 4, '5', 0, 0, 0, 0, 0, 3194967, '11-09-1985', '1985-11-09', -1, -1, '116.71.173.147', 0, 1, 0, 0, -1, 0, 0, '''d1=;)aK|Se?COo+_6COvClR7+h<se', 0, 0, 0, '', 0, 0, 0, 0, 0, 0, 0, 0, 0, 0, 0, 0, '', '', 0, '', 'vb', '', 0, 1, 0, 0, NULL),
(24522, 2, '', 0, 'khawar71', '4e0ca09cfc50dfa9717d0deccff01eed', '2014-05-18', 'khawar71@yahoo.com', 0, '', '', '', '', '', '', '', 2, 0, 'New Member', 0, 1400407392, 0, 1400407392, 1400407890, 0, 0, 0, 0, 4, '5', 0, 0, 0, 0, 0, 3194967, '06-17-1971', '1971-06-17', -1, -1, '182.188.166.108', 0, 1, 0, 0, -1, 0, 0, 'w[,2<+{HffGc<6gB%mUt^Fsgw>_3Dz', 0, 0, 0, '', 0, 0, 0, 0, 0, 0, 0, 0, 0, 0, 0, 0, '', '', 0, '', 'vb', '', 0, 1, 0, 0, NULL),
(24587, 2, '', 0, 'nabeelamin13@gmail.com', '7cf024bad78d05bb8ab12f2d5f3678c4', '2014-05-20', 'nabeelamin13@gmail.com', 0, '', '', '', '', '', '', '', 2, 0, 'New Member', 0, 1400601226, 0, 1400601226, 1400601226, 0, 0, 0, 0, 4, '5', 0, 0, 0, 0, 0, 3194967, '10-02-1984', '1984-10-02', -1, -1, '39.55.98.229', 0, 1, 0, 0, -1, 0, 0, '=Ojp74IV21sC;!,K^SO,]Z}6[:(EZU', 0, 0, 0, '', 0, 0, 0, 0, 0, 0, 0, 0, 0, 0, 0, 0, '', '', 0, '', 'vb', '', 0, 1, 0, 0, NULL),
(24579, 3, '', 0, 'aittytts2135', 'f0c135af060c9979ac7ee7a43bfd80ec', '2014-05-20', 'aittytts@ymail.com', 0, '', '', '', '', '', '', '', 2, 0, 'New Member', 0, 1400548548, 0, 1400548548, 1400548548, 0, 0, 0, 0, 4, '6.5', 0, 0, 0, 0, 0, 3194903, '03-08-1976', '1976-03-08', -1, -1, '37.59.161.236', 0, 1, 0, 0, -1, 0, 0, 'WH4^j>WraLJKa\\Yl#G}#{i1=;OalO;', 0, 0, 0, '', 0, 0, 0, 0, 0, 0, 0, 0, 0, 0, 0, 0, '', '', 0, '', 'vb', '', 0, 1, 0, 0, NULL),
(24534, 3, '', 0, 'MHain', 'c129fbaed6c4623dd19537dd284ba71e', '2014-05-18', 'dysfunctionalboim39p@outlook.com', 0, '', '', '', '', '', '', '', 2, 0, 'New Member', 0, 1400431555, 0, 1400431555, 1400434325, 0, 0, 0, 0, 4, '5', 0, 0, 0, 0, 0, 3194967, '09-07-1982', '1982-09-07', -1, -1, '204.44.112.241', 0, 1, 0, 0, -1, 0, 0, '1$1$_k$}rOkBn~qN{U-(fB@Z}jKE+p', 0, 0, 0, '', 0, 0, 0, 0, 0, 0, 0, 0, 0, 0, 0, 0, '', '', 0, '', 'vb', '', 0, 1, 0, 0, NULL),
(24552, 3, '', 0, 'SLamson', '59fd1c383a85762d000bf76316985915', '2014-05-19', 'spearslghfiqxt@live.com', 0, '', '', '', '', '', '', '', 2, 0, 'New Member', 0, 1400490903, 0, 1400490903, 1401115392, 0, 0, 0, 0, 4, '5', 0, 0, 0, 0, 0, 3194967, '12-06-1982', '1982-12-06', -1, -1, '50.2.223.24', 0, 1, 0, 0, -1, 0, 0, 'fs*47]U4FS\\:AEH:OX/L2|j~bqPLl)', 0, 0, 0, '', 0, 0, 0, 0, 0, 0, 0, 0, 0, 0, 0, 0, '', '', 0, '', 'vb', '', 0, 1, 0, 0, NULL),
(24539, 3, '', 0, 'MOhpaebk', '7132dd6a5c6af1034e94617d7a82cc0c', '2014-05-18', 'hyde3b72km@outlook.com', 0, '', '', '', '', '', '', '', 2, 0, 'New Member', 0, 1400442311, 0, 1400442311, 1401002202, 0, 0, 0, 0, 4, '5', 0, 0, 0, 0, 0, 3194967, '06-03-1982', '1982-06-03', -1, -1, '50.2.223.24', 0, 1, 0, 0, -1, 0, 0, '3c$VlR1Xa="N]1oLA~lNFMJrD\\z~&L', 0, 0, 0, '', 0, 0, 0, 0, 0, 0, 0, 0, 0, 0, 0, 0, '', '', 0, '', 'vb', '', 0, 1, 0, 0, NULL),
(24537, 3, '', 0, 'JWhitehur', 'b83f9801098b51e4494c7f044981f9c9', '2014-05-18', 'peronyl01@smart-mail.de', 0, '', '', '', '', '', '', '', 2, 0, 'New Member', 0, 1400438441, 0, 1400438441, 1400490255, 0, 0, 0, 0, 4, '5', 0, 0, 0, 0, 0, 3194967, '11-24-1970', '1970-11-24', -1, -1, '5.135.99.222', 0, 1, 0, 0, -1, 0, 0, ',,?i=b916qgw+T`_u~-AH((p1>8,$3', 0, 0, 0, '', 0, 0, 0, 0, 0, 0, 0, 0, 0, 0, 0, 0, '', '', 0, '', 'vb', '', 0, 1, 0, 0, NULL),
(24575, 3, '', 0, 'DelphiaHa', 'e25793a2a64992eb3353af1ca192d274', '2014-05-20', 'deonrbumumgh@outlook.com', 0, '', '', '', '', '', '', '', 2, 0, 'New Member', 0, 1400544068, 0, 1400544068, 1400570157, 0, 0, 0, 0, 4, '5', 0, 0, 0, 0, 0, 3194967, '06-15-1976', '1976-06-15', -1, -1, '89.47.24.123', 0, 1, 0, 0, -1, 0, 0, '>!p/V^bMd_5=VuUCJt8J^5I"l>h1Fv', 0, 0, 0, '', 0, 0, 0, 0, 0, 0, 0, 0, 0, 0, 0, 0, '', '', 0, '', 'vb', '', 0, 1, 0, 0, NULL),
(24576, 3, '', 0, 'IRatten', '2aa1640732eeca210ac1ff05b494d592', '2014-05-20', 'marlaxqkj@hotmail.com', 0, '', '', '', '', '', '', '', 2, 0, 'New Member', 0, 1400547138, 0, 1400547138, 1400554475, 0, 0, 0, 0, 4, '5', 0, 0, 0, 0, 0, 3194967, '01-04-1983', '1983-01-04', -1, -1, '50.115.161.252', 0, 1, 0, 0, -1, 0, 0, 'EDZ\\<Nu#E[?C2SEDU/+fP>lA<92].D', 0, 0, 0, '', 0, 0, 0, 0, 0, 0, 0, 0, 0, 0, 0, 0, '', '', 0, '', 'vb', '', 0, 1, 0, 0, NULL),
(24548, 2, '', 0, 'Yusra M Taj', 'a9c8cf99df46b6c1964abaad18cb18ad', '2014-05-19', 'yusramanzoor786@gmail.com', 0, '', '', '', '', '', '', '', 2, 1, 'New Member', 0, 1400484118, 0, 1407565570, 1407577916, 0, 0, 0, 0, 4, '5', 0, 0, 0, 0, 0, 3195095, '11-13-1982', '1982-11-13', -1, -1, '119.160.118.237', 0, 1, 0, 0, -1, 0, 0, '&xTKnz"C~%A0>U}|E;"lVEM|3v,&bA', 0, 0, 0, '', 0, 0, 2, 0, 0, 0, 0, 0, 0, 0, 0, 0, '', '', 0, '', 'vb', '', 0, 1, 0, 0, NULL),
(24571, 3, '', 0, 'CFreitag', '171020dfdaf76434519cfcd3890d08b6', '2014-05-19', 'ubiquitousbonfin@outlook.com', 0, '', '', '', '', '', '', '', 2, 0, 'New Member', 0, 1400538754, 0, 1400538754, 1400538754, 0, 0, 0, 0, 4, '5', 0, 0, 0, 0, 0, 3194967, '05-05-1978', '1978-05-05', -1, -1, '204.44.83.34', 0, 1, 0, 0, -1, 0, 0, '{y''q7B-fa>B%,F{<oz1T\\N65K]r''UA', 0, 0, 0, '', 0, 0, 0, 0, 0, 0, 0, 0, 0, 0, 0, 0, '', '', 0, '', 'vb', '', 0, 1, 0, 0, NULL),
(24572, 3, '', 0, 'LShapcott', 'a6988973c3f5f5d39f1a5f9dc3d04a7b', '2014-05-19', 'gyetheredgq@yahoo.com', 0, '', '', '', '', '', '', '', 2, 0, 'New Member', 0, 1400539908, 0, 1400539908, 1400547188, 0, 0, 0, 0, 4, '5', 0, 0, 0, 0, 0, 3194967, '01-11-1975', '1975-01-11', -1, -1, '198.23.175.100', 0, 1, 0, 0, -1, 0, 0, '9}o[${"!8qzIFXv[lB9_In"=A=7enS', 0, 0, 0, '', 0, 0, 0, 0, 0, 0, 0, 0, 0, 0, 0, 0, '', '', 0, '', 'vb', '', 0, 1, 0, 0, NULL),
(24573, 3, '', 0, 'asadchowdary', '0e234733a714f3434c939992cef4b45b', '2014-05-19', 'asadchowdary@aol.com', 0, '', '', '', '', '', '', '', 2, 0, 'New Member', 0, 1400539971, 0, 1400539971, 1400539989, 0, 0, 0, 0, 4, '5', 0, 0, 0, 0, 0, 3194967, '08-25-1986', '1986-08-25', -1, -1, '39.42.196.9', 0, 1, 0, 0, -1, 0, 0, 'UOx>DHs\\f;k^;Tvb6sz3-Gp}qzGqGy', 0, 0, 0, '', 0, 0, 0, 0, 0, 0, 0, 0, 0, 0, 0, 0, '', '', 0, '', 'vb', '', 0, 1, 0, 0, NULL),
(24570, 3, '', 0, 'RKim', '6e35a714f50bc7a8222b7c9e41bceb66', '2014-05-19', 'rod.kim52@cungtuvan.com', 0, '', '', '', '', '', '', '', 2, 0, 'New Member', 0, 1400538146, 0, 1400538146, 1400540683, 0, 0, 0, 0, 4, '5', 0, 0, 0, 0, 0, 3194967, '02-02-1975', '1975-02-02', -1, -1, '173.213.96.167', 0, 1, 0, 0, -1, 0, 0, 'D>kj}VuQdgrE_wnkCopwXYXAHwdo=;', 0, 0, 0, '', 0, 0, 0, 0, 0, 0, 0, 0, 0, 0, 0, 0, '', '', 0, '', 'vb', '', 0, 1, 0, 0, NULL),
(24564, 3, '', 0, 'LSchnell', 'c2595957c273ab3bdcb482057b7b8410', '2014-05-19', 'morenoulzq6eh@hotmail.com', 0, '', '', '', '', '', '', '', 2, 0, 'New Member', 0, 1400517871, 0, 1400517871, 1400517871, 0, 0, 0, 0, 4, '5', 0, 0, 0, 0, 0, 3194967, '02-25-1979', '1979-02-25', -1, -1, '50.115.170.205', 0, 1, 0, 0, -1, 0, 0, '&[Jf0H!{%jj?U,|vjP"I}i2jEXuT|K', 0, 0, 0, '', 0, 0, 0, 0, 0, 0, 0, 0, 0, 0, 0, 0, '', '', 0, '', 'vb', '', 0, 1, 0, 0, NULL),
(24574, 3, '', 0, 'IWawn', '4e54d527b5fcb03cef1b2325b08e2fa6', '2014-05-20', 'hartmanch6ljdq@hotmail.com', 0, '', '', '', '', '', '', '', 2, 0, 'New Member', 0, 1400543984, 0, 1400543984, 1400543984, 0, 0, 0, 0, 4, '5', 0, 0, 0, 0, 0, 3194967, '01-14-1979', '1979-01-14', -1, -1, '50.115.170.144', 0, 1, 0, 0, -1, 0, 0, 'b}NYf[tv|C][=+"##;i-LRK(7nmB\\~', 0, 0, 0, '', 0, 0, 0, 0, 0, 0, 0, 0, 0, 0, 0, 0, '', '', 0, '', 'vb', '', 0, 1, 0, 0, NULL),
(24566, 2, '', 0, 'aliasad936', '27466928d3a8b93c6558d7af7415fcf4', '2014-05-19', 'aliasad936@gmail.com', 0, '', '', '', '', '', '', '', 2, 0, 'New Member', 0, 1400522062, 0, 1401170601, 1401821964, 0, 0, 0, 0, 4, '5', 0, 0, 0, 0, 0, 3194967, '03-08-1987', '1987-03-08', -1, -1, '5.108.69.83', 0, 1, 0, 0, -1, 0, 0, '=?hjy1Y''8<Ts9*J~c6VqB4-k\\L$$*.', 0, 0, 0, '', 0, 0, 3, 0, 0, 0, 0, 0, 0, 0, 0, 0, '', '', 0, '', 'vb', '', 0, 1, 0, 0, NULL),
(24577, 3, '', 0, 'JKhq', 'aa3a3ba6c6309cc821d1c840656ce728', '2014-05-20', 'besauniert@yahoo.com', 0, '', '', '', '', '', '', '', 2, 0, 'New Member', 0, 1400548046, 0, 1400548046, 1400555227, 0, 0, 0, 0, 4, '5', 0, 0, 0, 0, 0, 3194967, '01-02-1971', '1971-01-02', -1, -1, '23.94.99.28', 0, 1, 0, 0, -1, 0, 0, 'CLE/?52wrrC`J=br[f8muB$Ki5R;`p', 0, 0, 0, '', 0, 0, 0, 0, 0, 0, 0, 0, 0, 0, 0, 0, '', '', 0, '', 'vb', '', 0, 1, 0, 0, NULL),
(24568, 2, '', 0, 'utmankhel', '6263ff5b06aee1a4b65fb39867d69e83', '2014-05-19', 'sajjad_utmankhel@yahoo.com', 0, '', '', '', '', '', '', '', 2, 0, 'New Member', 0, 1400528178, 0, 1400531578, 1400531578, 0, 0, 0, 0, 4, '5', 0, 0, 0, 0, 0, 3194967, '10-11-1988', '1988-10-11', -1, -1, '175.107.62.194', 0, 1, 0, 0, -1, 0, 0, '4>F1zaVxd39YYLqdI\\%}G7K)$2US"p', 0, 0, 0, '', 0, 0, 1, 0, 0, 0, 0, 0, 0, 0, 0, 0, '', '', 0, '', 'vb', '', 0, 1, 0, 0, NULL),
(24569, 3, '', 0, 'AHall', '56fe6744bb88b7933291538dfb2b8d8c', '2014-05-19', 'pfaucherokp@yahoo.com', 0, '', '', '', '', '', '', '', 2, 0, 'New Member', 0, 1400530099, 0, 1400530099, 1400537283, 0, 0, 0, 0, 4, '5', 0, 0, 0, 0, 0, 3194967, '12-17-1978', '1978-12-17', -1, -1, '198.23.175.100', 0, 1, 0, 0, -1, 0, 0, 'My5mW4s8_`<(W2:`)~O|hYtic@$\\lL', 0, 0, 0, '', 0, 0, 0, 0, 0, 0, 0, 0, 0, 0, 0, 0, '', '', 0, '', 'vb', '', 0, 1, 0, 0, NULL),
(24633, 3, '', 0, 'KManske', '71edefc80b6201c416c317fbf26229e3', '2014-05-22', 'faikskhr@outlook.com', 0, '', '', '', '', '', '', '', 2, 0, 'New Member', 0, 1400724213, 0, 1400724213, 1400724213, 0, 0, 0, 0, 4, '5', 0, 0, 0, 0, 0, 3194967, '12-07-1971', '1971-12-07', -1, -1, '107.155.65.222', 0, 1, 0, 0, -1, 0, 0, 'C;~SZ6.-bD)1gZlg0m)|]>VYIH"UY4', 0, 0, 0, '', 0, 0, 0, 0, 0, 0, 0, 0, 0, 0, 0, 0, '', '', 0, '', 'vb', '', 0, 1, 0, 0, NULL),
(24589, 3, '', 0, 'Hassan Khan', 'd767a8ae823f82679b9c03cc4469934a', '2014-05-20', 'alih439@gmail.com', 0, '', '', '', '', '', '', '', 2, 0, 'New Member', 0, 1400609734, 0, 1400609734, 1400693212, 0, 0, 0, 0, 4, '5', 0, 0, 0, 0, 0, 3194967, '09-20-1995', '1995-09-20', -1, -1, '39.47.250.108', 0, 1, 0, 0, -1, 0, 0, 'O<vChmb^f97Ao3,c2d[+Xl>|5S''9N7', 0, 0, 0, '', 0, 0, 0, 0, 0, 0, 0, 0, 0, 0, 0, 0, '', '', 0, '', 'vb', '', 0, 1, 0, 0, NULL),
(24584, 3, '', 0, 'LPontius', '67aafeeec6d8415d098a7be0a0818042', '2014-05-20', 'wymerlinxi@outlook.com', 0, '', '', '', '', '', '', '', 2, 0, 'New Member', 0, 1400561378, 0, 1400561378, 1400596257, 0, 0, 0, 0, 4, '5', 0, 0, 0, 0, 0, 3194967, '07-29-1980', '1980-07-29', -1, -1, '107.155.65.137', 0, 1, 0, 0, -1, 0, 0, '?NunF>^)\\\\r]uV_6<!W.uZ$5[@>qeD', 0, 0, 0, '', 0, 0, 0, 0, 0, 0, 0, 0, 0, 0, 0, 0, '', '', 0, '', 'vb', '', 0, 1, 0, 0, NULL),
(24585, 2, '', 0, 'MrHot2000', '7b158d1ce69fa91ad1ac1c5c5f7b58e6', '2014-05-20', 'mrhot2000@hotmail.com', 0, '', '', '', '', '', '', '', 2, 0, 'New Member', 0, 1400566378, 0, 1400584397, 1400584573, 0, 0, 0, 0, 4, '5', 0, 0, 0, 0, 0, 3194967, '04-07-1981', '1981-04-07', -1, -1, '182.178.185.40', 0, 1, 0, 0, -1, 0, 0, 'ZLUKa1Katmq]z1SRJ$1Y^Co$=2.TS-', 0, 0, 0, '', 0, 0, 0, 0, 0, 0, 0, 0, 0, 0, 0, 0, '', '', 0, '', 'vb', '', 0, 1, 0, 0, NULL),
(24586, 3, '', 0, 'MNYPV', 'aa39e3e8f354a3a532a33fa6ca036ab4', '2014-05-20', 'demonicsadness8btnke@nokiamail.com', 0, '', '', '', '', '', '', '', 2, 0, 'New Member', 0, 1400567146, 0, 1400567146, 1400567146, 0, 0, 0, 0, 4, '5', 0, 0, 0, 0, 0, 3194967, '10-31-1975', '1975-10-31', -1, -1, '69.12.88.149', 0, 1, 0, 0, -1, 0, 0, 'iXNGWJ&TuJt''DFy=_;!+%0"GE5F($l', 0, 0, 0, '', 0, 0, 0, 0, 0, 0, 0, 0, 0, 0, 0, 0, '', '', 0, '', 'vb', '', 0, 1, 0, 0, NULL),
(24593, 3, '', 0, 'T4970', '44ed57c5e0f3be5fa5fe788d07170013', '2014-05-21', 'tanesha-irwin@tipbongmoingay.info', 0, '', '', '', '', '', '', '', 2, 0, 'New Member', 0, 1400628942, 0, 1400628942, 1400631930, 0, 0, 0, 0, 4, '5', 0, 0, 0, 0, 0, 3194967, '08-11-1980', '1980-08-11', -1, -1, '69.12.80.193', 0, 1, 0, 0, -1, 0, 0, 'lh&s+I^/yg9f+8c^OX2"eY^1sN5Y@{', 0, 0, 0, '', 0, 0, 0, 0, 0, 0, 0, 0, 0, 0, 0, 0, '', '', 0, '', 'vb', '', 0, 1, 0, 0, NULL),
(24594, 3, '', 0, 'MMansom', '21fa696486f149a4380484af04e10b10', '2014-05-21', 'warmgala4qvy40@outlook.com', 0, '', '', '', '', '', '', '', 2, 0, 'New Member', 0, 1400633213, 0, 1400633213, 1400633213, 0, 0, 0, 0, 4, '5', 0, 0, 0, 0, 0, 3194967, '03-20-1977', '1977-03-20', -1, -1, '192.227.240.222', 0, 1, 0, 0, -1, 0, 0, 'KNLDZ2B["i<!+d848f!JeFlfPiFkZT', 0, 0, 0, '', 0, 0, 0, 0, 0, 0, 0, 0, 0, 0, 0, 0, '', '', 0, '', 'vb', '', 0, 1, 0, 0, NULL),
(24595, 3, '', 0, 'LFrier', '3da8d406502cf7f0a3bd407fb579c8b3', '2014-05-21', 'eckgdv@hotmail.com', 0, '', '', '', '', '', '', '', 2, 0, 'New Member', 0, 1400639540, 0, 1400639540, 1400641702, 0, 0, 0, 0, 4, '5', 0, 0, 0, 0, 0, 3194967, '12-02-1970', '1970-12-02', -1, -1, '199.119.225.252', 0, 1, 0, 0, -1, 0, 0, '&L~x/?uT^vL6pVJoR[%I*([3c4BD9m', 0, 0, 0, '', 0, 0, 0, 0, 0, 0, 0, 0, 0, 0, 0, 0, '', '', 0, '', 'vb', '', 0, 1, 0, 0, NULL),
(24596, 3, '', 0, 'EGoheen', '8cf44fbaaf802bc39a790ea210b0dac3', '2014-05-21', 'burtonyocvdbqt@outlook.com', 0, '', '', '', '', '', '', '', 2, 0, 'New Member', 0, 1400652664, 0, 1400652664, 1401160803, 0, 0, 0, 0, 4, '5', 0, 0, 0, 0, 0, 3194967, '07-09-1980', '1980-07-09', -1, -1, '198.12.75.130', 0, 1, 0, 0, -1, 0, 0, 'cq"<2JB9NF.,#Yb2{D=;p3PP37A3):', 0, 0, 0, '', 0, 0, 0, 0, 0, 0, 0, 0, 0, 0, 0, 0, '', '', 0, '', 'vb', '', 0, 1, 0, 0, NULL),
(24597, 3, '', 0, 'VKZA', 'b60ebbe91b86fba9e29934cb1c0916c3', '2014-05-21', 'abashedalmanac55f83@outlook.com', 0, '', '', '', '', '', '', '', 2, 0, 'New Member', 0, 1400654833, 0, 1400654833, 1400657067, 0, 0, 0, 0, 4, '5', 0, 0, 0, 0, 0, 3194967, '03-21-1981', '1981-03-21', -1, -1, '107.181.70.100', 0, 1, 0, 0, -1, 0, 0, '%Ko1J8xT+Sb_Xl5*I;VY^qLwKi{coh', 0, 0, 0, '', 0, 0, 0, 0, 0, 0, 0, 0, 0, 0, 0, 0, '', '', 0, '', 'vb', '', 0, 1, 0, 0, NULL),
(24598, 3, '', 0, 'BIfl', '4ae738bab1a44c73ee174a3aca084a86', '2014-05-21', 'ronnytqqj@hotmail.com', 0, '', '', '', '', '', '', '', 2, 0, 'New Member', 0, 1400657388, 0, 1400657388, 1400666051, 0, 0, 0, 0, 4, '5', 0, 0, 0, 0, 0, 3194967, '01-30-1979', '1979-01-30', -1, -1, '162.218.239.51', 0, 1, 0, 0, -1, 0, 0, 's=U}ew{UC}_<;+p''Juim]c8jgOl$n{', 0, 0, 0, '', 0, 0, 0, 0, 0, 0, 0, 0, 0, 0, 0, 0, '', '', 0, '', 'vb', '', 0, 1, 0, 0, NULL),
(24599, 3, '', 0, 'BGroce', '5c2277e8af9c5dfd838531f73754777e', '2014-05-21', 'wvschanzcsr@yahoo.com', 0, '', '', '', '', '', '', '', 2, 0, 'New Member', 0, 1400657452, 0, 1400657452, 1400657452, 0, 0, 0, 0, 4, '5', 0, 0, 0, 0, 0, 3194967, '03-04-1979', '1979-03-04', -1, -1, '151.237.177.45', 0, 1, 0, 0, -1, 0, 0, 'G1f7m77`|`}GF<y5-(x(\\gz''7HHiPB', 0, 0, 0, '', 0, 0, 0, 0, 0, 0, 0, 0, 0, 0, 0, 0, '', '', 0, '', 'vb', '', 0, 1, 0, 0, NULL),
(24630, 3, '', 0, 'LCurtin', 'bb1519892ed2d74bd982831385f99ef7', '2014-05-22', 'crediblefireworcu528@outlook.com', 0, '', '', '', '', '', '', '', 2, 0, 'New Member', 0, 1400722911, 0, 1400722911, 1400724967, 0, 0, 0, 0, 4, '5', 0, 0, 0, 0, 0, 3194967, '09-05-1980', '1980-09-05', -1, -1, '69.12.78.126', 0, 1, 0, 0, -1, 0, 0, 'i`[TY41dgr,3&0l\\;6;f,JL~WTlO4?', 0, 0, 0, '', 0, 0, 0, 0, 0, 0, 0, 0, 0, 0, 0, 0, '', '', 0, '', 'vb', '', 0, 1, 0, 0, NULL),
(24601, 3, '', 0, 'BMahn', '7f151abb8cf1dece89ccedec5ef5a7dd', '2014-05-21', 'erskywgx@hotmail.com', 0, '', '', '', '', '', '', '', 2, 0, 'New Member', 0, 1400660187, 0, 1400660187, 1400660187, 0, 0, 0, 0, 4, '5', 0, 0, 0, 0, 0, 3194967, '08-22-1984', '1984-08-22', -1, -1, '192.95.43.220', 0, 1, 0, 0, -1, 0, 0, 'EUcnT&m5ydYi2FJJ''I`K{TD*xT@~]p', 0, 0, 0, '', 0, 0, 0, 0, 0, 0, 0, 0, 0, 0, 0, 0, '', '', 0, '', 'vb', '', 0, 1, 0, 0, NULL),
(24602, 3, '', 0, 'LHns', 'e3fc03ded2ca58515dc8064b159e0487', '2014-05-21', 'isaagvessar@yahoo.com', 0, '', '', '', '', '', '', '', 2, 0, 'New Member', 0, 1400663439, 0, 1400663439, 1400663439, 0, 0, 0, 0, 4, '5', 0, 0, 0, 0, 0, 3194967, '01-08-1980', '1980-01-08', -1, -1, '178.32.8.237', 0, 1, 0, 0, -1, 0, 0, 'OdEVQA;v.mq=MC4.5e=k7X|W+nJ"7w', 0, 0, 0, '', 0, 0, 0, 0, 0, 0, 0, 0, 0, 0, 0, 0, '', '', 0, '', 'vb', '', 0, 1, 0, 0, NULL),
(24820, 3, '', 0, 'GZRM', '28652e6f21322e5dcdd48861f6649608', '2014-05-26', 'fretfulquibble1f8741@outlook.com', 0, '', '', '', '', '', '', '', 2, 0, 'New Member', 0, 1401106160, 0, 1401106160, 1401108398, 0, 0, 0, 0, 4, '5', 0, 0, 0, 0, 0, 3194967, '04-25-1975', '1975-04-25', -1, -1, '69.12.74.151', 0, 1, 0, 0, -1, 0, 0, 'u;J+Z_gOtvP1^>2jSUi9SC&\\x(I@t4', 0, 0, 0, '', 0, 0, 0, 0, 0, 0, 0, 0, 0, 0, 0, 0, '', '', 0, '', 'vb', '', 0, 1, 0, 0, NULL),
(24604, 3, '', 0, 'M37U', '38f9d644c0ce181adc109415af2eefbd', '2014-05-21', 'budzta@outlook.com', 0, '', '', '', '', '', '', '', 2, 0, 'New Member', 0, 1400668659, 0, 1400668659, 1401101620, 0, 0, 0, 0, 4, '5', 0, 0, 0, 0, 0, 3194967, '07-24-1970', '1970-07-24', -1, -1, '108.166.183.226', 0, 1, 0, 0, -1, 0, 0, ')YL=P\\_o8!3]ePHu%l}@ba-tK>B0Cm', 0, 0, 0, '', 0, 0, 0, 0, 0, 0, 0, 0, 0, 0, 0, 0, '', '', 0, '', 'vb', '', 0, 1, 0, 0, NULL),
(24605, 3, '', 0, 'CRooke', '95d82dbe85145eaeadeee67f6d282933', '2014-05-21', 'aeskwef@hotmail.com', 0, '', '', '', '', '', '', '', 2, 0, 'New Member', 0, 1400669104, 0, 1400669104, 1400671271, 0, 0, 0, 0, 4, '5', 0, 0, 0, 0, 0, 3194967, '04-08-1975', '1975-04-08', -1, -1, '178.33.141.85', 0, 1, 0, 0, -1, 0, 0, '-a4DDTp-YkZP"Bh/wA&Nvkp_h).pXj', 0, 0, 0, '', 0, 0, 0, 0, 0, 0, 0, 0, 0, 0, 0, 0, '', '', 0, '', 'vb', '', 0, 1, 0, 0, NULL),
(24662, 3, '', 0, 'LCaballer', 'd331f27301b0d997a3b63e9139818207', '2014-05-22', 'leanna_caballero40@camnangtonghop.com', 0, '', '', '', '', '', '', '', 2, 0, 'New Member', 0, 1400752265, 0, 1400752265, 1400754524, 0, 0, 0, 0, 4, '5', 0, 0, 0, 0, 0, 3194967, '07-10-1984', '1984-07-10', -1, -1, '173.232.104.167', 0, 1, 0, 0, -1, 0, 0, 'd[Sm^''Sz2LJ="h902:E#''[R:{/kf\\>', 0, 0, 0, '', 0, 0, 0, 0, 0, 0, 0, 0, 0, 0, 0, 0, '', '', 0, '', 'vb', '', 0, 1, 0, 0, NULL),
(24632, 3, '', 0, 'SXWL', '614245fa330e928a55b02283893816c8', '2014-05-22', 'waggishoverviewup25u@outlook.com', 0, '', '', '', '', '', '', '', 2, 0, 'New Member', 0, 1400724155, 0, 1400724155, 1400726816, 0, 0, 0, 0, 4, '5', 0, 0, 0, 0, 0, 3194967, '11-14-1972', '1972-11-14', -1, -1, '83.7.92.36', 0, 1, 0, 0, -1, 0, 0, 'brCFm}J(Yp*^T$MS}#[`%Qe=h\\;K{n', 0, 0, 0, '', 0, 0, 0, 0, 0, 0, 0, 0, 0, 0, 0, 0, '', '', 0, '', 'vb', '', 0, 1, 0, 0, NULL),
(24668, 3, '', 0, 'TMoats', '64cf136b0084e3e9e7ffc1d6756e5134', '2014-05-22', 'steffanieqhseidman@yahoo.com', 0, '', '', '', '', '', '', '', 2, 0, 'New Member', 0, 1400767648, 0, 1400767648, 1400767648, 0, 0, 0, 0, 4, '5', 0, 0, 0, 0, 0, 3194967, '12-07-1978', '1978-12-07', -1, -1, '173.0.55.242', 0, 1, 0, 0, -1, 0, 0, ']''0L}Y+`*;me1gbbFA2^EWJW}Y`fE{', 0, 0, 0, '', 0, 0, 0, 0, 0, 0, 0, 0, 0, 0, 0, 0, '', '', 0, '', 'vb', '', 0, 1, 0, 0, NULL),
(24628, 3, '', 0, 'TDerr', 'e8cbd9e5f7029b2697e048f5cabf3aa2', '2014-05-22', 'tddebryfidj@yahoo.com', 0, '', '', '', '', '', '', '', 2, 0, 'New Member', 0, 1400720639, 0, 1400720639, 1400727874, 0, 0, 0, 0, 4, '5', 0, 0, 0, 0, 0, 3194967, '10-27-1970', '1970-10-27', -1, -1, '23.94.99.28', 0, 1, 0, 0, -1, 0, 0, '92"&WH''l)VTf[;Su-dBB\\Yj`9<OLhz', 0, 0, 0, '', 0, 0, 0, 0, 0, 0, 0, 0, 0, 0, 0, 0, '', '', 0, '', 'vb', '', 0, 1, 0, 0, NULL),
(24609, 2, '', 0, 'aleyali', 'b574f5890c32382e72218382d7216fa6', '2014-05-21', 'syedaleyali@gmail.com', 0, '', '', '', '', '', '', '', 2, 0, 'New Member', 0, 1400678333, 0, 1400678333, 1400678568, 0, 0, 0, 0, 4, '5', 0, 0, 0, 0, 0, 3194967, '11-05-1976', '1976-11-05', -1, -1, '203.101.163.149', 0, 1, 0, 0, -1, 0, 0, 'is?hf~VAR%Ka%Iv:1El:2m7$|#NfXN', 0, 0, 0, '', 0, 0, 0, 0, 0, 0, 0, 0, 0, 0, 0, 0, '', '', 0, '', 'vb', '', 0, 1, 0, 0, NULL),
(24610, 3, '', 0, 'DNLZ', '699ed0168f833a42d72fcab6ab31095d', '2014-05-21', 'freesdq@hotmail.com', 0, '', '', '', '', '', '', '', 2, 0, 'New Member', 0, 1400685813, 0, 1400685813, 1400687944, 0, 0, 0, 0, 4, '5', 0, 0, 0, 0, 0, 3194967, '05-18-1978', '1978-05-18', -1, -1, '188.165.169.253', 0, 1, 0, 0, -1, 0, 0, '`Eg4IyR}<3\\(R.0J54MDKZ|z!r5AuB', 0, 0, 0, '', 0, 0, 0, 0, 0, 0, 0, 0, 0, 0, 0, 0, '', '', 0, '', 'vb', '', 0, 1, 0, 0, NULL),
(24611, 3, '', 0, 'MWolford', '4e173735311bacfe534f08125908cc7f', '2014-05-21', 'kassiejwx177@hotmail.com', 0, '', '', '', '', '', '', '', 2, 0, 'New Member', 0, 1400686447, 0, 1400686447, 1400697482, 0, 0, 0, 0, 4, '5', 0, 0, 0, 0, 0, 3194967, '10-11-1970', '1970-10-11', -1, -1, '192.227.160.167', 0, 1, 0, 0, -1, 0, 0, 'tIc\\]Umh+BZ6.Bw7/C]G/OR0_K3t9R', 0, 0, 0, '', 0, 0, 0, 0, 0, 0, 0, 0, 0, 0, 0, 0, '', '', 0, '', 'vb', '', 0, 1, 0, 0, NULL),
(24612, 3, '', 0, 'KLzl', '216d8fd1bc45c952866209aec6ab93d7', '2014-05-21', 'luteuzdyf@yahoo.com', 0, '', '', '', '', '', '', '', 2, 0, 'New Member', 0, 1400688544, 0, 1400688544, 1400691388, 0, 0, 0, 0, 4, '5', 0, 0, 0, 0, 0, 3194967, '09-11-1971', '1971-09-11', -1, -1, '178.32.56.248', 0, 1, 0, 0, -1, 0, 0, 'O9,`Y+FQM$a(KXV2ZjGI,2bR>xrUUW', 0, 0, 0, '', 0, 0, 0, 0, 0, 0, 0, 0, 0, 0, 0, 0, '', '', 0, '', 'vb', '', 0, 1, 0, 0, NULL),
(24613, 3, '', 0, 'fahadgondal', '72f9da64c17f527bc363d4aef1a6c24f', '2014-05-21', 'fahadgondal85@gmail.com', 0, '', '', '', '', '', '', '', 2, 0, 'New Member', 0, 1400690739, 0, 1400690891, 1477478649, 0, 0, 0, 0, 4, '5', 0, 0, 0, 0, 0, 3194967, '02-20-1985', '1985-02-20', -1, -1, '101.50.116.229', 0, 1, 0, 0, -1, 0, 0, 'ZE"m+>`wz_oy?7+N8-TB3Y_r>x7Sx}', 0, 0, 0, '', 0, 0, 0, 0, 0, 0, 0, 0, 0, 0, 0, 0, '', '', 0, '', 'vb', '', 0, 1, 0, 0, NULL),
(24614, 2, '', 0, 'crmehmood', '2a5f294cbf66f14c2c9bd37ce6ae42ba', '2014-05-21', 'rashid.mehmood@nafafunds.com', 0, '', '', '', '', '', '', '', 2, 0, 'New Member', 0, 1400691458, 0, 1400691496, 1400746491, 0, 0, 0, 0, 4, '5', 0, 0, 0, 0, 0, 3194967, '04-17-1977', '1977-04-17', -1, -1, '110.39.160.74', 0, 1, 0, 0, -1, 0, 0, '~2`M3Ky.fHIHk*a)siwJjr.F$1{Jr?', 0, 0, 0, '', 0, 0, 0, 0, 0, 0, 0, 0, 0, 0, 0, 0, '', '', 0, '', 'vb', '', 0, 1, 0, 0, NULL),
(24615, 3, '', 0, 'SNeild', '5108f1ba406cbec6c605eb073f57e9e1', '2014-05-21', 'spencer.neild@camnang24h.com', 0, '', '', '', '', '', '', '', 2, 0, 'New Member', 0, 1400691682, 0, 1400691682, 1400700419, 0, 0, 0, 0, 4, '5', 0, 0, 0, 0, 0, 3194967, '08-09-1982', '1982-08-09', -1, -1, '50.115.168.149', 0, 1, 0, 0, -1, 0, 0, 'bfw8]#gHPWFcTKw;_J1H@t.X:y2H}5', 0, 0, 0, '', 0, 0, 0, 0, 0, 0, 0, 0, 0, 0, 0, 0, '', '', 0, '', 'vb', '', 0, 1, 0, 0, NULL),
(24884, 3, '', 0, 'A2360', 'a1839146a424327f679991f6037cb672', '2014-05-27', 'kentv6aczpv@hotmail.com', 0, '', '', '', '', '', '', '', 2, 0, 'New Member', 0, 1401198053, 0, 1401198053, 1401198053, 0, 0, 0, 0, 4, '5', 0, 0, 0, 0, 0, 3194967, '09-23-1982', '1982-09-23', -1, -1, '50.115.171.35', 0, 1, 0, 0, -1, 0, 0, 'nnLW|_y>RjSd03byTTy|&iq7sGvN9I', 0, 0, 0, '', 0, 0, 0, 0, 0, 0, 0, 0, 0, 0, 0, 0, '', '', 0, '', 'vb', '', 0, 1, 0, 0, NULL),
(24626, 3, '', 0, 'JLantz', '3aa8504ffe3c556c8603ab4565833b36', '2014-05-22', 'waller2tm6rxd@hotmail.com', 0, '', '', '', '', '', '', '', 2, 0, 'New Member', 0, 1400713732, 0, 1400713732, 1401184657, 0, 0, 0, 0, 4, '5', 0, 0, 0, 0, 0, 3194967, '02-02-1974', '1974-02-02', -1, -1, '50.115.170.205', 0, 1, 0, 0, -1, 0, 0, 'J-}/2JGx>MSi''/)zZiV_a7''.h0{vIl', 0, 0, 0, '', 0, 0, 0, 0, 0, 0, 0, 0, 0, 0, 0, 0, '', '', 0, '', 'vb', '', 0, 1, 0, 0, NULL),
(24617, 3, '', 0, 'DBooth', '21756590dd4c10b565fc70d38ba3adaf', '2014-05-21', 'spearsj1xqaa@live.com', 0, '', '', '', '', '', '', '', 2, 0, 'New Member', 0, 1400694980, 0, 1400694980, 1400694980, 0, 0, 0, 0, 4, '5', 0, 0, 0, 0, 0, 3194967, '01-20-1971', '1971-01-20', -1, -1, '208.89.208.183', 0, 1, 0, 0, -1, 0, 0, '10b-G[fa=hKU2xC&@KY1eTBs^,>b(/', 0, 0, 0, '', 0, 0, 0, 0, 0, 0, 0, 0, 0, 0, 0, 0, '', '', 0, '', 'vb', '', 0, 1, 0, 0, NULL),
(24618, 3, '', 0, 'LCopley', 'b05e09ec61a408941845e142d6986737', '2014-05-21', 'gsm.pedia.gsa@gmail.com', 0, '', '', '', '', '', '', '', 2, 0, 'New Member', 0, 1400697738, 0, 1400697738, 1400700004, 0, 0, 0, 0, 4, '5', 0, 0, 0, 0, 0, 3194967, '11-12-1975', '1975-11-12', -1, -1, '190.21.187.113', 0, 1, 0, 0, -1, 0, 0, 'ZU"bpg|''e+zmyv#]U<iW}{-+";\\:BV', 0, 0, 0, '', 0, 0, 0, 0, 0, 0, 0, 0, 0, 0, 0, 0, '', '', 0, '', 'vb', '', 0, 1, 0, 0, NULL),
(24619, 3, '', 0, 'IMoffet', '88c0b14dec215b2666ee911c3f23c5b5', '2014-05-21', 'alafvemvu1984@yahoo.co.uk', 0, '', '', '', '', '', '', '', 2, 0, 'New Member', 0, 1400698105, 0, 1400698105, 1400698105, 0, 0, 0, 0, 4, '5', 0, 0, 0, 0, 0, 3194967, '03-08-1971', '1971-03-08', -1, -1, '69.12.72.156', 0, 1, 0, 0, -1, 0, 0, 'V~IaW''5yV1_bms8f?cnOP}("DEzPM(', 0, 0, 0, '', 0, 0, 0, 0, 0, 0, 0, 0, 0, 0, 0, 0, '', '', 0, '', 'vb', '', 0, 1, 0, 0, NULL),
(24634, 3, '', 0, 'EForeman', '7b94ea16d71131a06da124da51774904', '2014-05-22', 'larrywilson050@gmail.com', 0, '', '', '', '', '', '', '', 2, 0, 'New Member', 0, 1400724587, 0, 1400724587, 1400733465, 0, 0, 0, 0, 4, '5', 0, 0, 0, 0, 0, 3194967, '02-24-1971', '1971-02-24', -1, -1, '107.155.81.155', 0, 1, 0, 0, -1, 0, 0, 'P*\\^7?#@Piy=R*+Z(gx^BC''Dw_W?\\''', 0, 0, 0, '', 0, 0, 0, 0, 0, 0, 0, 0, 0, 0, 0, 0, '', '', 0, '', 'vb', '', 0, 1, 0, 0, NULL),
(24621, 3, '', 0, 'ranjha', 'be96fd6eec110fed29b5c1fba7868f74', '2014-05-21', 'softglaxy007@yahoo.com', 0, '', '', '', '', '', '', '', 2, 0, 'New Member', 0, 1400701754, 0, 1400701754, 1400701754, 0, 0, 0, 0, 4, '5', 0, 0, 0, 0, 0, 3194967, '04-04-1991', '1991-04-04', -1, -1, '39.47.75.115', 0, 1, 0, 0, -1, 0, 0, '_Vby]6flxuLooZbZs?nn%kFOkBam''`', 0, 0, 0, '', 0, 0, 0, 0, 0, 0, 0, 0, 0, 0, 0, 0, '', '', 0, '', 'vb', '', 0, 1, 0, 0, NULL),
(24622, 3, '', 0, 'HHuber', '646f993d165184e59a8a6ce7c562e7d5', '2014-05-21', 'draconiannarratyrp7@nokiamail.com', 0, '', '', '', '', '', '', '', 2, 0, 'New Member', 0, 1400711043, 0, 1400711043, 1400711043, 0, 0, 0, 0, 4, '5', 0, 0, 0, 0, 0, 3194967, '12-22-1976', '1976-12-22', -1, -1, '192.161.162.107', 0, 1, 0, 0, -1, 0, 0, 'o.A{CI0"*a?\\KCp5B6q3HD={]UT##R', 0, 0, 0, '', 0, 0, 0, 0, 0, 0, 0, 0, 0, 0, 0, 0, '', '', 0, '', 'vb', '', 0, 1, 0, 0, NULL),
(24623, 3, '', 0, 'PF78', 'a1a30cf666fef7a59be3ff674747df12', '2014-05-21', 'volatileadult786428@outlook.com', 0, '', '', '', '', '', '', '', 2, 0, 'New Member', 0, 1400711051, 0, 1400711051, 1400713065, 0, 0, 0, 0, 4, '5', 0, 0, 0, 0, 0, 3194967, '06-12-1974', '1974-06-12', -1, -1, '69.12.74.75', 0, 1, 0, 0, -1, 0, 0, '9LpbI|}zwU4UF0EaJM8%7NbBEAi/cp', 0, 0, 0, '', 0, 0, 0, 0, 0, 0, 0, 0, 0, 0, 0, 0, '', '', 0, '', 'vb', '', 0, 1, 0, 0, NULL),
(24624, 3, '', 0, 'VXSA', '415504301eb47177cbb7f02b62d3991e', '2014-05-21', 'johnfjqn@outlook.com', 0, '', '', '', '', '', '', '', 2, 0, 'New Member', 0, 1400712830, 0, 1400712830, 1400716608, 0, 0, 0, 0, 4, '5', 0, 0, 0, 0, 0, 3194967, '09-30-1977', '1977-09-30', -1, -1, '209.148.82.164', 0, 1, 0, 0, -1, 0, 0, '?ey(%:Pgauq<D.PV!.yGlMk4jDpKOQ', 0, 0, 0, '', 0, 0, 0, 0, 0, 0, 0, 0, 0, 0, 0, 0, '', '', 0, '', 'vb', '', 0, 1, 0, 0, NULL),
(24661, 2, '', 0, 'mrBablu', '10fdb73af260993c980f3064830d61c6', '2014-05-22', 'bablutrublu@gmail.com', 0, '', '', '', '', '', '', '', 2, 0, 'New Member', 0, 1400751587, 0, 1400910616, 1400910616, 0, 0, 0, 0, 4, '5', 0, 0, 0, 0, 0, 3194967, '07-17-1992', '1992-07-17', -1, -1, '39.59.78.91', 0, 1, 0, 0, -1, 0, 0, 'o9^j3,+rTAcCe.eLD"4bF:leZE/b"S', 0, 0, 0, '', 0, 0, 0, 0, 0, 0, 0, 0, 0, 0, 0, 0, '77d939d2df5a2c4d93a912784c2ff8df', '', 0, '', 'vb', '', 0, 1, 0, 0, NULL),
(24636, 2, '', 0, 'MDhakiyar', '56cdb0f809e94e316efb8475cb1c7193', '2014-05-22', 'pervqmmvez@yahoo.com', 0, '', '', '', '', '', '', '', 2, 0, 'New Member', 0, 1400727692, 0, 1400727692, 1400743548, 0, 0, 0, 0, 4, '5', 0, 0, 0, 0, 0, 3194967, '05-11-1975', '1975-05-11', -1, -1, '23.231.7.7', 0, 1, 0, 0, -1, 0, 0, '55}R/4<Xr*1s29g''5C>UZn{(i7~S[)', 0, 0, 0, '', 0, 0, 0, 0, 0, 0, 0, 0, 0, 0, 0, 0, '', '', 0, '', 'vb', '', 0, 1, 0, 0, NULL),
(24637, 2, '', 0, 'ZahidJutt', 'a9450372a806bf4299400fbe28259e8e', '2014-05-22', 'zahidjutt@msn.com', 0, '', '', '', '', '', '', '', 2, 0, 'New Member', 0, 1400728251, 0, 1427327095, 1427331969, 0, 0, 0, 0, 4, '5', 0, 0, 0, 0, 0, 3194967, '08-26-1988', '1988-08-26', -1, -1, '111.119.172.192', 0, 1, 0, 0, -1, 0, 0, '`JG=}7&:phfTN~}|\\Wgz$0T_Eif%6[', 0, 0, 0, '', 0, 0, 0, 0, 0, 0, 0, 0, 0, 0, 0, 0, '', '', 0, '', 'vb', '', 0, 1, 0, 0, NULL),
(24670, 3, '', 0, 'AShick', '6630469c0eec24b5ff6e87e7132d5b62', '2014-05-22', 'nuttynut518@hotmail.com', 0, '', '', '', '', '', '', '', 2, 0, 'New Member', 0, 1400781784, 0, 1400781784, 1400784666, 0, 0, 0, 0, 4, '5', 0, 0, 0, 0, 0, 3194967, '01-26-1985', '1985-01-26', -1, -1, '107.155.118.8', 0, 1, 0, 0, -1, 0, 0, 'WFv(>f=7-KhV''+DH}S&'',xC<aV|&RO', 0, 0, 0, '', 0, 0, 0, 0, 0, 0, 0, 0, 0, 0, 0, 0, '', '', 0, '', 'vb', '', 0, 1, 0, 0, NULL),
(24639, 3, '', 0, 'LLymburne', '5e3f7eb34c9b43ce5167e85427cd9d7f', '2014-05-22', 'liza.lymburner39@camnang24h.com', 0, '', '', '', '', '', '', '', 2, 0, 'New Member', 0, 1400728865, 0, 1400728865, 1400737511, 0, 0, 0, 0, 4, '5', 0, 0, 0, 0, 0, 3194967, '08-09-1976', '1976-08-09', -1, -1, '173.232.104.167', 0, 1, 0, 0, -1, 0, 0, '@4&'':h%pItbe]_>WoA"En+V]9&A:x/', 0, 0, 0, '', 0, 0, 0, 0, 0, 0, 0, 0, 0, 0, 0, 0, '', '', 0, '', 'vb', '', 0, 1, 0, 0, NULL),
(24640, 3, '', 0, 'E27S', '605e724d2c1549aa7b28e1f9076f6729', '2014-05-22', 'eugenio_veitch@iidiscounts.org', 0, '', '', '', '', '', '', '', 2, 0, 'New Member', 0, 1400732199, 0, 1400732199, 1400734846, 0, 0, 0, 0, 4, '5', 0, 0, 0, 0, 0, 3194967, '02-21-1975', '1975-02-21', -1, -1, '50.115.160.91', 0, 1, 0, 0, -1, 0, 0, '.>~oh%%h#GQUWKpt?oG}dp9VyFaQ?Z', 0, 0, 0, '', 0, 0, 0, 0, 0, 0, 0, 0, 0, 0, 0, 0, '', '', 0, '', 'vb', '', 0, 1, 0, 0, NULL),
(24642, 3, '', 0, 'DI74', 'c4084a98c2e568949d428e2474c3c0b6', '2014-05-22', 'casonuxjp@hotmail.com', 0, '', '', '', '', '', '', '', 2, 0, 'New Member', 0, 1400735614, 0, 1400735614, 1400743583, 0, 0, 0, 0, 4, '5', 0, 0, 0, 0, 0, 3194967, '01-29-1972', '1972-01-29', -1, -1, '172.245.214.233', 0, 1, 0, 0, -1, 0, 0, '%!k*{$81j''nDb(hyUImDM8~>-KT*#j', 0, 0, 0, '', 0, 0, 0, 0, 0, 0, 0, 0, 0, 0, 0, 0, '', '', 0, '', 'vb', '', 0, 1, 0, 0, NULL),
(24643, 2, '', 0, 'azhar yar khan', 'bc5508118287051ad7e31f6366acbbdd', '2014-05-22', 'azharyk2008@gmail.com', 0, '', '', '', '', '', '', '', 2, 0, 'New Member', 0, 1400736038, 0, 1400736897, 1400736897, 0, 0, 0, 0, 4, '12', 0, 0, 0, 0, 0, 3194967, '08-28-1973', '1973-08-28', -1, -1, '111.119.169.124', 0, 1, 0, 0, -1, 0, 0, ']!j,$cFTh[5C_|aRDK[|w"CT=h/z[O', 0, 0, 0, '', 0, 0, 0, 0, 0, 0, 0, 0, 0, 0, 0, 0, '', '', 0, '', 'vb', '', 0, 1, 0, 0, NULL),
(24644, 3, '', 0, 'WSchoonov', 'a1238c8f46e056bd7b7a786341bb5a72', '2014-05-22', 'ordinarymanaclekx83z@outlook.com', 0, '', '', '', '', '', '', '', 2, 0, 'New Member', 0, 1400736128, 0, 1400736128, 1400738378, 0, 0, 0, 0, 4, '5', 0, 0, 0, 0, 0, 3194967, '05-01-1974', '1974-05-01', -1, -1, '107.158.22.105', 0, 1, 0, 0, -1, 0, 0, 'u,hJ:A],`~4C3c;qT<VUZfqPB[LWgd', 0, 0, 0, '', 0, 0, 0, 0, 0, 0, 0, 0, 0, 0, 0, 0, '', '', 0, '', 'vb', '', 0, 1, 0, 0, NULL),
(24680, 3, '', 0, 'N53L', '13217796fe135d7971beb61a58e08e66', '2014-05-23', 'availableevasio6ps88@outlook.com', 0, '', '', '', '', '', '', '', 2, 0, 'New Member', 0, 1400806717, 0, 1400806717, 1400809487, 0, 0, 0, 0, 4, '5', 0, 0, 0, 0, 0, 3194967, '02-24-1974', '1974-02-24', -1, -1, '198.55.113.119', 0, 1, 0, 0, -1, 0, 0, 'G7UUO3/~9=*c*gCNS+@"O[\\cEFZ2d''', 0, 0, 0, '', 0, 0, 0, 0, 0, 0, 0, 0, 0, 0, 0, 0, '', '', 0, '', 'vb', '', 0, 1, 0, 0, NULL),
(24646, 2, '', 0, 'Kalyam Shareef', '3cd1efb4db35e7632cffc2953db1d984', '2014-05-22', 'oo7_t@hotmail.com', 0, '', '', '', '', '', '', '', 2, 0, 'New Member', 0, 1400736640, 0, 1400736640, 1400736640, 0, 0, 0, 0, 4, '5', 0, 0, 0, 0, 0, 3194967, '04-21-1990', '1990-04-21', -1, -1, '39.33.164.144', 0, 1, 0, 0, -1, 0, 0, '''Mf;Cpis*Io|/;d:xj''T76**c;\\7Ar', 0, 0, 0, '', 0, 0, 0, 0, 0, 0, 0, 0, 0, 0, 0, 0, '', '', 0, '', 'vb', '', 0, 1, 0, 0, NULL),
(24647, 3, '', 0, 'SXTA', 'cc6187feff42f497ae3caf41c1d14066', '2014-05-22', 'juliannmfsteed@yahoo.com', 0, '', '', '', '', '', '', '', 2, 0, 'New Member', 0, 1400736764, 0, 1400736764, 1400740637, 0, 0, 0, 0, 4, '5', 0, 0, 0, 0, 0, 3194967, '11-26-1984', '1984-11-26', -1, -1, '23.94.23.26', 0, 1, 0, 0, -1, 0, 0, 'fF.R^h&ZfD^`lXg>$nP/K;Z)}3(N`#', 0, 0, 0, '', 0, 0, 0, 0, 0, 0, 0, 0, 0, 0, 0, 0, '', '', 0, '', 'vb', '', 0, 1, 0, 0, NULL),
(24649, 2, '', 0, 'saleemzahoor', 'e94e39f75feff5a6b4311a15c2ee4d32', '2014-05-22', 'saleemzahoor@gmail.com', 0, '', '', '', '', '', '', '', 2, 0, 'New Member', 0, 1400737676, 0, 1400738274, 1405621709, 0, 0, 0, 0, 4, '5', 0, 0, 0, 0, 0, 3194967, '06-23-1972', '1972-06-23', -1, -1, '39.32.24.144', 0, 1, 0, 0, -1, 0, 0, 'Up\\@}m%L4]OMd;_jY!GknA2u@;#m~b', 0, 0, 0, '', 0, 0, 0, 0, 0, 0, 0, 0, 0, 0, 0, 0, '', '', 0, '', 'vb', '', 0, 1, 0, 0, NULL),
(24650, 2, '', 0, 'Kashif Chaudhry', '27a2938f193a16796cb226f22e05974a', '2014-05-22', 'kashifchaudhry@engineer.com', 0, '', '', '', '', '', '', '', 2, 0, 'New Member', 0, 1400737805, 0, 1400737805, 1400738015, 0, 0, 0, 0, 4, '5', 0, 0, 0, 0, 0, 3194967, '12-02-1983', '1983-12-02', -1, -1, '110.38.212.217', 0, 1, 0, 0, -1, 0, 0, 'vN+vVq-m]Gc&(xIj1peNQT"zJIlpH6', 0, 0, 0, '', 0, 0, 0, 0, 0, 0, 0, 0, 0, 0, 0, 0, '', '', 0, '', 'vb', '', 0, 1, 0, 0, NULL),
(24665, 3, '', 0, 'gardner92', 'c320eaeeddf4a0752d9747ca9f6e6261', '2014-05-22', 'katicmfd@hotmail.com', 0, '', '', '', '', '', '', '', 2, 0, 'New Member', 0, 1400757905, 0, 1402843738, 1402975511, 0, 0, 0, 0, 4, '-11', 0, 0, 0, 0, 0, 3195031, '07-18-1988', '1988-07-18', -1, -1, '54.185.185.255', 0, 1, 0, 0, -1, 0, 0, 'Gq|`^-\\Pigx)/P[";k4WKLyWP2+6$W', 0, 0, 0, '', 0, 0, 0, 0, 0, 0, 0, 0, 0, 0, 0, 0, '', '', 0, '', 'vb', '', 0, 1, 0, 0, NULL),
(24652, 3, '', 0, 'DLankford', 'c83fc618582c4d1b0cdf19a99006e9c4', '2014-05-22', 'dorthy.lankford44@diendanthongtin.com', 0, '', '', '', '', '', '', '', 2, 0, 'New Member', 0, 1400740174, 0, 1400740174, 1400747047, 0, 0, 0, 0, 4, '5', 0, 0, 0, 0, 0, 3194967, '08-08-1976', '1976-08-08', -1, -1, '69.12.76.114', 0, 1, 0, 0, -1, 0, 0, 'Do{;V$;a59/3Mhy''GC_#Gs>Uq<GFU;', 0, 0, 0, '', 0, 0, 0, 0, 0, 0, 0, 0, 0, 0, 0, 0, '', '', 0, '', 'vb', '', 0, 1, 0, 0, NULL),
(24718, 2, '', 0, 'zashah1', '3935f32a2cd7cc7fe03d0b013d1acb0e', '2014-05-24', 'zeeshan@infoshield.info', 0, '', '', '', '', '', '', '', 2, 0, 'New Member', 0, 1400905911, 0, 1400905911, 1400906066, 0, 0, 0, 0, 4, '5', 0, 0, 0, 0, 0, 3194967, '11-05-1978', '1978-11-05', -1, -1, '39.47.14.97', 0, 1, 0, 0, -1, 0, 0, '^o''%pX"+<dIKKj"><K?gr=F\\#%j)v+', 0, 0, 0, '', 0, 0, 0, 0, 0, 0, 0, 0, 0, 0, 0, 0, '', '', 0, '', 'vb', '', 0, 1, 0, 0, NULL),
(24654, 16, '', 0, 'redbull', '29efacab9eee0a4f86ee2fa5bc8b4760', '2014-05-22', 'lushpush744@gmail.com', 0, '', '', '', '', '', '', '', 2, 0, 'Banned', 0, 1400745097, 0, 1405418101, 1405418101, 1405162399, 449875, 25, 0, 4, '5', 0, 0, 0, 0, 0, 3194967, '01-18-1990', '1990-01-18', -1, -1, '182.178.68.12', 0, 1, 0, 0, -1, 0, 0, 'T6KeY''g-MtCl-Xae/Hv=Qq,z0?(4_@', 0, 0, 0, '', 0, 0, 12, 0, 0, 0, 0, 0, 0, 0, 0, 0, '', '', 0, '', 'vb', '', 0, 1, 0, 0, NULL),
(30573, 3, '', 0, 'Lashawn69F', '4f03a82c31fafba5ce3fa1f4cd06a1a1', '2014-12-09', 'opalklingensmithwapf@yahoo.com', 0, '', '', '', '', '', '', '', 2, 0, 'New Member', 0, 1418138597, 0, 1418593414, 1418606247, 0, 0, 0, 0, 4, '5', 0, 0, 0, 0, 0, 3194967, '08-19-1976', '1976-08-19', -1, -1, '124.123.76.113', 0, 1, 0, 0, -1, 0, 0, ';N7He+:|8W9)1Qzs"^GO]XWdDjP%h"', 0, 0, 0, '', 0, 0, 0, 0, 0, 0, 0, 0, 0, 0, 0, 0, '', '', 0, '', 'vb', '', 0, 1, 0, 0, NULL),
(24656, 3, '', 0, 'MCuller', '82753eef67eb0086939feffa56ced6c6', '2014-05-22', 'fellkhk@outlook.com', 0, '', '', '', '', '', '', '', 2, 0, 'New Member', 0, 1400746023, 0, 1400746023, 1400751359, 0, 0, 0, 0, 4, '5', 0, 0, 0, 0, 0, 3194967, '04-03-1981', '1981-04-03', -1, -1, '198.167.137.193', 0, 1, 0, 0, -1, 0, 0, 'jTHf{j5ol8PqJ>.0E3nG+#bjyy/+C}', 0, 0, 0, '', 0, 0, 0, 0, 0, 0, 0, 0, 0, 0, 0, 0, '', '', 0, '', 'vb', '', 0, 1, 0, 0, NULL),
(24687, 3, '', 0, 'blexeypitt5529', 'f0f92870ae94a39c3bbb468cd76cb40c', '2014-05-23', 'blexeypitt@ymail.com', 0, '', '', '', '', '', '', '', 2, 0, 'New Member', 0, 1400820871, 0, 1400820871, 1400820871, 0, 0, 0, 0, 4, '-6', 0, 0, 0, 0, 0, 3195031, '10-16-1988', '1988-10-16', -1, -1, '201.155.208.245', 0, 1, 0, 0, -1, 0, 0, 'h;6eiqT>|&<\\Na*hTY|8ttyJ+XdH%t', 0, 0, 0, '', 0, 0, 0, 0, 0, 0, 0, 0, 0, 0, 0, 0, '', '', 0, '', 'vb', '', 0, 1, 0, 0, NULL),
(24838, 3, '', 0, 'LMcConnel', '8b3c37f16d02ca49ca20749530b4ac10', '2014-05-27', 'knownpageant50nm897@outlook.com', 0, '', '', '', '', '', '', '', 2, 0, 'New Member', 0, 1401147556, 0, 1401147556, 1401150293, 0, 0, 0, 0, 4, '5', 0, 0, 0, 0, 0, 3194967, '05-25-1973', '1973-05-25', -1, -1, '69.12.74.48', 0, 1, 0, 0, -1, 0, 0, '"*_LD_zq+clboT23~QuhG1cv1Fu[v9', 0, 0, 0, '', 0, 0, 0, 0, 0, 0, 0, 0, 0, 0, 0, 0, '', '', 0, '', 'vb', '', 0, 1, 0, 0, NULL);
INSERT INTO `user` (`userid`, `usergroupid`, `membergroupids`, `displaygroupid`, `username`, `password`, `passworddate`, `email`, `styleid`, `parentemail`, `homepage`, `icq`, `aim`, `yahoo`, `msn`, `skype`, `showvbcode`, `showbirthday`, `usertitle`, `customtitle`, `joindate`, `daysprune`, `lastvisit`, `lastactivity`, `lastpost`, `lastpostid`, `posts`, `reputation`, `reputationlevelid`, `timezoneoffset`, `pmpopup`, `avatarid`, `avatarrevision`, `profilepicrevision`, `sigpicrevision`, `options`, `birthday`, `birthday_search`, `maxposts`, `startofweek`, `ipaddress`, `referrerid`, `languageid`, `emailstamp`, `threadedmode`, `autosubscribe`, `pmtotal`, `pmunread`, `salt`, `ipoints`, `infractions`, `warnings`, `infractiongroupids`, `infractiongroupid`, `adminoptions`, `profilevisits`, `friendcount`, `friendreqcount`, `vmunreadcount`, `vmmoderatedcount`, `socgroupinvitecount`, `socgroupreqcount`, `pcunreadcount`, `pcmoderatedcount`, `gmmoderatedcount`, `assetposthash`, `fbuserid`, `fbjoindate`, `fbname`, `logintype`, `fbaccesstoken`, `bloggroupreqcount`, `showblogcss`, `importuserid`, `newrepcount`, `panjo_selling`) VALUES
(24685, 3, '', 0, 'MWic', '729238e7ecb7626d83d964ee9d7770c4', '2014-05-23', 'souzacnku@outlook.com', 0, '', '', '', '', '', '', '', 2, 0, 'New Member', 0, 1400813852, 0, 1400813852, 1400817861, 0, 0, 0, 0, 4, '5', 0, 0, 0, 0, 0, 3194967, '07-29-1982', '1982-07-29', -1, -1, '23.94.159.180', 0, 1, 0, 0, -1, 0, 0, 'TLG$C2E7~Pt\\11M{hI11l''FuM7wgtl', 0, 0, 0, '', 0, 0, 0, 0, 0, 0, 0, 0, 0, 0, 0, 0, '', '', 0, '', 'vb', '', 0, 1, 0, 0, NULL),
(24667, 3, '', 0, 'DKnotts', '1806b36cd9a3c7c1d6d77e8e72eebfa6', '2014-05-22', 'drusilla_knotts2@iidiscounts.org', 0, '', '', '', '', '', '', '', 2, 0, 'New Member', 0, 1400763981, 0, 1400763981, 1400766730, 0, 0, 0, 0, 4, '5', 0, 0, 0, 0, 0, 3194967, '11-03-1980', '1980-11-03', -1, -1, '198.23.167.137', 0, 1, 0, 0, -1, 0, 0, 'XL5,~T]*at_-D\\(w[]qfXiCYs&`HwO', 0, 0, 0, '', 0, 0, 0, 0, 0, 0, 0, 0, 0, 0, 0, 0, '', '', 0, '', 'vb', '', 0, 1, 0, 0, NULL),
(24660, 2, '', 0, 'Ali Ghazi', '27ae055e62a37d49b8e24c49dcd7f009', '2014-05-22', 'anglouaf@yahoo.com', 0, '', '', '', '', '', '', '', 2, 0, 'New Member', 0, 1400750461, 0, 1441106732, 1468228560, 0, 0, 0, 0, 4, '5', 0, 0, 0, 0, 0, 3194967, '03-28-1983', '1983-03-28', -1, -1, '111.68.103.86', 0, 1, 0, 0, -1, 0, 0, '=Jd0.HnVKKl:C#j|X|%IDyC,6QAKcJ', 0, 0, 0, '', 0, 0, 0, 0, 0, 0, 0, 0, 0, 0, 0, 0, '', '', 0, '', 'vb', '', 0, 1, 0, 0, NULL),
(24730, 3, '', 0, 'DCWMX', 'e21aca73df45e1700466bfe552ffebf8', '2014-05-24', 'unaccountableluz5525@outlook.com', 0, '', '', '', '', '', '', '', 2, 0, 'New Member', 0, 1400932162, 0, 1400932162, 1400932162, 0, 0, 0, 0, 4, '5', 0, 0, 0, 0, 0, 3194967, '04-06-1982', '1982-04-06', -1, -1, '82.178.73.151', 0, 1, 0, 0, -1, 0, 0, '{HSM{q)sajX,ObHU)?|2Y^qyaH;{on', 0, 0, 0, '', 0, 0, 0, 0, 0, 0, 0, 0, 0, 0, 0, 0, '', '', 0, '', 'vb', '', 0, 1, 0, 0, NULL),
(24672, 3, '', 0, 'VAllie', 'f93e72cb50cc84e053ff62b96e620de5', '2014-05-22', 'lainek9schleppy@yahoo.com', 0, '', '', '', '', '', '', '', 2, 0, 'New Member', 0, 1400785360, 0, 1400785360, 1400785360, 0, 0, 0, 0, 4, '5', 0, 0, 0, 0, 0, 3194967, '08-31-1977', '1977-08-31', -1, -1, '173.0.52.248', 0, 1, 0, 0, -1, 0, 0, 't@NTbox?l>]wGfvyv@YB/=O&8C[Bwr', 0, 0, 0, '', 0, 0, 0, 0, 0, 0, 0, 0, 0, 0, 0, 0, '', '', 0, '', 'vb', '', 0, 1, 0, 0, NULL),
(24731, 3, '', 0, 'CEaster', '65a1ac2bbb3967e8801d8f4bf96ee485', '2014-05-24', 'wielyvw@hotmail.com', 0, '', '', '', '', '', '', '', 2, 0, 'New Member', 0, 1400936387, 0, 1400936387, 1400938959, 0, 0, 0, 0, 4, '5', 0, 0, 0, 0, 0, 3194967, '08-30-1975', '1975-08-30', -1, -1, '151.237.190.155', 0, 1, 0, 0, -1, 0, 0, ':g(Yu{e[<^>j86ej509JyVkp,$j>2#', 0, 0, 0, '', 0, 0, 0, 0, 0, 0, 0, 0, 0, 0, 0, 0, '', '', 0, '', 'vb', '', 0, 1, 0, 0, NULL),
(24686, 3, '', 0, 'GDMFM', '652b7c6e55ec3307136feb2a3d360143', '2014-05-23', 'eddeexibud@yahoo.com', 0, '', '', '', '', '', '', '', 2, 0, 'New Member', 0, 1400819711, 0, 1400819711, 1400819711, 0, 0, 0, 0, 4, '5', 0, 0, 0, 0, 0, 3194967, '08-15-1982', '1982-08-15', -1, -1, '192.3.60.170', 0, 1, 0, 0, -1, 0, 0, '^r&I\\E\\H;=$vM]x8MC(kgX{GUR~3u_', 0, 0, 0, '', 0, 0, 0, 0, 0, 0, 0, 0, 0, 0, 0, 0, '', '', 0, '', 'vb', '', 0, 1, 0, 0, NULL),
(24809, 2, '', 0, 'Sheraaz', 'f7057b13af7437b50352828195e423f9', '2014-05-26', 'waheed4812@gmail.com', 0, '', '', '', '', '', '', '', 2, 0, 'New Member', 0, 1401083633, 0, 1401260914, 1401260914, 1401194429, 442178, 4, 0, 4, '5', 0, 0, 0, 0, 0, 3194967, '03-17-1965', '1965-03-17', -1, -1, '115.186.136.104', 0, 1, 0, 0, -1, 0, 0, 'Fz)i!i2Eq"hgg}}X~a886v!z)LLd1''', 0, 0, 0, '', 0, 0, 2, 0, 0, 0, 0, 0, 0, 0, 0, 0, '', '', 0, '', 'vb', '', 0, 1, 0, 0, NULL),
(24682, 3, '', 0, 'CBowman', '6cfe374f338ce0e5e31c66d269d054ab', '2014-05-23', 'coral_bowman@outlook.com', 0, '', '', '', '', '', '', '', 2, 0, 'New Member', 0, 1400811829, 0, 1400811829, 1400811829, 0, 0, 0, 0, 4, '5', 0, 0, 0, 0, 0, 3194967, '02-17-1977', '1977-02-17', -1, -1, '190.72.22.80', 0, 1, 0, 0, -1, 0, 0, '("m21g(VF-@%&:~BYz'',8@?[d^xahd', 0, 0, 0, '', 0, 0, 0, 0, 0, 0, 0, 0, 0, 0, 0, 0, '', '', 0, '', 'vb', '', 0, 1, 0, 0, NULL),
(24677, 2, '', 0, 'Top Gunner', 'c5fe0611344f88694c000514b3edf742', '2014-05-22', 'kamranfaruki73@gmail.com', 0, '', '', '', '', '', '', '', 2, 0, 'New Member', 0, 1400797917, 0, 1400798561, 1408111878, 0, 0, 0, 0, 4, '5', 0, 0, 0, 0, 0, 3195095, '02-06-1973', '1973-02-06', -1, -1, '94.59.219.42', 83, 1, 0, 0, -1, 0, 0, 'l~n0}{,n}s1n*U[zT>i{D:V<&=`5}w', 0, 0, 0, '', 0, 0, 0, 0, 0, 0, 0, 0, 0, 0, 0, 0, '', '', 0, '', 'vb', '', 0, 1, 0, 0, NULL),
(24678, 3, '', 0, 'MCostello', '485c42236779bea4f1909035950e8b74', '2014-05-23', 'pejusucynevu@yahoo.com', 0, '', '', '', '', '', '', '', 2, 0, 'New Member', 0, 1400799857, 0, 1400799857, 1400799857, 0, 0, 0, 0, 4, '5', 0, 0, 0, 0, 0, 3194967, '01-21-1976', '1976-01-21', -1, -1, '107.158.229.228', 0, 1, 0, 0, -1, 0, 0, '/fp"7K&!Lhok9@vCAwp|IE+7NEG|\\6', 0, 0, 0, '', 0, 0, 0, 0, 0, 0, 0, 0, 0, 0, 0, 0, '', '', 0, '', 'vb', '', 0, 1, 0, 0, NULL),
(24721, 2, '', 0, 'Usama Ahmed', '213d49230089dd6d4088a6c46dfe9926', '2014-05-24', 'dusama_90@hotmail.com', 0, '', '', '', '', '', '', '', 2, 0, 'New Member', 0, 1400911168, 0, 1402075191, 1416898359, 1416898080, 467194, 1, 0, 4, '5', 0, 0, 0, 0, 0, 3194967, '11-14-1990', '1990-11-14', -1, -1, '162.210.196.179', 0, 1, 0, 0, -1, 0, 0, 'h)u4T2=zrt@zZ=V(^$uujuv.@OQn~"', 0, 0, 0, '', 0, 0, 1, 1, 0, 0, 0, 0, 0, 0, 0, 0, '', '', 0, '', 'vb', '', 0, 1, 0, 0, NULL),
(24719, 3, '', 0, 'BKwk', '74e304b0d6b15f0bf98e1a81cbb8126b', '2014-05-24', 'brianne.raley@camnang24h.com', 0, '', '', '', '', '', '', '', 2, 0, 'New Member', 0, 1400906266, 0, 1400906266, 1400915921, 0, 0, 0, 0, 4, '5', 0, 0, 0, 0, 0, 3194967, '08-28-1972', '1972-08-28', -1, -1, '107.158.23.77', 0, 1, 0, 0, -1, 0, 0, 'Nb|v#lr?o0=JwS_;DTfJuA]pA#V;m''', 0, 0, 0, '', 0, 0, 0, 0, 0, 0, 0, 0, 0, 0, 0, 0, '', '', 0, '', 'vb', '', 0, 1, 0, 0, NULL),
(24692, 2, '', 0, 'skyhunter', 'fbb95c166428a221b3171437efe015e4', '2014-05-23', 'jadykhanz@yahoo.com', 0, '', '', '', '', '', '', '', 2, 0, 'New Member', 0, 1400835893, 0, 1400838741, 1400838741, 0, 0, 0, 0, 4, '0', 0, 0, 0, 0, 0, 3195031, '09-01-1981', '1981-09-01', -1, -1, '188.29.165.151', 0, 1, 0, 0, -1, 0, 0, '@WJ7d0P]6^{O"_$C8kD''z17Z[S96%w', 0, 0, 0, '', 0, 0, 0, 0, 0, 0, 0, 0, 0, 0, 0, 0, '', '', 0, '', 'vb', '', 0, 1, 0, 0, NULL),
(24713, 3, '', 0, 'SGarvan', '23f39654f6ebebe4ec6ff8fae20e84b1', '2014-05-23', 'catyhcrtws@yahoo.com', 0, '', '', '', '', '', '', '', 2, 0, 'New Member', 0, 1400879845, 0, 1400879845, 1400879845, 0, 0, 0, 0, 4, '5', 0, 0, 0, 0, 0, 3194967, '01-12-1979', '1979-01-12', -1, -1, '92.114.82.72', 0, 1, 0, 0, -1, 0, 0, ':t+6C|IXT{H8/YVZ7mIYK,Y3_^V,!''', 0, 0, 0, '', 0, 0, 0, 0, 0, 0, 0, 0, 0, 0, 0, 0, '', '', 0, '', 'vb', '', 0, 1, 0, 0, NULL),
(24834, 3, '', 0, 'AQWL', '342b4f35488fc154e7ea69040e014eb7', '2014-05-26', 'spearsbk8gqg@hotmail.com', 0, '', '', '', '', '', '', '', 2, 0, 'New Member', 0, 1401142227, 0, 1401142227, 1401142227, 0, 0, 0, 0, 4, '5', 0, 0, 0, 0, 0, 3194967, '09-09-1983', '1983-09-09', -1, -1, '50.115.171.174', 0, 1, 0, 0, -1, 0, 0, 'TZ?p6P\\U66QnliLmgT%nTqFYNFVFM0', 0, 0, 0, '', 0, 0, 0, 0, 0, 0, 0, 0, 0, 0, 0, 0, '', '', 0, '', 'vb', '', 0, 1, 0, 0, NULL),
(24695, 3, '', 0, 'MPither', '92e9d8492add742ecc8bde6e5014bae4', '2014-05-23', 'hryniews.ki.e.mil@gmail.com', 0, '', '', '', '', '', '', '', 2, 0, 'New Member', 0, 1400840494, 0, 1400840494, 1400857256, 0, 0, 0, 0, 4, '5', 0, 0, 0, 0, 0, 3194967, '12-21-1975', '1975-12-21', -1, -1, '23.108.196.76', 0, 1, 0, 0, -1, 0, 0, 'MC?,1^5];~xp?n>1KJy''?U_7[~`+G%', 0, 0, 0, '', 0, 0, 0, 0, 0, 0, 0, 0, 0, 0, 0, 0, '', '', 0, '', 'vb', '', 0, 1, 0, 0, NULL),
(24696, 3, '', 0, 'JP82', '7746e2653d2e1c524756cc983b3fed5a', '2014-05-23', 'joanne.beasley@tipbongmoingay.info', 0, '', '', '', '', '', '', '', 2, 0, 'New Member', 0, 1400840546, 0, 1400840546, 1400840546, 0, 0, 0, 0, 4, '5', 0, 0, 0, 0, 0, 3194967, '01-11-1983', '1983-01-11', -1, -1, '107.181.70.158', 0, 1, 0, 0, -1, 0, 0, '34i!d(+u.H]YE1sY.?Ul_%3zB6^AB}', 0, 0, 0, '', 0, 0, 0, 0, 0, 0, 0, 0, 0, 0, 0, 0, '', '', 0, '', 'vb', '', 0, 1, 0, 0, NULL),
(24697, 2, '', 0, 'Fraz.javed', 'e12be1129527c72b6eea32029e8057b6', '2014-05-23', 'fraz.javed@gmail.com', 0, '', '', '', '', '', '', '', 2, 0, 'New Member', 0, 1400840635, 0, 1400840923, 1400914255, 0, 0, 0, 0, 4, '5', 0, 0, 0, 0, 0, 3194967, '03-14-1986', '1986-03-14', -1, -1, '39.55.213.203', 0, 1, 0, 0, -1, 0, 0, 'C~xU~2Go7A\\NQ@PuiV?s54ND\\1!OmZ', 0, 0, 0, '', 0, 0, 0, 0, 0, 0, 0, 0, 0, 0, 0, 0, '', '', 0, '', 'vb', '', 0, 1, 0, 0, NULL),
(24722, 3, '', 0, 'WDCA', '6346f5eee6f0fb808fd32e93d171246c', '2014-05-24', 'lenitablh843@hotmail.com', 0, '', '', '', '', '', '', '', 2, 0, 'New Member', 0, 1400912927, 0, 1400912927, 1400931799, 0, 0, 0, 0, 4, '5', 0, 0, 0, 0, 0, 3194967, '11-29-1983', '1983-11-29', -1, -1, '173.0.53.107', 0, 1, 0, 0, -1, 0, 0, ':8w|7/\\#Y/;9OqkO=Ab7~zN2p'',b1`', 0, 0, 0, '', 0, 0, 0, 0, 0, 0, 0, 0, 0, 0, 0, 0, '', '', 0, '', 'vb', '', 0, 1, 0, 0, NULL),
(24699, 3, '', 0, 'LL14', 'ee6eb063af113000fa1310fa0b80c042', '2014-05-23', 'leo-saucier78@iidiscounts.com', 0, '', '', '', '', '', '', '', 2, 0, 'New Member', 0, 1400852892, 0, 1400852892, 1400860166, 0, 0, 0, 0, 4, '5', 0, 0, 0, 0, 0, 3194967, '01-15-1980', '1980-01-15', -1, -1, '173.0.48.138', 0, 1, 0, 0, -1, 0, 0, '~`k0n}D8WLHl*<#%Fl`$Lj>3~@1,1Y', 0, 0, 0, '', 0, 0, 0, 0, 0, 0, 0, 0, 0, 0, 0, 0, '', '', 0, '', 'vb', '', 0, 1, 0, 0, NULL),
(24700, 3, '', 0, 'VDty', 'c77f781ee7936b08fa926216d005e8b4', '2014-05-23', 'meekleaf10jq69b@outlook.com', 0, '', '', '', '', '', '', '', 2, 0, 'New Member', 0, 1400853725, 0, 1400853725, 1400860931, 0, 0, 0, 0, 4, '5', 0, 0, 0, 0, 0, 3194967, '05-20-1983', '1983-05-20', -1, -1, '213.87.128.238', 0, 1, 0, 0, -1, 0, 0, '*kbu#O(_vc2u5U0("7sM.z<uaT*Hpz', 0, 0, 0, '', 0, 0, 0, 0, 0, 0, 0, 0, 0, 0, 0, 0, '', '', 0, '', 'vb', '', 0, 1, 0, 0, NULL),
(24826, 3, '', 0, 'BFenbury', '3d74c5a7664c20b5d1c73c921b0bf5aa', '2014-05-26', 'brendan_fenbury100@iidiscounts.org', 0, '', '', '', '', '', '', '', 2, 0, 'New Member', 0, 1401134338, 0, 1401134338, 1401141754, 0, 0, 0, 0, 4, '5', 0, 0, 0, 0, 0, 3194967, '09-07-1979', '1979-09-07', -1, -1, '198.50.161.246', 0, 1, 0, 0, -1, 0, 0, 'VJ*UW[3!O}~+=v-iF%k-\\{xb10iF1_', 0, 0, 0, '', 0, 0, 0, 0, 0, 0, 0, 0, 0, 0, 0, 0, '', '', 0, '', 'vb', '', 0, 1, 0, 0, NULL),
(24784, 3, '', 0, 'FDLW', '1b4648ce17e5748c6cd4945db4596e29', '2014-05-25', 'giovannagdicke@outlook.com', 0, '', '', '', '', '', '', '', 2, 0, 'New Member', 0, 1401047148, 0, 1401047148, 1401058764, 0, 0, 0, 0, 4, '5', 0, 0, 0, 0, 0, 3194967, '12-22-1984', '1984-12-22', -1, -1, '198.23.248.138', 0, 1, 0, 0, -1, 0, 0, 'iNHqB1p3%<*jxQ=.o/ciIjpM.W>H`#', 0, 0, 0, '', 0, 0, 0, 0, 0, 0, 0, 0, 0, 0, 0, 0, '', '', 0, '', 'vb', '', 0, 1, 0, 0, NULL),
(24703, 3, '', 0, 'F8199', 'd6ad551322c92f5987cf267e7f294795', '2014-05-23', 'alivepyramid81jdsox@nokiamail.com', 0, '', '', '', '', '', '', '', 2, 0, 'New Member', 0, 1400856019, 0, 1400856019, 1400856019, 0, 0, 0, 0, 4, '5', 0, 0, 0, 0, 0, 3194967, '05-15-1984', '1984-05-15', -1, -1, '192.161.162.37', 0, 1, 0, 0, -1, 0, 0, 'V$g?SOzsA8bm;m?c[U6cw~,=6)I3#x', 0, 0, 0, '', 0, 0, 0, 0, 0, 0, 0, 0, 0, 0, 0, 0, '', '', 0, '', 'vb', '', 0, 1, 0, 0, NULL),
(24704, 2, '', 0, 'Mak.maverick', '820d540a02ec5d6222034095f0fb67be', '2014-05-23', 'akmalkami@gmail.com', 0, '', '', '', '', '', '', '', 2, 0, 'New Member', 0, 1400860693, 0, 1400861342, 1400861342, 0, 0, 0, 0, 4, '5', 0, 0, 0, 0, 0, 3194967, '02-01-1993', '1993-02-01', -1, -1, '182.189.10.124', 0, 1, 0, 0, -1, 0, 0, 'a\\1kbMWv}N}>F|nja>7Z5$yk=ZvVt*', 0, 0, 0, '', 0, 0, 1, 0, 0, 0, 0, 0, 0, 0, 0, 0, '', '', 0, '', 'vb', '', 0, 1, 0, 0, NULL),
(24729, 2, '', 0, 'sshaikh', '5f49b7edc6a07bc39c80285ce9cbcbac', '2014-05-24', 'sshaikh.pk@gmail.com', 0, '', '', '', '', '', '', '', 2, 0, 'New Member', 0, 1400931595, 0, 1400931830, 1400931830, 0, 0, 0, 0, 4, '5', 0, 0, 0, 0, 0, 3194967, '01-31-1952', '1952-01-31', -1, -1, '39.47.155.145', 0, 1, 0, 0, -1, 0, 0, ':iG~j5kj?4a|$oS/nEPkP/,$(\\*\\:c', 0, 0, 0, '', 0, 0, 0, 0, 0, 0, 0, 0, 0, 0, 0, 0, '', '', 0, '', 'vb', '', 0, 1, 0, 0, NULL),
(24706, 3, '', 0, 'MKeating', '06261770b57292e53bd0943c62adb2af', '2014-05-23', 'soznyzn@hotmail.com', 0, '', '', '', '', '', '', '', 2, 0, 'New Member', 0, 1400863000, 0, 1400863000, 1400865258, 0, 0, 0, 0, 4, '5', 0, 0, 0, 0, 0, 3194967, '03-25-1970', '1970-03-25', -1, -1, '178.33.143.31', 0, 1, 0, 0, -1, 0, 0, '.iApV,*MzPeyC<hF+9x%/h?YQ#4j$[', 0, 0, 0, '', 0, 0, 0, 0, 0, 0, 0, 0, 0, 0, 0, 0, '', '', 0, '', 'vb', '', 0, 1, 0, 0, NULL),
(24707, 3, '', 0, 'mubasharwaqar', 'f0359b122be97187210e56ab7744e35a', '2014-05-23', 'princemubashar81@gmail.com', 0, '', '', '', '', '', '', '', 2, 0, 'New Member', 0, 1400867161, 0, 1400867161, 1400867506, 0, 0, 0, 0, 4, '5', 0, 0, 0, 0, 0, 3194967, '09-05-1997', '1997-09-05', -1, -1, '182.186.240.163', 0, 1, 0, 0, -1, 0, 0, 'FX$s1t=*Nwh8''cUz[''U_)@}aJ]F{c5', 0, 0, 0, '', 0, 0, 0, 0, 0, 0, 0, 0, 0, 0, 0, 0, '', '', 0, '', 'vb', '', 0, 1, 0, 0, NULL),
(25018, 3, '', 0, 'D01I', '46d56105f6e446db61b19aaef33915c1', '2014-05-31', 'hrynie.wskie.mi.l@gmail.com', 0, '', '', '', '', '', '', '', 2, 0, 'New Member', 0, 1401562831, 0, 1401562831, 1401570004, 0, 0, 0, 0, 4, '5', 0, 0, 0, 0, 0, 3194967, '04-03-1983', '1983-04-03', -1, -1, '23.108.74.203', 0, 1, 0, 0, -1, 0, 0, 'L`?.tBvS<L6,TBM1-Zs1&o[/0dIK(3', 0, 0, 0, '', 0, 0, 0, 0, 0, 0, 0, 0, 0, 0, 0, 0, '', '', 0, '', 'vb', '', 0, 1, 0, 0, NULL),
(24723, 3, '', 0, 'CTjf', '293937bbde43d28337ebf36fb2829eb6', '2014-05-24', 'ginawellssa5@hotmail.com', 0, '', '', '', '', '', '', '', 2, 0, 'New Member', 0, 1400913374, 0, 1400913374, 1400915931, 0, 0, 0, 0, 4, '5', 0, 0, 0, 0, 0, 3194967, '04-29-1970', '1970-04-29', -1, -1, '23.94.245.234', 0, 1, 0, 0, -1, 0, 0, 'BFI==&>~+Q*95hxL8^t[A+u;8.4b<"', 0, 0, 0, '', 0, 0, 0, 0, 0, 0, 0, 0, 0, 0, 0, 0, '', '', 0, '', 'vb', '', 0, 1, 0, 0, NULL),
(24837, 3, '', 0, 'LDunshea', '3cff59c5aa8c89148a55951d07932c77', '2014-05-27', 'imminenteconomy7n442@outlook.com', 0, '', '', '', '', '', '', '', 2, 0, 'New Member', 0, 1401145368, 0, 1401145368, 1401147673, 0, 0, 0, 0, 4, '5', 0, 0, 0, 0, 0, 3194967, '09-23-1973', '1973-09-23', -1, -1, '69.12.74.151', 0, 1, 0, 0, -1, 0, 0, '6!~<iA(Mr#=?aC+"fi+&BoPXjqI=y]', 0, 0, 0, '', 0, 0, 0, 0, 0, 0, 0, 0, 0, 0, 0, 0, '', '', 0, '', 'vb', '', 0, 1, 0, 0, NULL),
(24725, 3, '', 0, 'DGEF', 'ceac3ea7ddf5ee2ee1e5cbe5cc7425ae', '2014-05-24', 'wholesaletag4549@outlook.com', 0, '', '', '', '', '', '', '', 2, 0, 'New Member', 0, 1400918036, 0, 1400918036, 1400925338, 0, 0, 0, 0, 4, '5', 0, 0, 0, 0, 0, 3194967, '08-26-1972', '1972-08-26', -1, -1, '192.3.55.233', 0, 1, 0, 0, -1, 0, 0, 'Vv-8_7Fr3fPU{$0DoK_@hk8Vv}_3oM', 0, 0, 0, '', 0, 0, 0, 0, 0, 0, 0, 0, 0, 0, 0, 0, '', '', 0, '', 'vb', '', 0, 1, 0, 0, NULL),
(24735, 2, '', 0, 'MAK1', 'fe5ded3edee1656a7aaeecd683be6508', '2014-05-24', 'Murtaza_khan_15@yahoo.com', 0, '', '', '', '', '', '', '', 2, 0, 'New Member', 0, 1400939310, 0, 1408829437, 1408829437, 1404940713, 449626, 12, 0, 4, '5', 0, 0, 0, 0, 0, 3194967, '07-15-1976', '1976-07-15', -1, -1, '119.157.224.157', 8108, 1, 0, 0, -1, 0, 0, 'dITc''aqj"o7By9Ac~0r-i$P|Dcq1ws', 0, 0, 0, '', 0, 0, 0, 0, 0, 0, 0, 0, 0, 0, 0, 0, '', '', 0, '', 'vb', '', 0, 1, 0, 0, NULL),
(24727, 3, '', 0, 'J08G', '814dd812d38c50b866a80632c34ded31', '2014-05-24', 'flagrantaccount86@outlook.com', 0, '', '', '', '', '', '', '', 2, 0, 'New Member', 0, 1400921370, 0, 1400921370, 1400928533, 0, 0, 0, 0, 4, '5', 0, 0, 0, 0, 0, 3194967, '11-12-1973', '1973-11-12', -1, -1, '198.12.72.97', 0, 1, 0, 0, -1, 0, 0, '@{=#g^LOYiL<"._P7lY]VmOhgs|qMo', 0, 0, 0, '', 0, 0, 0, 0, 0, 0, 0, 0, 0, 0, 0, 0, '', '', 0, '', 'vb', '', 0, 1, 0, 0, NULL),
(24836, 3, '', 0, 'EChisholm', 'ca782fad557abb40ad562dce99440a5e', '2014-05-26', 'edward.chisholm32@kienthucxahoi.com', 0, '', '', '', '', '', '', '', 2, 0, 'New Member', 0, 1401142938, 0, 1401142938, 1401149760, 0, 0, 0, 0, 4, '5', 0, 0, 0, 0, 0, 3194967, '08-19-1977', '1977-08-19', -1, -1, '23.108.132.185', 0, 1, 0, 0, -1, 0, 0, 'UY8HS}l1F/r8zoHn,dj}6kdR{i(=|y', 0, 0, 0, '', 0, 0, 0, 0, 0, 0, 0, 0, 0, 0, 0, 0, '', '', 0, '', 'vb', '', 0, 1, 0, 0, NULL),
(24739, 2, '', 0, 'imranashrafi1', '4043cd3ba0b77fa7b03119458c7fea01', '2014-05-24', 'imranashrafi123@outlook.com', 0, '', '', '', '', '', '', '', 2, 0, 'Member', 0, 1400947544, 0, 1470210338, 1470331457, 1470087373, 495676, 138, 0, 4, '5', 0, 48, 0, 0, 0, 3194967, '03-02-1986', '1986-03-02', -1, -1, '27.255.57.213', 430, 1, 1400951573, 0, -1, 0, 0, 'V?Ti;wD|0{t2pAUo:&r>NE|u&"^R''Q', 0, 0, 0, '', 0, 0, 7, 1, 0, 0, 0, 0, 0, 0, 0, 0, '', '', 0, '', 'vb', '', 0, 1, 0, 0, NULL),
(24740, 3, '', 0, 'bobbytivaov2073', '0ea3a42f0b84c866dbacdaa8829ed086', '2014-05-24', 'bobbytivaov@ymail.com', 0, '', '', '', '', '', '', '', 2, 0, 'New Member', 0, 1400947693, 0, 1400947693, 1400947693, 0, 0, 0, 0, 4, '4.5', 0, 0, 0, 0, 0, 3195031, '09-22-1986', '1986-09-22', -1, -1, '124.109.46.174', 0, 1, 0, 0, -1, 0, 0, '[F82!mR>?Q.xd-^#fx$$MB&%M%:z{$', 0, 0, 0, '', 0, 0, 0, 0, 0, 0, 0, 0, 0, 0, 0, 0, '', '', 0, '', 'vb', '', 0, 1, 0, 0, NULL),
(24806, 3, '', 0, 'CMarcell', '40888b6ed83881784d0a9e25b2c84916', '2014-05-26', 'sneakysquirrel150@hotmail.com', 0, '', '', '', '', '', '', '', 2, 0, 'New Member', 0, 1401078347, 0, 1401078347, 1401081965, 0, 0, 0, 0, 4, '5', 0, 0, 0, 0, 0, 3194967, '01-30-1970', '1970-01-30', -1, -1, '23.247.173.37', 0, 1, 0, 0, -1, 0, 0, 'C[JY|f`#C[9{}1/{p"j($sMiJTc,L:', 0, 0, 0, '', 0, 0, 0, 0, 0, 0, 0, 0, 0, 0, 0, 0, '', '', 0, '', 'vb', '', 0, 1, 0, 0, NULL),
(24743, 3, '', 0, 'asifzzzz', '9228103a57aeb3d737022e65d3eb0727', '2014-05-24', 'asif.cantt@hotmail.com', 0, '', '', '', '', '', '', '', 2, 0, 'New Member', 0, 1400952294, 0, 1400952294, 1400952471, 0, 0, 0, 0, 4, '5', 0, 0, 0, 0, 0, 3194967, '12-13-1987', '1987-12-13', -1, -1, '182.186.161.219', 0, 1, 0, 0, -1, 0, 0, 'pq)W*26jA*-e.b''Sp,[C9#.xms:Ev_', 0, 0, 0, '', 0, 0, 0, 0, 0, 0, 0, 0, 0, 0, 0, 0, '', '', 0, '', 'vb', '', 0, 1, 0, 0, NULL),
(25071, 3, '', 0, 'MWinters', 'b9055cff9d096cea9bc4f4c4df967d08', '2014-06-02', 'jodybaiyxyzjrsv@yahoo.com', 0, '', '', '', '', '', '', '', 2, 0, 'New Member', 0, 1401664674, 0, 1401664674, 1401670062, 0, 0, 0, 0, 4, '5', 0, 0, 0, 0, 0, 3194967, '01-11-1972', '1972-01-11', -1, -1, '165.231.22.207', 0, 1, 0, 0, -1, 0, 0, '@OV8"g9$2,>#S?ixHg!f0T]cR?+8i@', 0, 0, 0, '', 0, 0, 0, 0, 0, 0, 0, 0, 0, 0, 0, 0, '', '', 0, '', 'vb', '', 0, 1, 0, 0, NULL),
(24818, 3, '', 0, 'ADAlberti', '372e8ff65f5728ef84d9eae5f4190b42', '2014-05-26', 'majkkcvmv@yahoo.com', 0, '', '', '', '', '', '', '', 2, 0, 'New Member', 0, 1401103929, 0, 1401103929, 1401231776, 0, 0, 0, 0, 4, '5', 0, 0, 0, 0, 0, 3194967, '11-30-1981', '1981-11-30', -1, -1, '107.158.23.42', 0, 1, 0, 0, -1, 0, 0, 'Z;`BT''m"&}\\@l36CovH2P\\PQ4!X|}L', 0, 0, 0, '', 0, 0, 0, 0, 0, 0, 0, 0, 0, 0, 0, 0, '', '', 0, '', 'vb', '', 0, 1, 0, 0, NULL),
(24746, 3, '', 0, 'ABrandenb', '1a11230bfdffd2af3cd781cd97a03b5d', '2014-05-24', 'pefyxevocyd@yahoo.com', 0, '', '', '', '', '', '', '', 2, 0, 'New Member', 0, 1400957113, 0, 1400957113, 1401036172, 0, 0, 0, 0, 4, '5', 0, 0, 0, 0, 0, 3194967, '08-23-1977', '1977-08-23', -1, -1, '107.158.22.81', 0, 1, 0, 0, -1, 0, 0, '~+VV=yAUc[*o=\\leV}uDQ''8g\\CPX-I', 0, 0, 0, '', 0, 0, 0, 0, 0, 0, 0, 0, 0, 0, 0, 0, '', '', 0, '', 'vb', '', 0, 1, 0, 0, NULL),
(24747, 2, '', 0, 'mfaraxbaig', '0f89fafd22cbbcb0b1b6bb21b03941c8', '2014-05-24', 'mfaraxbaig@gmail.com', 0, '', '', '', '', '', '', '', 2, 0, 'New Member', 0, 1400957446, 0, 1471859921, 1471943390, 0, 0, 0, 0, 4, '5', 0, 0, 0, 0, 0, 3195095, '12-15-1990', '1990-12-15', -1, -1, '74.115.1.120', 24739, 1, 0, 0, -1, 0, 0, '''!C9t{\\A0{V#vd.}Olne7<)[H`|vm"', 0, 0, 0, '', 0, 0, 0, 0, 0, 0, 0, 0, 0, 0, 0, 0, '', '', 0, '', 'vb', '', 0, 1, 0, 0, NULL),
(24807, 3, '', 0, 'LCunniff', '809129eb029044576d07f558ec89d3fe', '2014-05-26', 'wondatfpfaffinger@yahoo.com', 0, '', '', '', '', '', '', '', 2, 0, 'New Member', 0, 1401080128, 0, 1401080128, 1401080128, 0, 0, 0, 0, 4, '5', 0, 0, 0, 0, 0, 3194967, '12-16-1973', '1973-12-16', -1, -1, '23.108.132.184', 0, 1, 0, 0, -1, 0, 0, 'TB_FOrR3y-eJC2:BP3XwS@5K6/`dr%', 0, 0, 0, '', 0, 0, 0, 0, 0, 0, 0, 0, 0, 0, 0, 0, '', '', 0, '', 'vb', '', 0, 1, 0, 0, NULL),
(24749, 3, '', 0, 'BDinkel', '5063fe66b91ece9ab92d9d9fcfbf0008', '2014-05-24', 'shelbagcu727@hotmail.com', 0, '', '', '', '', '', '', '', 2, 0, 'New Member', 0, 1400967988, 0, 1400967988, 1400970476, 0, 0, 0, 0, 4, '5', 0, 0, 0, 0, 0, 3194967, '12-29-1977', '1977-12-29', -1, -1, '5.45.181.186', 0, 1, 0, 0, -1, 0, 0, 'i=.YO/;Q.UBO[ylsr\\gY0il|>wjo#=', 0, 0, 0, '', 0, 0, 0, 0, 0, 0, 0, 0, 0, 0, 0, 0, '', '', 0, '', 'vb', '', 0, 1, 0, 0, NULL),
(24750, 3, '', 0, 'EBarraclo', '043b43959bd4725fcc31fbded0bea2cd', '2014-05-25', 'eliza.barraclough52@camnangdoisong.com', 0, '', '', '', '', '', '', '', 2, 0, 'New Member', 0, 1400978084, 0, 1400978084, 1400986698, 0, 0, 0, 0, 4, '5', 0, 0, 0, 0, 0, 3194967, '09-25-1973', '1973-09-25', -1, -1, '192.3.164.210', 0, 1, 0, 0, -1, 0, 0, '$Bx2kPFbSHc-)m(BBl1`q)/fN<)JM0', 0, 0, 0, '', 0, 0, 0, 0, 0, 0, 0, 0, 0, 0, 0, 0, '', '', 0, '', 'vb', '', 0, 1, 0, 0, NULL),
(24752, 3, '', 0, 'GRaines', '425a40361589d8fa7a772d518cd7a8c2', '2014-05-25', 'gwen_raines@iidiscounts.com', 0, '', '', '', '', '', '', '', 2, 0, 'New Member', 0, 1400984680, 0, 1400984680, 1400984680, 0, 0, 0, 0, 4, '5', 0, 0, 0, 0, 0, 3194967, '03-10-1976', '1976-03-10', -1, -1, '173.0.59.29', 0, 1, 0, 0, -1, 0, 0, 'WdI"9ui?Dc9U?G|z4dm-Z7MNj(^y.N', 0, 0, 0, '', 0, 0, 0, 0, 0, 0, 0, 0, 0, 0, 0, 0, '', '', 0, '', 'vb', '', 0, 1, 0, 0, NULL),
(25654, 3, '', 0, 'JConforti', '5a9b1cb009688a71178f4b65ff09e569', '2014-06-21', 'bashfulbreeze84ktz82@outlook.com', 0, '', '', '', '', '', '', '', 2, 0, 'New Member', 0, 1403378465, 0, 1403378465, 1403380999, 0, 0, 0, 0, 4, '5', 0, 0, 0, 0, 0, 3194967, '05-28-1971', '1971-05-28', -1, -1, '107.155.120.19', 0, 1, 0, 0, -1, 0, 0, '2$~/:,/z$*:bcr}40V43`e=,D''''g_K', 0, 0, 0, '', 0, 0, 0, 0, 0, 0, 0, 0, 0, 0, 0, 0, '', '', 0, '', 'vb', '', 0, 1, 0, 0, NULL),
(24821, 2, '', 0, 'SHunter', '4bb5496aefd348f3e3948cd6a020ee79', '2014-05-26', 'sydiqyvimyhe@yahoo.com', 0, '', '', '', '', '', '', '', 2, 0, 'New Member', 0, 1401108929, 0, 1401108929, 1401118384, 0, 0, 0, 0, 4, '5', 0, 0, 0, 0, 0, 3194967, '07-16-1985', '1985-07-16', -1, -1, '69.12.89.142', 0, 1, 0, 0, -1, 0, 0, 'qj$dEy%<F&8{N@IL`LzE<V&}VnKw[R', 0, 0, 0, '', 0, 0, 0, 0, 0, 0, 0, 0, 0, 0, 0, 0, '', '', 0, '', 'vb', '', 0, 1, 0, 0, NULL),
(24800, 3, '', 0, 'NChristy', '7598c27ffa58dfbcda0014d8cdc31103', '2014-05-26', 'numbers.christy22@camnangdoisong.com', 0, '', '', '', '', '', '', '', 2, 0, 'New Member', 0, 1401071173, 0, 1401071173, 1401079999, 0, 0, 0, 0, 4, '5', 0, 0, 0, 0, 0, 3194967, '03-07-1972', '1972-03-07', -1, -1, '198.167.137.163', 0, 1, 0, 0, -1, 0, 0, 'aRx{P@bnH!;vL[IXvI}-ZVEw2hUVzE', 0, 0, 0, '', 0, 0, 0, 0, 0, 0, 0, 0, 0, 0, 0, 0, '', '', 0, '', 'vb', '', 0, 1, 0, 0, NULL),
(24828, 3, '', 0, 'SGaunson', '5e87b0b39dc8f024b4dfe05833e4fe2d', '2014-05-26', 'sally.gaunson57@camnang24h.com', 0, '', '', '', '', '', '', '', 2, 0, 'New Member', 0, 1401136755, 0, 1401136755, 1401136755, 0, 0, 0, 0, 4, '5', 0, 0, 0, 0, 0, 3194967, '05-02-1984', '1984-05-02', -1, -1, '69.12.76.54', 0, 1, 0, 0, -1, 0, 0, '9v5MxM/}5%A~cZ[LQF7v%,<#-l''}e!', 0, 0, 0, '', 0, 0, 0, 0, 0, 0, 0, 0, 0, 0, 0, 0, '', '', 0, '', 'vb', '', 0, 1, 0, 0, NULL),
(24804, 3, '', 0, 'AHollenbe', '15f3961b5cf8b64216732e62bd54732a', '2014-05-26', 'titdeadepo1971@yahoo.com', 0, '', '', '', '', '', '', '', 2, 0, 'New Member', 0, 1401074063, 0, 1401074063, 1401131341, 0, 0, 0, 0, 4, '5', 0, 0, 0, 0, 0, 3194967, '10-20-1979', '1979-10-20', -1, -1, '46.105.39.117', 0, 1, 0, 0, -1, 0, 0, '=[EK$@@vZtQ8e;UYJQ\\h2?E&)Rmkrf', 0, 0, 0, '', 0, 0, 0, 0, 0, 0, 0, 0, 0, 0, 0, 0, '', '', 0, '', 'vb', '', 0, 1, 0, 0, NULL),
(24805, 3, '', 0, 'INeudorf', 'c1f95175f34c1de4453ec5eefccc77f3', '2014-05-26', 'wayflowroesan1987@yahoo.com', 0, '', '', '', '', '', '', '', 2, 0, 'New Member', 0, 1401076968, 0, 1401076968, 1401131308, 0, 0, 0, 0, 4, '5', 0, 0, 0, 0, 0, 3194967, '10-18-1971', '1971-10-18', -1, -1, '176.31.213.119', 0, 1, 0, 0, -1, 0, 0, '$.kr!Hez5,1Bj|@BykTSm1yfd8mZm5', 0, 0, 0, '', 0, 0, 0, 0, 0, 0, 0, 0, 0, 0, 0, 0, '', '', 0, '', 'vb', '', 0, 1, 0, 0, NULL),
(24759, 3, '', 0, 'AFantl', '773a12e7a0aba49ba68bb7f4dee796fe', '2014-05-25', 'adrianne-fantl@camnang24h.com', 0, '', '', '', '', '', '', '', 2, 0, 'New Member', 0, 1401002904, 0, 1401002904, 1401011540, 0, 0, 0, 0, 4, '5', 0, 0, 0, 0, 0, 3194967, '02-24-1977', '1977-02-24', -1, -1, '69.12.76.114', 0, 1, 0, 0, -1, 0, 0, ',Ks>=0x(?UDd7q=Yh<8MOP0U]gb}}^', 0, 0, 0, '', 0, 0, 0, 0, 0, 0, 0, 0, 0, 0, 0, 0, '', '', 0, '', 'vb', '', 0, 1, 0, 0, NULL),
(24760, 3, '', 0, 'AWeeks', '208d99f4a754d157bf98db928c64b98a', '2014-05-25', 'annett_weeks@camnang24h.com', 0, '', '', '', '', '', '', '', 2, 0, 'New Member', 0, 1401003338, 0, 1401003338, 1401012019, 0, 0, 0, 0, 4, '5', 0, 0, 0, 0, 0, 3194967, '03-18-1975', '1975-03-18', -1, -1, '23.108.132.140', 0, 1, 0, 0, -1, 0, 0, ']VXr`GhoE=)5IRbX~qt(,=2TE`Dr?I', 0, 0, 0, '', 0, 0, 0, 0, 0, 0, 0, 0, 0, 0, 0, 0, '', '', 0, '', 'vb', '', 0, 1, 0, 0, NULL),
(25402, 3, '', 0, 'radajnray3544', '7787cbee4ae31260b258ed7d6b977dd1', '2014-06-13', 'radajnray@ymail.com', 0, '', '', '', '', '', '', '', 2, 0, 'New Member', 0, 1402653849, 0, 1402653849, 1402653849, 0, 0, 0, 0, 4, '7', 0, 0, 0, 0, 0, 3195031, '07-21-1980', '1980-07-21', -1, -1, '54.72.95.241', 0, 1, 0, 0, -1, 0, 0, 'Ww8<D:xdV3@;ke*r,90H.ehHL\\Tz=N', 0, 0, 0, '', 0, 0, 0, 0, 0, 0, 0, 0, 0, 0, 0, 0, '', '', 0, '', 'vb', '', 0, 1, 0, 0, NULL),
(24761, 3, '', 0, 'BBernal', 'e450f35e40add99d35fcd80ca3353730', '2014-05-25', 'brandi_bernal6@iidiscounts.org', 0, '', '', '', '', '', '', '', 2, 0, 'New Member', 0, 1401005625, 0, 1401005625, 1401008306, 0, 0, 0, 0, 4, '5', 0, 0, 0, 0, 0, 3194967, '03-14-1982', '1982-03-14', -1, -1, '173.254.234.185', 0, 1, 0, 0, -1, 0, 0, 'S1C4}t4f:M^sWC`+O#>)M_#WTV=Xx%', 0, 0, 0, '', 0, 0, 0, 0, 0, 0, 0, 0, 0, 0, 0, 0, '', '', 0, '', 'vb', '', 0, 1, 0, 0, NULL),
(24810, 3, '', 0, 'BLarocca', 'ca327eacfd12d7ee84306983d68d9d95', '2014-05-26', 'goblerjhqf@yahoo.com', 0, '', '', '', '', '', '', '', 2, 0, 'New Member', 0, 1401085224, 0, 1401085224, 1401092542, 0, 0, 0, 0, 4, '5', 0, 0, 0, 0, 0, 3194967, '06-20-1983', '1983-06-20', -1, -1, '173.213.80.172', 0, 1, 0, 0, -1, 0, 0, '_DIMWb<H!VbXHAt>Y~ke&c]c`XPxk;', 0, 0, 0, '', 0, 0, 0, 0, 0, 0, 0, 0, 0, 0, 0, 0, '', '', 0, '', 'vb', '', 0, 1, 0, 0, NULL),
(24763, 2, '', 0, 'Sardar zia', 'c61445da7c4e499b08e30950388fc067', '2014-05-25', 'Sardarzia@live.com', 0, '', '', '', '', '', '', '', 2, 0, 'New Member', 0, 1401006081, 0, 1402582674, 1403450167, 0, 0, 0, 0, 4, '5', 0, 0, 0, 0, 0, 3194967, '11-24-1959', '1959-11-24', -1, -1, '31.186.228.27', 0, 1, 0, 0, -1, 0, 0, 'v?U="?Wm9zzhTNNIH\\#)i53uoz^FE%', 0, 0, 0, '', 0, 0, 1, 1, 0, 0, 0, 0, 0, 0, 0, 0, '1a87857d9d554c8305c18f68d69c7fa1', '', 0, '', 'vb', '', 0, 1, 0, 0, NULL),
(24764, 3, '', 0, 'BNud', '63f17920faaff16c147bfbb09365b2e3', '2014-05-25', 'kingmldldbr@live.com', 0, '', '', '', '', '', '', '', 2, 0, 'New Member', 0, 1401006295, 0, 1401006295, 1401006295, 0, 0, 0, 0, 4, '5', 0, 0, 0, 0, 0, 3194967, '05-28-1984', '1984-05-28', -1, -1, '208.89.208.183', 0, 1, 0, 0, -1, 0, 0, 'GsN:rCJ|^vgVl~.a,)}''knMHYoD/=}', 0, 0, 0, '', 0, 0, 0, 0, 0, 0, 0, 0, 0, 0, 0, 0, '', '', 0, '', 'vb', '', 0, 1, 0, 0, NULL),
(24765, 3, '', 0, 'MBeer', 'e4f78a74d15e25d06a04c3f91348e516', '2014-05-25', 'hormnfsqc@yahoo.com', 0, '', '', '', '', '', '', '', 2, 0, 'New Member', 0, 1401007432, 0, 1401007432, 1401014830, 0, 0, 0, 0, 4, '5', 0, 0, 0, 0, 0, 3194967, '10-17-1976', '1976-10-17', -1, -1, '192.3.61.30', 0, 1, 0, 0, -1, 0, 0, 'MMbxqoEE^|!L[G*f6@bIezYJx]ysGY', 0, 0, 0, '', 0, 0, 0, 0, 0, 0, 0, 0, 0, 0, 0, 0, '', '', 0, '', 'vb', '', 0, 1, 0, 0, NULL),
(24766, 3, '', 0, 'A8272', '63c6d1cfc79a7bbab034baab98b08b1b', '2014-05-25', 'hardingiqzqsooh@outlook.com', 0, '', '', '', '', '', '', '', 2, 0, 'New Member', 0, 1401011431, 0, 1401011431, 1401011431, 0, 0, 0, 0, 4, '5', 0, 0, 0, 0, 0, 3194967, '09-18-1984', '1984-09-18', -1, -1, '50.2.223.74', 0, 1, 0, 0, -1, 0, 0, 'Cht"%k@E..+GU>bmt(}((W;6bU++m7', 0, 0, 0, '', 0, 0, 0, 0, 0, 0, 0, 0, 0, 0, 0, 0, '', '', 0, '', 'vb', '', 0, 1, 0, 0, NULL),
(24832, 3, '', 0, 'AAngas', 'dea693a5a675d09a64a8592cd4aab0b9', '2014-05-26', 'alejandra-angas88@kienthuccuatoi.com', 0, '', '', '', '', '', '', '', 2, 0, 'New Member', 0, 1401140700, 0, 1401140700, 1401147802, 0, 0, 0, 0, 4, '5', 0, 0, 0, 0, 0, 3194967, '05-20-1978', '1978-05-20', -1, -1, '23.108.132.173', 0, 1, 0, 0, -1, 0, 0, '''?.(W4%rj1?80.?(BenryfD\\GBbql{', 0, 0, 0, '', 0, 0, 0, 0, 0, 0, 0, 0, 0, 0, 0, 0, '', '', 0, '', 'vb', '', 0, 1, 0, 0, NULL),
(24768, 3, '', 0, 'DBoothby', 'f658f4375f25d29227d4492364c0896a', '2014-05-25', 'dong-boothby@tipbongmoingay.info', 0, '', '', '', '', '', '', '', 2, 0, 'New Member', 0, 1401014884, 0, 1401014884, 1401014884, 0, 0, 0, 0, 4, '5', 0, 0, 0, 0, 0, 3194967, '04-16-1981', '1981-04-16', -1, -1, '172.245.181.176', 0, 1, 0, 0, -1, 0, 0, '+@?}?ZvPd\\&80y~(DLSPW-;gz+WK`X', 0, 0, 0, '', 0, 0, 0, 0, 0, 0, 0, 0, 0, 0, 0, 0, '', '', 0, '', 'vb', '', 0, 1, 0, 0, NULL),
(24808, 3, '', 0, 'NR95', 'ac66cff3b314cfef65cd30d28530932c', '2014-05-26', 'gamypregnancy12nx70s@outlook.com', 0, '', '', '', '', '', '', '', 2, 0, 'New Member', 0, 1401083085, 0, 1401083085, 1401085204, 0, 0, 0, 0, 4, '5', 0, 0, 0, 0, 0, 3194967, '02-29-1972', '1972-02-29', -1, -1, '83.4.112.54', 0, 1, 0, 0, -1, 0, 0, 'p2L`cy02TjZgG?#4*B:0wB~c^dbS_x', 0, 0, 0, '', 0, 0, 0, 0, 0, 0, 0, 0, 0, 0, 0, 0, '', '', 0, '', 'vb', '', 0, 1, 0, 0, NULL),
(24770, 3, '', 0, 'MCanter', 'c71cd57f6ea73612e5db3e811d589f09', '2014-05-25', 'auspicioushitchr1158@outlook.com', 0, '', '', '', '', '', '', '', 2, 0, 'New Member', 0, 1401016997, 0, 1401016997, 1401023563, 0, 0, 0, 0, 4, '5', 0, 0, 0, 0, 0, 3194967, '08-16-1982', '1982-08-16', -1, -1, '83.29.175.240', 0, 1, 0, 0, -1, 0, 0, '''fOz{h5g:SExA7&P(SdHm[<:"b*k^)', 0, 0, 0, '', 0, 0, 0, 0, 0, 0, 0, 0, 0, 0, 0, 0, '', '', 0, '', 'vb', '', 0, 1, 0, 0, NULL),
(24771, 2, '', 0, 'A.W 1', '650b2d92b12780d67d139dc2c878ca19', '2014-10-05', 'Arbabwajid@live.com', 0, '', '', '', '', '', '', '', 2, 0, 'Member', 0, 1401017583, 0, 1421527929, 1425414523, 1414526472, 464060, 60, 0, 4, '4.5', 0, 0, 0, 0, 0, 3194967, '07-04-1987', '1987-07-04', -1, -1, '182.185.9.126', 0, 1, 0, 0, -1, 0, 0, ';[rp,[4#~`*bhuW%VMPCJ^?NaE)ED"', 0, 0, 0, '', 0, 0, 6, 0, 0, 0, 0, 0, 0, 0, 0, 0, '799ee1b70660e72f644003ef7472b47f', '', 0, '', 'vb', '', 0, 1, 0, 0, NULL),
(24772, 3, '', 0, 'M. Farooq', '541e80c2ea8990c78b4218755a0d8a14', '2014-05-25', 'farooqkhi@yahoo.com', 0, '', '', '', '', '', '', '', 2, 0, 'New Member', 0, 1401017816, 0, 1401019076, 1401019076, 0, 0, 0, 0, 4, '5', 0, 0, 0, 0, 0, 3194967, '01-01-1963', '1963-01-01', -1, -1, '119.156.10.70', 430, 1, 0, 0, -1, 0, 0, '`rvJWDbsBZ==>=apZ-s2'',gJXHQj:o', 0, 0, 0, '', 0, 0, 0, 0, 0, 0, 0, 0, 0, 0, 0, 0, '', '', 0, '', 'vb', '', 0, 1, 0, 0, NULL),
(24775, 3, '', 0, 'ZBoatwrig', 'dbd7c67301387b5603cfaa93805be16e', '2014-05-25', 'plantgesture51rb43h@outlook.com', 0, '', '', '', '', '', '', '', 2, 0, 'New Member', 0, 1401023906, 0, 1401023906, 1401026021, 0, 0, 0, 0, 4, '5', 0, 0, 0, 0, 0, 3194967, '01-20-1978', '1978-01-20', -1, -1, '178.46.56.37', 0, 1, 0, 0, -1, 0, 0, '[bLZU$Z%=$[=oWR#Ce/h9:=l!}Xh95', 0, 0, 0, '', 0, 0, 0, 0, 0, 0, 0, 0, 0, 0, 0, 0, '', '', 0, '', 'vb', '', 0, 1, 0, 0, NULL),
(24802, 3, '', 0, 'JImre', '1067bb2489e4e38f6512a485bbc80035', '2014-05-26', 'jnhcornellehxg@outlook.com', 0, '', '', '', '', '', '', '', 2, 0, 'New Member', 0, 1401071759, 0, 1401071759, 1401083791, 0, 0, 0, 0, 4, '5', 0, 0, 0, 0, 0, 3194967, '04-13-1982', '1982-04-13', -1, -1, '192.95.43.206', 0, 1, 0, 0, -1, 0, 0, ';Lf+:S:<uD~F-JzeW2!N6)>ULcuj`R', 0, 0, 0, '', 0, 0, 0, 0, 0, 0, 0, 0, 0, 0, 0, 0, '', '', 0, '', 'vb', '', 0, 1, 0, 0, NULL),
(24803, 3, '', 0, 'M2887', '92a10044034eca0b83e0d9ef810ff6ec', '2014-05-26', 'tellingflavor239@yahoo.com', 0, '', '', '', '', '', '', '', 2, 0, 'New Member', 0, 1401073749, 0, 1401073749, 1401074319, 0, 0, 0, 0, 4, '5', 0, 0, 0, 0, 0, 3194967, '04-20-1985', '1985-04-20', -1, -1, '69.12.90.200', 0, 1, 0, 0, -1, 0, 0, '3Q<6VeE-Q0):+DX]t1|b8(<V3@V("y', 0, 0, 0, '', 0, 0, 0, 0, 0, 0, 0, 0, 0, 0, 0, 0, '', '', 0, '', 'vb', '', 0, 1, 0, 0, NULL),
(25084, 3, '', 0, 'xtannajue', '33eddd64e97c6bb53653385b0d8812c9', '2014-06-02', 'camelintoli@hotmail.com', 0, '', '', '', '', '', '', '', 2, 0, 'New Member', 0, 1401699403, 0, 1401699403, 1401699403, 0, 0, 0, 0, 4, '1', 0, 0, 0, 0, 0, 3195031, '04-07-1982', '1982-04-07', -1, -1, '23.89.141.19', 0, 1, 0, 0, -1, 0, 0, 'y.T4TAI.2\\.NR)D?gh`h!}X~r^dNfG', 0, 0, 0, '', 0, 0, 0, 0, 0, 0, 0, 0, 0, 0, 0, 0, '', '', 0, '', 'vb', '', 0, 1, 0, 0, NULL),
(24786, 3, '', 0, 'K1245', '1554f9aadf8c262503d3034f8d870efd', '2014-05-25', 'davxdimzuk@yahoo.com', 0, '', '', '', '', '', '', '', 2, 0, 'New Member', 0, 1401054117, 0, 1401054117, 1401063060, 0, 0, 0, 0, 4, '5', 0, 0, 0, 0, 0, 3194967, '04-06-1983', '1983-04-06', -1, -1, '50.115.175.221', 0, 1, 0, 0, -1, 0, 0, 'Rll|1)R?[dzD[jz(*Hi%+t0D"l6syQ', 0, 0, 0, '', 0, 0, 0, 0, 0, 0, 0, 0, 0, 0, 0, 0, '', '', 0, '', 'vb', '', 0, 1, 0, 0, NULL),
(24819, 3, '', 0, 'MUZN', '2a7bef5f30997e6a74411260820f7dab', '2014-05-26', 'hjejackiexn@outlook.com', 0, '', '', '', '', '', '', '', 2, 0, 'New Member', 0, 1401105997, 0, 1401105997, 1401116278, 0, 0, 0, 0, 4, '5', 0, 0, 0, 0, 0, 3194967, '09-20-1974', '1974-09-20', -1, -1, '192.95.43.200', 0, 1, 0, 0, -1, 0, 0, '0IE[O`lq>KV._WPrC+K",(r/1=1#_m', 0, 0, 0, '', 0, 0, 0, 0, 0, 0, 0, 0, 0, 0, 0, 0, '', '', 0, '', 'vb', '', 0, 1, 0, 0, NULL),
(24780, 3, '', 0, 'MVanRaalt', '63c17947f35f53b482c3f0facdbf32d2', '2014-05-25', 'cappqstugs@yahoo.com', 0, '', '', '', '', '', '', '', 2, 0, 'New Member', 0, 1401038874, 0, 1401038874, 1401038874, 0, 0, 0, 0, 4, '5', 0, 0, 0, 0, 0, 3194967, '09-04-1974', '1974-09-04', -1, -1, '46.249.58.197', 0, 1, 0, 0, -1, 0, 0, 'wZ=xC5N.*DCw65l:~t7$@bavV){zS#', 0, 0, 0, '', 0, 0, 0, 0, 0, 0, 0, 0, 0, 0, 0, 0, '', '', 0, '', 'vb', '', 0, 1, 0, 0, NULL),
(24797, 3, '', 0, 'CPXT', 'e963a1f66f1620aa0211a3ddacd48bde', '2014-05-26', 'chau_statton24@kienthuccuatoi.com', 0, '', '', '', '', '', '', '', 2, 0, 'New Member', 0, 1401069567, 0, 1401069567, 1401076387, 0, 0, 0, 0, 4, '5', 0, 0, 0, 0, 0, 3194967, '11-24-1983', '1983-11-24', -1, -1, '107.181.70.247', 0, 1, 0, 0, -1, 0, 0, 'cwO:`b+zSBD(J5iqNkx<Pl''3l-"4Bw', 0, 0, 0, '', 0, 0, 0, 0, 0, 0, 0, 0, 0, 0, 0, 0, '', '', 0, '', 'vb', '', 0, 1, 0, 0, NULL),
(24782, 3, '', 0, 'MWillough', '260673781a73bf95f9a4bc110175bb8d', '2014-05-25', 'hayeszsrat@yahoo.com', 0, '', '', '', '', '', '', '', 2, 0, 'New Member', 0, 1401041651, 0, 1401041651, 1401041651, 0, 0, 0, 0, 4, '5', 0, 0, 0, 0, 0, 3194967, '09-19-1976', '1976-09-19', -1, -1, '5.39.126.74', 0, 1, 0, 0, -1, 0, 0, '5*FdD\\?R''[]@0VHl)6~m!90ICaB14S', 0, 0, 0, '', 0, 0, 0, 0, 0, 0, 0, 0, 0, 0, 0, 0, '', '', 0, '', 'vb', '', 0, 1, 0, 0, NULL),
(24783, 2, '', 0, 'zastava', '8150b79ae25faa1a45937367711b051a', '2014-05-25', 'ahmedalishah15@yahoo.com', 0, '', '', '', '', '', '', '', 2, 0, 'New Member', 0, 1401041732, 0, 1402934282, 1403543900, 0, 0, 0, 0, 4, '5', 0, 0, 0, 0, 0, 3194967, '01-29-1993', '1993-01-29', -1, -1, '39.33.130.229', 0, 1, 0, 0, -1, 0, 0, 'z|74R1HZ.+/fY(@+t)eyBDMBrh*(#Z', 0, 0, 0, '', 0, 0, 0, 0, 0, 0, 0, 0, 0, 0, 0, 0, '', '', 0, '', 'vb', '', 0, 1, 0, 0, NULL),
(24833, 3, '', 0, 'HBeaulieu', '49a163af296cfe1e7bcc7577b3cddf86', '2014-05-26', 'heriberto.beaulieu@kienthuccuatoi.com', 0, '', '', '', '', '', '', '', 2, 0, 'New Member', 0, 1401140827, 0, 1401140827, 1401148017, 0, 0, 0, 0, 4, '5', 0, 0, 0, 0, 0, 3194967, '09-21-1984', '1984-09-21', -1, -1, '23.108.132.173', 0, 1, 0, 0, -1, 0, 0, '@1tzgz{(r_~tbGu_gr'']`.VJ:O2GCB', 0, 0, 0, '', 0, 0, 0, 0, 0, 0, 0, 0, 0, 0, 0, 0, '', '', 0, '', 'vb', '', 0, 1, 0, 0, NULL),
(24814, 3, '', 0, 'PUNE', '061b0e14876743a7a06c76df7efcef30', '2014-05-26', 'bettyejoclubbs@yahoo.com', 0, '', '', '', '', '', '', '', 2, 0, 'New Member', 0, 1401099405, 0, 1401099405, 1401105006, 0, 0, 0, 0, 4, '5', 0, 0, 0, 0, 0, 3194967, '02-16-1980', '1980-02-16', -1, -1, '107.155.80.208', 0, 1, 0, 0, -1, 0, 0, 'd\\@iz/lBs4''^imZ3caJM9-YO}1]*9^', 0, 0, 0, '', 0, 0, 0, 0, 0, 0, 0, 0, 0, 0, 0, 0, '', '', 0, '', 'vb', '', 0, 1, 0, 0, NULL),
(24830, 3, '', 0, 'EAUE', '96e33a35356173ee3e936e5b3afd0d25', '2014-05-26', 'guardedthrill4847u57@outlook.com', 0, '', '', '', '', '', '', '', 2, 0, 'New Member', 0, 1401140179, 0, 1401140179, 1401142170, 0, 0, 0, 0, 4, '5', 0, 0, 0, 0, 0, 3194967, '05-03-1975', '1975-05-03', -1, -1, '69.12.74.151', 0, 1, 0, 0, -1, 0, 0, 'd-Y{8iujporTm-u;iT~n|9(aFIJ12o', 0, 0, 0, '', 0, 0, 0, 0, 0, 0, 0, 0, 0, 0, 0, 0, '', '', 0, '', 'vb', '', 0, 1, 0, 0, NULL),
(24825, 3, '', 0, 'SSteil', 'cf36de31d239a50edbf9fb1bc3d33963', '2014-05-26', 'shane-steil@iidiscounts.com', 0, '', '', '', '', '', '', '', 2, 0, 'New Member', 0, 1401134164, 0, 1401134164, 1401141402, 0, 0, 0, 0, 4, '5', 0, 0, 0, 0, 0, 3194967, '09-22-1982', '1982-09-22', -1, -1, '198.50.161.246', 0, 1, 0, 0, -1, 0, 0, '($v+y%}e=2p=pTYt.t$TX:_7vj2@+t', 0, 0, 0, '', 0, 0, 0, 0, 0, 0, 0, 0, 0, 0, 0, 0, '', '', 0, '', 'vb', '', 0, 1, 0, 0, NULL),
(24839, 3, '', 0, 'ATalbott', '5be41a901a7708f7887a8f548548d613', '2014-05-27', 'overwroughtbevy4041@outlook.com', 0, '', '', '', '', '', '', '', 2, 0, 'New Member', 0, 1401147587, 0, 1401147587, 1401149768, 0, 0, 0, 0, 4, '5', 0, 0, 0, 0, 0, 3194967, '12-19-1981', '1981-12-19', -1, -1, '69.12.74.48', 0, 1, 0, 0, -1, 0, 0, 'Or1K>{l/mhYw*e<G:`1m)f~\\1UrqO=', 0, 0, 0, '', 0, 0, 0, 0, 0, 0, 0, 0, 0, 0, 0, 0, '', '', 0, '', 'vb', '', 0, 1, 0, 0, NULL),
(24901, 3, '', 0, 'SNve', 'bf95ff759befae7e6b7df5e19d29e42f', '2014-05-28', 'clammyknoll87eo67@outlook.com', 0, '', '', '', '', '', '', '', 2, 0, 'New Member', 0, 1401240102, 0, 1401240102, 1401260472, 0, 0, 0, 0, 4, '5', 0, 0, 0, 0, 0, 3194967, '01-03-1981', '1981-01-03', -1, -1, '69.12.74.48', 0, 1, 0, 0, -1, 0, 0, '33G9e8=v2{nC*&>W[yjH+X.Du8Hjgy', 0, 0, 0, '', 0, 0, 0, 0, 0, 0, 0, 0, 0, 0, 0, 0, '', '', 0, '', 'vb', '', 0, 1, 0, 0, NULL),
(24938, 3, '', 0, 'MArmitage', 'af7619c35d5828ec37c9a3a3d94eb5bb', '2014-05-29', 'ossifiedcybersp3fw41@outlook.com', 0, '', '', '', '', '', '', '', 2, 0, 'New Member', 0, 1401345919, 0, 1401345919, 1401348126, 0, 0, 0, 0, 4, '5', 0, 0, 0, 0, 0, 3194967, '11-02-1974', '1974-11-02', -1, -1, '23.82.67.86', 0, 1, 0, 0, -1, 0, 0, 'KB"/NfOT>Iw~i8R{I$d!cze2J?{$sv', 0, 0, 0, '', 0, 0, 0, 0, 0, 0, 0, 0, 0, 0, 0, 0, '', '', 0, '', 'vb', '', 0, 1, 0, 0, NULL),
(24842, 3, '', 0, 'CWaldrup', '155afcb17251bc47717517902ddc721d', '2014-05-27', 'curtis_waldrup@kienthuccuatoi.com', 0, '', '', '', '', '', '', '', 2, 0, 'New Member', 0, 1401150901, 0, 1401150901, 1401157751, 0, 0, 0, 0, 4, '5', 0, 0, 0, 0, 0, 3194967, '09-17-1983', '1983-09-17', -1, -1, '69.12.76.114', 0, 1, 0, 0, -1, 0, 0, '>s3}T.5<[tLVY,c9V_l:UsG0#BV1LI', 0, 0, 0, '', 0, 0, 0, 0, 0, 0, 0, 0, 0, 0, 0, 0, '', '', 0, '', 'vb', '', 0, 1, 0, 0, NULL),
(24988, 3, '', 0, 'KLhotsky', '5e5332a4c878448e662ac6291d5b230e', '2014-05-30', 'datquach12@outlook.com', 0, '', '', '', '', '', '', '', 2, 0, 'New Member', 0, 1401475363, 0, 1401475363, 1401477279, 0, 0, 0, 0, 4, '5', 0, 0, 0, 0, 0, 3194967, '06-04-1976', '1976-06-04', -1, -1, '23.94.19.77', 0, 1, 0, 0, -1, 0, 0, ']3)[4m6:Jfp|jBRx74=Ko?''WxWe''t2', 0, 0, 0, '', 0, 0, 0, 0, 0, 0, 0, 0, 0, 0, 0, 0, '', '', 0, '', 'vb', '', 0, 1, 0, 0, NULL),
(24989, 2, '', 0, 'px4.1987', '86a3ab815285f1f98cb6a1978b76b9d7', '2014-05-30', 'px4.1987@gmail.com', 7, '', '', '', '', '', '', '', 2, 0, 'Member', 0, 1401480653, 0, 1477757878, 1477824271, 1462096788, 493634, 75, 0, 4, '5', 0, 0, 0, 0, 0, 3163223, '09-29-1987', '1987-09-29', 40, 1, '162.210.196.161', 0, 0, 0, 0, -1, 0, 0, 'KI;,!({8+;VYOp&RSKw$`{smD_.};.', 0, 0, 0, '', 0, 0, 7, 0, 0, 0, 0, 0, 0, 0, 0, 0, '4336c89d36ebe937a7feb69d910e2a41', '', 0, '', 'vb', '', 0, 1, 0, 0, NULL),
(24845, 3, '', 0, 'VRicketts', '1cfb308a341b75f09b321a88c7db08fc', '2014-05-27', 'abrasiverunt28x6623@outlook.com', 0, '', '', '', '', '', '', '', 2, 0, 'New Member', 0, 1401153188, 0, 1401153188, 1401155842, 0, 0, 0, 0, 4, '5', 0, 0, 0, 0, 0, 3194967, '06-22-1973', '1973-06-22', -1, -1, '165.231.22.143', 0, 1, 0, 0, -1, 0, 0, '-M!]"G3zA.<yRpH6#{2<?(w`qQWIcX', 0, 0, 0, '', 0, 0, 0, 0, 0, 0, 0, 0, 0, 0, 0, 0, '', '', 0, '', 'vb', '', 0, 1, 0, 0, NULL),
(24936, 3, '', 0, 'WVISK', 'a5e71074c9d96a8b90079acc5a8f1d51', '2014-05-29', 'wade-guerra9@cungsuyngam.com', 0, '', '', '', '', '', '', '', 2, 0, 'New Member', 0, 1401337118, 0, 1401337118, 1401342521, 0, 0, 0, 0, 4, '5', 0, 0, 0, 0, 0, 3194967, '09-08-1970', '1970-09-08', -1, -1, '69.12.76.224', 0, 1, 0, 0, -1, 0, 0, '0lg2u3AE:$pf.Geo,nC!JvkoZZZH^a', 0, 0, 0, '', 0, 0, 0, 0, 0, 0, 0, 0, 0, 0, 0, 0, '', '', 0, '', 'vb', '', 0, 1, 0, 0, NULL),
(24900, 3, '', 0, 'RB90', '8c8a9708e73d93d24c84163b43b4fa1f', '2014-05-28', 'remona_harcus@iidiscounts.org', 0, '', '', '', '', '', '', '', 2, 0, 'New Member', 0, 1401233989, 0, 1401233989, 1401241190, 0, 0, 0, 0, 4, '5', 0, 0, 0, 0, 0, 3194967, '03-16-1981', '1981-03-16', -1, -1, '95.154.217.192', 0, 1, 0, 0, -1, 0, 0, '<b,z\\[A<a82iipT7b\\=L|k^Y}JP&E#', 0, 0, 0, '', 0, 0, 0, 0, 0, 0, 0, 0, 0, 0, 0, 0, '', '', 0, '', 'vb', '', 0, 1, 0, 0, NULL),
(24848, 3, '', 0, 'LBattarbe', '89840103125633a1fc40d09d3b819d22', '2014-05-27', 'reminiscentutil1go1@outlook.com', 0, '', '', '', '', '', '', '', 2, 0, 'New Member', 0, 1401158062, 0, 1401158062, 1401160045, 0, 0, 0, 0, 4, '5', 0, 0, 0, 0, 0, 3194967, '09-20-1972', '1972-09-20', -1, -1, '69.12.74.72', 0, 1, 0, 0, -1, 0, 0, '*r^8!Up3Nyad""+Lv''sX5IuN['',='']', 0, 0, 0, '', 0, 0, 0, 0, 0, 0, 0, 0, 0, 0, 0, 0, '', '', 0, '', 'vb', '', 0, 1, 0, 0, NULL),
(24849, 3, '', 0, 'KRamsboth', '74f020f10bd3476959b2fc7a4c50edf6', '2014-05-27', 'gloverq1hblbdv@outlook.com', 0, '', '', '', '', '', '', '', 2, 0, 'New Member', 0, 1401162485, 0, 1401162485, 1401162485, 0, 0, 0, 0, 4, '5', 0, 0, 0, 0, 0, 3194967, '09-20-1979', '1979-09-20', -1, -1, '199.180.130.88', 0, 1, 0, 0, -1, 0, 0, 'TV+lp8lFj#CtW`:#a8\\vA-REQ>Xb6f', 0, 0, 0, '', 0, 0, 0, 0, 0, 0, 0, 0, 0, 0, 0, 0, '', '', 0, '', 'vb', '', 0, 1, 0, 0, NULL),
(24850, 2, '', 0, 'AXUN', '65bf1234fc88fdf4402af39c1074111f', '2014-05-27', 'kumuemxr@yahoo.com', 0, '', '', '', '', '', '', '', 2, 0, 'New Member', 0, 1401163450, 0, 1401163450, 1401163661, 0, 0, 0, 0, 4, '5', 0, 0, 0, 0, 0, 3194967, '12-24-1975', '1975-12-24', -1, -1, '178.238.133.223', 0, 1, 0, 0, -1, 0, 0, 'k8bXV[?PetWxde>xrOc4]1ToJVe;[7', 0, 0, 0, '', 0, 0, 0, 0, 0, 0, 0, 0, 0, 0, 0, 0, '', '', 0, '', 'vb', '', 0, 1, 0, 0, NULL),
(24851, 3, '', 0, 'L9827', 'f56cff89670d7fccb7c9d864c4f57ec9', '2014-05-27', 'roundcan74t620k@outlook.com', 0, '', '', '', '', '', '', '', 2, 0, 'New Member', 0, 1401165357, 0, 1401165357, 1401197924, 0, 0, 0, 0, 4, '5', 0, 0, 0, 0, 0, 3194967, '04-18-1971', '1971-04-18', -1, -1, '165.231.22.143', 0, 1, 0, 0, -1, 0, 0, 'LyH\\$wF''gCr@bCAasJbFx{#oQdv!)v', 0, 0, 0, '', 0, 0, 0, 0, 0, 0, 0, 0, 0, 0, 0, 0, '', '', 0, '', 'vb', '', 0, 1, 0, 0, NULL),
(24852, 3, '', 0, 'JDorman', 'fb2f3feace83535d19b585cbc2eefa16', '2014-05-27', 'evilwoman54it80t@outlook.com', 0, '', '', '', '', '', '', '', 2, 0, 'New Member', 0, 1401165489, 0, 1401165489, 1401168210, 0, 0, 0, 0, 4, '5', 0, 0, 0, 0, 0, 3194967, '09-08-1979', '1979-09-08', -1, -1, '165.231.22.143', 0, 1, 0, 0, -1, 0, 0, '/lvAf#jJA`.?y*xXss5EP197+V+VKw', 0, 0, 0, '', 0, 0, 0, 0, 0, 0, 0, 0, 0, 0, 0, 0, '', '', 0, '', 'vb', '', 0, 1, 0, 0, NULL),
(24853, 3, '', 0, 'PG44', '00fe04351594e2ff006bb0c2cd81a676', '2014-05-27', 'wastefullap463h54@outlook.com', 0, '', '', '', '', '', '', '', 2, 0, 'New Member', 0, 1401165792, 0, 1401165792, 1401197978, 0, 0, 0, 0, 4, '5', 0, 0, 0, 0, 0, 3194967, '11-16-1984', '1984-11-16', -1, -1, '69.12.78.126', 0, 1, 0, 0, -1, 0, 0, '2ubW{Jzoj]4,@(V#MP}P@P57P=/pq!', 0, 0, 0, '', 0, 0, 0, 0, 0, 0, 0, 0, 0, 0, 0, 0, '', '', 0, '', 'vb', '', 0, 1, 0, 0, NULL),
(24855, 3, '', 0, 'MYYAK', 'c7c87d3434db3fcdb890ba5f3d67b97b', '2014-05-27', 'malorie_mccrae22@camnangdoisong.com', 0, '', '', '', '', '', '', '', 2, 0, 'New Member', 0, 1401169650, 0, 1401169650, 1401178583, 0, 0, 0, 0, 4, '5', 0, 0, 0, 0, 0, 3194967, '07-03-1970', '1970-07-03', -1, -1, '198.98.120.84', 0, 1, 0, 0, -1, 0, 0, '<FLs>hFkm$H5TCP%Z4H;s;55y`"qP-', 0, 0, 0, '', 0, 0, 0, 0, 0, 0, 0, 0, 0, 0, 0, 0, '', '', 0, '', 'vb', '', 0, 1, 0, 0, NULL),
(24856, 3, '', 0, 'MRing', '040fecbf0ec315f9053f8eb933c080d2', '2014-05-27', 'lightshoe62ima26@outlook.com', 0, '', '', '', '', '', '', '', 2, 0, 'New Member', 0, 1401170108, 0, 1401170108, 1401172669, 0, 0, 0, 0, 4, '5', 0, 0, 0, 0, 0, 3194967, '06-01-1985', '1985-06-01', -1, -1, '198.143.143.228', 0, 1, 0, 0, -1, 0, 0, '2iK^X)=cOP(,)+L^U2R+}X^{oDwX}v', 0, 0, 0, '', 0, 0, 0, 0, 0, 0, 0, 0, 0, 0, 0, 0, '', '', 0, '', 'vb', '', 0, 1, 0, 0, NULL),
(25070, 3, '', 0, 'Richardlani', '05d170de36420acbeb970376b92210c0', '2014-06-02', 'sveridokse@gmail.com', 0, '', '', '', '', '', '', '', 2, 0, 'New Member', 0, 1401664215, 0, 1401664215, 1401664215, 0, 0, 0, 0, 4, '-4.5', 0, 0, 0, 0, 0, 3195031, '02-20-1976', '1976-02-20', -1, -1, '66.171.229.28', 0, 1, 0, 0, -1, 0, 0, '^9LIa="]jEkvclWtN\\qoVzO7dZHdE[', 0, 0, 0, '', 0, 0, 0, 0, 0, 0, 0, 0, 0, 0, 0, 0, '', '', 0, '', 'vb', '', 0, 1, 0, 0, NULL),
(24858, 3, '', 0, 'JBagot', '476acdd10cef111f08846dbf330d22a2', '2014-05-27', 'quaintray183em83@outlook.com', 0, '', '', '', '', '', '', '', 2, 0, 'New Member', 0, 1401172383, 0, 1401172383, 1401174946, 0, 0, 0, 0, 4, '5', 0, 0, 0, 0, 0, 3194967, '08-15-1982', '1982-08-15', -1, -1, '69.12.74.75', 0, 1, 0, 0, -1, 0, 0, 'CbWnCHK)yPCC&L=h.G|ngQp$9OzsE=', 0, 0, 0, '', 0, 0, 0, 0, 0, 0, 0, 0, 0, 0, 0, 0, '', '', 0, '', 'vb', '', 0, 1, 0, 0, NULL),
(24859, 3, '', 0, 'A93E', '4d32f1ddbed8f1f5da2ffc89bafa23ca', '2014-05-27', 'gulliblejacket48ma13@outlook.com', 0, '', '', '', '', '', '', '', 2, 0, 'New Member', 0, 1401174719, 0, 1401174719, 1401177234, 0, 0, 0, 0, 4, '5', 0, 0, 0, 0, 0, 3194967, '02-06-1977', '1977-02-06', -1, -1, '192.3.55.246', 0, 1, 0, 0, -1, 0, 0, 'yyp]g`u+>@m_!mSHgT9YNn[NP.ysT~', 0, 0, 0, '', 0, 0, 0, 0, 0, 0, 0, 0, 0, 0, 0, 0, '', '', 0, '', 'vb', '', 0, 1, 0, 0, NULL),
(24909, 3, '', 0, 'L6595', '48bf095a9e8d1b47db283a53ea653b4e', '2014-05-28', 'jznkynaeic@yahoo.com', 0, '', '', '', '', '', '', '', 2, 0, 'New Member', 0, 1401261627, 0, 1401261627, 1401272958, 0, 0, 0, 0, 4, '5', 0, 0, 0, 0, 0, 3194967, '11-06-1975', '1975-11-06', -1, -1, '170.130.111.240', 0, 1, 0, 0, -1, 0, 0, 'Rc12~Vxr+k9Y=n]A$-4;6m@QiJ!`)S', 0, 0, 0, '', 0, 0, 0, 0, 0, 0, 0, 0, 0, 0, 0, 0, '', '', 0, '', 'vb', '', 0, 1, 0, 0, NULL),
(24861, 3, '', 0, 'NMagill', 'f7de8efbcd5f1539460f0ee8a5c11b6b', '2014-05-27', 'humdrumcab238if16@outlook.com', 0, '', '', '', '', '', '', '', 2, 0, 'New Member', 0, 1401177176, 0, 1401177176, 1401179530, 0, 0, 0, 0, 4, '5', 0, 0, 0, 0, 0, 3194967, '07-04-1983', '1983-07-04', -1, -1, '69.12.74.48', 0, 1, 0, 0, -1, 0, 0, 'V1-}L3UAMic\\''rw;B]0NcJ{s"R>sfJ', 0, 0, 0, '', 0, 0, 0, 0, 0, 0, 0, 0, 0, 0, 0, 0, '', '', 0, '', 'vb', '', 0, 1, 0, 0, NULL),
(24862, 3, '', 0, 'DWhitcomb', 'ba3bb553ca3f227d4b5cc0e5a9b6896d', '2014-05-27', 'wickeddemonstrapl401@outlook.com', 0, '', '', '', '', '', '', '', 2, 0, 'New Member', 0, 1401177480, 0, 1401177480, 1401179634, 0, 0, 0, 0, 4, '5', 0, 0, 0, 0, 0, 3194967, '02-09-1970', '1970-02-09', -1, -1, '69.12.74.48', 0, 1, 0, 0, -1, 0, 0, '^<w~x/09LhyrhK$/cWuGi;`S[V;NO|', 0, 0, 0, '', 0, 0, 0, 0, 0, 0, 0, 0, 0, 0, 0, 0, '', '', 0, '', 'vb', '', 0, 1, 0, 0, NULL),
(24863, 3, '', 0, 'CLaw', '1a7ed45dffe1c27677330739e9934904', '2014-05-27', 'overwroughtmisfwnl28@outlook.com', 0, '', '', '', '', '', '', '', 2, 0, 'New Member', 0, 1401179991, 0, 1401179991, 1401182160, 0, 0, 0, 0, 4, '5', 0, 0, 0, 0, 0, 3194967, '07-10-1977', '1977-07-10', -1, -1, '69.12.74.48', 0, 1, 0, 0, -1, 0, 0, 'Rv~@(WFq^;94albzt24NY>5by}WG-(', 0, 0, 0, '', 0, 0, 0, 0, 0, 0, 0, 0, 0, 0, 0, 0, '', '', 0, '', 'vb', '', 0, 1, 0, 0, NULL),
(24864, 3, '', 0, 'MNolen', 'd4345650f15cd7862614c708441d64fe', '2014-05-27', 'fadedjug403e628@outlook.com', 0, '', '', '', '', '', '', '', 2, 0, 'New Member', 0, 1401183082, 0, 1401183082, 1401185132, 0, 0, 0, 0, 4, '5', 0, 0, 0, 0, 0, 3194967, '11-02-1974', '1974-11-02', -1, -1, '199.119.226.83', 0, 1, 0, 0, -1, 0, 0, '=D,lss*ASF]tA5%@{?gjr.@BJTbve&', 0, 0, 0, '', 0, 0, 0, 0, 0, 0, 0, 0, 0, 0, 0, 0, '', '', 0, '', 'vb', '', 0, 1, 0, 0, NULL);
INSERT INTO `user` (`userid`, `usergroupid`, `membergroupids`, `displaygroupid`, `username`, `password`, `passworddate`, `email`, `styleid`, `parentemail`, `homepage`, `icq`, `aim`, `yahoo`, `msn`, `skype`, `showvbcode`, `showbirthday`, `usertitle`, `customtitle`, `joindate`, `daysprune`, `lastvisit`, `lastactivity`, `lastpost`, `lastpostid`, `posts`, `reputation`, `reputationlevelid`, `timezoneoffset`, `pmpopup`, `avatarid`, `avatarrevision`, `profilepicrevision`, `sigpicrevision`, `options`, `birthday`, `birthday_search`, `maxposts`, `startofweek`, `ipaddress`, `referrerid`, `languageid`, `emailstamp`, `threadedmode`, `autosubscribe`, `pmtotal`, `pmunread`, `salt`, `ipoints`, `infractions`, `warnings`, `infractiongroupids`, `infractiongroupid`, `adminoptions`, `profilevisits`, `friendcount`, `friendreqcount`, `vmunreadcount`, `vmmoderatedcount`, `socgroupinvitecount`, `socgroupreqcount`, `pcunreadcount`, `pcmoderatedcount`, `gmmoderatedcount`, `assetposthash`, `fbuserid`, `fbjoindate`, `fbname`, `logintype`, `fbaccesstoken`, `bloggroupreqcount`, `showblogcss`, `importuserid`, `newrepcount`, `panjo_selling`) VALUES
(24865, 3, '', 0, 'MVPH', 'e4d6a8c8e0b9428640879a165d5f1a95', '2014-05-27', 'hellishhinge19359@outlook.com', 0, '', '', '', '', '', '', '', 2, 0, 'New Member', 0, 1401183240, 0, 1401183240, 1401185123, 0, 0, 0, 0, 4, '5', 0, 0, 0, 0, 0, 3194967, '04-06-1982', '1982-04-06', -1, -1, '199.119.226.83', 0, 1, 0, 0, -1, 0, 0, 'rRr:8#RmHiy[w$F7i=BdYfC;4s\\KGo', 0, 0, 0, '', 0, 0, 0, 0, 0, 0, 0, 0, 0, 0, 0, 0, '', '', 0, '', 'vb', '', 0, 1, 0, 0, NULL),
(24866, 3, '', 0, 'LQ60', '1604212a8fdfbe8b9faf6362741acb6d', '2014-05-27', 'horriblespeck550tw42@outlook.com', 0, '', '', '', '', '', '', '', 2, 0, 'New Member', 0, 1401183423, 0, 1401183423, 1401185631, 0, 0, 0, 0, 4, '5', 0, 0, 0, 0, 0, 3194967, '11-04-1980', '1980-11-04', -1, -1, '199.119.226.83', 0, 1, 0, 0, -1, 0, 0, '&x=FOKwTFXHS=A0!fE)kJH%W;ZM}0_', 0, 0, 0, '', 0, 0, 0, 0, 0, 0, 0, 0, 0, 0, 0, 0, '', '', 0, '', 'vb', '', 0, 1, 0, 0, NULL),
(24867, 3, '', 0, 'PQfk', '3060a3ac65d82cc6f782eb5b9bcdce23', '2014-05-27', 'dryoaf23fy90q@outlook.com', 0, '', '', '', '', '', '', '', 2, 0, 'New Member', 0, 1401183475, 0, 1401183475, 1401185901, 0, 0, 0, 0, 4, '5', 0, 0, 0, 0, 0, 3194967, '04-21-1977', '1977-04-21', -1, -1, '199.119.226.83', 0, 1, 0, 0, -1, 0, 0, '9tS`w%>CRE8-O#N-sUVE8yr$/c-20{', 0, 0, 0, '', 0, 0, 0, 0, 0, 0, 0, 0, 0, 0, 0, 0, '', '', 0, '', 'vb', '', 0, 1, 0, 0, NULL),
(24868, 3, '', 0, 'ARHD', '02864e268302d8d80a03b05a8243ab6f', '2014-05-27', 'marksrgv@outlook.com', 0, '', '', '', '', '', '', '', 2, 0, 'New Member', 0, 1401183538, 0, 1401183538, 1401188274, 0, 0, 0, 0, 4, '5', 0, 0, 0, 0, 0, 3194967, '11-30-1972', '1972-11-30', -1, -1, '27.147.225.66', 0, 1, 0, 0, -1, 0, 0, 'wr)td2i8E*%XsD!l~+H4Mj=rpmpM''#', 0, 0, 0, '', 0, 0, 0, 0, 0, 0, 0, 0, 0, 0, 0, 0, '', '', 0, '', 'vb', '', 0, 1, 0, 0, NULL),
(24869, 3, '', 0, 'KChesser', '3d2a47e0da8b820a6e81e6ffe4a33865', '2014-05-27', 'warmace71tg02@outlook.com', 0, '', '', '', '', '', '', '', 2, 0, 'New Member', 0, 1401184071, 0, 1401184071, 1401186308, 0, 0, 0, 0, 4, '5', 0, 0, 0, 0, 0, 3194967, '08-20-1983', '1983-08-20', -1, -1, '74.221.208.217', 0, 1, 0, 0, -1, 0, 0, 'vkE$;HRH=(}a@wUC(:O:IL&q>Ez(iB', 0, 0, 0, '', 0, 0, 0, 0, 0, 0, 0, 0, 0, 0, 0, 0, '', '', 0, '', 'vb', '', 0, 1, 0, 0, NULL),
(24870, 3, '', 0, 'RGisborne', 'aa1d519ccc04b4d369a1db7a29d5a727', '2014-05-27', 'royal.gisborne@kienthucxahoi.com', 0, '', '', '', '', '', '', '', 2, 0, 'New Member', 0, 1401184134, 0, 1401184134, 1401190988, 0, 0, 0, 0, 4, '5', 0, 0, 0, 0, 0, 3194967, '12-02-1972', '1972-12-02', -1, -1, '69.12.76.114', 0, 1, 0, 0, -1, 0, 0, 'd&%fc''c<DCi.?|?|n''Frv{!mLsg_P!', 0, 0, 0, '', 0, 0, 0, 0, 0, 0, 0, 0, 0, 0, 0, 0, '', '', 0, '', 'vb', '', 0, 1, 0, 0, NULL),
(24871, 3, '', 0, 'GDoolette', '300d416bf3dc6e6b27abda2b380a2498', '2014-05-27', 'alikeaccordion99303@outlook.com', 0, '', '', '', '', '', '', '', 2, 0, 'New Member', 0, 1401184227, 0, 1401184227, 1401186294, 0, 0, 0, 0, 4, '5', 0, 0, 0, 0, 0, 3194967, '08-08-1971', '1971-08-08', -1, -1, '74.221.208.217', 0, 1, 0, 0, -1, 0, 0, '}J_\\d`}Z.WNvCiF-unn4;?-2C"NL:m', 0, 0, 0, '', 0, 0, 0, 0, 0, 0, 0, 0, 0, 0, 0, 0, '', '', 0, '', 'vb', '', 0, 1, 0, 0, NULL),
(24872, 3, '', 0, 'EIrving', 'b4769896646153714947b62de193adbc', '2014-05-27', 'squarepedigree53457@outlook.com', 0, '', '', '', '', '', '', '', 2, 0, 'New Member', 0, 1401185682, 0, 1401185682, 1401187546, 0, 0, 0, 0, 4, '5', 0, 0, 0, 0, 0, 3194967, '01-14-1977', '1977-01-14', -1, -1, '165.231.22.189', 0, 1, 0, 0, -1, 0, 0, 'bVp_]zK''ZlghZx7XZ,*RsTs!r?sg''s', 0, 0, 0, '', 0, 0, 0, 0, 0, 0, 0, 0, 0, 0, 0, 0, '', '', 0, '', 'vb', '', 0, 1, 0, 0, NULL),
(24873, 2, '', 0, 'akht786', 'f8718da221372920a3cd14a5d4d7340a', '2014-05-27', 'jacksparrow94529@gmail.com', 0, '', '', '', '', '', '', '', 2, 0, 'New Member', 0, 1401186563, 0, 1401187665, 1401187665, 0, 0, 0, 0, 4, '5', 0, 0, 0, 0, 0, 3194967, '02-01-1985', '1985-02-01', -1, -1, '94.201.232.31', 0, 1, 0, 0, -1, 0, 0, 'SML"U[zwYLTp5''''uLs]>hC!NL]zi(A', 0, 0, 0, '', 0, 0, 0, 0, 0, 0, 0, 0, 0, 0, 0, 0, '', '', 0, '', 'vb', '', 0, 1, 0, 0, NULL),
(24874, 3, '', 0, 'JMordaunt', '62e135a785665a5f0256f5a61e25c9de', '2014-05-27', 'redsilhouette69yh75j@outlook.com', 0, '', '', '', '', '', '', '', 2, 0, 'New Member', 0, 1401186614, 0, 1401186614, 1401188575, 0, 0, 0, 0, 4, '5', 0, 0, 0, 0, 0, 3194967, '12-27-1971', '1971-12-27', -1, -1, '69.12.74.72', 0, 1, 0, 0, -1, 0, 0, '83xTkz6'':`})\\p?Q(4''p*S1mvKA9dJ', 0, 0, 0, '', 0, 0, 0, 0, 0, 0, 0, 0, 0, 0, 0, 0, '', '', 0, '', 'vb', '', 0, 1, 0, 0, NULL),
(24875, 3, '', 0, 'JBaer', 'f518432ee440efd922d29530e50c4ad5', '2014-05-27', 'uppityoutlaw222x615@outlook.com', 0, '', '', '', '', '', '', '', 2, 0, 'New Member', 0, 1401186622, 0, 1401186622, 1401188536, 0, 0, 0, 0, 4, '5', 0, 0, 0, 0, 0, 3194967, '12-17-1984', '1984-12-17', -1, -1, '69.12.74.72', 0, 1, 0, 0, -1, 0, 0, 'gEX(Qs*K^]?K=vZ{8IYa[)5jpk.B26', 0, 0, 0, '', 0, 0, 0, 0, 0, 0, 0, 0, 0, 0, 0, 0, '', '', 0, '', 'vb', '', 0, 1, 0, 0, NULL),
(24876, 3, '', 0, 'URNLA', 'a0213d0b1b6c9809f22fce6d309baaf8', '2014-05-27', 'damagedlemon42z738a@outlook.com', 0, '', '', '', '', '', '', '', 2, 0, 'New Member', 0, 1401187164, 0, 1401187164, 1401189300, 0, 0, 0, 0, 4, '5', 0, 0, 0, 0, 0, 3194967, '08-22-1983', '1983-08-22', -1, -1, '192.3.55.241', 0, 1, 0, 0, -1, 0, 0, '5]u36VmuW|5>9X>~Dh0>"s2RS%sIPT', 0, 0, 0, '', 0, 0, 0, 0, 0, 0, 0, 0, 0, 0, 0, 0, '', '', 0, '', 'vb', '', 0, 1, 0, 0, NULL),
(24877, 2, '', 0, 'SAS Shah g', 'e08e8f3ed5180b3c84755f891a4df135', '2014-05-27', 'sas.shah99@gmail.com', 0, '', '', '', '', '', '', '', 2, 0, 'New Member', 0, 1401187608, 0, 1401187608, 1401187627, 0, 0, 0, 0, 4, '5', 0, 0, 0, 0, 0, 3194967, '06-10-1984', '1984-06-10', -1, -1, '223.29.238.3', 0, 1, 0, 0, -1, 0, 0, ',&j7VRY\\r+G+b&Yl)),y_OAx@''C2)Y', 0, 0, 0, '', 0, 0, 0, 0, 0, 0, 0, 0, 0, 0, 0, 0, '', '', 0, '', 'vb', '', 0, 1, 0, 0, NULL),
(24910, 3, '', 0, 'BWEP', '735fe00ff2eddec4bbacd71a9e3f2ad2', '2014-05-28', 'buford.feierabend@kienthucxahoi.com', 0, '', '', '', '', '', '', '', 2, 0, 'New Member', 0, 1401263153, 0, 1401263153, 1401269951, 0, 0, 0, 0, 4, '5', 0, 0, 0, 0, 0, 3194967, '10-19-1975', '1975-10-19', -1, -1, '50.115.168.205', 0, 1, 0, 0, -1, 0, 0, 'pdc,xq@rfT,:`-3c1~V.,&q%ndv,9(', 0, 0, 0, '', 0, 0, 0, 0, 0, 0, 0, 0, 0, 0, 0, 0, '', '', 0, '', 'vb', '', 0, 1, 0, 0, NULL),
(24904, 3, '', 0, 'hamzaomar', 'd19bdc686bf5128118dc8992ccbe7cde', '2014-05-28', 'hamza.280@hotmail.com', 0, '', '', '', '', '', '', '', 2, 0, 'New Member', 0, 1401246757, 0, 1401246757, 1401247153, 0, 0, 0, 0, 4, '5', 0, 0, 0, 0, 0, 3194967, '08-05-1989', '1989-08-05', -1, -1, '139.190.249.221', 0, 1, 0, 0, -1, 0, 0, '&"[)Mo=/B%D>pHC5Pyo5p~v1'';<sY[', 0, 0, 0, '', 0, 0, 0, 0, 0, 0, 0, 0, 0, 0, 0, 0, '', '', 0, '', 'vb', '', 0, 1, 0, 0, NULL),
(24880, 2, '', 0, 'suha52', '8bfc3919e806fd784df55a82b65695d2', '2014-05-27', 'suha52@outlook.com', 0, '', '', '', '', '', '', '', 2, 0, 'New Member', 0, 1401191479, 0, 1472711255, 1472714934, 1472714933, 496411, 18, 0, 4, '5', 0, 0, 0, 0, 0, 3194967, '03-10-1992', '1992-03-10', -1, -1, '39.47.135.148', 0, 1, 0, 0, -1, 0, 0, 'jF^[cF6G[T!ee]zXc9\\L{*DZ!!S[tE', 0, 0, 0, '', 0, 0, 6, 0, 0, 0, 0, 0, 0, 0, 0, 0, '', '', 0, '', 'vb', '', 0, 1, 0, 0, NULL),
(25003, 3, '', 0, 'NJamison', '7752ff3a144191277c4552280548d564', '2014-05-31', 'mikabdqhdn@outlook.com', 0, '', '', '', '', '', '', '', 2, 0, 'New Member', 0, 1401521077, 0, 1401521077, 1401521077, 0, 0, 0, 0, 4, '5', 0, 0, 0, 0, 0, 3194967, '04-17-1975', '1975-04-17', -1, -1, '204.44.83.26', 0, 1, 0, 0, -1, 0, 0, '7?29YH-R;TKio~~,[Z<Vm0tWGK=1<a', 0, 0, 0, '', 0, 0, 0, 0, 0, 0, 0, 0, 0, 0, 0, 0, '', '', 0, '', 'vb', '', 0, 1, 0, 0, NULL),
(24943, 2, '', 0, 'hayat', 'afa8a2e5d80a6dcff79f347619abf9d2', '2014-05-29', 'engrmhayat17@gmail.com', 0, '', '', '', '', '', '', '', 2, 0, 'New Member', 0, 1401357046, 0, 1401357046, 1401358104, 0, 0, 0, 0, 4, '5', 0, 0, 0, 0, 0, 3194967, '05-19-1993', '1993-05-19', -1, -1, '209.73.148.30', 0, 1, 0, 0, -1, 0, 0, 'Kf-vQzG^%l;_+MP9A-MvZ,OB@5^K9o', 0, 0, 0, '', 0, 0, 0, 0, 0, 0, 0, 0, 0, 0, 0, 0, '', '', 0, '', 'vb', '', 0, 1, 0, 0, NULL),
(24882, 3, '', 0, 'FYVB', '090bd1a1b1aebae56b3ec1b46b6b133b', '2014-05-27', 'aquatictag29ihw67@outlook.com', 0, '', '', '', '', '', '', '', 2, 0, 'New Member', 0, 1401193307, 0, 1401193307, 1401198674, 0, 0, 0, 0, 4, '5', 0, 0, 0, 0, 0, 3194967, '07-21-1985', '1985-07-21', -1, -1, '69.12.78.126', 0, 1, 0, 0, -1, 0, 0, 'R{8-`Q2-a$Dc{g%Hnu)PR%6G?okLn(', 0, 0, 0, '', 0, 0, 0, 0, 0, 0, 0, 0, 0, 0, 0, 0, '', '', 0, '', 'vb', '', 0, 1, 0, 0, NULL),
(24911, 3, '', 0, 'KBenny', '8199ca69daf2b991f04af7efeb89d0a2', '2014-05-28', 'kasha-benny14@kienthucxahoi.com', 0, '', '', '', '', '', '', '', 2, 0, 'New Member', 0, 1401263201, 0, 1401263201, 1401270005, 0, 0, 0, 0, 4, '5', 0, 0, 0, 0, 0, 3194967, '06-25-1983', '1983-06-25', -1, -1, '50.115.168.205', 0, 1, 0, 0, -1, 0, 0, '?z2!)Xx:V?eU@]-|oJ>6q6B}YXIR,(', 0, 0, 0, '', 0, 0, 0, 0, 0, 0, 0, 0, 0, 0, 0, 0, '', '', 0, '', 'vb', '', 0, 1, 0, 0, NULL),
(24885, 3, '', 0, 'H3480', '4ca23cd977ed9cec5ac6cf111ba69fc5', '2014-05-27', 'caylornki412@live.com', 0, '', '', '', '', '', '', '', 2, 0, 'New Member', 0, 1401199548, 0, 1401199548, 1401199548, 0, 0, 0, 0, 4, '5', 0, 0, 0, 0, 0, 3194967, '09-02-1980', '1980-09-02', -1, -1, '93.118.73.91', 0, 1, 0, 0, -1, 0, 0, 'a>~4O[hvZnteNud[=!q;N:ld~w+3^J', 0, 0, 0, '', 0, 0, 0, 0, 0, 0, 0, 0, 0, 0, 0, 0, '', '', 0, '', 'vb', '', 0, 1, 0, 0, NULL),
(25115, 2, '', 0, 'RNgabidj', '2c5abaa8c328edbd0f5931cdee13e8f0', '2014-06-03', 'farrahmrozek@gmail.com', 0, '', '', '', '', '', '', '', 2, 0, 'New Member', 0, 1401807115, 0, 1401807115, 1401807386, 0, 0, 0, 0, 4, '5', 0, 0, 0, 0, 0, 3194967, '02-01-1971', '1971-02-01', -1, -1, '107.182.23.148', 0, 1, 0, 0, -1, 0, 0, 'il0Kg(QN\\+6bl|geh`J2,@ku_lE\\!Q', 0, 0, 0, '', 0, 0, 0, 0, 0, 0, 0, 0, 0, 0, 0, 0, '', '', 0, '', 'vb', '', 0, 1, 0, 0, NULL),
(24887, 2, '', 0, 'mohsin00', '77445461ba75e5badb970c2c595b76b1', '2014-05-27', 'invincible2002@gmail.com', 0, '', '', '', '', '', '', '', 2, 0, 'New Member', 0, 1401201855, 0, 1405368334, 1406209919, 1401993193, 443703, 16, 0, 4, '5', 0, 0, 0, 0, 0, 3194967, '03-05-1987', '1987-03-05', -1, -1, '115.186.98.217', 0, 1, 0, 0, -1, 0, 0, 'B&N/qf=.y)n]S:fy09bqP/MpNv|SKG', 0, 0, 0, '', 0, 0, 15, 1, 0, 0, 0, 0, 0, 0, 0, 0, '99e55d3b77cc9a673db9ba894a34e725', '', 0, '', 'vb', '', 0, 1, 0, 0, NULL),
(24888, 3, '', 0, 'JGPUF', 'd39d8b081b555e09a0035496a376348f', '2014-05-27', 'splendidfairies51@outlook.com', 0, '', '', '', '', '', '', '', 2, 0, 'New Member', 0, 1401202643, 0, 1401202643, 1401204822, 0, 0, 0, 0, 4, '5', 0, 0, 0, 0, 0, 3194967, '09-27-1976', '1976-09-27', -1, -1, '205.213.195.80', 0, 1, 0, 0, -1, 0, 0, 'KI\\*}@f55hmJ$W~9$Y8xj>X6[(602?', 0, 0, 0, '', 0, 0, 0, 0, 0, 0, 0, 0, 0, 0, 0, 0, '', '', 0, '', 'vb', '', 0, 1, 0, 0, NULL),
(24889, 3, '', 0, 'SEldridge', '5cff9caeefd84f6caf2ac5d222583f7d', '2014-05-27', 'owenxp0l6sv@live.com', 0, '', '', '', '', '', '', '', 2, 0, 'New Member', 0, 1401206154, 0, 1401206154, 1401206154, 0, 0, 0, 0, 4, '5', 0, 0, 0, 0, 0, 3194967, '08-05-1979', '1979-08-05', -1, -1, '50.115.170.206', 0, 1, 0, 0, -1, 0, 0, '2rd8%^+n3e&nG$5DP1F&B|vi8pnI_V', 0, 0, 0, '', 0, 0, 0, 0, 0, 0, 0, 0, 0, 0, 0, 0, '', '', 0, '', 'vb', '', 0, 1, 0, 0, NULL),
(24890, 3, '', 0, 'Muhammad ibrar', '501186102018a186d78a8e03bb4be47e', '2014-05-27', 'MIKhankpk1@gmail.com', 0, '', '', '', '', '', '', '', 2, 0, 'New Member', 0, 1401209895, 0, 1401209895, 1401210098, 0, 0, 0, 0, 4, '5', 0, 0, 0, 0, 0, 3194967, '03-03-1995', '1995-03-03', -1, -1, '182.185.101.172', 0, 1, 0, 0, -1, 0, 0, '[oS0)NOs7?Suh=q)e?I6$7fwEDO`W_', 0, 0, 0, '', 0, 0, 0, 0, 0, 0, 0, 0, 0, 0, 0, 0, '', '', 0, '', 'vb', '', 0, 1, 0, 0, NULL),
(24912, 3, '', 0, 'SHarney', '7d94b6a2710e17e8adc2427d739b3445', '2014-05-28', 'lewdknoll681693@outlook.com', 0, '', '', '', '', '', '', '', 2, 0, 'New Member', 0, 1401265575, 0, 1401265575, 1401269590, 0, 0, 0, 0, 4, '5', 0, 0, 0, 0, 0, 3194967, '02-03-1980', '1980-02-03', -1, -1, '198.143.143.228', 0, 1, 0, 0, -1, 0, 0, '1Q,$UygM&"Ub,B$B)6va0#FCm9i></', 0, 0, 0, '', 0, 0, 0, 0, 0, 0, 0, 0, 0, 0, 0, 0, '', '', 0, '', 'vb', '', 0, 1, 0, 0, NULL),
(24892, 2, '', 0, 'marjan khan', '8130af5a5b8e9e9f4315530edda26432', '2014-05-27', 'marjankhan2@gmail.com', 0, '', '', '', '', '', '', '', 2, 0, 'New Member', 0, 1401216518, 0, 1401217105, 1401227343, 0, 0, 0, 0, 4, '5', 0, 0, 0, 0, 0, 3194967, '04-19-1994', '1994-04-19', -1, -1, '39.41.214.7', 0, 1, 0, 0, -1, 0, 0, 'Slt!56?M0UG$gY&S(hMPBjLHWVeLNJ', 0, 0, 0, '', 0, 0, 1, 0, 0, 0, 0, 0, 0, 0, 0, 0, '', '', 0, '', 'vb', '', 0, 1, 0, 0, NULL),
(24893, 3, '', 0, 'ABarwell', '053dd224f8ccaae2ba0bc744a07a25d7', '2014-05-27', 'quickinformatioho552@outlook.com', 0, '', '', '', '', '', '', '', 2, 0, 'New Member', 0, 1401219103, 0, 1401219103, 1401221569, 0, 0, 0, 0, 4, '5', 0, 0, 0, 0, 0, 3194967, '02-16-1981', '1981-02-16', -1, -1, '199.119.226.83', 0, 1, 0, 0, -1, 0, 0, 'W9j<Rasz3^dW@Em,/JD{Lf%u|#_\\Ok', 0, 0, 0, '', 0, 0, 0, 0, 0, 0, 0, 0, 0, 0, 0, 0, '', '', 0, '', 'vb', '', 0, 1, 0, 0, NULL),
(24894, 3, '', 0, 'khizar', '96004d418a9716b07f7801beaccbf1d8', '2014-05-27', 'riaz.arian@yahoo.com', 0, '', '', '', '', '', '', '', 2, 0, 'New Member', 0, 1401220418, 0, 1401220418, 1401221112, 0, 0, 0, 0, 4, '5', 0, 0, 0, 0, 0, 3194967, '12-28-1975', '1975-12-28', -1, -1, '119.157.33.143', 0, 1, 0, 0, -1, 0, 0, '5`Tg_>F&iQghtY#eF<=<)$6|V&JH~^', 0, 0, 0, '', 0, 0, 0, 0, 0, 0, 0, 0, 0, 0, 0, 0, '', '', 0, '', 'vb', '', 0, 1, 0, 0, NULL),
(24895, 3, '', 0, 'QBMM', '0c803836072bf4569f26c697bb3b653e', '2014-05-27', 'walleregrlvnzqr@outlook.com', 0, '', '', '', '', '', '', '', 2, 0, 'New Member', 0, 1401223835, 0, 1401223835, 1401223835, 0, 0, 0, 0, 4, '5', 0, 0, 0, 0, 0, 3194967, '11-08-1978', '1978-11-08', -1, -1, '192.227.137.44', 0, 1, 0, 0, -1, 0, 0, 'To&vg!nUFd1\\l!DJC@Fz35.UsG''=j%', 0, 0, 0, '', 0, 0, 0, 0, 0, 0, 0, 0, 0, 0, 0, 0, '', '', 0, '', 'vb', '', 0, 1, 0, 0, NULL),
(24914, 3, '', 0, 'adil.amin84', '579fe714cf1caeeb5005f22911aef428', '2014-05-28', 'supersix911@gmail.com', 0, '', '', '', '', '', '', '', 2, 0, 'New Member', 0, 1401267444, 0, 1401267725, 1401272796, 0, 0, 0, 0, 4, '5', 0, 0, 0, 0, 0, 3194967, '08-03-1989', '1989-08-03', -1, -1, '216.185.35.70', 0, 1, 0, 0, -1, 0, 0, '@V)|gkjM2}YE;$n=::-''Aa36[h12p5', 0, 0, 0, '', 0, 0, 0, 0, 0, 0, 0, 0, 0, 0, 0, 0, '', '', 0, '', 'vb', '', 0, 1, 0, 0, NULL),
(24915, 3, '', 0, 'F3256', '21d79d510530040084505c1b8113d896', '2014-05-28', 'valentinehlscct@outlook.com', 0, '', '', '', '', '', '', '', 2, 0, 'New Member', 0, 1401268177, 0, 1401268177, 1401268177, 0, 0, 0, 0, 4, '5', 0, 0, 0, 0, 0, 3194967, '05-14-1980', '1980-05-14', -1, -1, '204.44.83.26', 0, 1, 0, 0, -1, 0, 0, '$-39EBdW]}72M2J;9T''&?XS;9X,x)*', 0, 0, 0, '', 0, 0, 0, 0, 0, 0, 0, 0, 0, 0, 0, 0, '', '', 0, '', 'vb', '', 0, 1, 0, 0, NULL),
(25068, 3, '', 0, 'HAnstey', 'babeb89e40631633ef6153b88f380fc6', '2014-06-01', 'corinabhwpuf@outlook.com', 0, '', '', '', '', '', '', '', 2, 0, 'New Member', 0, 1401662966, 0, 1401662966, 1401662966, 0, 0, 0, 0, 4, '5', 0, 0, 0, 0, 0, 3194967, '02-25-1973', '1973-02-25', -1, -1, '23.105.208.90', 0, 1, 0, 0, -1, 0, 0, 'Q6>BLk~GcgqFx+j,,{+D%*(n#8Q(Hj', 0, 0, 0, '', 0, 0, 0, 0, 0, 0, 0, 0, 0, 0, 0, 0, '', '', 0, '', 'vb', '', 0, 1, 0, 0, NULL),
(24917, 3, '', 0, 'NIkc', '3facaab5b9d9e7726e12983502802606', '2014-05-28', 'neva_florey56@denese.progrespoland.com', 0, '', '', '', '', '', '', '', 2, 0, 'New Member', 0, 1401274312, 0, 1401274312, 1401283041, 0, 0, 0, 0, 4, '5', 0, 0, 0, 0, 0, 3194967, '03-21-1982', '1982-03-21', -1, -1, '218.186.17.235', 0, 1, 0, 0, -1, 0, 0, 'qS:j^|%de.&k_yxZ/$r2N''&VKP*,9q', 0, 0, 0, '', 0, 0, 0, 0, 0, 0, 0, 0, 0, 0, 0, 0, '', '', 0, '', 'vb', '', 0, 1, 0, 0, NULL),
(24918, 16, '', 0, 'Swordmaster Enterprises', '0aace0e47b1bbd97cc27f2337443834e', '2016-04-10', 'imranroy003@gmail.com', 7, '', '', '', '', '', '', '', 2, 0, 'Banned', 0, 1401275590, 0, 1460306797, 1460306797, 1460269763, 492940, 0, 0, 4, '5', 0, 0, 0, 0, 0, 11551831, '01-01-1955', '1955-01-01', 20, 1, '119.154.88.127', 15746, 0, 0, 0, -1, 0, 0, 'bZ+{HRHeABNy}R*Hex"8h8~wlg_u-3', 0, 0, 0, '', 0, 0, 3, 0, 0, 0, 0, 0, 0, 0, 0, 0, '', '', 0, '', 'vb', '', 0, 1, 0, 0, NULL),
(24919, 3, '', 0, 'JLta', 'f652b74804519f2f6bf2fbcbc6887e0a', '2014-05-28', 'guiltlesswealthdv15@outlook.com', 0, '', '', '', '', '', '', '', 2, 0, 'New Member', 0, 1401275982, 0, 1401275982, 1401279019, 0, 0, 0, 0, 4, '5', 0, 0, 0, 0, 0, 3194967, '12-31-1979', '1979-12-31', -1, -1, '195.90.96.114', 0, 1, 0, 0, -1, 0, 0, 'A,E83l-_]X(qSA|,nJ}cZ;1"Se=~y4', 0, 0, 0, '', 0, 0, 0, 0, 0, 0, 0, 0, 0, 0, 0, 0, '', '', 0, '', 'vb', '', 0, 1, 0, 0, NULL),
(24920, 3, '', 0, 'OLuong', '28c78c8b64234633b72e58036c741761', '2014-05-28', 'honorablerubbis8d377@outlook.com', 0, '', '', '', '', '', '', '', 2, 0, 'New Member', 0, 1401280439, 0, 1401280439, 1401282360, 0, 0, 0, 0, 4, '5', 0, 0, 0, 0, 0, 3194967, '01-15-1971', '1971-01-15', -1, -1, '198.143.143.228', 0, 1, 0, 0, -1, 0, 0, '~eVLp9QR|LRj{''Y|9#`>=Lzv;''=TYe', 0, 0, 0, '', 0, 0, 0, 0, 0, 0, 0, 0, 0, 0, 0, 0, '', '', 0, '', 'vb', '', 0, 1, 0, 0, NULL),
(24921, 3, '', 0, 'MToussain', '14d745412177fa8f92899bda181c0964', '2014-05-28', 'toolewwap@outlook.com', 0, '', '', '', '', '', '', '', 2, 0, 'New Member', 0, 1401287311, 0, 1401287311, 1401287311, 0, 0, 0, 0, 4, '5', 0, 0, 0, 0, 0, 3194967, '02-27-1985', '1985-02-27', -1, -1, '201.86.95.28', 0, 1, 0, 0, -1, 0, 0, '\\Z>_Ztg?g#w]XhAN;.JvKVMjaQsS_V', 0, 0, 0, '', 0, 0, 0, 0, 0, 0, 0, 0, 0, 0, 0, 0, '', '', 0, '', 'vb', '', 0, 1, 0, 0, NULL),
(24922, 3, '', 0, 'LWhaley', '3c61408973cb241d34146934d74d99e1', '2014-05-28', 'rmasakocvj@yahoo.com', 0, '', '', '', '', '', '', '', 2, 0, 'New Member', 0, 1401291967, 0, 1401291967, 1401295489, 0, 0, 0, 0, 4, '5', 0, 0, 0, 0, 0, 3194967, '08-30-1979', '1979-08-30', -1, -1, '149.255.107.20', 0, 1, 0, 0, -1, 0, 0, '8V)&4shY~?K#Mz(&6m}F_\\/E!cq"~-', 0, 0, 0, '', 0, 0, 0, 0, 0, 0, 0, 0, 0, 0, 0, 0, '', '', 0, '', 'vb', '', 0, 1, 0, 0, NULL),
(24923, 3, '', 0, 'EWhitacre', '3cd7a70aa222c795a9905f43a8b9eb2e', '2014-05-28', 'gsgriggsxk@yahoo.com', 0, '', '', '', '', '', '', '', 2, 0, 'New Member', 0, 1401291979, 0, 1401291979, 1401302502, 0, 0, 0, 0, 4, '5', 0, 0, 0, 0, 0, 3194967, '09-19-1978', '1978-09-19', -1, -1, '165.231.8.86', 0, 1, 0, 0, -1, 0, 0, ']<uR&PQEzTqv[v-JuS*RbOSGBTFN*]', 0, 0, 0, '', 0, 0, 0, 0, 0, 0, 0, 0, 0, 0, 0, 0, '', '', 0, '', 'vb', '', 0, 1, 0, 0, NULL),
(24924, 2, '', 0, 'Afzal', 'a23857c9794f118fa4a643490c7568d6', '2014-05-28', 'afzalmbutt@gmail.com', 7, '', '', '', '', '', '', '', 2, 0, 'Enthusiast', 0, 1401295800, 0, 1453828945, 1453875716, 1453810817, 490044, 227, 0, 4, '5', 0, 0, 0, 0, 0, 11584631, '10-18-1977', '1977-10-18', -1, 1, '202.69.35.131', 790, 0, 0, 0, -1, 0, 0, 'NEt..kn40vG0CxtM=>YLLfCv?iV|!!', 0, 0, 0, '', 0, 0, 34, 3, 0, 0, 0, 0, 0, 0, 0, 0, '', '', 0, '', 'vb', '', 0, 1, 0, 0, NULL),
(25048, 3, '', 0, 'KLeatherm', '38f2dcd3918060ee45bd8ad2c8f3c6ce', '2014-06-01', 'hryniew.s.k.iemil@gmail.com', 0, '', '', '', '', '', '', '', 2, 0, 'New Member', 0, 1401614758, 0, 1401614758, 1401626124, 0, 0, 0, 0, 4, '5', 0, 0, 0, 0, 0, 3194967, '06-06-1980', '1980-06-06', -1, -1, '23.108.196.229', 0, 1, 0, 0, -1, 0, 0, 'IX4"s&RgZ(W@W^FIzruN>A^ub%O[nG', 0, 0, 0, '', 0, 0, 0, 0, 0, 0, 0, 0, 0, 0, 0, 0, '', '', 0, '', 'vb', '', 0, 1, 0, 0, NULL),
(24926, 3, '', 0, 'PBalfe', '5e8b829f50972d6e3d32bbe772c4c4d2', '2014-05-28', 'leachsjls3b@outlook.com', 0, '', '', '', '', '', '', '', 2, 0, 'New Member', 0, 1401298530, 0, 1401298530, 1401298530, 0, 0, 0, 0, 4, '5', 0, 0, 0, 0, 0, 3194967, '05-17-1984', '1984-05-17', -1, -1, '107.161.182.90', 0, 1, 0, 0, -1, 0, 0, 'oWU\\f_6A$%W[-~nqt6[UK-VE}i~&R(', 0, 0, 0, '', 0, 0, 0, 0, 0, 0, 0, 0, 0, 0, 0, 0, '', '', 0, '', 'vb', '', 0, 1, 0, 0, NULL),
(24944, 3, '', 0, 'LElmslie', 'afbf4a72acae59ce7bbb5d9db72b7c7a', '2014-05-29', 'lynda_elmslie@raymundo.progrespoland.com', 0, '', '', '', '', '', '', '', 2, 0, 'New Member', 0, 1401361450, 0, 1401361450, 1401363856, 0, 0, 0, 0, 4, '5', 0, 0, 0, 0, 0, 3194967, '07-13-1970', '1970-07-13', -1, -1, '83.21.123.186', 0, 1, 0, 0, -1, 0, 0, 'vz^a=*n,yOq5JslR\\e5agwzV[S9BDB', 0, 0, 0, '', 0, 0, 0, 0, 0, 0, 0, 0, 0, 0, 0, 0, '', '', 0, '', 'vb', '', 0, 1, 0, 0, NULL),
(24928, 2, '', 0, 'hurr', 'c8abf51584e069d877496a48ac9363e8', '2016-09-27', 'bang.71@hotmail.com', 0, '', '', '', '', '', '', '', 2, 0, 'New Member', 0, 1401307444, 0, 1474979760, 1475258246, 1475258214, 497845, 12, 0, 4, '5', 0, 0, 0, 0, 0, 3194967, '03-02-1971', '1971-03-02', -1, -1, '175.107.5.141', 0, 1, 0, 0, -1, 0, 0, ':3b`C$CTG9}jAK|a_l]~;\\NnbKsHn@', 0, 0, 0, '', 0, 0, 2, 0, 0, 0, 0, 0, 0, 0, 0, 0, '', '', 0, '', 'vb', '', 0, 1, 0, 0, NULL),
(24929, 2, '', 0, 'chzartash', '8cf42abff9f172f11df59518b0d80fdf', '2014-05-28', 'chzartash@gmail.com', 0, '', '', '', '', '', '', '', 2, 0, 'New Member', 0, 1401309729, 0, 1401312887, 1401385315, 0, 0, 0, 0, 4, '5', 0, 0, 0, 0, 0, 3194967, '05-07-1988', '1988-05-07', -1, -1, '188.53.105.167', 0, 1, 0, 0, -1, 0, 0, 'i>m"s?V{Fd|u\\fSL>+yT3ml$k\\2gj*', 0, 0, 0, '', 0, 0, 0, 0, 0, 0, 0, 0, 0, 0, 0, 0, '', '', 0, '', 'vb', '', 0, 1, 0, 0, NULL),
(25030, 3, '', 0, 'MBrandenb', '1e725af3e83c63fd36bc9673a2baf225', '2014-06-01', 'fascinatedocclu6c210@outlook.com', 0, '', '', '', '', '', '', '', 2, 0, 'New Member', 0, 1401578509, 0, 1401578509, 1401580725, 0, 0, 0, 0, 4, '5', 0, 0, 0, 0, 0, 3194967, '11-03-1972', '1972-11-03', -1, -1, '192.126.161.45', 0, 1, 0, 0, -1, 0, 0, ',S@LA|[GMLT6JD?#[e6/A.{>AO5Kf#', 0, 0, 0, '', 0, 0, 0, 0, 0, 0, 0, 0, 0, 0, 0, 0, '', '', 0, '', 'vb', '', 0, 1, 0, 0, NULL),
(24931, 3, '', 0, 'G9874', '5604b5e137fac9618b80784139ccaafa', '2014-05-28', 'callieppqqjg@outlook.com', 0, '', '', '', '', '', '', '', 2, 0, 'New Member', 0, 1401314264, 0, 1401314264, 1401314264, 0, 0, 0, 0, 4, '5', 0, 0, 0, 0, 0, 3194967, '09-28-1975', '1975-09-28', -1, -1, '69.12.77.125', 0, 1, 0, 0, -1, 0, 0, '=fnSI`zi%)'')l(B[,J~@{bX}NLYHdV', 0, 0, 0, '', 0, 0, 0, 0, 0, 0, 0, 0, 0, 0, 0, 0, '', '', 0, '', 'vb', '', 0, 1, 0, 0, NULL),
(24995, 3, '', 0, 'MMcCabe', '3e7eb720aac48c3914416612bb134106', '2014-05-31', 'helenaskncbb@outlook.com', 0, '', '', '', '', '', '', '', 2, 0, 'New Member', 0, 1401501954, 0, 1401501954, 1401501954, 0, 0, 0, 0, 4, '5', 0, 0, 0, 0, 0, 3194967, '01-08-1984', '1984-01-08', -1, -1, '69.12.84.29', 0, 1, 0, 0, -1, 0, 0, '\\R,aJp73ahYK{b8<kJ<r\\&}7GTeK,b', 0, 0, 0, '', 0, 0, 0, 0, 0, 0, 0, 0, 0, 0, 0, 0, '', '', 0, '', 'vb', '', 0, 1, 0, 0, NULL),
(25014, 3, '', 0, 'FSwigert', '984301c44a2053a45ce91ca929f04092', '2014-05-31', 'ivanusbp@outlook.com', 0, '', '', '', '', '', '', '', 2, 0, 'New Member', 0, 1401551529, 0, 1401551529, 1401569804, 0, 0, 0, 0, 4, '5', 0, 0, 0, 0, 0, 3194967, '01-17-1971', '1971-01-17', -1, -1, '162.212.57.121', 0, 1, 0, 0, -1, 0, 0, 'Chf#1KSr^8pqtST."BGI''TpUpoC02''', 0, 0, 0, '', 0, 0, 0, 0, 0, 0, 0, 0, 0, 0, 0, 0, '', '', 0, '', 'vb', '', 0, 1, 0, 0, NULL),
(24945, 3, '', 0, 'STdp', 'fe49d8a3df056874c93d9e4fcb39112f', '2014-05-29', 'janinezomkqi@outlook.com', 0, '', '', '', '', '', '', '', 2, 0, 'New Member', 0, 1401364758, 0, 1401364758, 1402941467, 0, 0, 0, 0, 4, '5', 0, 0, 0, 0, 0, 3194967, '04-01-1980', '1980-04-01', -1, -1, '173.232.107.162', 0, 1, 0, 0, -1, 0, 0, '8N!D&D''?FWf*ldcl}^BX''/Y&fWo^jl', 0, 0, 0, '', 0, 0, 0, 0, 0, 0, 0, 0, 0, 0, 0, 0, '', '', 0, '', 'vb', '', 0, 1, 0, 0, NULL),
(25031, 3, '', 0, 'DGLW', '696324c98edb39024d3ee26f3150dfb8', '2014-06-01', 'amparopebrilla@yahoo.com', 0, '', '', '', '', '', '', '', 2, 0, 'New Member', 0, 1401582616, 0, 1401582616, 1401603630, 0, 0, 0, 0, 4, '5', 0, 0, 0, 0, 0, 3194967, '10-08-1983', '1983-10-08', -1, -1, '204.44.82.140', 0, 1, 0, 0, -1, 0, 0, 'oi\\?:J+lHg/1t)%T7L|`<8f0,M4F!''', 0, 0, 0, '', 0, 0, 0, 0, 0, 0, 0, 0, 0, 0, 0, 0, '', '', 0, '', 'vb', '', 0, 1, 0, 0, NULL),
(25054, 3, '', 0, 'RQ40', 'cfe05986c2e72e3fce4e7aa7a4a545c5', '2014-06-01', 'snapfpnrmw@yahoo.com', 0, '', '', '', '', '', '', '', 2, 0, 'New Member', 0, 1401635206, 0, 1401635206, 1401635206, 0, 0, 0, 0, 4, '5', 0, 0, 0, 0, 0, 3194967, '10-20-1983', '1983-10-20', -1, -1, '37.59.227.68', 0, 1, 0, 0, -1, 0, 0, 'T[Hs6p<1&X.o-$#:41c=Q?aB8)_qr:', 0, 0, 0, '', 0, 0, 0, 0, 0, 0, 0, 0, 0, 0, 0, 0, '', '', 0, '', 'vb', '', 0, 1, 0, 0, NULL),
(25009, 3, '', 0, 'AMcPhee', 'f88cc1dac448f2080ad931102b9d6bc8', '2014-05-31', 'capricexxpust@yahoo.com', 0, '', '', '', '', '', '', '', 2, 0, 'New Member', 0, 1401537627, 0, 1401537627, 1401537627, 0, 0, 0, 0, 4, '5', 0, 0, 0, 0, 0, 3194967, '04-30-1983', '1983-04-30', -1, -1, '209.148.82.103', 0, 1, 0, 0, -1, 0, 0, '?''u*uPb-DW-9I4FCV$s$#LwZ~M,e2;', 0, 0, 0, '', 0, 0, 0, 0, 0, 0, 0, 0, 0, 0, 0, 0, '', '', 0, '', 'vb', '', 0, 1, 0, 0, NULL),
(25011, 3, '', 0, 'SBilliot', '9e8984eb834d50c8ea3d139bfbddb28c', '2014-05-31', 'permissibledisp9156@outlook.com', 0, '', '', '', '', '', '', '', 2, 0, 'New Member', 0, 1401543522, 0, 1401543522, 1401546256, 0, 0, 0, 0, 4, '5', 0, 0, 0, 0, 0, 3194967, '02-10-1970', '1970-02-10', -1, -1, '173.208.39.221', 0, 1, 0, 0, -1, 0, 0, 'T&i+HVrsG%bH9]pqEQ<vDA+2_^ii)2', 0, 0, 0, '', 0, 0, 0, 0, 0, 0, 0, 0, 0, 0, 0, 0, '', '', 0, '', 'vb', '', 0, 1, 0, 0, NULL),
(24951, 3, '', 0, 'HBeaumont', '6179c90f0e46d9f554535904cc09b0b8', '2014-05-29', 'wakefulundercur9551@outlook.com', 0, '', '', '', '', '', '', '', 2, 0, 'New Member', 0, 1401371019, 0, 1401371019, 1401373453, 0, 0, 0, 0, 4, '5', 0, 0, 0, 0, 0, 3194967, '09-25-1985', '1985-09-25', -1, -1, '107.155.119.172', 0, 1, 0, 0, -1, 0, 0, '\\P>ldEY{ZpXet3=''Lwh1XUznJrgY6U', 0, 0, 0, '', 0, 0, 0, 0, 0, 0, 0, 0, 0, 0, 0, 0, '', '', 0, '', 'vb', '', 0, 1, 0, 0, NULL),
(24952, 3, '', 0, 'MZambrano', 'b1eefa66007412e77dedf200c5e3e010', '2014-05-29', 'neighborlybreezsa602@outlook.com', 0, '', '', '', '', '', '', '', 2, 0, 'New Member', 0, 1401374896, 0, 1401374896, 1401382087, 0, 0, 0, 0, 4, '5', 0, 0, 0, 0, 0, 3194967, '09-23-1975', '1975-09-23', -1, -1, '109.184.70.52', 0, 1, 0, 0, -1, 0, 0, 'j0n|:z/M[sgAWM#c!STc.64RrpN.dd', 0, 0, 0, '', 0, 0, 0, 0, 0, 0, 0, 0, 0, 0, 0, 0, '', '', 0, '', 'vb', '', 0, 1, 0, 0, NULL),
(24953, 3, '', 0, 'AXPYG', '9b9ea83f6d85a45d599b6554172ec257', '2014-05-29', 'abstractedincid6m460@outlook.com', 0, '', '', '', '', '', '', '', 2, 0, 'New Member', 0, 1401376593, 0, 1401376593, 1401379503, 0, 0, 0, 0, 4, '5', 0, 0, 0, 0, 0, 3194967, '11-02-1983', '1983-11-02', -1, -1, '107.155.119.175', 0, 1, 0, 0, -1, 0, 0, 'a#0a_A$iC_6-V=Ib5."s+D3bvo}`[k', 0, 0, 0, '', 0, 0, 0, 0, 0, 0, 0, 0, 0, 0, 0, 0, '', '', 0, '', 'vb', '', 0, 1, 0, 0, NULL),
(24954, 3, '', 0, 'VMorice', '849a2a6094392f97b7b059945d9e20d9', '2014-05-29', 'mightyguy54vb998@outlook.com', 0, '', '', '', '', '', '', '', 2, 0, 'New Member', 0, 1401380892, 0, 1401380892, 1401382708, 0, 0, 0, 0, 4, '5', 0, 0, 0, 0, 0, 3194967, '04-15-1980', '1980-04-15', -1, -1, '107.155.120.172', 0, 1, 0, 0, -1, 0, 0, 'Q}v4#a?Dk&cgL<m"0gaw!C}%s.8(J,', 0, 0, 0, '', 0, 0, 0, 0, 0, 0, 0, 0, 0, 0, 0, 0, '', '', 0, '', 'vb', '', 0, 1, 0, 0, NULL),
(24955, 3, '', 0, 'FSchipper', 'c66f8c490d8d649fe3315b4b22a22404', '2014-05-29', 'agonizingsled99847@outlook.com', 0, '', '', '', '', '', '', '', 2, 0, 'New Member', 0, 1401381470, 0, 1401381470, 1401383988, 0, 0, 0, 0, 4, '5', 0, 0, 0, 0, 0, 3194967, '08-12-1984', '1984-08-12', -1, -1, '107.155.117.246', 0, 1, 0, 0, -1, 0, 0, ')nv"ox<:*HcQHcI[}TbN+GUlTB}Q)]', 0, 0, 0, '', 0, 0, 0, 0, 0, 0, 0, 0, 0, 0, 0, 0, '', '', 0, '', 'vb', '', 0, 1, 0, 0, NULL),
(24956, 3, '', 0, 'KRoyston', 'ce3cebcebea5a86c80e36a88e3e0109b', '2014-05-29', 'protectivefascij3162@outlook.com', 0, '', '', '', '', '', '', '', 2, 0, 'New Member', 0, 1401383967, 0, 1401383967, 1401386045, 0, 0, 0, 0, 4, '5', 0, 0, 0, 0, 0, 3194967, '03-22-1984', '1984-03-22', -1, -1, '107.155.77.13', 0, 1, 0, 0, -1, 0, 0, 'M6EE<z:{^''k+TL~):?8Xo@/HV{juF<', 0, 0, 0, '', 0, 0, 0, 0, 0, 0, 0, 0, 0, 0, 0, 0, '', '', 0, '', 'vb', '', 0, 1, 0, 0, NULL),
(24958, 3, '', 0, 'OYWKP', '2dd3ba2a141cdad52391ac5797826c5a', '2014-05-29', 'boilingguru975318@outlook.com', 0, '', '', '', '', '', '', '', 2, 0, 'New Member', 0, 1401386150, 0, 1401386150, 1401388052, 0, 0, 0, 0, 4, '5', 0, 0, 0, 0, 0, 3194967, '04-02-1980', '1980-04-02', -1, -1, '107.155.120.205', 0, 1, 0, 0, -1, 0, 0, '=cgAxn~dx[V9Jj:.%4z:/[%%h-=4-1', 0, 0, 0, '', 0, 0, 0, 0, 0, 0, 0, 0, 0, 0, 0, 0, '', '', 0, '', 'vb', '', 0, 1, 0, 0, NULL),
(25007, 3, '', 0, 'LLeatherm', 'e8df6b3926dbc46933182e6a41ea5ac9', '2014-05-31', 'elitepark317@hotmail.com', 0, '', '', '', '', '', '', '', 2, 0, 'New Member', 0, 1401530650, 0, 1401530650, 1401530650, 0, 0, 0, 0, 4, '5', 0, 0, 0, 0, 0, 3194967, '02-05-1982', '1982-02-05', -1, -1, '93.118.79.76', 0, 1, 0, 0, -1, 0, 0, 'K*Eo6fS9^kxo&RA&OmhsJ4R(]JjD]$', 0, 0, 0, '', 0, 0, 0, 0, 0, 0, 0, 0, 0, 0, 0, 0, '', '', 0, '', 'vb', '', 0, 1, 0, 0, NULL),
(25008, 3, '', 0, 'KIIN', '6f1a6ab34e11d2d071daab9cab955c09', '2014-05-31', 'gsmpedia.g.sa@gmail.com', 0, '', '', '', '', '', '', '', 2, 0, 'New Member', 0, 1401531013, 0, 1401531013, 1401532969, 0, 0, 0, 0, 4, '5', 0, 0, 0, 0, 0, 3194967, '09-13-1977', '1977-09-13', -1, -1, '77.243.112.142', 0, 1, 0, 0, -1, 0, 0, '%F$#&Q&o,m#mFQ!JSrOhIx$X7Z4g\\F', 0, 0, 0, '', 0, 0, 0, 0, 0, 0, 0, 0, 0, 0, 0, 0, '', '', 0, '', 'vb', '', 0, 1, 0, 0, NULL),
(25002, 3, '', 0, 'GDickerso', 'cf58b12807537cdea09ec5523756d189', '2014-05-31', 'chucekjkh@outlook.com', 0, '', '', '', '', '', '', '', 2, 0, 'New Member', 0, 1401517357, 0, 1401517357, 1401517357, 0, 0, 0, 0, 4, '5', 0, 0, 0, 0, 0, 3194967, '07-17-1982', '1982-07-17', -1, -1, '69.12.77.125', 0, 1, 0, 0, -1, 0, 0, 'jP5QAm7sGIYd>\\ti9jH].VoU,)^4)z', 0, 0, 0, '', 0, 0, 0, 0, 0, 0, 0, 0, 0, 0, 0, 0, '', '', 0, '', 'vb', '', 0, 1, 0, 0, NULL),
(24962, 3, '', 0, 'OHatten', '2a760ad32b2c003da7b9eb79a957c388', '2014-05-29', 'osvaldo_hatten9@camnang24h.com', 0, '', '', '', '', '', '', '', 2, 0, 'New Member', 0, 1401390132, 0, 1401390132, 1401398795, 0, 0, 0, 0, 4, '5', 0, 0, 0, 0, 0, 3194967, '06-08-1971', '1971-06-08', -1, -1, '23.108.132.185', 0, 1, 0, 0, -1, 0, 0, '[cd?"{=j.M7sP=w\\W[yY4M3Zf$w);9', 0, 0, 0, '', 0, 0, 0, 0, 0, 0, 0, 0, 0, 0, 0, 0, '', '', 0, '', 'vb', '', 0, 1, 0, 0, NULL),
(24963, 3, '', 0, 'SRaggatt', 'edde2ff3c927ae6bbdc74ac42ef83086', '2014-05-29', 'foregoinglaborezt151@outlook.com', 0, '', '', '', '', '', '', '', 2, 0, 'New Member', 0, 1401391585, 0, 1401391585, 1401398943, 0, 0, 0, 0, 4, '5', 0, 0, 0, 0, 0, 3194967, '05-06-1976', '1976-05-06', -1, -1, '109.160.100.194', 0, 1, 0, 0, -1, 0, 0, '{x$Q\\DeQOz]i{c[n%8{cU7PhsT/5cB', 0, 0, 0, '', 0, 0, 0, 0, 0, 0, 0, 0, 0, 0, 0, 0, '', '', 0, '', 'vb', '', 0, 1, 0, 0, NULL),
(24993, 3, '', 0, 'DDorris', '25a2cb93a3e05a2e3b186952a63c34b3', '2014-05-31', 'kraeyweywf@yahoo.com', 0, '', '', '', '', '', '', '', 2, 0, 'New Member', 0, 1401500560, 0, 1401500560, 1401500560, 0, 0, 0, 0, 4, '5', 0, 0, 0, 0, 0, 3194967, '10-26-1977', '1977-10-26', -1, -1, '178.32.231.203', 0, 1, 0, 0, -1, 0, 0, ':Hd3#AyQDyBR*qc8''kx4>_.NIx''28m', 0, 0, 0, '', 0, 0, 0, 0, 0, 0, 0, 0, 0, 0, 0, 0, '', '', 0, '', 'vb', '', 0, 1, 0, 0, NULL),
(24994, 3, '', 0, 'OWexler', '09fc0b53ddf87805cfecb50fdb995508', '2014-05-31', 'birdqzm@outlook.com', 0, '', '', '', '', '', '', '', 2, 0, 'New Member', 0, 1401501802, 0, 1401501802, 1401773495, 0, 0, 0, 0, 4, '5', 0, 0, 0, 0, 0, 3194967, '09-07-1975', '1975-09-07', -1, -1, '177.97.221.139', 0, 1, 0, 0, -1, 0, 0, 'L:sY''>sH|)|},}8P=/''Su17I0\\UeE*', 0, 0, 0, '', 0, 0, 0, 0, 0, 0, 0, 0, 0, 0, 0, 0, '', '', 0, '', 'vb', '', 0, 1, 0, 0, NULL),
(24986, 3, '', 0, 'CKraus', 'af5293118b1d371ae4c88d1ec81be4ba', '2014-05-30', 'ivonnetprager@yahoo.com', 0, '', '', '', '', '', '', '', 2, 0, 'New Member', 0, 1401462251, 0, 1401462251, 1401464139, 0, 0, 0, 0, 4, '5', 0, 0, 0, 0, 0, 3194967, '01-02-1973', '1973-01-02', -1, -1, '109.200.20.250', 0, 1, 0, 0, -1, 0, 0, '(<[MvR53KOsqG/0#dmbP6''kree<8''W', 0, 0, 0, '', 0, 0, 0, 0, 0, 0, 0, 0, 0, 0, 0, 0, '', '', 0, '', 'vb', '', 0, 1, 0, 0, NULL),
(24967, 3, '', 0, 'A2229', '8cf966b318b5b5e5a3087a1b50b101d5', '2014-05-29', 'heartbreakingaxcj10x@outlook.com', 0, '', '', '', '', '', '', '', 2, 0, 'New Member', 0, 1401398228, 0, 1401398228, 1401398479, 0, 0, 0, 0, 4, '5', 0, 0, 0, 0, 0, 3194967, '01-07-1977', '1977-01-07', -1, -1, '107.155.118.244', 0, 1, 0, 0, -1, 0, 0, 'O-<=q5(<#H:Hm;<Fl+GvsuJ]@R&P[7', 0, 0, 0, '', 0, 0, 0, 0, 0, 0, 0, 0, 0, 0, 0, 0, '', '', 0, '', 'vb', '', 0, 1, 0, 0, NULL),
(24968, 3, '', 0, 'RKossak', 'ef022d3c99563893c373d40f6b588ed5', '2014-05-30', 'snogcrv@outlook.com', 0, '', '', '', '', '', '', '', 2, 0, 'New Member', 0, 1401404695, 0, 1401404695, 1401444235, 0, 0, 0, 0, 4, '5', 0, 0, 0, 0, 0, 3194967, '09-27-1975', '1975-09-27', -1, -1, '23.105.212.105', 0, 1, 0, 0, -1, 0, 0, 'OO}q-2|E_W}o6#]mEEM5G,F[b6J*k8', 0, 0, 0, '', 0, 0, 0, 0, 0, 0, 0, 0, 0, 0, 0, 0, '', '', 0, '', 'vb', '', 0, 1, 0, 0, NULL),
(25029, 3, '', 0, 'annatgoolety9554', '8219511cd2403f7c9d1876f0eb1aebd5', '2014-06-01', 'annatgoolety@ymail.com', 0, '', '', '', '', '', '', '', 2, 0, 'New Member', 0, 1401578014, 0, 1401578014, 1401578014, 0, 0, 0, 0, 4, '5.75', 0, 0, 0, 0, 0, 3194903, '05-15-1987', '1987-05-15', -1, -1, '89.67.176.229', 0, 1, 0, 0, -1, 0, 0, '6m4LA|-'';Lzms{6@t4!oh]Euvt''$/a', 0, 0, 0, '', 0, 0, 0, 0, 0, 0, 0, 0, 0, 0, 0, 0, '', '', 0, '', 'vb', '', 0, 1, 0, 0, NULL),
(25108, 2, '', 0, 'samanni', '6b09c6950994c8cd5a8dd5e9d25a1d54', '2014-06-03', 'saman_1137@yahoo.com', 0, '', '', '', '', '', '', '', 2, 0, 'New Member', 0, 1401774285, 0, 1401775003, 1401794399, 0, 0, 0, 0, 4, '5', 0, 0, 0, 0, 0, 3194967, '12-03-1981', '1981-12-03', -1, -1, '65.49.14.76', 0, 1, 0, 0, -1, 0, 0, 'x2|AA!M-JlgQ!^sI.AL&MXODOSkhj(', 0, 0, 0, '', 0, 0, 0, 0, 0, 0, 0, 0, 0, 0, 0, 0, '', '', 0, '', 'vb', '', 0, 1, 0, 0, NULL),
(25062, 2, '', 0, 'salmanmasahib', '9dc2b4ff0820e96faa190b7b90802485', '2014-06-01', 'salmanmasahib@gmail.com', 0, '', '', '', '', '', '', '', 2, 0, 'New Member', 0, 1401645572, 0, 1401645572, 1401645572, 0, 0, 0, 0, 4, '5', 0, 0, 0, 0, 0, 3194967, '04-01-1988', '1988-04-01', -1, -1, '39.33.202.85', 0, 1, 0, 0, -1, 0, 0, 'T/:(;Q4ZoP2Qi;?_,,=%`+`HJ<BA@S', 0, 0, 0, '', 0, 0, 0, 0, 0, 0, 0, 0, 0, 0, 0, 0, '', '', 0, '', 'vb', '', 0, 1, 0, 0, NULL),
(25063, 3, '', 0, 'adnanbkhan', '889bc342ffeb1430ea9795eef34df1f6', '2014-06-01', 'adnankhan000@gmail.com', 0, '', '', '', '', '', '', '', 2, 0, 'New Member', 0, 1401645906, 0, 1401645906, 1401645938, 0, 0, 0, 0, 4, '5', 0, 0, 0, 0, 0, 3194967, '07-06-1984', '1984-07-06', -1, -1, '182.185.123.153', 0, 1, 0, 0, -1, 0, 0, 'v\\cZ{I_{8mV\\3bBmWQ3l7B!t]o?^T4', 0, 0, 0, '', 0, 0, 0, 0, 0, 0, 0, 0, 0, 0, 0, 0, '', '', 0, '', 'vb', '', 0, 1, 0, 0, NULL),
(25061, 3, '', 0, 'AMcRobert', '393b56ae723161fbe860faa624f54699', '2014-06-01', 'abbsgyyxs@yahoo.com', 0, '', '', '', '', '', '', '', 2, 0, 'New Member', 0, 1401641188, 0, 1401641188, 1401641188, 0, 0, 0, 0, 4, '5', 0, 0, 0, 0, 0, 3194967, '03-14-1973', '1973-03-14', -1, -1, '178.32.6.140', 0, 1, 0, 0, -1, 0, 0, 'GCVJ1''`FhRdN9{`%!rA+K^Oj8K3Bn@', 0, 0, 0, '', 0, 0, 0, 0, 0, 0, 0, 0, 0, 0, 0, 0, '', '', 0, '', 'vb', '', 0, 1, 0, 0, NULL),
(24972, 3, '', 0, 'SDlt', 'f3199337912cdbb88bc7859e268c3346', '2014-05-30', 'shelli_freycinet11@iidiscounts.com', 0, '', '', '', '', '', '', '', 2, 0, 'New Member', 0, 1401426335, 0, 1401426335, 1401426335, 0, 0, 0, 0, 4, '5', 0, 0, 0, 0, 0, 3194967, '03-28-1973', '1973-03-28', -1, -1, '173.0.60.212', 0, 1, 0, 0, -1, 0, 0, '?;''Qr"3-:^\\iP9ff|^9C#;%E?;ry_g', 0, 0, 0, '', 0, 0, 0, 0, 0, 0, 0, 0, 0, 0, 0, 0, '', '', 0, '', 'vb', '', 0, 1, 0, 0, NULL),
(24973, 3, '', 0, 'DNavarret', 'af05fa3a50a9b066e45537585c9153c3', '2014-05-30', 'darrell.navarrete80@iidiscounts.com', 0, '', '', '', '', '', '', '', 2, 0, 'New Member', 0, 1401426354, 0, 1401426354, 1401426354, 0, 0, 0, 0, 4, '5', 0, 0, 0, 0, 0, 3194967, '03-26-1975', '1975-03-26', -1, -1, '173.0.60.212', 0, 1, 0, 0, -1, 0, 0, 'zx,`vlO:<f3g*2G~B$l}A4W>qG^mSL', 0, 0, 0, '', 0, 0, 0, 0, 0, 0, 0, 0, 0, 0, 0, 0, '', '', 0, '', 'vb', '', 0, 1, 0, 0, NULL),
(24974, 3, '', 0, 'EMonteneg', '924f20fb77b6d36c16baafacb9d085d3', '2014-05-30', 'purashkgqe@outlook.com', 0, '', '', '', '', '', '', '', 2, 0, 'New Member', 0, 1401427427, 0, 1401427427, 1401427427, 0, 0, 0, 0, 4, '5', 0, 0, 0, 0, 0, 3194967, '05-31-1978', '1978-05-31', -1, -1, '23.105.208.90', 0, 1, 0, 0, -1, 0, 0, 'Fj!O{HN?K<=kPt+B<i1o75?]DNzB.S', 0, 0, 0, '', 0, 0, 0, 0, 0, 0, 0, 0, 0, 0, 0, 0, '', '', 0, '', 'vb', '', 0, 1, 0, 0, NULL),
(25025, 3, '', 0, 'EDettmann', 'e2431ec0aecef95953bf6da5a7492193', '2014-05-31', 'tranquilbigot824829@outlook.com', 0, '', '', '', '', '', '', '', 2, 0, 'New Member', 0, 1401570273, 0, 1401570273, 1401572356, 0, 0, 0, 0, 4, '5', 0, 0, 0, 0, 0, 3194967, '09-04-1971', '1971-09-04', -1, -1, '173.208.39.221', 0, 1, 0, 0, -1, 0, 0, 'EA:>nlaK]=VN''d[g1MKnBiL;G_v?ZW', 0, 0, 0, '', 0, 0, 0, 0, 0, 0, 0, 0, 0, 0, 0, 0, '', '', 0, '', 'vb', '', 0, 1, 0, 0, NULL),
(25006, 2, '', 0, 'stevens', 'ffb234559414a28149ec59af9b95b8ff', '2014-05-31', 'mubeengaba@yahoo.com', 0, '', '', '', '', '', '', '', 2, 0, 'New Member', 0, 1401528226, 0, 1403512478, 1403525178, 1402240032, 444023, 3, 0, 4, '5', 0, 0, 0, 0, 0, 2146391, '05-09-1985', '1985-05-09', -1, -1, '39.32.253.74', 0, 1, 0, 0, -1, 0, 0, 'GOA_7w"!s2Z/o8}jE{,C''Ys.m"i/*]', 0, 0, 0, '', 0, 0, 1, 0, 0, 0, 0, 0, 0, 0, 0, 0, '93db4365e41d18cb6e18fb4d3ee681e9', '', 0, '', 'vb', '', 0, 1, 0, 0, NULL),
(25015, 2, '', 0, 'ch mehraj', '7426ad67bf4e810840ad6559662eca2d', '2014-05-31', 'mehrajulhassan@hotmail.com', 0, '', '', '', '', '', '', '', 2, 0, 'New Member', 0, 1401554531, 0, 1401554531, 1401556021, 0, 0, 0, 0, 4, '5', 0, 0, 0, 0, 0, 3194967, '04-29-1984', '1984-04-29', -1, -1, '87.109.88.17', 0, 1, 0, 0, -1, 0, 0, 'By[cJK?2;h;y%^TD/J@q,+4h&[iJz!', 0, 0, 0, '', 0, 0, 0, 0, 0, 0, 0, 0, 0, 0, 0, 0, '', '', 0, '', 'vb', '', 0, 1, 0, 0, NULL),
(25019, 3, '', 0, 'TCardus', '6d6566e8098b6b9b1fd3d7100b51e744', '2014-05-31', 'impartialmalpracbw82@outlook.com', 0, '', '', '', '', '', '', '', 2, 0, 'New Member', 0, 1401562884, 0, 1401562884, 1401566532, 0, 0, 0, 0, 4, '5', 0, 0, 0, 0, 0, 3194967, '02-22-1977', '1977-02-22', -1, -1, '173.208.39.55', 0, 1, 0, 0, -1, 0, 0, 'bah&X<B%RMYszi!V^2\\Nmj^R5+ZGN/', 0, 0, 0, '', 0, 0, 0, 0, 0, 0, 0, 0, 0, 0, 0, 0, '', '', 0, '', 'vb', '', 0, 1, 0, 0, NULL),
(25004, 3, '', 0, 'CLindell', '64e336c1e68ce511c7c1e882e61deea9', '2014-05-31', 'whistann@hotmail.com', 0, '', '', '', '', '', '', '', 2, 0, 'New Member', 0, 1401524530, 0, 1401524530, 1401526655, 0, 0, 0, 0, 4, '5', 0, 0, 0, 0, 0, 3194967, '09-25-1982', '1982-09-25', -1, -1, '167.88.123.105', 0, 1, 0, 0, -1, 0, 0, '>@Q6#j(m^gr&h(_NGiJ''z21NKMV*4G', 0, 0, 0, '', 0, 0, 0, 0, 0, 0, 0, 0, 0, 0, 0, 0, '', '', 0, '', 'vb', '', 0, 1, 0, 0, NULL),
(24983, 3, '', 0, 'FFajardo', 'cde2a80ecb7c93ea1f307a4b1c6f5991', '2014-05-30', 'rossiniazza@hotmail.com', 0, '', '', '', '', '', '', '', 2, 0, 'New Member', 0, 1401458270, 0, 1401458270, 1401460748, 0, 0, 0, 0, 4, '5', 0, 0, 0, 0, 0, 3194967, '01-02-1985', '1985-01-02', -1, -1, '117.102.49.141', 0, 1, 0, 0, -1, 0, 0, 'c|)V"#t)ub=nrTBoJ&FQAG@-M>WjQG', 0, 0, 0, '', 0, 0, 0, 0, 0, 0, 0, 0, 0, 0, 0, 0, '', '', 0, '', 'vb', '', 0, 1, 0, 0, NULL),
(24984, 3, '', 0, 'M4918', 'fdf2dc19f80c4e0487a6070ac6378f98', '2014-05-30', 'juliamjulfy@outlook.com', 0, '', '', '', '', '', '', '', 2, 0, 'New Member', 0, 1401460293, 0, 1401460293, 1401460293, 0, 0, 0, 0, 4, '5', 0, 0, 0, 0, 0, 3194967, '09-02-1976', '1976-09-02', -1, -1, '204.44.83.26', 0, 1, 0, 0, -1, 0, 0, 'XAtfszIbZpH:$|5I7aSpiXba{p*v~]', 0, 0, 0, '', 0, 0, 0, 0, 0, 0, 0, 0, 0, 0, 0, 0, '', '', 0, '', 'vb', '', 0, 1, 0, 0, NULL),
(24985, 3, '', 0, 'C80Y', '3b50b8def7b328686781390ee09e65a8', '2014-05-30', 'daracpsd@outlook.com', 0, '', '', '', '', '', '', '', 2, 0, 'New Member', 0, 1401460678, 0, 1401460678, 1401524364, 0, 0, 0, 0, 4, '5', 0, 0, 0, 0, 0, 3194967, '04-14-1971', '1971-04-14', -1, -1, '69.175.86.202', 0, 1, 0, 0, -1, 0, 0, '4%1n"Xj6gm;`x<+,lRJ{1od''bp`3e*', 0, 0, 0, '', 0, 0, 0, 0, 0, 0, 0, 0, 0, 0, 0, 0, '', '', 0, '', 'vb', '', 0, 1, 0, 0, NULL),
(25032, 3, '', 0, 'MXSGH', 'a614d1619afb39b4ff801926d6b3eb52', '2014-06-01', 'lyricaljacket521l50z@outlook.com', 0, '', '', '', '', '', '', '', 2, 0, 'New Member', 0, 1401584033, 0, 1401584033, 1401589583, 0, 0, 0, 0, 4, '5', 0, 0, 0, 0, 0, 3194967, '03-18-1981', '1981-03-18', -1, -1, '173.208.39.8', 0, 1, 0, 0, -1, 0, 0, 'J=(k5&PtDHV!w;I@Cf2zovG.KEFd6@', 0, 0, 0, '', 0, 0, 0, 0, 0, 0, 0, 0, 0, 0, 0, 0, '', '', 0, '', 'vb', '', 0, 1, 0, 0, NULL),
(25033, 3, '', 0, 'HBeeson', 'c52ecd3dfdf65205034e2a93a42f227f', '2014-06-01', 'grremeynhm@yahoo.com', 0, '', '', '', '', '', '', '', 2, 0, 'New Member', 0, 1401589379, 0, 1401589379, 1401593821, 0, 0, 0, 0, 4, '5', 0, 0, 0, 0, 0, 3194967, '04-30-1980', '1980-04-30', -1, -1, '192.227.243.33', 0, 1, 0, 0, -1, 0, 0, '/Pn6qL=''-q32k@s2sPl#18b?[.=:*k', 0, 0, 0, '', 0, 0, 0, 0, 0, 0, 0, 0, 0, 0, 0, 0, '', '', 0, '', 'vb', '', 0, 1, 0, 0, NULL),
(25052, 3, '', 0, 'goodlove', 'd669a1c1edff53e02807bd0dcb0f5942', '2014-06-01', 'proncity007@gmail.com', 0, '', '', '', '', '', '', '', 2, 0, 'New Member', 0, 1401626112, 0, 1401626112, 1401626248, 0, 0, 0, 0, 4, '5', 0, 0, 0, 0, 0, 3194967, '03-15-1988', '1988-03-15', -1, -1, '39.55.165.19', 1447, 1, 0, 0, -1, 0, 0, '9oTd0RGUc|,1i{1T5)@u|,soFvry&c', 0, 0, 0, '', 0, 0, 0, 0, 0, 0, 0, 0, 0, 0, 0, 0, '', '', 0, '', 'vb', '', 0, 1, 0, 0, NULL),
(25035, 3, '', 0, 'DFawsitt', 'd696abdeefaa47adab22e1b4e4e9968e', '2014-06-01', 'stiffpolice327@hotmail.com', 0, '', '', '', '', '', '', '', 2, 0, 'New Member', 0, 1401593728, 0, 1401593728, 1401596395, 0, 0, 0, 0, 4, '5', 0, 0, 0, 0, 0, 3194967, '03-25-1972', '1972-03-25', -1, -1, '173.254.234.197', 0, 1, 0, 0, -1, 0, 0, '_*;3FJ0*vDZ}m&))~o?;~seS\\;_XCE', 0, 0, 0, '', 0, 0, 0, 0, 0, 0, 0, 0, 0, 0, 0, 0, '', '', 0, '', 'vb', '', 0, 1, 0, 0, NULL),
(25036, 3, '', 0, 'KCastlebe', 'cf5da94cc49ca18c2b25e733d96bd805', '2014-06-01', 'tammiemvqlzo@outlook.com', 0, '', '', '', '', '', '', '', 2, 0, 'New Member', 0, 1401595263, 0, 1401595263, 1401595263, 0, 0, 0, 0, 4, '5', 0, 0, 0, 0, 0, 3194967, '01-14-1974', '1974-01-14', -1, -1, '69.12.84.175', 0, 1, 0, 0, -1, 0, 0, 'zW@o)K"f0AyNc%KdRmnE.[cVU]E3)c', 0, 0, 0, '', 0, 0, 0, 0, 0, 0, 0, 0, 0, 0, 0, 0, '', '', 0, '', 'vb', '', 0, 1, 0, 0, NULL),
(25037, 3, '', 0, 'HPomeroy', '5ab9c7ba00532ace0707d26d43352176', '2014-06-01', 'enchantinghorse3092@outlook.com', 0, '', '', '', '', '', '', '', 2, 0, 'New Member', 0, 1401600740, 0, 1401600740, 1401603150, 0, 0, 0, 0, 4, '5', 0, 0, 0, 0, 0, 3194967, '10-04-1979', '1979-10-04', -1, -1, '176.61.142.215', 0, 1, 0, 0, -1, 0, 0, 'x!m[A6)yN)sXqS:!3CGBCMA<Z(SXkx', 0, 0, 0, '', 0, 0, 0, 0, 0, 0, 0, 0, 0, 0, 0, 0, '', '', 0, '', 'vb', '', 0, 1, 0, 0, NULL),
(25038, 3, '', 0, 'BMahomet', '8995a1bf23cc2556881147b45e1dfede', '2014-06-01', 'vedan1tyndal@yahoo.com', 0, '', '', '', '', '', '', '', 2, 0, 'New Member', 0, 1401601745, 0, 1401601745, 1401601745, 0, 0, 0, 0, 4, '5', 0, 0, 0, 0, 0, 3194967, '03-05-1978', '1978-03-05', -1, -1, '69.12.77.167', 0, 1, 0, 0, -1, 0, 0, 'iZ./,F^?P4Qf>YQ7S,"lt1pk,cX_)C', 0, 0, 0, '', 0, 0, 0, 0, 0, 0, 0, 0, 0, 0, 0, 0, '', '', 0, '', 'vb', '', 0, 1, 0, 0, NULL),
(25039, 3, '', 0, 'JMuhammad', '111e9509e5d728e4a9cc2c04bc6e6f61', '2014-06-01', 'zoilalftmgz@outlook.com', 0, '', '', '', '', '', '', '', 2, 0, 'New Member', 0, 1401603103, 0, 1401603103, 1401603103, 0, 0, 0, 0, 4, '5', 0, 0, 0, 0, 0, 3194967, '06-11-1976', '1976-06-11', -1, -1, '198.55.112.184', 0, 1, 0, 0, -1, 0, 0, '(tw#BLf6-DIvC8rdIea*`eNi)CPFz7', 0, 0, 0, '', 0, 0, 0, 0, 0, 0, 0, 0, 0, 0, 0, 0, '', '', 0, '', 'vb', '', 0, 1, 0, 0, NULL),
(25564, 3, '', 0, 'LCollett', '1be04449142d8c5411c6e2f0fe13fc7c', '2014-06-18', 'tarnowski692267@gra.beskidy.pl', 0, '', '', '', '', '', '', '', 2, 0, 'New Member', 0, 1403091790, 0, 1403091790, 1403098983, 0, 0, 0, 0, 4, '5', 0, 0, 0, 0, 0, 3194967, '09-21-1973', '1973-09-21', -1, -1, '178.73.206.134', 0, 1, 0, 0, -1, 0, 0, '1.:BWtv/?%$ZL9%#6WYsLq-nCcXLp)', 0, 0, 0, '', 0, 0, 0, 0, 0, 0, 0, 0, 0, 0, 0, 0, '', '', 0, '', 'vb', '', 0, 1, 0, 0, NULL),
(25056, 3, '', 0, 'HWanliss', '49723ccc61abf55118ba1d3ad0501730', '2014-06-01', 'shierlingle@hotmail.com', 0, '', '', '', '', '', '', '', 2, 0, 'New Member', 0, 1401636491, 0, 1401636491, 1402080689, 0, 0, 0, 0, 4, '5', 0, 0, 0, 0, 0, 3194967, '06-20-1973', '1973-06-20', -1, -1, '186.117.156.236', 0, 1, 0, 0, -1, 0, 0, '3Op+[%.@2wk{S{#''\\Be/`zO{e(A>re', 0, 0, 0, '', 0, 0, 0, 0, 0, 0, 0, 0, 0, 0, 0, 0, '', '', 0, '', 'vb', '', 0, 1, 0, 0, NULL),
(25042, 3, '', 0, 'DMvs', '13cb05fcf21f44c8e7aabea1bd2fbd3e', '2014-06-01', 'damian_weekes@iidiscounts.org', 0, '', '', '', '', '', '', '', 2, 0, 'New Member', 0, 1401606406, 0, 1401606406, 1401614406, 0, 0, 0, 0, 4, '5', 0, 0, 0, 0, 0, 3194967, '01-02-1970', '1970-01-02', -1, -1, '69.12.71.148', 0, 1, 0, 0, -1, 0, 0, 'ZA''a2fc|d|)R_ZDhR:{:wZS$b2[g;8', 0, 0, 0, '', 0, 0, 0, 0, 0, 0, 0, 0, 0, 0, 0, 0, '', '', 0, '', 'vb', '', 0, 1, 0, 0, NULL),
(25721, 3, '', 0, 'NSnowden', 'b1dbef6416650904a5589813689f21bc', '2014-06-23', 'kontra@polair.eu', 0, '', '', '', '', '', '', '', 2, 0, 'New Member', 0, 1403561928, 0, 1403561928, 1403562167, 0, 0, 0, 0, 4, '5', 0, 0, 0, 0, 0, 3194967, '08-27-1979', '1979-08-27', -1, -1, '185.9.148.169', 0, 1, 0, 0, -1, 0, 0, '$uYd?Z3/,6Nfm|~J''O9`U+aa][Rhs{', 0, 0, 0, '', 0, 0, 0, 0, 0, 0, 0, 0, 0, 0, 0, 0, '', '', 0, '', 'vb', '', 0, 1, 0, 0, NULL),
(25112, 3, '', 0, 'SAhMouy', '7a73e4ea9fbfb9ec2f63134ef6aac3d3', '2014-06-03', 'uglylibrary23b319q@outlook.com', 0, '', '', '', '', '', '', '', 2, 0, 'New Member', 0, 1401799139, 0, 1401799139, 1401801325, 0, 0, 0, 0, 4, '5', 0, 0, 0, 0, 0, 3194967, '06-21-1975', '1975-06-21', -1, -1, '108.186.244.164', 0, 1, 0, 0, -1, 0, 0, 'R]zVr;8#x!4_ZvfJB(Pq0@RD)^WC;&', 0, 0, 0, '', 0, 0, 0, 0, 0, 0, 0, 0, 0, 0, 0, 0, '', '', 0, '', 'vb', '', 0, 1, 0, 0, NULL),
(25058, 3, '', 0, 'ETrugerna', 'abbb2e5832d2856e379ed243f05b6cce', '2014-06-01', 'abbiezangbmsbqgyp@yahoo.com', 0, '', '', '', '', '', '', '', 2, 0, 'New Member', 0, 1401637957, 0, 1401637957, 1401637957, 0, 0, 0, 0, 4, '5', 0, 0, 0, 0, 0, 3194967, '07-14-1977', '1977-07-14', -1, -1, '176.31.60.97', 0, 1, 0, 0, -1, 0, 0, '@>I0"~c''l5HpK"/9G,6?mq}7H`jLWU', 0, 0, 0, '', 0, 0, 0, 0, 0, 0, 0, 0, 0, 0, 0, 0, '', '', 0, '', 'vb', '', 0, 1, 0, 0, NULL),
(25046, 3, '', 0, 'JThornber', '6992300ffed6e45d78c857d1697d576e', '2014-06-01', 'jesus_thornber@iidiscounts.org', 0, '', '', '', '', '', '', '', 2, 0, 'New Member', 0, 1401610590, 0, 1401610590, 1401617942, 0, 0, 0, 0, 4, '5', 0, 0, 0, 0, 0, 3194967, '09-28-1970', '1970-09-28', -1, -1, '173.0.59.29', 0, 1, 0, 0, -1, 0, 0, 'iw^XEK3DYmYYGH#PQLC_Ljtk^dIOLL', 0, 0, 0, '', 0, 0, 0, 0, 0, 0, 0, 0, 0, 0, 0, 0, '', '', 0, '', 'vb', '', 0, 1, 0, 0, NULL),
(25047, 3, '', 0, 'JGuertin', '1f9505f8bb4766c54793ceea5b282827', '2014-06-01', 'jdcazys@outlook.com', 0, '', '', '', '', '', '', '', 2, 0, 'New Member', 0, 1401612032, 0, 1401612032, 1401627377, 0, 0, 0, 0, 4, '5', 0, 0, 0, 0, 0, 3194967, '08-02-1982', '1982-08-02', -1, -1, '192.210.144.19', 0, 1, 0, 0, -1, 0, 0, 'AY]i4yn}_zaA~L|Dv6jMFYZWQW4WIz', 0, 0, 0, '', 0, 0, 0, 0, 0, 0, 0, 0, 0, 0, 0, 0, '', '', 0, '', 'vb', '', 0, 1, 0, 0, NULL),
(25049, 2, '', 0, 'Pak_Track', 'ce81d82a2e8c6ea72fdd88caf27f6e5e', '2014-06-01', 'hacktestca@gmail.com', 7, '', '', '', '', '', '', '', 2, 0, 'New Member', 0, 1401617647, 0, 1471108713, 1472484551, 1404482193, 448564, 3, 0, 4, '5', 0, 0, 0, 0, 0, 3163223, '12-30-1983', '1983-12-30', -1, 1, '39.50.253.112', 0, 0, 0, 0, -1, 0, 0, '&X$1jg_9k~"<JrSI/-Ta.p##Oz4#3h', 0, 0, 0, '', 0, 0, 1, 0, 0, 0, 0, 0, 0, 0, 0, 0, '', '', 0, '', 'vb', '', 0, 1, 0, 0, NULL),
(25050, 3, '', 0, 'DDorringt', '7e5f8252c4c0d8636fb04cf082c4f4a2', '2014-06-01', 'margotaeb218@hotmail.com', 0, '', '', '', '', '', '', '', 2, 0, 'New Member', 0, 1401619874, 0, 1401619874, 1401630660, 0, 0, 0, 0, 4, '5', 0, 0, 0, 0, 0, 3194967, '07-19-1975', '1975-07-19', -1, -1, '50.2.225.229', 0, 1, 0, 0, -1, 0, 0, 'R<G==UD}+LEI-cwmb|i>,S}i&1ql->', 0, 0, 0, '', 0, 0, 0, 0, 0, 0, 0, 0, 0, 0, 0, 0, '', '', 0, '', 'vb', '', 0, 1, 0, 0, NULL),
(25051, 2, '', 0, 'sajjadahmad', 'a4661f0d26c424f3cde2eb43c2218000', '2014-06-01', 'sajjad_chaudry@hotmail.com', 0, '', '', '', '', '', '', '', 2, 0, 'New Member', 0, 1401623596, 0, 1401623596, 1401624314, 0, 0, 0, 0, 4, '5', 0, 0, 0, 0, 0, 3194967, '04-04-1992', '1992-04-04', -1, -1, '39.47.178.157', 0, 1, 0, 0, -1, 0, 0, 'k-!Q2t<swgtGj[P/SSrc\\S5{P[;Hg4', 0, 0, 0, '', 0, 0, 0, 0, 0, 0, 0, 0, 0, 0, 0, 0, '', '', 0, '', 'vb', '', 0, 1, 0, 0, NULL);
INSERT INTO `user` (`userid`, `usergroupid`, `membergroupids`, `displaygroupid`, `username`, `password`, `passworddate`, `email`, `styleid`, `parentemail`, `homepage`, `icq`, `aim`, `yahoo`, `msn`, `skype`, `showvbcode`, `showbirthday`, `usertitle`, `customtitle`, `joindate`, `daysprune`, `lastvisit`, `lastactivity`, `lastpost`, `lastpostid`, `posts`, `reputation`, `reputationlevelid`, `timezoneoffset`, `pmpopup`, `avatarid`, `avatarrevision`, `profilepicrevision`, `sigpicrevision`, `options`, `birthday`, `birthday_search`, `maxposts`, `startofweek`, `ipaddress`, `referrerid`, `languageid`, `emailstamp`, `threadedmode`, `autosubscribe`, `pmtotal`, `pmunread`, `salt`, `ipoints`, `infractions`, `warnings`, `infractiongroupids`, `infractiongroupid`, `adminoptions`, `profilevisits`, `friendcount`, `friendreqcount`, `vmunreadcount`, `vmmoderatedcount`, `socgroupinvitecount`, `socgroupreqcount`, `pcunreadcount`, `pcmoderatedcount`, `gmmoderatedcount`, `assetposthash`, `fbuserid`, `fbjoindate`, `fbname`, `logintype`, `fbaccesstoken`, `bloggroupreqcount`, `showblogcss`, `importuserid`, `newrepcount`, `panjo_selling`) VALUES
(25118, 3, '', 0, 'LBaccarin', '0b60cb657e1abba1a0a77cc66917374c', '2014-06-03', 'raksrenant@yahoo.com', 0, '', '', '', '', '', '', '', 2, 0, 'New Member', 0, 1401819692, 0, 1401819692, 1401878370, 0, 0, 0, 0, 4, '5', 0, 0, 0, 0, 0, 3194967, '10-29-1979', '1979-10-29', -1, -1, '198.175.125.192', 0, 1, 0, 0, -1, 0, 0, 'H(7+%[Y9ps!:T"UAD3aW>k''ORr`u+m', 0, 0, 0, '', 0, 0, 0, 0, 0, 0, 0, 0, 0, 0, 0, 0, '', '', 0, '', 'vb', '', 0, 1, 0, 0, NULL),
(25073, 3, '', 0, 'LD80', 'd261ac0c03de548d3bad311c93581b07', '2014-06-02', 'dannabinddeqcfr@yahoo.com', 0, '', '', '', '', '', '', '', 2, 0, 'New Member', 0, 1401666867, 0, 1401666867, 1401668734, 0, 0, 0, 0, 4, '5', 0, 0, 0, 0, 0, 3194967, '05-22-1978', '1978-05-22', -1, -1, '198.143.143.141', 0, 1, 0, 0, -1, 0, 0, 'qTXotcC0?/1UBu11yptg|0\\X^E(.u/', 0, 0, 0, '', 0, 0, 0, 0, 0, 0, 0, 0, 0, 0, 0, 0, '', '', 0, '', 'vb', '', 0, 1, 0, 0, NULL),
(25841, 3, '', 0, 'FSartori', 'ac8ab42ea69a9a03dec574ddf921816a', '2014-06-29', 'jamalrag@outlook.com', 0, '', '', '', '', '', '', '', 2, 0, 'New Member', 0, 1404060373, 0, 1404060373, 1404313019, 0, 0, 0, 0, 4, '5', 0, 0, 0, 0, 0, 3194967, '08-07-1971', '1971-08-07', -1, -1, '173.208.46.240', 0, 1, 0, 0, -1, 0, 0, 'HYL"$LfC?$Nyu$Y`S8nbN-CZ}R.~\\h', 0, 0, 0, '', 0, 0, 0, 0, 0, 0, 0, 0, 0, 0, 0, 0, '', '', 0, '', 'vb', '', 0, 1, 0, 0, NULL),
(25105, 3, '', 0, 'TMontez', '3c64cee5589a37ec045d45c9da4cc184', '2014-06-03', 'discreetwidget5w6@outlook.com', 0, '', '', '', '', '', '', '', 2, 0, 'New Member', 0, 1401761587, 0, 1401761587, 1401761587, 0, 0, 0, 0, 4, '5', 0, 0, 0, 0, 0, 3194967, '06-22-1971', '1971-06-22', -1, -1, '199.180.130.77', 0, 1, 0, 0, -1, 0, 0, 'zOP<?U="pcd#>:/HG:D}V|iT!#(b{,', 0, 0, 0, '', 0, 0, 0, 0, 0, 0, 0, 0, 0, 0, 0, 0, '', '', 0, '', 'vb', '', 0, 1, 0, 0, NULL),
(25103, 3, '', 0, 'LBallou', 'd994255a898cbe7d0f6855ad1123e961', '2014-06-03', 'hrynie.wskiemil@gmail.com', 0, '', '', '', '', '', '', '', 2, 0, 'New Member', 0, 1401751574, 0, 1401751574, 1401758800, 0, 0, 0, 0, 4, '5', 0, 0, 0, 0, 0, 3194967, '05-21-1975', '1975-05-21', -1, -1, '23.108.196.40', 0, 1, 0, 0, -1, 0, 0, '.:bNvE8JYK!_Tf_,KC:Sc6[]W$@_8k', 0, 0, 0, '', 0, 0, 0, 0, 0, 0, 0, 0, 0, 0, 0, 0, '', '', 0, '', 'vb', '', 0, 1, 0, 0, NULL),
(25077, 3, '', 0, 'HQBUK', 'f42907ec9b0befe8fea15b09c843873c', '2014-06-02', 'tenuouscord620@hotmail.com', 0, '', '', '', '', '', '', '', 2, 0, 'New Member', 0, 1401678285, 0, 1401678285, 1401681888, 0, 0, 0, 0, 4, '5', 0, 0, 0, 0, 0, 3194967, '05-30-1972', '1972-05-30', -1, -1, '199.180.129.57', 0, 1, 0, 0, -1, 0, 0, '4!`,"Mebfq`:2nc''Ulokb?*_chpkkb', 0, 0, 0, '', 0, 0, 0, 0, 0, 0, 0, 0, 0, 0, 0, 0, '', '', 0, '', 'vb', '', 0, 1, 0, 0, NULL),
(25106, 3, '', 0, 'RHurley', 'ba9b1e9a5d75dca06dbf9dc25fd34cfe', '2014-06-03', 'villakchan@yahoo.com', 0, '', '', '', '', '', '', '', 2, 0, 'New Member', 0, 1401763554, 0, 1401763554, 1401763554, 0, 0, 0, 0, 4, '5', 0, 0, 0, 0, 0, 3194967, '01-08-1980', '1980-01-08', -1, -1, '78.129.131.68', 0, 1, 0, 0, -1, 0, 0, '.yY30]2w\\=d"%_"dL3=,s<9[C$#yvZ', 0, 0, 0, '', 0, 0, 0, 0, 0, 0, 0, 0, 0, 0, 0, 0, '', '', 0, '', 'vb', '', 0, 1, 0, 0, NULL),
(25080, 3, '', 0, 'LMyrick', 'f682aab43b2e529815a5299ac3ca9e59', '2014-06-02', 'chrisreed420@wiserocket.com', 0, '', '', '', '', '', '', '', 2, 0, 'New Member', 0, 1401689982, 0, 1401689982, 1401722536, 0, 0, 0, 0, 4, '5', 0, 0, 0, 0, 0, 3194967, '07-27-1980', '1980-07-27', -1, -1, '23.81.63.128', 0, 1, 0, 0, -1, 0, 0, '9_)i4*K~n6cujJ`^8YO$6I9\\>@R4sq', 0, 0, 0, '', 0, 0, 0, 0, 0, 0, 0, 0, 0, 0, 0, 0, '', '', 0, '', 'vb', '', 0, 1, 0, 0, NULL),
(25081, 3, '', 0, 'JAmiet', 'fd3452526a4a318d90cd7f07ba60d50a', '2014-06-02', 'cifdynqarn@yahoo.com', 0, '', '', '', '', '', '', '', 2, 0, 'New Member', 0, 1401692088, 0, 1401692088, 1401699041, 0, 0, 0, 0, 4, '5', 0, 0, 0, 0, 0, 3194967, '11-28-1978', '1978-11-28', -1, -1, '198.27.106.83', 0, 1, 0, 0, -1, 0, 0, '*l8Hj#0KX-e\\D;594URM(85J*Jdu\\7', 0, 0, 0, '', 0, 0, 0, 0, 0, 0, 0, 0, 0, 0, 0, 0, '', '', 0, '', 'vb', '', 0, 1, 0, 0, NULL),
(25082, 3, '', 0, 'AMcDonell', '74b08d2859ba30939c8965c978d88bc1', '2014-06-02', 'alisha.mcdonell100@iidiscouns.org', 0, '', '', '', '', '', '', '', 2, 0, 'New Member', 0, 1401694190, 0, 1401694190, 1401696672, 0, 0, 0, 0, 4, '5', 0, 0, 0, 0, 0, 3194967, '03-15-1971', '1971-03-15', -1, -1, '198.23.167.137', 0, 1, 0, 0, -1, 0, 0, 'U7~3<g!UA,]tmx\\yc,54S}I@E.=!P`', 0, 0, 0, '', 0, 0, 0, 0, 0, 0, 0, 0, 0, 0, 0, 0, '', '', 0, '', 'vb', '', 0, 1, 0, 0, NULL),
(25110, 3, '', 0, 'shariqjawed', '211977bc65676b4e813511d821c96b9e', '2014-06-03', 'shariqjawed95@yahoo.com', 0, '', '', '', '', '', '', '', 2, 0, 'New Member', 0, 1401782586, 0, 1401782586, 1401782621, 0, 0, 0, 0, 4, '5', 0, 0, 0, 0, 0, 3194967, '06-25-1994', '1994-06-25', -1, -1, '113.203.235.9', 0, 1, 0, 0, -1, 0, 0, '`fyk-P!1YJ1hbH^ev>rdNm/9@78Rs5', 0, 0, 0, '', 0, 0, 0, 0, 0, 0, 0, 0, 0, 0, 0, 0, '', '', 0, '', 'vb', '', 0, 1, 0, 0, NULL),
(25087, 3, '', 0, 'KTherry', 'bfafdc5c26da37b59cfe109f50fa8a5c', '2014-06-02', 'tamrajprv@outlook.com', 0, '', '', '', '', '', '', '', 2, 0, 'New Member', 0, 1401712769, 0, 1401712769, 1401734895, 0, 0, 0, 0, 4, '5', 0, 0, 0, 0, 0, 3194967, '07-22-1980', '1980-07-22', -1, -1, '107.155.80.139', 0, 1, 0, 0, -1, 0, 0, '1M+GtTg;5eJMLn'':q!5EW*''p%#p''RZ', 0, 0, 0, '', 0, 0, 0, 0, 0, 0, 0, 0, 0, 0, 0, 0, '', '', 0, '', 'vb', '', 0, 1, 0, 0, NULL),
(25116, 2, '', 0, 'TheRainforest', '3a5a22a9328b41e342eef4035e954f42', '2014-06-03', 'booksandrivers@live.com', 0, '', '', '', '', '', '', '', 2, 0, 'New Member', 0, 1401808197, 0, 1401808197, 1401808678, 0, 0, 0, 0, 4, '5', 0, 0, 0, 0, 0, 3194967, '03-22-1985', '1985-03-22', -1, -1, '182.178.200.61', 0, 1, 0, 0, -1, 0, 0, 'H0d*HOH,qz?]KRfq]l\\0m=5M`yFEDP', 0, 0, 0, '', 0, 0, 1, 0, 0, 0, 0, 0, 0, 0, 0, 0, '', '', 0, '', 'vb', '', 0, 1, 0, 0, NULL),
(25089, 3, '', 0, 'batrickmtexaxda1248', '2bd46e149c0c68d37ca146169c855cc0', '2014-06-02', 'batrickmtexaxda@ymail.com', 0, '', '', '', '', '', '', '', 2, 0, 'New Member', 0, 1401719144, 0, 1401719144, 1401719144, 0, 0, 0, 0, 4, '-1', 0, 0, 0, 0, 0, 3195031, '04-16-1975', '1975-04-16', -1, -1, '123.192.79.102', 0, 1, 0, 0, -1, 0, 0, 'Zht6IbBBbd_%!_hMi15jV{%@$l'',T_', 0, 0, 0, '', 0, 0, 0, 0, 0, 0, 0, 0, 0, 0, 0, 0, '', '', 0, '', 'vb', '', 0, 1, 0, 0, NULL),
(25117, 3, '', 0, 'LArmstead', '5e9859856fceb8a00faf7843fe025d0e', '2014-06-03', 'burteysza@yahoo.com', 0, '', '', '', '', '', '', '', 2, 0, 'New Member', 0, 1401817501, 0, 1401817501, 1401817501, 0, 0, 0, 0, 4, '5', 0, 0, 0, 0, 0, 3194967, '08-18-1982', '1982-08-18', -1, -1, '188.165.83.235', 0, 1, 0, 0, -1, 0, 0, '^"cq+9t@;&fbl=G38UO*(|{vv]V&^&', 0, 0, 0, '', 0, 0, 0, 0, 0, 0, 0, 0, 0, 0, 0, 0, '', '', 0, '', 'vb', '', 0, 1, 0, 0, NULL),
(25091, 3, '', 0, 'DFowell', '76ed3882c13c0c6870c70edaa653dc64', '2014-06-02', 'fascinatedinsom285@outlook.com', 0, '', '', '', '', '', '', '', 2, 0, 'New Member', 0, 1401720301, 0, 1401720301, 1401722300, 0, 0, 0, 0, 4, '5', 0, 0, 0, 0, 0, 3194967, '08-28-1981', '1981-08-28', -1, -1, '192.227.253.248', 0, 1, 0, 0, -1, 0, 0, 'k*n{`wjh,O;>KDj)t-}kKH+YiIZ?0E', 0, 0, 0, '', 0, 0, 0, 0, 0, 0, 0, 0, 0, 0, 0, 0, '', '', 0, '', 'vb', '', 0, 1, 0, 0, NULL),
(25099, 3, '', 0, 'S18R', '5b6ccdf987ceb97854d1a23753ac061a', '2014-06-02', 'gracefulsermon10r881@outlook.com', 0, '', '', '', '', '', '', '', 2, 0, 'New Member', 0, 1401741463, 0, 1401741463, 1401744081, 0, 0, 0, 0, 4, '5', 0, 0, 0, 0, 0, 3194967, '08-01-1978', '1978-08-01', -1, -1, '108.186.244.67', 0, 1, 0, 0, -1, 0, 0, 'UIhHE$RM:V@N#)x%/k)hB1r_N_%/;D', 0, 0, 0, '', 0, 0, 0, 0, 0, 0, 0, 0, 0, 0, 0, 0, '', '', 0, '', 'vb', '', 0, 1, 0, 0, NULL),
(25100, 3, '', 0, 'abobyusasda8262', 'e6ac91ca47d9bcfd08feae403bc91cd6', '2014-06-02', 'abobyusasda@ymail.com', 0, '', '', '', '', '', '', '', 2, 0, 'New Member', 0, 1401741859, 0, 1401741859, 1401741859, 0, 0, 0, 0, 4, '-8', 0, 0, 0, 0, 0, 3195031, '06-25-1978', '1978-06-25', -1, -1, '64.40.147.164', 0, 1, 0, 0, -1, 0, 0, '""w!,X\\w''M`C:0HL^fjMxohUsqYGh4', 0, 0, 0, '', 0, 0, 0, 0, 0, 0, 0, 0, 0, 0, 0, 0, '', '', 0, '', 'vb', '', 0, 1, 0, 0, NULL),
(25101, 3, '', 0, 'waseem janu', '857e99a5376fd8d41dde6b4a816e3c17', '2014-06-02', 'waseem.janu.73@yahoo.com', 0, '', '', '', '', '', '', '', 2, 0, 'New Member', 0, 1401746866, 0, 1401746866, 1401747013, 0, 0, 0, 0, 4, '5', 0, 0, 0, 0, 0, 3195031, '03-06-1995', '1995-03-06', -1, -1, '182.189.60.101', 8551, 1, 0, 0, -1, 0, 0, 'exN:7GO:Eizo5^B_^Tw=P?pQF+xr,M', 0, 0, 0, '', 0, 0, 0, 0, 0, 0, 0, 0, 0, 0, 0, 0, '', '', 0, '', 'vb', '', 0, 1, 0, 0, NULL),
(25102, 3, '', 0, 'AMunday', '8cfc6d510c9d1046d5e615b04faf770a', '2014-06-03', 'heavypyramid573d32y@outlook.com', 0, '', '', '', '', '', '', '', 2, 0, 'New Member', 0, 1401750412, 0, 1401750412, 1401753690, 0, 0, 0, 0, 4, '5', 0, 0, 0, 0, 0, 3194967, '05-03-1976', '1976-05-03', -1, -1, '192.230.61.25', 0, 1, 0, 0, -1, 0, 0, 'm,movx1,|U^#0H-PVuLI-CTi''{]0;Q', 0, 0, 0, '', 0, 0, 0, 0, 0, 0, 0, 0, 0, 0, 0, 0, '', '', 0, '', 'vb', '', 0, 1, 0, 0, NULL),
(25096, 3, '', 0, 'GRodarte', 'ee5b5d57d950bd384c7a6b77b4b5d467', '2014-06-02', 'feignedportrait4gj17@outlook.com', 0, '', '', '', '', '', '', '', 2, 0, 'New Member', 0, 1401729585, 0, 1401729585, 1401732283, 0, 0, 0, 0, 4, '5', 0, 0, 0, 0, 0, 3194967, '07-18-1981', '1981-07-18', -1, -1, '192.126.161.169', 0, 1, 0, 0, -1, 0, 0, '=Q!A{}oGFMu5jlx!0}Kyp(~(Be4-+<', 0, 0, 0, '', 0, 0, 0, 0, 0, 0, 0, 0, 0, 0, 0, 0, '', '', 0, '', 'vb', '', 0, 1, 0, 0, NULL),
(25098, 2, '', 0, 'sami uddin qureshi', 'f2355555ead3a7679682c356eb22abda', '2014-06-02', 'samiuq@hotmail.com', 0, '', '', '', '', '', '', '', 2, 0, 'New Member', 0, 1401735544, 0, 1401735544, 1401735722, 0, 0, 0, 0, 4, '5', 0, 0, 0, 0, 0, 3194967, '03-29-1980', '1980-03-29', -1, -1, '39.44.242.130', 0, 1, 0, 0, -1, 0, 0, '=<^''Rq^*ZVEFWUaY..J9hZ7S&V6$S/', 0, 0, 0, '', 0, 0, 0, 0, 0, 0, 0, 0, 0, 0, 0, 0, '', '', 0, '', 'vb', '', 0, 1, 0, 0, NULL),
(25119, 3, '', 0, 'JParkes', '7c5a3b678bf0f16a38846426086a0ae3', '2014-06-03', 'smellyarson9254@outlook.com', 0, '', '', '', '', '', '', '', 2, 0, 'New Member', 0, 1401821016, 0, 1401821016, 1401828281, 0, 0, 0, 0, 4, '5', 0, 0, 0, 0, 0, 3194967, '02-03-1981', '1981-02-03', -1, -1, '23.105.213.214', 0, 1, 0, 0, -1, 0, 0, 'Y2,1Gn-f8(Ip(PFvj$]JN4E]xp~e#z', 0, 0, 0, '', 0, 0, 0, 0, 0, 0, 0, 0, 0, 0, 0, 0, '', '', 0, '', 'vb', '', 0, 1, 0, 0, NULL),
(25120, 3, '', 0, 'H9651', 'bab342ff17b6adc12b87bfd6f2c73b72', '2014-06-03', 'leoniesukhup@hotmail.com', 0, '', '', '', '', '', '', '', 2, 0, 'New Member', 0, 1401824429, 0, 1401824429, 1401827800, 0, 0, 0, 0, 4, '5', 0, 0, 0, 0, 0, 3194967, '12-30-1976', '1976-12-30', -1, -1, '190.77.58.246', 0, 1, 0, 0, -1, 0, 0, 'U,EA/lv<WzU(Sj3W/Sfb%/4}-M_C=J', 0, 0, 0, '', 0, 0, 0, 0, 0, 0, 0, 0, 0, 0, 0, 0, '', '', 0, '', 'vb', '', 0, 1, 0, 0, NULL),
(25121, 3, '', 0, 'VJCLC', '7e6da0db8be8ae5bb1d154716f28321f', '2014-06-03', 'vincenzo-rodrigues098574@outlook.com', 0, '', '', '', '', '', '', '', 2, 0, 'New Member', 0, 1401825354, 0, 1401825354, 1401901210, 0, 0, 0, 0, 4, '5', 0, 0, 0, 0, 0, 3194967, '01-19-1982', '1982-01-19', -1, -1, '162.250.232.72', 0, 1, 0, 0, -1, 0, 0, 'cR=?j~3=b77?3>sN|.?`wxSv0kD6N#', 0, 0, 0, '', 0, 0, 0, 0, 0, 0, 0, 0, 0, 0, 0, 0, '', '', 0, '', 'vb', '', 0, 1, 0, 0, NULL),
(25617, 3, '', 0, 'CMcKillop', '8746ea1eac738ee0c98439433b5a18e3', '2014-06-20', 'halfsnitch846801@outlook.com', 0, '', '', '', '', '', '', '', 2, 0, 'New Member', 0, 1403243187, 0, 1403243187, 1403245567, 0, 0, 0, 0, 4, '5', 0, 0, 0, 0, 0, 3194967, '06-28-1982', '1982-06-28', -1, -1, '209.161.99.71', 0, 1, 0, 0, -1, 0, 0, '3#R!bj,[Vf[,@rDbjK"d\\VD~0G|}''[', 0, 0, 0, '', 0, 0, 0, 0, 0, 0, 0, 0, 0, 0, 0, 0, '', '', 0, '', 'vb', '', 0, 1, 0, 0, NULL),
(25128, 3, '', 0, 'TBracken', 'd2a9bc2efe4d944e50ef9f4466fb1bc4', '2014-06-04', 'jonzazzkx@outlook.com', 0, '', '', '', '', '', '', '', 2, 0, 'New Member', 0, 1401843694, 0, 1401843694, 1401855851, 0, 0, 0, 0, 4, '5', 0, 0, 0, 0, 0, 3194967, '11-14-1976', '1976-11-14', -1, -1, '199.180.128.128', 0, 1, 0, 0, -1, 0, 0, 'F>W7%+8F&+."my4)U>V~u*eZ{3IYtQ', 0, 0, 0, '', 0, 0, 0, 0, 0, 0, 0, 0, 0, 0, 0, 0, '', '', 0, '', 'vb', '', 0, 1, 0, 0, NULL),
(25776, 3, '', 0, 'VX16', 'dce3b21b39d471b549d8548e52f6ffde', '2014-06-26', 'spuriousgash99763@outlook.com', 0, '', '', '', '', '', '', '', 2, 0, 'New Member', 0, 1403757741, 0, 1403757741, 1403779336, 0, 0, 0, 0, 4, '5', 0, 0, 0, 0, 0, 3194967, '10-25-1979', '1979-10-25', -1, -1, '87.98.173.250', 0, 1, 0, 0, -1, 0, 0, '6K(ib4UO$_JM(`fSkJ2Ll1kFMz*P(V', 0, 0, 0, '', 0, 0, 0, 0, 0, 0, 0, 0, 0, 0, 0, 0, '', '', 0, '', 'vb', '', 0, 1, 0, 0, NULL),
(25621, 2, '', 0, 'Razor Ali Khan', '4fc387a8e0983248cf01fcd2f0ab76ff', '2014-06-20', 'muhammadali.maqbool@gmail.com', 0, '', '', '', '', '', '', '', 2, 0, 'New Member', 0, 1403259943, 0, 1403260530, 1403787770, 0, 0, 0, 0, 4, '5', 0, 0, 0, 0, 0, 3194967, '05-22-1970', '1970-05-22', -1, -1, '119.152.247.115', 0, 1, 0, 0, -1, 0, 0, 'Gn19("f[A~XD~[8D]86''b8sIF>/bBO', 0, 0, 0, '', 0, 0, 0, 0, 0, 0, 0, 0, 0, 0, 0, 0, '', '', 0, '', 'vb', '', 0, 1, 0, 0, NULL),
(25341, 2, '', 0, 'zeeshan abbas khan', 'f1b21dd500c30cc6b93f8c7d32fbdd1e', '2014-06-11', 'zeeshanabbaskhan@yahoo.com', 0, '', '', '', '', '', '', '', 2, 0, 'New Member', 0, 1402490354, 0, 1402490634, 1402490863, 0, 0, 0, 0, 4, '5', 0, 0, 0, 0, 0, 3194967, '07-21-1977', '1977-07-21', -1, -1, '182.180.103.131', 0, 1, 0, 0, -1, 0, 0, 'IjWeL@l[VrXlxu&oLQsZ/>*GCYmVES', 0, 0, 0, '', 0, 0, 0, 0, 0, 0, 0, 0, 0, 0, 0, 0, '', '', 0, '', 'vb', '', 0, 1, 0, 0, NULL),
(25145, 3, '', 0, 'RAshcroft', 'cd0a3778af66d068ede5ede9a52e867e', '2014-06-04', 'leighfrzc@outlook.com', 0, '', '', '', '', '', '', '', 2, 0, 'New Member', 0, 1401900367, 0, 1401900367, 1401923287, 0, 0, 0, 0, 4, '5', 0, 0, 0, 0, 0, 3194967, '03-23-1976', '1976-03-23', -1, -1, '107.155.118.123', 0, 1, 0, 0, -1, 0, 0, 'lDB:1hB!]2^{ob)z<V&!MgCQq''+]\\A', 0, 0, 0, '', 0, 0, 0, 0, 0, 0, 0, 0, 0, 0, 0, 0, '', '', 0, '', 'vb', '', 0, 1, 0, 0, NULL),
(25135, 3, '', 0, 'LMJJV', 'aca35ed9f7ac2484ebb28f2031714546', '2014-06-04', 'juliannehqrxh@hotmail.com', 0, '', '', '', '', '', '', '', 2, 0, 'New Member', 0, 1401867396, 0, 1401867396, 1401870114, 0, 0, 0, 0, 4, '5', 0, 0, 0, 0, 0, 3194967, '05-27-1971', '1971-05-27', -1, -1, '79.126.126.164', 0, 1, 0, 0, -1, 0, 0, 'A5pKMJ{2u+1V=2$DUHS+c4svl(/K]v', 0, 0, 0, '', 0, 0, 0, 0, 0, 0, 0, 0, 0, 0, 0, 0, '', '', 0, '', 'vb', '', 0, 1, 0, 0, NULL),
(25151, 2, '', 0, 'saide', '801df9995a3fdfeff06bf7142b0de288', '2014-06-04', 'stepwellpk@gmail.com', 0, '', '', '', '', '', '', '', 2, 0, 'New Member', 0, 1401908674, 0, 1411808737, 1412523664, 1411728636, 460510, 1, 0, 4, '5', 0, 0, 0, 0, 0, 3194967, '10-05-1976', '1976-10-05', -1, -1, '182.187.38.143', 0, 1, 0, 0, -1, 0, 0, 'czJvi:8_Rh)A}7DHQ>m3E>iM+f>{0i', 0, 0, 0, '', 0, 0, 0, 0, 0, 0, 0, 0, 0, 0, 0, 0, '', '', 0, '', 'vb', '', 0, 1, 0, 0, NULL),
(25137, 3, '', 0, 'NTyson', 'a716683c6907d1a43fc16c17551650b9', '2014-06-04', 'rheba27kartye@yahoo.com', 0, '', '', '', '', '', '', '', 2, 0, 'New Member', 0, 1401872224, 0, 1401872224, 1401896241, 0, 0, 0, 0, 4, '5', 0, 0, 0, 0, 0, 3194967, '03-10-1977', '1977-03-10', -1, -1, '107.155.75.19', 0, 1, 0, 0, -1, 0, 0, ':~@?QlQ&~73m"h1"s^}jS9hb76u9<)', 0, 0, 0, '', 0, 0, 0, 0, 0, 0, 0, 0, 0, 0, 0, 0, '', '', 0, '', 'vb', '', 0, 1, 0, 0, NULL),
(25138, 3, '', 0, 'VRaney', '8eea42c7555a4644052726e9ecae1eea', '2014-06-04', 'gsabsat2@howitsdone.net', 0, '', '', '', '', '', '', '', 2, 0, 'New Member', 0, 1401872787, 0, 1401872787, 1401874957, 0, 0, 0, 0, 4, '5', 0, 0, 0, 0, 0, 3194967, '07-12-1973', '1973-07-12', -1, -1, '107.182.115.64', 0, 1, 0, 0, -1, 0, 0, '2r:*nn1z&mlCj#T\\q.7o8NV?x}P$o=', 0, 0, 0, '', 0, 0, 0, 0, 0, 0, 0, 0, 0, 0, 0, 0, '', '', 0, '', 'vb', '', 0, 1, 0, 0, NULL),
(25733, 3, '', 0, 'BMayorga', '37418089703f8d761f41f898f6dd8270', '2014-06-24', 'lavishpoker358155@outlook.com', 0, '', '', '', '', '', '', '', 2, 0, 'New Member', 0, 1403613792, 0, 1403613792, 1403613792, 0, 0, 0, 0, 4, '5', 0, 0, 0, 0, 0, 3194967, '08-03-1983', '1983-08-03', -1, -1, '37.59.77.72', 0, 1, 0, 0, -1, 0, 0, 'EN4bi@D"Yl\\Wnmj6%a^ba5&O''-lzj''', 0, 0, 0, '', 0, 0, 0, 0, 0, 0, 0, 0, 0, 0, 0, 0, '', '', 0, '', 'vb', '', 0, 1, 0, 0, NULL),
(25648, 3, '', 0, 'D3923', '75942213b31217de8dfb8a4158ec665a', '2014-06-21', 'daniella_sikora17@leagueoflegendscodesgratuit.fr', 0, '', '', '', '', '', '', '', 2, 0, 'New Member', 0, 1403355129, 0, 1403355129, 1403362322, 0, 0, 0, 0, 4, '5', 0, 0, 0, 0, 0, 3194967, '07-06-1971', '1971-07-06', -1, -1, '107.182.115.163', 0, 1, 0, 0, -1, 0, 0, 'aQHg"}n1MkzE4+Hpd[\\Ev34dHF`E/`', 0, 0, 0, '', 0, 0, 0, 0, 0, 0, 0, 0, 0, 0, 0, 0, '', '', 0, '', 'vb', '', 0, 1, 0, 0, NULL),
(25140, 3, '', 0, 'JCvm', '9ba4e23d1398705291fac526f08788c2', '2014-06-04', 'narrowcore52zg259@outlook.com', 0, '', '', '', '', '', '', '', 2, 0, 'New Member', 0, 1401878002, 0, 1401878002, 1401880187, 0, 0, 0, 0, 4, '5', 0, 0, 0, 0, 0, 3194967, '08-16-1980', '1980-08-16', -1, -1, '192.126.163.145', 0, 1, 0, 0, -1, 0, 0, 'rr&)]Eka=R]J/$Z<b?MJm3f=.!2|*Q', 0, 0, 0, '', 0, 0, 0, 0, 0, 0, 0, 0, 0, 0, 0, 0, '', '', 0, '', 'vb', '', 0, 1, 0, 0, NULL),
(25152, 3, '', 0, 'BWoodward', '38dce84131a6c3800c43cdf58af271c2', '2014-06-04', 'louisfnjwn@yahoo.com', 0, '', '', '', '', '', '', '', 2, 0, 'New Member', 0, 1401910790, 0, 1401910790, 1401910790, 0, 0, 0, 0, 4, '5', 0, 0, 0, 0, 0, 3194967, '01-03-1970', '1970-01-03', -1, -1, '46.105.156.229', 0, 1, 0, 0, -1, 0, 0, 'Q251su,I)L%P|T335>P38BU1=GW*Ih', 0, 0, 0, '', 0, 0, 0, 0, 0, 0, 0, 0, 0, 0, 0, 0, '', '', 0, '', 'vb', '', 0, 1, 0, 0, NULL),
(25330, 2, '', 0, 'omar_hunter', '507621c5a586d2d5faa251825ff4787d', '2014-06-11', 'omar.company2000@yahoo.com', 0, '', '', '', '', '', '', '', 2, 0, 'New Member', 0, 1402467283, 0, 1402467283, 1402468533, 0, 0, 0, 0, 4, '5', 0, 0, 0, 0, 0, 3194967, '06-22-1978', '1978-06-22', -1, -1, '41.239.10.17', 790, 1, 0, 0, -1, 0, 0, '6!{DI''m6rgBak8Y-`XC?Y\\+.Ht$:+7', 0, 0, 0, '', 0, 0, 0, 0, 0, 0, 0, 0, 0, 0, 0, 0, '', '', 0, '', 'vb', '', 0, 1, 0, 0, NULL),
(25820, 2, '', 0, 'shabirbrothers', 'b01d8663fc7186f41295fb7c3194ed6a', '2014-06-28', 'shabirbrothers@live.com', 0, '', '', '', '', '', '', '', 2, 0, 'New Member', 0, 1403941298, 0, 1403941571, 1404200981, 0, 0, 0, 0, 4, '5', 0, 0, 0, 0, 0, 3194967, '09-19-1981', '1981-09-19', -1, -1, '64.40.147.108', 0, 1, 0, 0, -1, 0, 0, 'ruBF%W)4-YweopO^4@<%i[Dc^M:>3L', 0, 0, 0, '', 0, 0, 0, 0, 0, 0, 0, 0, 0, 0, 0, 0, '', '', 0, '', 'vb', '', 0, 1, 0, 0, NULL),
(25332, 3, '', 0, 'MWechsler', '21bf18890404417b7d6ae786439ea3ea', '2014-06-11', 'margret.wechsler@chiasetrongngay.com', 0, '', '', '', '', '', '', '', 2, 0, 'New Member', 0, 1402473760, 0, 1402473760, 1402480904, 0, 0, 0, 0, 4, '5', 0, 0, 0, 0, 0, 3194967, '06-30-1982', '1982-06-30', -1, -1, '198.167.137.163', 0, 1, 0, 0, -1, 0, 0, 'K0p4J+C;+NNX|:FfcJ^5d@JN_zZZoe', 0, 0, 0, '', 0, 0, 0, 0, 0, 0, 0, 0, 0, 0, 0, 0, '', '', 0, '', 'vb', '', 0, 1, 0, 0, NULL),
(25830, 3, '', 0, 'OY82', 'd06b85a0b9957ad8908b5d68a2a59ca5', '2014-06-29', 'otilia-dryer@nouvebelleskin.net', 0, '', '', '', '', '', '', '', 2, 0, 'New Member', 0, 1404010040, 0, 1404010040, 1404010040, 0, 0, 0, 0, 4, '5', 0, 0, 0, 0, 0, 3194967, '09-29-1984', '1984-09-29', -1, -1, '23.94.243.224', 0, 1, 0, 0, -1, 0, 0, '{}qGd??j6hCG$\\U/":\\-+L`P|E"v:2', 0, 0, 0, '', 0, 0, 0, 0, 0, 0, 0, 0, 0, 0, 0, 0, '', '', 0, '', 'vb', '', 0, 1, 0, 0, NULL),
(25577, 3, '', 0, 'NOuttrim', 'f14e5ad1d4954d03f75ec1f261013f12', '2014-06-18', 'mmehxcxa@yahoo.com', 0, '', '', '', '', '', '', '', 2, 0, 'New Member', 0, 1403121287, 0, 1403121287, 1403121287, 0, 0, 0, 0, 4, '5', 0, 0, 0, 0, 0, 3194967, '10-24-1972', '1972-10-24', -1, -1, '198.50.136.109', 0, 1, 0, 0, -1, 0, 0, '72]$)?qd2%NHl|%b''6TB3Zf^4e%Ae=', 0, 0, 0, '', 0, 0, 0, 0, 0, 0, 0, 0, 0, 0, 0, 0, '', '', 0, '', 'vb', '', 0, 1, 0, 0, NULL),
(26030, 2, '', 0, 'deardeparted', '35ef541cbd12561d77c484e7d69d0db9', '2014-07-06', 'littlewoodspace@gmail.com', 0, '', '', '', '', '', '', '', 2, 0, 'New Member', 0, 1404679687, 0, 1404679687, 1404679687, 0, 0, 0, 0, 4, '5', 0, 0, 0, 0, 0, 3194967, '01-01-1980', '1980-01-01', -1, -1, '39.32.211.1', 0, 1, 0, 0, -1, 0, 0, '@B&QH<]KX)&bTQ$OB!H"|%BtsCPzG>', 0, 0, 0, '', 0, 0, 0, 0, 0, 0, 0, 0, 0, 0, 0, 0, '', '', 0, '', 'vb', '', 0, 1, 0, 0, NULL),
(25854, 3, '', 0, 'EPersse', '20c91f4743614c96200da3a58735a490', '2014-06-30', 'allegeddirectiv5634@outlook.com', 0, '', '', '', '', '', '', '', 2, 0, 'New Member', 0, 1404084134, 0, 1404084134, 1404087167, 0, 0, 0, 0, 4, '5', 0, 0, 0, 0, 0, 3194967, '09-14-1973', '1973-09-14', -1, -1, '46.105.189.182', 0, 1, 0, 0, -1, 0, 0, 'oNv}@;Jrd=gmJZ/?:BmqgDT9C,m>5=', 0, 0, 0, '', 0, 0, 0, 0, 0, 0, 0, 0, 0, 0, 0, 0, '', '', 0, '', 'vb', '', 0, 1, 0, 0, NULL),
(25337, 3, '', 0, 'RKhawer', 'c2aa52d24e678e4057e3193d983364ed', '2014-06-11', 'Raheel_khawer@hotmail.com', 0, '', '', '', '', '', '', '', 2, 0, 'New Member', 0, 1402482581, 0, 1402482581, 1402483306, 0, 0, 0, 0, 4, '5', 0, 0, 0, 0, 0, 3194967, '12-28-1981', '1981-12-28', -1, -1, '61.5.135.163', 0, 1, 0, 0, -1, 0, 0, 'P5-vEk+[[n5-C;ef1D`[pmst^LO!#*', 0, 0, 0, '', 0, 0, 0, 0, 0, 0, 0, 0, 0, 0, 0, 0, '', '', 0, '', 'vb', '', 0, 1, 0, 0, NULL),
(25161, 3, '', 0, 'CQbe', 'ad07d83819184a783dc7489deca631f8', '2014-06-05', 'antonettavdrlej@outlook.com', 0, '', '', '', '', '', '', '', 2, 0, 'New Member', 0, 1401935818, 0, 1401935818, 1401935818, 0, 0, 0, 0, 4, '5', 0, 0, 0, 0, 0, 3194967, '10-20-1974', '1974-10-20', -1, -1, '204.44.83.189', 0, 1, 0, 0, -1, 0, 0, 'FK&ek''P[YC4YQ(Luo$%mr*I@3/0xg(', 0, 0, 0, '', 0, 0, 0, 0, 0, 0, 0, 0, 0, 0, 0, 0, '', '', 0, '', 'vb', '', 0, 1, 0, 0, NULL),
(25162, 3, '', 0, 'OReeder', '452cc30c711ffcd284809f9d2b93c713', '2014-06-05', 'hryniews.k.iemi.l@gmail.com', 0, '', '', '', '', '', '', '', 2, 0, 'New Member', 0, 1401937878, 0, 1401937878, 1401940170, 0, 0, 0, 0, 4, '5', 0, 0, 0, 0, 0, 3194967, '08-04-1979', '1979-08-04', -1, -1, '23.108.74.67', 0, 1, 0, 0, -1, 0, 0, 'qYWss1PkYxRvD;|wD("@b8V#<wHB\\+', 0, 0, 0, '', 0, 0, 0, 0, 0, 0, 0, 0, 0, 0, 0, 0, '', '', 0, '', 'vb', '', 0, 1, 0, 0, NULL),
(25163, 3, '', 0, 'Timur Shah', '9ac3daffea7e7bd41c39563dd18e0f89', '2015-09-04', 'captaintimur@hotmail.com', 0, '', '', '', '', '', '', '', 2, 0, 'New Member', 0, 1401949308, 0, 1401949539, 1441516428, 0, 0, 0, 0, 4, '5', 0, 0, 0, 0, 0, 3194967, '10-24-1964', '1964-10-24', -1, -1, '178.152.46.208', 0, 1, 0, 0, -1, 0, 0, '`_FL^Q~<86V!!N*$VfDYFIU{"}g-/%', 0, 0, 0, '', 0, 0, 0, 0, 0, 0, 0, 0, 0, 0, 0, 0, '', '', 0, '', 'vb', '', 0, 1, 0, 0, NULL),
(25392, 3, '', 0, 'STiegs', 'b588fb07edff366e96aa638352f6c885', '2014-06-13', 'vitarue240@hotmail.com', 0, '', '', '', '', '', '', '', 2, 0, 'New Member', 0, 1402620902, 0, 1402620902, 1402623079, 0, 0, 0, 0, 4, '5', 0, 0, 0, 0, 0, 3194967, '03-29-1979', '1979-03-29', -1, -1, '46.146.229.3', 0, 1, 0, 0, -1, 0, 0, ')l-bv2ncw''S[Io5O#,6O.AB7.I8SG1', 0, 0, 0, '', 0, 0, 0, 0, 0, 0, 0, 0, 0, 0, 0, 0, '', '', 0, '', 'vb', '', 0, 1, 0, 0, NULL),
(25166, 3, '', 0, 'THyatt', '43f31c05c5318cbac35c37af16fa108e', '2014-06-05', 'numbersvdhhrf@outlook.com', 0, '', '', '', '', '', '', '', 2, 0, 'New Member', 0, 1401963974, 0, 1401963974, 1401963974, 0, 0, 0, 0, 4, '5', 0, 0, 0, 0, 0, 3194967, '03-24-1975', '1975-03-24', -1, -1, '69.12.84.29', 0, 1, 0, 0, -1, 0, 0, '0w-F;Xk''%`mpnpuL.{(r/7FbpFFY4g', 0, 0, 0, '', 0, 0, 0, 0, 0, 0, 0, 0, 0, 0, 0, 0, '', '', 0, '', 'vb', '', 0, 1, 0, 0, NULL),
(25167, 3, '', 0, 'MBosanque', 'dcef15199959d80cb47303d362c74a69', '2014-06-05', 'merri.bosanquet60@carbulosss.com', 0, '', '', '', '', '', '', '', 2, 0, 'New Member', 0, 1401971207, 0, 1401971207, 1401983171, 0, 0, 0, 0, 4, '5', 0, 0, 0, 0, 0, 3194967, '01-29-1975', '1975-01-29', -1, -1, '199.119.227.150', 0, 1, 0, 0, -1, 0, 0, 'YO]WN~i;qTKvvCzW8S8S;eS@&>r7nW', 0, 0, 0, '', 0, 0, 0, 0, 0, 0, 0, 0, 0, 0, 0, 0, '', '', 0, '', 'vb', '', 0, 1, 0, 0, NULL),
(25168, 3, '', 0, 'JPurdy', 'f185f807689395723423149752b9a394', '2014-06-05', 'clara-boatman623191@outlook.com', 0, '', '', '', '', '', '', '', 2, 0, 'New Member', 0, 1401988003, 0, 1401988003, 1402000292, 0, 0, 0, 0, 4, '5', 0, 0, 0, 0, 0, 3194967, '04-21-1971', '1971-04-21', -1, -1, '165.231.1.115', 0, 1, 0, 0, -1, 0, 0, ']YOk000u6+IR(7e:.SHO%{):amj=7@', 0, 0, 0, '', 0, 0, 0, 0, 0, 0, 0, 0, 0, 0, 0, 0, '', '', 0, '', 'vb', '', 0, 1, 0, 0, NULL),
(25169, 3, '', 0, 'SEllswort', 'e33f914183e9ab27e7d4ae64e4ebd123', '2014-06-05', 'chelseaciipde@outlook.com', 0, '', '', '', '', '', '', '', 2, 0, 'New Member', 0, 1401988842, 0, 1401988842, 1403073356, 0, 0, 0, 0, 4, '5', 0, 0, 0, 0, 0, 3194967, '11-12-1971', '1971-11-12', -1, -1, '69.12.77.141', 0, 1, 0, 0, -1, 0, 0, '~A`E|%Z9IJG$AbHPT)i0D"I<+>3Wj''', 0, 0, 0, '', 0, 0, 0, 0, 0, 0, 0, 0, 0, 0, 0, 0, '', '', 0, '', 'vb', '', 0, 1, 0, 0, NULL),
(25171, 3, '', 0, 'KZGA', '58a8939834c886e8d6fb7d19eecc2d9c', '2014-06-05', 'annett.clarke@outlook.com', 0, '', '', '', '', '', '', '', 2, 0, 'New Member', 0, 1401991765, 0, 1401991765, 1401991765, 0, 0, 0, 0, 4, '5', 0, 0, 0, 0, 0, 3194967, '03-28-1976', '1976-03-28', -1, -1, '173.234.232.10', 0, 1, 0, 0, -1, 0, 0, 'M#/V&"**N(@,xp9~/fb#a0s$F}<nwK', 0, 0, 0, '', 0, 0, 0, 0, 0, 0, 0, 0, 0, 0, 0, 0, '', '', 0, '', 'vb', '', 0, 1, 0, 0, NULL),
(25172, 2, '', 0, 'waseem.khan', '66eb0ebd6b4df6f5c6f2e23ad50bb0d8', '2014-06-05', 'waseem.khan51990@gmail.com', 0, '', '', '', '', '', '', '', 2, 0, 'New Member', 0, 1401993637, 0, 1401993637, 1401994037, 0, 0, 0, 0, 4, '5', 0, 0, 0, 0, 0, 3194967, '05-14-1990', '1990-05-14', -1, -1, '39.33.232.211', 790, 1, 0, 0, -1, 0, 0, 'c6%Bedc#$?2)KGa2:V%`q[]Go%&y_=', 0, 0, 0, '', 0, 0, 0, 0, 0, 0, 0, 0, 0, 0, 0, 0, '', '', 0, '', 'vb', '', 0, 1, 0, 0, NULL),
(25174, 3, '', 0, 'NAlarcon', '33d69baaaeaba57e2cec6e42764508ce', '2014-06-05', 'neal.alarcon32@tipbongmoingay.info', 0, '', '', '', '', '', '', '', 2, 0, 'New Member', 0, 1402001380, 0, 1402001380, 1402004377, 0, 0, 0, 0, 4, '5', 0, 0, 0, 0, 0, 3194967, '06-17-1978', '1978-06-17', -1, -1, '23.82.64.57', 0, 1, 0, 0, -1, 0, 0, '`K75?,{|NLWwDT4RD0GLDwInfG=)7n', 0, 0, 0, '', 0, 0, 0, 0, 0, 0, 0, 0, 0, 0, 0, 0, '', '', 0, '', 'vb', '', 0, 1, 0, 0, NULL),
(25426, 3, '', 0, 'AEMDH', 'ac62aa2686afe43f10ca22d4e5211758', '2014-06-14', 'nvddeldibw@hotmail.com', 0, '', '', '', '', '', '', '', 2, 0, 'New Member', 0, 1402723354, 0, 1402723354, 1402725455, 0, 0, 0, 0, 4, '5', 0, 0, 0, 0, 0, 3194967, '02-14-1970', '1970-02-14', -1, -1, '93.118.72.9', 0, 1, 0, 0, -1, 0, 0, '*h&G1*GsL$2$5D8UZJHbFyHu0IlCsG', 0, 0, 0, '', 0, 0, 0, 0, 0, 0, 0, 0, 0, 0, 0, 0, '', '', 0, '', 'vb', '', 0, 1, 0, 0, NULL),
(25356, 3, '', 0, 'eveasmaarey4586', 'fa8c474422f703605314f4d717b7009c', '2014-06-12', 'eveasmaarey@ymail.com', 0, '', '', '', '', '', '', '', 2, 0, 'New Member', 0, 1402534266, 0, 1402534266, 1402534266, 0, 0, 0, 0, 4, '-6', 0, 0, 0, 0, 0, 3195031, '06-15-1985', '1985-06-15', -1, -1, '180.242.71.218', 0, 1, 0, 0, -1, 0, 0, 'o_gSX{VM&6^e$!Z2o=}$s$(~1uk/{>', 0, 0, 0, '', 0, 0, 0, 0, 0, 0, 0, 0, 0, 0, 0, 0, '', '', 0, '', 'vb', '', 0, 1, 0, 0, NULL),
(25177, 3, '', 0, 'L9970', '0e10bb2a2ecb32e8c7edea66dff146b3', '2014-06-05', 'lisa-mortensen@larhonda.progrespoland.com', 0, '', '', '', '', '', '', '', 2, 0, 'New Member', 0, 1402008774, 0, 1402008774, 1402016358, 0, 0, 0, 0, 4, '5', 0, 0, 0, 0, 0, 3194967, '04-19-1975', '1975-04-19', -1, -1, '83.21.90.110', 0, 1, 0, 0, -1, 0, 0, '.bP(}f0<M}W$JW$iZi:`&h-|Fd_c|F', 0, 0, 0, '', 0, 0, 0, 0, 0, 0, 0, 0, 0, 0, 0, 0, '', '', 0, '', 'vb', '', 0, 1, 0, 0, NULL),
(25429, 3, '', 0, 'SBpj', '8e571fb1c7f8f9d84e920b8dc3f3bb9a', '2014-06-14', 'canexsn@outlook.com', 0, '', '', '', '', '', '', '', 2, 0, 'New Member', 0, 1402726953, 0, 1402726953, 1403045827, 0, 0, 0, 0, 4, '5', 0, 0, 0, 0, 0, 3194967, '04-13-1972', '1972-04-13', -1, -1, '173.208.46.92', 0, 1, 0, 0, -1, 0, 0, 'J:L*ohyP)/<x6Bsxk`h]1j^JBoD7g*', 0, 0, 0, '', 0, 0, 0, 0, 0, 0, 0, 0, 0, 0, 0, 0, '', '', 0, '', 'vb', '', 0, 1, 0, 0, NULL),
(25739, 3, '', 0, 'GNhy', 'f41b940a8e8f196507d5740c41b4b6d7', '2014-06-24', 'exinalpag1973@yahoo.com', 0, '', '', '', '', '', '', '', 2, 0, 'New Member', 0, 1403645266, 0, 1403645266, 1403647386, 0, 0, 0, 0, 4, '5', 0, 0, 0, 0, 0, 3194967, '07-30-1977', '1977-07-30', -1, -1, '192.99.141.120', 0, 1, 0, 0, -1, 0, 0, 'O*EtU+Zci)%7[mMwo5ck.![_Wq)}qi', 0, 0, 0, '', 0, 0, 0, 0, 0, 0, 0, 0, 0, 0, 0, 0, '', '', 0, '', 'vb', '', 0, 1, 0, 0, NULL),
(26175, 2, '', 0, 'niazi 1', '96ae4bd67ddf827be129d0d7854db2d6', '2014-07-12', 'niazijawadkhan@yahoo.com', 0, '', '', '', '', '', '', '', 2, 0, 'New Member', 0, 1405153602, 0, 1405154001, 1405154001, 0, 0, 0, 0, 4, '5', 0, 0, 0, 0, 0, 3194967, '02-18-1992', '1992-02-18', -1, -1, '182.189.136.188', 0, 1, 0, 0, -1, 0, 0, '2@9059)pr*w+9flXWzQvNAjR~6#9|7', 0, 0, 0, '', 0, 0, 0, 0, 0, 0, 0, 0, 0, 0, 0, 0, '', '', 0, '', 'vb', '', 0, 1, 0, 0, NULL),
(25992, 3, '', 0, 'SUPM', 'b5512c8565d9dbab40c6facfad6a96e8', '2014-07-05', 'relievedrubbishkx54c@outlook.com', 0, '', '', '', '', '', '', '', 2, 0, 'New Member', 0, 1404575955, 0, 1404575955, 1404666195, 0, 0, 0, 0, 4, '5', 0, 0, 0, 0, 0, 3194967, '11-02-1983', '1983-11-02', -1, -1, '5.39.32.103', 0, 1, 0, 0, -1, 0, 0, 'U&zp-Z"t0~f3JV8/egAWL~H*a9>4+$', 0, 0, 0, '', 0, 0, 0, 0, 0, 0, 0, 0, 0, 0, 0, 0, '', '', 0, '', 'vb', '', 0, 1, 0, 0, NULL),
(25813, 3, '', 0, 'MIMHR', 'acaa17687a72feb9c062cd5785745335', '2014-06-28', 'mollie.fernandez52@airforce.elk.pl', 0, '', '', '', '', '', '', '', 2, 0, 'New Member', 0, 1403918516, 0, 1403918516, 1403926970, 0, 0, 0, 0, 4, '5', 0, 0, 0, 0, 0, 3194967, '11-16-1977', '1977-11-16', -1, -1, '198.11.224.186', 0, 1, 0, 0, -1, 0, 0, 'u(-ie2t}$z,?(BY*5<PIqJ)rH70rO(', 0, 0, 0, '', 0, 0, 0, 0, 0, 0, 0, 0, 0, 0, 0, 0, '', '', 0, '', 'vb', '', 0, 1, 0, 0, NULL),
(25637, 2, '', 0, 'Zarb', '887baad42fd92c9812ba2c9bc9fe9e3d', '2014-06-20', 'meraj.hasan@hotmail.com', 0, '', '', '', '', '', '', '', 2, 0, 'New Member', 0, 1403303267, 0, 1408460427, 1412352480, 1407345005, 453548, 11, 0, 4, '5', 0, 0, 0, 0, 0, 3194967, '03-16-1988', '1988-03-16', -1, -1, '39.47.242.138', 0, 1, 0, 0, -1, 0, 0, 'd~j[p?g7k,Du:5s077xI1IF.ya\\O,M', 0, 0, 0, '', 0, 0, 0, 0, 0, 0, 0, 0, 0, 0, 0, 0, '', '', 0, '', 'vb', '', 0, 1, 0, 0, NULL),
(25867, 3, '', 0, 'mian umar farooq', '2fb39133a88e4bd71571a73bf5ed60d9', '2014-06-30', 'umarfarooq412@yahoo.com', 0, '', '', '', '', '', '', '', 2, 0, 'New Member', 0, 1404138098, 0, 1404138098, 1404138098, 0, 0, 0, 0, 4, '5', 0, 0, 0, 0, 0, 3194967, '09-29-1994', '1994-09-29', -1, -1, '59.103.198.143', 0, 1, 0, 0, -1, 0, 0, 'U><%.SwVJ7;XrcD|Tk%VpE''j]~=QrS', 0, 0, 0, '', 0, 0, 0, 0, 0, 0, 0, 0, 0, 0, 0, 0, '', '', 0, '', 'vb', '', 0, 1, 0, 0, NULL),
(25788, 3, '', 0, 'DZweig', 'b1bddf3d0652de0719d49b9b7a764ab2', '2014-06-26', 'sachiko2zpalakiko@yahoo.com', 0, '', '', '', '', '', '', '', 2, 0, 'New Member', 0, 1403806646, 0, 1403806646, 1403838128, 0, 0, 0, 0, 4, '5', 0, 0, 0, 0, 0, 3194967, '02-25-1982', '1982-02-25', -1, -1, '192.3.183.44', 0, 1, 0, 0, -1, 0, 0, '`u=*G"E(\\-r0lR60''6z(5wqdpj`gZ!', 0, 0, 0, '', 0, 0, 0, 0, 0, 0, 0, 0, 0, 0, 0, 0, '', '', 0, '', 'vb', '', 0, 1, 0, 0, NULL),
(25382, 2, '', 0, 'Nabeel_102', '4b073f5df172317520e65b85919fc020', '2014-06-12', 'nabeel_102@yahoo.com', 0, '', '', '', '', '', '', '', 2, 0, 'New Member', 0, 1402585749, 0, 1406455618, 1409133425, 1406455617, 452087, 1, 0, 4, '5', 0, 0, 0, 0, 0, 3194967, '09-26-1986', '1986-09-26', -1, -1, '115.186.185.198', 0, 1, 0, 0, -1, 0, 0, 'F>HAC,vxp~NV<r[n,8#x"]5?*vM,3U', 0, 0, 0, '', 0, 0, 1, 0, 0, 0, 0, 0, 0, 0, 0, 0, '', '', 0, '', 'vb', '', 0, 1, 0, 0, NULL),
(25184, 3, '', 0, 'LBladen', 'dcfa572bf57077f63d287fb138c88a17', '2014-06-06', 'prefhouscaegros1980@yahoo.com', 0, '', '', '', '', '', '', '', 2, 0, 'New Member', 0, 1402033636, 0, 1402033636, 1402095437, 0, 0, 0, 0, 4, '5', 0, 0, 0, 0, 0, 3194967, '12-26-1982', '1982-12-26', -1, -1, '204.44.92.104', 0, 1, 0, 0, -1, 0, 0, '(89P:lo]E"eT&>mQZCyua}*L$J6w_E', 0, 0, 0, '', 0, 0, 0, 0, 0, 0, 0, 0, 0, 0, 0, 0, '', '', 0, '', 'vb', '', 0, 1, 0, 0, NULL),
(25548, 3, '', 0, 'BAHYX', '7b74a54410dec3e38e013b19d18d05cc', '2014-06-18', 'venicepsqyhy@outlook.com', 0, '', '', '', '', '', '', '', 2, 0, 'New Member', 0, 1403046250, 0, 1403046250, 1403046250, 0, 0, 0, 0, 4, '5', 0, 0, 0, 0, 0, 3194967, '12-08-1976', '1976-12-08', -1, -1, '107.158.23.202', 0, 1, 0, 0, -1, 0, 0, 'Xy^crNKLicMp5K?/iwpmbp951Hj.*$', 0, 0, 0, '', 0, 0, 0, 0, 0, 0, 0, 0, 0, 0, 0, 0, '', '', 0, '', 'vb', '', 0, 1, 0, 0, NULL),
(25713, 3, '', 0, 'SG80', '901f691e39ac2d1f0fbbf61ffc00fa13', '2014-06-23', 'qpeasantexb@yahoo.com', 0, '', '', '', '', '', '', '', 2, 0, 'New Member', 0, 1403538039, 0, 1403538039, 1403538039, 0, 0, 0, 0, 4, '5', 0, 0, 0, 0, 0, 3194967, '01-21-1980', '1980-01-21', -1, -1, '50.115.171.218', 0, 1, 0, 0, -1, 0, 0, '[py''\\PU]H:+N"bgSb!51|t7I.q<",H', 0, 0, 0, '', 0, 0, 0, 0, 0, 0, 0, 0, 0, 0, 0, 0, '', '', 0, '', 'vb', '', 0, 1, 0, 0, NULL),
(25403, 3, '', 0, 'PNeubauer', '00013be78d6c101586369dc957548ce2', '2014-06-13', 'candyxfjrbj@outlook.com', 0, '', '', '', '', '', '', '', 2, 0, 'New Member', 0, 1402654733, 0, 1402654733, 1402685728, 0, 0, 0, 0, 4, '5', 0, 0, 0, 0, 0, 3194967, '04-13-1978', '1978-04-13', -1, -1, '216.107.159.124', 0, 1, 0, 0, -1, 0, 0, 'N/=nI)TSz`k,)ypqB>Ov9lE@aj]rU6', 0, 0, 0, '', 0, 0, 0, 0, 0, 0, 0, 0, 0, 0, 0, 0, '', '', 0, '', 'vb', '', 0, 1, 0, 0, NULL),
(25728, 2, '', 0, 'Mohamed', '82dd898fe7dd229ef58b27b111298673', '2014-06-24', 'al_ia_ss@yahoo.com', 0, '', '', '', '', '', '', '', 2, 0, 'New Member', 0, 1403604134, 0, 1403604179, 1403606054, 0, 0, 0, 0, 4, '5', 0, 0, 0, 0, 0, 3194967, '12-25-1983', '1983-12-25', -1, -1, '80.76.175.172', 0, 1, 0, 0, -1, 0, 0, '?kntzw''Tyj-\\j)$|=Zam?xjammOAY>', 0, 0, 0, '', 0, 0, 0, 0, 0, 0, 0, 0, 0, 0, 0, 0, '', '', 0, '', 'vb', '', 0, 1, 0, 0, NULL),
(25190, 3, '', 0, 'mill0ping3k', 'f3cc0f66586d002456326da0fabc68a8', '2014-06-06', 'millingcnd+xmc@gmail.com', 0, '', '', '', '', '', '', '', 2, 0, 'New Member', 0, 1402046049, 0, 1402046049, 1402047503, 0, 0, 0, 0, 4, '-11', 0, 0, 0, 0, 0, 3195031, '06-21-1982', '1982-06-21', -1, -1, '174.139.80.66', 0, 1, 0, 0, -1, 0, 0, 'D~`(9B/"(6i2Z#$E(ACc>mh(z''sM.:', 0, 0, 0, '', 0, 0, 0, 0, 0, 0, 0, 0, 0, 0, 0, 0, '', '', 0, '', 'vb', '', 0, 1, 0, 0, NULL),
(25191, 3, '', 0, 'TBoxer', '8c711ec36ec489c9071e422ae5f1bcb6', '2014-06-06', 'tocomarle1972@yahoo.com', 0, '', '', '', '', '', '', '', 2, 0, 'New Member', 0, 1402047489, 0, 1402047489, 1402097967, 0, 0, 0, 0, 4, '5', 0, 0, 0, 0, 0, 3194967, '01-14-1977', '1977-01-14', -1, -1, '37.59.73.93', 0, 1, 0, 0, -1, 0, 0, 'C-Nv8fz|87sd{P1;C2a-$N''iAz!i"M', 0, 0, 0, '', 0, 0, 0, 0, 0, 0, 0, 0, 0, 0, 0, 0, '', '', 0, '', 'vb', '', 0, 1, 0, 0, NULL),
(25192, 3, '', 0, 'JDLFU', '011363d6415b0a93bf2bc9184dd94850', '2014-06-06', 'doungayk@hotmail.com', 0, '', '', '', '', '', '', '', 2, 0, 'New Member', 0, 1402048100, 0, 1402048100, 1402055359, 0, 0, 0, 0, 4, '5', 0, 0, 0, 0, 0, 3194967, '01-29-1970', '1970-01-29', -1, -1, '142.4.196.238', 0, 1, 0, 0, -1, 0, 0, ']z$V]=]5(t[b{EG_\\2OEGJ~Ku!_?A/', 0, 0, 0, '', 0, 0, 0, 0, 0, 0, 0, 0, 0, 0, 0, 0, '', '', 0, '', 'vb', '', 0, 1, 0, 0, NULL),
(25195, 3, '', 0, 'FManzo', '7fb73fbfe798d29563a52f2f0e1ceca7', '2014-06-06', 'sukeybrjpostelnicu@yahoo.com', 0, '', '', '', '', '', '', '', 2, 0, 'New Member', 0, 1402052217, 0, 1402052217, 1402052217, 0, 0, 0, 0, 4, '5', 0, 0, 0, 0, 0, 3194967, '05-26-1974', '1974-05-26', -1, -1, '69.12.89.150', 0, 1, 0, 0, -1, 0, 0, '$BR2ce"$&eolyKQUixkC/B|j<~1}"_', 0, 0, 0, '', 0, 0, 0, 0, 0, 0, 0, 0, 0, 0, 0, 0, '', '', 0, '', 'vb', '', 0, 1, 0, 0, NULL),
(25196, 3, '', 0, 'PBennelon', '0f2fbe7abb82797712da7f050c1aeee7', '2014-06-06', 'subsequenttag59j2ry6@outlook.com', 0, '', '', '', '', '', '', '', 2, 0, 'New Member', 0, 1402052486, 0, 1402052486, 1402055087, 0, 0, 0, 0, 4, '5', 0, 0, 0, 0, 0, 3194967, '10-04-1985', '1985-10-04', -1, -1, '199.180.129.57', 0, 1, 0, 0, -1, 0, 0, '9hB}X/x%`NnZ;2i\\0Tx/ev1E{5GSL,', 0, 0, 0, '', 0, 0, 0, 0, 0, 0, 0, 0, 0, 0, 0, 0, '', '', 0, '', 'vb', '', 0, 1, 0, 0, NULL),
(25571, 3, '', 0, 'maximsjnr1088', '9072e2dfee7637d20de4a1ae6341586e', '2014-06-18', 'maximsjnr@ymail.com', 0, '', '', '', '', '', '', '', 2, 0, 'New Member', 0, 1403108128, 0, 1403108128, 1403108128, 0, 0, 0, 0, 4, '10', 0, 0, 0, 0, 0, 3194903, '02-20-1983', '1983-02-20', -1, -1, '46.188.42.52', 0, 1, 0, 0, -1, 0, 0, '4Z^=b?X?F:T7KX<`4earUe9!G;o),A', 0, 0, 0, '', 0, 0, 0, 0, 0, 0, 0, 0, 0, 0, 0, 0, '', '', 0, '', 'vb', '', 0, 1, 0, 0, NULL),
(25198, 3, '', 0, 'LMarlar', 'c55220cab821582f485d69723d656a89', '2014-06-06', 'wjirwrebe@yahoo.com', 0, '', '', '', '', '', '', '', 2, 0, 'New Member', 0, 1402054558, 0, 1402054558, 1402054558, 0, 0, 0, 0, 4, '5', 0, 0, 0, 0, 0, 3194967, '01-23-1982', '1982-01-23', -1, -1, '23.105.131.159', 0, 1, 0, 0, -1, 0, 0, '.do:X?83yWh$>IDhwYpygaOG0/Au-(', 0, 0, 0, '', 0, 0, 0, 0, 0, 0, 0, 0, 0, 0, 0, 0, '', '', 0, '', 'vb', '', 0, 1, 0, 0, NULL),
(25373, 3, '', 0, 'P26P', '2c869b198991af76165fd5a55b412b8a', '2014-06-12', 'boleswgax@outlook.com', 0, '', '', '', '', '', '', '', 2, 0, 'New Member', 0, 1402574715, 0, 1402574715, 1402574715, 0, 0, 0, 0, 4, '5', 0, 0, 0, 0, 0, 3194967, '12-06-1982', '1982-12-06', -1, -1, '173.234.232.60', 0, 1, 0, 0, -1, 0, 0, 'ITSvi$1''h.k0''5.l4%W$uph..6WCfD', 0, 0, 0, '', 0, 0, 0, 0, 0, 0, 0, 0, 0, 0, 0, 0, '', '', 0, '', 'vb', '', 0, 1, 0, 0, NULL),
(25635, 2, '', 0, 'Haider Iqbal', 'b3c0e891b30f5b1ac156322e5128e068', '2014-06-20', 'haidriqbal@gmail.com', 0, '', '', '', '', '', '', '', 2, 0, 'New Member', 0, 1403296850, 0, 1403297990, 1403341032, 0, 0, 0, 0, 4, '5', 0, 0, 0, 0, 0, 3194967, '09-17-1991', '1991-09-17', -1, -1, '39.48.48.55', 0, 1, 0, 0, -1, 0, 0, 'cNJ&u7hLkSyr:u.^isc~''a$HtD6<d"', 0, 0, 0, '', 0, 0, 0, 0, 0, 0, 0, 0, 0, 0, 0, 0, '', '', 0, '', 'vb', '', 0, 1, 0, 0, NULL),
(25629, 3, '', 0, 'G2295', 'a38416cd313a65b023a941d4e1833328', '2014-06-20', 'omlealleo@yahoo.com', 0, '', '', '', '', '', '', '', 2, 0, 'New Member', 0, 1403277265, 0, 1403277265, 1403277265, 0, 0, 0, 0, 4, '5', 0, 0, 0, 0, 0, 3194967, '04-13-1983', '1983-04-13', -1, -1, '172.245.240.143', 0, 1, 0, 0, -1, 0, 0, 'e=Qh*A)][.+O\\H4@G`I~X!joK=K8=%', 0, 0, 0, '', 0, 0, 0, 0, 0, 0, 0, 0, 0, 0, 0, 0, '', '', 0, '', 'vb', '', 0, 1, 0, 0, NULL),
(25856, 3, '', 0, 'CBJI', '2a725d3b70fb656ab0c71f87c0321b62', '2014-06-30', 'rabidtableware68791@outlook.com', 0, '', '', '', '', '', '', '', 2, 0, 'New Member', 0, 1404084763, 0, 1404084763, 1404084763, 0, 0, 0, 0, 4, '5', 0, 0, 0, 0, 0, 3194967, '05-20-1975', '1975-05-20', -1, -1, '178.32.27.75', 0, 1, 0, 0, -1, 0, 0, 'biWMe6o.O/wfPl>_9@m`<r@LJwMPV^', 0, 0, 0, '', 0, 0, 0, 0, 0, 0, 0, 0, 0, 0, 0, 0, '', '', 0, '', 'vb', '', 0, 1, 0, 0, NULL),
(25205, 3, '', 0, 'KMunoz', '7d634ebdd7040f0f14643713f3247952', '2014-06-06', 'lolaafabm@yahoo.com', 0, '', '', '', '', '', '', '', 2, 0, 'New Member', 0, 1402082437, 0, 1402082437, 1402082437, 0, 0, 0, 0, 4, '5', 0, 0, 0, 0, 0, 3194967, '12-31-1972', '1972-12-31', -1, -1, '188.165.162.195', 0, 1, 0, 0, -1, 0, 0, '_A.YF1+7R%oo4j[~$Rqj{"S[.i+\\lw', 0, 0, 0, '', 0, 0, 0, 0, 0, 0, 0, 0, 0, 0, 0, 0, '', '', 0, '', 'vb', '', 0, 1, 0, 0, NULL),
(25727, 2, '', 0, 'falcon4_89', '11c26a9010b1dca2ded9b3275e8c1d41', '2014-06-24', 'krmooltan@gmail.com', 0, '', '', '', '', '', '', '', 2, 0, 'New Member', 0, 1403601283, 0, 1404682300, 1408145792, 1404244971, 447995, 10, 0, 4, '5', 0, 0, 0, 0, 0, 3194967, '02-04-1989', '1989-02-04', -1, -1, '119.154.67.45', 0, 1, 1403716116, 0, -1, 0, 0, 'j2e?m~e>%r\\nG:fu%4k$=2sqy&0gE9', 0, 0, 0, '', 0, 0, 0, 0, 0, 0, 0, 0, 0, 0, 0, 0, '', '', 0, '', 'vb', '', 0, 1, 0, 0, NULL),
(25561, 3, '', 0, 'RMackenna', '7e2783971157f55484d2c9aa2cce9ef8', '2014-06-18', 'robbynrfbloch@yahoo.com', 0, '', '', '', '', '', '', '', 2, 0, 'New Member', 0, 1403088779, 0, 1403088779, 1403088779, 0, 0, 0, 0, 4, '5', 0, 0, 0, 0, 0, 3194967, '07-04-1973', '1973-07-04', -1, -1, '37.59.216.99', 0, 1, 0, 0, -1, 0, 0, '$6KjA>yTKSU1M|S/C<}eDCnTA~Z2Oy', 0, 0, 0, '', 0, 0, 0, 0, 0, 0, 0, 0, 0, 0, 0, 0, '', '', 0, '', 'vb', '', 0, 1, 0, 0, NULL),
(25209, 3, '', 0, 'NZGS', '98c21bd26584792a23de3637f7773a94', '2014-06-06', 'demontevar@hotmail.com', 0, '', '', '', '', '', '', '', 2, 0, 'New Member', 0, 1402093863, 0, 1402093863, 1402096021, 0, 0, 0, 0, 4, '5', 0, 0, 0, 0, 0, 3194967, '08-20-1971', '1971-08-20', -1, -1, '103.255.122.139', 0, 1, 0, 0, -1, 0, 0, 'Sk~ZYl~,ge,@%5|RK5F7ERHjuVu(-}', 0, 0, 0, '', 0, 0, 0, 0, 0, 0, 0, 0, 0, 0, 0, 0, '', '', 0, '', 'vb', '', 0, 1, 0, 0, NULL),
(25210, 3, '', 0, 'N3877', '896a370c70f75ad9a6afa1e8884e62c7', '2014-06-06', 'elizarb@outlook.com', 0, '', '', '', '', '', '', '', 2, 0, 'New Member', 0, 1402093980, 0, 1402093980, 1402117167, 0, 0, 0, 0, 4, '5', 0, 0, 0, 0, 0, 3194967, '11-29-1973', '1973-11-29', -1, -1, '204.44.82.140', 0, 1, 0, 0, -1, 0, 0, 'H~}|{"[_Psns1D=<*dEG82V.B#ND=3', 0, 0, 0, '', 0, 0, 0, 0, 0, 0, 0, 0, 0, 0, 0, 0, '', '', 0, '', 'vb', '', 0, 1, 0, 0, NULL),
(25385, 3, '', 0, 'usf butt', 'cefda8b72e5112e4f271dc2d6f3cbf5c', '2014-06-12', 'yousafbutt12345@gmail.com', 0, '', '', '', '', '', '', '', 2, 0, 'New Member', 0, 1402600129, 0, 1402600776, 1402601999, 0, 0, 0, 0, 4, '5', 0, 0, 0, 0, 0, 3194967, '04-09-1995', '1995-04-09', -1, -1, '66.171.229.16', 790, 1, 0, 0, -1, 0, 0, '.$.A+q;C/cp;BTIuL[(f&f4@YA}kUY', 0, 0, 0, '', 0, 0, 0, 0, 0, 0, 0, 0, 0, 0, 0, 0, '', '', 0, '', 'vb', '', 0, 1, 0, 0, NULL),
(25386, 3, '', 0, 'CKunkle', 'ab0d6d8c4932c85ca2aa5d6a49889766', '2014-06-12', 'carrie-kunkle@chiasetrongngay.com', 0, '', '', '', '', '', '', '', 2, 0, 'New Member', 0, 1402600223, 0, 1402600223, 1402607998, 0, 0, 0, 0, 4, '5', 0, 0, 0, 0, 0, 3194967, '01-27-1983', '1983-01-27', -1, -1, '192.3.164.210', 0, 1, 0, 0, -1, 0, 0, 'mG8-]\\:42%Wt)_Sw(%}e|q).`Hcn2V', 0, 0, 0, '', 0, 0, 0, 0, 0, 0, 0, 0, 0, 0, 0, 0, '', '', 0, '', 'vb', '', 0, 1, 0, 0, NULL),
(25213, 3, '', 0, 'X05L', 'fd5af0286091a24a144fb9b6bd52dd4c', '2014-06-07', 'aytiepr@hotmail.com', 0, '', '', '', '', '', '', '', 2, 0, 'New Member', 0, 1402102286, 0, 1402102286, 1402109512, 0, 0, 0, 0, 4, '5', 0, 0, 0, 0, 0, 3194967, '05-30-1978', '1978-05-30', -1, -1, '142.4.195.125', 0, 1, 0, 0, -1, 0, 0, '>wU&FUDni$~C@!-?-*e5}^h0dWPoGy', 0, 0, 0, '', 0, 0, 0, 0, 0, 0, 0, 0, 0, 0, 0, 0, '', '', 0, '', 'vb', '', 0, 1, 0, 0, NULL),
(25427, 3, '', 0, 'LBerger', '3bd8560b47dda8cf7562f3bec9b7ae81', '2014-06-14', 'verdantcurator6pc@nokiamail.com', 0, '', '', '', '', '', '', '', 2, 0, 'New Member', 0, 1402724154, 0, 1402724154, 1402731361, 0, 0, 0, 0, 4, '5', 0, 0, 0, 0, 0, 3194967, '08-03-1977', '1977-08-03', -1, -1, '167.160.115.149', 0, 1, 0, 0, -1, 0, 0, 'S#Qg''<T&c?%MvMn?Ird4p>?B=k''_U@', 0, 0, 0, '', 0, 0, 0, 0, 0, 0, 0, 0, 0, 0, 0, 0, '', '', 0, '', 'vb', '', 0, 1, 0, 0, NULL),
(26593, 3, '', 0, 'DDickerma', '1b018bd02e97a1622ce9d08a57b67673', '2014-08-02', 'ytabicasx@yahoo.com', 0, '', '', '', '', '', '', '', 2, 0, 'New Member', 0, 1406947926, 0, 1406947926, 1407004788, 0, 0, 0, 0, 4, '5', 0, 0, 0, 0, 0, 3194967, '03-27-1974', '1974-03-27', -1, -1, '5.157.36.155', 0, 1, 0, 0, -1, 0, 0, 'p!-YH''t0E>dpZA<oBo^-MC&*th$MDc', 0, 0, 0, '', 0, 0, 0, 0, 0, 0, 0, 0, 0, 0, 0, 0, '', '', 0, '', 'vb', '', 0, 1, 0, 0, NULL),
(25775, 3, '', 0, 'SLZT', '235d10d86387539ad34e475a70be5d6b', '2014-06-26', 'samuel.heinrich87@kredytydlaciebie.pl', 0, '', '', '', '', '', '', '', 2, 0, 'New Member', 0, 1403752771, 0, 1403752771, 1403760204, 0, 0, 0, 0, 4, '5', 0, 0, 0, 0, 0, 3194967, '09-27-1977', '1977-09-27', -1, -1, '188.65.76.182', 0, 1, 0, 0, -1, 0, 0, '{`yZ?E^yIyjM\\41tS(t:5\\6J9hl\\e^', 0, 0, 0, '', 0, 0, 0, 0, 0, 0, 0, 0, 0, 0, 0, 0, '', '', 0, '', 'vb', '', 0, 1, 0, 0, NULL),
(25216, 3, '', 0, 'ASheedy', '7a6382d45dfad2835844ee496b508927', '2014-06-07', 'hickshoer@hotmail.com', 0, '', '', '', '', '', '', '', 2, 0, 'New Member', 0, 1402113541, 0, 1402113541, 1402113541, 0, 0, 0, 0, 4, '5', 0, 0, 0, 0, 0, 3194967, '06-21-1970', '1970-06-21', -1, -1, '182.253.48.26', 0, 1, 0, 0, -1, 0, 0, '!*&o]S6vl1+q%>i3`#5I?v4Z=q5!<''', 0, 0, 0, '', 0, 0, 0, 0, 0, 0, 0, 0, 0, 0, 0, 0, '', '', 0, '', 'vb', '', 0, 1, 0, 0, NULL),
(25217, 3, '', 0, 'DTownley', '31b69f21b0f2ee958deb0d805f33108b', '2014-06-07', 'iyvzrm@outlook.com', 0, '', '', '', '', '', '', '', 2, 0, 'New Member', 0, 1402115006, 0, 1402115006, 1402139003, 0, 0, 0, 0, 4, '5', 0, 0, 0, 0, 0, 3194967, '04-18-1984', '1984-04-18', -1, -1, '107.158.228.237', 0, 1, 0, 0, -1, 0, 0, '0*{h(/?rdc|Q|O?fL-9;P-17%bwv5`', 0, 0, 0, '', 0, 0, 0, 0, 0, 0, 0, 0, 0, 0, 0, 0, '', '', 0, '', 'vb', '', 0, 1, 0, 0, NULL),
(25218, 3, '', 0, 'X5985', 'fe2c76ba6621c193e5565769413100fb', '2014-06-07', 'xavier.quezada35@cungtam.com', 0, '', '', '', '', '', '', '', 2, 0, 'New Member', 0, 1402115811, 0, 1402115811, 1402122876, 0, 0, 0, 0, 4, '5', 0, 0, 0, 0, 0, 3194967, '05-22-1973', '1973-05-22', -1, -1, '23.108.132.182', 0, 1, 0, 0, -1, 0, 0, '!#,T+{2YJrw9w9V''m/5;k9bxzr8ySi', 0, 0, 0, '', 0, 0, 0, 0, 0, 0, 0, 0, 0, 0, 0, 0, '', '', 0, '', 'vb', '', 0, 1, 0, 0, NULL),
